{"id":"EXP-20260318T225600Z-QWEN35CUDA-SPARSE-8192-KAPPA-RESULT","date":"2026-03-18","question":"With the improved sparse kernel now at kappa≈77.57 and implied crossover ≈12.8k, does the same Qwen CUDA Wayfinder/HCSA configuration continue to move in the right direction at T=8192 without violating any stability or memory stop-gates?","hypothesis":"T=8192 is still below the current crossover estimate, so Wayfinder may remain slower than dense, but the dense gap should be much smaller than under the old kappa≈101.67 regime. The main win condition for this rung is that memory remains bounded, 8/8 Wayfinder layers stay active, and empirical kappa stays at or below the new ~77.57 anchor so the next 16384 rung is mathematically credible.","change_set":["measurement-only run on top of hcsa/torch/attention_wayfinder_sparse.py","measurement-only run on top of hcsa/integrations/qwen_torch.py","measurement-only run on top of scripts/bench_qwen35_cuda_wayfinder.py","notes/LAB_NOTEBOOK.md","notes/experiments.ndjson"],"command":".venv/bin/python scripts/bench_qwen35_cuda_wayfinder.py --model-path /home/hmbown/HF_Models/Qwen3.5-9B --seq-lens 8192 --path sparse --strategy random --engine auto --warmup 1 --repeats 1 --forward-target backbone --phases dense wayfinder --skip-divergence --output benchmarks/cuda/qwen35_wayfinder/EXP-20260318T225600Z-QWEN35CUDA-SPARSE-8192-KAPPA.ndjson && journalctl -b -k --since '2026-03-18 17:56:00' | rg -n 'NVRM|Xid|Out of memory|hung task|BUG:|Call Trace'","controls":{"baseline_run_path":"benchmarks/cuda/qwen35_wayfinder/EXP-20260318T224737Z-QWEN35CUDA-SPARSE-4096-KAPPA.ndjson","supplemental_baseline_path":"benchmarks/cuda/qwen35_wayfinder/EXP-20260318T222540Z-QWEN35CUDA-SPARSE-4096-NOMETRICS.ndjson","one_process_at_a_time":true,"lock_file":"benchmarks/cuda/qwen35_wayfinder/.bench_qwen35_cuda_wayfinder.lock","retro_backfill_inference":"off","model_path":"/home/hmbown/HF_Models/Qwen3.5-9B","device":"cuda","gpu":"NVIDIA GB10","device_capability":[12,1],"torch":"2.10.0+cu130","transformers":"5.3.0","path":"sparse","strategy":"random","compute_graph_metrics":false,"forward_target":"backbone","window":64,"landmark_stride":64,"num_cycles":1,"engine_request":"auto","warmup":1,"repeats":1,"seq_lens":[8192],"kernel_log_since":"2026-03-18 17:56:00"},"metrics":{"status":"completed","artifact":"benchmarks/cuda/qwen35_wayfinder/EXP-20260318T225600Z-QWEN35CUDA-SPARSE-8192-KAPPA.ndjson","kernel_fault_lines_after_start":0,"dense":{"median_ms":5132.08,"prefill_tok_per_sec":1596.2,"peak_mem_gb":18.38},"wayfinder":{"median_ms":9382.32,"prefill_tok_per_sec":873.1,"peak_mem_gb":18.49,"wayfinder_active_layers":8,"wayfinder_graph_cache_entries_total":8,"engine":"batched"},"wayfinder_profile_summary":{"path":"sparse","graph_source":"runtime","graph_cache_hit_all_layers":true,"graph_metrics_present":false,"per_layer_attn_kernel_ms_range":[627.5438670018048,640.7962060002319],"per_layer_attn_kernel_ms_mean":633.1266093752674,"per_layer_attn_kernel_ms_delta_vs_4096_anchor_mean":399.42184562505645,"per_layer_attn_kernel_ms_delta_vs_4096_anchor_pct":170.90873083441622},"delta_vs_dense_abs":{"median_ms":4250.24,"prefill_tok_per_sec":-723.1,"peak_mem_gb":0.10999999999999943},"delta_vs_dense_pct":{"median_ms":82.81710339667347,"prefill_tok_per_sec":-45.301340684124796,"peak_mem_gb":0.5984766050054376},"memory_reduction_pct_convention":"100*(1-wayfinder/dense)","memory_reduction_pct":-0.5984766050054269,"dense_delta_vs_named_4096_anchor_abs":{"median_ms":2993.5,"prefill_tok_per_sec":-319.0999999999999,"peak_mem_gb":0.8399999999999999},"dense_delta_vs_named_4096_anchor_pct":{"median_ms":139.97605888019154,"prefill_tok_per_sec":-16.660575366783267,"peak_mem_gb":4.789053591790193},"wayfinder_delta_vs_named_4096_anchor_abs":{"median_ms":5453.65,"prefill_tok_per_sec":-169.4999999999999,"peak_mem_gb":0.9199999999999982},"wayfinder_delta_vs_named_4096_anchor_pct":{"median_ms":138.8166987810124,"prefill_tok_per_sec":-16.257433339727594,"peak_mem_gb":5.236198064883314},"D_estimate":129.0,"kappa":116.09594659112784,"kappa_delta_vs_anchor_abs":38.52336171859511,"kappa_delta_vs_anchor_pct":49.661052009413766,"crossover_estimate":81141.96420845015,"crossover_delta_vs_anchor_abs":68343.29299938539,"crossover_delta_vs_anchor_pct":533.9874107476148},"decision":"follow-up","next_action":"Stop the automatic prefill ladder here. Next, isolate why the sparse kernel constant factor worsens at 8192 despite bounded memory, most likely with chunk-level instrumentation and an adaptive chunking/tiling experiment before any 16384+ rerun."}
{"id":"EXP-20260318T231105Z-QWEN35CUDA-SPARSE-ADAPTIVE-CHUNK-PRERUN","date":"2026-03-18","question":"Can adaptive sparse query chunking plus chunk-level observability lower the Qwen CUDA Wayfinder/HCSA kernel constant factor at T=8192 without giving back the 4096 gain or violating bounded-memory behavior?","hypothesis":"The current Qwen sparse path still runs with a fixed query_chunk_size=256 and kv_head_chunk_size=4, and it gathers K then V separately for every query chunk. At T=8192, that means 32 query chunks per active layer even though peak memory stayed close to dense (18.49 GB vs 18.38 GB). An adaptive larger query chunk for long prefill, chosen from a bounded temporary-byte budget and surfaced in the profile, should reduce chunk-loop launch overhead while keeping the gather/materialization footprint bounded. Win condition: hold or improve 4096 while materially reducing 8192 attn_kernel_ms, empirical kappa, and crossover lateness.","change_set":["planned edits to hcsa/torch/attention_wayfinder_sparse.py","planned edits to hcsa/integrations/qwen_torch.py","planned edits to scripts/bench_qwen35_cuda_wayfinder.py","possible regression updates in tests/pytorch/test_torch_qwen_sparse_gqa.py","notes/LAB_NOTEBOOK.md","notes/experiments.ndjson"],"command":".venv/bin/python -m py_compile hcsa/integrations/qwen_torch.py hcsa/torch/attention_wayfinder_sparse.py scripts/bench_qwen35_cuda_wayfinder.py tests/pytorch/test_torch_qwen_sparse_gqa.py && .venv/bin/python -m pytest tests/pytorch/test_torch_qwen_sparse_gqa.py tests/pytorch/test_torch_causality.py tests/pytorch/test_torch_dense_limit_equivalence.py tests/pytorch/test_torch_matches_mlx_reference_small.py tests/test_qwen_cuda_wayfinder_cli.py -q && .venv/bin/python scripts/bench_qwen35_cuda_wayfinder.py --model-path /home/hmbown/HF_Models/Qwen3.5-9B --seq-lens 4096 8192 --path sparse --strategy random --engine auto --warmup 1 --repeats 1 --forward-target backbone --phases dense wayfinder --skip-divergence --output benchmarks/cuda/qwen35_wayfinder/EXP-20260318T231105Z-QWEN35CUDA-SPARSE-ADAPTIVE-CHUNK.ndjson && journalctl -b -k --since '2026-03-18 18:11:05' | rg -n 'NVRM|Xid|Out of memory|hung task|BUG:|Call Trace'","controls":{"baseline_run_path_4096":"benchmarks/cuda/qwen35_wayfinder/EXP-20260318T224737Z-QWEN35CUDA-SPARSE-4096-KAPPA.ndjson","baseline_run_path_8192":"benchmarks/cuda/qwen35_wayfinder/EXP-20260318T225600Z-QWEN35CUDA-SPARSE-8192-KAPPA.ndjson","one_process_at_a_time":true,"lock_file":"benchmarks/cuda/qwen35_wayfinder/.bench_qwen35_cuda_wayfinder.lock","retro_backfill_inference":"off","model_path":"/home/hmbown/HF_Models/Qwen3.5-9B","device":"cuda","gpu":"NVIDIA GB10","device_capability":[12,1],"torch":"2.10.0+cu130","transformers":"5.3.0","path":"sparse","strategy":"random","compute_graph_metrics":false,"forward_target":"backbone","window":64,"landmark_stride":64,"num_cycles":1,"engine_request":"auto","warmup":1,"repeats":1,"seq_lens":[4096,8192],"kernel_log_since":"2026-03-18 18:11:05","current_anchor_4096":{"D_estimate":97.0,"kappa":77.57258487253273,"crossover_tokens_estimate":12798.671209064763},"current_anchor_8192":{"D_estimate":129.0,"kappa":116.09594659112784,"crossover_tokens_estimate":81141.96420845015}},"metrics":{"status":"pending","artifacts_expected":["benchmarks/cuda/qwen35_wayfinder/EXP-20260318T231105Z-QWEN35CUDA-SPARSE-ADAPTIVE-CHUNK.ndjson"],"required":["py_compile success","pytest selected suite passes","bench[label=dense][seq_len=4096].median_ms","bench[label=wayfinder][seq_len=4096].median_ms","bench[label=dense][seq_len=8192].median_ms","bench[label=wayfinder][seq_len=8192].median_ms","bench[label=wayfinder].wayfinder_profiles","bench[label=wayfinder].wayfinder_active_layers==8","wayfinder profile includes effective sparse chunk fields","wayfinder D_estimate","wayfinder empirical kappa","wayfinder crossover_estimate","zero new kernel fault lines after kernel_log_since"]},"decision":"pending","next_action":"Implement adaptive chunk sizing and chunk observability, run the guarded 4096/8192 benchmark pair, and only if 8192 kappa improves without harming 4096 reopen the long-context ladder."}
{"id":"EXP-20260318T231105Z-QWEN35CUDA-SPARSE-ADAPTIVE-CHUNK-RESULT","date":"2026-03-18","question":"Can adaptive sparse query chunking plus chunk-level observability lower the Qwen CUDA Wayfinder/HCSA kernel constant factor at T=8192 without giving back the 4096 gain or violating bounded-memory behavior?","hypothesis":"The current Qwen sparse path still runs with a fixed query_chunk_size=256 and kv_head_chunk_size=4, and it gathers K then V separately for every query chunk. At T=8192, that means 32 query chunks per active layer even though peak memory stayed close to dense (18.49 GB vs 18.38 GB). An adaptive larger query chunk for long prefill, chosen from a bounded temporary-byte budget and surfaced in the profile, should reduce chunk-loop launch overhead while keeping the gather/materialization footprint bounded. Win condition: hold or improve 4096 while materially reducing 8192 attn_kernel_ms, empirical kappa, and crossover lateness.","change_set":["hcsa/torch/attention_wayfinder_sparse.py","hcsa/integrations/qwen_torch.py","scripts/bench_qwen35_cuda_wayfinder.py","tests/pytorch/test_torch_qwen_sparse_gqa.py","tests/test_qwen_cuda_wayfinder_cli.py","notes/LAB_NOTEBOOK.md","notes/experiments.ndjson"],"command":".venv/bin/python -m py_compile hcsa/integrations/qwen_torch.py hcsa/torch/attention_wayfinder_sparse.py scripts/bench_qwen35_cuda_wayfinder.py tests/pytorch/test_torch_qwen_sparse_gqa.py && .venv/bin/python -m pytest tests/pytorch/test_torch_qwen_sparse_gqa.py tests/pytorch/test_torch_causality.py tests/pytorch/test_torch_dense_limit_equivalence.py tests/pytorch/test_torch_matches_mlx_reference_small.py tests/test_qwen_cuda_wayfinder_cli.py -q && .venv/bin/python scripts/bench_qwen35_cuda_wayfinder.py --model-path /home/hmbown/HF_Models/Qwen3.5-9B --seq-lens 4096 8192 --path sparse --strategy random --engine auto --warmup 1 --repeats 1 --forward-target backbone --phases dense wayfinder --skip-divergence --output benchmarks/cuda/qwen35_wayfinder/EXP-20260318T231105Z-QWEN35CUDA-SPARSE-ADAPTIVE-CHUNK.ndjson && journalctl -b -k --since '2026-03-18 18:11:05' | rg -n 'NVRM|Xid|Out of memory|hung task|BUG:|Call Trace'","controls":{"baseline_run_path_4096":"benchmarks/cuda/qwen35_wayfinder/EXP-20260318T224737Z-QWEN35CUDA-SPARSE-4096-KAPPA.ndjson","baseline_run_path_8192":"benchmarks/cuda/qwen35_wayfinder/EXP-20260318T225600Z-QWEN35CUDA-SPARSE-8192-KAPPA.ndjson","one_process_at_a_time":true,"lock_file":"benchmarks/cuda/qwen35_wayfinder/.bench_qwen35_cuda_wayfinder.lock","retro_backfill_inference":"off","model_path":"/home/hmbown/HF_Models/Qwen3.5-9B","device":"cuda","gpu":"NVIDIA GB10","device_capability":[12,1],"torch":"2.10.0+cu130","transformers":"5.3.0","path":"sparse","strategy":"random","compute_graph_metrics":false,"forward_target":"backbone","window":64,"landmark_stride":64,"num_cycles":1,"engine_request":"auto","warmup":1,"repeats":1,"seq_lens":[4096,8192],"kernel_log_since":"2026-03-18 18:11:05"},"metrics":{"status":"completed","validation":{"py_compile":"pass","pytest":{"passed":26,"skipped":1,"failed":0}},"warnings":["existing torch.jit.script_method deprecation warnings","existing GB10 capability 12.1 vs PyTorch max advertised 12.0 warning"],"artifact":"benchmarks/cuda/qwen35_wayfinder/EXP-20260318T231105Z-QWEN35CUDA-SPARSE-ADAPTIVE-CHUNK.ndjson","kernel_fault_lines_after_start":0,"dense_4096":{"median_ms":2141.41,"prefill_tok_per_sec":1912.8,"peak_mem_gb":17.54},"wayfinder_4096":{"median_ms":3343.39,"prefill_tok_per_sec":1225.1,"peak_mem_gb":17.57,"wayfinder_active_layers":8,"wayfinder_graph_cache_entries_total":8,"effective_chunking":{"query_chunk_size":1024,"kv_head_chunk_size":1,"num_query_chunks":4,"num_head_blocks":4,"chunk_mode":"auto","chunk_budget_exceeded":false},"per_layer_attn_kernel_ms_mean":191.19},"delta_vs_dense_4096_abs":{"median_ms":1201.98,"prefill_tok_per_sec":-687.7,"peak_mem_gb":0.03},"delta_vs_dense_4096_pct":{"median_ms":56.12860823046417,"prefill_tok_per_sec":-35.95148943883312,"peak_mem_gb":0.1710376282782277},"memory_reduction_pct_4096":-0.17103762827823665,"dense_4096_delta_vs_named_baseline_abs":{"median_ms":2.83,"prefill_tok_per_sec":-2.5,"peak_mem_gb":0.0},"dense_4096_delta_vs_named_baseline_pct":{"median_ms":0.1323322060585968,"prefill_tok_per_sec":-0.1305270719991646,"peak_mem_gb":0.0},"wayfinder_4096_delta_vs_named_baseline_abs":{"median_ms":-585.28,"prefill_tok_per_sec":182.5,"peak_mem_gb":0.0},"wayfinder_4096_delta_vs_named_baseline_pct":{"median_ms":-14.896781766862001,"prefill_tok_per_sec":17.502397850565885,"peak_mem_gb":0.0},"D_estimate_4096":97.0,"kappa_4096":65.93455832495403,"kappa_4096_delta_vs_anchor_abs":-11.638026547578702,"kappa_4096_delta_vs_anchor_pct":-15.001673407396168,"crossover_estimate_4096":8837.104194462412,"crossover_4096_delta_vs_anchor_abs":-3961.5670146023505,"crossover_4096_delta_vs_anchor_pct":-30.952621849230238,"dense_8192":{"median_ms":4349.72,"prefill_tok_per_sec":1883.3,"peak_mem_gb":18.38},"wayfinder_8192":{"median_ms":7958.37,"prefill_tok_per_sec":1029.4,"peak_mem_gb":18.49,"wayfinder_active_layers":8,"wayfinder_graph_cache_entries_total":8,"effective_chunking":{"query_chunk_size":192,"kv_head_chunk_size":4,"num_query_chunks":43,"num_head_blocks":1,"chunk_mode":"auto","chunk_budget_exceeded":false},"per_layer_attn_kernel_ms_mean":538.55},"delta_vs_dense_8192_abs":{"median_ms":3608.65,"prefill_tok_per_sec":-853.9,"peak_mem_gb":0.11},"delta_vs_dense_8192_pct":{"median_ms":82.96129420449826,"prefill_tok_per_sec":-45.34434237720915,"peak_mem_gb":0.5984766050054376},"memory_reduction_pct_8192":-0.5984766050054269,"dense_8192_delta_vs_named_baseline_abs":{"median_ms":-782.36,"prefill_tok_per_sec":287.1,"peak_mem_gb":0.0},"dense_8192_delta_vs_named_baseline_pct":{"median_ms":-15.244508659251185,"prefill_tok_per_sec":17.98646786117029,"peak_mem_gb":0.0},"wayfinder_8192_delta_vs_named_baseline_abs":{"median_ms":-1423.95,"prefill_tok_per_sec":156.3,"peak_mem_gb":0.0},"wayfinder_8192_delta_vs_named_baseline_pct":{"median_ms":-15.176271111383367,"prefill_tok_per_sec":17.901729469705654,"peak_mem_gb":0.0},"D_estimate_8192":129.0,"kappa_8192":116.18541483203657,"kappa_8192_delta_vs_anchor_abs":0.08946824090872952,"kappa_8192_delta_vs_anchor_pct":0.07706316165498038,"crossover_estimate_8192":81842.80503970875,"crossover_8192_delta_vs_anchor_abs":700.8408312586017,"crossover_8192_delta_vs_anchor_pct":0.8637657788211718,"stop_gate_tripped":"kappa_8192_failed_to_improve"},"decision":"follow-up","next_action":"Keep the adaptive chunking and chunk-observability patch because it materially improves the 4096 checkpoint and preserves bounded memory, but stop the automatic prefill ladder here. The next experiment must target the remaining 8192+ constant-factor term directly, because the current auto policy still resolves to 43 query chunks at T=8192 and does not move crossover earlier."}
{"id":"EXP-20260319T040003Z-QWEN35CUDA-SPARSE-QCHUNK-FIRST-PRERUN","date":"2026-03-19","question":"Can a query-chunk-first Wayfinder/HCSA auto chunk objective lower long-context kappa enough to reopen the ladder toward 16k, without regressing the current 4096 gain or violating bounded-memory behavior?","hypothesis":"The current auto chunk resolver is minimizing num_query_chunks * num_head_blocks using the padded neighborhood width d = neigh.shape[-1], which overweights head-block consolidation and underweights the serial query-chunk loop that actually pays the repeated gather / score / softmax / value-materialization overhead. That is why the current 8192 checkpoint resolves to query_chunk_size=192, kv_head_chunk_size=4, 43 query chunks, 1 head block even though a query-first objective under the same 160 MiB budget would prefer shapes like 768 x 1 at 8192. If the auto sort is changed to minimize query chunks first, then head blocks, then secondary tile-shape tie-breaks, Wayfinder/HCSA should keep the 4096 win, materially reduce 8192 attn_kernel_ms and kappa, and make a guarded 16384 rung mathematically credible.","change_set":["planned edits to hcsa/torch/attention_wayfinder_sparse.py","possible regression updates in tests/pytorch/test_torch_qwen_sparse_gqa.py","possible integration / CLI regression updates in scripts/bench_qwen35_cuda_wayfinder.py","possible integration / CLI regression updates in tests/test_qwen_cuda_wayfinder_cli.py","notes/LAB_NOTEBOOK.md","notes/experiments.ndjson"],"command":".venv/bin/python -m py_compile hcsa/integrations/qwen_torch.py hcsa/torch/attention_wayfinder_sparse.py scripts/bench_qwen35_cuda_wayfinder.py tests/pytorch/test_torch_qwen_sparse_gqa.py && .venv/bin/python -m pytest tests/pytorch/test_torch_qwen_sparse_gqa.py tests/pytorch/test_torch_causality.py tests/pytorch/test_torch_dense_limit_equivalence.py tests/pytorch/test_torch_matches_mlx_reference_small.py tests/test_qwen_cuda_wayfinder_cli.py -q && .venv/bin/python scripts/bench_qwen35_cuda_wayfinder.py --model-path /home/hmbown/HF_Models/Qwen3.5-9B --seq-lens 4096 8192 --path sparse --strategy random --engine auto --warmup 1 --repeats 1 --forward-target backbone --phases dense wayfinder --skip-divergence --output benchmarks/cuda/qwen35_wayfinder/EXP-20260319T040003Z-QWEN35CUDA-SPARSE-QCHUNK-FIRST.ndjson && journalctl -b -k --since '2026-03-18 22:00:03 CDT' | rg -n 'NVRM|Xid|Out of memory|hung task|BUG:|Call Trace'","controls":{"baseline_run_path":"benchmarks/cuda/qwen35_wayfinder/EXP-20260318T231105Z-QWEN35CUDA-SPARSE-ADAPTIVE-CHUNK.ndjson","one_process_at_a_time":true,"lock_file":"benchmarks/cuda/qwen35_wayfinder/.bench_qwen35_cuda_wayfinder.lock","retro_backfill_inference":"off","model_path":"/home/hmbown/HF_Models/Qwen3.5-9B","device":"cuda","gpu":"NVIDIA GB10","device_capability":[12,1],"torch":"2.10.0+cu130","transformers":"5.3.0","path":"sparse","strategy":"random","compute_graph_metrics":false,"forward_target":"backbone","window":64,"landmark_stride":64,"num_cycles":1,"engine_request":"auto","warmup":1,"repeats":1,"seq_lens":[4096,8192],"temp_budget_mib":160.0,"kernel_log_since":"2026-03-18 22:00:03 CDT","current_anchor_4096":{"D_estimate":97.0,"kappa":65.93455832495403,"crossover_tokens_estimate":8837.104194462412,"effective_chunking":{"query_chunk_size":1024,"kv_head_chunk_size":1,"num_query_chunks":4,"num_head_blocks":4}},"current_anchor_8192":{"D_estimate":129.0,"kappa":116.18541483203657,"crossover_tokens_estimate":81842.80503970875,"effective_chunking":{"query_chunk_size":192,"kv_head_chunk_size":4,"num_query_chunks":43,"num_head_blocks":1}}},"metrics":{"status":"pending","artifacts_expected":["benchmarks/cuda/qwen35_wayfinder/EXP-20260319T040003Z-QWEN35CUDA-SPARSE-QCHUNK-FIRST.ndjson"],"required":["py_compile success","pytest selected suite passes","bench[label=dense][seq_len=4096].median_ms","bench[label=wayfinder][seq_len=4096].median_ms","bench[label=dense][seq_len=8192].median_ms","bench[label=wayfinder][seq_len=8192].median_ms","bench[label=wayfinder].wayfinder_profiles","bench[label=wayfinder].wayfinder_active_layers==8","wayfinder profile shows query-chunk-first effective chunking","wayfinder D_estimate","wayfinder empirical kappa","wayfinder crossover_estimate","zero new kernel fault lines after kernel_log_since"]},"decision":"pending","next_action":"Implement the query-chunk-first auto objective, run the guarded 4096/8192 pair, and only if 8192 kappa improves without harming 4096 open the 16384 continuation immediately."}
