{"id":"EXP-20260208-HCY-IDEA1-DISJOINT-RESULT-CORR1","date":"2026-02-08","question":"Can we enforce edge-disjoint multi-cycle packing and consume all cycles in permute attention?","hypothesis":"Edge-disjoint generation will eliminate overlap waste and multi-cycle permute will produce correct outputs with near-linear compute scaling in cycle count.","change_set":["hcsa/cycles.py edge_disjoint_random_cycles + verify_edge_disjoint","hcsa/graph_strategies.py edge_disjoint random strategy + all_cycle_perms propagation","hcsa/graph/abi.py all_cycle_perms support + stack metadata","hcsa/topology/core.py edge_disjoint topology wiring","hcsa/mlx/attention.py multi-cycle [H,d,T] batched/active permute support","hcsa/integrations/qwen_mlx.py multi-cycle cache stacking","hcsa/mlx/model.py + hcsa/integrations/glm_mlx.py + hcsa/integrations/gpt2_mlx.py + hcsa/integrations/qwen_mlx.py edge_disjoint config wiring","tests/test_edge_disjoint_cycles.py (new)"],"command":"python3 -m pytest tests/test_edge_disjoint_cycles.py -q && python3 -m pytest -q && PYTHONPATH=. python3 scripts/bench_mlx_wayfinder_scale.py --seq-lens 2048 4096 --batch 2 --heads 4 --embd 128 --window 32 --landmark-stride 32 --warmup 2 --iters 4 --num-cycles 1 --out-dir benchmarks/mlx/tiny_wayfinder/disjoint_d1 && PYTHONPATH=. python3 scripts/bench_mlx_wayfinder_scale.py --seq-lens 2048 4096 --batch 2 --heads 4 --embd 128 --window 32 --landmark-stride 32 --warmup 2 --iters 4 --num-cycles 2 --out-dir benchmarks/mlx/tiny_wayfinder/disjoint_d2","controls":{"seq_lens":[2048,4096],"batch":2,"heads":4,"embd":128,"window":32,"landmark_stride":32,"warmup":2,"iters":4,"retro_backfill_enabled":false,"baseline_path":"benchmarks/mlx/tiny_wayfinder/disjoint_d1/results.json","row_filter":"mode=wayfinder_permute"},"metrics":{"tests":{"edge_disjoint_cycles":{"passed":5,"failed":0},"pytest_full":{"status":"pass","failures":0}},"seq2048":{"tokens_per_sec":{"absolute":1785284.268023977,"delta_vs_baseline":-1404540.7012667633,"pct_delta_vs_baseline":-44.03190503518642},"peak_memory_bytes":{"absolute":67487700,"delta_vs_baseline":229376,"pct_delta_vs_baseline":0.3410373413408279}},"seq4096":{"tokens_per_sec":{"absolute":1909139.906987293,"delta_vs_baseline":-1403185.4450768207,"pct_delta_vs_baseline":-42.36254884208188},"peak_memory_bytes":{"absolute":145445076,"delta_vs_baseline":458752,"pct_delta_vs_baseline":0.31641053262375285}}},"decision":"follow-up","next_action":"continue ideas 2/5/3 and later optimize multi-cycle overhead"}
{"id":"EXP-20260208-HCY-IDEA2-RESILIENCE-RESULT","date":"2026-02-08","question":"Under window-drop, does the cycle+window graph maintain resilience signals at practical drop rates?","hypothesis":"At drop_rate=0.3 survival remains high, while drop_rate=0.8 significantly degrades resilience.","change_set":["hcsa/graph/analysis.py check_resilience","hcsa/graph/__init__.py exports check_resilience","hcsa/mlx/attention.py theorem-backed window_drop comments","docs/resilience.md (new)","tests/test_resilience.py (new)"],"command":"python3 -m pytest tests/test_resilience.py -q && python3 -m pytest -q && python3 -c \"from hcsa.graph.analysis import check_resilience; import numpy as np; p=np.random.default_rng(42).permutation(128); print(check_resilience(p, window=32, drop_rate=0.3, num_trials=100, rng=np.random.default_rng(1))); print(check_resilience(p, window=32, drop_rate=0.8, num_trials=100, rng=np.random.default_rng(1)))\"","controls":{"T":128,"window":32,"perm_seed":42,"trial_rng_seed":1,"retro_backfill_enabled":false},"metrics":{"tests":{"test_resilience":{"passed":3,"failed":0},"pytest_full":{"status":"pass","failures":0}},"safe":{"drop_rate":0.3,"survival_rate":0.96,"min_degree_mean":20.08,"min_degree_min":14,"theoretical_threshold":17.0},"aggressive":{"drop_rate":0.8,"survival_rate":0.0,"min_degree_mean":3.12,"min_degree_min":1,"theoretical_threshold":17.0}},"decision":"keep","next_action":"implement Idea 5 regularity-informed cycle strategy"}
{"id":"EXP-20260208-HCY-IDEA5-REGULARITY-RESULT","date":"2026-02-08","question":"Can regular-partition cycle construction improve cluster regularity while preserving runtime feasibility?","hypothesis":"regular_partition should reduce cluster-pair deviation relative to random cycles at similar runtime complexity.","change_set":["measurement only (no new code changes)"],"command":"python3 -m pytest tests/test_regularity.py -q && python3 -m pytest -q && PYTHONPATH=. python3 scripts/bench_mlx_wayfinder_scale.py --seq-lens 2048 4096 --batch 2 --heads 4 --embd 128 --window 32 --landmark-stride 32 --warmup 2 --iters 4 --strategy random --num-cycles 1 --out-dir benchmarks/mlx/tiny_wayfinder/regularity_random && PYTHONPATH=. python3 scripts/bench_mlx_wayfinder_scale.py --seq-lens 2048 4096 --batch 2 --heads 4 --embd 128 --window 32 --landmark-stride 32 --warmup 2 --iters 4 --strategy regular_partition --regular-num-clusters 8 --num-cycles 1 --out-dir benchmarks/mlx/tiny_wayfinder/regularity_reg8 && PYTHONPATH=. python3 scripts/bench_mlx_wayfinder_scale.py --seq-lens 2048 4096 --batch 2 --heads 4 --embd 128 --window 32 --landmark-stride 32 --warmup 2 --iters 4 --strategy regular_partition --regular-num-clusters 16 --num-cycles 1 --out-dir benchmarks/mlx/tiny_wayfinder/regularity_reg16 && python3 - <<'PY' ... check_regularity snippet ... PY","controls":{"seq_lens":[2048,4096],"batch":2,"heads":4,"embd":128,"window":32,"landmark_stride":32,"warmup":2,"iters":4,"num_cycles":1,"retro_backfill_enabled":false,"baseline_path":"benchmarks/mlx/tiny_wayfinder/regularity_random/results.json","row_filter":"mode=wayfinder_permute"},"metrics":{"tests":{"test_regularity":{"passed":4,"failed":0},"pytest_full":{"status":"pass","failures":0,"warnings":["PytestUnknownMarkWarning: pytest.mark.slow in tests/pytorch/test_perf_regression.py"]}},"seq2048":{"random":{"tokens_per_sec":2773893.1503725853,"peak_memory_bytes":67258324},"reg8":{"tokens_per_sec":{"absolute":3138146.6534196045,"delta_vs_random":364253.50304701924,"pct_delta_vs_random":13.131490279438834},"peak_memory_bytes":{"absolute":67258324,"delta_vs_random":0,"pct_delta_vs_random":0.0}},"reg16":{"tokens_per_sec":{"absolute":2938483.0438047084,"delta_vs_random":164589.89343212312,"pct_delta_vs_random":5.933533867650426},"peak_memory_bytes":{"absolute":67258324,"delta_vs_random":0,"pct_delta_vs_random":0.0}}},"seq4096":{"random":{"tokens_per_sec":3251707.8640073794,"peak_memory_bytes":144986324},"reg8":{"tokens_per_sec":{"absolute":3470573.9380442793,"delta_vs_random":218866.07403689995,"pct_delta_vs_random":6.730804305544105},"peak_memory_bytes":{"absolute":144986324,"delta_vs_random":0,"pct_delta_vs_random":0.0}},"reg16":{"tokens_per_sec":{"absolute":3660410.2586552086,"delta_vs_random":408702.39464782923,"pct_delta_vs_random":12.568853066561537},"peak_memory_bytes":{"absolute":144986324,"delta_vs_random":0,"pct_delta_vs_random":0.0}}},"regularity_snippet":{"T2048":{"random":{"max_deviation":0.13208742477035162,"mean_deviation":0.09771935381691478},"reg8":{"max_deviation":0.11383039271485483,"mean_deviation":0.09433693796243596},"reg16":{"max_deviation":0.24714332353901405,"mean_deviation":0.1793992817499184}},"T4096":{"random":{"max_deviation":0.08221249502586549,"mean_deviation":0.048826104257859146},"reg8":{"max_deviation":0.09319238000638545,"mean_deviation":0.058267409273120734},"reg16":{"max_deviation":0.17278377494275432,"mean_deviation":0.1266110565914295}}}},"decision":"follow-up","next_action":"refine regular_partition assignment/stitching to improve regularity deviation while preserving throughput gains"}
{"id":"EXP-20260208-HCY-IDEA3-COVERING-RESULT","date":"2026-02-08","question":"Do additional covering cycles move permute outputs closer to dense attention in small-T regimes?","hypothesis":"Increasing covering cycles from d=1 to d=4 to d=8 improves approximation quality to dense outputs (lower L2, higher cosine similarity).","change_set":["measurement only (no code changes)"],"command":"python3 -m pytest tests/test_covering.py -q && python3 -m pytest -q && python3 - <<'PY' ... dense_causal_attention vs wayfinder_covering_attention at T={256,512}, d={1,4,8} ... PY","controls":{"B":1,"H":2,"dh":8,"window":4,"query_chunk_size":128,"seq_lens":[256,512],"qkv_rng_seed":123,"covering_generator_seed":42,"baseline_definition":"d=1 row for each T","dense_reference":"dense_causal_attention on identical q/k/v"},"metrics":{"tests":{"test_covering":{"passed":4,"failed":0},"pytest_full":{"status":"pass","failures":0,"warnings":["PytestUnknownMarkWarning: pytest.mark.slow in tests/pytorch/test_perf_regression.py"]}},"T256":{"d1":{"coverage":0.00784313725490196,"l2":37.65647888183594,"cos":0.24362292885780334},"d4":{"coverage":{"absolute":0.03137254901960784,"delta_vs_d1":0.023529411764705882,"pct_delta_vs_d1":300.0},"l2":{"absolute":35.46280288696289,"delta_vs_d1":-2.193675994873047,"pct_delta_vs_d1":-5.8254942044812195},"cos":{"absolute":0.254599392414093,"delta_vs_d1":0.010976463556289673,"pct_delta_vs_d1":4.505513338892811}},"d8":{"coverage":{"absolute":0.06274509803921569,"delta_vs_d1":0.054901960784313725,"pct_delta_vs_d1":700.0},"l2":{"absolute":34.563602447509766,"delta_vs_d1":-3.092876434326172,"pct_delta_vs_d1":-8.213397869810017},"cos":{"absolute":0.2608260214328766,"delta_vs_d1":0.017203092575073242,"pct_delta_vs_d1":7.061360215858114}}},"T512":{"d1":{"coverage":0.003913894324853229,"l2":53.566158294677734,"cos":0.18330292403697968},"d4":{"coverage":{"absolute":0.015655577299412915,"delta_vs_d1":0.011741682974559686,"pct_delta_vs_d1":300.0},"l2":{"absolute":50.08660125732422,"delta_vs_d1":-3.4795570373535156,"pct_delta_vs_d1":-6.495812184648008},"cos":{"absolute":0.19458645582199097,"delta_vs_d1":0.011283531785011292,"pct_delta_vs_d1":6.155674735845972}},"d8":{"coverage":{"absolute":0.03131115459882583,"delta_vs_d1":0.0273972602739726,"pct_delta_vs_d1":700.0},"l2":{"absolute":48.75308609008789,"delta_vs_d1":-4.813072204589844,"pct_delta_vs_d1":-8.985285407462317},"cos":{"absolute":0.20152504742145538,"delta_vs_d1":0.018222123384475708,"pct_delta_vs_d1":9.940988928687009}}}},"decision":"keep","next_action":"run d=16 and larger T sweeps, then quantify quality-vs-throughput tradeoff for default max_cycles"}
{"id":"EXP-20260208-HCY-IDEA5-REGULARITY-RESULT-CORR1","date":"2026-02-08","question":"Can regular-partition cycle construction improve cluster regularity while preserving runtime feasibility?","hypothesis":"regular_partition should reduce cluster-pair deviation relative to random cycles at similar runtime complexity.","change_set":["hcsa/cycles.py regular_partition_cycle","hcsa/graph_strategies.py RegularPartitionStrategy + registry","hcsa/topology/core.py regular_num_clusters + static cache mode","hcsa/graph/analysis.py check_regularity","hcsa/graph/__init__.py export check_regularity","scripts/bench_mlx_wayfinder_scale.py regular strategy + --regular-num-clusters","hcsa/mlx/attention.py + hcsa/mlx/model.py + hcsa/integrations/qwen_mlx.py + hcsa/integrations/glm_mlx.py + hcsa/integrations/gpt2_mlx.py strategy/config wiring","tests/test_regularity.py (new)"],"command":"python3 -m pytest tests/test_regularity.py -q && python3 -m pytest -q && PYTHONPATH=. python3 scripts/bench_mlx_wayfinder_scale.py --seq-lens 2048 4096 --batch 2 --heads 4 --embd 128 --window 32 --landmark-stride 32 --warmup 2 --iters 4 --strategy random --num-cycles 1 --out-dir benchmarks/mlx/tiny_wayfinder/regularity_random && PYTHONPATH=. python3 scripts/bench_mlx_wayfinder_scale.py --seq-lens 2048 4096 --batch 2 --heads 4 --embd 128 --window 32 --landmark-stride 32 --warmup 2 --iters 4 --strategy regular_partition --regular-num-clusters 8 --num-cycles 1 --out-dir benchmarks/mlx/tiny_wayfinder/regularity_reg8 && PYTHONPATH=. python3 scripts/bench_mlx_wayfinder_scale.py --seq-lens 2048 4096 --batch 2 --heads 4 --embd 128 --window 32 --landmark-stride 32 --warmup 2 --iters 4 --strategy regular_partition --regular-num-clusters 16 --num-cycles 1 --out-dir benchmarks/mlx/tiny_wayfinder/regularity_reg16","controls":{"seq_lens":[2048,4096],"batch":2,"heads":4,"embd":128,"window":32,"landmark_stride":32,"warmup":2,"iters":4,"num_cycles":1,"baseline_path":"benchmarks/mlx/tiny_wayfinder/regularity_random/results.json","row_filter":"mode=wayfinder_permute"},"metrics":{"tests":{"test_regularity":{"passed":4,"failed":0},"pytest_full":{"status":"pass","failures":0}},"seq2048":{"reg8":{"tokens_per_sec":{"absolute":3138146.6534196045,"delta_vs_random":364253.50304701924,"pct_delta_vs_random":13.131490279438834},"peak_memory_bytes":{"absolute":67258324,"delta_vs_random":0,"pct_delta_vs_random":0.0}},"reg16":{"tokens_per_sec":{"absolute":2938483.0438047084,"delta_vs_random":164589.89343212312,"pct_delta_vs_random":5.933533867650426},"peak_memory_bytes":{"absolute":67258324,"delta_vs_random":0,"pct_delta_vs_random":0.0}}},"seq4096":{"reg8":{"tokens_per_sec":{"absolute":3470573.9380442793,"delta_vs_random":218866.07403689995,"pct_delta_vs_random":6.730804305544105},"peak_memory_bytes":{"absolute":144986324,"delta_vs_random":0,"pct_delta_vs_random":0.0}},"reg16":{"tokens_per_sec":{"absolute":3660410.2586552086,"delta_vs_random":408702.39464782923,"pct_delta_vs_random":12.568853066561537},"peak_memory_bytes":{"absolute":144986324,"delta_vs_random":0,"pct_delta_vs_random":0.0}}},"regularity_snippet":{"T2048":{"random":{"max_deviation":0.13208742477035162,"mean_deviation":0.09771935381691478},"reg8":{"max_deviation":0.11383039271485483,"mean_deviation":0.09433693796243596},"reg16":{"max_deviation":0.24714332353901405,"mean_deviation":0.1793992817499184}},"T4096":{"random":{"max_deviation":0.08221249502586549,"mean_deviation":0.048826104257859146},"reg8":{"max_deviation":0.09319238000638545,"mean_deviation":0.058267409273120734},"reg16":{"max_deviation":0.17278377494275432,"mean_deviation":0.1266110565914295}}}},"decision":"follow-up","next_action":"tune regular_partition stitching to consistently improve regularity metrics"}
{"id":"EXP-20260208-HCY-IDEA3-COVERING-RESULT","date":"2026-02-08","question":"Do additional covering cycles move permute outputs closer to dense attention in small-T regimes?","hypothesis":"Increasing covering cycles from 1 to 4 to 8 improves approximation quality to dense outputs (lower L2 distance), at near-linear extra compute.","change_set":["hcsa/cycles.py covering_cycles with even-T Walecki seeding + greedy candidate selection","hcsa/graph/analysis.py compute_edge_coverage","hcsa/graph/__init__.py export compute_edge_coverage","hcsa/mlx/attention.py wayfinder_covering_attention","tests/test_covering.py (new)"],"command":"python3 -m pytest tests/test_covering.py -q && python3 -m pytest -q && python3 - <<'PY' ... dense vs covering d={1,4,8} at T={256,512} ... PY","controls":{"fixed_rng":true,"same_qkv_per_T":true,"baseline_d":1},"metrics":{"tests":{"test_covering":{"passed":4,"failed":0},"pytest_full":{"status":"pass","failures":0}},"t256":{"d1":{"coverage":0.00784313725490196,"l2":37.65647888183594,"cos":0.24362292885780334},"d4":{"coverage":0.03137254901960784,"l2":35.46280288696289,"cos":0.254599392414093,"delta_l2_vs_d1":-2.193675994873047,"pct_l2_vs_d1":-5.825539637165733,"delta_cos_vs_d1":0.010976463556289673,"pct_cos_vs_d1":4.5055310406763},"d8":{"coverage":0.06274509803921569,"l2":34.563602447509766,"cos":0.2608260214328766,"delta_l2_vs_d1":-3.092876434326172,"pct_l2_vs_d1":-8.21398990424584,"delta_cos_vs_d1":0.017203092575073242,"pct_cos_vs_d1":7.060934246244335}},"t512":{"d1":{"coverage":0.003913894324853229,"l2":53.566158294677734,"cos":0.18330292403697968},"d4":{"coverage":0.015655577299412915,"l2":50.08660125732422,"cos":0.19458645582199097,"delta_l2_vs_d1":-3.4795570373535156,"pct_l2_vs_d1":-6.495547321366036,"delta_cos_vs_d1":0.011283531785011292,"pct_cos_vs_d1":6.156279121025469},"d8":{"coverage":0.03131115459882583,"l2":48.75308609008789,"cos":0.20152504742145538,"delta_l2_vs_d1":-4.813072204589844,"pct_l2_vs_d1":-8.98502340115673,"delta_cos_vs_d1":0.018222123384475708,"pct_cos_vs_d1":9.94141711896857}}},"decision":"keep","next_action":"optional: expose covering as explicit runtime path for research-only ablations"}
{"id":"EXP-20260208-HCY-IDEA4-SPECTRAL-RESULT-CORR1","date":"2026-02-08","question":"Do random-cycle + local-window graphs in HCSA satisfy strong expansion proxies (d/lambda) at small sequence lengths?","hypothesis":"Random cycles with window augmentation will produce expansion ratios above threshold while deliberately bad cycles fail.","change_set":["measurement-only addendum for implemented spectral utilities"],"command":"python3 -c \"import numpy as np; from hcsa.graph.analysis import spectral_gap, expansion_proxy; T=128; perm_rand=np.random.default_rng(42).permutation(T); perm_id=np.arange(T); print(spectral_gap(perm_rand, include_window=True, window=8, expander_threshold=1.1)); print(spectral_gap(perm_id, include_window=True, window=8, expander_threshold=1.1)); print(expansion_proxy(perm_rand, window=8, num_walks=2000, walk_len=20, rng=np.random.default_rng(3))); print(expansion_proxy(perm_id, window=8, num_walks=2000, walk_len=20, rng=np.random.default_rng(3)))\"","controls":{"T":128,"window":8,"perm_seed":42,"proxy_num_walks":2000,"proxy_walk_len":20},"metrics":{"spectral_random":{"degree":17.265625,"lambda_2":15.345235996406261,"spectral_gap":2.241637663001848,"expansion_ratio":1.1251456154889687,"is_good_expander":true},"spectral_identity":{"degree":15.453125,"lambda_2":15.548127486606457,"spectral_gap":0.3386900788927498,"expansion_ratio":0.9938897795449455,"is_good_expander":false},"proxy_random":{"mixing_time_estimate":19,"endpoint_uniformity":148.096},"proxy_identity":{"mixing_time_estimate":29,"endpoint_uniformity":2213.376}},"decision":"keep","next_action":"retain verify_spectral_gap as opt-in debug/research control"}
{"id": "EXP-20260208-E2E-P0-PREFLIGHT", "date": "2026-02-08", "question": "Is the environment and regression suite healthy enough to trust subsequent E2E benchmark measurements?", "hypothesis": "env_check_mlx and required pytest suites will pass, enabling full E2E benchmark execution.", "change_set": ["none (measurement-only preflight)"], "command": "python3 scripts/env_check_mlx.py --json-out benchmarks/mlx/e2e_validation_20260208_192216/env_check_mlx.json && python3 -m pytest tests/test_edge_disjoint_cycles.py tests/test_resilience.py tests/test_covering.py tests/test_spectral.py tests/test_regularity.py -q && python3 -m pytest -q", "controls": {"cwd": "/Volumes/VIXinSSD/wayfinder", "PYTHONPATH": "/Volumes/VIXinSSD/wayfinder"}, "metrics": {"status": "pending"}, "decision": "pending", "next_action": "run preflight and record result artifacts"}
{"id": "EXP-20260208-E2E-P0-PREFLIGHT-RESULT", "date": "2026-02-08", "question": "Is the environment and regression suite healthy enough to trust subsequent E2E benchmark measurements?", "hypothesis": "env_check_mlx and required pytest suites will pass, enabling full E2E benchmark execution.", "change_set": ["none (measurement-only preflight)"], "command": "python3 scripts/env_check_mlx.py --json-out benchmarks/mlx/e2e_validation_20260208_192216/env_check_mlx.json && python3 -m pytest tests/test_edge_disjoint_cycles.py tests/test_resilience.py tests/test_covering.py tests/test_spectral.py tests/test_regularity.py -q && python3 -m pytest -q", "controls": {"cwd": "/Volumes/VIXinSSD/wayfinder", "PYTHONPATH": "/Volumes/VIXinSSD/wayfinder"}, "metrics": {"env_check": {"status": "pass", "artifact": "benchmarks/mlx/e2e_validation_20260208_192216/env_check_mlx.json", "mlx_version": "0.30.6", "device": "Apple M4 Max", "memory_gb": 36.0}, "pytest_targeted": {"status": "pass", "passed": 19, "artifact": "benchmarks/mlx/e2e_validation_20260208_192216/phase0_pytests_targeted.log"}, "pytest_full": {"status": "pass_with_warning", "tests_collected": 111, "warnings": ["PytestUnknownMarkWarning: pytest.mark.slow in tests/pytorch/test_perf_regression.py"], "artifact": "benchmarks/mlx/e2e_validation_20260208_192216/phase0_pytests_full.log"}}, "decision": "keep", "next_action": "run Phase 1 idea measurements"}
{"id": "EXP-20260208-E2E-P1-IDEA1-DISJOINT", "date": "2026-02-08", "question": "For Tiny synthetic long context, does increasing cycles from d=1 to d=2 under edge-disjoint setup improve or hurt throughput/memory?", "hypothesis": "d=2 increases graph coverage but may reduce throughput from additional cycle aggregation overhead; memory change should be small.", "change_set": ["none (measurement-only run using existing edge-disjoint path)"], "command": "PYTHONPATH=/Volumes/VIXinSSD/wayfinder python3 scripts/bench_mlx_wayfinder_scale.py --seq-lens 2048 4096 --batch 2 --heads 4 --embd 128 --window 32 --landmark-stride 32 --warmup 2 --iters 4 --num-cycles 1 --out-dir benchmarks/mlx/e2e_validation_20260208_192216/idea1_disjoint_d1 && PYTHONPATH=/Volumes/VIXinSSD/wayfinder python3 scripts/bench_mlx_wayfinder_scale.py --seq-lens 2048 4096 --batch 2 --heads 4 --embd 128 --window 32 --landmark-stride 32 --warmup 2 --iters 4 --num-cycles 2 --out-dir benchmarks/mlx/e2e_validation_20260208_192216/idea1_disjoint_d2", "controls": {"seq_lens": [2048, 4096], "batch": 2, "heads": 4, "embd": 128, "window": 32, "landmark_stride": 32, "warmup": 2, "iters": 4, "baseline_path": "benchmarks/mlx/e2e_validation_20260208_192216/idea1_disjoint_d1/results.json"}, "metrics": {"status": "pending"}, "decision": "pending", "next_action": "run d1/d2 and compute absolute/delta/%"}
