{"id":"EXP-20260216T054319Z-GLM8192-CHUNK-POLICY-FIX-RESULT","date":"2026-02-16","question":"Can we recover 8k Wayfinder efficiency by relaxing only the 8k query-chunk cap (192->384) while keeping long-context caps unchanged?","hypothesis":"8k slowdown is caused by over-fragmented active gather chunks; larger 8k query chunks will reduce prefill overhead and improve dense-relative e2e.","change_set":["hcsa/integrations/glm_mlx.py _effective_permute_chunking policy split at T>=32768 vs T>=8192 (reverted after evaluation)"],"command":"post-fix wayfinder decode32+decode256 repeats=2 at T=8192 compared to tie-break dense baselines","controls":{"wayfinder32_postfix_path":"benchmarks/mlx/glm_4_7_flash_4bit_wayfinder/20260216_glm8192_chunkfix_wayfinder32_trace/results.json","wayfinder256_postfix_path":"benchmarks/mlx/glm_4_7_flash_4bit_wayfinder/20260216_glm8192_chunkfix_wayfinder256_trace/results.json","dense32_baseline_path":"benchmarks/mlx/glm_4_7_flash_4bit_wayfinder/20260216_glm8192_tiebreak_dense32/results.json","dense256_baseline_path":"benchmarks/mlx/glm_4_7_flash_4bit_wayfinder/20260216_glm8192_tiebreak_dense256/results.json"},"metrics":{"decode32_prefx_vs_postfix":{"e2e_sec":{"dense_mean":16.71164243799285,"wayfinder_prefix_mean":20.355250208522193,"wayfinder_postfix_mean":20.34160081204027},"prefill_sec":{"dense_mean":16.00632791701355,"wayfinder_prefix_mean":19.597568000026513,"wayfinder_postfix_mean":19.577967729012016},"decode_sec":{"dense_mean":0.7053145209793001,"wayfinder_prefix_mean":0.7576822084956802,"wayfinder_postfix_mean":0.7636330830282532},"decode_tok_s":{"dense_mean":45.36995819502451,"wayfinder_prefix_mean":42.251765743372076,"wayfinder_postfix_mean":41.91479572477783},"peak_memory_bytes":{"dense_mean":20660500140.0,"wayfinder_prefix_mean":20610120350.0,"wayfinder_postfix_mean":21763834526.0}},"decode256_prefx_vs_postfix":{"e2e_sec":{"dense_mean":21.000097583484603,"wayfinder_prefix_mean":24.735477332986193,"wayfinder_postfix_mean":24.709570229490055},"prefill_sec":{"dense_mean":16.00412495798082,"wayfinder_prefix_mean":19.59514950000448,"wayfinder_postfix_mean":19.579483583482215},"decode_sec":{"dense_mean":4.995972625503782,"wayfinder_prefix_mean":5.140327832981711,"wayfinder_postfix_mean":5.13008664600784},"decode_tok_s":{"dense_mean":51.241273783337775,"wayfinder_prefix_mean":49.803087502799144,"wayfinder_postfix_mean":49.90219481755394},"peak_memory_bytes":{"dense_mean":20660500140.0,"wayfinder_prefix_mean":20610120350.0,"wayfinder_postfix_mean":21763834526.0}},"postfix_trace32_repeat1":{"sample_count":34,"layer_observations":272,"phase_counts":{"prefill":2,"decode":32},"path_counts":{"wayfinder":16,"wayfinder_dense_fallback":256},"cache_source_counts":{"runtime":16,"dense_fallback":256},"graph_seq_len_counts":{"4096":8,"8192":8},"q_len_counts":{"4096":16,"1":256},"dense_fallback_reason_counts":{"unspecified":256},"fallback_layer_observations":256,"decode_layer_observations":256,"decode_fallback_layer_observations":256,"prefill_layer_observations":16,"prefill_fallback_layer_observations":0,"decode_step_observations":32,"decode_fallback_steps":32,"prefill_step_observations":2,"prefill_fallback_steps":0,"dense_fallback_share_run":0.9411764705882353,"dense_fallback_share_decode_layers":1.0,"dense_fallback_share_prefill_layers":0.0,"dense_fallback_share_decode_steps":1.0,"dense_fallback_share_prefill_steps":0.0,"timing_ms_by_phase":{"overall":{"graph_build_ms":12.018043756484985,"attention_ms":3603.4050431251526,"total_profile_ms":3626.066555738449,"graph_vs_attention_total_ms":3615.4230868816376,"graph_build_share_of_graph_plus_attention":0.003324104390463122,"attention_share_of_graph_plus_attention":0.9966758956095368,"layer_observations_with_timing":272},"prefill":{"graph_build_ms":12.018043756484985,"attention_ms":3602.2499589920044,"total_profile_ms":3618.541584312916,"graph_vs_attention_total_ms":3614.2680027484894,"graph_build_share_of_graph_plus_attention":0.003325166741189585,"attention_share_of_graph_plus_attention":0.9966748332588105,"layer_observations_with_timing":16},"decode":{"graph_build_ms":0.0,"attention_ms":1.1550841331481934,"total_profile_ms":7.524971425533295,"graph_vs_attention_total_ms":1.1550841331481934,"graph_build_share_of_graph_plus_attention":0.0,"attention_share_of_graph_plus_attention":1.0,"layer_observations_with_timing":256}},"fallback_share_known":true,"active_query_ratio":0.029411764705882353,"adaptive_graph_reuse_ratio":0.0,"cache_hit_ratio":0.9926470588235294},"postfix_trace256_repeat1":{"sample_count":258,"layer_observations":2064,"phase_counts":{"prefill":2,"decode":256},"path_counts":{"wayfinder":16,"wayfinder_dense_fallback":2048},"cache_source_counts":{"runtime":16,"dense_fallback":2048},"graph_seq_len_counts":{"4096":8,"8192":8},"q_len_counts":{"4096":16,"1":2048},"dense_fallback_reason_counts":{"unspecified":2048},"fallback_layer_observations":2048,"decode_layer_observations":2048,"decode_fallback_layer_observations":2048,"prefill_layer_observations":16,"prefill_fallback_layer_observations":0,"decode_step_observations":256,"decode_fallback_steps":256,"prefill_step_observations":2,"prefill_fallback_steps":0,"dense_fallback_share_run":0.9922480620155039,"dense_fallback_share_decode_layers":1.0,"dense_fallback_share_prefill_layers":0.0,"dense_fallback_share_decode_steps":1.0,"dense_fallback_share_prefill_steps":0.0,"timing_ms_by_phase":{"overall":{"graph_build_ms":21.757082998752594,"attention_ms":3630.179586291313,"total_profile_ms":3707.6459186673164,"graph_vs_attention_total_ms":3651.9366692900658,"graph_build_share_of_graph_plus_attention":0.005957683544107614,"attention_share_of_graph_plus_attention":0.9940423164558924,"layer_observations_with_timing":2064},"prefill":{"graph_build_ms":21.757082998752594,"attention_ms":3620.9169571995735,"total_profile_ms":3646.163792014122,"graph_vs_attention_total_ms":3642.674040198326,"graph_build_share_of_graph_plus_attention":0.00597283280322497,"attention_share_of_graph_plus_attention":0.9940271671967751,"layer_observations_with_timing":16},"decode":{"graph_build_ms":0.0,"attention_ms":9.262629091739655,"total_profile_ms":61.48212665319443,"graph_vs_attention_total_ms":9.262629091739655,"graph_build_share_of_graph_plus_attention":0.0,"attention_share_of_graph_plus_attention":1.0,"layer_observations_with_timing":2048}},"fallback_share_known":true,"active_query_ratio":0.003875968992248062,"adaptive_graph_reuse_ratio":0.0,"cache_hit_ratio":0.999031007751938}},"decision":"revert","next_action":"Keep prior chunk policy; this patch did not materially improve e2e and increased peak memory."}
{"id":"EXP-20260216T100000Z-GLM8192-FORMULA-INVESTIGATION-RESULT","date":"2026-02-16","question":"Can we make the formula strategy work at 8k without regressing 32k/65k?","hypothesis":"Fix 1 (Tq gate relaxation) or Fix 2 (monolithic prefill) should eliminate 8k regression.","change_set":["Attempted Tq gate relaxation in fused_attention.py (reverted)","Attempted monolithic 8k prefill (timeout, not viable)"],"command":"8k validation benchmarks with each fix candidate","controls":{"dense_baseline":"benchmarks/mlx/glm_4_7_flash_4bit_wayfinder/20260216_glm8192_tiebreak_dense32","seq_len":8192},"metrics":{"fix1_result":"timeout (>10min)","fix2_result":"timeout (>5min)","root_cause":"gather overhead dominates at 8k; O(T²) vs O(T×W) advantage too small"},"decision":"accept_8k_residual","next_action":"Document 8k residual in README; update benchmark table with measured results"}
{"id":"EXP-20260216T180500Z-GLM-8W-ACTIVE-CONTIGUOUS-PRERUN","date":"2026-02-16","question":"Does the 8W active contiguous-path fix remove the 8k regression while preserving wins at 2k/32k/65k?","hypothesis":"Wayfinder becomes faster than dense at all tested scales for decode32 and decode256, with 8k regression eliminated.","change_set":["hcsa/mlx/fused_attention.py active contiguous gate: Tq <= query_chunk_size -> 2*Tq >= Tk","hcsa/mlx/fused_attention.py active chunk formula: min(query_chunk_size, T) -> max(256, min(8*window, T))","hcsa/integrations/glm_mlx.py active_dense_threshold default: \"auto\" -> None","hcsa/integrations/qwen_mlx.py active_dense_threshold default: \"auto\" -> None"],"command":"python3 scripts/bench_glm_consumer_mlx.py --mode dense --no-swap --seq-lens 2048 8192 32768 65536 --decode-len 32 --repeats 1 --skip-multi-turn --skip-quality --out-dir benchmarks/mlx/glm_4_7_flash_4bit_wayfinder/8w_fix_dense32 && python3 scripts/bench_glm_consumer_mlx.py --mode wayfinder --seq-lens 2048 8192 32768 65536 --decode-len 32 --repeats 1 --skip-multi-turn --skip-quality --out-dir benchmarks/mlx/glm_4_7_flash_4bit_wayfinder/8w_fix_wayfinder32 && python3 scripts/bench_glm_consumer_mlx.py --mode dense --no-swap --seq-lens 2048 8192 32768 65536 --decode-len 256 --repeats 1 --skip-multi-turn --skip-quality --out-dir benchmarks/mlx/glm_4_7_flash_4bit_wayfinder/8w_fix_dense256 && python3 scripts/bench_glm_consumer_mlx.py --mode wayfinder --seq-lens 2048 8192 32768 65536 --decode-len 256 --repeats 1 --skip-multi-turn --skip-quality --out-dir benchmarks/mlx/glm_4_7_flash_4bit_wayfinder/8w_fix_wayfinder256","controls":{"model":"mlx-community/GLM-4.7-Flash-4bit","seq_lens":[2048,8192,32768,65536],"decode_lens":[32,256],"repeats":1,"skip_multi_turn":true,"skip_quality":true,"baseline_summary_path":"benchmarks/mlx/glm_4_7_flash_4bit_wayfinder/20260216_glm_prefill_matrix_summary.json"},"metrics":{"status":"pending","required":["e2e_sec_by_seq","delta_vs_dense_abs","delta_vs_dense_pct","dense_vs_baseline_abs","dense_vs_baseline_pct","wayfinder_vs_baseline_abs","wayfinder_vs_baseline_pct","peak_memory_bytes","memory_reduction_pct"]},"decision":"pending","next_action":"Run 4-command matrix, compute dense-vs-wayfinder plus baseline deltas, and update README if 8k regression is eliminated."}
{"id":"EXP-20260216T180500Z-GLM-8W-ACTIVE-CONTIGUOUS-RESULT","date":"2026-02-16","question":"Does the 8W active contiguous-path fix remove the 8k regression while preserving wins at 2k/32k/65k?","hypothesis":"Wayfinder becomes faster than dense at all tested scales for decode32 and decode256, with 8k regression eliminated.","change_set":["same as pre-run"],"command":"Executed full 4-command matrix at decode_len={32,256} with repeats=1 and identical controls.","controls":{"dense32":"benchmarks/mlx/glm_4_7_flash_4bit_wayfinder/8w_fix_dense32/results.json","wayfinder32":"benchmarks/mlx/glm_4_7_flash_4bit_wayfinder/8w_fix_wayfinder32/results.json","dense256":"benchmarks/mlx/glm_4_7_flash_4bit_wayfinder/8w_fix_dense256/results.json","wayfinder256":"benchmarks/mlx/glm_4_7_flash_4bit_wayfinder/8w_fix_wayfinder256/results.json","baseline_summary_path":"benchmarks/mlx/glm_4_7_flash_4bit_wayfinder/20260216_glm_prefill_matrix_summary.json"},"metrics":{"decode32":{"2048":{"dense_e2e_sec":3.2155437910114415,"wayfinder_e2e_sec":2.5801073759794235,"delta_vs_dense_abs":-0.635436415032018,"delta_vs_dense_pct":-19.761398268258166},"8192":{"dense_e2e_sec":16.936140042031184,"wayfinder_e2e_sec":9.663074499985669,"delta_vs_dense_abs":-7.273065542045515,"delta_vs_dense_pct":-42.94405646148189},"32768":{"dense_e2e_sec":282.9541161659872,"wayfinder_e2e_sec":112.3095124590327,"delta_vs_dense_abs":-170.6446037069545,"delta_vs_dense_pct":-60.30822453448621},"65536":{"dense_e2e_sec":1156.530053623952,"wayfinder_e2e_sec":727.0367136670393,"delta_vs_dense_abs":-429.4933399569127,"delta_vs_dense_pct":-37.136375195016186}},"decode256":{"2048":{"dense_e2e_sec":6.636738166038413,"wayfinder_e2e_sec":6.327278165961616,"delta_vs_dense_abs":-0.30946000007679686,"delta_vs_dense_pct":-4.662832740040415},"8192":{"dense_e2e_sec":21.321895791974384,"wayfinder_e2e_sec":14.296649291994981,"delta_vs_dense_abs":-7.025246499979403,"delta_vs_dense_pct":-32.9485078086899},"32768":{"dense_e2e_sec":379.126856708026,"wayfinder_e2e_sec":120.95169133297168,"delta_vs_dense_abs":-258.17516537505435,"delta_vs_dense_pct":-68.09730326593052},"65536":{"dense_e2e_sec":1469.295744040981,"wayfinder_e2e_sec":430.7673999170074,"delta_vs_dense_abs":-1038.5283441239735,"delta_vs_dense_pct":-70.68204943326967}},"decode32_vs_baseline":{"dense":{"2048":{"abs":0.11554379101144141,"pct":3.727219064885207},"8192":{"abs":0.006140042031184123,"pct":0.03626722995383416},"32768":{"abs":104.98411616598722,"pct":58.98978264088735},"65536":{"abs":90.84005362395192,"pct":8.52405986956356}},"wayfinder":{"2048":{"abs":-0.029892624020576353,"pct":-1.145311265156182},"8192":{"abs":-10.46692550001433,"pct":-51.996649279753264},"32768":{"abs":-10.720487540967298,"pct":-8.71371823211192},"65536":{"abs":375.5167136670393,"pct":106.8265571424213}}},"peak_memory_bytes":{"dense":{"2048":18284344600,"8192":20660500140,"32768":26017775484,"65536":33160809276},"wayfinder":{"2048":18318769672,"8192":20160008272,"32768":21978678158,"65536":23795994534}},"memory_reduction_pct":{"2048":-0.18827621527106597,"8192":2.4224576588589786,"32768":15.524376126944063,"65536":28.240609763338153}},"decision":"keep","next_action":"Update README GLM benchmark tables with measured 8W-fix matrix and run full tests."}
{"id":"EXP-20260216T193000Z-GLM-MASTER-FORMULA-HARMONIC-PRERUN","date":"2026-02-16","question":"Can a continuous, non-piecewise chunk formula recover 65k performance while keeping the 8k fix?","hypothesis":"Replacing fixed 8W contiguous chunking with a harmonic blend of query_chunk_size and 8W will preserve 8k gains and reduce 65k regression.","change_set":["hcsa/mlx/fused_attention.py _active_via_full_prefill q_chunk formula -> harmonic_mean(min(query_chunk_size,T), min(8*window,T))"],"command":"python3 scripts/bench_glm_consumer_mlx.py --mode wayfinder --seq-lens 8192 65536 --decode-len 32 --repeats 1 --skip-multi-turn --skip-quality --out-dir benchmarks/mlx/glm_4_7_flash_4bit_wayfinder/formula_harmonic_wayfinder32","controls":{"model":"mlx-community/GLM-4.7-Flash-4bit","seq_lens":[8192,65536],"decode_len":32,"repeats":1,"skip_multi_turn":true,"skip_quality":true,"baseline_paths":["benchmarks/mlx/glm_4_7_flash_4bit_wayfinder/8w_fix_wayfinder32/results.json","benchmarks/mlx/glm_4_7_flash_4bit_wayfinder/20260216_glm_prefill_matrix32_wayfinder_trace/results.json"]},"metrics":{"status":"pending","required":["e2e_sec_8192","e2e_sec_65536","delta_vs_8w_fix_abs","delta_vs_8w_fix_pct","delta_vs_prior65k_abs","delta_vs_prior65k_pct"]},"decision":"pending","next_action":"Run targeted wayfinder sweep and decide keep/revert for master formula."}
{"id":"EXP-20260216T193000Z-GLM-MASTER-FORMULA-HARMONIC-RESULT","date":"2026-02-16","question":"Can a continuous, non-piecewise chunk formula recover 65k performance while keeping the 8k fix?","hypothesis":"Replacing fixed 8W contiguous chunking with a harmonic blend of query_chunk_size and 8W will preserve 8k gains and reduce 65k regression.","change_set":["hcsa/mlx/fused_attention.py _active_via_full_prefill q_chunk formula -> harmonic_mean(min(query_chunk_size,T), min(8*window,T))"],"command":"python3 scripts/bench_glm_consumer_mlx.py --mode wayfinder --seq-lens 8192 65536 --decode-len 32 --repeats 1 --skip-multi-turn --skip-quality --out-dir benchmarks/mlx/glm_4_7_flash_4bit_wayfinder/formula_harmonic_wayfinder32","controls":{"formula_run_path":"benchmarks/mlx/glm_4_7_flash_4bit_wayfinder/formula_harmonic_wayfinder32/results.json","baseline_8w_fix_wayfinder32":"benchmarks/mlx/glm_4_7_flash_4bit_wayfinder/8w_fix_wayfinder32/results.json","baseline_8w_fix_dense32":"benchmarks/mlx/glm_4_7_flash_4bit_wayfinder/8w_fix_dense32/results.json","baseline_prior65k":"benchmarks/mlx/glm_4_7_flash_4bit_wayfinder/20260216_glm_prefill_matrix32_wayfinder_trace/results.json"},"metrics":{"decode32":{"8192":{"wayfinder_e2e_sec":10.653194375976454,"prefill_sec":9.853612041973975,"decode_sec":0.7995823340024799,"peak_memory_bytes":20071482232,"delta_vs_8w_fix_abs":0.9901198759907857,"delta_vs_8w_fix_pct":10.24642701442749,"delta_vs_dense_abs":-6.282945666054729,"delta_vs_dense_pct":-37.09786084941468},"65536":{"wayfinder_e2e_sec":411.44483424996724,"prefill_sec":399.4238949579885,"decode_sec":12.02093929197872,"peak_memory_bytes":23795994534,"delta_vs_8w_fix_abs":-315.59187941707205,"delta_vs_8w_fix_pct":-43.4079701182193,"delta_vs_dense_abs":-745.0852193739847,"delta_vs_dense_pct":-64.42419866559305,"delta_vs_prior65k_abs":59.9248847089475,"delta_vs_prior65k_pct":17.04736382307506}}},"decision":"keep","next_action":"Use harmonic formula as master non-chunky default and run full decode32/decode256 matrix before final README refresh."}
{"id":"EXP-20260217T002514Z-NANBEIGE41-3B-WAYFINDER-PRERUN","date":"2026-02-17","question":"Does the harmonic active-contiguous policy generalize to a smaller non-MoE model (Nanbeige4.1-3B) in MLX Qwen-family benchmarking?","hypothesis":"Wayfinder with window=64, head_chunk_size=2, query_chunk_size=384 remains faster than dense at medium/long contexts and may extend maximum successful context length.","change_set":["hcsa/integrations/qwen_mlx.py: identity fallback for missing q_norm/k_norm in QwenWayfinderAttention/extract_qkv"],"command":"Step0 preflight + paired decode32 matrix + long-context stop-gated extension + paired decode256 checkpoints + wayfinder hsa-trace runs using scripts/bench_qwen_consumer_mlx.py and model Nanbeige/Nanbeige4.1-3B","controls":{"model":"Nanbeige/Nanbeige4.1-3B","entrypoint":"scripts/bench_qwen_consumer_mlx.py","decode32_seq_lens":[2048,8192,16384,32768],"long_seq_lens":[65536,98304,131072],"decode256_policy":"8192 + largest paired-success T from decode32","repeats":1,"skip_multi_turn":true,"skip_quality":true,"wayfinder":{"window":64,"head_chunk_size":2,"query_chunk_size":384},"retro_backfill_inference":"off"},"metrics":{"status":"pending","required":["e2e_sec","prefill_sec","decode_sec","peak_memory_bytes","delta_vs_dense_abs","delta_vs_dense_pct","memory_reduction_pct","path_counts","dense_fallback_share_run","timing_ms_by_phase"]},"decision":"pending","next_action":"Execute campaign commands and write RESULT entry with absolute and delta metrics plus failure boundary."}
{"id":"EXP-20260217T174044Z-NANBEIGE41-3B-WAYFINDER-RESULT","date":"2026-02-17","question":"Does the harmonic active-contiguous policy generalize to Nanbeige/Nanbeige4.1-3B with paired dense baselines at larger contexts?","hypothesis":"Wayfinder with window=64, head_chunk_size=2, query_chunk_size=384 should stay competitive at long context and potentially improve max-scale runtime vs dense.","change_set":["hcsa/integrations/qwen_mlx.py: identity fallback when q_norm/k_norm are absent on Qwen-family attention modules"],"command":"Step0 preflight + paired decode32 (core+long) + decode256 checkpoints + hsa-trace checkpoints via scripts/bench_qwen_consumer_mlx.py; resume attempts for wayfinder decode256/trace at T=131072 were stop-gated on non-completing hangs.","controls":{"model":"Nanbeige/Nanbeige4.1-3B","entrypoint":"scripts/bench_qwen_consumer_mlx.py","repeats":1,"skip_multi_turn":true,"skip_quality":true,"retro_backfill_inference":"off","wayfinder":{"window":64,"head_chunk_size":2,"query_chunk_size":384}},"metrics":{"preflight":{"passed":true,"dense_out":"benchmarks/mlx/nanbeige4_1_3b_wayfinder/preflight_dense/results.json","wayfinder_out":"benchmarks/mlx/nanbeige4_1_3b_wayfinder/preflight_wayfinder/results.json"},"decode32":{"2048":{"dense_e2e_sec":2.04169262497453,"wayfinder_e2e_sec":2.3138024589861743,"delta_vs_dense_abs":0.2721098340116441,"delta_vs_dense_pct":13.327659153151844},"8192":{"dense_e2e_sec":6.897076749999542,"wayfinder_e2e_sec":7.164006001024973,"delta_vs_dense_abs":0.26692925102543086,"delta_vs_dense_pct":3.8701795079407892},"16384":{"dense_e2e_sec":15.070868248993065,"wayfinder_e2e_sec":15.629427999956533,"delta_vs_dense_abs":0.5585597509634681,"delta_vs_dense_pct":3.706221444811498},"32768":{"dense_e2e_sec":38.37527904100716,"wayfinder_e2e_sec":39.66667412495008,"delta_vs_dense_abs":1.2913950839429162,"delta_vs_dense_pct":3.3651744461921793},"65536":{"dense_e2e_sec":115.02118149999296,"wayfinder_e2e_sec":118.12203354202211,"delta_vs_dense_abs":3.100852042029146,"delta_vs_dense_pct":2.695896531048358},"98304":{"dense_e2e_sec":233.8231759580085,"wayfinder_e2e_sec":237.64993600000162,"delta_vs_dense_abs":3.8267600419931114,"delta_vs_dense_pct":1.6366042528993558},"131072":{"dense_e2e_sec":438.1875977090094,"wayfinder_e2e_sec":403.3926235830295,"delta_vs_dense_abs":-34.794974125979934,"delta_vs_dense_pct":-7.940656994378581}},"decode256":{"8192":{"dense_e2e_sec":11.92745333298808,"wayfinder_e2e_sec":15.944827541999985,"delta_vs_dense_abs":4.017374209011905,"delta_vs_dense_pct":33.681743259484776},"131072":{"dense_e2e_sec":373.40119070903165,"wayfinder_status":"hang_no_row_after_resume_attempts"}},"memory_reduction_pct":{"formula":"100*(1-wayfinder/dense)","decode32":{"2048":-1.4791012753124555,"8192":-0.2462647543707952,"16384":-1.2056766060184243,"32768":-2.6795617243174696,"65536":-0.09715840495194694,"98304":-0.08398292110471939,"131072":-0.07429858405445522},"decode256":{"8192":-0.13227527290311514}},"failure_boundary":{"decode32_dense_max_T":131072,"decode32_wayfinder_max_T":131072,"decode256_dense_max_T":131072,"decode256_wayfinder_max_T":8192},"trace":{"trace_8192":{"path_counts":{"permute":264,"permute_dense_fallback":8},"dense_fallback_share_run":0.029411764705882353,"timing_ms_by_phase":null},"trace_131072":{"status":"hang_stop_gated","fallback_observability_source":"benchmarks/mlx/nanbeige4_1_3b_wayfinder/long_wayfinder32_T131072/results.json","path_counts":{"permute":264,"permute_dense_fallback":248},"dense_fallback_share_run":0.484375,"timing_ms_by_phase":null}}},"decision":"follow-up","next_action":"Add adaptive policy term by context/model-size and debug non-completing wayfinder decode256/trace behavior at T=131072 before finalizing small-model default guidance."}
