{"id": "EXP-20260208-E2E-TIEBREAK-IDEA5-REGULARITY", "date": "2026-02-08", "question": "Why does Idea-5 regular partition at T=4096 conflict materially with earlier results (>10% drift in throughput direction)?", "hypothesis": "A fresh repeat under identical settings will discriminate whether the sign flip is stable behavior or noise.", "change_set": ["none (measurement-only tie-break repeat)"], "command": "PYTHONPATH=/Volumes/VIXinSSD/wayfinder python3 scripts/bench_mlx_wayfinder_scale.py --seq-lens 2048 4096 --batch 2 --heads 4 --embd 128 --window 32 --landmark-stride 32 --warmup 2 --iters 4 --strategy random --num-cycles 1 --out-dir benchmarks/mlx/e2e_validation_20260208_192216/tiebreak_idea5_random && PYTHONPATH=/Volumes/VIXinSSD/wayfinder python3 scripts/bench_mlx_wayfinder_scale.py --seq-lens 2048 4096 --batch 2 --heads 4 --embd 128 --window 32 --landmark-stride 32 --warmup 2 --iters 4 --strategy regular_partition --regular-num-clusters 8 --num-cycles 1 --out-dir benchmarks/mlx/e2e_validation_20260208_192216/tiebreak_idea5_reg8 && PYTHONPATH=/Volumes/VIXinSSD/wayfinder python3 scripts/bench_mlx_wayfinder_scale.py --seq-lens 2048 4096 --batch 2 --heads 4 --embd 128 --window 32 --landmark-stride 32 --warmup 2 --iters 4 --strategy regular_partition --regular-num-clusters 16 --num-cycles 1 --out-dir benchmarks/mlx/e2e_validation_20260208_192216/tiebreak_idea5_reg16", "controls": {"seq_lens": [2048, 4096], "batch": 2, "heads": 4, "embd": 128, "window": 32, "landmark_stride": 32, "warmup": 2, "iters": 4, "num_cycles": 1, "reference_runs": {"earlier": "benchmarks/mlx/tiny_wayfinder/regularity_random|reg8|reg16/results.json", "current": "benchmarks/mlx/e2e_validation_20260208_192216/idea5_random|reg8|reg16/results.json", "tiebreak": "benchmarks/mlx/e2e_validation_20260208_192216/tiebreak_idea5_random|reg8|reg16/results.json"}}, "metrics": {"status": "pending"}, "decision": "pending", "next_action": "run tie-break and report all three measurements"}
{"id": "EXP-20260208-E2E-TIEBREAK-IDEA5-REGULARITY-RESULT", "date": "2026-02-08", "question": "Why does Idea-5 regular partition at T=4096 conflict materially with earlier results (>10% drift in throughput direction)?", "hypothesis": "A fresh repeat under identical settings will discriminate whether the sign flip is stable behavior or noise.", "change_set": ["none (measurement-only tie-break repeat)"], "command": "PYTHONPATH=/Volumes/VIXinSSD/wayfinder python3 scripts/bench_mlx_wayfinder_scale.py ... (tiebreak_idea5_random/reg8/reg16)", "controls": {"seq_lens": [2048, 4096], "batch": 2, "heads": 4, "embd": 128, "window": 32, "landmark_stride": 32, "warmup": 2, "iters": 4, "num_cycles": 1, "reference_runs": {"earlier": "benchmarks/mlx/tiny_wayfinder/regularity_random|reg8|reg16/results.json", "current": "benchmarks/mlx/e2e_validation_20260208_192216/idea5_random|reg8|reg16/results.json", "tiebreak": "benchmarks/mlx/e2e_validation_20260208_192216/tiebreak_idea5_random|reg8|reg16/results.json"}}, "metrics": {"three_run_summary": {"2048": {"earlier": {"random_tok_s": 2773893.1503725853, "reg8_tok_s": 3138146.6534196045, "reg16_tok_s": 2938483.0438047084, "reg8_delta_vs_random": 364253.50304701924, "reg8_pct_vs_random": 13.131490050296033, "reg16_delta_vs_random": 164589.89343212312, "reg16_pct_vs_random": 5.933534008331058}, "current": {"random_tok_s": 2915259.9571946487, "reg8_tok_s": 2931865.967780897, "reg16_tok_s": 3210397.4286508686, "reg8_delta_vs_random": 16606.010586248245, "reg8_pct_vs_random": 0.5696236641012348, "reg16_delta_vs_random": 295137.4714562199, "reg16_pct_vs_random": 10.123881773487891}, "tiebreak": {"random_tok_s": 2382462.621662983, "reg8_tok_s": 2398857.4927143333, "reg16_tok_s": 2362991.4739185283, "reg8_delta_vs_random": 16394.871051350143, "reg8_pct_vs_random": 0.6881480910666441, "reg16_delta_vs_random": -19471.14774445491, "reg16_pct_vs_random": -0.8172698101288091}}, "4096": {"earlier": {"random_tok_s": 3251707.8640073794, "reg8_tok_s": 3470573.9380442793, "reg16_tok_s": 3660410.2586552086, "reg8_delta_vs_random": 218866.07403689995, "reg8_pct_vs_random": 6.73080372500533, "reg16_delta_vs_random": 408702.39464782923, "reg16_pct_vs_random": 12.568853406903152}, "current": {"random_tok_s": 3829155.712460304, "reg8_tok_s": 3637419.6025046785, "reg16_tok_s": 3459794.035154872, "reg8_delta_vs_random": -191736.1099556256, "reg8_pct_vs_random": -5.007268556139013, "reg16_delta_vs_random": -369361.67730543204, "reg16_pct_vs_random": -9.646034401356593}, "tiebreak": {"random_tok_s": 2652778.012366513, "reg8_tok_s": 3190626.3003067826, "reg16_tok_s": 2614502.995647631, "reg8_delta_vs_random": 537848.2879402698, "reg8_pct_vs_random": 20.27490749067471, "reg16_delta_vs_random": -38275.01671888167, "reg16_pct_vs_random": -1.4428277277802437}}}, "sign_resolution_4096": {"earlier_reg16_positive": true, "current_reg16_positive": false, "tiebreak_reg16_positive": false}}, "decision": "follow-up", "next_action": "treat regular strategy as run-state sensitive and keep random as default pending stability work"}
