{"id":"EXP-20260318T211835Z-QWEN35CUDA-SPARSE-512-RESULT","date":"2026-03-18","question":"After proving sparse Hamiltonian semantics at 64/128/256, does the same path=sparse configuration remain stable and semantically intact at T=512 without any new current-boot NVIDIA or OOM kernel events?","hypothesis":"T=512 should complete cleanly on the true sparse path, keep 8/8 active Wayfinder layers, and continue to report path='sparse', graph_source='runtime', and non-null graph metrics on every active profile. Performance may still trail dense at this context.","change_set":["measurement-only","notes/LAB_NOTEBOOK.md","notes/experiments.ndjson"],"command":".venv/bin/python scripts/bench_qwen35_cuda_wayfinder.py --model-path /home/hmbown/HF_Models/Qwen3.5-9B --seq-lens 512 --path sparse --strategy random --compute-graph-metrics --engine auto --warmup 1 --repeats 1 --forward-target backbone --phases dense wayfinder --skip-divergence --output benchmarks/cuda/qwen35_wayfinder/EXP-20260318T211835Z-QWEN35CUDA-SPARSE-512.ndjson && journalctl -b -k --since '2026-03-18 16:18:35' | rg -n 'NVRM|Xid|Out of memory|hung task|BUG:|Call Trace'","controls":{"baseline_run_path":"benchmarks/cuda/qwen35_wayfinder/EXP-20260318T210720Z-QWEN35CUDA-SPARSE-LOWTOKEN-METRICS.ndjson","supplemental_perm_baseline_path":"benchmarks/cuda/qwen35_wayfinder/EXP-20260318T203600Z-QWEN35CUDA-LOWTOKEN-AUTO-512.ndjson","one_process_at_a_time":true,"lock_file":"benchmarks/cuda/qwen35_wayfinder/.bench_qwen35_cuda_wayfinder.lock","retro_backfill_inference":"off","model_path":"/home/hmbown/HF_Models/Qwen3.5-9B","device":"cuda","gpu":"NVIDIA GB10","device_capability":[12,1],"torch":"2.10.0+cu130","transformers":"5.3.0","path":"sparse","strategy":"random","compute_graph_metrics":true,"forward_target":"backbone","window":64,"landmark_stride":64,"num_cycles":1,"engine_request":"auto","warmup":1,"repeats":1,"seq_lens":[512],"kernel_log_since":"2026-03-18 16:18:35"},"metrics":{"status":"completed","artifact":"benchmarks/cuda/qwen35_wayfinder/EXP-20260318T211835Z-QWEN35CUDA-SPARSE-512.ndjson","dense":{"median_ms":336.88,"prefill_tok_per_sec":1519.8,"peak_mem_gb":16.8},"wayfinder":{"median_ms":683.01,"prefill_tok_per_sec":749.6,"peak_mem_gb":18.54,"wayfinder_active_layers":8,"wayfinder_graph_cache_entries_total":8},"delta_vs_dense_abs":{"median_ms":346.13,"prefill_tok_per_sec":-770.2,"peak_mem_gb":1.74},"delta_vs_dense_pct":{"median_ms":102.74,"prefill_tok_per_sec":-50.68,"peak_mem_gb":10.36},"memory_reduction_pct_convention":"100*(1-wayfinder/dense)","memory_reduction_pct":-10.36,"delta_vs_perm_baseline_abs":{"median_ms":245.93,"prefill_tok_per_sec":-421.8,"peak_mem_gb":0.69},"delta_vs_perm_baseline_pct":{"median_ms":56.27,"prefill_tok_per_sec":-36.01,"peak_mem_gb":3.87},"graph_metrics":{"graph_source":"runtime","degree_mean":66.17822265625,"max_degree":74,"shortcut_rate":0.9931640625,"reachability_proxy":511.9990234375,"edge_type_counts":{"cycle":4096,"window":122288,"landmark":9149,"rewire":0}},"kernel_fault_lines_after_start":0},"decision":"keep","next_action":"Continue the bounded sparse ladder to T=1024 only, same controls and stop-gates."}
{"id":"EXP-20260318T212235Z-QWEN35CUDA-SPARSE-1024-PRERUN","date":"2026-03-18","question":"After a clean sparse T=512 checkpoint, does the same path=sparse configuration remain stable and semantically intact at T=1024 without any new current-boot NVIDIA or OOM kernel events?","hypothesis":"T=1024 should complete cleanly on the true sparse path, keep 8/8 active Wayfinder layers, and continue to report path='sparse', graph_source='runtime', and non-null graph metrics on every active profile. Performance may still trail dense.","change_set":["measurement-only"],"command":".venv/bin/python scripts/bench_qwen35_cuda_wayfinder.py --model-path /home/hmbown/HF_Models/Qwen3.5-9B --seq-lens 1024 --path sparse --strategy random --compute-graph-metrics --engine auto --warmup 1 --repeats 1 --forward-target backbone --phases dense wayfinder --skip-divergence --output benchmarks/cuda/qwen35_wayfinder/EXP-20260318T212235Z-QWEN35CUDA-SPARSE-1024.ndjson && journalctl -b -k --since '2026-03-18 16:22:35' | rg -n 'NVRM|Xid|Out of memory|hung task|BUG:|Call Trace'","controls":{"baseline_run_path":"benchmarks/cuda/qwen35_wayfinder/EXP-20260318T211835Z-QWEN35CUDA-SPARSE-512.ndjson","supplemental_perm_baseline_path":"benchmarks/cuda/qwen35_wayfinder/EXP-20260318T204303Z-QWEN35CUDA-LOWTOKEN-AUTO-1024.ndjson","one_process_at_a_time":true,"lock_file":"benchmarks/cuda/qwen35_wayfinder/.bench_qwen35_cuda_wayfinder.lock","retro_backfill_inference":"off","model_path":"/home/hmbown/HF_Models/Qwen3.5-9B","device":"cuda","gpu":"NVIDIA GB10","device_capability":[12,1],"torch":"2.10.0+cu130","transformers":"5.3.0","path":"sparse","strategy":"random","compute_graph_metrics":true,"forward_target":"backbone","window":64,"landmark_stride":64,"num_cycles":1,"engine_request":"auto","warmup":1,"repeats":1,"seq_lens":[1024],"kernel_log_since":"2026-03-18 16:22:35"},"metrics":{"status":"pending","artifacts_expected":["benchmarks/cuda/qwen35_wayfinder/EXP-20260318T212235Z-QWEN35CUDA-SPARSE-1024.ndjson"],"required":["bench[label=dense].median_ms","bench[label=dense].prefill_tok_per_sec","bench[label=dense].peak_mem_gb","bench[label=wayfinder].median_ms","bench[label=wayfinder].prefill_tok_per_sec","bench[label=wayfinder].peak_mem_gb","bench[label=wayfinder].wayfinder_profiles","bench[label=wayfinder].wayfinder_profiles[].path==sparse","bench[label=wayfinder].wayfinder_profiles[].graph_metrics not all null","zero new kernel fault lines after kernel_log_since"]},"decision":"pending","next_action":"Run the sparse 1024 checkpoint, inspect the artifact for sparse-path graph metrics and active layers, and stop immediately if any new kernel fault appears."}
{"id":"EXP-20260318T212235Z-QWEN35CUDA-SPARSE-1024-RESULT","date":"2026-03-18","question":"After a clean sparse T=512 checkpoint, does the same path=sparse configuration remain stable and semantically intact at T=1024 without any new current-boot NVIDIA or OOM kernel events?","hypothesis":"T=1024 should complete cleanly on the true sparse path, keep 8/8 active Wayfinder layers, and continue to report path='sparse', graph_source='runtime', and non-null graph metrics on every active profile. Performance may still trail dense.","change_set":["measurement-only","notes/LAB_NOTEBOOK.md","notes/experiments.ndjson"],"command":".venv/bin/python scripts/bench_qwen35_cuda_wayfinder.py --model-path /home/hmbown/HF_Models/Qwen3.5-9B --seq-lens 1024 --path sparse --strategy random --compute-graph-metrics --engine auto --warmup 1 --repeats 1 --forward-target backbone --phases dense wayfinder --skip-divergence --output benchmarks/cuda/qwen35_wayfinder/EXP-20260318T212235Z-QWEN35CUDA-SPARSE-1024.ndjson && journalctl -b -k --since '2026-03-18 16:22:35' | rg -n 'NVRM|Xid|Out of memory|hung task|BUG:|Call Trace'","controls":{"baseline_run_path":"benchmarks/cuda/qwen35_wayfinder/EXP-20260318T211835Z-QWEN35CUDA-SPARSE-512.ndjson","supplemental_perm_baseline_path":"benchmarks/cuda/qwen35_wayfinder/EXP-20260318T204303Z-QWEN35CUDA-LOWTOKEN-AUTO-1024.ndjson","one_process_at_a_time":true,"lock_file":"benchmarks/cuda/qwen35_wayfinder/.bench_qwen35_cuda_wayfinder.lock","retro_backfill_inference":"off","model_path":"/home/hmbown/HF_Models/Qwen3.5-9B","device":"cuda","gpu":"NVIDIA GB10","device_capability":[12,1],"torch":"2.10.0+cu130","transformers":"5.3.0","path":"sparse","strategy":"random","compute_graph_metrics":true,"forward_target":"backbone","window":64,"landmark_stride":64,"num_cycles":1,"engine_request":"auto","warmup":1,"repeats":1,"seq_lens":[1024],"kernel_log_since":"2026-03-18 16:22:35"},"metrics":{"status":"completed","artifact":"benchmarks/cuda/qwen35_wayfinder/EXP-20260318T212235Z-QWEN35CUDA-SPARSE-1024.ndjson","dense":{"median_ms":575.08,"prefill_tok_per_sec":1780.6,"peak_mem_gb":16.9},"wayfinder":{"median_ms":1243.32,"prefill_tok_per_sec":823.6,"peak_mem_gb":20.78,"wayfinder_active_layers":8,"wayfinder_graph_cache_entries_total":8},"delta_vs_dense_abs":{"median_ms":668.24,"prefill_tok_per_sec":-957.0,"peak_mem_gb":3.88},"delta_vs_dense_pct":{"median_ms":116.2,"prefill_tok_per_sec":-53.75,"peak_mem_gb":22.96},"memory_reduction_pct_convention":"100*(1-wayfinder/dense)","memory_reduction_pct":-22.96,"delta_vs_perm_baseline_abs":{"median_ms":405.52,"prefill_tok_per_sec":-398.6,"peak_mem_gb":1.76},"delta_vs_perm_baseline_pct":{"median_ms":48.4,"prefill_tok_per_sec":-32.61,"peak_mem_gb":9.25},"graph_metrics":{"graph_source":"runtime","degree_mean":72.309326171875,"max_degree":82,"shortcut_rate":0.997314453125,"reachability_proxy":1023.99853515625,"edge_type_counts":{"cycle":8192,"window":253307,"landmark":34680,"rewire":0}},"kernel_fault_lines_after_start":0},"decision":"keep","next_action":"Continue the bounded sparse ladder to T=2048 only, same controls and stop-gates."}
{"id":"EXP-20260318T213005Z-QWEN35CUDA-SPARSE-2048-PRERUN","date":"2026-03-18","question":"After a clean sparse T=1024 checkpoint, does the same path=sparse configuration remain stable and semantically intact at T=2048 without any new current-boot NVIDIA or OOM kernel events?","hypothesis":"T=2048 should still complete cleanly on the true sparse path, keep 8/8 active Wayfinder layers, and continue to report path='sparse', graph_source='runtime', and non-null graph metrics on every active profile. Performance may still trail dense, but memory should remain far below device capacity.","change_set":["measurement-only"],"command":".venv/bin/python scripts/bench_qwen35_cuda_wayfinder.py --model-path /home/hmbown/HF_Models/Qwen3.5-9B --seq-lens 2048 --path sparse --strategy random --compute-graph-metrics --engine auto --warmup 1 --repeats 1 --forward-target backbone --phases dense wayfinder --skip-divergence --output benchmarks/cuda/qwen35_wayfinder/EXP-20260318T213005Z-QWEN35CUDA-SPARSE-2048.ndjson && journalctl -b -k --since '2026-03-18 16:30:05' | rg -n 'NVRM|Xid|Out of memory|hung task|BUG:|Call Trace'","controls":{"baseline_run_path":"benchmarks/cuda/qwen35_wayfinder/EXP-20260318T212235Z-QWEN35CUDA-SPARSE-1024.ndjson","supplemental_perm_baseline_path":"benchmarks/cuda/qwen35_wayfinder/EXP-20260318T204752Z-QWEN35CUDA-LOWTOKEN-AUTO-2048.ndjson","one_process_at_a_time":true,"lock_file":"benchmarks/cuda/qwen35_wayfinder/.bench_qwen35_cuda_wayfinder.lock","retro_backfill_inference":"off","model_path":"/home/hmbown/HF_Models/Qwen3.5-9B","device":"cuda","gpu":"NVIDIA GB10","device_capability":[12,1],"torch":"2.10.0+cu130","transformers":"5.3.0","path":"sparse","strategy":"random","compute_graph_metrics":true,"forward_target":"backbone","window":64,"landmark_stride":64,"num_cycles":1,"engine_request":"auto","warmup":1,"repeats":1,"seq_lens":[2048],"kernel_log_since":"2026-03-18 16:30:05"},"metrics":{"status":"pending","artifacts_expected":["benchmarks/cuda/qwen35_wayfinder/EXP-20260318T213005Z-QWEN35CUDA-SPARSE-2048.ndjson"],"required":["bench[label=dense].median_ms","bench[label=dense].prefill_tok_per_sec","bench[label=dense].peak_mem_gb","bench[label=wayfinder].median_ms","bench[label=wayfinder].prefill_tok_per_sec","bench[label=wayfinder].peak_mem_gb","bench[label=wayfinder].wayfinder_profiles","bench[label=wayfinder].wayfinder_profiles[].path==sparse","bench[label=wayfinder].wayfinder_profiles[].graph_metrics not all null","zero new kernel fault lines after kernel_log_since"]},"decision":"pending","next_action":"Run the sparse 2048 checkpoint, inspect the artifact for sparse-path graph metrics and active layers, and stop immediately if any new kernel fault appears."}
{"id":"EXP-20260318T213005Z-QWEN35CUDA-SPARSE-2048-RESULT","date":"2026-03-18","question":"After a clean sparse T=1024 checkpoint, does the same path=sparse configuration remain stable and semantically intact at T=2048 without any new current-boot NVIDIA or OOM kernel events?","hypothesis":"T=2048 should still complete cleanly on the true sparse path, keep 8/8 active Wayfinder layers, and continue to report path='sparse', graph_source='runtime', and non-null graph metrics on every active profile. Performance may still trail dense, but memory should remain far below device capacity.","change_set":["measurement-only","notes/LAB_NOTEBOOK.md","notes/experiments.ndjson"],"command":".venv/bin/python scripts/bench_qwen35_cuda_wayfinder.py --model-path /home/hmbown/HF_Models/Qwen3.5-9B --seq-lens 2048 --path sparse --strategy random --compute-graph-metrics --engine auto --warmup 1 --repeats 1 --forward-target backbone --phases dense wayfinder --skip-divergence --output benchmarks/cuda/qwen35_wayfinder/EXP-20260318T213005Z-QWEN35CUDA-SPARSE-2048.ndjson && journalctl -b -k --since '2026-03-18 16:30:05' | rg -n 'NVRM|Xid|Out of memory|hung task|BUG:|Call Trace'","controls":{"baseline_run_path":"benchmarks/cuda/qwen35_wayfinder/EXP-20260318T212235Z-QWEN35CUDA-SPARSE-1024.ndjson","supplemental_perm_baseline_path":"benchmarks/cuda/qwen35_wayfinder/EXP-20260318T204752Z-QWEN35CUDA-LOWTOKEN-AUTO-2048.ndjson","one_process_at_a_time":true,"lock_file":"benchmarks/cuda/qwen35_wayfinder/.bench_qwen35_cuda_wayfinder.lock","retro_backfill_inference":"off","model_path":"/home/hmbown/HF_Models/Qwen3.5-9B","device":"cuda","gpu":"NVIDIA GB10","device_capability":[12,1],"torch":"2.10.0+cu130","transformers":"5.3.0","path":"sparse","strategy":"random","compute_graph_metrics":true,"forward_target":"backbone","window":64,"landmark_stride":64,"num_cycles":1,"engine_request":"auto","warmup":1,"repeats":1,"seq_lens":[2048],"kernel_log_since":"2026-03-18 16:30:05"},"metrics":{"status":"completed","artifact":"benchmarks/cuda/qwen35_wayfinder/EXP-20260318T213005Z-QWEN35CUDA-SPARSE-2048.ndjson","dense":{"median_ms":1231.7,"prefill_tok_per_sec":1662.7,"peak_mem_gb":17.11},"wayfinder":{"median_ms":2946.04,"prefill_tok_per_sec":695.2,"peak_mem_gb":26.45,"wayfinder_active_layers":8,"wayfinder_graph_cache_entries_total":8},"delta_vs_dense_abs":{"median_ms":1714.34,"prefill_tok_per_sec":-967.5,"peak_mem_gb":9.34},"delta_vs_dense_pct":{"median_ms":139.18,"prefill_tok_per_sec":-58.19,"peak_mem_gb":54.59},"memory_reduction_pct_convention":"100*(1-wayfinder/dense)","memory_reduction_pct":-54.59,"delta_vs_perm_baseline_abs":{"median_ms":1114.29,"prefill_tok_per_sec":-422.9,"peak_mem_gb":5.13},"delta_vs_perm_baseline_pct":{"median_ms":60.83,"prefill_tok_per_sec":-37.82,"peak_mem_gb":24.06},"graph_metrics":{"graph_source":"runtime","degree_mean":81.3873291015625,"max_degree":98,"shortcut_rate":0.9984130859375,"reachability_proxy":2047.99560546875,"edge_type_counts":{"cycle":16384,"window":515422,"landmark":134919,"rewire":0}},"kernel_fault_lines_after_start":0},"decision":"keep","next_action":"Continue the bounded sparse ladder to T=4096 only, same controls and stop-gates."}
{"id":"EXP-20260318T213717Z-QWEN35CUDA-SPARSE-4096-PRERUN","date":"2026-03-18","question":"After a clean sparse T=2048 checkpoint, does the same path=sparse configuration remain stable and semantically intact at T=4096 without any new current-boot NVIDIA or OOM kernel events?","hypothesis":"T=4096 should still complete cleanly on the true sparse path, keep 8/8 active Wayfinder layers, and continue to report path='sparse', graph_source='runtime', and non-null graph metrics on every active profile. Peak memory should rise materially, but remain well below device capacity if the scaling trend stays smooth.","change_set":["measurement-only"],"command":".venv/bin/python scripts/bench_qwen35_cuda_wayfinder.py --model-path /home/hmbown/HF_Models/Qwen3.5-9B --seq-lens 4096 --path sparse --strategy random --compute-graph-metrics --engine auto --warmup 1 --repeats 1 --forward-target backbone --phases dense wayfinder --skip-divergence --output benchmarks/cuda/qwen35_wayfinder/EXP-20260318T213717Z-QWEN35CUDA-SPARSE-4096.ndjson && journalctl -b -k --since '2026-03-18 16:37:17' | rg -n 'NVRM|Xid|Out of memory|hung task|BUG:|Call Trace'","controls":{"baseline_run_path":"benchmarks/cuda/qwen35_wayfinder/EXP-20260318T213005Z-QWEN35CUDA-SPARSE-2048.ndjson","one_process_at_a_time":true,"lock_file":"benchmarks/cuda/qwen35_wayfinder/.bench_qwen35_cuda_wayfinder.lock","retro_backfill_inference":"off","model_path":"/home/hmbown/HF_Models/Qwen3.5-9B","device":"cuda","gpu":"NVIDIA GB10","device_capability":[12,1],"torch":"2.10.0+cu130","transformers":"5.3.0","path":"sparse","strategy":"random","compute_graph_metrics":true,"forward_target":"backbone","window":64,"landmark_stride":64,"num_cycles":1,"engine_request":"auto","warmup":1,"repeats":1,"seq_lens":[4096],"kernel_log_since":"2026-03-18 16:37:17"},"metrics":{"status":"pending","artifacts_expected":["benchmarks/cuda/qwen35_wayfinder/EXP-20260318T213717Z-QWEN35CUDA-SPARSE-4096.ndjson"],"required":["bench[label=dense].median_ms","bench[label=dense].prefill_tok_per_sec","bench[label=dense].peak_mem_gb","bench[label=wayfinder].median_ms","bench[label=wayfinder].prefill_tok_per_sec","bench[label=wayfinder].peak_mem_gb","bench[label=wayfinder].wayfinder_profiles","bench[label=wayfinder].wayfinder_profiles[].path==sparse","bench[label=wayfinder].wayfinder_profiles[].graph_metrics not all null","zero new kernel fault lines after kernel_log_since"]},"decision":"pending","next_action":"Run the sparse 4096 checkpoint, inspect the artifact for sparse-path graph metrics and active layers, and stop immediately if any new kernel fault appears."}
{"id":"EXP-20260318T213717Z-QWEN35CUDA-SPARSE-4096-RESULT","date":"2026-03-18","question":"After a clean sparse T=2048 checkpoint, does the same path=sparse configuration remain stable and semantically intact at T=4096 without any new current-boot NVIDIA or OOM kernel events?","hypothesis":"T=4096 should still complete cleanly on the true sparse path, keep 8/8 active Wayfinder layers, and continue to report path='sparse', graph_source='runtime', and non-null graph metrics on every active profile. Peak memory should rise materially, but remain well below device capacity if the scaling trend stays smooth.","change_set":["measurement-only","notes/LAB_NOTEBOOK.md","notes/experiments.ndjson"],"command":".venv/bin/python scripts/bench_qwen35_cuda_wayfinder.py --model-path /home/hmbown/HF_Models/Qwen3.5-9B --seq-lens 4096 --path sparse --strategy random --compute-graph-metrics --engine auto --warmup 1 --repeats 1 --forward-target backbone --phases dense wayfinder --skip-divergence --output benchmarks/cuda/qwen35_wayfinder/EXP-20260318T213717Z-QWEN35CUDA-SPARSE-4096.ndjson && journalctl -b -k --since '2026-03-18 16:37:17' | rg -n 'NVRM|Xid|Out of memory|hung task|BUG:|Call Trace'","controls":{"baseline_run_path":"benchmarks/cuda/qwen35_wayfinder/EXP-20260318T213005Z-QWEN35CUDA-SPARSE-2048.ndjson","one_process_at_a_time":true,"lock_file":"benchmarks/cuda/qwen35_wayfinder/.bench_qwen35_cuda_wayfinder.lock","retro_backfill_inference":"off","model_path":"/home/hmbown/HF_Models/Qwen3.5-9B","device":"cuda","gpu":"NVIDIA GB10","device_capability":[12,1],"torch":"2.10.0+cu130","transformers":"5.3.0","path":"sparse","strategy":"random","compute_graph_metrics":true,"forward_target":"backbone","window":64,"landmark_stride":64,"num_cycles":1,"engine_request":"auto","warmup":1,"repeats":1,"seq_lens":[4096],"kernel_log_since":"2026-03-18 16:37:17"},"metrics":{"status":"aborted_after_dense_only","artifact":"benchmarks/cuda/qwen35_wayfinder/EXP-20260318T213717Z-QWEN35CUDA-SPARSE-4096.ndjson","dense":{"median_ms":2539.01,"prefill_tok_per_sec":1613.2,"peak_mem_gb":17.54},"wayfinder":{"row_emitted":false},"kernel_fault_lines_after_start":0,"runtime_observation":{"approx_wall_seconds_before_interrupt":713,"process_cpu_pct":101.0,"gpu_compute_app_mem_mib":51953},"non_inference_diagnosis":{"construct_only_t4096_s":0.62,"graph_metrics_t1024_s":3.115,"graph_metrics_t2048_s":14.561,"graph_metrics_t4096_s":75.802,"interpretation":"graph_metrics on cache-miss warmup dominates wall time and is repeated per swapped layer when compute_graph_metrics=true"}},"decision":"follow-up","next_action":"Do not rerun T=4096 with compute_graph_metrics enabled until static graph/metric work is shared across layers or graph-metric computation is gated to a cheaper single-shot path."}
