{"id":"EXP-20260213T230717Z-PHASE0-BASELINE-TRUTH-LOCK-RESULT","date":"2026-02-13","question":"Can we complete the Phase 0 stop-gate (facts vs assumptions memo, behavior map, risk register, SQL todo orchestration) without running inference or benchmarks?","hypothesis":"A strict no-inference analysis cycle can close Phase 0 by consolidating existing evidence, creating SQL todo orchestration, and freezing an executable run queue with stop gates.","change_set":["notes/PHASE0_BASELINE_TRUTH_LOCK_20260213.md","notes/todos.sqlite3","notes/HANDOFF_20260213_PHASE0.md","notes/LAB_NOTEBOOK.md","notes/experiments.ndjson"],"command":"Executed SQL todo bootstrap/seed/dependency setup and ready-queue checks; updated documentation artifacts only (no inference/benchmark runs).","controls":{"no_inference":true,"no_benchmark":true,"no_finetune":true,"evidence_format":"file:line","retro_backfill_inference_default_off":true},"metrics":{"artifacts":["notes/PHASE0_BASELINE_TRUTH_LOCK_20260213.md","notes/HANDOFF_20260213_PHASE0.md","notes/todos.sqlite3"],"sql_before":{"pending_todos":6,"ready_queue":["baseline-truth-lock"]},"sql_after":{"pending_todos":5,"ready_queue":["runtime-path-observability"]},"executed_inference_commands":0,"executed_benchmark_commands":0},"decision":"keep","next_action":"Begin Phase 1 runtime-path-observability using the prepared queue and stop gates from notes/PHASE0_BASELINE_TRUTH_LOCK_20260213.md."}
{"id":"EXP-20260214T052401Z-PHASE1-RUNTIME-PATH-OBSERVABILITY-PRERUN","date":"2026-02-14","question":"Can we make runtime path/fallback behavior machine-observable for dense, wayfinder/permute, and sparse runs without requiring --hsa-trace sample dumps?","hypothesis":"Always-on compact path/fallback summaries, plus explicit dense baseline path markers when no Wayfinder layers are active, will make fallback share known by default and prevent hidden dense routing from being mistaken as HCSA gains.","change_set":["scripts/bench_glm_consumer_mlx.py","scripts/bench_qwen_consumer_mlx.py","notes/LAB_NOTEBOOK.md","notes/experiments.ndjson"],"command":"python3 -m py_compile scripts/bench_glm_consumer_mlx.py scripts/bench_qwen_consumer_mlx.py && python3 scripts/bench_glm_consumer_mlx.py --help && python3 scripts/bench_qwen_consumer_mlx.py --help","controls":{"no_inference":true,"no_benchmark":true,"no_finetune":true,"hsa_trace_verbose_samples_optional":true,"compact_summary_always_on":true},"metrics":{"status":"pending","required":["single_turn[].hsa_trace_summary.path_counts","single_turn[].hsa_trace_summary.dense_fallback_reason_counts","single_turn[].dense_fallback_share_run","single_turn[].dense_fallback_share_decode_steps","single_turn[].observability_fallback_share_known","dense_mode_explicit_path_counts"]},"decision":"pending","next_action":"Implement runtime observability patch in both consumer scripts, run static validation commands, then append RESULT entry with field verification."}
{"id":"EXP-20260214T052401Z-PHASE1-RUNTIME-PATH-OBSERVABILITY-RESULT","date":"2026-02-14","question":"Can we make runtime path/fallback behavior machine-observable for dense, wayfinder/permute, and sparse runs without requiring --hsa-trace sample dumps?","hypothesis":"Always-on compact path/fallback summaries, plus explicit dense baseline path markers when no Wayfinder layers are active, will make fallback share known by default and prevent hidden dense routing from being mistaken as HCSA gains.","change_set":["scripts/bench_glm_consumer_mlx.py","scripts/bench_qwen_consumer_mlx.py","notes/LAB_NOTEBOOK.md","notes/experiments.ndjson"],"command":"python3 -m py_compile scripts/bench_glm_consumer_mlx.py scripts/bench_qwen_consumer_mlx.py && python3 scripts/bench_glm_consumer_mlx.py --help >/dev/null && python3 scripts/bench_qwen_consumer_mlx.py --help >/dev/null","controls":{"no_inference":true,"no_benchmark":true,"no_finetune":true,"hsa_trace_verbose_samples_optional":true,"compact_summary_always_on":true},"metrics":{"validation":{"commands_passed_abs":3,"commands_total_abs":3,"commands_failed_abs":0,"commands_failed_delta_vs_baseline_abs":0,"commands_failed_delta_vs_baseline_pct":0.0},"field_verification":{"glm_summary":{"dense_fallback_share_run":"scripts/bench_glm_consumer_mlx.py:220","dense_fallback_share_decode_steps":"scripts/bench_glm_consumer_mlx.py:227","fallback_share_known":"scripts/bench_glm_consumer_mlx.py:233"},"qwen_summary":{"dense_fallback_share_run":"scripts/bench_qwen_consumer_mlx.py:239","dense_fallback_share_decode_steps":"scripts/bench_qwen_consumer_mlx.py:246","fallback_share_known":"scripts/bench_qwen_consumer_mlx.py:252"},"glm_row":{"dense_fallback_share_run":"scripts/bench_glm_consumer_mlx.py:602","dense_fallback_share_decode_steps":"scripts/bench_glm_consumer_mlx.py:603","observability_fallback_share_known":"scripts/bench_glm_consumer_mlx.py:604"},"qwen_row":{"dense_fallback_share_run":"scripts/bench_qwen_consumer_mlx.py:623","dense_fallback_share_decode_steps":"scripts/bench_qwen_consumer_mlx.py:624","observability_fallback_share_known":"scripts/bench_qwen_consumer_mlx.py:625"},"default_path_snapshots":{"glm_prefill":"scripts/bench_glm_consumer_mlx.py:335","glm_decode":"scripts/bench_glm_consumer_mlx.py:415","qwen_prefill":"scripts/bench_qwen_consumer_mlx.py:356","qwen_decode":"scripts/bench_qwen_consumer_mlx.py:436"}}},"decision":"keep","next_action":"Run paired dense/wayfinder/sparse benchmark matrix and require observability_fallback_share_known=true before accepting any performance claim."}
{"id":"EXP-20260214T053337Z-PHASE1-HANDOFF-RESULT","date":"2026-02-14","question":"Did this cycle produce the required short handoff memo with completed items, blockers, and next ready todo IDs?","hypothesis":"If SQL todo state and cycle artifacts are up to date, the handoff memo can be generated directly without running inference.","change_set":["notes/HANDOFF_20260214_PHASE1.md"],"command":"sqlite3 notes/todos.sqlite3 bootstrap query + ready queue query; author notes/HANDOFF_20260214_PHASE1.md","controls":{"no_inference":true,"no_benchmark":true,"no_finetune":true},"metrics":{"handoff_memo_created_abs":1,"handoff_memo_delta_vs_baseline_abs":1,"next_ready_todo_ids":["hcsa-kernel-optimization"]},"decision":"keep","next_action":"Begin Phase 2 kernel/implementation optimization loop with hypothesis-first PRERUN entries per run."}
{"id":"EXP-20260215T172430Z-QWEN-HORIZON-FIX-RESULT","date":"2026-02-15","question":"Does porting GLM fast-graph horizon logic to Qwen preserve correctness under the full test suite?","hypothesis":"Adding _fast_graph_build and prioritizing it in _adaptive_graph_seq_len prevents fast-permute decode horizon oversizing without regressions.","change_set":["hcsa/integrations/qwen_mlx.py: add _fast_graph_build","hcsa/integrations/qwen_mlx.py: prioritize fast-graph early return in _adaptive_graph_seq_len"],"command":"python3 -m pytest tests/ -x -q","controls":{"test_scope":"tests/","stop_on_first_failure":true},"metrics":{"tests_collected_abs":247,"tests_passed_abs":247,"tests_failed_abs":0,"warnings_abs":3},"decision":"keep","next_action":"Execute Qwen3-30B long-decode and perf replication campaigns with pre-registered protocols."}
{"id":"EXP-20260215T172430Z-QWEN30B-LONG-DECODE-PRERUN","date":"2026-02-15","question":"With Qwen3-30B-A3B-4bit, does Wayfinder default remain near-identical to dense across decode lengths 256/512/1024?","hypothesis":"At W=64 and short prompts, Wayfinder default should match dense closely with high token overlap and no systematic late-window drift.","change_set":["/tmp/test_qwen30b_long_decode.py benchmark harness"],"command":"python3 /tmp/test_qwen30b_long_decode.py 2>&1 | tee benchmarks/mlx/qwen3_30b_a3b_wayfinder/long_decode_log.txt","controls":{"model":"mlx-community/Qwen3-30B-A3B-4bit","decode_lengths":[256,512,1024],"prompt_count":5,"decode_mode":"greedy","retro_backfill_default_inference_off":true},"metrics":{"status":"pending","required":["match_rate","first_divergence_at","windowed_match_rates","overall_average_match_rate","overall_worst_match_rate"]},"decision":"pending","next_action":"Run long-decode script, then record RESULT with pass/fail against drift criteria."}
{"id":"EXP-20260215T172430Z-QWEN30B-PERF-PRERUN","date":"2026-02-15","question":"At seq_len 2048/8192 decode_len=256, is Wayfinder default faster and/or lower-memory than dense on Qwen3-30B-A3B-4bit?","hypothesis":"Wayfinder should improve or match dense E2E at 8192 due to faster sparse prefill, with possibly mixed results at 2048.","change_set":["measurement only"],"command":"dense: python3 scripts/bench_qwen_consumer_mlx.py --model-path mlx-community/Qwen3-30B-A3B-4bit --mode dense --skip-quality --skip-multi-turn --seq-lens 2048 8192 --decode-len 256 --repeats 1 --cooldown-sec 10 --out-dir benchmarks/mlx/qwen3_30b_a3b_wayfinder/perf_dense ; wayfinder: python3 scripts/bench_qwen_consumer_mlx.py --model-path mlx-community/Qwen3-30B-A3B-4bit --mode wayfinder --skip-quality --skip-multi-turn --seq-lens 2048 8192 --decode-len 256 --repeats 1 --cooldown-sec 10 --out-dir benchmarks/mlx/qwen3_30b_a3b_wayfinder/perf_wayfinder","controls":{"model":"mlx-community/Qwen3-30B-A3B-4bit","seq_lens":[2048,8192],"decode_len":256,"repeats":1,"skip_quality":true,"skip_multi_turn":true},"metrics":{"status":"pending","required":["e2e_sec","ttft_sec","itl_p95_sec","decode_tok_s","peak_memory_bytes","delta_vs_dense_abs","delta_vs_dense_pct","memory_reduction_pct_convention"]},"decision":"pending","next_action":"Run dense and wayfinder perf commands and record RESULT with absolute/delta/% metrics."}
{"id":"EXP-20260215T175202Z-GLM47-LONGCTX-QUALITY-PRERUN","date":"2026-02-15","question":"At long contexts, does Wayfinder prefill plus dense decode stay close enough to dense quality on GLM-4.7-Flash-4bit?","hypothesis":"With decode backend fixed to dense, Wayfinder should remain near dense quality while retaining viable long-context runtime.","change_set":["measurement only"],"command":"dense: python3 scripts/bench_glm_consumer_mlx.py --model-path mlx-community/GLM-4.7-Flash-4bit --mode dense --seq-lens 32768 65536 --decode-len 256 --repeats 1 --chunk-size 4096 --kv-step 4096 --cooldown-sec 0 --quality-dataset benchmarks/mlx/glm_4_7_flash_4bit_wayfinder/quality_eval_glm47_consumer_v1.json --skip-multi-turn --out-dir benchmarks/mlx/glm_4_7_flash_4bit_wayfinder/20260215_glm47_longctx_dense ; wayfinder: python3 scripts/bench_glm_consumer_mlx.py --model-path mlx-community/GLM-4.7-Flash-4bit --mode wayfinder --debug-wayfinder-decode-backend dense --seq-lens 32768 65536 --decode-len 256 --repeats 1 --chunk-size 4096 --kv-step 4096 --cooldown-sec 0 --window 64 --landmark-stride 0 --head-chunk-size 2 --query-chunk-size 192 --quality-dataset benchmarks/mlx/glm_4_7_flash_4bit_wayfinder/quality_eval_glm47_consumer_v1.json --skip-multi-turn --out-dir benchmarks/mlx/glm_4_7_flash_4bit_wayfinder/20260215_glm47_longctx_wayfinder_dense_decode","controls":{"model":"mlx-community/GLM-4.7-Flash-4bit","quality_dataset":"benchmarks/mlx/glm_4_7_flash_4bit_wayfinder/quality_eval_glm47_consumer_v1.json","seq_lens":[32768,65536],"decode_len":256,"repeats":1,"skip_multi_turn":true,"wayfinder_decode_backend":"dense"},"metrics":{"status":"pending","required":["quality_accuracy_abs","e2e_sec","ttft_sec","itl_p95_sec","decode_tok_s","peak_memory_bytes","delta_vs_dense_abs","delta_vs_dense_pct","memory_reduction_pct_convention"]},"decision":"pending","next_action":"Execute dense and wayfinder runs and record RESULT with long-context fidelity verdict."}
{"id":"EXP-20260215T172430Z-QWEN30B-LONG-DECODE-RESULT","date":"2026-02-15","question":"With Qwen3-30B-A3B-4bit, does Wayfinder default remain near-identical to dense across decode lengths 256/512/1024?","hypothesis":"At W=64 and short prompts, Wayfinder default should match dense closely with high token overlap and no systematic late-window drift.","change_set":["/tmp/test_qwen30b_long_decode.py benchmark harness"],"command":"python3 /tmp/test_qwen30b_long_decode.py 2>&1 | tee benchmarks/mlx/qwen3_30b_a3b_wayfinder/long_decode_log.txt","controls":{"model":"mlx-community/Qwen3-30B-A3B-4bit","decode_lengths":[256,512,1024],"prompt_count":5,"decode_mode":"greedy","retro_backfill_default_inference_off":true},"metrics":{"status":"blocked_redirect","artifacts":["benchmarks/mlx/qwen3_30b_a3b_wayfinder/long_decode_log.txt"],"missing_artifacts":["benchmarks/mlx/qwen3_30b_a3b_wayfinder/long_decode_quality.json"],"observed_output":["Swapped 48 layers, fast_graph_build=True","Loading dense model..."],"termination":"interrupted after user-priority redirect to GLM-first long-context validation"},"decision":"follow-up","next_action":"Resume full Qwen long-decode matrix after GLM long-context campaign."}
{"id":"EXP-20260215T172430Z-QWEN30B-PERF-RESULT","date":"2026-02-15","question":"At seq_len 2048/8192 decode_len=256, is Wayfinder default faster and/or lower-memory than dense on Qwen3-30B-A3B-4bit?","hypothesis":"Wayfinder should improve or match dense E2E at 8192 due to faster sparse prefill, with possibly mixed results at 2048.","change_set":["measurement only"],"command":"dense+wayfinder paired benchmark campaign (interrupted before pair completion)","controls":{"model":"mlx-community/Qwen3-30B-A3B-4bit","seq_lens":[2048,8192],"decode_len":256,"repeats":1,"skip_quality":true,"skip_multi_turn":true},"metrics":{"status":"aborted_redirect","partial_observation":"dense run started and produced early progress, but no complete dense-vs-wayfinder pair was produced","valid_comparison":false},"decision":"follow-up","next_action":"Re-run paired Qwen dense/wayfinder perf campaign after GLM-first milestone."}
{"id":"EXP-20260215T175202Z-GLM47-LONGCTX-QUALITY-RESULT","date":"2026-02-15","question":"At long contexts, does Wayfinder prefill plus dense decode stay close enough to dense quality on GLM-4.7-Flash-4bit?","hypothesis":"With decode backend fixed to dense, Wayfinder should remain near dense quality while retaining viable long-context runtime.","change_set":["measurement only"],"command":"dense then wayfinder (dense decode backend) at seq_len 32768/65536, decode_len 256, quality dataset v1","controls":{"model":"mlx-community/GLM-4.7-Flash-4bit","quality_dataset":"benchmarks/mlx/glm_4_7_flash_4bit_wayfinder/quality_eval_glm47_consumer_v1.json","seq_lens":[32768,65536],"decode_len":256,"repeats":1,"skip_multi_turn":true,"wayfinder_decode_backend":"dense","dense_result_path":"benchmarks/mlx/glm_4_7_flash_4bit_wayfinder/20260215_glm47_longctx_dense_rerun1/results.json","wayfinder_result_path":"benchmarks/mlx/glm_4_7_flash_4bit_wayfinder/20260215_glm47_longctx_wayfinder_dense_decode/results.json"},"metrics":{"seq32768":{"dense":{"e2e_sec":169.72494679206284,"ttft_sec":4.602589917019475,"itl_p95_sec":0.03480533399898565,"decode_tok_s":1.5501081511574196,"peak_memory_bytes":26017775484},"wayfinder":{"e2e_sec":205.62950666603865,"ttft_sec":12.407092208042275,"itl_p95_sec":0.03678166700457223,"decode_tok_s":1.3248153068772776,"peak_memory_bytes":26021249644},"delta_vs_dense":{"e2e_sec":35.90455987397581,"e2e_pct":21.154461080919403,"decode_tok_s":-0.22529284428014205,"decode_tok_s_pct":-14.534580765822257,"peak_memory_bytes":3474160,"peak_memory_bytes_pct":0.013352978691757727,"memory_reduction_pct_convention":-0.013352978691754869}},"seq65536":{"dense":{"e2e_sec":990.9597795410082,"ttft_sec":35.71485812502261,"itl_p95_sec":0.055178125010104385,"decode_tok_s":0.26798861156851103,"peak_memory_bytes":33160809276},"wayfinder":{"e2e_sec":1217.5312910830257,"ttft_sec":31.344199583982117,"itl_p95_sec":0.056226833005435765,"decode_tok_s":0.2158215589891048,"peak_memory_bytes":33164283436},"delta_vs_dense":{"e2e_sec":226.57151154201757,"e2e_pct":22.8639406046853,"decode_tok_s":-0.05216705257940624,"decode_tok_s_pct":-19.466307662838123,"peak_memory_bytes":3474160,"peak_memory_bytes_pct":0.010476127332747625,"memory_reduction_pct_convention":-0.010476127332758973}},"quality":{"dense":{"correct":3,"num_tasks":6,"accuracy":0.5},"wayfinder":{"correct":3,"num_tasks":6,"accuracy":0.5},"delta_vs_dense":{"accuracy_abs":0.0,"accuracy_pct":0.0}}},"decision":"keep_quality_followup_perf","next_action":"Optimize wayfinder prefill runtime at 65k while preserving dense decode backend, then rerun same protocol."}
{"id":"EXP-20260215T184939Z-GLM47-TASKAWARE-FORMULA-PRERUN","date":"2026-02-15","question":"If fixed benchmark knobs are replaced with context/task-aware settings, does Wayfinder prefill plus dense decode close runtime gap while maintaining quality parity vs dense at 32k/65k?","hypothesis":"Task-aware scaling of decode_len/chunk/cache/window/chunking will improve long-context runtime behavior relative to fixed constants without degrading 6-task quality parity.","change_set":["measurement only"],"command":"sequential one-at-a-time runs: dense+wayfinder@32768 then dense+wayfinder@65536 using derived per-context params","controls":{"model":"mlx-community/GLM-4.7-Flash-4bit","quality_dataset":"benchmarks/mlx/glm_4_7_flash_4bit_wayfinder/quality_eval_glm47_consumer_v1.json","repeats":1,"skip_multi_turn":true,"wayfinder_decode_backend":"dense","formula":{"decode_len":"min(256,max(128,T//256))","chunk_size":"min(8192,max(4096,T//8))","kv_step":"chunk_size","window":"min(128,max(64,T//512))","landmark_stride":"2*window","head_chunk_size":"2","query_chunk_size":"min(256,max(192,T//256))"},"derived":{"32768":{"decode_len":128,"chunk_size":4096,"kv_step":4096,"window":64,"landmark_stride":128,"head_chunk_size":2,"query_chunk_size":192},"65536":{"decode_len":256,"chunk_size":8192,"kv_step":8192,"window":128,"landmark_stride":256,"head_chunk_size":2,"query_chunk_size":256}}},"metrics":{"status":"pending","required":["e2e_sec","ttft_sec","itl_p95_sec","decode_tok_s","peak_memory_bytes","quality_accuracy_abs","delta_vs_dense_abs","delta_vs_dense_pct","memory_reduction_pct_convention"]},"decision":"pending","next_action":"Run four sequential benchmarks and compute dense-vs-wayfinder deltas per context."}
{"id":"EXP-20260215T184939Z-GLM47-TASKAWARE-FORMULA-RESULT","date":"2026-02-15","question":"If fixed benchmark knobs are replaced with context/task-aware settings, does Wayfinder prefill plus dense decode close runtime gap while maintaining quality parity vs dense at 32k/65k?","hypothesis":"Task-aware scaling of decode_len/chunk/cache/window/chunking will improve long-context runtime behavior relative to fixed constants without degrading 6-task quality parity.","change_set":["measurement only"],"command":"four sequential runs (one-at-a-time): dense/wayfinder at T=32768 and dense/wayfinder at T=65536 using derived formula parameters","controls":{"model":"mlx-community/GLM-4.7-Flash-4bit","quality_dataset":"benchmarks/mlx/glm_4_7_flash_4bit_wayfinder/quality_eval_glm47_consumer_v1.json","repeats":1,"skip_multi_turn":true,"wayfinder_decode_backend":"dense","derived":{"32768":{"decode_len":128,"chunk_size":4096,"kv_step":4096,"window":64,"landmark_stride":128,"head_chunk_size":2,"query_chunk_size":192},"65536":{"decode_len":256,"chunk_size":8192,"kv_step":8192,"window":128,"landmark_stride":256,"head_chunk_size":2,"query_chunk_size":256}},"result_paths":{"dense_t32768":"benchmarks/mlx/glm_4_7_flash_4bit_wayfinder/20260215_glm47_taskaware_formula/dense_t32768/results.json","wayfinder_t32768":"benchmarks/mlx/glm_4_7_flash_4bit_wayfinder/20260215_glm47_taskaware_formula/wayfinder_t32768/results.json","dense_t65536":"benchmarks/mlx/glm_4_7_flash_4bit_wayfinder/20260215_glm47_taskaware_formula/dense_t65536/results.json","wayfinder_t65536":"benchmarks/mlx/glm_4_7_flash_4bit_wayfinder/20260215_glm47_taskaware_formula/wayfinder_t65536/results.json"}},"metrics":{"t32768":{"dense":{"e2e_sec":162.05948720802553,"ttft_sec":4.6309735419927165,"itl_p95_sec":0.03531841700896621,"decode_tok_s":14.198404726397193,"peak_memory_bytes":26017775484,"quality_accuracy":0.5},"wayfinder":{"e2e_sec":153.87165504100267,"ttft_sec":3.6981205830234103,"itl_p95_sec":0.03678283398039639,"decode_tok_s":15.512119209900534,"peak_memory_bytes":26021216876,"quality_accuracy":0.5},"delta_vs_dense":{"e2e_sec":-8.187832167022862,"e2e_pct":-5.052362134475138,"decode_tok_s":1.3137144835033414,"decode_tok_s_pct":9.25254990837758,"peak_memory_bytes":3441392,"peak_memory_bytes_pct":0.013227080086521358,"memory_reduction_pct_convention":-0.01322708008653084,"quality_accuracy_abs":0.0,"quality_accuracy_pct":0.0}},"t65536":{"dense":{"e2e_sec":955.0680449579377,"ttft_sec":81.057607499999,"itl_p95_sec":0.05593158403644338,"decode_tok_s":2.6844197868148267,"peak_memory_bytes":43609489218,"quality_accuracy":0.5},"wayfinder":{"e2e_sec":1053.304471624957,"ttft_sec":79.934603917005,"itl_p95_sec":0.05694183398736641,"decode_tok_s":2.6525481991166204,"peak_memory_bytes":43612766770,"quality_accuracy":0.5},"delta_vs_dense":{"e2e_sec":98.23642666701926,"e2e_pct":10.285803947230347,"decode_tok_s":-0.031871587698206305,"decode_tok_s_pct":-1.1872803149027313,"peak_memory_bytes":3277552,"peak_memory_bytes_pct":0.007515685367502944,"memory_reduction_pct_convention":-0.00751568536749847,"quality_accuracy_abs":0.0,"quality_accuracy_pct":0.0}},"quality_summary":{"dense_t32768":{"correct":3,"num_tasks":6,"accuracy":0.5},"wayfinder_t32768":{"correct":3,"num_tasks":6,"accuracy":0.5},"dense_t65536":{"correct":3,"num_tasks":6,"accuracy":0.5},"wayfinder_t65536":{"correct":3,"num_tasks":6,"accuracy":0.5}}},"decision":"follow-up","next_action":"Run a 65k-only micro-sweep over window/landmark_stride/query_chunk_size with dense decode backend fixed, preserving same quality dataset and one-at-a-time execution."}
