{"id":"EXP-20260318T175055Z-QWEN35CUDA-LONGRUN-HARDENING-RESULT","date":"2026-03-18","question":"Can we harden the Qwen CUDA long-context benchmark so it does not silently lose intermediate results or accumulate avoidable memory across sequence lengths?","hypothesis":"Adding an exclusive lock, incremental NDJSON writes, resume support, backbone-only benchmarking, immediate output deletion, and per-seq Wayfinder graph-cache clearing will remove the main failure amplifiers seen in the crash investigation and let us restart long sweeps safely.","change_set":["scripts/bench_qwen35_cuda_wayfinder.py","notes/LAB_NOTEBOOK.md","notes/experiments.ndjson"],"command":".venv/bin/python -m py_compile scripts/bench_qwen35_cuda_wayfinder.py && .venv/bin/python scripts/bench_qwen35_cuda_wayfinder.py --model-path /home/hmbown/HF_Models/Qwen3.5-9B --seq-lens 64 128 --engine flex --warmup 1 --repeats 1 --forward-target backbone --phases dense wayfinder --skip-divergence --output benchmarks/cuda/qwen35_wayfinder/EXP-20260318T-smoke-backbone.ndjson","controls":{"baseline_run_path":"benchmarks/cuda/qwen35_wayfinder/EXP-long-seq-Qwen3.5-9B.ndjson","one_process_at_a_time":true,"lock_file":"benchmarks/cuda/qwen35_wayfinder/.bench_qwen35_cuda_wayfinder.lock","retro_backfill_inference":"off","model_path":"/home/hmbown/HF_Models/Qwen3.5-9B","device":"cuda","gpu":"NVIDIA GB10","dtype":"bfloat16","engine":"flex","forward_target":"backbone","window":64,"landmark_stride":64,"num_cycles":1,"warmup":1,"repeats":1,"seq_lens":[64,128]},"metrics":{"status":"completed","artifacts":{"smoke_run":"benchmarks/cuda/qwen35_wayfinder/EXP-20260318T-smoke-backbone.ndjson"},"durability":{"meta_row_written_before_load":true,"dense_rows_present_before_wayfinder_load":true,"exclusive_lock_used":true},"per_t":{"64":{"dense":{"median_ms":144.58,"prefill_tok_per_sec":442.7,"peak_mem_gb":16.71},"wayfinder":{"median_ms":139.08,"prefill_tok_per_sec":460.2,"peak_mem_gb":16.72,"wayfinder_graph_cache_entries_total":8},"delta_wayfinder_minus_dense":{"median_ms_abs":-5.5,"median_ms_pct":-3.8,"prefill_tok_per_sec_abs":17.5,"prefill_tok_per_sec_pct":3.95,"peak_mem_gb_abs":0.01,"peak_mem_gb_pct":0.06,"memory_reduction_pct_convention":-0.06}},"128":{"dense":{"median_ms":159.09,"prefill_tok_per_sec":804.6,"peak_mem_gb":16.72},"wayfinder":{"median_ms":153.65,"prefill_tok_per_sec":833.0,"peak_mem_gb":16.75,"wayfinder_graph_cache_entries_total":8},"delta_wayfinder_minus_dense":{"median_ms_abs":-5.44,"median_ms_pct":-3.42,"prefill_tok_per_sec_abs":28.4,"prefill_tok_per_sec_pct":3.53,"peak_mem_gb_abs":0.03,"peak_mem_gb_pct":0.18,"memory_reduction_pct_convention":-0.18}}},"cache_control":{"cleared_entries_before_second_seq_len":8,"cleared_layers_before_second_seq_len":8}},"decision":"keep","next_action":"Launch the 16k/32k backbone comparison as dense-first followed by resume-wayfinder into the same artifact."}
{"id":"EXP-20260318T175055Z-QWEN35CUDA-BACKBONE-16K32K-PRERUN","date":"2026-03-18","question":"With the hardened backbone-only prefill path, how do default Qwen3.5 attention and Wayfinder compare at T=16384 and T=32768?","hypothesis":"Removing the full-logits allocation and clearing seq-length-specific Wayfinder graph caches should let the comparison complete cleanly at 16k/32k; Wayfinder may still lag at 16k but should narrow or reverse the gap by 32k.","change_set":["measurement-only"],"command":".venv/bin/python scripts/bench_qwen35_cuda_wayfinder.py --model-path /home/hmbown/HF_Models/Qwen3.5-9B --seq-lens 16384 32768 --engine flex --warmup 1 --repeats 3 --forward-target backbone --phases dense --skip-divergence --output benchmarks/cuda/qwen35_wayfinder/EXP-20260318T175055Z-QWEN35CUDA-BACKBONE-16K32K.ndjson && .venv/bin/python scripts/bench_qwen35_cuda_wayfinder.py --model-path /home/hmbown/HF_Models/Qwen3.5-9B --seq-lens 16384 32768 --engine flex --warmup 1 --repeats 3 --forward-target backbone --phases wayfinder --skip-divergence --resume --output benchmarks/cuda/qwen35_wayfinder/EXP-20260318T175055Z-QWEN35CUDA-BACKBONE-16K32K.ndjson","controls":{"baseline_run_path":"benchmarks/cuda/qwen35_wayfinder/EXP-20260318T-smoke-backbone.ndjson","comparison_baseline":"dense rows from the same output artifact at the same seq_len","one_process_at_a_time":true,"lock_file":"benchmarks/cuda/qwen35_wayfinder/.bench_qwen35_cuda_wayfinder.lock","retro_backfill_inference":"off","model_path":"/home/hmbown/HF_Models/Qwen3.5-9B","device":"cuda","gpu":"NVIDIA GB10","dtype":"bfloat16","engine":"flex","forward_target":"backbone","window":64,"landmark_stride":64,"num_cycles":1,"warmup":1,"repeats":3,"seq_lens":[16384,32768],"stop_gates":["nonzero exit from either command","missing dense or wayfinder row for T=16384 or T=32768","successful row missing prefill_tok_per_sec or peak_mem_gb","successful wayfinder row missing wayfinder_profiles or showing zero mode=wayfinder layers","resume append missing on second command"]},"metrics":{"status":"pending","artifacts_expected":["benchmarks/cuda/qwen35_wayfinder/EXP-20260318T175055Z-QWEN35CUDA-BACKBONE-16K32K.ndjson"],"required":["bench[label=dense].median_ms","bench[label=dense].prefill_tok_per_sec","bench[label=dense].peak_mem_gb","bench[label=wayfinder].median_ms","bench[label=wayfinder].prefill_tok_per_sec","bench[label=wayfinder].peak_mem_gb","bench[label=wayfinder].wayfinder_profiles"]},"decision":"pending","next_action":"Run dense first, resume Wayfinder into the same artifact, then append a RESULT entry with absolute metrics and deltas vs dense at each seq_len."}
{"id":"EXP-20260318T180911Z-QWEN35CUDA-CACHE-GUARD-SMOKE-PRERUN","date":"2026-03-18","question":"Do engine-specific graph-cache trimming plus explicit long-context guardrails harden the Qwen CUDA path enough to safely re-run a bounded T=16384 smoke after today’s reboot?","hypothesis":"Trimming the flex cache to the tensors it actually uses, capping retained graph-cache entries to 1, defaulting the benchmark back to forward_target=backbone, and rejecting unsafe long causal_lm runs without opt-in should remove the main avoidable memory amplifiers while preserving the successful 16k backbone path.","change_set":["hcsa/integrations/qwen_torch.py","hcsa/torch/attention_wayfinder_permute.py","scripts/bench_qwen35_cuda_wayfinder.py","scripts/serve_qwen_wayfinder_cuda.py"],"command":".venv/bin/python -m py_compile hcsa/integrations/qwen_torch.py hcsa/torch/attention_wayfinder_permute.py scripts/bench_qwen35_cuda_wayfinder.py scripts/serve_qwen_wayfinder_cuda.py && .venv/bin/python scripts/bench_qwen35_cuda_wayfinder.py --model-path /home/hmbown/HF_Models/Qwen3.5-9B --seq-lens 16384 --engine flex --warmup 1 --repeats 1 --forward-target backbone --phases dense wayfinder --skip-divergence --output benchmarks/cuda/qwen35_wayfinder/EXP-20260318T180911Z-QWEN35CUDA-CACHE-GUARD-SMOKE.ndjson && .venv/bin/python scripts/bench_qwen35_cuda_wayfinder.py --model-path /home/hmbown/HF_Models/Qwen3.5-9B --seq-lens 16384 --engine flex --warmup 1 --repeats 1 --forward-target causal_lm --phases dense --skip-divergence --output /tmp/EXP-20260318T180911Z-should-not-run.ndjson","controls":{"baseline_run_path":"benchmarks/cuda/qwen35_wayfinder/EXP-20260318T175055Z-QWEN35CUDA-BACKBONE-16K32K.ndjson","one_process_at_a_time":true,"lock_file":"benchmarks/cuda/qwen35_wayfinder/.bench_qwen35_cuda_wayfinder.lock","retro_backfill_inference":"off","model_path":"/home/hmbown/HF_Models/Qwen3.5-9B","device":"cuda","gpu":"NVIDIA GB10","dtype":"bfloat16","engine":"flex","forward_target":"backbone for the smoke run; causal_lm only for the refusal check","window":64,"landmark_stride":64,"num_cycles":1,"warmup":1,"repeats":1,"seq_lens":[16384],"stop_gates":["nonzero exit from py_compile","missing dense or wayfinder row for T=16384","successful row missing prefill_tok_per_sec or peak_mem_gb","successful wayfinder row missing wayfinder_profiles or showing zero mode=wayfinder layers","guard command exits 0","/tmp/EXP-20260318T180911Z-should-not-run.ndjson exists after the guard command"]},"metrics":{"status":"pending","artifacts_expected":["benchmarks/cuda/qwen35_wayfinder/EXP-20260318T180911Z-QWEN35CUDA-CACHE-GUARD-SMOKE.ndjson"],"required":["py_compile success","bench[label=dense].median_ms","bench[label=dense].prefill_tok_per_sec","bench[label=dense].peak_mem_gb","bench[label=wayfinder].median_ms","bench[label=wayfinder].prefill_tok_per_sec","bench[label=wayfinder].peak_mem_gb","bench[label=wayfinder].wayfinder_profiles","guard refusal on long causal_lm without --allow-large-logits"]},"decision":"pending","next_action":"Run the compile + 16k backbone smoke + refusal check, then append a RESULT entry with absolute metrics and deltas vs the dense row in the same artifact."}
{"id":"EXP-20260318T180911Z-QWEN35CUDA-CACHE-GUARD-SMOKE-RESULT","date":"2026-03-18","question":"Do engine-specific graph-cache trimming plus explicit long-context guardrails harden the Qwen CUDA path enough to safely re-run a bounded T=16384 smoke after today’s reboot?","hypothesis":"Trimming the flex cache to the tensors it actually uses, capping retained graph-cache entries to 1, defaulting the benchmark back to forward_target=backbone, and rejecting unsafe long causal_lm runs without opt-in should remove the main avoidable memory amplifiers while preserving the successful 16k backbone path.","change_set":["hcsa/integrations/qwen_torch.py","hcsa/torch/attention_wayfinder_permute.py","scripts/bench_qwen35_cuda_wayfinder.py","scripts/serve_qwen_wayfinder_cuda.py","notes/LAB_NOTEBOOK.md","notes/experiments.ndjson"],"command":".venv/bin/python -m py_compile hcsa/integrations/qwen_torch.py hcsa/torch/attention_wayfinder_permute.py scripts/bench_qwen35_cuda_wayfinder.py scripts/serve_qwen_wayfinder_cuda.py && .venv/bin/python scripts/bench_qwen35_cuda_wayfinder.py --model-path /home/hmbown/HF_Models/Qwen3.5-9B --seq-lens 16384 --engine flex --warmup 1 --repeats 1 --forward-target backbone --phases dense wayfinder --skip-divergence --output benchmarks/cuda/qwen35_wayfinder/EXP-20260318T180911Z-QWEN35CUDA-CACHE-GUARD-SMOKE.ndjson && .venv/bin/python scripts/bench_qwen35_cuda_wayfinder.py --model-path /home/hmbown/HF_Models/Qwen3.5-9B --seq-lens 16384 --engine flex --warmup 1 --repeats 1 --forward-target causal_lm --phases dense --skip-divergence --output /tmp/EXP-20260318T180911Z-guard-check.ndjson","controls":{"baseline_run_path":"benchmarks/cuda/qwen35_wayfinder/EXP-20260318T175055Z-QWEN35CUDA-BACKBONE-16K32K.ndjson","one_process_at_a_time":true,"lock_file":"benchmarks/cuda/qwen35_wayfinder/.bench_qwen35_cuda_wayfinder.lock","retro_backfill_inference":"off","model_path":"/home/hmbown/HF_Models/Qwen3.5-9B","device":"cuda","gpu":"NVIDIA GB10","dtype":"bfloat16","engine":"flex","forward_target":"backbone for the smoke run; causal_lm only for the refusal check","window":64,"landmark_stride":64,"num_cycles":1,"warmup":1,"repeats":1,"seq_lens":[16384]},"metrics":{"status":"completed","artifacts":{"smoke_run":"benchmarks/cuda/qwen35_wayfinder/EXP-20260318T180911Z-QWEN35CUDA-CACHE-GUARD-SMOKE.ndjson","guard_path_checked":"/tmp/EXP-20260318T180911Z-guard-check.ndjson"},"dense":{"path":"benchmarks/cuda/qwen35_wayfinder/EXP-20260318T180911Z-QWEN35CUDA-CACHE-GUARD-SMOKE.ndjson","mean":{"prefill_sec":8.84955,"prefill_tok_s":1851.4,"peak_memory_gb":20.08}},"wayfinder":{"path":"benchmarks/cuda/qwen35_wayfinder/EXP-20260318T180911Z-QWEN35CUDA-CACHE-GUARD-SMOKE.ndjson","mean":{"prefill_sec":8.5811,"prefill_tok_s":1909.3,"peak_memory_gb":20.15},"wayfinder_graph_cache_entries_total":8,"per_layer_graph_cache_entries":[1,1,1,1,1,1,1,1]},"delta_vs_dense_abs":{"prefill_sec":-0.26845,"prefill_tok_s":57.9,"peak_memory_gb":0.07},"delta_vs_dense_pct":{"prefill_sec":-3.03,"prefill_tok_s":3.13,"peak_memory_gb":0.35},"memory_reduction_pct_convention":"100*(1-wayfinder/dense)","memory_reduction_pct":-0.35,"guard_refusal":{"exit_code":1,"artifact_created":false,"message_contains":"Refusing long `causal_lm` prefill benchmark without explicit opt-in."}},"decision":"keep","next_action":"Use the hardened defaults for resumed backbone long-context sweeps, and if the user wants the MLX Qwen path stabilized next, trim the fused GQA expansion and cache retention there using the same evidence-driven approach."}
{"id":"EXP-20260318T181900Z-QWEN35CUDA-BACKBONE-32K64K128K-PRERUN","date":"2026-03-18","question":"At higher token counts, do the hardened Qwen3.5 CUDA backbone runs show the Wayfinder prefill benefit we expect at T=32768, 65536, and 131072?","hypothesis":"With the unsafe full-logits path removed and the flex cache trimmed to one retained graph entry per layer, Wayfinder should maintain or widen its prefill-latency advantage as T increases, while memory may remain near-neutral or slightly worse because only Qwen3.5’s 8 full-attention layers are swapped.","change_set":["measurement-only"],"command":".venv/bin/python scripts/bench_qwen35_cuda_wayfinder.py --model-path /home/hmbown/HF_Models/Qwen3.5-9B --seq-lens 32768 65536 131072 --engine flex --warmup 1 --repeats 1 --forward-target backbone --phases dense --skip-divergence --output benchmarks/cuda/qwen35_wayfinder/EXP-20260318T181900Z-QWEN35CUDA-BACKBONE-32K64K128K.ndjson && .venv/bin/python scripts/bench_qwen35_cuda_wayfinder.py --model-path /home/hmbown/HF_Models/Qwen3.5-9B --seq-lens 32768 65536 131072 --engine flex --warmup 1 --repeats 1 --forward-target backbone --phases wayfinder --skip-divergence --resume --output benchmarks/cuda/qwen35_wayfinder/EXP-20260318T181900Z-QWEN35CUDA-BACKBONE-32K64K128K.ndjson","controls":{"baseline_run_path":"benchmarks/cuda/qwen35_wayfinder/EXP-20260318T180911Z-QWEN35CUDA-CACHE-GUARD-SMOKE.ndjson","comparison_baseline":"dense rows from the same output artifact at the same seq_len","one_process_at_a_time":true,"lock_file":"benchmarks/cuda/qwen35_wayfinder/.bench_qwen35_cuda_wayfinder.lock","retro_backfill_inference":"off","model_path":"/home/hmbown/HF_Models/Qwen3.5-9B","device":"cuda","gpu":"NVIDIA GB10","dtype":"bfloat16","engine":"flex","forward_target":"backbone","window":64,"landmark_stride":64,"num_cycles":1,"warmup":1,"repeats":1,"seq_lens":[32768,65536,131072],"stop_gates":["nonzero exit from either command","missing dense or wayfinder row for T=32768, 65536, or 131072","successful row missing prefill_tok_per_sec or peak_mem_gb","successful wayfinder row missing wayfinder_profiles or showing zero mode=wayfinder layers","resume append missing on second command"]},"metrics":{"status":"pending","artifacts_expected":["benchmarks/cuda/qwen35_wayfinder/EXP-20260318T181900Z-QWEN35CUDA-BACKBONE-32K64K128K.ndjson"],"required":["bench[label=dense].median_ms","bench[label=dense].prefill_tok_per_sec","bench[label=dense].peak_mem_gb","bench[label=wayfinder].median_ms","bench[label=wayfinder].prefill_tok_per_sec","bench[label=wayfinder].peak_mem_gb","bench[label=wayfinder].wayfinder_profiles"]},"decision":"pending","next_action":"Run dense first, resume Wayfinder into the same artifact, then append a RESULT entry with absolute metrics and deltas vs dense at each seq_len."}
{"id":"EXP-20260318T201433Z-QWEN35CUDA-SAFETY-LOWTOKEN-PRERUN","date":"2026-03-18","question":"Can we make the Qwen3.5-9B CUDA path safer on this GB10 by refusing unsupported flex runs by default, while confirming the Wayfinder path still works on a low-token batched smoke and the current PyTorch test suite stays green?","hypothesis":"The current PyTorch build (2.10.0+cu130) advertises CUDA arch support only through sm_120, while the local GPU reports capability 12.1; guarding explicit flex requests should prevent the driver-level illegal-instruction path seen before the reboot, and a batched low-token smoke plus tests/pytorch should confirm that Wayfinder still functions on this machine without long-context inference.","change_set":["hcsa/integrations/qwen_torch.py","scripts/bench_qwen35_cuda_wayfinder.py","scripts/serve_qwen_wayfinder_cuda.py"],"command":".venv/bin/python -m py_compile hcsa/integrations/qwen_torch.py scripts/bench_qwen35_cuda_wayfinder.py scripts/serve_qwen_wayfinder_cuda.py && .venv/bin/python -m pytest tests/pytorch -q && .venv/bin/python scripts/bench_qwen35_cuda_wayfinder.py --model-path /home/hmbown/HF_Models/Qwen3.5-9B --seq-lens 64 128 --engine batched --warmup 1 --repeats 1 --forward-target backbone --phases dense wayfinder --skip-divergence --output benchmarks/cuda/qwen35_wayfinder/EXP-20260318T201433Z-QWEN35CUDA-LOWTOKEN-BATCHED.ndjson && .venv/bin/python scripts/bench_qwen35_cuda_wayfinder.py --model-path /home/hmbown/HF_Models/Qwen3.5-9B --seq-lens 64 --engine flex --warmup 1 --repeats 1 --forward-target backbone --phases dense --skip-divergence --output /tmp/EXP-20260318T201433Z-should-refuse.ndjson","controls":{"baseline_run_path":"benchmarks/cuda/qwen35_wayfinder/EXP-20260318T180911Z-QWEN35CUDA-CACHE-GUARD-SMOKE.ndjson","one_process_at_a_time":true,"lock_file":"benchmarks/cuda/qwen35_wayfinder/.bench_qwen35_cuda_wayfinder.lock","retro_backfill_inference":"off","model_path":"/home/hmbown/HF_Models/Qwen3.5-9B","device":"cuda","gpu":"NVIDIA GB10","device_capability":[12,1],"torch":"2.10.0+cu130","transformers":"5.3.0","torch_cuda_arch_list":["sm_80","sm_90","sm_100","sm_110","sm_120","compute_120"],"forward_target":"backbone","window":64,"landmark_stride":64,"num_cycles":1,"batched_smoke":{"engine":"batched","warmup":1,"repeats":1,"seq_lens":[64,128]},"stop_gates":["nonzero exit from py_compile","pytest failure in tests/pytorch","missing low-token dense or wayfinder row for T=64 or T=128","successful low-token row missing prefill_tok_per_sec or peak_mem_gb","successful wayfinder row missing wayfinder_profiles or showing zero mode=wayfinder layers","explicit flex refusal command exits 0","/tmp/EXP-20260318T201433Z-should-refuse.ndjson exists after the refusal command"]},"metrics":{"status":"pending","artifacts_expected":["benchmarks/cuda/qwen35_wayfinder/EXP-20260318T201433Z-QWEN35CUDA-LOWTOKEN-BATCHED.ndjson"],"required":["py_compile success","pytest tests/pytorch pass","bench[label=dense].median_ms","bench[label=dense].prefill_tok_per_sec","bench[label=dense].peak_mem_gb","bench[label=wayfinder].median_ms","bench[label=wayfinder].prefill_tok_per_sec","bench[label=wayfinder].peak_mem_gb","bench[label=wayfinder].wayfinder_profiles","guard refusal on explicit unsupported flex request"]},"decision":"pending","next_action":"Apply the safety guard, run tests and the batched low-token smoke, then append a RESULT entry before attempting any further flex inference on this machine."}
