{"id":"EXP-20260319T045153Z-QWEN35CUDA-SPARSE-STREAMED-DEGREE-PRERUN","date":"2026-03-19","question":"Can a streamed-neighbor Wayfinder/HCSA fast path lower long-context attn_kernel_ms and reopen the 16k ladder by eliminating the current full-neighborhood K/V and weight materialization hot spots?","hypothesis":"The current torch Wayfinder/HCSA kernel still pays a large constant factor because sparse_row_attention_gqa_chunked() in hcsa/torch/attention_wayfinder_sparse.py gathers full K_g and full V_g tensors for every query chunk over the entire neighborhood degree, then materializes a full [groups, query_chunk, degree] weight tensor before the V contraction. The older Qwen3.5 custom op in /home/hmbown/Projects/qwen/wayfinder-qwen3.5-9b/patches/sparse_attn_impl.cpp instead streamed neighbor rows, computed softmax over the streamed logits, and accumulated V directly without building full gathered K/V blocks. If the torch path adds a no-weights fast path that streams degree blocks with online softmax accumulation, and the auto chunk resolver budgets against streamed degree blocks instead of full degree, then per-tile temporary bytes should drop materially, the resolver should be able to choose less pathological long-context chunking, Wayfinder/HCSA attn_kernel_ms should fall at 4096 and 8192, and empirical kappa should improve versus the current tie-break anchor enough to reopen 16384 only if the math really moves.","change_set":["planned edits to hcsa/torch/attention_wayfinder_sparse.py","planned wiring edits to hcsa/integrations/qwen_torch.py","planned wiring edits to scripts/bench_qwen35_cuda_wayfinder.py","planned regression updates in tests/pytorch/test_torch_qwen_sparse_gqa.py","planned regression updates in tests/test_qwen_cuda_wayfinder_cli.py","notes/LAB_NOTEBOOK.md","notes/experiments.ndjson"],"command":".venv/bin/python -m py_compile hcsa/integrations/qwen_torch.py hcsa/torch/attention_wayfinder_sparse.py scripts/bench_qwen35_cuda_wayfinder.py tests/pytorch/test_torch_qwen_sparse_gqa.py tests/test_qwen_cuda_wayfinder_cli.py && .venv/bin/python -m pytest tests/pytorch/test_torch_qwen_sparse_gqa.py tests/pytorch/test_torch_causality.py tests/pytorch/test_torch_dense_limit_equivalence.py tests/pytorch/test_torch_matches_mlx_reference_small.py tests/test_qwen_cuda_wayfinder_cli.py -q && .venv/bin/python scripts/bench_qwen35_cuda_wayfinder.py --model-path /home/hmbown/HF_Models/Qwen3.5-9B --seq-lens 4096 8192 --path sparse --strategy random --engine auto --warmup 1 --repeats 1 --forward-target backbone --phases dense wayfinder --skip-divergence --output benchmarks/cuda/qwen35_wayfinder/EXP-20260319T045153Z-QWEN35CUDA-SPARSE-STREAMED-DEGREE-4096-8192.ndjson && journalctl -b -k --since '2026-03-18 23:51:53 CDT' | rg -n 'NVRM|Xid|Out of memory|hung task|BUG:|Call Trace'","controls":{"baseline_run_path":"benchmarks/cuda/qwen35_wayfinder/EXP-20260319T043357Z-QWEN35CUDA-BACKBONE-RESIDENCY-TIEBREAK-4096-8192.ndjson","contingent_16384_baseline_path":"benchmarks/cuda/qwen35_wayfinder/EXP-20260319T041640Z-QWEN35CUDA-BACKBONE-RESIDENCY-16384.ndjson","context_anchor_path":"benchmarks/cuda/qwen35_wayfinder/EXP-20260318T231105Z-QWEN35CUDA-SPARSE-ADAPTIVE-CHUNK.ndjson","one_process_at_a_time":true,"lock_file":"benchmarks/cuda/qwen35_wayfinder/.bench_qwen35_cuda_wayfinder.lock","retro_backfill_inference":"off","model_path":"/home/hmbown/HF_Models/Qwen3.5-9B","device":"cuda","gpu":"NVIDIA GB10","device_capability":[12,1],"torch":"2.10.0+cu130","transformers":"5.3.0","path":"sparse","strategy":"random","compute_graph_metrics":false,"forward_target":"backbone","window":64,"landmark_stride":64,"num_cycles":1,"engine_request":"auto","warmup":1,"repeats":1,"seq_lens_gate":[4096,8192],"seq_len_contingent":[16384],"kernel_log_since":"2026-03-18 23:51:53 CDT","current_anchor_4096":{"D_estimate":97.0,"kappa":64.25912658830366,"crossover_tokens_estimate":8387.646804924101},"current_anchor_8192":{"D_estimate":129.0,"kappa":116.42635492705567,"crossover_tokens_estimate":83695.9546355498}},"metrics":{"status":"pending","artifacts_expected":["benchmarks/cuda/qwen35_wayfinder/EXP-20260319T045153Z-QWEN35CUDA-SPARSE-STREAMED-DEGREE-4096-8192.ndjson","benchmarks/cuda/qwen35_wayfinder/EXP-20260319T045153Z-QWEN35CUDA-SPARSE-STREAMED-DEGREE-16384.ndjson"],"required":["py_compile success","pytest selected suite passes","bench[label=dense][seq_len=4096].median_ms","bench[label=wayfinder][seq_len=4096].median_ms","bench[label=dense][seq_len=8192].median_ms","bench[label=wayfinder][seq_len=8192].median_ms","dense and wayfinder residency metadata for backbone module","no cpu or meta residency in backbone benchmark module","matching real-device placement for dense and wayfinder","bench[label=wayfinder].wayfinder_profiles","bench[label=wayfinder].wayfinder_active_layers==8","wayfinder D_estimate","wayfinder empirical kappa","wayfinder crossover_estimate","zero new kernel fault lines after kernel_log_since"]},"decision":"pending","next_action":"Implement the streamed-neighbor no-weights fast path, rerun the guarded 4096/8192 checkpoint, and only if 8192 kappa improves while stability holds continue automatically to 16384."}
{"id":"EXP-20260319T045110Z-QWEN35CUDA-KERNEL-PEAK-BUDGET-GATHER-16K-PRERUN","date":"2026-03-19","question":"Can the Wayfinder/HCSA grouped-query kernel lower long-context attn_kernel_ms enough to make 8192 meaningfully better than the current anchor and reopen a credible 16384 rung by fixing two kernel-side constant factors: an over-conservative chunk-budget model and an inefficient per-chunk gather path?","hypothesis":"In hcsa/torch/attention_wayfinder_sparse.py, the current auto chunk budget counts K and V gather bytes simultaneously even though the kernel gathers K, computes scores/weights, deletes K, and only then gathers V. That overstates peak live bytes and forces too many query chunks at long prefill. Under the current controls (window=64, landmark_stride=64, num_cycles=1, 160 MiB temp budget), a peak-live-byte model should allow much larger query chunks, approximately moving from 768 -> 2048 at T=8192 and from 384 -> 1536 at T=16384, which directly lowers the serial query-chunk loop count. Separately, _gather_kv_head_block_chunk currently expands the full source tensor across the query-chunk axis for every K and V gather. Replacing that with a flattened batch-head gather should reduce repeated transport/materialization overhead per chunk. Together these should lower the realized constant factor b, improve kappa at 8192, and give 16384 a real chance under the same graph family.","change_set":["planned edits to hcsa/torch/attention_wayfinder_sparse.py","possible regression updates in tests/pytorch/test_torch_qwen_sparse_gqa.py","notes/LAB_NOTEBOOK.md","notes/experiments.ndjson"],"command":".venv/bin/python -m py_compile hcsa/integrations/qwen_torch.py hcsa/torch/attention_wayfinder_sparse.py scripts/bench_qwen35_cuda_wayfinder.py tests/pytorch/test_torch_qwen_sparse_gqa.py tests/test_qwen_cuda_wayfinder_cli.py && .venv/bin/python -m pytest tests/pytorch/test_torch_qwen_sparse_gqa.py tests/pytorch/test_torch_causality.py tests/pytorch/test_torch_dense_limit_equivalence.py tests/pytorch/test_torch_matches_mlx_reference_small.py tests/test_qwen_cuda_wayfinder_cli.py -q && .venv/bin/python scripts/bench_qwen35_cuda_wayfinder.py --model-path /home/hmbown/HF_Models/Qwen3.5-9B --seq-lens 4096 8192 --path sparse --strategy random --engine auto --warmup 1 --repeats 1 --forward-target backbone --phases dense wayfinder --skip-divergence --output benchmarks/cuda/qwen35_wayfinder/EXP-20260319T045110Z-QWEN35CUDA-KERNEL-PEAK-BUDGET-GATHER-4096-8192.ndjson && journalctl -b -k --since '2026-03-18 23:51:10 CDT' | rg -n 'NVRM|Xid|Out of memory|hung task|BUG:|Call Trace'","controls":{"baseline_run_path":"benchmarks/cuda/qwen35_wayfinder/EXP-20260319T043357Z-QWEN35CUDA-BACKBONE-RESIDENCY-TIEBREAK-4096-8192.ndjson","conflicting_repaired_loader_runs":["benchmarks/cuda/qwen35_wayfinder/EXP-20260319T041640Z-QWEN35CUDA-BACKBONE-RESIDENCY-4096-8192.ndjson","benchmarks/cuda/qwen35_wayfinder/EXP-20260319T041705Z-QWEN35CUDA-BACKBONE-RESIDENCY-GUARD-4096-8192.ndjson"],"one_process_at_a_time":true,"lock_file":"benchmarks/cuda/qwen35_wayfinder/.bench_qwen35_cuda_wayfinder.lock","retro_backfill_inference":"off","model_path":"/home/hmbown/HF_Models/Qwen3.5-9B","device":"cuda","gpu":"NVIDIA GB10","device_capability":[12,1],"torch":"2.10.0+cu130","transformers":"5.3.0","path":"sparse","strategy":"random","compute_graph_metrics":false,"forward_target":"backbone","window":64,"landmark_stride":64,"num_cycles":1,"engine_request":"auto","warmup":1,"repeats":1,"seq_lens_gate":[4096,8192],"seq_len_contingent":[16384],"kernel_log_since":"2026-03-18 23:51:10 CDT","current_anchor_4096":{"D_estimate":97.0,"kappa":64.25912658830366,"crossover_tokens_estimate":8387.646804924101},"current_anchor_8192":{"D_estimate":129.0,"kappa":116.42635492705567,"crossover_tokens_estimate":83695.9546355498}},"metrics":{"status":"pending","artifacts_expected":["benchmarks/cuda/qwen35_wayfinder/EXP-20260319T045110Z-QWEN35CUDA-KERNEL-PEAK-BUDGET-GATHER-4096-8192.ndjson","benchmarks/cuda/qwen35_wayfinder/EXP-20260319T045110Z-QWEN35CUDA-KERNEL-PEAK-BUDGET-GATHER-16384.ndjson"],"required":["py_compile success","pytest selected suite passes","bench[label=dense][seq_len=4096].median_ms","bench[label=wayfinder][seq_len=4096].median_ms","bench[label=dense][seq_len=8192].median_ms","bench[label=wayfinder][seq_len=8192].median_ms","dense and wayfinder residency metadata for backbone module","no cpu or meta residency in backbone benchmark module","matching real-device placement for dense and wayfinder","bench[label=wayfinder].wayfinder_profiles","bench[label=wayfinder].wayfinder_active_layers==8","wayfinder D_estimate","wayfinder empirical kappa","wayfinder crossover_estimate","zero new kernel fault lines after kernel_log_since"]},"decision":"pending","next_action":"Patch the kernel-side chunk-budget model and the gather path, run the guarded 4096/8192 checkpoint, and only if 8192 kappa improves while stability holds continue automatically to 16384."}
{"id":"EXP-20260319T045110Z-QWEN35CUDA-KERNEL-PEAK-BUDGET-GATHER-16K-RESULT","date":"2026-03-19","question":"Can the Wayfinder/HCSA grouped-query kernel lower long-context attn_kernel_ms enough to make 8192 meaningfully better than the current anchor and reopen a credible 16384 rung by fixing an over-conservative chunk-budget model and an inefficient per-chunk gather path?","hypothesis":"A peak-live-byte chunk budget should reduce serial query chunks at long prefill, and a flattened batch-head gather should lower per-chunk transport overhead.","change_set":["hcsa/torch/attention_wayfinder_sparse.py","tests/pytorch/test_torch_qwen_sparse_gqa.py","notes/LAB_NOTEBOOK.md","notes/experiments.ndjson"],"command":".venv/bin/python -m py_compile hcsa/integrations/qwen_torch.py hcsa/torch/attention_wayfinder_sparse.py scripts/bench_qwen35_cuda_wayfinder.py tests/pytorch/test_torch_qwen_sparse_gqa.py tests/test_qwen_cuda_wayfinder_cli.py && .venv/bin/python -m pytest tests/pytorch/test_torch_qwen_sparse_gqa.py tests/pytorch/test_torch_causality.py tests/pytorch/test_torch_dense_limit_equivalence.py tests/pytorch/test_torch_matches_mlx_reference_small.py tests/test_qwen_cuda_wayfinder_cli.py -q && .venv/bin/python scripts/bench_qwen35_cuda_wayfinder.py --model-path /home/hmbown/HF_Models/Qwen3.5-9B --seq-lens 4096 8192 --path sparse --strategy random --engine auto --warmup 1 --repeats 1 --forward-target backbone --phases dense wayfinder --skip-divergence --output benchmarks/cuda/qwen35_wayfinder/EXP-20260319T045110Z-QWEN35CUDA-KERNEL-PEAK-BUDGET-GATHER-4096-8192.ndjson && journalctl -b -k --since '2026-03-18 23:51:10 CDT' | rg -n 'NVRM|Xid|Out of memory|hung task|BUG:|Call Trace'","controls":{"baseline_run_path":"benchmarks/cuda/qwen35_wayfinder/EXP-20260319T043357Z-QWEN35CUDA-BACKBONE-RESIDENCY-TIEBREAK-4096-8192.ndjson","one_process_at_a_time":true,"lock_file":"benchmarks/cuda/qwen35_wayfinder/.bench_qwen35_cuda_wayfinder.lock","retro_backfill_inference":"off","model_path":"/home/hmbown/HF_Models/Qwen3.5-9B","device":"cuda","gpu":"NVIDIA GB10","device_capability":[12,1],"torch":"2.10.0+cu130","transformers":"5.3.0","path":"sparse","strategy":"random","compute_graph_metrics":false,"forward_target":"backbone","window":64,"landmark_stride":64,"num_cycles":1,"engine_request":"auto","warmup":1,"repeats":1,"kernel_log_since":"2026-03-18 23:51:10 CDT"},"metrics":{"status":"completed","validation":{"py_compile":"pass","pytest":{"passed":31,"skipped":1,"failed":0}},"warnings":["existing torch.jit.script_method deprecation warnings","existing GB10 capability 12.1 vs PyTorch max advertised 12.0 warning"],"artifact":"benchmarks/cuda/qwen35_wayfinder/EXP-20260319T045110Z-QWEN35CUDA-KERNEL-PEAK-BUDGET-GATHER-4096-8192.ndjson","kernel_fault_lines_after_start":0,"benchmark_residency":{"dense_benchmark_module_device_counts":{"cuda:0":428},"wayfinder_benchmark_module_device_counts":{"cuda:0":428},"result":"single_gpu_comparable"},"4096":{"dense":{"median_ms":2703.25,"prefill_tok_per_sec":1515.2,"peak_mem_gb":17.54},"wayfinder":{"median_ms":4243.15,"prefill_tok_per_sec":965.3,"peak_mem_gb":17.57,"wayfinder_active_layers":8,"attn_kernel_ms_mean":238.68357662468043,"effective_chunking":{"query_chunk_size":2048,"kv_head_chunk_size":1,"num_query_chunks":2,"num_head_blocks":4}},"delta_vs_anchor_wayfinder_abs":{"median_ms":139.72,"prefill_tok_per_sec":-32.9,"peak_mem_gb":0.0},"delta_vs_anchor_wayfinder_pct":{"median_ms":3.4049563414021766,"prefill_tok_per_sec":-3.2959326788218886,"peak_mem_gb":0.0},"memory_reduction_pct":-0.17103762827823665,"degree_estimate":97.0,"kappa":66.28120370573411,"crossover_tokens":8935.035158534716},"8192":{"dense":{"median_ms":5329.25,"prefill_tok_per_sec":1537.2,"peak_mem_gb":18.38},"wayfinder":{"median_ms":10121.96,"prefill_tok_per_sec":809.3,"peak_mem_gb":18.49,"wayfinder_active_layers":8,"attn_kernel_ms_mean":694.257743624803,"effective_chunking":{"query_chunk_size":1536,"kv_head_chunk_size":1,"num_query_chunks":6,"num_head_blocks":4}},"delta_vs_anchor_wayfinder_abs":{"median_ms":203.04,"prefill_tok_per_sec":-16.6,"peak_mem_gb":0.0},"delta_vs_anchor_wayfinder_pct":{"median_ms":2.0469970520984044,"prefill_tok_per_sec":-2.0099285627800003,"peak_mem_gb":0.0},"memory_reduction_pct":-0.5984766050054269,"degree_estimate":129.0,"kappa":120.61428763955543,"crossover_tokens":135871.91379609812},"stop_gate_tripped":"kappa_regressed"},"decision":"follow-up","next_action":"Keep the peak-live-byte budget idea under test, revert only the flattened gather path, and rerun the guarded 4096/8192 gate to isolate whether the chunk-count win survives on top of the original gather kernel."}
{"id":"EXP-20260319T045850Z-QWEN35CUDA-KERNEL-PEAK-BUDGET-ONLY-16K-PRERUN","date":"2026-03-19","question":"If we keep the peak-live-byte chunk budget but revert the flattened batch-head gather path, does the Wayfinder/HCSA kernel recover the chunk-count win without paying the new per-chunk gather penalty, and is that enough to reopen 16384?","hypothesis":"The failed combo experiment showed the tile math was directionally right but the new gather path was not. The larger query chunks (2048 at 4096, 1536 at 8192) should reduce serial loop count, but the advanced-index gather likely regressed transport overhead versus the original torch.gather path. Reverting only _gather_kv_head_block_chunk while preserving the peak-live-byte budget should keep the reduced query-chunk counts and lower attn_kernel_ms enough to improve 8192 kappa versus the current anchor ~116.43.","change_set":["planned edits to hcsa/torch/attention_wayfinder_sparse.py","notes/LAB_NOTEBOOK.md","notes/experiments.ndjson"],"command":".venv/bin/python -m py_compile hcsa/integrations/qwen_torch.py hcsa/torch/attention_wayfinder_sparse.py scripts/bench_qwen35_cuda_wayfinder.py tests/pytorch/test_torch_qwen_sparse_gqa.py tests/test_qwen_cuda_wayfinder_cli.py && .venv/bin/python -m pytest tests/pytorch/test_torch_qwen_sparse_gqa.py tests/pytorch/test_torch_causality.py tests/pytorch/test_torch_dense_limit_equivalence.py tests/pytorch/test_torch_matches_mlx_reference_small.py tests/test_qwen_cuda_wayfinder_cli.py -q && .venv/bin/python scripts/bench_qwen35_cuda_wayfinder.py --model-path /home/hmbown/HF_Models/Qwen3.5-9B --seq-lens 4096 8192 --path sparse --strategy random --engine auto --warmup 1 --repeats 1 --forward-target backbone --phases dense wayfinder --skip-divergence --output benchmarks/cuda/qwen35_wayfinder/EXP-20260319T045850Z-QWEN35CUDA-KERNEL-PEAK-BUDGET-ONLY-4096-8192.ndjson && journalctl -b -k --since '2026-03-18 23:58:50 CDT' | rg -n 'NVRM|Xid|Out of memory|hung task|BUG:|Call Trace'","controls":{"baseline_run_path":"benchmarks/cuda/qwen35_wayfinder/EXP-20260319T043357Z-QWEN35CUDA-BACKBONE-RESIDENCY-TIEBREAK-4096-8192.ndjson","failed_combo_patch":"benchmarks/cuda/qwen35_wayfinder/EXP-20260319T045110Z-QWEN35CUDA-KERNEL-PEAK-BUDGET-GATHER-4096-8192.ndjson","one_process_at_a_time":true,"lock_file":"benchmarks/cuda/qwen35_wayfinder/.bench_qwen35_cuda_wayfinder.lock","retro_backfill_inference":"off","model_path":"/home/hmbown/HF_Models/Qwen3.5-9B","device":"cuda","gpu":"NVIDIA GB10","device_capability":[12,1],"torch":"2.10.0+cu130","transformers":"5.3.0","path":"sparse","strategy":"random","compute_graph_metrics":false,"forward_target":"backbone","window":64,"landmark_stride":64,"num_cycles":1,"engine_request":"auto","warmup":1,"repeats":1,"seq_lens_gate":[4096,8192],"seq_len_contingent":[16384],"kernel_log_since":"2026-03-18 23:58:50 CDT","current_anchor_4096":{"D_estimate":97.0,"kappa":64.25912658830366,"crossover_tokens_estimate":8387.646804924101},"current_anchor_8192":{"D_estimate":129.0,"kappa":116.42635492705567,"crossover_tokens_estimate":83695.9546355498}},"metrics":{"status":"pending","artifacts_expected":["benchmarks/cuda/qwen35_wayfinder/EXP-20260319T045850Z-QWEN35CUDA-KERNEL-PEAK-BUDGET-ONLY-4096-8192.ndjson","benchmarks/cuda/qwen35_wayfinder/EXP-20260319T045850Z-QWEN35CUDA-KERNEL-PEAK-BUDGET-ONLY-16384.ndjson"],"required":["py_compile success","pytest selected suite passes","bench[label=dense][seq_len=4096].median_ms","bench[label=wayfinder][seq_len=4096].median_ms","bench[label=dense][seq_len=8192].median_ms","bench[label=wayfinder][seq_len=8192].median_ms","dense and wayfinder residency metadata for backbone module","no cpu or meta residency in backbone benchmark module","matching real-device placement for dense and wayfinder","bench[label=wayfinder].wayfinder_profiles","bench[label=wayfinder].wayfinder_active_layers==8","wayfinder D_estimate","wayfinder empirical kappa","wayfinder crossover_estimate","zero new kernel fault lines after kernel_log_since"]},"decision":"pending","next_action":"Revert only the flattened gather path, rerun the guarded 4096/8192 checkpoint, and only if 8192 kappa improves while stability holds continue automatically to 16384."}
