{"id": "EXP-20260212T002127Z-GLM-DRIFT-LAYER-LOCALIZATION-RESULT", "date": "2026-02-12", "question": "Is extract-focused quality drift concentrated in early layers or late layers on the GLM Wayfinder path?", "hypothesis": "Last-layer-only swap (N=8) should remain closer to dense than first-layer-only swap if drift is concentrated earlier.", "change_set": ["scripts/bench_glm_consumer_mlx.py: add model_config={trust_remote_code:true} to mlx_lm.load for glm4_moe_lite compatibility", "scripts/bench_glm_consumer_mlx.py: trace logits cast compatibility fix using array.astype(mx.float32) + NumPy copy"], "command": "cd /Volumes/VIXinSSD/wayfinder && bash scripts/run_glm_drift_followup_bundle.sh", "controls": {"baseline_run_root": "/Volumes/VIXinSSD/wayfinder/benchmarks/mlx/post_reboot_20260211_20260211T202821Z", "baseline_drift": -0.16666666666666669, "fixed": {"model": "mlx-community/GLM-4.7-Flash-4bit", "seed": 42, "dataset": "benchmarks/mlx/glm_4_7_flash_4bit_wayfinder/quality_eval_glm47_consumer_v1.json", "seq_len": 8192, "decode_len": 64, "chunk_size": 4096, "kv_step": 4096, "path": "permute", "window": 64, "retro_backfill_default_inference_off": true}}, "metrics": {"run_root": "/Volumes/VIXinSSD/wayfinder/benchmarks/mlx/post_reboot_20260211_20260211T202821Z/quality_localization_diag_20260212T002127Z", "artifacts": ["/Volumes/VIXinSSD/wayfinder/benchmarks/mlx/post_reboot_20260211_20260211T202821Z/quality_localization_diag_20260212T002127Z/layer_first8/results.json", "/Volumes/VIXinSSD/wayfinder/benchmarks/mlx/post_reboot_20260211_20260211T202821Z/quality_localization_diag_20260212T002127Z/layer_last8/results.json", "/Volumes/VIXinSSD/wayfinder/benchmarks/mlx/post_reboot_20260211_20260211T202821Z/quality_localization_diag_20260212T002127Z/layer_localization_summary.json"], "baseline": {"dense_accuracy": 0.5, "wayfinder_accuracy": 0.3333333333333333, "drift": -0.16666666666666669}, "first8": {"accuracy_abs": 0.3333333333333333, "drift_vs_dense_abs": -0.16666666666666669, "delta_vs_baseline_drift": 0.0, "delta_pct_vs_baseline_drift": 0.0, "extract_delta_vs_dense": -0.5}, "last8": {"accuracy_abs": 0.5, "drift_vs_dense_abs": 0.0, "delta_vs_baseline_drift": 0.16666666666666669, "delta_pct_vs_baseline_drift": 100.0, "extract_delta_vs_dense": 0.0}}, "decision": "follow-up", "next_action": "Run finer-grained early/mid-layer localization sweeps because last8 eliminates drift while first8 retains full baseline drift."}
{"id": "EXP-20260212T002127Z-GLM-DRIFT-EXTRACT01-TRACE-RESULT", "date": "2026-02-12", "question": "At what decode step does Wayfinder first diverge from dense on extract-01, and what are the competing token logits?", "hypothesis": "Divergence occurs in early decode steps with immediate top-1 token switch.", "change_set": ["Reuse bundle outputs from quality_localization_diag_20260212T002127Z; no additional runtime config change"], "command": "cd /Volumes/VIXinSSD/wayfinder && bash scripts/run_glm_drift_followup_bundle.sh", "controls": {"task_id": "extract-01", "fixed": {"seq_len": 8192, "decode_len": 32, "seed": 42, "trace_topk": 8, "trace_max_steps": 16, "chunk_size": 4096, "kv_step": 4096, "dense_control": "--no-swap", "retro_backfill_default_inference_off": true}}, "metrics": {"artifacts": ["/Volumes/VIXinSSD/wayfinder/benchmarks/mlx/post_reboot_20260211_20260211T202821Z/quality_localization_diag_20260212T002127Z/trace_dense_extract01/results.json", "/Volumes/VIXinSSD/wayfinder/benchmarks/mlx/post_reboot_20260211_20260211T202821Z/quality_localization_diag_20260212T002127Z/trace_wayfinder_extract01/results.json", "/Volumes/VIXinSSD/wayfinder/benchmarks/mlx/post_reboot_20260211_20260211T202821Z/quality_localization_diag_20260212T002127Z/extract01_trace_diff.json"], "dense_correct_abs": true, "wayfinder_correct_abs": false, "trace_steps_compared_abs": 16, "first_divergence_step_abs": 1, "dense_step1": {"token_id": 9255, "logit": 127.0}, "wayfinder_step1": {"token_id": 320, "logit": 120.0}, "baseline_drift_context": -0.16666666666666669}, "decision": "follow-up", "next_action": "Debug early-step token ranking stability on extract prompts, starting at divergence step 1."}
{"id": "EXP-20260212T005058Z-GLM-HAPPY-MEDIAN-SEARCH-PRERUN", "date": "2026-02-12", "question": "Which GLM Wayfinder configuration yields dense-like quality (drift vs dense >= -0.05) with better decode throughput than full-wayfinder?", "hypothesis": "Late-layer-only swaps preserve quality while runtime knob tuning recovers speed; early/mid-heavy swaps drive drift.", "change_set": ["none (measurement + analysis only)"], "command": "Run c00..c13 quality-only sweep with fixed controls, then fit surrogate and validate top 3 with repeats.", "controls": {"baseline_dense": "/Volumes/VIXinSSD/wayfinder/benchmarks/mlx/post_reboot_20260211_20260211T202821Z/consumer_dense_quality/results.json", "baseline_wayfinder": "/Volumes/VIXinSSD/wayfinder/benchmarks/mlx/post_reboot_20260211_20260211T202821Z/consumer_wayfinder_quality/results.json", "baseline_drift": -0.16666666666666669, "fixed": {"model": "mlx-community/GLM-4.7-Flash-4bit", "seed": 42, "dataset": "benchmarks/mlx/glm_4_7_flash_4bit_wayfinder/quality_eval_glm47_consumer_v1.json", "seq_len": 8192, "decode_len": 64, "chunk_size": 4096, "kv_step": 4096, "path": "permute", "window": 64, "landmark_stride": 0, "retro_backfill_default_inference_off": true}, "run_root": "/Volumes/VIXinSSD/wayfinder/benchmarks/mlx/post_reboot_20260211_20260211T202821Z/happy_median_search_20260212T005058Z"}, "metrics": {"status": "pending", "required": ["quality_accuracy_abs", "drift_vs_dense_abs", "drift_delta_vs_baseline_abs", "drift_delta_pct_vs_baseline", "itl_p95_mean_abs", "tok_per_sec_abs", "ttft_mean_abs", "peak_memory_bytes_mean_abs"]}, "decision": "pending", "next_action": "Execute coarse sweep, compute surrogate, choose top expected Pareto points, then run repeats."}
{"id": "EXP-20260212T005058Z-GLM-HAPPY-MEDIAN-REFINE-PRERUN", "date": "2026-02-12", "question": "Around the best coarse point (last4), do targeted runtime knob variants improve speed while keeping drift >= -0.05 and memory <= +1%?", "hypothesis": "last4 remains Pareto-optimal; minor runtime knob changes may further improve speed without violating quality gate.", "change_set": ["none (measurement + analysis only)"], "command": "Run p14_last4_no_discovered, p15_last4_h4, p16_last4_t16384; then repeat top-3 feasible candidates twice each.", "controls": {"run_root": "/Volumes/VIXinSSD/wayfinder/benchmarks/mlx/post_reboot_20260211_20260211T202821Z/happy_median_search_20260212T005058Z", "baseline_drift": -0.16666666666666669, "quality_gate": -0.05, "memory_gate_delta_pct_max": 1.0, "fixed": {"model": "mlx-community/GLM-4.7-Flash-4bit", "seed": 42, "dataset": "benchmarks/mlx/glm_4_7_flash_4bit_wayfinder/quality_eval_glm47_consumer_v1.json", "seq_len": 8192, "decode_len": 64, "chunk_size": 4096, "kv_step": 4096, "path": "permute", "window": 64, "landmark_stride": 0, "retro_backfill_default_inference_off": true}}, "metrics": {"status": "pending"}, "decision": "pending", "next_action": "Execute refinement points and run repeat validations for top 3 candidates."}
{"id": "EXP-20260212T005058Z-GLM-HAPPY-MEDIAN-SEARCH-RESULT", "date": "2026-02-12", "question": "Which GLM Wayfinder configuration yields dense-like quality (drift vs dense >= -0.05) with better decode throughput than full-wayfinder?", "hypothesis": "Late-layer-focused swaps preserve quality while early/mid-heavy swaps drive drift; runtime knobs can add speed.", "change_set": ["none (measurement + analysis only)"], "command": "Executed coarse c00..c13 sweep with fixed controls under happy_median_search_20260212T005058Z.", "controls": {"run_root": "/Volumes/VIXinSSD/wayfinder/benchmarks/mlx/post_reboot_20260211_20260211T202821Z/happy_median_search_20260212T005058Z", "baseline_dense": "benchmarks/mlx/post_reboot_20260211_20260211T202821Z/consumer_dense_quality/results.json", "baseline_wayfinder": "benchmarks/mlx/post_reboot_20260211_20260211T202821Z/consumer_wayfinder_quality/results.json", "baseline_drift": -0.16666666666666669, "fixed": {"model": "mlx-community/GLM-4.7-Flash-4bit", "seed": 42, "dataset": "benchmarks/mlx/glm_4_7_flash_4bit_wayfinder/quality_eval_glm47_consumer_v1.json", "seq_len": 8192, "decode_len": 64, "chunk_size": 4096, "kv_step": 4096, "path": "permute", "window": 64, "landmark_stride": 0, "retro_backfill_default_inference_off": true}}, "metrics": {"artifacts": ["/Volumes/VIXinSSD/wayfinder/benchmarks/mlx/post_reboot_20260211_20260211T202821Z/happy_median_search_20260212T005058Z/coarse_summary.json", "/Volumes/VIXinSSD/wayfinder/benchmarks/mlx/post_reboot_20260211_20260211T202821Z/happy_median_search_20260212T005058Z/surrogate_predictions.json", "/Volumes/VIXinSSD/wayfinder/benchmarks/mlx/post_reboot_20260211_20260211T202821Z/happy_median_search_20260212T005058Z/all_summary_post_refine.json", "/Volumes/VIXinSSD/wayfinder/benchmarks/mlx/post_reboot_20260211_20260211T202821Z/happy_median_search_20260212T005058Z/happy_median_final_summary.json"], "coarse_best_feasible": {"label": "c03_last4", "accuracy_abs": 0.5, "drift_vs_dense_abs": 0.0, "drift_delta_vs_baseline_abs": 0.16666666666666669, "drift_delta_pct_vs_baseline": 100.0, "tok_per_sec_abs": 57.817091431789784, "ttft_abs": 0.20871439565962646, "peak_memory_gib_abs": 15.77277207840234, "tok_delta_pct_vs_dense": -17.838620405578485, "mem_delta_pct_vs_dense": 0.09165577637342391}, "coarse_fail_examples": {"c04_last6": {"accuracy_abs": 0.3333333333333333, "drift_vs_dense_abs": -0.16666666666666669, "tok_per_sec_abs": 53.61445080963268}, "c08_band24_46": {"accuracy_abs": 0.3333333333333333, "drift_vs_dense_abs": -0.16666666666666669, "tok_per_sec_abs": 32.33101928923995}}, "surrogate_top_expected_probes": ["p14_last4_no_discovered", "p15_last4_h4", "p16_last4_t16384"]}, "decision": "follow-up", "next_action": "Run refinement probes and repeat top-3 feasible candidates."}
{"id": "EXP-20260212T005058Z-GLM-HAPPY-MEDIAN-REFINE-RESULT", "date": "2026-02-12", "question": "Around last4, do targeted runtime knobs improve speed without violating quality/memory gates?", "hypothesis": "last4 remains Pareto-optimal; active_dense_threshold or kernel toggles may yield incremental speed gains.", "change_set": ["none (measurement + analysis only)"], "command": "Executed p14/p15/p16 and repeats for top-3 feasible candidates under happy_median_search_20260212T005058Z.", "controls": {"quality_gate": -0.05, "memory_gate_delta_pct_max": 1.0, "baseline_drift": -0.16666666666666669, "run_root": "/Volumes/VIXinSSD/wayfinder/benchmarks/mlx/post_reboot_20260211_20260211T202821Z/happy_median_search_20260212T005058Z"}, "metrics": {"top_nonrepeat_feasible": [{"label": "p16_last4_t16384", "accuracy_abs": 0.5, "drift_vs_dense_abs": 0.0, "drift_delta_vs_baseline_abs": 0.16666666666666669, "drift_delta_pct_vs_baseline": 100.0, "tok_per_sec_abs": 58.050519022306226, "ttft_abs": 0.2255698816588847, "peak_memory_gib_abs": 15.772771091355631, "tok_delta_pct_vs_dense": -17.50690650580788, "mem_delta_pct_vs_dense": 0.09164951272243302}, {"label": "c03_last4", "accuracy_abs": 0.5, "drift_vs_dense_abs": 0.0, "drift_delta_vs_baseline_abs": 0.16666666666666669, "drift_delta_pct_vs_baseline": 100.0, "tok_per_sec_abs": 57.817091431789784, "ttft_abs": 0.20871439565962646, "peak_memory_gib_abs": 15.77277207840234, "tok_delta_pct_vs_dense": -17.838620405578485, "mem_delta_pct_vs_dense": 0.09165577637342391}, {"label": "p14_last4_no_discovered", "accuracy_abs": 0.5, "drift_vs_dense_abs": 0.0, "drift_delta_vs_baseline_abs": 0.16666666666666669, "drift_delta_pct_vs_baseline": 100.0, "tok_per_sec_abs": 55.55549177488376, "ttft_abs": 0.24085877783363685, "peak_memory_gib_abs": 15.772777567617595, "tok_delta_pct_vs_dense": -21.052482315613986, "mem_delta_pct_vs_dense": 0.09169061011355742}], "repeat_summary": {"p16_last4_t16384": {"n": 3, "labels": ["p16_last4_t16384", "rep_p16_last4_t16384_r1", "rep_p16_last4_t16384_r2"], "accuracy_mean": 0.5, "accuracy_std": 0.0, "drift_mean": 0.0, "drift_std": 0.0, "tok_per_sec_mean": 55.209972813564534, "tok_per_sec_std": 2.0085778125733014, "itl_mean": 0.018136071775289666, "itl_std": 0.0006432559814784556, "ttft_mean": 0.26140570138684577, "ttft_std": 0.025345339362503373, "peak_memory_gib_mean": 15.772776030676646, "peak_memory_gib_std": 4.611693747649584e-06, "tok_delta_pct_vs_dense_mean": -21.543484436872728, "mem_delta_pct_vs_dense_mean": 0.09168085691585355}, "c03_last4": {"n": 3, "labels": ["c03_last4", "rep_c03_last4_r1", "rep_c03_last4_r2"], "accuracy_mean": 0.5, "accuracy_std": 0.0, "drift_mean": 0.0, "drift_std": 0.0, "tok_per_sec_mean": 55.24892879404511, "tok_per_sec_std": 1.8163231076559598, "itl_mean": 0.018119037107680924, "itl_std": 0.0005821607594373062, "ttft_mean": 0.283448421330023, "ttft_std": 0.05285010059539625, "peak_memory_gib_mean": 15.772772380668256, "peak_memory_gib_std": 4.39055735737065e-06, "tok_delta_pct_vs_dense_mean": -21.488125770075836, "mem_delta_pct_vs_dense_mean": 0.09165769450778018}, "p14_last4_no_discovered": {"n": 3, "labels": ["p14_last4_no_discovered", "rep_p14_last4_no_discovered_r1", "rep_p14_last4_no_discovered_r2"], "accuracy_mean": 0.5, "accuracy_std": 0.0, "drift_mean": 0.0, "drift_std": 0.0, "tok_per_sec_mean": 52.01630721420476, "tok_per_sec_std": 2.5101411019607407, "itl_mean": 0.019268171329814423, "itl_std": 0.0009000268119548033, "ttft_mean": 0.29528002083599053, "ttft_std": 0.03869416675416977, "peak_memory_gib_mean": 15.772764100744906, "peak_memory_gib_std": 2.1101226555883015e-05, "tok_delta_pct_vs_dense_mean": -26.081865132072654, "mem_delta_pct_vs_dense_mean": 0.09160515135089535}}, "quality_speed_frontier_2d": ["p16_last4_t16384"]}, "decision": "keep", "next_action": "Recommend last4+t16384 as primary, keep plain last4 as conservative fallback due near-identical repeat mean and simpler config."}
{"id": "EXP-20260212T013118Z-GLM-LAST4-CONFIRMATION-GATE-PRERUN", "date": "2026-02-12", "question": "Does provisional last4 (optional t16384) pass robustness gates across seeds/repeats on the canonical 6-task set?", "hypothesis": "Both last4 and last4+t16384 keep drift >= -0.05, maintain large tok/s advantage vs full-wayfinder, and stay within +1% memory vs dense.", "change_set": ["none (measurement + analysis only)"], "command": "Run seed matrix on v1 dataset: per seed dense/full controls + two replicate runs each for last4 and last4+t16384.", "controls": {"run_root": "/Volumes/VIXinSSD/wayfinder/benchmarks/mlx/post_reboot_20260211_20260211T202821Z/last4_confirmation_gate_20260212T013118Z", "dataset": "benchmarks/mlx/glm_4_7_flash_4bit_wayfinder/quality_eval_glm47_consumer_v1.json", "seeds": [42, 7, 99], "fixed": {"model": "mlx-community/GLM-4.7-Flash-4bit", "seq_len": 8192, "decode_len": 64, "chunk_size": 4096, "kv_step": 4096, "path": "permute", "window": 64, "landmark_stride": 0, "head_chunk_size": 2, "query_chunk_size": 192, "retro_backfill_default_inference_off": true}, "gates": {"drift_vs_dense_min": -0.05, "mem_delta_pct_vs_dense_max": 1.0}}, "metrics": {"status": "pending"}, "decision": "pending", "next_action": "Execute matrix and compute gate pass/fail per seed + aggregate."}
{"id": "EXP-20260212T013118Z-GLM-LAST4-HELDOUT-PRERUN", "date": "2026-02-12", "question": "On a larger held-out extract-heavy set, do last4 and last4+t16384 remain dense-like before locking defaults?", "hypothesis": "last4 variants remain near-dense on held-out extract tasks while retaining strong speed edge over full-wayfinder.", "change_set": ["benchmarks/mlx/glm_4_7_flash_4bit_wayfinder/quality_eval_glm47_consumer_extract_holdout_v1.json"], "command": "Create held-out dataset then run dense/full/last4/last4+t16384 at seed=42.", "controls": {"run_root": "/Volumes/VIXinSSD/wayfinder/benchmarks/mlx/post_reboot_20260211_20260211T202821Z/last4_confirmation_gate_20260212T013118Z", "seed": 42, "fixed": {"model": "mlx-community/GLM-4.7-Flash-4bit", "seq_len": 8192, "decode_len": 64, "chunk_size": 4096, "kv_step": 4096, "path": "permute", "window": 64, "landmark_stride": 0, "head_chunk_size": 2, "query_chunk_size": 192, "retro_backfill_default_inference_off": true}}, "metrics": {"status": "pending"}, "decision": "pending", "next_action": "Run held-out quartet and evaluate lock/no-lock decision."}
{"id": "EXP-20260212T013118Z-GLM-LAST4-CONFIRMATION-GATE-RESULT", "date": "2026-02-12", "question": "Does provisional last4 (optional t16384) pass must-pass gates across seeds 42/7/99 on the canonical 6-task quality set?", "hypothesis": "Both last4 and last4+t16384 maintain drift >= -0.05, keep large tok/s advantage vs full-wayfinder, and stay within +1% memory vs dense.", "change_set": ["none (measurement + analysis only)"], "command": "Run 12-run matrix via scripts/bench_glm_consumer_mlx.py over seeds {42,7,99} and configs {dense,full,last4,last4_t16384}; summarize to confirmation_gate_summary.json", "controls": {"run_root": "/Volumes/VIXinSSD/wayfinder/benchmarks/mlx/post_reboot_20260211_20260211T202821Z/last4_confirmation_gate_20260212T013118Z", "dataset": "benchmarks/mlx/glm_4_7_flash_4bit_wayfinder/quality_eval_glm47_consumer_v1.json", "fixed": {"model": "mlx-community/GLM-4.7-Flash-4bit", "seq_len": 8192, "decode_len": 64, "repeats": 3, "chunk_size": 4096, "kv_step": 4096, "path": "permute", "window": 64, "landmark_stride": 0, "head_chunk_size": 2, "query_chunk_size": 192, "skip_multi_turn": true, "retro_backfill_default_inference_off": true}, "baseline_dense_per_seed": ["s42_dense", "s7_dense", "s99_dense"], "baseline_full_wayfinder_per_seed": ["s42_full_wayfinder", "s7_full_wayfinder", "s99_full_wayfinder"], "gates": {"drift_vs_dense_min": -0.05, "mem_delta_vs_dense_pct_max": 1.0}}, "metrics": {"artifacts": ["/Volumes/VIXinSSD/wayfinder/benchmarks/mlx/post_reboot_20260211_20260211T202821Z/last4_confirmation_gate_20260212T013118Z/confirmation_gate_summary.json", "/Volumes/VIXinSSD/wayfinder/benchmarks/mlx/post_reboot_20260211_20260211T202821Z/last4_confirmation_gate_20260212T013118Z/run_matrix_20260212T015556Z.log"], "baseline_dense": {"seed42": {"accuracy": 0.5, "tok_s_abs": 45.71583544845495, "peak_memory_bytes_abs": 20660500140}, "seed7": {"accuracy": 0.5, "tok_s_abs": 47.58123017059112, "peak_memory_bytes_abs": 20660500140}, "seed99": {"accuracy": 0.5, "tok_s_abs": 47.71668959929609, "peak_memory_bytes_abs": 20660500140}}, "last4": {"drift_vs_dense_abs_per_seed": {"42": 0.0, "7": 0.0, "99": 0.0}, "tok_s_adv_vs_full_pct_per_seed": {"42": 979.8706508838475, "7": 1045.6802126947002, "99": 979.4054930225028}, "mem_delta_vs_dense_pct_per_seed": {"42": 1.813006778450621, "7": 1.8132843322349546, "99": 1.8130959921670131}, "aggregate": {"drift_vs_dense_abs": 0.0, "tok_s_adv_vs_full_pct": 1001.6521188670168, "mem_delta_vs_dense_pct": 1.8131290342841961}}, "last4_t16384": {"drift_vs_dense_abs_per_seed": {"42": 0.0, "7": 0.0, "99": 0.0}, "tok_s_adv_vs_full_pct_per_seed": {"42": 1017.4916385438561, "7": 1058.4928491306612, "99": 984.8146369878823}, "mem_delta_vs_dense_pct_per_seed": {"42": 1.813244681694326, "7": 1.8129770405451495, "99": 1.8131455553427767}, "aggregate": {"drift_vs_dense_abs": 0.0, "tok_s_adv_vs_full_pct": 1020.2663748874666, "mem_delta_vs_dense_pct": 1.8131224258607508}}, "gate_verdict": {"drift_gate_all_seeds": true, "tok_advantage_gate_all_seeds": true, "memory_gate_all_seeds": false, "overall": false}}, "decision": "follow-up", "next_action": "Do not lock defaults/docs yet; reduce peak memory to <= +1.0% vs dense and rerun the same 3-seed confirmation gate."}
