{"id":"EXP-20260318T224711Z-QWEN35CUDA-HCSA-KAPPA-GATHER-RESULT","date":"2026-03-18","question":"Can the Qwen CUDA Wayfinder/HCSA kernel lower empirical kappa at T=4096 by removing duplicate grouped-query K/V gather work and staging K/V materialization so the hot path moves less data at once?","hypothesis":"At the current graph family (window=64, landmark_stride=64, num_cycles=1), D(4096) ~= 97, so the path to a lower kappa is reducing the realization constant factor b, not changing the graph. Reusing one gathered K/V neighborhood across all query heads in the same KV group and delaying V gather until after weights are known should materially reduce per-layer attn_kernel_ms, improve T=4096 Wayfinder/HCSA latency and tok/s, and move the dense crossover earlier than the current ~32130-token estimate without weakening causality or activation coverage.","change_set":["hcsa/torch/attention_wayfinder_sparse.py","tests/pytorch/test_torch_qwen_sparse_gqa.py","notes/LAB_NOTEBOOK.md","notes/experiments.ndjson"],"command":".venv/bin/python -m py_compile hcsa/integrations/qwen_torch.py hcsa/torch/attention_wayfinder_sparse.py scripts/bench_qwen35_cuda_wayfinder.py tests/pytorch/test_torch_qwen_sparse_gqa.py && .venv/bin/python -m pytest tests/pytorch/test_torch_qwen_sparse_gqa.py tests/pytorch/test_torch_causality.py tests/pytorch/test_torch_dense_limit_equivalence.py tests/pytorch/test_torch_matches_mlx_reference_small.py tests/test_qwen_cuda_wayfinder_cli.py -q && .venv/bin/python scripts/bench_qwen35_cuda_wayfinder.py --model-path /home/hmbown/HF_Models/Qwen3.5-9B --seq-lens 4096 --path sparse --strategy random --engine auto --warmup 1 --repeats 1 --forward-target backbone --phases dense wayfinder --skip-divergence --output benchmarks/cuda/qwen35_wayfinder/EXP-20260318T224711Z-QWEN35CUDA-HCSA-4096-KAPPA-GATHER.ndjson && journalctl -b -k --since '2026-03-18 17:55:00 CDT' | rg -n 'NVRM|Xid|Out of memory|hung task|BUG:|Call Trace'","controls":{"baseline_run_path":"benchmarks/cuda/qwen35_wayfinder/EXP-20260318T222540Z-QWEN35CUDA-SPARSE-4096-NOMETRICS.ndjson","one_process_at_a_time":true,"lock_file":"benchmarks/cuda/qwen35_wayfinder/.bench_qwen35_cuda_wayfinder.lock","retro_backfill_inference":"off","model_path":"/home/hmbown/HF_Models/Qwen3.5-9B","device":"cuda","gpu":"NVIDIA GB10","device_capability":[12,1],"torch":"2.10.0+cu130","transformers":"5.3.0","path":"sparse","strategy":"random","compute_graph_metrics":false,"forward_target":"backbone","window":64,"landmark_stride":64,"num_cycles":1,"engine_request":"auto","warmup":1,"repeats":1,"seq_lens":[4096],"degree_estimate":97.0,"baseline_dense_ms":2476.75,"baseline_wayfinder_ms":5963.43,"baseline_kappa":101.67218755040433,"baseline_crossover_tokens":32129.999483962263,"kernel_log_since":"2026-03-18 17:55:00 CDT"},"metrics":{"status":"completed","artifact":"benchmarks/cuda/qwen35_wayfinder/EXP-20260318T224711Z-QWEN35CUDA-HCSA-4096-KAPPA-GATHER.ndjson","validation":{"py_compile":"pass","pytest":{"passed":20,"skipped":1,"failed":0}},"warnings":["existing torch.jit.script_method deprecation warnings","existing GB10 capability 12.1 vs PyTorch max advertised 12.0 warning"],"kernel_fault_lines_after_start":0,"dense":{"median_ms":2508.2,"prefill_tok_per_sec":1633.0,"peak_mem_gb":17.54},"wayfinder":{"median_ms":3902.12,"prefill_tok_per_sec":1049.7,"peak_mem_gb":17.57,"wayfinder_active_layers":8,"wayfinder_graph_cache_entries_total":8,"engine":"batched"},"wayfinder_profile_summary":{"path":"sparse","graph_source":"runtime","graph_cache_hit_all_layers":true,"graph_metrics_present":false,"attn_kernel_ms_mean":223.88654037558808,"attn_kernel_ms_min":221.10982799858903,"attn_kernel_ms_max":225.9435170017241,"graph_build_ms_mean":0.032465999538544565},"delta_vs_dense_abs":{"median_ms":1393.92,"prefill_tok_per_sec":-583.3,"peak_mem_gb":0.03},"delta_vs_dense_pct":{"median_ms":55.574515588868515,"prefill_tok_per_sec":-35.71953459889773,"peak_mem_gb":0.1710376282782277},"memory_reduction_pct_convention":"100*(1-wayfinder/dense)","memory_reduction_pct":-0.17103762827823665,"delta_vs_named_baseline_abs":{"wayfinder_median_ms":-2061.3100000000004,"wayfinder_prefill_tok_per_sec":362.80000000000007,"wayfinder_peak_mem_gb":0.0,"dense_median_ms":31.449999999999818,"dense_prefill_tok_per_sec":-20.799999999999955,"dense_peak_mem_gb":0.0,"attn_kernel_ms_mean":-264.55310999972426},"delta_vs_named_baseline_pct":{"wayfinder_median_ms":-34.56584549495844,"wayfinder_prefill_tok_per_sec":52.81700393070317,"wayfinder_peak_mem_gb":0.0,"dense_median_ms":1.269809225799932,"dense_prefill_tok_per_sec":-1.2577095174749036,"dense_peak_mem_gb":0.0,"attn_kernel_ms_mean":-54.162906266197716},"kappa":65.69414596412427,"kappa_delta_abs":-35.97804158628006,"kappa_delta_pct":-35.38631601532506,"crossover_tokens":8772.454898167285,"crossover_delta_tokens":-23357.544585794977},"decision":"keep","next_action":"Because kappa improved materially and the crossover estimate is now inside the expected 8k-16k band, run the guarded T=8192 checkpoint immediately on the same controls."}
{"id":"EXP-20260318T225831Z-QWEN35CUDA-HCSA-8192-LADDER-PRERUN","date":"2026-03-18","question":"With kappa improved to ~65.69 at T=4096, does the same Wayfinder/HCSA path remain stable and move toward dense crossover at T=8192 under the same graph family and no-metrics controls?","hypothesis":"For the current graph family, D(8192) ~= 129. Holding kappa ~= 65.69 predicts L_hcsa / L_dense ~= kappa * D / T ~= 1.03, so T=8192 should be near the dense crossover and may beat dense if constant factors continue to improve. Memory should remain bounded and near-dense, active Wayfinder/HCSA layers should stay 8/8, and any further kappa reduction would move crossover earlier than ~8772.","change_set":["measurement-only run on top of hcsa/torch/attention_wayfinder_sparse.py","measurement-only run on top of hcsa/integrations/qwen_torch.py","measurement-only run on top of scripts/bench_qwen35_cuda_wayfinder.py","measurement-only run on top of tests/pytorch/test_torch_qwen_sparse_gqa.py","notes/LAB_NOTEBOOK.md","notes/experiments.ndjson"],"command":".venv/bin/python scripts/bench_qwen35_cuda_wayfinder.py --model-path /home/hmbown/HF_Models/Qwen3.5-9B --seq-lens 8192 --path sparse --strategy random --engine auto --warmup 1 --repeats 1 --forward-target backbone --phases dense wayfinder --skip-divergence --output benchmarks/cuda/qwen35_wayfinder/EXP-20260318T225831Z-QWEN35CUDA-HCSA-8192-LADDER.ndjson && journalctl -b -k --since '2026-03-18 17:58:42 CDT' | rg -n 'NVRM|Xid|Out of memory|hung task|BUG:|Call Trace'","controls":{"baseline_run_path":"benchmarks/cuda/qwen35_wayfinder/EXP-20260318T224711Z-QWEN35CUDA-HCSA-4096-KAPPA-GATHER.ndjson","one_process_at_a_time":true,"lock_file":"benchmarks/cuda/qwen35_wayfinder/.bench_qwen35_cuda_wayfinder.lock","retro_backfill_inference":"off","model_path":"/home/hmbown/HF_Models/Qwen3.5-9B","device":"cuda","gpu":"NVIDIA GB10","device_capability":[12,1],"torch":"2.10.0+cu130","transformers":"5.3.0","path":"sparse","strategy":"random","compute_graph_metrics":false,"forward_target":"backbone","window":64,"landmark_stride":64,"num_cycles":1,"engine_request":"auto","warmup":1,"repeats":1,"seq_lens":[8192],"degree_estimate":129.0,"baseline_kappa":65.69414596412427,"baseline_crossover_tokens":8772.454898167285,"kernel_log_since":"2026-03-18 17:58:42 CDT"},"metrics":{"status":"pending","artifacts_expected":["benchmarks/cuda/qwen35_wayfinder/EXP-20260318T225831Z-QWEN35CUDA-HCSA-8192-LADDER.ndjson"],"required":["bench[label=dense].median_ms","bench[label=dense].prefill_tok_per_sec","bench[label=dense].peak_mem_gb","bench[label=wayfinder].median_ms","bench[label=wayfinder].prefill_tok_per_sec","bench[label=wayfinder].peak_mem_gb","bench[label=wayfinder].wayfinder_profiles","bench[label=wayfinder].wayfinder_active_layers==8","zero new kernel fault lines after kernel_log_since","recomputed kappa <= 65.69414596412427 or dense crossover achieved"]},"decision":"pending","next_action":"Run the guarded T=8192 checkpoint, inspect the artifact and kernel log, and if kappa improves or dense crossover is reached, continue directly to T=16384."}
{"id":"EXP-20260318T224737Z-QWEN35CUDA-SPARSE-KAPPA-KERNEL-PRERUN","date":"2026-03-18","question":"Can the Qwen CUDA Wayfinder/HCSA sparse kernel lower the current kappa≈101.67 at T=4096 by removing repeated grouped-query K/V gather traffic and using a more efficient score/value contraction, without changing the graph family or losing bounded memory?","hypothesis":"The graph/cache side is no longer the blocker. The dominant term is the grouped-query sparse realization still re-gathering identical KV-head neighborhoods once per query-group chunk and casting those temporaries to float in the hot loop. Gathering K/V once per KV head and query chunk, reusing those gathered tensors across all query heads in the group, and using broadcast matmul/einsum-style contractions should lower attn_kernel_ms at fixed D(T), reduce T=4096 Wayfinder latency versus the latest clean 4096 baseline artifact, and move the implied crossover earlier than the current ~32.1k tokens.","change_set":["planned edits to hcsa/torch/attention_wayfinder_sparse.py","possible wiring/config edits to hcsa/integrations/qwen_torch.py","possible regression updates in tests/pytorch/test_torch_qwen_sparse_gqa.py","notes/LAB_NOTEBOOK.md","notes/experiments.ndjson"],"command":".venv/bin/python -m py_compile hcsa/integrations/qwen_torch.py hcsa/torch/attention_wayfinder_sparse.py scripts/bench_qwen35_cuda_wayfinder.py tests/pytorch/test_torch_qwen_sparse_gqa.py && .venv/bin/python -m pytest tests/pytorch/test_torch_qwen_sparse_gqa.py tests/pytorch/test_torch_causality.py tests/pytorch/test_torch_dense_limit_equivalence.py tests/pytorch/test_torch_matches_mlx_reference_small.py tests/test_qwen_cuda_wayfinder_cli.py -q && .venv/bin/python scripts/bench_qwen35_cuda_wayfinder.py --model-path /home/hmbown/HF_Models/Qwen3.5-9B --seq-lens 4096 --path sparse --strategy random --engine auto --warmup 1 --repeats 1 --forward-target backbone --phases dense wayfinder --skip-divergence --output benchmarks/cuda/qwen35_wayfinder/EXP-20260318T224737Z-QWEN35CUDA-SPARSE-4096-KAPPA.ndjson && journalctl -b -k --since '2026-03-18 17:51:13' | rg -n 'NVRM|Xid|Out of memory|hung task|BUG:|Call Trace'","controls":{"baseline_run_path":"benchmarks/cuda/qwen35_wayfinder/EXP-20260318T222540Z-QWEN35CUDA-SPARSE-4096-NOMETRICS.ndjson","supplemental_baseline_path":"benchmarks/cuda/qwen35_wayfinder/EXP-20260318T213005Z-QWEN35CUDA-SPARSE-2048.ndjson","one_process_at_a_time":true,"lock_file":"benchmarks/cuda/qwen35_wayfinder/.bench_qwen35_cuda_wayfinder.lock","retro_backfill_inference":"off","model_path":"/home/hmbown/HF_Models/Qwen3.5-9B","device":"cuda","gpu":"NVIDIA GB10","device_capability":[12,1],"torch":"2.10.0+cu130","transformers":"5.3.0","path":"sparse","strategy":"random","compute_graph_metrics":false,"forward_target":"backbone","window":64,"landmark_stride":64,"num_cycles":1,"engine_request":"auto","warmup":1,"repeats":1,"seq_lens":[4096],"kernel_log_since":"2026-03-18 17:51:13","current_anchor":{"degree_estimate":97.0,"kappa":101.67218755040433,"crossover_tokens_estimate":32129.999483962263}},"metrics":{"status":"pending","artifacts_expected":["benchmarks/cuda/qwen35_wayfinder/EXP-20260318T224737Z-QWEN35CUDA-SPARSE-4096-KAPPA.ndjson"],"required":["py_compile success","pytest selected suite passes","bench[label=dense].median_ms","bench[label=dense].prefill_tok_per_sec","bench[label=dense].peak_mem_gb","bench[label=wayfinder].median_ms","bench[label=wayfinder].prefill_tok_per_sec","bench[label=wayfinder].peak_mem_gb","bench[label=wayfinder].wayfinder_profiles","bench[label=wayfinder].wayfinder_active_layers==8","wayfinder D_estimate","wayfinder empirical kappa","wayfinder crossover_estimate","zero new kernel fault lines after kernel_log_since"]},"decision":"pending","next_action":"Implement the shared-gather sparse kernel, run the guarded T=4096 rerun, and only if kappa improves with stable memory open a new PRERUN for the T=8192 continuation."}
{"id":"EXP-20260318T224737Z-QWEN35CUDA-SPARSE-KAPPA-KERNEL-RESULT","date":"2026-03-18","question":"Can the Qwen CUDA Wayfinder/HCSA sparse kernel lower the current kappa≈101.67 at T=4096 by removing repeated grouped-query K/V gather traffic and using a more efficient score/value contraction, without changing the graph family or losing bounded memory?","hypothesis":"The graph/cache side is no longer the blocker. The dominant term is the grouped-query sparse realization still re-gathering identical KV-head neighborhoods once per query-group chunk and casting those temporaries to float in the hot loop. Gathering K/V once per KV head and query chunk, reusing those gathered tensors across all query heads in the group, and using broadcast matmul/einsum-style contractions should lower attn_kernel_ms at fixed D(T), reduce T=4096 Wayfinder latency versus the latest clean 4096 baseline artifact, and move the implied crossover earlier than the current ~32.1k tokens.","change_set":["hcsa/torch/attention_wayfinder_sparse.py","notes/LAB_NOTEBOOK.md","notes/experiments.ndjson"],"command":".venv/bin/python -m py_compile hcsa/integrations/qwen_torch.py hcsa/torch/attention_wayfinder_sparse.py scripts/bench_qwen35_cuda_wayfinder.py tests/pytorch/test_torch_qwen_sparse_gqa.py && .venv/bin/python -m pytest tests/pytorch/test_torch_qwen_sparse_gqa.py tests/pytorch/test_torch_causality.py tests/pytorch/test_torch_dense_limit_equivalence.py tests/pytorch/test_torch_matches_mlx_reference_small.py tests/test_qwen_cuda_wayfinder_cli.py -q && .venv/bin/python scripts/bench_qwen35_cuda_wayfinder.py --model-path /home/hmbown/HF_Models/Qwen3.5-9B --seq-lens 4096 --path sparse --strategy random --engine auto --warmup 1 --repeats 1 --forward-target backbone --phases dense wayfinder --skip-divergence --output benchmarks/cuda/qwen35_wayfinder/EXP-20260318T224737Z-QWEN35CUDA-SPARSE-4096-KAPPA.ndjson && journalctl -b -k --since '2026-03-18 17:51:13' | rg -n 'NVRM|Xid|Out of memory|hung task|BUG:|Call Trace'","controls":{"baseline_run_path":"benchmarks/cuda/qwen35_wayfinder/EXP-20260318T222540Z-QWEN35CUDA-SPARSE-4096-NOMETRICS.ndjson","supplemental_baseline_path":"benchmarks/cuda/qwen35_wayfinder/EXP-20260318T213005Z-QWEN35CUDA-SPARSE-2048.ndjson","one_process_at_a_time":true,"lock_file":"benchmarks/cuda/qwen35_wayfinder/.bench_qwen35_cuda_wayfinder.lock","retro_backfill_inference":"off","model_path":"/home/hmbown/HF_Models/Qwen3.5-9B","device":"cuda","gpu":"NVIDIA GB10","device_capability":[12,1],"torch":"2.10.0+cu130","transformers":"5.3.0","path":"sparse","strategy":"random","compute_graph_metrics":false,"forward_target":"backbone","window":64,"landmark_stride":64,"num_cycles":1,"engine_request":"auto","warmup":1,"repeats":1,"seq_lens":[4096],"kernel_log_since":"2026-03-18 17:51:13"},"metrics":{"status":"completed","validation":{"py_compile":"pass","pytest":{"passed":20,"skipped":1,"failed":0}},"warnings":["existing torch.jit.script_method deprecation warnings","existing GB10 capability 12.1 vs PyTorch max advertised 12.0 warning"],"artifact":"benchmarks/cuda/qwen35_wayfinder/EXP-20260318T224737Z-QWEN35CUDA-SPARSE-4096-KAPPA.ndjson","kernel_fault_lines_after_start":0,"dense":{"median_ms":2138.58,"prefill_tok_per_sec":1915.3,"peak_mem_gb":17.54},"wayfinder":{"median_ms":3928.67,"prefill_tok_per_sec":1042.6,"peak_mem_gb":17.57,"wayfinder_active_layers":8,"wayfinder_graph_cache_entries_total":8,"engine":"batched"},"wayfinder_profile_summary":{"path":"sparse","graph_source":"runtime","graph_cache_hit_all_layers":true,"graph_metrics_present":false,"per_layer_graph_build_ms_range":[0.022160002117743716,0.03376099994056858],"per_layer_attn_kernel_ms_range":[232.15376200096216,235.47329899884062],"per_layer_attn_kernel_ms_mean":233.704763750211,"per_layer_attn_kernel_ms_delta_vs_baseline_mean":-254.73488662510135,"per_layer_attn_kernel_ms_delta_vs_baseline_pct":-52.15278620999862},"delta_vs_dense_abs":{"median_ms":1790.09,"prefill_tok_per_sec":-872.7,"peak_mem_gb":0.03},"delta_vs_dense_pct":{"median_ms":83.70460773036315,"prefill_tok_per_sec":-45.564663499190736,"peak_mem_gb":0.1710376282782277},"memory_reduction_pct_convention":"100*(1-wayfinder/dense)","memory_reduction_pct":-0.17103762827823665,"dense_delta_vs_named_4096_baseline_abs":{"median_ms":-338.1700000000001,"prefill_tok_per_sec":261.5,"peak_mem_gb":0.0},"dense_delta_vs_named_4096_baseline_pct":{"median_ms":-13.653780155445647,"prefill_tok_per_sec":15.81206917402346,"peak_mem_gb":0.0},"wayfinder_delta_vs_named_4096_baseline_abs":{"median_ms":-2034.7600000000002,"prefill_tok_per_sec":355.69999999999993,"peak_mem_gb":0.0},"wayfinder_delta_vs_named_4096_baseline_pct":{"median_ms":-34.12063191820815,"prefill_tok_per_sec":51.783374581452904,"peak_mem_gb":0.0},"D_estimate":97.0,"kappa":77.57258487253273,"kappa_delta_vs_anchor_abs":-24.0996026778716,"kappa_delta_vs_anchor_pct":-23.703240048734216,"crossover_estimate":12798.671209064763,"crossover_delta_vs_anchor_abs":-19331.3282748975,"crossover_delta_vs_anchor_pct":-60.16597754552334},"decision":"keep","next_action":"Because kappa improved materially and the implied crossover moved into the target band, open the guarded T=8192 sparse continuation immediately and keep climbing if kappa does not regress."}
{"id":"EXP-20260318T225600Z-QWEN35CUDA-SPARSE-8192-KAPPA-PRERUN","date":"2026-03-18","question":"With the improved sparse kernel now at kappa≈77.57 and implied crossover ≈12.8k, does the same Qwen CUDA Wayfinder/HCSA configuration continue to move in the right direction at T=8192 without violating any stability or memory stop-gates?","hypothesis":"T=8192 is still below the current crossover estimate, so Wayfinder may remain slower than dense, but the dense gap should be much smaller than under the old kappa≈101.67 regime. The main win condition for this rung is that memory remains bounded, 8/8 Wayfinder layers stay active, and empirical kappa stays at or below the new ~77.57 anchor so the next 16384 rung is mathematically credible.","change_set":["measurement-only run on top of hcsa/torch/attention_wayfinder_sparse.py","measurement-only run on top of hcsa/integrations/qwen_torch.py","measurement-only run on top of scripts/bench_qwen35_cuda_wayfinder.py","notes/LAB_NOTEBOOK.md","notes/experiments.ndjson"],"command":".venv/bin/python scripts/bench_qwen35_cuda_wayfinder.py --model-path /home/hmbown/HF_Models/Qwen3.5-9B --seq-lens 8192 --path sparse --strategy random --engine auto --warmup 1 --repeats 1 --forward-target backbone --phases dense wayfinder --skip-divergence --output benchmarks/cuda/qwen35_wayfinder/EXP-20260318T225600Z-QWEN35CUDA-SPARSE-8192-KAPPA.ndjson && journalctl -b -k --since '2026-03-18 17:56:00' | rg -n 'NVRM|Xid|Out of memory|hung task|BUG:|Call Trace'","controls":{"baseline_run_path":"benchmarks/cuda/qwen35_wayfinder/EXP-20260318T224737Z-QWEN35CUDA-SPARSE-4096-KAPPA.ndjson","supplemental_baseline_path":"benchmarks/cuda/qwen35_wayfinder/EXP-20260318T222540Z-QWEN35CUDA-SPARSE-4096-NOMETRICS.ndjson","one_process_at_a_time":true,"lock_file":"benchmarks/cuda/qwen35_wayfinder/.bench_qwen35_cuda_wayfinder.lock","retro_backfill_inference":"off","model_path":"/home/hmbown/HF_Models/Qwen3.5-9B","device":"cuda","gpu":"NVIDIA GB10","device_capability":[12,1],"torch":"2.10.0+cu130","transformers":"5.3.0","path":"sparse","strategy":"random","compute_graph_metrics":false,"forward_target":"backbone","window":64,"landmark_stride":64,"num_cycles":1,"engine_request":"auto","warmup":1,"repeats":1,"seq_lens":[8192],"kernel_log_since":"2026-03-18 17:56:00","current_anchor":{"kappa":77.57258487253273,"crossover_tokens_estimate":12798.671209064763}},"metrics":{"status":"pending","artifacts_expected":["benchmarks/cuda/qwen35_wayfinder/EXP-20260318T225600Z-QWEN35CUDA-SPARSE-8192-KAPPA.ndjson"],"required":["bench[label=dense].median_ms","bench[label=dense].prefill_tok_per_sec","bench[label=dense].peak_mem_gb","bench[label=wayfinder].median_ms","bench[label=wayfinder].prefill_tok_per_sec","bench[label=wayfinder].peak_mem_gb","bench[label=wayfinder].wayfinder_profiles","bench[label=wayfinder].wayfinder_active_layers==8","wayfinder D_estimate","wayfinder empirical kappa","wayfinder crossover_estimate","zero new kernel fault lines after kernel_log_since"]},"decision":"pending","next_action":"Run the guarded T=8192 continuation and only if kappa holds or improves with stable memory open the T=16384 PRERUN immediately."}
