{"id":"EXP-DEFINITIVE-DENSE-VS-WAYFINDER-HIGHSEQ-PRERUN","date":"2026-03-19","question":"With Triton fused kernel active, does Wayfinder show latency crossover vs dense at high seq lengths (T up to 131072)?","hypothesis":"Dense O(T^2) on 8 full-attention layers should increasingly dominate at high T; Wayfinder O(D) via Triton should produce crossover.","change_set":["measurement only — Triton fused kernel confirmed active"],"command":".venv/bin/python scripts/bench_qwen35_cuda_wayfinder.py --model-path /home/hmbown/HF_Models/Qwen3.5-9B --seq-lens 512 2048 4096 8192 16384 32768 65536 131072 --warmup 1 --repeats 3 --path sparse --strategy random --window 64 --landmark-stride 64 --forward-target backbone --phases dense wayfinder --skip-divergence --output benchmarks/cuda/qwen35_wayfinder/EXP-DEFINITIVE-DENSE-VS-WAYFINDER-HIGHSEQ.ndjson","controls":{"model":"Qwen3.5-9B","path":"sparse","strategy":"random","window":64,"landmark_stride":64,"gpu":"GB10 120GB","warmup":1,"repeats":3,"dtype":"bfloat16","forward_target":"backbone"},"metrics":{"status":"pending"},"decision":"pending","next_action":"run benchmark"}
{"id":"EXP-DEFINITIVE-DENSE-VS-WAYFINDER-HIGHSEQ-RESULT","date":"2026-03-19","question":"With Triton fused kernel active, does Wayfinder show latency crossover vs dense at high T (up to 131072)?","hypothesis":"Expected crossover as dense O(T^2) dominates at high T.","change_set":["measurement only"],"command":".venv/bin/python scripts/bench_qwen35_cuda_wayfinder.py --model-path /home/hmbown/HF_Models/Qwen3.5-9B --seq-lens 512 2048 4096 8192 16384 32768 65536 131072 --warmup 1 --repeats 3 --path sparse --forward-target backbone --phases dense wayfinder --skip-divergence","controls":{"model":"Qwen3.5-9B","path":"sparse","strategy":"random","window":64,"landmark_stride":64,"gpu":"GB10 120GB","triton_fused":"confirmed at all 64 dispatches"},"metrics":{"artifact":"benchmarks/cuda/qwen35_wayfinder/EXP-DEFINITIVE-DENSE-VS-WAYFINDER-HIGHSEQ.ndjson","smoke_test":"PASS (triton_fused confirmed, max_diff=0.016)","summary":{"T512":{"dense_ms":310.1,"wf_ms":314.1,"speedup":"0.99x","dense_peak_gb":16.80,"wf_peak_gb":16.80},"T2048":{"dense_ms":1204.5,"wf_ms":1231.2,"speedup":"0.98x","dense_peak_gb":17.11,"wf_peak_gb":17.13},"T4096":{"dense_ms":2439.5,"wf_ms":2540.8,"speedup":"0.96x","dense_peak_gb":17.54,"wf_peak_gb":17.57},"T8192":{"dense_ms":4934.4,"wf_ms":5183.0,"speedup":"0.95x","dense_peak_gb":18.38,"wf_peak_gb":18.49},"T16384":{"dense_ms":10001.3,"wf_ms":10729.7,"speedup":"0.93x","dense_peak_gb":20.08,"wf_peak_gb":20.43},"T32768":{"dense_ms":20468.7,"wf_ms":21921.0,"speedup":"0.93x","dense_peak_gb":23.46,"wf_peak_gb":24.73},"T65536":{"dense_ms":43288.8,"wf_ms":48667.4,"speedup":"0.89x","dense_peak_gb":30.23,"wf_peak_gb":35.02},"T131072":{"dense_ms":93281.9,"wf_ms":113433.9,"speedup":"0.82x","dense_peak_gb":43.78,"wf_peak_gb":62.36}},"T131072_per_layer_triton_ms":[4857.3,4932.8,4916.2,4861.4,4874.9,4875.5,4875.0,4851.3],"T131072_sparse_pct_of_forward":"34.4%","analysis":"no crossover — Wayfinder slower at all T, gap widens from 0.99x to 0.82x; gather-based sparse access cannot beat FlashAttention tiled IO; memory overhead from graph structures dominates at high T (+18.58GB at T=131072)"},"decision":"keep","next_action":"investigate block-sparse attention to use FlashAttention-compatible tiled IO, or reduce landmark density to cap degree at O(sqrt(T))"}
{"id":"EXP-20260319T212553Z-BLOCK-SPARSE-FLEX-PROTOTYPE-PRERUN","date":"2026-03-19","question":"Can a first block-Hamiltonian prototype be wired into the Torch/Qwen path using flex_attention block masks, so the repo can execute a contiguous-tile validation path instead of the existing gather-based sparse path?","hypothesis":"Replacing per-token neigh_idx gathers with a block-level Hamiltonian mask over block_size=128 should be implementable with the existing flex-attention path and should validate cleanly under targeted compile/tests without touching the gather kernel.","change_set":["hcsa/cycles.py","hcsa/torch/attention_wayfinder_permute.py","hcsa/integrations/qwen_torch.py","scripts/bench_qwen35_cuda_wayfinder.py","scripts/serve_qwen_wayfinder_cuda.py","tests/pytorch/test_torch_qwen_sparse_gqa.py","tests/test_qwen_cuda_wayfinder_cli.py"],"command":".venv/bin/python -m py_compile hcsa/cycles.py hcsa/torch/attention_wayfinder_permute.py hcsa/integrations/qwen_torch.py scripts/bench_qwen35_cuda_wayfinder.py scripts/serve_qwen_wayfinder_cuda.py tests/pytorch/test_torch_qwen_sparse_gqa.py tests/test_qwen_cuda_wayfinder_cli.py && .venv/bin/python -m pytest tests/pytorch/test_torch_qwen_sparse_gqa.py tests/test_qwen_cuda_wayfinder_cli.py -q","controls":{"baseline_context":["notes/BLOCK_HAMILTONIAN_DESIGN.md","EXP-DEFINITIVE-DENSE-VS-WAYFINDER-HIGHSEQ-RESULT"],"inference":"off","retro_backfill_inference":"off","validation_scope":"py_compile + targeted pytest only"},"metrics":{"status":"pending","required":["py_compile success","targeted pytest passes","block_sparse path visible in config/CLI/profile surfaces"]},"decision":"pending","next_action":"finish wiring tests and run targeted validation"}
{"id":"EXP-20260319T213047Z-QWEN35-BLOCK-SPARSE-SMOKE-PRERUN","date":"2026-03-19","question":"Does the new Qwen block_sparse path execute end-to-end on the real Qwen3.5-9B backbone with flex_attention, including on this machine's unsupported-but-forceable GB10 CUDA capability?","hypothesis":"With --allow-unsupported-arch --engine flex, the block-Hamiltonian path should run at least a guarded backbone smoke at T=512 and T=4096, emitting block_sparse_* profile fields instead of silently falling back.","change_set":["hcsa/cycles.py","hcsa/torch/attention_wayfinder_permute.py","hcsa/integrations/qwen_torch.py","scripts/bench_qwen35_cuda_wayfinder.py","scripts/serve_qwen_wayfinder_cuda.py"],"command":".venv/bin/python scripts/bench_qwen35_cuda_wayfinder.py --model-path /home/hmbown/HF_Models/Qwen3.5-9B --seq-lens 512 4096 --warmup 1 --repeats 1 --path block_sparse --block-size 128 --engine flex --allow-unsupported-arch --strategy random --forward-target backbone --phases wayfinder --skip-divergence --output benchmarks/cuda/qwen35_wayfinder/EXP-20260319T213047Z-QWEN35CUDA-BLOCK-SPARSE-SMOKE.ndjson","controls":{"model":"Qwen3.5-9B","path":"block_sparse","block_size":128,"strategy":"random","num_cycles":1,"forward_target":"backbone","lock_file":"benchmarks/cuda/qwen35_wayfinder/.bench_qwen35_cuda_wayfinder.lock"},"metrics":{"status":"pending","required":["completed wayfinder row for each requested seq_len","block_sparse_backend=flex_attention in profiles","no silent dense fallback"]},"decision":"pending","next_action":"run guarded smoke benchmark"}
{"id":"EXP-20260319T212553Z-BLOCK-SPARSE-FLEX-PROTOTYPE-RESULT","date":"2026-03-19","question":"Can a first block-Hamiltonian prototype be wired into the Torch/Qwen path using flex_attention block masks, so the repo can execute a contiguous-tile validation path instead of the existing gather-based sparse path?","hypothesis":"Replacing per-token neigh_idx gathers with a block-level Hamiltonian mask over block_size=128 should be implementable with the existing flex-attention path and should validate cleanly under targeted compile/tests without touching the gather kernel.","change_set":["hcsa/cycles.py","hcsa/torch/attention_wayfinder_permute.py","hcsa/integrations/qwen_torch.py","scripts/bench_qwen35_cuda_wayfinder.py","scripts/serve_qwen_wayfinder_cuda.py","tests/pytorch/test_torch_qwen_sparse_gqa.py","tests/test_qwen_cuda_wayfinder_cli.py"],"command":".venv/bin/python -m py_compile hcsa/cycles.py hcsa/torch/attention_wayfinder_permute.py hcsa/integrations/qwen_torch.py scripts/bench_qwen35_cuda_wayfinder.py scripts/serve_qwen_wayfinder_cuda.py tests/pytorch/test_torch_qwen_sparse_gqa.py tests/test_qwen_cuda_wayfinder_cli.py && .venv/bin/python -m pytest tests/pytorch/test_torch_qwen_sparse_gqa.py tests/test_qwen_cuda_wayfinder_cli.py -q","controls":{"baseline_context":["notes/BLOCK_HAMILTONIAN_DESIGN.md","EXP-DEFINITIVE-DENSE-VS-WAYFINDER-HIGHSEQ-RESULT"],"inference":"off","retro_backfill_inference":"off","validation_scope":"py_compile + targeted pytest only"},"metrics":{"py_compile":"pass","pytest":{"passed":40,"skipped":2,"failed":0},"warnings":["torch.jit.script_method deprecation warnings from PyTorch","CUDA capability warning for GB10 12.1 vs exact arch list"]},"decision":"keep","next_action":"run a guarded real-model smoke benchmark to verify the new path executes without silent dense fallback"}
{"id":"EXP-20260319T213047Z-QWEN35-BLOCK-SPARSE-SMOKE-RESULT","date":"2026-03-19","question":"Does the new Qwen block_sparse path execute end-to-end on the real Qwen3.5-9B backbone with flex_attention, including on this machine's unsupported-but-forceable GB10 CUDA capability?","hypothesis":"With --allow-unsupported-arch --engine flex, the block-Hamiltonian path should run at least a guarded backbone smoke at T=512 and T=4096, emitting block_sparse_* profile fields instead of silently falling back.","change_set":["hcsa/cycles.py","hcsa/torch/attention_wayfinder_permute.py","hcsa/integrations/qwen_torch.py","scripts/bench_qwen35_cuda_wayfinder.py","scripts/serve_qwen_wayfinder_cuda.py"],"command":".venv/bin/python scripts/bench_qwen35_cuda_wayfinder.py --model-path /home/hmbown/HF_Models/Qwen3.5-9B --seq-lens 512 4096 --warmup 1 --repeats 1 --path block_sparse --block-size 128 --engine flex --allow-unsupported-arch --strategy random --forward-target backbone --phases wayfinder --skip-divergence --output benchmarks/cuda/qwen35_wayfinder/EXP-20260319T213047Z-QWEN35CUDA-BLOCK-SPARSE-SMOKE.ndjson","controls":{"baseline_dense_artifact":"EXP-DEFINITIVE-DENSE-VS-WAYFINDER-HIGHSEQ-RESULT","model":"Qwen3.5-9B","path":"block_sparse","block_size":128,"strategy":"random","num_cycles":1,"forward_target":"backbone","repeats":1,"allow_unsupported_arch":true,"engine":"flex"},"metrics":{"artifact":"benchmarks/cuda/qwen35_wayfinder/EXP-20260319T213047Z-QWEN35CUDA-BLOCK-SPARSE-SMOKE.ndjson","status":"completed","execution":{"seq512":{"median_ms":289.48,"prefill_tok_per_sec":1768.7,"peak_mem_gb":16.8,"block_sparse_neighbor_blocks":4,"all_layers_mode":"wayfinder","all_layers_reason":null,"backend":"flex_attention"},"seq4096":{"median_ms":2372.63,"prefill_tok_per_sec":1726.4,"peak_mem_gb":17.54,"block_sparse_neighbor_blocks":9,"all_layers_mode":"wayfinder","all_layers_reason":null,"backend":"flex_attention"}},"delta_vs_dense_abs":{"seq512":{"median_ms":-20.62,"peak_mem_gb":0.0},"seq4096":{"median_ms":-66.87,"peak_mem_gb":0.0}},"delta_vs_dense_pct":{"seq512":{"median_ms":-6.65,"peak_mem_gb":0.0},"seq4096":{"median_ms":-2.74,"peak_mem_gb":0.0}},"memory_reduction_pct_convention":"100*(1-wayfinder/dense)","memory_reduction_pct":{"seq512":0.0,"seq4096":0.0},"caveat":"single-repeat smoke on forced unsupported exact arch; not yet a matched dense-vs-block_sparse benchmark"},"decision":"follow-up","next_action":"run a paired dense vs block_sparse backbone benchmark with matched controls and repeats at T=512, 4096, 16384, and 32768"}
{"id":"EXP-20260319T213753Z-QWEN35-BLOCK-SPARSE-PAIR-PRERUN","date":"2026-03-19","question":"At matched controls, does block_sparse on Qwen3.5-9B backbone improve latency or memory versus dense across T=512, 4096, 16384, 32768?","hypothesis":"The block-Hamiltonian path should preserve the memory footprint of dense within rounding noise and may show a latency crossover at longer sequence lengths because every neighborhood is compiled as contiguous block tiles instead of token-level gathers. The strongest expected improvement is at T=16384 and T=32768, where the block mask should amortize graph overhead over larger tiles.","change_set":["measurement only","reuse the existing block_sparse Qwen path, block_size=128, engine=flex"],"command":".venv/bin/python scripts/bench_qwen35_cuda_wayfinder.py --model-path /home/hmbown/HF_Models/Qwen3.5-9B --seq-lens 512 4096 16384 32768 --warmup 1 --repeats 3 --path block_sparse --block-size 128 --engine flex --allow-unsupported-arch --strategy random --forward-target backbone --phases dense wayfinder --skip-divergence --output benchmarks/cuda/qwen35_wayfinder/EXP-20260319T213753Z-QWEN35CUDA-BLOCK-SPARSE-PAIR.ndjson","controls":{"model":"Qwen3.5-9B","path":"block_sparse","block_size":128,"strategy":"random","num_cycles":1,"warmup":1,"repeats":3,"forward_target":"backbone","phases":["dense","wayfinder"],"allow_unsupported_arch":true,"engine":"flex","baseline_dense":"EXP-DEFINITIVE-DENSE-VS-WAYFINDER-HIGHSEQ-RESULT","baseline_smoke":"EXP-20260319T213047Z-QWEN35-BLOCK-SPARSE-SMOKE-RESULT"},"metrics":{"status":"pending","required":["dense and wayfinder rows present for seq_len 512, 4096, 16384, 32768","no silent dense fallback","block_sparse_backend=flex_attention in wayfinder profiles","no flex kernel compile/runtime failure"]},"decision":"pending","next_action":"run paired dense vs block_sparse benchmark and compare absolute, delta, and percentage metrics against the dense baseline"}
{"id":"EXP-20260319T221653Z-QWEN35CUDA-UNSUPPORTED-FLEX-LONGRUN-GUARD-PRERUN","date":"2026-03-19","question":"Can we prevent another host crash by tightening the unsupported-arch flex longrun guard in the Qwen CUDA benchmark and server CLIs?","hypothesis":"The partial longrun guard already present in the benchmark and server code should prevent the risky configuration once the unsafe-longrun messaging is made explicit, the server smoke path is capped at 4096 tokens, and the targeted CLI tests are promoted from expected-failure to required-pass.","change_set":["scripts/bench_qwen35_cuda_wayfinder.py","scripts/serve_qwen_wayfinder_cuda.py","tests/test_qwen_cuda_wayfinder_cli.py"],"command":".venv/bin/python -m py_compile scripts/bench_qwen35_cuda_wayfinder.py scripts/serve_qwen_wayfinder_cuda.py tests/test_qwen_cuda_wayfinder_cli.py && .venv/bin/python -m pytest tests/test_qwen_cuda_wayfinder_cli.py -q","controls":{"inference":"off","validation_scope":"py_compile + targeted CLI pytest","gpu":"GB10 120GB","device_capability":[12,1],"torch_cuda_arch_list":["sm_80","sm_90","sm_100","sm_110","sm_120","compute_120"],"validated_caps":{"permute":8192,"block_sparse":4096}},"metrics":{"status":"pending","required":["benchmark CLI longrun guard rejects unsupported block_sparse >4096 without unsafe override","serve CLI longrun guard rejects unsupported block_sparse max-input-tokens>4096 without unsafe override","unsupported-arch serve smoke still wires block_sparse at max-input-tokens=4096","targeted CLI pytest passes"]},"decision":"pending","next_action":"Run py_compile and targeted CLI pytest, then record the result and keep the guard if bounded smoke behavior still passes."}
{"id":"EXP-20260319T221653Z-QWEN35CUDA-UNSUPPORTED-FLEX-LONGRUN-GUARD-RESULT","date":"2026-03-19","question":"Can we prevent another host crash by tightening the unsupported-arch flex longrun guard in the Qwen CUDA benchmark and server CLIs?","hypothesis":"The partial longrun guard already present in the benchmark and server code should prevent the risky configuration once the unsafe-longrun messaging is made explicit, the server smoke path is capped at 4096 tokens, and the targeted CLI tests are promoted from expected-failure to required-pass.","change_set":["scripts/bench_qwen35_cuda_wayfinder.py","scripts/serve_qwen_wayfinder_cuda.py","tests/test_qwen_cuda_wayfinder_cli.py"],"command":"python -m py_compile scripts/bench_qwen35_cuda_wayfinder.py scripts/serve_qwen_wayfinder_cuda.py tests/test_qwen_cuda_wayfinder_cli.py && pytest tests/test_qwen_cuda_wayfinder_cli.py -q","controls":{"inference":"off","validation_scope":"py_compile + targeted CLI pytest","gpu":"GB10 120GB","device_capability":[12,1],"torch_cuda_arch_list":["sm_80","sm_90","sm_100","sm_110","sm_120","compute_120"],"validated_caps":{"permute":8192,"block_sparse":4096},"crash_artifact":"benchmarks/cuda/qwen35_wayfinder/EXP-20260319T213753Z-QWEN35CUDA-BLOCK-SPARSE-PAIR.ndjson","comparison_artifact":"benchmarks/cuda/qwen35_wayfinder/EXP-DEFINITIVE-DENSE-VS-WAYFINDER-HIGHSEQ.ndjson"},"metrics":{"py_compile":"pass","pytest":{"passed":10,"failed":0},"warnings":["14 torch.jit.script_method deprecation warnings from PyTorch"],"crash_artifact_rows":[["dense",512],["dense",4096],["dense",16384],["dense",32768],["wayfinder",512],["wayfinder",4096]],"crash_artifact_meta":{"path":"block_sparse","engine":"flex","allow_unsupported_arch":true,"flex_arch_supported_exact":false,"gpu":"NVIDIA GB10"},"comparison_wayfinder_peak_mem_gb_t131072":62.36,"inference":"likely unsupported-arch flex kernel fault rather than simple OOM"},"decision":"keep","next_action":"Keep unsupported-arch flex long runs behind `--unsafe-longrun`; use <=4096-token smoke on GB10 and move any longer flex validation to supported CUDA arch builds."}
{"id":"EXP-20260319T235004Z-SHA3319-NONQWEN-BASELINE-RELOCK-PRERUN","date":"2026-03-19","question":"What is the best validated original non-Qwen baseline/config in this repo right now, and what exact relock queue should run before more Qwen promotion?","hypothesis":"Existing GLM/MLX artifacts should still identify a strong long-prefill baseline and a separate quality-preserving decode candidate, but the best release artifact will likely still need a strict-observability relock and the current host may be unable to run MLX at all.","change_set":["notes/SHA-3319_NONQWEN_BASELINE_RELOCK_20260319.md","notes/LAB_NOTEBOOK.md","notes/experiments.ndjson"],"command":"python3 -c \"import mlx, sys; print(getattr(mlx, '__version__', 'unknown'))\" && python3 scripts/bench_glm_consumer_mlx.py --help && python3 -m pytest tests/mlx/test_mlx_causality.py tests/mlx/test_permute_retro_backfill.py tests/mlx/test_glm_hamiltonian_e2e.py -q","controls":{"inference":"off","strategy_order":"original non-Qwen first","expected_baselines":["benchmarks/mlx/first_release/EXP-20260218T151213Z-STABLE-PROFILE/stable_profile_summary.json","benchmarks/mlx/first_release/EXP-20260218T183512Z-GLM47-TOKENLEN-SWEEP/token_length_summary.json","benchmarks/mlx/post_reboot_20260211_20260211T202821Z/happy_median_search_20260212T005058Z/happy_median_final_summary.json","benchmarks/mlx/post_reboot_20260211_20260211T202821Z/mode3_cleanup_20260212T150726Z/mode3_summary.json"],"stop_gates":["no new benchmark before memo exists","do not call the GLM baseline relocked if fallback reasons remain non-informative","do not pretend this host can run MLX if mlx import fails"]},"metrics":{"status":"pending","required":["facts-vs-assumptions memo","named non-Qwen baseline artifacts","exact next benchmark queue with stop-gates","port-vs-do-not-port recommendation"]},"decision":"pending","next_action":"Inspect artifacts, verify local MLX availability, and write the re-lock memo."}
