{"id":"EXP-20260318T201433Z-QWEN35CUDA-SAFETY-LOWTOKEN-RESULT","date":"2026-03-18","question":"Can we make the Qwen3.5-9B CUDA path safer on this GB10 by refusing unsupported flex runs by default, while confirming the Wayfinder path still works on a low-token batched smoke and the current PyTorch test suite stays green?","hypothesis":"The current PyTorch build (2.10.0+cu130) advertises CUDA arch support only through sm_120, while the local GPU reports capability 12.1; guarding explicit flex requests should prevent the driver-level illegal-instruction path seen before the reboot, and a batched low-token smoke plus tests/pytorch should confirm that Wayfinder still functions on this machine without long-context inference.","change_set":["hcsa/integrations/qwen_torch.py","scripts/bench_qwen35_cuda_wayfinder.py","scripts/serve_qwen_wayfinder_cuda.py","notes/LAB_NOTEBOOK.md","notes/experiments.ndjson"],"command":".venv/bin/python -m py_compile hcsa/integrations/qwen_torch.py scripts/bench_qwen35_cuda_wayfinder.py scripts/serve_qwen_wayfinder_cuda.py && .venv/bin/python -m pytest tests/pytorch -q && .venv/bin/python scripts/bench_qwen35_cuda_wayfinder.py --model-path /home/hmbown/HF_Models/Qwen3.5-9B --seq-lens 64 128 --engine batched --warmup 1 --repeats 1 --forward-target backbone --phases dense wayfinder --skip-divergence --output benchmarks/cuda/qwen35_wayfinder/EXP-20260318T201433Z-QWEN35CUDA-LOWTOKEN-BATCHED.ndjson && .venv/bin/python scripts/bench_qwen35_cuda_wayfinder.py --model-path /home/hmbown/HF_Models/Qwen3.5-9B --seq-lens 64 --engine flex --warmup 1 --repeats 1 --forward-target backbone --phases dense --skip-divergence --output /tmp/EXP-20260318T201433Z-should-refuse.ndjson","controls":{"baseline_run_path":"benchmarks/cuda/qwen35_wayfinder/EXP-20260318T180911Z-QWEN35CUDA-CACHE-GUARD-SMOKE.ndjson","one_process_at_a_time":true,"lock_file":"benchmarks/cuda/qwen35_wayfinder/.bench_qwen35_cuda_wayfinder.lock","retro_backfill_inference":"off","model_path":"/home/hmbown/HF_Models/Qwen3.5-9B","device":"cuda","gpu":"NVIDIA GB10","device_capability":[12,1],"torch":"2.10.0+cu130","transformers":"5.3.0","torch_cuda_arch_list":["sm_80","sm_90","sm_100","sm_110","sm_120","compute_120"],"forward_target":"backbone","window":64,"landmark_stride":64,"num_cycles":1,"batched_smoke":{"engine":"batched","warmup":1,"repeats":1,"seq_lens":[64,128]}},"metrics":{"status":"completed","validation":{"py_compile":"pass","pytest":"61 passed, 1 skipped","cuda_warning":"GB10 capability 12.1 exceeds this torch build's advertised max 12.0"},"artifact":"benchmarks/cuda/qwen35_wayfinder/EXP-20260318T201433Z-QWEN35CUDA-LOWTOKEN-BATCHED.ndjson","per_t":{"64":{"dense":{"median_ms":153.89,"prefill_tok_per_sec":415.9,"peak_mem_gb":16.71},"wayfinder":{"median_ms":169.58,"prefill_tok_per_sec":377.4,"peak_mem_gb":16.83,"wayfinder_active_layers":8,"wayfinder_graph_cache_entries_total":8},"delta_vs_dense_abs":{"median_ms":15.69,"prefill_tok_per_sec":-38.5,"peak_mem_gb":0.12},"delta_vs_dense_pct":{"median_ms":10.2,"prefill_tok_per_sec":-9.26,"peak_mem_gb":0.72},"memory_reduction_pct_convention":"100*(1-wayfinder/dense)","memory_reduction_pct":-0.72},"128":{"dense":{"median_ms":168.99,"prefill_tok_per_sec":757.5,"peak_mem_gb":16.72},"wayfinder":{"median_ms":199.45,"prefill_tok_per_sec":641.8,"peak_mem_gb":16.98,"wayfinder_active_layers":8,"wayfinder_graph_cache_entries_total":8},"delta_vs_dense_abs":{"median_ms":30.46,"prefill_tok_per_sec":-115.7,"peak_mem_gb":0.26},"delta_vs_dense_pct":{"median_ms":18.02,"prefill_tok_per_sec":-15.27,"peak_mem_gb":1.56},"memory_reduction_pct_convention":"100*(1-wayfinder/dense)","memory_reduction_pct":-1.56}},"guard_refusal":{"exit_code":1,"artifact_created":false,"message_contains":"Requested `--engine flex` on a CUDA device that this PyTorch build does not explicitly support"},"cache_control":{"entries_cleared_before_t128":8,"layers_cleared_before_t128":8}},"decision":"keep","next_action":"Stay in low-token bounded validation mode and expand with engine=batched or engine=auto before any further long-context runs; revisit flex only with an explicit override or a torch build that advertises sm_121 support."}
{"id":"EXP-20260318T203050Z-QWEN35CUDA-LOWTOKEN-AUTO-256-PRERUN","date":"2026-03-18","question":"With the new unsupported-flex guard in place, does engine=auto stay stable on this GB10 at the next low-token step (256) without producing any new current-boot NVIDIA or OOM kernel events?","hypothesis":"On this machine engine=auto should resolve away from flex, use the safer non-flex Wayfinder path, and complete T=256 cleanly; dense should remain faster at this short context, but Wayfinder should still activate on all 8 swapped layers and keep memory close to dense.","change_set":["measurement-only"],"command":".venv/bin/python scripts/bench_qwen35_cuda_wayfinder.py --model-path /home/hmbown/HF_Models/Qwen3.5-9B --seq-lens 256 --engine auto --warmup 1 --repeats 1 --forward-target backbone --phases dense wayfinder --skip-divergence --output benchmarks/cuda/qwen35_wayfinder/EXP-20260318T203050Z-QWEN35CUDA-LOWTOKEN-AUTO-256.ndjson && journalctl -b -k --since '2026-03-18 15:30:50' | rg -n 'NVRM|Xid|Out of memory|hung task|BUG:|Call Trace'","controls":{"baseline_run_path":"benchmarks/cuda/qwen35_wayfinder/EXP-20260318T201433Z-QWEN35CUDA-LOWTOKEN-BATCHED.ndjson","one_process_at_a_time":true,"lock_file":"benchmarks/cuda/qwen35_wayfinder/.bench_qwen35_cuda_wayfinder.lock","retro_backfill_inference":"off","model_path":"/home/hmbown/HF_Models/Qwen3.5-9B","device":"cuda","gpu":"NVIDIA GB10","device_capability":[12,1],"torch":"2.10.0+cu130","transformers":"5.3.0","forward_target":"backbone","engine_request":"auto","expected_engine_resolution":"non-flex","window":64,"landmark_stride":64,"num_cycles":1,"warmup":1,"repeats":1,"seq_lens":[256],"kernel_log_since":"2026-03-18 15:30:50"},"metrics":{"status":"pending","artifacts_expected":["benchmarks/cuda/qwen35_wayfinder/EXP-20260318T203050Z-QWEN35CUDA-LOWTOKEN-AUTO-256.ndjson"],"required":["bench[label=dense].median_ms","bench[label=dense].prefill_tok_per_sec","bench[label=dense].peak_mem_gb","bench[label=wayfinder].median_ms","bench[label=wayfinder].prefill_tok_per_sec","bench[label=wayfinder].peak_mem_gb","bench[label=wayfinder].wayfinder_profiles","zero new kernel fault lines after kernel_log_since"]},"decision":"pending","next_action":"Run the 256 auto benchmark, inspect only new current-boot kernel lines after the experiment start time, and stop immediately if any new NVIDIA or OOM fault appears."}
{"id":"EXP-20260318T203050Z-QWEN35CUDA-LOWTOKEN-AUTO-256-RESULT","date":"2026-03-18","question":"With the new unsupported-flex guard in place, does engine=auto stay stable on this GB10 at the next low-token step (256) without producing any new current-boot NVIDIA or OOM kernel events?","hypothesis":"On this machine engine=auto should resolve away from flex, use the safer non-flex Wayfinder path, and complete T=256 cleanly; dense should remain faster at this short context, but Wayfinder should still activate on all 8 swapped layers and keep memory close to dense.","change_set":["measurement-only","notes/LAB_NOTEBOOK.md","notes/experiments.ndjson"],"command":".venv/bin/python scripts/bench_qwen35_cuda_wayfinder.py --model-path /home/hmbown/HF_Models/Qwen3.5-9B --seq-lens 256 --engine auto --warmup 1 --repeats 1 --forward-target backbone --phases dense wayfinder --skip-divergence --output benchmarks/cuda/qwen35_wayfinder/EXP-20260318T203050Z-QWEN35CUDA-LOWTOKEN-AUTO-256.ndjson && journalctl -b -k --since '2026-03-18 15:33:11' | rg -n 'NVRM|Xid|Out of memory|hung task|BUG:|Call Trace'","controls":{"baseline_run_path":"benchmarks/cuda/qwen35_wayfinder/EXP-20260318T201433Z-QWEN35CUDA-LOWTOKEN-BATCHED.ndjson","one_process_at_a_time":true,"lock_file":"benchmarks/cuda/qwen35_wayfinder/.bench_qwen35_cuda_wayfinder.lock","retro_backfill_inference":"off","model_path":"/home/hmbown/HF_Models/Qwen3.5-9B","device":"cuda","gpu":"NVIDIA GB10","device_capability":[12,1],"torch":"2.10.0+cu130","transformers":"5.3.0","forward_target":"backbone","engine_request":"auto","expected_engine_resolution":"non-flex","window":64,"landmark_stride":64,"num_cycles":1,"warmup":1,"repeats":1,"seq_lens":[256],"kernel_log_since":"2026-03-18 15:33:11"},"metrics":{"status":"completed","artifact":"benchmarks/cuda/qwen35_wayfinder/EXP-20260318T203050Z-QWEN35CUDA-LOWTOKEN-AUTO-256.ndjson","dense":{"median_ms":207.38,"prefill_tok_per_sec":1234.5,"peak_mem_gb":16.74},"wayfinder":{"median_ms":263.22,"prefill_tok_per_sec":972.6,"peak_mem_gb":17.27,"wayfinder_active_layers":8,"wayfinder_graph_cache_entries_total":8,"engine":"batched"},"delta_vs_dense_abs":{"median_ms":55.84,"prefill_tok_per_sec":-261.9,"peak_mem_gb":0.53},"delta_vs_dense_pct":{"median_ms":26.93,"prefill_tok_per_sec":-21.21,"peak_mem_gb":3.17},"memory_reduction_pct_convention":"100*(1-wayfinder/dense)","memory_reduction_pct":-3.17,"kernel_fault_lines_after_start":0},"decision":"keep","next_action":"Continue the same bounded ladder with T=512 only, same controls, and stop immediately on any new kernel-fault line or if engine=auto resolves to flex."}
{"id":"EXP-20260318T203600Z-QWEN35CUDA-LOWTOKEN-AUTO-512-PRERUN","date":"2026-03-18","question":"After the clean T=256 run, does engine=auto remain stable at T=512 without producing any new current-boot NVIDIA or OOM kernel events?","hypothesis":"engine=auto should continue to resolve to the non-flex Wayfinder path on this GB10, complete T=512 cleanly, and keep Wayfinder fully active across all 8 swapped layers with bounded cache.","change_set":["measurement-only"],"command":".venv/bin/python scripts/bench_qwen35_cuda_wayfinder.py --model-path /home/hmbown/HF_Models/Qwen3.5-9B --seq-lens 512 --engine auto --warmup 1 --repeats 1 --forward-target backbone --phases dense wayfinder --skip-divergence --output benchmarks/cuda/qwen35_wayfinder/EXP-20260318T203600Z-QWEN35CUDA-LOWTOKEN-AUTO-512.ndjson && journalctl -b -k --since '2026-03-18 15:36:00' | rg -n 'NVRM|Xid|Out of memory|hung task|BUG:|Call Trace'","controls":{"baseline_run_path":"benchmarks/cuda/qwen35_wayfinder/EXP-20260318T203050Z-QWEN35CUDA-LOWTOKEN-AUTO-256.ndjson","one_process_at_a_time":true,"lock_file":"benchmarks/cuda/qwen35_wayfinder/.bench_qwen35_cuda_wayfinder.lock","retro_backfill_inference":"off","model_path":"/home/hmbown/HF_Models/Qwen3.5-9B","device":"cuda","gpu":"NVIDIA GB10","device_capability":[12,1],"torch":"2.10.0+cu130","transformers":"5.3.0","forward_target":"backbone","engine_request":"auto","expected_engine_resolution":"non-flex","window":64,"landmark_stride":64,"num_cycles":1,"warmup":1,"repeats":1,"seq_lens":[512],"kernel_log_since":"2026-03-18 15:36:00"},"metrics":{"status":"pending","artifacts_expected":["benchmarks/cuda/qwen35_wayfinder/EXP-20260318T203600Z-QWEN35CUDA-LOWTOKEN-AUTO-512.ndjson"],"required":["bench[label=dense].median_ms","bench[label=dense].prefill_tok_per_sec","bench[label=dense].peak_mem_gb","bench[label=wayfinder].median_ms","bench[label=wayfinder].prefill_tok_per_sec","bench[label=wayfinder].peak_mem_gb","bench[label=wayfinder].wayfinder_profiles","zero new kernel fault lines after kernel_log_since"]},"decision":"pending","next_action":"Run the 512 auto benchmark, inspect only new current-boot kernel lines after the experiment start time, and stop immediately if any new NVIDIA or OOM fault appears."}
{"id":"EXP-20260318T203600Z-QWEN35CUDA-LOWTOKEN-AUTO-512-RESULT","date":"2026-03-18","question":"After the clean T=256 run, does engine=auto remain stable at T=512 without producing any new current-boot NVIDIA or OOM kernel events?","hypothesis":"engine=auto should continue to resolve to the non-flex Wayfinder path on this GB10, complete T=512 cleanly, and keep Wayfinder fully active across all 8 swapped layers with bounded cache.","change_set":["measurement-only","notes/LAB_NOTEBOOK.md","notes/experiments.ndjson"],"command":".venv/bin/python scripts/bench_qwen35_cuda_wayfinder.py --model-path /home/hmbown/HF_Models/Qwen3.5-9B --seq-lens 512 --engine auto --warmup 1 --repeats 1 --forward-target backbone --phases dense wayfinder --skip-divergence --output benchmarks/cuda/qwen35_wayfinder/EXP-20260318T203600Z-QWEN35CUDA-LOWTOKEN-AUTO-512.ndjson && journalctl -b -k --since '2026-03-18 15:37:17' | rg -n 'NVRM|Xid|Out of memory|hung task|BUG:|Call Trace'","controls":{"baseline_run_path":"benchmarks/cuda/qwen35_wayfinder/EXP-20260318T203050Z-QWEN35CUDA-LOWTOKEN-AUTO-256.ndjson","one_process_at_a_time":true,"lock_file":"benchmarks/cuda/qwen35_wayfinder/.bench_qwen35_cuda_wayfinder.lock","retro_backfill_inference":"off","model_path":"/home/hmbown/HF_Models/Qwen3.5-9B","device":"cuda","gpu":"NVIDIA GB10","device_capability":[12,1],"torch":"2.10.0+cu130","transformers":"5.3.0","forward_target":"backbone","engine_request":"auto","expected_engine_resolution":"non-flex","window":64,"landmark_stride":64,"num_cycles":1,"warmup":1,"repeats":1,"seq_lens":[512],"kernel_log_since":"2026-03-18 15:37:17"},"metrics":{"status":"completed","artifact":"benchmarks/cuda/qwen35_wayfinder/EXP-20260318T203600Z-QWEN35CUDA-LOWTOKEN-AUTO-512.ndjson","dense":{"median_ms":300.42,"prefill_tok_per_sec":1704.3,"peak_mem_gb":16.8},"wayfinder":{"median_ms":437.08,"prefill_tok_per_sec":1171.4,"peak_mem_gb":17.85,"wayfinder_active_layers":8,"wayfinder_graph_cache_entries_total":8,"engine":"batched"},"delta_vs_dense_abs":{"median_ms":136.66,"prefill_tok_per_sec":-532.9,"peak_mem_gb":1.05},"delta_vs_dense_pct":{"median_ms":45.49,"prefill_tok_per_sec":-31.27,"peak_mem_gb":6.25},"memory_reduction_pct_convention":"100*(1-wayfinder/dense)","memory_reduction_pct":-6.25,"kernel_fault_lines_after_start":0},"decision":"keep","next_action":"Continue the same bounded ladder with T=1024 only, same controls, and stop immediately on any new kernel-fault line or if engine=auto resolves to flex."}
{"id":"EXP-20260318T204303Z-QWEN35CUDA-LOWTOKEN-AUTO-1024-PRERUN","date":"2026-03-18","question":"After clean T=256 and T=512 guarded runs, does engine=auto remain stable at T=1024 without producing any new current-boot NVIDIA or OOM kernel events?","hypothesis":"engine=auto should continue to resolve to the non-flex Wayfinder path on this GB10, complete T=1024 cleanly, and keep Wayfinder fully active across all 8 swapped layers with bounded cache.","change_set":["measurement-only"],"command":".venv/bin/python scripts/bench_qwen35_cuda_wayfinder.py --model-path /home/hmbown/HF_Models/Qwen3.5-9B --seq-lens 1024 --engine auto --warmup 1 --repeats 1 --forward-target backbone --phases dense wayfinder --skip-divergence --output benchmarks/cuda/qwen35_wayfinder/EXP-20260318T204303Z-QWEN35CUDA-LOWTOKEN-AUTO-1024.ndjson && journalctl -b -k --since '2026-03-18 15:43:03' | rg -n 'NVRM|Xid|Out of memory|hung task|BUG:|Call Trace'","controls":{"baseline_run_path":"benchmarks/cuda/qwen35_wayfinder/EXP-20260318T203600Z-QWEN35CUDA-LOWTOKEN-AUTO-512.ndjson","one_process_at_a_time":true,"lock_file":"benchmarks/cuda/qwen35_wayfinder/.bench_qwen35_cuda_wayfinder.lock","retro_backfill_inference":"off","model_path":"/home/hmbown/HF_Models/Qwen3.5-9B","device":"cuda","gpu":"NVIDIA GB10","device_capability":[12,1],"torch":"2.10.0+cu130","transformers":"5.3.0","forward_target":"backbone","engine_request":"auto","expected_engine_resolution":"non-flex","window":64,"landmark_stride":64,"num_cycles":1,"warmup":1,"repeats":1,"seq_lens":[1024],"kernel_log_since":"2026-03-18 15:43:03"},"metrics":{"status":"pending","artifacts_expected":["benchmarks/cuda/qwen35_wayfinder/EXP-20260318T204303Z-QWEN35CUDA-LOWTOKEN-AUTO-1024.ndjson"],"required":["bench[label=dense].median_ms","bench[label=dense].prefill_tok_per_sec","bench[label=dense].peak_mem_gb","bench[label=wayfinder].median_ms","bench[label=wayfinder].prefill_tok_per_sec","bench[label=wayfinder].peak_mem_gb","bench[label=wayfinder].wayfinder_profiles","zero new kernel fault lines after kernel_log_since"]},"decision":"pending","next_action":"Run the 1024 auto benchmark, inspect only new current-boot kernel lines after the experiment start time, and stop immediately if any new NVIDIA or OOM fault appears."}
{"id":"EXP-20260318T204303Z-QWEN35CUDA-LOWTOKEN-AUTO-1024-RESULT","date":"2026-03-18","question":"After clean T=256 and T=512 guarded runs, does engine=auto remain stable at T=1024 without producing any new current-boot NVIDIA or OOM kernel events?","hypothesis":"engine=auto should continue to resolve to the non-flex Wayfinder path on this GB10, complete T=1024 cleanly, and keep Wayfinder fully active across all 8 swapped layers with bounded cache.","change_set":["measurement-only","notes/LAB_NOTEBOOK.md","notes/experiments.ndjson"],"command":".venv/bin/python scripts/bench_qwen35_cuda_wayfinder.py --model-path /home/hmbown/HF_Models/Qwen3.5-9B --seq-lens 1024 --engine auto --warmup 1 --repeats 1 --forward-target backbone --phases dense wayfinder --skip-divergence --output benchmarks/cuda/qwen35_wayfinder/EXP-20260318T204303Z-QWEN35CUDA-LOWTOKEN-AUTO-1024.ndjson && journalctl -b -k --since '2026-03-18 15:43:03' | rg -n 'NVRM|Xid|Out of memory|hung task|BUG:|Call Trace'","controls":{"baseline_run_path":"benchmarks/cuda/qwen35_wayfinder/EXP-20260318T203600Z-QWEN35CUDA-LOWTOKEN-AUTO-512.ndjson","one_process_at_a_time":true,"lock_file":"benchmarks/cuda/qwen35_wayfinder/.bench_qwen35_cuda_wayfinder.lock","retro_backfill_inference":"off","model_path":"/home/hmbown/HF_Models/Qwen3.5-9B","device":"cuda","gpu":"NVIDIA GB10","device_capability":[12,1],"torch":"2.10.0+cu130","transformers":"5.3.0","forward_target":"backbone","engine_request":"auto","expected_engine_resolution":"non-flex","window":64,"landmark_stride":64,"num_cycles":1,"warmup":1,"repeats":1,"seq_lens":[1024],"kernel_log_since":"2026-03-18 15:43:03"},"metrics":{"status":"completed","artifact":"benchmarks/cuda/qwen35_wayfinder/EXP-20260318T204303Z-QWEN35CUDA-LOWTOKEN-AUTO-1024.ndjson","dense":{"median_ms":550.05,"prefill_tok_per_sec":1861.6,"peak_mem_gb":16.9},"wayfinder":{"median_ms":837.8,"prefill_tok_per_sec":1222.2,"peak_mem_gb":19.02,"wayfinder_active_layers":8,"wayfinder_graph_cache_entries_total":8,"engine":"batched"},"delta_vs_dense_abs":{"median_ms":287.75,"prefill_tok_per_sec":-639.4,"peak_mem_gb":2.12},"delta_vs_dense_pct":{"median_ms":52.31,"prefill_tok_per_sec":-34.35,"peak_mem_gb":12.54},"memory_reduction_pct_convention":"100*(1-wayfinder/dense)","memory_reduction_pct":-12.54,"kernel_fault_lines_after_start":0},"decision":"keep","next_action":"If continuing within the low-token safety envelope, advance to T=2048 only with the same controls and stop immediately on any new kernel-fault line or if engine=auto resolves to flex."}
{"id":"EXP-20260318T204752Z-QWEN35CUDA-LOWTOKEN-AUTO-2048-PRERUN","date":"2026-03-18","question":"After clean guarded runs through T=1024, does engine=auto remain stable at T=2048 without producing any new current-boot NVIDIA or OOM kernel events?","hypothesis":"engine=auto should continue to resolve to the non-flex Wayfinder path on this GB10, complete T=2048 cleanly, and keep Wayfinder fully active across all 8 swapped layers with bounded cache.","change_set":["measurement-only"],"command":".venv/bin/python scripts/bench_qwen35_cuda_wayfinder.py --model-path /home/hmbown/HF_Models/Qwen3.5-9B --seq-lens 2048 --engine auto --warmup 1 --repeats 1 --forward-target backbone --phases dense wayfinder --skip-divergence --output benchmarks/cuda/qwen35_wayfinder/EXP-20260318T204752Z-QWEN35CUDA-LOWTOKEN-AUTO-2048.ndjson && journalctl -b -k --since '2026-03-18 15:47:52' | rg -n 'NVRM|Xid|Out of memory|hung task|BUG:|Call Trace'","controls":{"baseline_run_path":"benchmarks/cuda/qwen35_wayfinder/EXP-20260318T204303Z-QWEN35CUDA-LOWTOKEN-AUTO-1024.ndjson","one_process_at_a_time":true,"lock_file":"benchmarks/cuda/qwen35_wayfinder/.bench_qwen35_cuda_wayfinder.lock","retro_backfill_inference":"off","model_path":"/home/hmbown/HF_Models/Qwen3.5-9B","device":"cuda","gpu":"NVIDIA GB10","device_capability":[12,1],"torch":"2.10.0+cu130","transformers":"5.3.0","forward_target":"backbone","engine_request":"auto","expected_engine_resolution":"non-flex","window":64,"landmark_stride":64,"num_cycles":1,"warmup":1,"repeats":1,"seq_lens":[2048],"kernel_log_since":"2026-03-18 15:47:52"},"metrics":{"status":"pending","artifacts_expected":["benchmarks/cuda/qwen35_wayfinder/EXP-20260318T204752Z-QWEN35CUDA-LOWTOKEN-AUTO-2048.ndjson"],"required":["bench[label=dense].median_ms","bench[label=dense].prefill_tok_per_sec","bench[label=dense].peak_mem_gb","bench[label=wayfinder].median_ms","bench[label=wayfinder].prefill_tok_per_sec","bench[label=wayfinder].peak_mem_gb","bench[label=wayfinder].wayfinder_profiles","zero new kernel fault lines after kernel_log_since"]},"decision":"pending","next_action":"Run the 2048 auto benchmark, inspect only new current-boot kernel lines after the experiment start time, and stop immediately if any new NVIDIA or OOM fault appears."}
