{"id":"EXP-20260319T041640Z-QWEN35CUDA-BACKBONE-RESIDENCY-16K-PRERUN","date":"2026-03-19","question":"Can the Qwen backbone benchmark loader force or verify equal CUDA residency for dense and Wayfinder/HCSA so the 4096 -> 8192 -> 16384 ladder produces mathematically valid latency, memory, and kappa checkpoints again?","hypothesis":"The current long-context blocker is benchmark comparability, not a new Wayfinder/HCSA stability fault. In scripts/bench_qwen35_cuda_wayfinder.py, dense and Wayfinder both load with device_map=\"auto\" and the benchmark then times model.model for forward_target=backbone. On the last query-chunk-first artifact, that left almost all backbone parameters offloaded ({'cuda:0': 1, 'meta': 425} and model.layers on cpu), which made the dense rows unusable and invalidated kappa and crossover estimates. If the benchmark load path is changed so backbone timing either places the whole model on cuda:0 or aborts when the selected benchmark module is split across cpu/meta devices, the 4096 and 8192 checkpoints should return to valid dense-vs-Wayfinder/HCSA comparisons. That will let us measure whether the current variable-chunk and compute-dtype changes actually make the 16384 rung credible instead of chasing a fake crossover.","change_set":["planned edits to scripts/bench_qwen35_cuda_wayfinder.py","possible small regression updates in tests/test_qwen_cuda_wayfinder_cli.py","possible small regression updates in tests/pytorch/test_torch_qwen_sparse_gqa.py","notes/LAB_NOTEBOOK.md","notes/experiments.ndjson"],"command":".venv/bin/python -m py_compile hcsa/integrations/qwen_torch.py hcsa/torch/attention_wayfinder_sparse.py scripts/bench_qwen35_cuda_wayfinder.py tests/pytorch/test_torch_qwen_sparse_gqa.py tests/test_qwen_cuda_wayfinder_cli.py && .venv/bin/python -m pytest tests/pytorch/test_torch_qwen_sparse_gqa.py tests/pytorch/test_torch_causality.py tests/pytorch/test_torch_dense_limit_equivalence.py tests/pytorch/test_torch_matches_mlx_reference_small.py tests/test_qwen_cuda_wayfinder_cli.py -q && .venv/bin/python scripts/bench_qwen35_cuda_wayfinder.py --model-path /home/hmbown/HF_Models/Qwen3.5-9B --seq-lens 4096 8192 --path sparse --strategy random --engine auto --warmup 1 --repeats 1 --forward-target backbone --phases dense wayfinder --skip-divergence --output benchmarks/cuda/qwen35_wayfinder/EXP-20260319T041640Z-QWEN35CUDA-BACKBONE-RESIDENCY-4096-8192.ndjson && journalctl -b -k --since '2026-03-18 23:16:40 CDT' | rg -n 'NVRM|Xid|Out of memory|hung task|BUG:|Call Trace'","controls":{"baseline_run_path":"benchmarks/cuda/qwen35_wayfinder/EXP-20260318T231105Z-QWEN35CUDA-SPARSE-ADAPTIVE-CHUNK.ndjson","confounded_run_path":"benchmarks/cuda/qwen35_wayfinder/EXP-20260319T040003Z-QWEN35CUDA-SPARSE-QCHUNK-FIRST.ndjson","one_process_at_a_time":true,"lock_file":"benchmarks/cuda/qwen35_wayfinder/.bench_qwen35_cuda_wayfinder.lock","retro_backfill_inference":"off","model_path":"/home/hmbown/HF_Models/Qwen3.5-9B","device":"cuda","gpu":"NVIDIA GB10","device_capability":[12,1],"torch":"2.10.0+cu130","transformers":"5.3.0","path":"sparse","strategy":"random","compute_graph_metrics":false,"forward_target":"backbone","window":64,"landmark_stride":64,"num_cycles":1,"engine_request":"auto","warmup":1,"repeats":1,"seq_lens_gate":[4096,8192],"seq_len_contingent":[16384],"kernel_log_since":"2026-03-18 23:16:40 CDT","current_anchor_4096":{"dense_ms":2141.41,"wayfinder_ms":3343.39,"D_estimate":97.0,"kappa":65.93455832495403,"crossover_tokens_estimate":8837.104194462412},"current_anchor_8192":{"dense_ms":4349.72,"wayfinder_ms":7958.37,"D_estimate":129.0,"kappa":116.18541483203657,"crossover_tokens_estimate":81842.80503970875}},"metrics":{"status":"pending","artifacts_expected":["benchmarks/cuda/qwen35_wayfinder/EXP-20260319T041640Z-QWEN35CUDA-BACKBONE-RESIDENCY-4096-8192.ndjson","benchmarks/cuda/qwen35_wayfinder/EXP-20260319T041640Z-QWEN35CUDA-BACKBONE-RESIDENCY-16384.ndjson"],"required":["py_compile success","pytest selected suite passes","bench[label=dense][seq_len=4096].median_ms","bench[label=wayfinder][seq_len=4096].median_ms","bench[label=dense][seq_len=8192].median_ms","bench[label=wayfinder][seq_len=8192].median_ms","dense and wayfinder residency metadata for backbone module","no cpu or meta residency in backbone benchmark module","matching real-device placement for dense and wayfinder","bench[label=wayfinder].wayfinder_profiles","bench[label=wayfinder].wayfinder_active_layers==8","wayfinder D_estimate","wayfinder empirical kappa","wayfinder crossover_estimate","zero new kernel fault lines after kernel_log_since"]},"decision":"pending","next_action":"Patch the benchmark loader to enforce or validate single-device backbone residency, run the guarded 4096/8192 checkpoint, and only if 8192 kappa improves while stability holds continue automatically to 16384."}
{"id":"EXP-20260319T043357Z-QWEN35CUDA-BACKBONE-RESIDENCY-TIEBREAK-PRERUN","date":"2026-03-19","question":"Which repaired-loader benchmark regime is actually reproducible on the current workspace and machine: the 041640 result where 8192 improved to kappa≈70.95 and reopened 16384, or the 041705 result where 4096/8192 both regressed above kappa=128 and blocked 16k immediately?","hypothesis":"H1: benchmarks/cuda/qwen35_wayfinder/EXP-20260319T041640Z-QWEN35CUDA-BACKBONE-RESIDENCY-4096-8192.ndjson is the reproducible regime, with T=4096 Wayfinder/HCSA around 3593 ms, T=8192 around 9395 ms, dense around 2516/8409 ms, and kappa≈60.31/70.95. H2: benchmarks/cuda/qwen35_wayfinder/EXP-20260319T041705Z-QWEN35CUDA-BACKBONE-RESIDENCY-GUARD-4096-8192.ndjson is the reproducible regime, with T=4096 Wayfinder/HCSA around 7102 ms, T=8192 around 9287 ms, dense around 2155/4368 ms, and kappa≈139.15/135.01. A fresh measurement-only rerun on the current code with the same repaired loader should resolve which regime actually reproduces, or prove the benchmark is unstable enough that no honest 16k claim can be made yet.","change_set":["measurement-only rerun on current code","notes/LAB_NOTEBOOK.md","notes/experiments.ndjson"],"command":".venv/bin/python scripts/bench_qwen35_cuda_wayfinder.py --model-path /home/hmbown/HF_Models/Qwen3.5-9B --seq-lens 4096 8192 --path sparse --strategy random --engine auto --warmup 1 --repeats 1 --forward-target backbone --phases dense wayfinder --skip-divergence --output benchmarks/cuda/qwen35_wayfinder/EXP-20260319T043357Z-QWEN35CUDA-BACKBONE-RESIDENCY-TIEBREAK-4096-8192.ndjson && journalctl -b -k --since '2026-03-18 23:33:57 CDT' | rg -n 'NVRM|Xid|Out of memory|hung task|BUG:|Call Trace'","controls":{"baseline_run_path_h1":"benchmarks/cuda/qwen35_wayfinder/EXP-20260319T041640Z-QWEN35CUDA-BACKBONE-RESIDENCY-4096-8192.ndjson","baseline_run_path_h2":"benchmarks/cuda/qwen35_wayfinder/EXP-20260319T041705Z-QWEN35CUDA-BACKBONE-RESIDENCY-GUARD-4096-8192.ndjson","anchor_run_path":"benchmarks/cuda/qwen35_wayfinder/EXP-20260318T231105Z-QWEN35CUDA-SPARSE-ADAPTIVE-CHUNK.ndjson","one_process_at_a_time":true,"lock_file":"benchmarks/cuda/qwen35_wayfinder/.bench_qwen35_cuda_wayfinder.lock","retro_backfill_inference":"off","model_path":"/home/hmbown/HF_Models/Qwen3.5-9B","device":"cuda","gpu":"NVIDIA GB10","device_capability":[12,1],"torch":"2.10.0+cu130","transformers":"5.3.0","path":"sparse","strategy":"random","compute_graph_metrics":false,"forward_target":"backbone","window":64,"landmark_stride":64,"num_cycles":1,"engine_request":"auto","warmup":1,"repeats":1,"seq_lens":[4096,8192],"kernel_log_since":"2026-03-18 23:33:57 CDT"},"metrics":{"status":"pending","artifacts_expected":["benchmarks/cuda/qwen35_wayfinder/EXP-20260319T043357Z-QWEN35CUDA-BACKBONE-RESIDENCY-TIEBREAK-4096-8192.ndjson"],"required":["bench[label=dense][seq_len=4096].median_ms","bench[label=wayfinder][seq_len=4096].median_ms","bench[label=dense][seq_len=8192].median_ms","bench[label=wayfinder][seq_len=8192].median_ms","dense and wayfinder residency metadata for backbone module","no cpu or meta residency in backbone benchmark module","matching real-device placement for dense and wayfinder","bench[label=wayfinder].wayfinder_profiles","bench[label=wayfinder].wayfinder_active_layers==8","zero new kernel fault lines after kernel_log_since"]},"decision":"pending","next_action":"Run the measurement-only tie-break checkpoint and compare it directly against both repaired-loader hypotheses before making any further 16k claim."}
{"id":"EXP-20260319T041640Z-QWEN35CUDA-BACKBONE-RESIDENCY-16K-RESULT","date":"2026-03-19","question":"Can the Qwen backbone benchmark loader force or verify equal CUDA residency for dense and Wayfinder/HCSA so the 4096 -> 8192 -> 16384 ladder produces mathematically valid latency, memory, and kappa checkpoints again?","hypothesis":"The long-context blocker was benchmark comparability, not graph build. For forward_target=backbone, forcing a whole-model CUDA load and auditing benchmark-module residency should make dense and Wayfinder/HCSA rows comparable again and reopen the ladder only if the kernel math really improved.","change_set":["scripts/bench_qwen35_cuda_wayfinder.py","tests/test_qwen_cuda_wayfinder_cli.py","notes/LAB_NOTEBOOK.md","notes/experiments.ndjson"],"command":".venv/bin/python -m py_compile hcsa/integrations/qwen_torch.py hcsa/torch/attention_wayfinder_sparse.py scripts/bench_qwen35_cuda_wayfinder.py tests/pytorch/test_torch_qwen_sparse_gqa.py tests/test_qwen_cuda_wayfinder_cli.py && .venv/bin/python -m pytest tests/pytorch/test_torch_qwen_sparse_gqa.py tests/pytorch/test_torch_causality.py tests/pytorch/test_torch_dense_limit_equivalence.py tests/pytorch/test_torch_matches_mlx_reference_small.py tests/test_qwen_cuda_wayfinder_cli.py -q && .venv/bin/python scripts/bench_qwen35_cuda_wayfinder.py --model-path /home/hmbown/HF_Models/Qwen3.5-9B --seq-lens 4096 8192 --path sparse --strategy random --engine auto --warmup 1 --repeats 1 --forward-target backbone --phases dense wayfinder --skip-divergence --output benchmarks/cuda/qwen35_wayfinder/EXP-20260319T041640Z-QWEN35CUDA-BACKBONE-RESIDENCY-4096-8192.ndjson && journalctl -b -k --since '2026-03-18 23:16:40 CDT' | rg -n 'NVRM|Xid|Out of memory|hung task|BUG:|Call Trace' && .venv/bin/python scripts/bench_qwen35_cuda_wayfinder.py --model-path /home/hmbown/HF_Models/Qwen3.5-9B --seq-lens 16384 --path sparse --strategy random --engine auto --warmup 1 --repeats 1 --forward-target backbone --phases dense wayfinder --skip-divergence --output benchmarks/cuda/qwen35_wayfinder/EXP-20260319T041640Z-QWEN35CUDA-BACKBONE-RESIDENCY-16384.ndjson","controls":{"baseline_run_path":"benchmarks/cuda/qwen35_wayfinder/EXP-20260318T231105Z-QWEN35CUDA-SPARSE-ADAPTIVE-CHUNK.ndjson","one_process_at_a_time":true,"lock_file":"benchmarks/cuda/qwen35_wayfinder/.bench_qwen35_cuda_wayfinder.lock","retro_backfill_inference":"off","model_path":"/home/hmbown/HF_Models/Qwen3.5-9B","device":"cuda","gpu":"NVIDIA GB10","device_capability":[12,1],"torch":"2.10.0+cu130","transformers":"5.3.0","path":"sparse","strategy":"random","compute_graph_metrics":false,"forward_target":"backbone","window":64,"landmark_stride":64,"num_cycles":1,"engine_request":"auto","warmup":1,"repeats":1,"seq_lens_gate":[4096,8192],"seq_len_contingent":[16384],"kernel_log_since":"2026-03-18 23:16:40 CDT"},"metrics":{"status":"completed","validation":{"py_compile":"pass","pytest":{"passed":31,"skipped":1,"failed":0}},"warnings":["existing torch.jit.script_method deprecation warnings","existing GB10 capability 12.1 vs PyTorch max advertised 12.0 warning"],"artifacts":["benchmarks/cuda/qwen35_wayfinder/EXP-20260319T041640Z-QWEN35CUDA-BACKBONE-RESIDENCY-4096-8192.ndjson","benchmarks/cuda/qwen35_wayfinder/EXP-20260319T041640Z-QWEN35CUDA-BACKBONE-RESIDENCY-16384.ndjson"],"kernel_fault_lines_after_start":0,"benchmark_residency":{"dense_benchmark_module_device_counts":{"cuda:0":428},"wayfinder_benchmark_module_device_counts":{"cuda:0":428},"result":"single_gpu_comparable"},"gate_4096":{"dense":{"median_ms":2515.97,"prefill_tok_per_sec":1628.0,"peak_mem_gb":17.54},"wayfinder":{"median_ms":3593.43,"prefill_tok_per_sec":1139.9,"peak_mem_gb":17.57,"wayfinder_active_layers":8,"attn_kernel_ms_mean":200.2872156253943,"effective_chunking":{"query_chunk_size":1024,"kv_head_chunk_size":1,"num_query_chunks":4,"num_head_blocks":4}},"delta_vs_named_baseline_abs":{"dense_median_ms":374.56,"dense_prefill_tok_per_sec":-284.8,"dense_peak_mem_gb":0.0,"wayfinder_median_ms":250.04,"wayfinder_prefill_tok_per_sec":-85.2,"wayfinder_peak_mem_gb":0.0},"delta_vs_named_baseline_pct":{"dense_median_ms":17.491279110492616,"dense_prefill_tok_per_sec":-14.889167712254284,"dense_peak_mem_gb":0.0,"wayfinder_median_ms":7.478636952314865,"wayfinder_prefill_tok_per_sec":-6.9545343237286605,"wayfinder_peak_mem_gb":0.0},"memory_reduction_pct":-0.17103762827823665,"degree_estimate":97.0,"kappa":60.310363296171275,"crossover_tokens":7412.984425070237},"gate_8192":{"dense":{"median_ms":8409.12,"prefill_tok_per_sec":974.2,"peak_mem_gb":18.38},"wayfinder":{"median_ms":9394.81,"prefill_tok_per_sec":872.0,"peak_mem_gb":18.49,"wayfinder_active_layers":8,"attn_kernel_ms_mean":645.2739613732774,"effective_chunking":{"query_chunk_size":768,"kv_head_chunk_size":1,"num_query_chunks":11,"num_head_blocks":4}},"delta_vs_named_baseline_abs":{"dense_median_ms":4059.4,"dense_prefill_tok_per_sec":-909.1,"dense_peak_mem_gb":0.0,"wayfinder_median_ms":1436.44,"wayfinder_prefill_tok_per_sec":-157.4,"wayfinder_peak_mem_gb":0.0},"delta_vs_named_baseline_pct":{"dense_median_ms":93.32554739155624,"dense_prefill_tok_per_sec":-48.27165082567832,"dense_peak_mem_gb":0.0,"wayfinder_median_ms":18.049424693750098,"wayfinder_prefill_tok_per_sec":-15.290460462405292,"wayfinder_peak_mem_gb":0.0},"memory_reduction_pct":-0.5984766050054269,"degree_estimate":129.0,"kappa":70.94759606144852,"crossover_tokens":10346.347541586843},"contingent_16384":{"dense":{"median_ms":10689.35,"prefill_tok_per_sec":1532.7,"peak_mem_gb":20.08},"wayfinder":{"median_ms":26553.78,"prefill_tok_per_sec":617.0,"peak_mem_gb":20.43,"wayfinder_active_layers":8,"attn_kernel_ms_mean":2188.531495625284,"effective_chunking":{"query_chunk_size":384,"kv_head_chunk_size":1,"num_query_chunks":43,"num_head_blocks":4}},"memory_reduction_pct":-1.7430278884462247,"degree_estimate":193.0,"kappa":210.88111331381572,"crossover_tokens":null}},"decision":"follow-up","next_action":"Treat the loader fix as real, but do not treat this optimistic 4096/8192 regime as authoritative by itself because it conflicts with the repaired-loader artifact EXP-20260319T041705Z-QWEN35CUDA-BACKBONE-RESIDENCY-GUARD-4096-8192.ndjson. Resolve the conflict before making any further 16k claim."}
{"id":"EXP-20260319T043357Z-QWEN35CUDA-BACKBONE-RESIDENCY-TIEBREAK-RESULT","date":"2026-03-19","question":"Which repaired-loader benchmark regime is actually reproducible on the current workspace and machine?","hypothesis":"H1 expected the 041640 regime (kappa≈60.31/70.95). H2 expected the 041705 regime (kappa≈139.15/135.01). A fresh measurement-only rerun on the current code with the same repaired loader should resolve which regime actually reproduces, or prove the benchmark is unstable enough that no honest 16k claim can be made yet.","change_set":["measurement-only rerun on current code","notes/LAB_NOTEBOOK.md","notes/experiments.ndjson"],"command":".venv/bin/python scripts/bench_qwen35_cuda_wayfinder.py --model-path /home/hmbown/HF_Models/Qwen3.5-9B --seq-lens 4096 8192 --path sparse --strategy random --engine auto --warmup 1 --repeats 1 --forward-target backbone --phases dense wayfinder --skip-divergence --output benchmarks/cuda/qwen35_wayfinder/EXP-20260319T043357Z-QWEN35CUDA-BACKBONE-RESIDENCY-TIEBREAK-4096-8192.ndjson && journalctl -b -k --since '2026-03-18 23:33:57 CDT' | rg -n 'NVRM|Xid|Out of memory|hung task|BUG:|Call Trace'","controls":{"baseline_run_path_h1":"benchmarks/cuda/qwen35_wayfinder/EXP-20260319T041640Z-QWEN35CUDA-BACKBONE-RESIDENCY-4096-8192.ndjson","baseline_run_path_h2":"benchmarks/cuda/qwen35_wayfinder/EXP-20260319T041705Z-QWEN35CUDA-BACKBONE-RESIDENCY-GUARD-4096-8192.ndjson","anchor_run_path":"benchmarks/cuda/qwen35_wayfinder/EXP-20260318T231105Z-QWEN35CUDA-SPARSE-ADAPTIVE-CHUNK.ndjson","one_process_at_a_time":true,"lock_file":"benchmarks/cuda/qwen35_wayfinder/.bench_qwen35_cuda_wayfinder.lock","retro_backfill_inference":"off","model_path":"/home/hmbown/HF_Models/Qwen3.5-9B","device":"cuda","gpu":"NVIDIA GB10","device_capability":[12,1],"torch":"2.10.0+cu130","transformers":"5.3.0","path":"sparse","strategy":"random","compute_graph_metrics":false,"forward_target":"backbone","window":64,"landmark_stride":64,"num_cycles":1,"engine_request":"auto","warmup":1,"repeats":1,"seq_lens":[4096,8192],"kernel_log_since":"2026-03-18 23:33:57 CDT"},"metrics":{"status":"completed","artifact":"benchmarks/cuda/qwen35_wayfinder/EXP-20260319T043357Z-QWEN35CUDA-BACKBONE-RESIDENCY-TIEBREAK-4096-8192.ndjson","kernel_fault_lines_after_start":0,"benchmark_residency":{"dense_benchmark_module_device_counts":{"cuda:0":428},"wayfinder_benchmark_module_device_counts":{"cuda:0":428},"result":"single_gpu_comparable"},"4096":{"dense":{"median_ms":2696.5,"prefill_tok_per_sec":1519.0,"peak_mem_gb":17.54},"wayfinder":{"median_ms":4103.43,"prefill_tok_per_sec":998.2,"peak_mem_gb":17.57,"wayfinder_active_layers":8,"attn_kernel_ms_mean":234.45641474972945,"effective_chunking":{"query_chunk_size":1024,"num_query_chunks":4}},"memory_reduction_pct":-0.17103762827823665,"degree_estimate":97.0,"kappa":64.25912658830366,"crossover_tokens":8387.646804924101,"delta_vs_h1_wayfinder_abs_ms":510.0,"delta_vs_h1_wayfinder_pct":14.192568103455486,"delta_vs_h2_wayfinder_abs_ms":-2998.38,"delta_vs_h2_wayfinder_pct":-42.21994111360343,"delta_vs_anchor_wayfinder_abs_ms":760.04,"delta_vs_anchor_wayfinder_pct":22.732615698437826},"8192":{"dense":{"median_ms":5410.2,"prefill_tok_per_sec":1514.2,"peak_mem_gb":18.38},"wayfinder":{"median_ms":9918.92,"prefill_tok_per_sec":825.9,"peak_mem_gb":18.49,"wayfinder_active_layers":8,"attn_kernel_ms_mean":682.6263088751148,"effective_chunking":{"query_chunk_size":768,"num_query_chunks":11}},"memory_reduction_pct":-0.5984766050054269,"degree_estimate":129.0,"kappa":116.42635492705567,"crossover_tokens":83695.9546355498,"delta_vs_h1_wayfinder_abs_ms":524.11,"delta_vs_h1_wayfinder_pct":5.578718462640549,"delta_vs_h2_wayfinder_abs_ms":632.24,"delta_vs_h2_wayfinder_pct":6.808030426374116,"delta_vs_anchor_wayfinder_abs_ms":1960.55,"delta_vs_anchor_wayfinder_pct":24.635069744181287},"resolution":"tie-break landed between the two repaired-loader artifacts and reproduced neither regime cleanly"},"decision":"follow-up","next_action":"Do not claim 16k is fixed. The loader fix is real, but the one-shot warmup=1/repeats=1 ladder is still unstable and 8192 did not improve materially over the adaptive-chunk anchor. Target benchmark stability and the remaining long-context kernel cost before retrying the ladder."}
