{"id": "EXP-20260208-E2E-P4E-GLM-CHUNKED-HCSA-THR16384-RESULT", "date": "2026-02-08", "question": "In chunked prefill mode, does HCSA with active_dense_threshold=16384 outperform dense baseline at 32K/65K?", "hypothesis": "Lower threshold should force more sparse work and improve throughput, with potential memory benefits.", "change_set": ["none (measurement-only benchmark run)", "swap enabled"], "command": "PYTHONPATH=/Volumes/VIXinSSD/wayfinder python3 scripts/bench_glm_chunked_prefill_mlx.py --model-path mlx-community/GLM-4.7-Flash-4bit --seq-lens 32768 65536 --chunk-sizes 4096 --decode-lens 0 1 --cache-modes normal --path permute --window 64 --landmark-stride 0 --head-chunk-size 2 --query-chunk-size 384 --active-dense-threshold 16384 --kv-step 4096 --baseline-path benchmarks/mlx/glm_4_7_flash_4bit_wayfinder/20260207_201347_fullmodel_prefill_kv_checkpoint/results.json --out-dir benchmarks/mlx/e2e_validation_20260208_192216/glm47_chunked_hcsa_thr16384", "controls": {"model_path": "mlx-community/GLM-4.7-Flash-4bit", "seq_lens": [32768, 65536], "chunk_sizes": [4096], "decode_lens": [0, 1], "cache_modes": ["normal"], "path": "permute", "window": 64, "landmark_stride": 0, "head_chunk_size": 2, "query_chunk_size": 384, "active_dense_threshold": 16384, "kv_step": 4096, "baseline_path": "benchmarks/mlx/e2e_validation_20260208_192216/glm47_chunked_dense/results.json"}, "metrics": {"artifact": "benchmarks/mlx/e2e_validation_20260208_192216/glm47_chunked_hcsa_thr16384/results.json", "rows": {"32768": {"cache_mode": "normal", "chunk_size": 4096, "seq_len": 32768, "max_kv_size": null, "no_swap": false, "kv_step": 4096, "retro_backfill_enabled": false, "ok": true, "baseline_seq_len_match": true, "prefill_only": {"sec": 217.592606582999, "tok_s": 150.59335201952692, "peak_memory_bytes": 22446619216, "chunk_reports": [{"chunk_index": 0, "start": 0, "end": 4096, "tokens": 4096, "k_len": 4096, "sec": 22.47537333299988, "cache_state": {"layers": 47, "layer_type": "KVCache", "offset_min": 4096, "offset_max": 4096, "size_min": 4096, "size_max": 4096}, "peak_memory_bytes_after_chunk": 18929169896, "profile_sample": {"path": "permute_dense_fallback", "graph_build_ms": 0.0, "attention_ms": 0.020374983549118042, "cache_hit": true, "seq_len": null, "q_len": null, "graph_seq_len": null, "active_query_mode": null, "active_dense_threshold": 16384, "active_dense_triggered": true}}, {"chunk_index": 1, "start": 4096, "end": 8192, "tokens": 4096, "k_len": 8192, "sec": 10.285770083981333, "cache_state": {"layers": 47, "layer_type": "KVCache", "offset_min": 8192, "offset_max": 8192, "size_min": 8192, "size_max": 8192}, "peak_memory_bytes_after_chunk": 20660893536, "profile_sample": {"path": "permute_dense_fallback", "graph_build_ms": 0.0, "attention_ms": 0.01508300006389618, "cache_hit": true, "seq_len": null, "q_len": null, "graph_seq_len": null, "active_query_mode": null, "active_dense_threshold": 16384, "active_dense_triggered": true}}, {"chunk_index": 2, "start": 8192, "end": 12288, "tokens": 4096, "k_len": 12288, "sec": 13.793007958011003, "cache_state": {"layers": 47, "layer_type": "KVCache", "offset_min": 12288, "offset_max": 12288, "size_min": 12288, "size_max": 12288}, "peak_memory_bytes_after_chunk": 21553756376, "profile_sample": {"path": "permute_dense_fallback", "graph_build_ms": 0.0, "attention_ms": 0.016958996653556824, "cache_hit": true, "seq_len": null, "q_len": null, "graph_seq_len": null, "active_query_mode": null, "active_dense_threshold": 16384, "active_dense_triggered": true}}, {"chunk_index": 3, "start": 12288, "end": 16384, "tokens": 4096, "k_len": 16384, "sec": 17.34989941600361, "cache_state": {"layers": 47, "layer_type": "KVCache", "offset_min": 16384, "offset_max": 16384, "size_min": 16384, "size_max": 16384}, "peak_memory_bytes_after_chunk": 22446619216, "profile_sample": {"path": "permute_dense_fallback", "graph_build_ms": 0.0, "attention_ms": 0.015416011214256287, "cache_hit": true, "seq_len": null, "q_len": null, "graph_seq_len": null, "active_query_mode": null, "active_dense_threshold": 16384, "active_dense_triggered": true}}, {"chunk_index": 4, "start": 16384, "end": 20480, "tokens": 4096, "k_len": 20480, "sec": 45.681620374991326, "cache_state": {"layers": 47, "layer_type": "KVCache", "offset_min": 20480, "offset_max": 20480, "size_min": 20480, "size_max": 20480}, "peak_memory_bytes_after_chunk": 22446619216, "profile_sample": {"path": "permute", "graph_build_ms": 13400.697166010737, "attention_ms": 638.373541995883, "cache_hit": false, "seq_len": 20480, "q_len": 4096, "graph_seq_len": 32768, "active_query_mode": true, "active_dense_threshold": 16384, "active_dense_triggered": false}}, {"chunk_index": 5, "start": 20480, "end": 24576, "tokens": 4096, "k_len": 24576, "sec": 33.68704416701803, "cache_state": {"layers": 47, "layer_type": "KVCache", "offset_min": 24576, "offset_max": 24576, "size_min": 24576, "size_max": 24576}, "peak_memory_bytes_after_chunk": 22446619216, "profile_sample": {"path": "permute", "graph_build_ms": 0.0033340156078338623, "attention_ms": 666.6755409985781, "cache_hit": true, "seq_len": 24576, "q_len": 4096, "graph_seq_len": 32768, "active_query_mode": true, "active_dense_threshold": 16384, "active_dense_triggered": false}}, {"chunk_index": 6, "start": 24576, "end": 28672, "tokens": 4096, "k_len": 28672, "sec": 34.120414083008654, "cache_state": {"layers": 47, "layer_type": "KVCache", "offset_min": 28672, "offset_max": 28672, "size_min": 28672, "size_max": 28672}, "peak_memory_bytes_after_chunk": 22446619216, "profile_sample": {"path": "permute", "graph_build_ms": 0.003375008702278137, "attention_ms": 682.2952920049429, "cache_hit": true, "seq_len": 28672, "q_len": 4096, "graph_seq_len": 32768, "active_query_mode": true, "active_dense_threshold": 16384, "active_dense_triggered": false}}, {"chunk_index": 7, "start": 28672, "end": 32768, "tokens": 4096, "k_len": 32768, "sec": 40.06421874999069, "cache_state": {"layers": 47, "layer_type": "KVCache", "offset_min": 32768, "offset_max": 32768, "size_min": 32768, "size_max": 32768}, "peak_memory_bytes_after_chunk": 22446619216, "profile_sample": {"path": "permute", "graph_build_ms": 0.004374995827674866, "attention_ms": 694.0916249901056, "cache_hit": true, "seq_len": 32768, "q_len": 4096, "graph_seq_len": 32768, "active_query_mode": true, "active_dense_threshold": 16384, "active_dense_triggered": false}}], "cache_state_end": {"layers": 47, "layer_type": "KVCache", "offset_min": 32768, "offset_max": 32768, "size_min": 32768, "size_max": 32768}, "comparison_vs_baseline": {"sec": {"absolute": 217.592606582999, "baseline": 61.28745470799913, "delta_vs_baseline": 156.30515187499986, "delta_pct_vs_baseline": 255.03612871460822}, "tok_s": {"absolute": 150.59335201952692, "baseline": 534.6608071116906, "delta_vs_baseline": -384.06745509216364, "delta_pct_vs_baseline": -71.83385241326133}, "peak_memory_bytes": {"absolute": 22446619216.0, "baseline": 28928288404, "delta_vs_baseline": -6481669188.0, "delta_pct_vs_baseline": -22.40598924305442}, "memory_reduction_pct_vs_baseline": 22.405989243054425}}, "prefill_plus_1": {"prefill_sec": 217.592606582999, "decode_sec": 18.695774958003312, "total_sec": 236.2883815410023, "prefill_tok_s": 150.59335201952692, "decode_tok_s": 0.053488020809317596, "peak_memory_bytes": 22446619216, "chunk_reports": [{"chunk_index": 0, "start": 0, "end": 4096, "tokens": 4096, "k_len": 4096, "sec": 22.47537333299988, "cache_state": {"layers": 47, "layer_type": "KVCache", "offset_min": 4096, "offset_max": 4096, "size_min": 4096, "size_max": 4096}, "peak_memory_bytes_after_chunk": 18929169896, "profile_sample": {"path": "permute_dense_fallback", "graph_build_ms": 0.0, "attention_ms": 0.020374983549118042, "cache_hit": true, "seq_len": null, "q_len": null, "graph_seq_len": null, "active_query_mode": null, "active_dense_threshold": 16384, "active_dense_triggered": true}}, {"chunk_index": 1, "start": 4096, "end": 8192, "tokens": 4096, "k_len": 8192, "sec": 10.285770083981333, "cache_state": {"layers": 47, "layer_type": "KVCache", "offset_min": 8192, "offset_max": 8192, "size_min": 8192, "size_max": 8192}, "peak_memory_bytes_after_chunk": 20660893536, "profile_sample": {"path": "permute_dense_fallback", "graph_build_ms": 0.0, "attention_ms": 0.01508300006389618, "cache_hit": true, "seq_len": null, "q_len": null, "graph_seq_len": null, "active_query_mode": null, "active_dense_threshold": 16384, "active_dense_triggered": true}}, {"chunk_index": 2, "start": 8192, "end": 12288, "tokens": 4096, "k_len": 12288, "sec": 13.793007958011003, "cache_state": {"layers": 47, "layer_type": "KVCache", "offset_min": 12288, "offset_max": 12288, "size_min": 12288, "size_max": 12288}, "peak_memory_bytes_after_chunk": 21553756376, "profile_sample": {"path": "permute_dense_fallback", "graph_build_ms": 0.0, "attention_ms": 0.016958996653556824, "cache_hit": true, "seq_len": null, "q_len": null, "graph_seq_len": null, "active_query_mode": null, "active_dense_threshold": 16384, "active_dense_triggered": true}}, {"chunk_index": 3, "start": 12288, "end": 16384, "tokens": 4096, "k_len": 16384, "sec": 17.34989941600361, "cache_state": {"layers": 47, "layer_type": "KVCache", "offset_min": 16384, "offset_max": 16384, "size_min": 16384, "size_max": 16384}, "peak_memory_bytes_after_chunk": 22446619216, "profile_sample": {"path": "permute_dense_fallback", "graph_build_ms": 0.0, "attention_ms": 0.015416011214256287, "cache_hit": true, "seq_len": null, "q_len": null, "graph_seq_len": null, "active_query_mode": null, "active_dense_threshold": 16384, "active_dense_triggered": true}}, {"chunk_index": 4, "start": 16384, "end": 20480, "tokens": 4096, "k_len": 20480, "sec": 45.681620374991326, "cache_state": {"layers": 47, "layer_type": "KVCache", "offset_min": 20480, "offset_max": 20480, "size_min": 20480, "size_max": 20480}, "peak_memory_bytes_after_chunk": 22446619216, "profile_sample": {"path": "permute", "graph_build_ms": 13400.697166010737, "attention_ms": 638.373541995883, "cache_hit": false, "seq_len": 20480, "q_len": 4096, "graph_seq_len": 32768, "active_query_mode": true, "active_dense_threshold": 16384, "active_dense_triggered": false}}, {"chunk_index": 5, "start": 20480, "end": 24576, "tokens": 4096, "k_len": 24576, "sec": 33.68704416701803, "cache_state": {"layers": 47, "layer_type": "KVCache", "offset_min": 24576, "offset_max": 24576, "size_min": 24576, "size_max": 24576}, "peak_memory_bytes_after_chunk": 22446619216, "profile_sample": {"path": "permute", "graph_build_ms": 0.0033340156078338623, "attention_ms": 666.6755409985781, "cache_hit": true, "seq_len": 24576, "q_len": 4096, "graph_seq_len": 32768, "active_query_mode": true, "active_dense_threshold": 16384, "active_dense_triggered": false}}, {"chunk_index": 6, "start": 24576, "end": 28672, "tokens": 4096, "k_len": 28672, "sec": 34.120414083008654, "cache_state": {"layers": 47, "layer_type": "KVCache", "offset_min": 28672, "offset_max": 28672, "size_min": 28672, "size_max": 28672}, "peak_memory_bytes_after_chunk": 22446619216, "profile_sample": {"path": "permute", "graph_build_ms": 0.003375008702278137, "attention_ms": 682.2952920049429, "cache_hit": true, "seq_len": 28672, "q_len": 4096, "graph_seq_len": 32768, "active_query_mode": true, "active_dense_threshold": 16384, "active_dense_triggered": false}}, {"chunk_index": 7, "start": 28672, "end": 32768, "tokens": 4096, "k_len": 32768, "sec": 40.06421874999069, "cache_state": {"layers": 47, "layer_type": "KVCache", "offset_min": 32768, "offset_max": 32768, "size_min": 32768, "size_max": 32768}, "peak_memory_bytes_after_chunk": 22446619216, "profile_sample": {"path": "permute", "graph_build_ms": 0.004374995827674866, "attention_ms": 694.0916249901056, "cache_hit": true, "seq_len": 32768, "q_len": 4096, "graph_seq_len": 32768, "active_query_mode": true, "active_dense_threshold": 16384, "active_dense_triggered": false}}], "cache_state_after_prefill": {"layers": 47, "layer_type": "KVCache", "offset_min": 32768, "offset_max": 32768, "size_min": 32768, "size_max": 32768}, "cache_state_end": {"layers": 47, "layer_type": "KVCache", "offset_min": 32769, "offset_max": 32769, "size_min": 32769, "size_max": 32769}, "ttft_sec": 18.680606249981793, "itl_p50_sec": 18.680606249981793, "itl_p95_sec": 18.680606249981793, "comparison_vs_baseline": {"prefill_sec": {"absolute": 217.592606582999, "baseline": 85.62437291700189, "delta_vs_baseline": 131.9682336659971, "delta_pct_vs_baseline": 154.124613319992}, "decode_sec": {"absolute": 18.695774958003312, "baseline": null, "delta_vs_baseline": null, "delta_pct_vs_baseline": null}, "total_sec": {"absolute": 236.2883815410023, "baseline": 106.03095458399912, "delta_vs_baseline": 130.2574269570032, "delta_pct_vs_baseline": 122.84849029988835}, "prefill_tok_s": {"absolute": 150.59335201952692, "baseline": 382.69477350523715, "delta_vs_baseline": -232.10142148571023, "delta_pct_vs_baseline": -60.64922689165859}, "decode_tok_s": {"absolute": 0.053488020809317596, "baseline": null, "delta_vs_baseline": null, "delta_pct_vs_baseline": null}, "ttft_sec": {"absolute": 18.680606249981793, "baseline": null, "delta_vs_baseline": null, "delta_pct_vs_baseline": null}, "itl_p50_sec": {"absolute": 18.680606249981793, "baseline": null, "delta_vs_baseline": null, "delta_pct_vs_baseline": null}, "itl_p95_sec": {"absolute": 18.680606249981793, "baseline": null, "delta_vs_baseline": null, "delta_pct_vs_baseline": null}, "peak_memory_bytes": {"absolute": 22446619216.0, "baseline": 29053543348, "delta_vs_baseline": -6606924132.0, "delta_pct_vs_baseline": -22.74051069386967}, "memory_reduction_pct_vs_baseline": 22.740510693869666}}, "case_elapsed_sec": 236.28951291699195}, "65536": {"cache_mode": "normal", "chunk_size": 4096, "seq_len": 65536, "max_kv_size": null, "no_swap": false, "kv_step": 4096, "retro_backfill_enabled": false, "ok": true, "baseline_seq_len_match": true, "prefill_only": {"sec": 575.7017176249938, "tok_s": 113.8367282806849, "peak_memory_bytes": 24155149252, "chunk_reports": [{"chunk_index": 0, "start": 0, "end": 4096, "tokens": 4096, "k_len": 4096, "sec": 6.8734199999889825, "cache_state": {"layers": 47, "layer_type": "KVCache", "offset_min": 4096, "offset_max": 4096, "size_min": 4096, "size_max": 4096}, "peak_memory_bytes_after_chunk": 19790444580, "profile_sample": {"path": "permute_dense_fallback", "graph_build_ms": 0.0, "attention_ms": 0.020416975021362305, "cache_hit": true, "seq_len": null, "q_len": null, "graph_seq_len": null, "active_query_mode": null, "active_dense_threshold": 16384, "active_dense_triggered": true}}, {"chunk_index": 1, "start": 4096, "end": 8192, "tokens": 4096, "k_len": 8192, "sec": 10.352614375005942, "cache_state": {"layers": 47, "layer_type": "KVCache", "offset_min": 8192, "offset_max": 8192, "size_min": 8192, "size_max": 8192}, "peak_memory_bytes_after_chunk": 20683307420, "profile_sample": {"path": "permute_dense_fallback", "graph_build_ms": 0.0, "attention_ms": 0.017917022109031677, "cache_hit": true, "seq_len": null, "q_len": null, "graph_seq_len": null, "active_query_mode": null, "active_dense_threshold": 16384, "active_dense_triggered": true}}, {"chunk_index": 2, "start": 8192, "end": 12288, "tokens": 4096, "k_len": 12288, "sec": 13.820888999995077, "cache_state": {"layers": 47, "layer_type": "KVCache", "offset_min": 12288, "offset_max": 12288, "size_min": 12288, "size_max": 12288}, "peak_memory_bytes_after_chunk": 21576170260, "profile_sample": {"path": "permute_dense_fallback", "graph_build_ms": 0.0, "attention_ms": 0.02020801603794098, "cache_hit": true, "seq_len": null, "q_len": null, "graph_seq_len": null, "active_query_mode": null, "active_dense_threshold": 16384, "active_dense_triggered": true}}, {"chunk_index": 3, "start": 12288, "end": 16384, "tokens": 4096, "k_len": 16384, "sec": 17.51611954101827, "cache_state": {"layers": 47, "layer_type": "KVCache", "offset_min": 16384, "offset_max": 16384, "size_min": 16384, "size_max": 16384}, "peak_memory_bytes_after_chunk": 22469033100, "profile_sample": {"path": "permute_dense_fallback", "graph_build_ms": 0.0, "attention_ms": 0.01662498712539673, "cache_hit": true, "seq_len": null, "q_len": null, "graph_seq_len": null, "active_query_mode": null, "active_dense_threshold": 16384, "active_dense_triggered": true}}, {"chunk_index": 4, "start": 16384, "end": 20480, "tokens": 4096, "k_len": 20480, "sec": 32.48358883301262, "cache_state": {"layers": 47, "layer_type": "KVCache", "offset_min": 20480, "offset_max": 20480, "size_min": 20480, "size_max": 20480}, "peak_memory_bytes_after_chunk": 22469033100, "profile_sample": {"path": "permute", "graph_build_ms": 0.0035420209169387817, "attention_ms": 653.2642920017242, "cache_hit": true, "seq_len": 20480, "q_len": 4096, "graph_seq_len": 36864, "active_query_mode": true, "active_dense_threshold": 16384, "active_dense_triggered": false}}, {"chunk_index": 5, "start": 20480, "end": 24576, "tokens": 4096, "k_len": 24576, "sec": 33.20774262500345, "cache_state": {"layers": 47, "layer_type": "KVCache", "offset_min": 24576, "offset_max": 24576, "size_min": 24576, "size_max": 24576}, "peak_memory_bytes_after_chunk": 22469033100, "profile_sample": {"path": "permute", "graph_build_ms": 0.003666996955871582, "attention_ms": 658.5775839984417, "cache_hit": true, "seq_len": 24576, "q_len": 4096, "graph_seq_len": 36864, "active_query_mode": true, "active_dense_threshold": 16384, "active_dense_triggered": false}}, {"chunk_index": 6, "start": 24576, "end": 28672, "tokens": 4096, "k_len": 28672, "sec": 34.383956208010204, "cache_state": {"layers": 47, "layer_type": "KVCache", "offset_min": 28672, "offset_max": 28672, "size_min": 28672, "size_max": 28672}, "peak_memory_bytes_after_chunk": 22469033100, "profile_sample": {"path": "permute", "graph_build_ms": 0.003916993737220764, "attention_ms": 677.9472500234842, "cache_hit": true, "seq_len": 28672, "q_len": 4096, "graph_seq_len": 36864, "active_query_mode": true, "active_dense_threshold": 16384, "active_dense_triggered": false}}, {"chunk_index": 7, "start": 28672, "end": 32768, "tokens": 4096, "k_len": 32768, "sec": 34.674790749995736, "cache_state": {"layers": 47, "layer_type": "KVCache", "offset_min": 32768, "offset_max": 32768, "size_min": 32768, "size_max": 32768}, "peak_memory_bytes_after_chunk": 22469033100, "profile_sample": {"path": "permute", "graph_build_ms": 0.003375008702278137, "attention_ms": 682.152125030756, "cache_hit": true, "seq_len": 32768, "q_len": 4096, "graph_seq_len": 36864, "active_query_mode": true, "active_dense_threshold": 16384, "active_dense_triggered": false}}, {"chunk_index": 8, "start": 32768, "end": 36864, "tokens": 4096, "k_len": 36864, "sec": 71.74241645800066, "cache_state": {"layers": 47, "layer_type": "KVCache", "offset_min": 36864, "offset_max": 36864, "size_min": 36864, "size_max": 36864}, "peak_memory_bytes_after_chunk": 22569699708, "profile_sample": {"path": "permute", "graph_build_ms": 27780.600291997194, "attention_ms": 640.2018329799175, "cache_hit": false, "seq_len": 36864, "q_len": 4096, "graph_seq_len": 65536, "active_query_mode": true, "active_dense_threshold": 16384, "active_dense_triggered": false}}, {"chunk_index": 9, "start": 36864, "end": 40960, "tokens": 4096, "k_len": 40960, "sec": 33.15609629199025, "cache_state": {"layers": 47, "layer_type": "KVCache", "offset_min": 40960, "offset_max": 40960, "size_min": 40960, "size_max": 40960}, "peak_memory_bytes_after_chunk": 22796192500, "profile_sample": {"path": "permute", "graph_build_ms": 0.006999999284744263, "attention_ms": 822.4505000114441, "cache_hit": true, "seq_len": 40960, "q_len": 4096, "graph_seq_len": 65536, "active_query_mode": true, "active_dense_threshold": 16384, "active_dense_triggered": false}}, {"chunk_index": 10, "start": 40960, "end": 45056, "tokens": 4096, "k_len": 45056, "sec": 33.49418008301291, "cache_state": {"layers": 47, "layer_type": "KVCache", "offset_min": 45056, "offset_max": 45056, "size_min": 45056, "size_max": 45056}, "peak_memory_bytes_after_chunk": 23022685292, "profile_sample": {"path": "permute", "graph_build_ms": 0.003541991114616394, "attention_ms": 665.6513330042362, "cache_hit": true, "seq_len": 45056, "q_len": 4096, "graph_seq_len": 65536, "active_query_mode": true, "active_dense_threshold": 16384, "active_dense_triggered": false}}, {"chunk_index": 11, "start": 45056, "end": 49152, "tokens": 4096, "k_len": 49152, "sec": 34.9846939999843, "cache_state": {"layers": 47, "layer_type": "KVCache", "offset_min": 49152, "offset_max": 49152, "size_min": 49152, "size_max": 49152}, "peak_memory_bytes_after_chunk": 23249178084, "profile_sample": {"path": "permute", "graph_build_ms": 0.0032079964876174927, "attention_ms": 676.4091250002384, "cache_hit": true, "seq_len": 49152, "q_len": 4096, "graph_seq_len": 65536, "active_query_mode": true, "active_dense_threshold": 16384, "active_dense_triggered": false}}, {"chunk_index": 12, "start": 49152, "end": 53248, "tokens": 4096, "k_len": 53248, "sec": 44.61885133298347, "cache_state": {"layers": 47, "layer_type": "KVCache", "offset_min": 53248, "offset_max": 53248, "size_min": 53248, "size_max": 53248}, "peak_memory_bytes_after_chunk": 23475670876, "profile_sample": {"path": "permute", "graph_build_ms": 0.0037080049514770508, "attention_ms": 1026.0240829885006, "cache_hit": true, "seq_len": 53248, "q_len": 4096, "graph_seq_len": 65536, "active_query_mode": true, "active_dense_threshold": 16384, "active_dense_triggered": false}}, {"chunk_index": 13, "start": 53248, "end": 57344, "tokens": 4096, "k_len": 57344, "sec": 48.4226454590098, "cache_state": {"layers": 47, "layer_type": "KVCache", "offset_min": 57344, "offset_max": 57344, "size_min": 57344, "size_max": 57344}, "peak_memory_bytes_after_chunk": 23702163668, "profile_sample": {"path": "permute", "graph_build_ms": 0.0030830055475234985, "attention_ms": 1144.4917089790106, "cache_hit": true, "seq_len": 57344, "q_len": 4096, "graph_seq_len": 65536, "active_query_mode": true, "active_dense_threshold": 16384, "active_