{"id": "EXP-20260208-E2E-P1-IDEA1-DISJOINT-RESULT", "date": "2026-02-08", "question": "For Tiny synthetic long context, does increasing cycles from d=1 to d=2 under edge-disjoint setup improve or hurt throughput/memory?", "hypothesis": "d=2 increases graph coverage but may reduce throughput from additional cycle aggregation overhead; memory change should be small.", "change_set": ["none (measurement-only run using existing edge-disjoint path)"], "command": "PYTHONPATH=/Volumes/VIXinSSD/wayfinder python3 scripts/bench_mlx_wayfinder_scale.py --seq-lens 2048 4096 --batch 2 --heads 4 --embd 128 --window 32 --landmark-stride 32 --warmup 2 --iters 4 --num-cycles 1 --out-dir benchmarks/mlx/e2e_validation_20260208_192216/idea1_disjoint_d1 && PYTHONPATH=/Volumes/VIXinSSD/wayfinder python3 scripts/bench_mlx_wayfinder_scale.py --seq-lens 2048 4096 --batch 2 --heads 4 --embd 128 --window 32 --landmark-stride 32 --warmup 2 --iters 4 --num-cycles 2 --out-dir benchmarks/mlx/e2e_validation_20260208_192216/idea1_disjoint_d2", "controls": {"seq_lens": [2048, 4096], "batch": 2, "heads": 4, "embd": 128, "window": 32, "landmark_stride": 32, "warmup": 2, "iters": 4, "baseline_path": "benchmarks/mlx/e2e_validation_20260208_192216/idea1_disjoint_d1/results.json", "row_filter": "attention.mode=wayfinder_permute"}, "metrics": {"artifacts": ["benchmarks/mlx/e2e_validation_20260208_192216/idea1_disjoint_d1/results.json", "benchmarks/mlx/e2e_validation_20260208_192216/idea1_disjoint_d2/results.json"], "seq2048": {"tokens_per_sec": {"absolute": 1655270.1819905012, "baseline_absolute": 3361625.9313326566, "delta_vs_baseline": -1706355.7493421554, "pct_delta_vs_baseline": -50.759834205160985}, "peak_memory_bytes": {"absolute": 55904212, "baseline_absolute": 55904212, "delta_vs_baseline": 0, "pct_delta_vs_baseline": 0.0}}, "seq4096": {"tokens_per_sec": {"absolute": 1771466.5434987657, "baseline_absolute": 3449595.760723812, "delta_vs_baseline": -1678129.2172250464, "pct_delta_vs_baseline": -48.647126609203994}, "peak_memory_bytes": {"absolute": 111792340, "baseline_absolute": 111792340, "delta_vs_baseline": 0, "pct_delta_vs_baseline": 0.0}}}, "decision": "follow-up", "next_action": "keep d=1 default and only revisit d>1 if quality gains justify throughput cost"}
{"id": "EXP-20260208-E2E-P1-IDEA5-REGULAR-PARTITION", "date": "2026-02-08", "question": "Does regular_partition improve throughput or memory over random cycles at fixed tiny benchmark settings?", "hypothesis": "regular_partition (reg8/reg16) should improve throughput via better locality with minimal memory change.", "change_set": ["none (measurement-only run using existing regular partition path)"], "command": "PYTHONPATH=/Volumes/VIXinSSD/wayfinder python3 scripts/bench_mlx_wayfinder_scale.py --seq-lens 2048 4096 --batch 2 --heads 4 --embd 128 --window 32 --landmark-stride 32 --warmup 2 --iters 4 --strategy random --num-cycles 1 --out-dir benchmarks/mlx/e2e_validation_20260208_192216/idea5_random && PYTHONPATH=/Volumes/VIXinSSD/wayfinder python3 scripts/bench_mlx_wayfinder_scale.py --seq-lens 2048 4096 --batch 2 --heads 4 --embd 128 --window 32 --landmark-stride 32 --warmup 2 --iters 4 --strategy regular_partition --regular-num-clusters 8 --num-cycles 1 --out-dir benchmarks/mlx/e2e_validation_20260208_192216/idea5_reg8 && PYTHONPATH=/Volumes/VIXinSSD/wayfinder python3 scripts/bench_mlx_wayfinder_scale.py --seq-lens 2048 4096 --batch 2 --heads 4 --embd 128 --window 32 --landmark-stride 32 --warmup 2 --iters 4 --strategy regular_partition --regular-num-clusters 16 --num-cycles 1 --out-dir benchmarks/mlx/e2e_validation_20260208_192216/idea5_reg16", "controls": {"seq_lens": [2048, 4096], "batch": 2, "heads": 4, "embd": 128, "window": 32, "landmark_stride": 32, "warmup": 2, "iters": 4, "num_cycles": 1, "baseline_path": "benchmarks/mlx/e2e_validation_20260208_192216/idea5_random/results.json"}, "metrics": {"status": "pending"}, "decision": "pending", "next_action": "run random/reg8/reg16 and compute deltas"}
{"id": "EXP-20260208-E2E-P1-IDEA5-REGULAR-PARTITION-RESULT", "date": "2026-02-08", "question": "Does regular_partition improve throughput or memory over random cycles at fixed tiny benchmark settings?", "hypothesis": "regular_partition (reg8/reg16) should improve throughput via better locality with minimal memory change.", "change_set": ["none (measurement-only run using existing regular partition path)"], "command": "PYTHONPATH=/Volumes/VIXinSSD/wayfinder python3 scripts/bench_mlx_wayfinder_scale.py --seq-lens 2048 4096 --batch 2 --heads 4 --embd 128 --window 32 --landmark-stride 32 --warmup 2 --iters 4 --strategy random --num-cycles 1 --out-dir benchmarks/mlx/e2e_validation_20260208_192216/idea5_random && PYTHONPATH=/Volumes/VIXinSSD/wayfinder python3 scripts/bench_mlx_wayfinder_scale.py --seq-lens 2048 4096 --batch 2 --heads 4 --embd 128 --window 32 --landmark-stride 32 --warmup 2 --iters 4 --strategy regular_partition --regular-num-clusters 8 --num-cycles 1 --out-dir benchmarks/mlx/e2e_validation_20260208_192216/idea5_reg8 && PYTHONPATH=/Volumes/VIXinSSD/wayfinder python3 scripts/bench_mlx_wayfinder_scale.py --seq-lens 2048 4096 --batch 2 --heads 4 --embd 128 --window 32 --landmark-stride 32 --warmup 2 --iters 4 --strategy regular_partition --regular-num-clusters 16 --num-cycles 1 --out-dir benchmarks/mlx/e2e_validation_20260208_192216/idea5_reg16", "controls": {"seq_lens": [2048, 4096], "batch": 2, "heads": 4, "embd": 128, "window": 32, "landmark_stride": 32, "warmup": 2, "iters": 4, "num_cycles": 1, "baseline_path": "benchmarks/mlx/e2e_validation_20260208_192216/idea5_random/results.json", "row_filter": "attention.mode=wayfinder_permute"}, "metrics": {"artifacts": ["benchmarks/mlx/e2e_validation_20260208_192216/idea5_random/results.json", "benchmarks/mlx/e2e_validation_20260208_192216/idea5_reg8/results.json", "benchmarks/mlx/e2e_validation_20260208_192216/idea5_reg16/results.json"], "seq2048": {"random": {"tokens_per_sec": 2915259.9571946487, "peak_memory_bytes": 55904212}, "reg8": {"tokens_per_sec": {"absolute": 2931865.967780897, "delta_vs_baseline": 16606.010586248245, "pct_delta_vs_baseline": 0.5696236641012348}, "peak_memory_bytes": {"absolute": 55904212, "delta_vs_baseline": 0, "pct_delta_vs_baseline": 0.0}}, "reg16": {"tokens_per_sec": {"absolute": 3210397.4286508686, "delta_vs_baseline": 295137.4714562199, "pct_delta_vs_baseline": 10.123881773487891}, "peak_memory_bytes": {"absolute": 55904212, "delta_vs_baseline": 0, "pct_delta_vs_baseline": 0.0}}}, "seq4096": {"random": {"tokens_per_sec": 3829155.712460304, "peak_memory_bytes": 111792340}, "reg8": {"tokens_per_sec": {"absolute": 3637419.6025046785, "delta_vs_baseline": -191736.1099556256, "pct_delta_vs_baseline": -5.007268556139013}, "peak_memory_bytes": {"absolute": 111792340, "delta_vs_baseline": 0, "pct_delta_vs_baseline": 0.0}}, "reg16": {"tokens_per_sec": {"absolute": 3459794.035154872, "delta_vs_baseline": -369361.67730543204, "pct_delta_vs_baseline": -9.646034401356593}, "peak_memory_bytes": {"absolute": 111792340, "delta_vs_baseline": 0, "pct_delta_vs_baseline": 0.0}}}}, "decision": "follow-up", "next_action": "retain random default and analyze regular-partition regression at T=4096"}
{"id": "EXP-20260208-E2E-P1-IDEA-METRICS", "date": "2026-02-08", "question": "Do resilience/spectral/covering diagnostics match theoretical expectations for cycle-based attention graphs?", "hypothesis": "Resilience stays high at drop_rate=0.3 and collapses at 0.8; random cycles beat identity on spectral/expansion metrics; increasing covering cycles improves dense-approximation quality.", "change_set": ["none (measurement-only script)"], "command": "python3 - <<'PY' ... writes benchmarks/mlx/tiny_wayfinder/idea_metrics_e2e.json ... PY", "controls": {"perm_seed": 42, "resilience_rng_seed": 1, "proxy_rng_seed": 3, "qkv_seed_rule": "123 + T", "covering_generator_seed": 42, "shape": {"B": 1, "H": 2, "dh": 8}, "covering_window": 4}, "metrics": {"status": "pending"}, "decision": "pending", "next_action": "execute script and log directional checks"}
{"id": "EXP-20260208-E2E-P1-IDEA-METRICS-RESULT", "date": "2026-02-08", "question": "Do resilience/spectral/covering diagnostics match theoretical expectations for cycle-based attention graphs?", "hypothesis": "Resilience stays high at drop_rate=0.3 and collapses at 0.8; random cycles beat identity on spectral/expansion metrics; increasing covering cycles improves dense-approximation quality.", "change_set": ["none (measurement-only script)"], "command": "python3 - <<'PY' ... writes benchmarks/mlx/tiny_wayfinder/idea_metrics_e2e.json ... PY", "controls": {"perm_seed": 42, "resilience_rng_seed": 1, "proxy_rng_seed": 3, "qkv_seed_rule": "123+T", "covering_generator_seed": 42, "shape": {"B": 1, "H": 2, "dh": 8}, "covering_window": 4}, "metrics": {"artifact": "benchmarks/mlx/tiny_wayfinder/idea_metrics_e2e.json", "resilience_safe": {"drop_rate": 0.3, "survival_rate": 0.96, "min_degree_mean": 20.08, "theoretical_threshold": 17.0}, "resilience_aggressive": {"drop_rate": 0.8, "survival_rate": 0.0, "min_degree_mean": 3.12, "theoretical_threshold": 17.0}, "spectral_random_w8": {"expansion_ratio": 1.1251456154889687, "is_good_expander": true}, "spectral_identity_w8": {"expansion_ratio": 0.9938897795449455, "is_good_expander": false}, "proxy_random_w8": {"mixing_time_estimate": 19, "endpoint_uniformity": 148.096}, "proxy_identity_w8": {"mixing_time_estimate": 29, "endpoint_uniformity": 2213.376}, "covering": {"256": {"d1": {"l2": 36.862953186035156, "cos": 0.2360485743404934}, "d4": {"l2": 34.23536682128906, "cos": 0.25069779942732306}, "d8": {"l2": 33.333316802978516, "cos": 0.2582050178544471}}, "512": {"d1": {"l2": 53.71562576293945, "cos": 0.18418719276362475}, "d4": {"l2": 50.476871490478516, "cos": 0.1965639442166277}, "d8": {"l2": 49.001094818115234, "cos": 0.20067784093116858}}}}, "decision": "keep", "next_action": "continue to Phase 2/3/4 end-to-end benchmarks"}
{"id": "EXP-20260208-E2E-P2-TINY-E2E", "date": "2026-02-08", "question": "With retro/backfill disabled, how does Wayfinder compare to dense on TinyShakespeare for short and long runs in quality, throughput, and memory?", "hypothesis": "Long run should preserve quality gate and show throughput/memory benefit; short run may be noisier but directionally consistent.", "change_set": ["none (measurement-only training runs)", "retro_backfill_enabled=false"], "command": "PYTHONPATH=/Volumes/VIXinSSD/wayfinder python3 scripts/run_mlx_experiment_tiny.py --data data/tinyshakespeare.txt --steps 300 --batch-size 8 --seq-len 128 --layers 2 --heads 4 --embd 128 --window 32 --landmark-stride 32 --num-cycles 1 --strategy random --wayfinder-attn wayfinder_permute --retro-backfill-enabled False --out-dir benchmarks/mlx/e2e_validation_20260208_192216/tiny_short && PYTHONPATH=/Volumes/VIXinSSD/wayfinder python3 scripts/run_mlx_experiment_tiny_long.py --data data/tinyshakespeare.txt --steps 1000 --batch-size 8 --seq-len 128 --layers 2 --heads 4 --embd 128 --window 32 --landmark-stride 32 --num-cycles 1 --strategy random --wayfinder-attn wayfinder_permute --retro-backfill-enabled False --out-dir benchmarks/mlx/e2e_validation_20260208_192216/tiny_long", "controls": {"dataset": "data/tinyshakespeare.txt", "steps_short": 300, "steps_long": 1000, "batch_size": 8, "seq_len": 128, "layers": 2, "heads": 4, "embd": 128, "window": 32, "landmark_stride": 32, "num_cycles": 1, "strategy": "random", "wayfinder_attn": "wayfinder_permute", "retro_backfill_enabled": false}, "metrics": {"status": "pending"}, "decision": "pending", "next_action": "run both tiny experiments and compute dense-vs-wayfinder deltas"}
{"id": "EXP-20260208-E2E-P2-TINY-E2E-RESULT", "date": "2026-02-08", "question": "With retro/backfill disabled, how does Wayfinder compare to dense on TinyShakespeare for short and long runs in quality, throughput, and memory?", "hypothesis": "Long run should preserve quality gate and show throughput/memory benefit; short run may be noisier but directionally consistent.", "change_set": ["none (measurement-only training runs)", "retro_backfill_enabled=false"], "command": "PYTHONPATH=/Volumes/VIXinSSD/wayfinder python3 scripts/run_mlx_experiment_tiny.py ... --out-dir benchmarks/mlx/e2e_validation_20260208_192216/tiny_short && PYTHONPATH=/Volumes/VIXinSSD/wayfinder python3 scripts/run_mlx_experiment_tiny_long.py ... --out-dir benchmarks/mlx/e2e_validation_20260208_192216/tiny_long", "controls": {"dataset": "data/tinyshakespeare.txt", "steps_short": 300, "steps_long": 1000, "batch_size": 8, "seq_len": 128, "layers": 2, "heads": 4, "embd": 128, "window": 32, "landmark_stride": 32, "num_cycles": 1, "strategy": "random", "wayfinder_attn": "wayfinder_permute", "retro_backfill_enabled": false}, "metrics": {"artifacts": ["benchmarks/mlx/e2e_validation_20260208_192216/tiny_short/summary.json", "benchmarks/mlx/e2e_validation_20260208_192216/tiny_long/summary.json"], "tiny_short": {"dense_final_val_ppl": 55.01039327260517, "wayfinder_final_val_ppl": 34.49717996814688, "delta_final_val_ppl": -20.51321330445829, "pct_delta_final_val_ppl": -37.28970487959362, "dense_tokens_per_sec": 417161.20175102045, "wayfinder_tokens_per_sec": 303755.4092630867, "delta_tokens_per_sec": -113405.79248793377, "pct_delta_tokens_per_sec": -27.185124602172177, "dense_peak_memory_bytes": 95191432, "wayfinder_peak_memory_bytes": 97337116, "delta_peak_memory_bytes": 2145684, "pct_delta_peak_memory_bytes": 2.2540726144344587, "memory_reduction_pct": -2.254072614434466}, "tiny_long": {"dense_final_val_ppl": 822.3014067577436, "wayfinder_final_val_ppl": 90.05233009578842, "delta_final_val_ppl": -732.2490766619552, "pct_delta_final_val_ppl": -89.04874424928248, "dense_tokens_per_sec": 431693.6735459433, "wayfinder_tokens_per_sec": 232426.25916485774, "delta_tokens_per_sec": -199267.41438108555, "pct_delta_tokens_per_sec": -46.15944744899728, "dense_peak_memory_bytes": 95191432, "wayfinder_peak_memory_bytes": 120135536, "delta_peak_memory_bytes": 24944104, "pct_delta_peak_memory_bytes": 26.204148289312425, "memory_reduction_pct": -26.204148289312435, "quality_gate_pass": true}}, "decision": "follow-up", "next_action": "proceed to Qwen and GLM long-context benchmarks for superiority determination"}
{"id": "EXP-20260208-E2E-P3-QWEN3-1P7B-SWAP", "date": "2026-02-08", "question": "Under full attention swap on Qwen3-1.7B-4bit, does Wayfinder achieve long-context throughput/memory advantage vs dense?", "hypothesis": "Memory should improve at long contexts, while throughput may still lag due integration overhead.", "change_set": ["none (measurement-only benchmark run)", "retro_backfill_enabled=false"], "command": "PYTHONPATH=/Volumes/VIXinSSD/wayfinder python3 scripts/bench_qwen_wayfinder_mlx.py --model-path mlx-community/Qwen3-1.7B-4bit --seq-lens 2048 8192 32768 --batch 1 --warmup 1 --iters 3 --dtype bfloat16 --path permute --window 64 --landmark-stride 64 --num-cycles 1 --seed 42 --full-swap --out-dir benchmarks/mlx/e2e_validation_20260208_192216/qwen3_1p7b_wayfinder", "controls": {"model_path": "mlx-community/Qwen3-1.7B-4bit", "seq_lens": [2048, 8192, 32768], "batch": 1, "warmup": 1, "iters": 3, "dtype": "bfloat16", "path": "permute", "window": 64, "landmark_stride": 64, "num_cycles": 1, "seed": 42, "full_swap": true}, "metrics": {"status": "pending"}, "decision": "pending", "next_action": "run qwen benchmark and compute deltas/joint_utility"}
{"id": "EXP-20260208-E2E-P3-QWEN3-1P7B-SWAP-RESULT", "date": "2026-02-08", "question": "Under full attention swap on Qwen3-1.7B-4bit, does Wayfinder achieve long-context throughput/memory advantage vs dense?", "hypothesis": "Memory should improve at long contexts, while throughput may still lag due integration overhead.", "change_set": ["none (measurement-only benchmark run)", "retro_backfill_enabled=false"], "command": "PYTHONPATH=/Volumes/VIXinSSD/wayfinder python3 scripts/bench_qwen_wayfinder_mlx.py --model-path mlx-community/Qwen3-1.7B-4bit --seq-lens 2048 8192 32768 --batch 1 --warmup 1 --iters 3 --dtype bfloat16 --path permute --window 64 --landmark-stride 64 --num-cycles 1 --seed 42 --full-swap --out-dir benchmarks/mlx/e2e_validation_20260208_192216/qwen3_1p7b_wayfinder", "controls": {"model_path": "mlx-community/Qwen3-1.7B-4bit", "seq_lens": [2048, 8192, 32768], "batch": 1, "warmup": 1, "iters": 3, "dtype": "bfloat16", "path": "permute", "window": 64, "landmark_stride": 64, "num_cycles": 1, "seed": 42, "full_swap": true}, "metrics": {"artifact": "benchmarks/mlx/e2e_validation_20260208_192216/qwen3_1p7b_wayfinder/results.json", "per_seq": {"2048": {"sanity_mae": 1.150622844696045, "graph_build_ms_first": 806.6267500072718, "attention": {"dense_tokens_per_sec": 267918.17250603734, "wayfinder_tokens_per_sec": 247966.89523904666, "delta_tokens_per_sec": -19951.277266990684, "pct_delta_tokens_per_sec": -7.4467801420006685, "dense_peak_memory_bytes": 61604392, "wayfinder_peak_memory_bytes": 98521236, "delta_peak_memory_bytes": 36916844, "pct_delta_peak_memory_bytes": 59.92566893607196, "memory_reduction_pct": -59.925668936071965, "throughput_ratio": 0.9255321985799934, "memory_ratio": 0.6252904906714731, "joint_utility": 0.5787264825823314}, "block": {"dense_tokens_per_sec": 82290.03198816218, "wayfinder_tokens_per_sec": 76625.67467565445, "delta_tokens_per_sec": -5664.357312507738, "pct_delta_tokens_per_sec": -6.883406380644723, "dense_peak_memory_bytes": 192422456, "wayfinder_peak_memory_bytes": 171450928, "delta_peak_memory_bytes": -20971528, "pct_delta_peak_memory_bytes": -10.898690535370777, "memory_reduction_pct": 10.89869053537078, "throughput_ratio": 0.9311659361935528, "memory_ratio": 1.1223179614402554, "joint_utility": 1.0450642552713552}}, "8192": {"sanity_mae": 1.2285213470458984, "graph_build_ms_first": 4858.61249999702, "attention": {"dense_tokens_per_sec": 165472.9399452021, "wayfinder_tokens_per_sec": 226021.27922057582, "delta_tokens_per_sec": 60548.33927537373, "pct_delta_tokens_per_sec": 36.59108207990072, "dense_peak_memory_bytes": 1186711592, "wayfinder_peak_memory_bytes": 1205569336, "delta_peak_memory_bytes": 18857744, "pct_delta_peak_memory_bytes": 1.5890755704356514, "memory_reduction_pct": -1.5890755704356607, "throughput_ratio": 1.3659108207990072, "memory_ratio": 0.9843578105075492, "joint_utility": 1.3445449849102802}, "block": {"dense_tokens_per_sec": 69279.00614278065, "wayfinder_tokens_per_sec": 77308.84877565704, "delta_tokens_per_sec": 8029.842632876389, "pct_delta_tokens_per_sec": 11.590585777641317, "dense_peak_memory_bytes": 1625016380, "wayfinder_peak_memory_bytes": 1541130292, "delta_peak_memory_bytes": -83886088, "pct_delta_peak_memory_bytes": -5.162168765338845, "memory_reduction_pct": 5.162168765338848, "throughput_ratio": 1.1159058577764132, "memory_ratio": 1.054431535370794, "joint_utility": 1.1766463269444463}}, "32768": {"sanity_mae": 1.3118351697921753, "graph_build_ms_first": 45685.6745839864, "attention": {"dense_tokens_per_sec": 57063.37303014407, "wayfinder_tokens_per_sec": 239453.17744827058, "delta_tokens_per_sec": 182389.80441812653, "pct_delta_tokens_per_sec": 319.62674958204457, "dense_peak_memory_bytes": 1842595880, "wayfinder_peak_memory_bytes": 1786040620, "delta_peak_memory_bytes": -56555260, "pct_delta_peak_memory_bytes": -3.069325217420979, "memory_reduction_pct": 3.0693252174209817, "throughput_ratio": 4.196267495820446, "memory_ratio": 1.031665158880877, "joint_utility": 4.32914297278226}, "block": {"dense_tokens_per_sec": 39325.68395599275, "wayfinder_tokens_per_sec": 81658.83626079648, "delta_tokens_per_sec": 42333.152304803734, "pct_delta_tokens_per_sec": 107.64759324256505, "dense_peak_memory_bytes": 3459500088, "wayfinder_peak_memory_bytes": 3258173488, "delta_peak_memory_bytes": -201326600, "pct_delta_peak_memory_bytes": -5.819528685613954, "memory_reduction_pct": 5.8195286856139505, "throughput_ratio": 2.0764759324256503, "memory_ratio": 1.0617912461511012, "joint_utility": 2.2047839678930012}}}}, "decision": "keep", "next_action": "run GLM target-regime benchmarks for final superiority determination"}
{"id": "EXP-20260208-E2E-P4A-GLM-ATTENTION-SWAP", "date": "2026-02-08", "question": "For GLM-4.7-Flash full attention swap, what are attention-level and block-level dense-vs-wayfinder throughput/memory outcomes across 2K/8K/32K?", "hypothesis": "Long context should show clear throughput gains with modest memory reduction; short contexts may be neutral.", "change_set": ["none (measurement-only benchmark run)", "retro_backfill_enabled=false"], "command": "PYTHONPATH=/Volumes/VIXinSSD/wayfinder python3 scripts/bench_glm_wayfinder_mlx.py --model-path mlx-community/GLM-4.7-Flash-4bit --seq-lens 2048 8192 32768 --batch 1 --warmup 1 --iters 3 --dtype bfloat16 --path permute --window 64 --landmark-stride 0 --num-cycles 1 --seed 42 --permute-head-chunk-size 2 --permute-query-chunk-size 384 --permute-memory-budget-multiplier 1.0 --full-swap --out-dir benchmarks/mlx/e2e_validation_20260208_192216/glm47_attention_swap", "controls": {"model_path": "mlx-community/GLM-4.7-Flash-4bit", "seq_lens": [2048, 8192, 32768], "batch": 1, "warmup": 1, "iters": 3, "dtype": "bfloat16", "path": "permute", "window": 64, "landmark_stride": 0, "num_cycles": 1, "seed": 42, "permute_head_chunk_size": 2, "permute_query_chunk_size": 384, "permute_memory_budget_multiplier": 1.0, "full_swap": true}, "metrics": {"status": "pending"}, "decision": "pending", "next_action": "run glm attention swap and compute deltas/joint utility"}
