{"id":"EXP-20260319T145856Z-QWEN35CUDA-QUALITY-MULTILEN-DIVERGENCE-RESULT","date":"2026-03-19","question":"Can the Qwen CUDA Wayfinder quality harness report divergence at every requested sequence length so we can honestly validate the Hamiltonian quality gate for landmark strides 64, 0, and 128?","hypothesis":"The harness fix should emit one divergence row per requested sequence length, and the fused Hamiltonian path was expected to keep cosine_similarity > 0.99 and top1_agreement > 0.90 through T=4096 for stride 64 and likely stride 128, with stride 0 expected to drift the most.","change_set":["scripts/bench_qwen35_cuda_wayfinder.py","tests/test_qwen_cuda_wayfinder_cli.py","notes/LAB_NOTEBOOK.md","notes/experiments.ndjson"],"command":".venv/bin/python -m py_compile scripts/bench_qwen35_cuda_wayfinder.py tests/test_qwen_cuda_wayfinder_cli.py && .venv/bin/python -m pytest tests/test_qwen_cuda_wayfinder_cli.py tests/pytorch/test_torch_qwen_sparse_gqa.py tests/pytorch/test_torch_causality.py tests/pytorch/test_torch_dense_limit_equivalence.py tests/pytorch/test_torch_matches_mlx_reference_small.py -q && .venv/bin/python scripts/bench_qwen35_cuda_wayfinder.py --model-path /home/hmbown/HF_Models/Qwen3.5-9B --seq-lens 64 256 1024 4096 --window 64 --dtype bfloat16 --num-cycles 1 --strategy random --path sparse --forward-target causal_lm --phases divergence --landmark-stride 64 --output benchmarks/cuda/qwen35_wayfinder/EXP-20260319T145856Z-QWEN35CUDA-QUALITY-DIVERGENCE-STRIDE64.ndjson && .venv/bin/python scripts/bench_qwen35_cuda_wayfinder.py --model-path /home/hmbown/HF_Models/Qwen3.5-9B --seq-lens 64 256 1024 4096 --window 64 --dtype bfloat16 --num-cycles 1 --strategy random --path sparse --forward-target causal_lm --phases divergence --landmark-stride 0 --output benchmarks/cuda/qwen35_wayfinder/EXP-20260319T145856Z-QWEN35CUDA-QUALITY-DIVERGENCE-STRIDE0.ndjson && .venv/bin/python scripts/bench_qwen35_cuda_wayfinder.py --model-path /home/hmbown/HF_Models/Qwen3.5-9B --seq-lens 64 256 1024 4096 --window 64 --dtype bfloat16 --num-cycles 1 --strategy random --path sparse --forward-target causal_lm --phases divergence --landmark-stride 128 --output benchmarks/cuda/qwen35_wayfinder/EXP-20260319T145856Z-QWEN35CUDA-QUALITY-DIVERGENCE-STRIDE128.ndjson && journalctl -b -k --since '2026-03-19 09:58:56 CDT' | rg -n 'NVRM|Xid|Out of memory|hung task|BUG:|Call Trace'","controls":{"baseline_harness_location":"scripts/bench_qwen35_cuda_wayfinder.py:755-757","reference_divergence_artifacts":["benchmarks/cuda/qwen35_wayfinder/EXP-20260318T170606Z-QWEN35CUDA-FLEX-SHORT.ndjson","benchmarks/cuda/qwen35_wayfinder/EXP-20260318T171044Z-QWEN35CUDA-FLEX-SHORT.ndjson"],"latest_performance_context":"benchmarks/cuda/qwen35_wayfinder/EXP-20260319T075000Z-QWEN35CUDA-FUSED-NOLM-32768-65536.ndjson","one_process_at_a_time":true,"lock_file":"benchmarks/cuda/qwen35_wayfinder/.bench_qwen35_cuda_wayfinder.lock","retro_backfill_inference":"off","model_path":"/home/hmbown/HF_Models/Qwen3.5-9B","device":"cuda","gpu":"NVIDIA GB10","path":"sparse","strategy":"random","window":64,"num_cycles":1,"seq_lens":[64,256,1024,4096],"dtype":"bfloat16","forward_target":"causal_lm","landmark_strides":[64,0,128]},"metrics":{"status":"completed","validation":{"py_compile":"pass","pytest":{"passed":40,"skipped":2,"failed":0}},"artifacts":["benchmarks/cuda/qwen35_wayfinder/EXP-20260319T145856Z-QWEN35CUDA-QUALITY-DIVERGENCE-STRIDE64.ndjson","benchmarks/cuda/qwen35_wayfinder/EXP-20260319T145856Z-QWEN35CUDA-QUALITY-DIVERGENCE-STRIDE0.ndjson","benchmarks/cuda/qwen35_wayfinder/EXP-20260319T145856Z-QWEN35CUDA-QUALITY-DIVERGENCE-STRIDE128.ndjson"],"quality_gate":{"cosine_similarity_min":0.99,"top1_agreement_min":0.9},"stride64":{"T64":{"cosine_similarity":0.999765,"top1_agreement":1.0,"l2_relative":0.021717},"T256":{"cosine_similarity":0.974983,"top1_agreement":0.9961,"l2_relative":0.225285},"T1024":{"cosine_similarity":0.972676,"top1_agreement":0.9961,"l2_relative":0.234834},"T4096":{"cosine_similarity":0.979964,"top1_agreement":0.9583,"l2_relative":0.199595}},"stride0":{"T64":{"cosine_similarity":0.999765,"top1_agreement":1.0,"l2_relative":0.021717},"T256":{"cosine_similarity":0.971431,"top1_agreement":0.9961,"l2_relative":0.244146},"T1024":{"cosine_similarity":0.970579,"top1_agreement":0.9502,"l2_relative":0.257691},"T4096":{"cosine_similarity":0.979367,"top1_agreement":0.9194,"l2_relative":0.217191}},"stride128":{"T64":{"cosine_similarity":0.999765,"top1_agreement":1.0,"l2_relative":0.021717},"T256":{"cosine_similarity":0.975202,"top1_agreement":0.9961,"l2_relative":0.224143},"T1024":{"cosine_similarity":0.972168,"top1_agreement":0.9971,"l2_relative":0.237763},"T4096":{"cosine_similarity":0.979953,"top1_agreement":0.9795,"l2_relative":0.199228}},"kernel_fault_lines_after_start":3,"kernel_fault_lines":["Mar 19 10:08:17 spark-0d4e kernel: NVRM: nvCheckOkFailedNoLog: Check failed: Out of memory [NV_ERR_NO_MEMORY] (0x00000051) returned from _memdescAllocInternal(pMemDesc) @ mem_desc.c:1359","Mar 19 10:13:11 spark-0d4e kernel: NVRM: nvCheckOkFailedNoLog: Check failed: Out of memory [NV_ERR_NO_MEMORY] (0x00000051) returned from _memdescAllocInternal(pMemDesc) @ mem_desc.c:1359","Mar 19 10:18:07 spark-0d4e kernel: NVRM: nvCheckOkFailedNoLog: Check failed: Out of memory [NV_ERR_NO_MEMORY] (0x00000051) returned from _memdescAllocInternal(pMemDesc) @ mem_desc.c:1359"],"tie_break":{"hypothesis_a":"Stop after the first artifact because the kernel log shows an NVIDIA out-of-memory event.","hypothesis_b":"Later sweeps can still complete even if the driver logs non-fatal allocation failures.","resolved":"The kernel-log OOM is real, but all three artifacts still completed successfully in the main workspace."}},"decision":"follow-up","next_action":"Keep the multi-length divergence harness, but do not promote any current causal-LM Hamiltonian schedule. Root-cause the cosine drift and repeated driver OOM lines before running more causal-LM quality or schedule-sweep benchmarks."}
{"id":"EXP-20260319T200000Z-QWEN35CUDA-DIVERGENCE-OOM-FIX","question":"Does refactoring the divergence loop to single model load eliminate NVRM OOM lines while preserving identical quality metrics?","hypothesis":"Reducing 12 model loads to 3 (one per stride) and comparing logits on CPU should eliminate driver-level OOM from alloc/free cycling on unified memory.","change_set":["scripts/bench_qwen35_cuda_wayfinder.py","tests/test_qwen_cuda_wayfinder_cli.py"],"command":".venv/bin/python scripts/bench_qwen35_cuda_wayfinder.py --model-path /home/hmbown/HF_Models/Qwen3.5-9B --seq-lens 64 256 1024 4096 --window 64 --dtype bfloat16 --num-cycles 1 --strategy random --path sparse --forward-target causal_lm --phases divergence --landmark-stride 64 --output benchmarks/cuda/qwen35_wayfinder/EXP-20260319T200000Z-QWEN35CUDA-DIVERGENCE-OOM-FIX-STRIDE64.ndjson","controls":"same graph family, same quality measurement, same seq_lens, same dtype","metrics":null,"decision":"pending","next_action":"run validation when no other inference is active"}
{"id":"EXP-20260319T210000Z-QWEN35CUDA-BACKBONE-VS-LM-DIVERGENCE","question":"Does lm_head amplify hidden-state divergence or is ~0.97 cosine already present at backbone output?","hypothesis":"The ~0.97 cosine is structural at the attention level (D≈70-130 covering 3-27% of positions). If backbone cosine is also ~0.97, the 0.99 gate is fundamentally incompatible with sparse attention at this sparsity level.","change_set":["scripts/bench_qwen35_cuda_wayfinder.py (planned --divergence-target option)"],"command":"planned: --divergence-target backbone","controls":"same as EXP-20260319T145856Z","metrics":null,"decision":"pending","next_action":"implement --divergence-target option after OOM fix lands"}
{"id":"EXP-20260319T175517Z-GRAPH-AUDIT-STATIC-VALIDATION-PRERUN","date":"2026-03-19","question":"For the graph-theory audit, do the graph-only validation scripts still run cleanly, and do they already show cycle-driven improvements in graph diagnostics while the MLX-backed queue remains locally blocked?","hypothesis":"The graph-only quick scripts should succeed without model inference and show at least one positive cycle-vs-window lift in spectral gap, Fiedler value, diameter, or causal coverage. The MLX-backed queue is expected to remain blocked here because `python3 -c \"import mlx\"` should fail with a precise missing-module error.","change_set":["notes/HCSA_GRAPH_THEORY_AUDIT_20260319.md","notes/LAB_NOTEBOOK.md","notes/experiments.ndjson"],"command":"PYTHONPATH=. python3 scripts/ablation_graph_metrics.py --quick\nPYTHONPATH=. python3 scripts/stress_test_cycle_benefit.py --quick\npython3 -c \"import mlx\"","controls":{"inference":"off","graph_only_scripts":["scripts/ablation_graph_metrics.py --quick","scripts/stress_test_cycle_benefit.py --quick"],"expected_outputs":["results/graph_metrics_ablation.ndjson","results/cycle_benefit_stress_test.ndjson"]},"metrics":{"status":"pending","required":["both graph-only scripts exit 0","both results files exist","quick diagnostics show at least one cycle-vs-window lift","mlx import returns success or a precise blocker reason"]},"decision":"pending","next_action":"Run the validation commands, capture the exact graph lifts and the local MLX import status, then close the audit with runnable-vs-blocked queue guidance."}
{"id":"EXP-20260319T175517Z-GRAPH-AUDIT-STATIC-VALIDATION-RESULT","date":"2026-03-19","question":"For the graph-theory audit, do the graph-only validation scripts still run cleanly, and do they already show cycle-driven improvements in graph diagnostics while the MLX-backed queue remains locally blocked?","hypothesis":"The graph-only quick scripts should succeed without model inference and show at least one positive cycle-vs-window lift in spectral gap, Fiedler value, diameter, or causal coverage. The MLX-backed queue is expected to remain blocked here because `python3 -c \"import mlx\"` should fail with a precise missing-module error.","change_set":["notes/HCSA_GRAPH_THEORY_AUDIT_20260319.md","notes/LAB_NOTEBOOK.md","notes/experiments.ndjson"],"command":"PYTHONPATH=. python3 scripts/ablation_graph_metrics.py --quick\nPYTHONPATH=. python3 scripts/stress_test_cycle_benefit.py --quick\npython3 -c \"import mlx\"","controls":{"inference":"off","graph_only_scripts":["scripts/ablation_graph_metrics.py --quick","scripts/stress_test_cycle_benefit.py --quick"],"expected_outputs":["results/graph_metrics_ablation.ndjson","results/cycle_benefit_stress_test.ndjson"],"graph_metrics_baseline":"window_only_T256_w8 in results/graph_metrics_ablation.ndjson","stress_baseline":"window_w8 at T=256 in results/cycle_benefit_stress_test.ndjson"},"metrics":{"status":"completed","artifacts":["results/graph_metrics_ablation.ndjson","results/cycle_benefit_stress_test.ndjson","notes/HCSA_GRAPH_THEORY_AUDIT_20260319.md"],"validation":{"ablation_graph_metrics_quick":"pass","stress_test_cycle_benefit_quick":"pass","mlx_import":"ModuleNotFoundError: No module named 'mlx'"},"graph_metrics_quick":{"baseline":{"name":"window_only_T256_w8","fiedler":0.03070403097474996,"diameter":32,"expansion_ratio":0.9897148019054499},"random_cycles_k1":{"fiedler":1.6536921806949318,"fiedler_delta_abs":1.622988149720182,"fiedler_delta_pct":5285.912299446534,"diameter":4,"diameter_delta_abs":-28,"diameter_delta_pct":-87.5,"expansion_ratio":1.086117777290112,"expansion_ratio_delta_abs":0.09640297538466224,"expansion_ratio_delta_pct":9.740450183058391},"random_cycles_k2":{"fiedler":3.5379047110044617,"fiedler_delta_abs":3.5072006800297117,"fiedler_delta_pct":11422.60663726507,"diameter":4,"diameter_delta_abs":-28,"diameter_delta_pct":-87.5,"expansion_ratio":1.2180190975088814,"expansion_ratio_delta_abs":0.22830429560343148,"expansion_ratio_delta_pct":23.067017882635905}},"stress_test_quick":{"baseline":{"name":"window_w8_T256","coverage_at_L5":0.44578755668720094,"causal_diameter":32,"spectral_gap":0.0019882883549485753},"plus1_cycle":{"coverage_at_L5":0.9862800567389126,"coverage_delta_abs":0.5404925000517117,"coverage_delta_pct":121.24441159109406,"causal_diameter":6,"causal_diameter_delta_abs":-26,"causal_diameter_delta_pct":-81.25,"spectral_gap":0.10550155922785298,"spectral_gap_delta_abs":0.1035132708729044,"spectral_gap_delta_pct":5206.149833110181},"plus2_cycles":{"coverage_at_L5":1.0,"coverage_delta_abs":0.5542124433127991,"coverage_delta_pct":124.32209804852795,"causal_diameter":5,"causal_diameter_delta_abs":-27,"causal_diameter_delta_pct":-84.375,"spectral_gap":0.18997160967729843,"spectral_gap_delta_abs":0.18798332132234985,"spectral_gap_delta_pct":9454.530116543978}}},"decision":"follow-up","next_action":"Use the graph-only lifts as supporting evidence in the audit memo, keep CUDA/Torch as the immediately runnable cycle-isolation surface on this host, and leave the MLX run queue staged until `mlx` is restored."}
{"id":"EXP-20260319T182733Z-TRITONRLM-WAYFINDER-SPARSE-GQA-BRIDGE-PRERUN","date":"2026-03-19","question":"Can `triton-rlm` host a Wayfinder-specific sparse GQA kernel task that loads the sibling repo, validates against a PyTorch sparse-attention oracle, and benchmarks the live Wayfinder Triton kernel as the seed baseline without copying the whole model stack?","hypothesis":"A dedicated `triton_rlm.tasks.wayfinder_sparse_gqa` task should load cleanly when `WAYFINDER_ROOT=/home/hmbown/Projects/Wayfinder`, use the existing Wayfinder fused sparse kernel as `baseline_source`, and pass a `--backend static` campaign against randomized Qwen-like sparse GQA validation cases within the task tolerances.","change_set":["/home/hmbown/Projects/triton-rlm/src/triton_rlm/tasks/wayfinder_sparse_gqa.py","/home/hmbown/Projects/triton-rlm/README.md","notes/LAB_NOTEBOOK.md","notes/experiments.ndjson"],"command":"python3 -m py_compile /home/hmbown/Projects/triton-rlm/src/triton_rlm/tasks/wayfinder_sparse_gqa.py\ncd /home/hmbown/Projects/triton-rlm && WAYFINDER_ROOT=/home/hmbown/Projects/Wayfinder PYTHONPATH=src python3 -m triton_rlm.cli run --task triton_rlm.tasks.wayfinder_sparse_gqa --backend static --out-dir artifacts/wayfinder_static --num-candidates 1 --repair-attempts 0","controls":{"backend":"static","wayfinder_root":"/home/hmbown/Projects/Wayfinder","benchmark_case":{"batch_size":1,"seq_len":1024,"degree":64,"num_q_heads":32,"num_kv_heads":2,"head_dim":256},"validation_cases":"fixed in triton_rlm.tasks.wayfinder_sparse_gqa","seed_source":"live Wayfinder hcsa/torch/triton_fused_sparse_attn.py"},"metrics":{"status":"pending","required":["task module imports successfully","summary.json artifact exists","candidate passes all validation cases","reference and candidate benchmark latencies are finite"]},"decision":"pending","next_action":"Run the static bridge smoke, inspect the artifact summary, and record whether the harness is ready for real kernel-search campaigns."}
{"id":"EXP-20260319T182733Z-TRITONRLM-WAYFINDER-SPARSE-GQA-BRIDGE-RESULT","date":"2026-03-19","question":"Can `triton-rlm` host a Wayfinder-specific sparse GQA kernel task that loads the sibling repo, validates against a PyTorch sparse-attention oracle, and benchmarks the live Wayfinder Triton kernel as the seed baseline without copying the whole model stack?","hypothesis":"A dedicated `triton_rlm.tasks.wayfinder_sparse_gqa` task should load cleanly when `WAYFINDER_ROOT=/home/hmbown/Projects/Wayfinder`, use the existing Wayfinder fused sparse kernel as `baseline_source`, and pass a `--backend static` campaign against randomized Qwen-like sparse GQA validation cases within the task tolerances.","change_set":["/home/hmbown/Projects/Wayfinder/hcsa/torch/triton_fused_sparse_attn.py","/home/hmbown/Projects/Wayfinder/tests/pytorch/test_torch_qwen_sparse_gqa.py","/home/hmbown/Projects/triton-rlm/src/triton_rlm/tasks/wayfinder_sparse_gqa.py","/home/hmbown/Projects/triton-rlm/src/triton_rlm/examples/wayfinder_sparse_gqa_candidate.py","/home/hmbown/Projects/triton-rlm/src/triton_rlm/tasks/__init__.py","/home/hmbown/Projects/triton-rlm/tests/test_tasks.py","/home/hmbown/Projects/triton-rlm/README.md","notes/LAB_NOTEBOOK.md","notes/experiments.ndjson"],"command":"python3 -m py_compile /home/hmbown/Projects/Wayfinder/hcsa/torch/triton_fused_sparse_attn.py /home/hmbown/Projects/Wayfinder/tests/pytorch/test_torch_qwen_sparse_gqa.py /home/hmbown/Projects/triton-rlm/src/triton_rlm/examples/wayfinder_sparse_gqa_candidate.py /home/hmbown/Projects/triton-rlm/tests/test_tasks.py\npython3 -m pytest /home/hmbown/Projects/Wayfinder/tests/pytorch/test_torch_qwen_sparse_gqa.py -q -k 'test_sparse_gqa_triton_fused_matches_repeated_kv_reference or test_sparse_gqa_triton_fused_handles_fully_masked_rows_with_bias'\ncd /home/hmbown/Projects/triton-rlm && PYTHONPATH=src python3 -m pytest tests/test_tasks.py -q\ncd /home/hmbown/Projects/triton-rlm && WAYFINDER_ROOT=/home/hmbown/Projects/Wayfinder PYTHONPATH=src python3 -m triton_rlm.cli run --task triton_rlm.tasks.wayfinder_sparse_gqa --backend static --out-dir artifacts/wayfinder_static --num-candidates 1 --repair-attempts 0","controls":{"backend":"static","wayfinder_root":"/home/hmbown/Projects/Wayfinder","failed_anchor_artifact":"/home/hmbown/Projects/triton-rlm/artifacts/wayfinder_static/wayfinder-sparse-gqa-20260319-132828/summary.json","fixed_artifact":"/home/hmbown/Projects/triton-rlm/artifacts/wayfinder_static/wayfinder-sparse-gqa-20260319-133412/summary.json","benchmark_case":{"batch_size":1,"seq_len":2048,"degree":64,"num_q_heads":32,"num_kv_heads":2,"head_dim":256},"validation_cases":"fixed in triton_rlm.tasks.wayfinder_sparse_gqa","seed_source":"vendored Wayfinder fused sparse GQA candidate"},"metrics":{"status":"completed","validation":{"py_compile":"pass","wayfinder_targeted_pytest":"pass","triton_rlm_pytest":"13 passed","static_bridge_campaign":"pass"},"artifacts":["/home/hmbown/Projects/triton-rlm/artifacts/wayfinder_static/wayfinder-sparse-gqa-20260319-132828/summary.json","/home/hmbown/Projects/triton-rlm/artifacts/wayfinder_static/wayfinder-sparse-gqa-20260319-133412/summary.json"],"root_cause":"Fully masked rows with bias produced NaNs in the fused online-softmax update (`-inf - -inf`) before the fix.","reference_latency_ms":{"failed_anchor":80.13005065917969,"fixed_run":82.35763549804688,"delta_abs":2.2275848388671875,"delta_pct":2.7800572101209035},"candidate_latency_ms":{"fixed_run":4.315936088562012,"delta_vs_reference_abs":-78.04169940948486,"delta_vs_reference_pct":-94.75965743600015,"speedup_vs_reference":19.082218505577288},"correctness":{"ok":true,"max_abs_error":0.001953125,"max_rel_error":211.75,"note":"Large relative error is caused by near-zero denominators; absolute error stayed within tolerance and all validation cases passed."}},"decision":"keep","next_action":"Add a Wayfinder-side tensor trace dumper for real Qwen sparse-attention slices, then run a first non-static `triton-rlm` search campaign on `triton_rlm.tasks.wayfinder_sparse_gqa`."}
