{"id":"EXP-20260321T003052Z-QWEN35CUDA-TRITON-SCALE-9B-RESULT","date":"2026-03-21","question":"Does the staged Wayfinder Triton block-sparse path keep improving versus dense on Qwen3.5-9B when the scaling curve is extended to T=8192, 32768, 65536, 98304, and 131072 with matched warmup=1, repeats=3, and forward_target=backbone?","hypothesis":"The current Triton block-sparse path should stay near parity at 8k, cross clearly positive by 32k, and reach its strongest speedup at 131072 because only the 8 full-attention layers are swapped while the block topology keeps memory overhead near zero on this hardware.","change_set":["measurement only"],"command":".venv/bin/python scripts/bench_qwen35_cuda_wayfinder.py --model-path /home/hmbown/HF_Models/Qwen3.5-9B --seq-lens 8192 32768 65536 98304 131072 --warmup 1 --repeats 3 --path block_sparse --engine triton --phases wayfinder dense --forward-target backbone --output benchmarks/cuda/qwen35_wayfinder/EXP-20260321T003052Z-QWEN35CUDA-TRITON-SCALE-9B.ndjson","controls":{"baseline_run_path":"benchmarks/cuda/qwen35_wayfinder/EXP-20260320T204420Z-Qwen3.5-9B.ndjson","one_process_at_a_time":true,"retro_backfill_inference":"off","model":"Qwen3.5-9B","model_path":"/home/hmbown/HF_Models/Qwen3.5-9B","device":"cuda","gpu":"NVIDIA GB10","path":"block_sparse","engine":"triton","block_size":128,"block_local_window_blocks":1,"block_partner_count":1,"block_sink_blocks":1,"block_partner_rule":"xor","dtype":"bfloat16","seq_lens":[8192,32768,65536,98304,131072],"warmup":1,"repeats":3,"forward_target":"backbone","phases":["wayfinder","dense"]},"metrics":{"artifact":"benchmarks/cuda/qwen35_wayfinder/EXP-20260321T003052Z-QWEN35CUDA-TRITON-SCALE-9B.ndjson","status":"completed","summary":{"T8192":{"dense_ms":4960.7,"wf_ms":4824.01,"speedup":"1.03x","dense_peak_gb":18.38,"wf_peak_gb":18.38},"T32768":{"dense_ms":20669.09,"wf_ms":19413.58,"speedup":"1.06x","dense_peak_gb":23.46,"wf_peak_gb":23.46},"T65536":{"dense_ms":44422.5,"wf_ms":38016.88,"speedup":"1.17x","dense_peak_gb":30.23,"wf_peak_gb":30.24},"T98304":{"dense_ms":69574.24,"wf_ms":59218.02,"speedup":"1.17x","dense_peak_gb":37.01,"wf_peak_gb":37.01},"T131072":{"dense_ms":96021.4,"wf_ms":78645.26,"speedup":"1.22x","dense_peak_gb":43.78,"wf_peak_gb":43.78}},"delta_vs_dense_abs":{"T8192":{"median_ms":-136.69,"peak_mem_gb":0.0},"T32768":{"median_ms":-1255.51,"peak_mem_gb":0.0},"T65536":{"median_ms":-6405.62,"peak_mem_gb":0.01},"T98304":{"median_ms":-10356.22,"peak_mem_gb":0.0},"T131072":{"median_ms":-17376.14,"peak_mem_gb":0.0}},"delta_vs_dense_pct":{"T8192":{"median_ms":-2.7554,"peak_mem_gb":0.0},"T32768":{"median_ms":-6.0744,"peak_mem_gb":0.0},"T65536":{"median_ms":-14.4195,"peak_mem_gb":0.0331},"T98304":{"median_ms":-14.8846,"peak_mem_gb":0.0},"T131072":{"median_ms":-18.0961,"peak_mem_gb":0.0}},"delta_vs_named_baseline_abs":{"T65536":{"wf_median_ms":90.45},"T131072":{"wf_median_ms":2669.39}},"delta_vs_named_baseline_pct":{"T65536":{"wf_median_ms":0.2385},"T131072":{"wf_median_ms":3.5135}},"memory_reduction_pct_convention":"100*(1-wayfinder/dense)","memory_reduction_pct":{"T8192":0.0,"T32768":0.0,"T65536":-0.0331,"T98304":0.0,"T131072":0.0}},"decision":"keep","next_action":"Run a dedicated T=262144 paired Triton benchmark, then execute divergence and decode checks before any MoE expansion or DeltaNet discussion."}
{"id":"EXP-20260321T010416Z-QWEN35CUDA-TRITON-SCALE-9B-262144-PRERUN","date":"2026-03-21","question":"At Qwen3.5-9B's configured maximum text context, T=262144, does the staged Wayfinder Triton block-sparse path still fit and preserve or improve the dense-vs-Wayfinder speedup trend?","hypothesis":"If both phases fit on the DGX Spark, Wayfinder should remain at least parity-positive and likely improve beyond the 1.22x seen at 131072, while peak memory should remain effectively equal to dense because only the 8 full-attention layers are swapped and the block topology overhead has stayed near zero through 131072.","change_set":["measurement only"],"command":".venv/bin/python scripts/bench_qwen35_cuda_wayfinder.py --model-path /home/hmbown/HF_Models/Qwen3.5-9B --seq-lens 262144 --warmup 1 --repeats 3 --path block_sparse --engine triton --phases wayfinder dense --forward-target backbone --output benchmarks/cuda/qwen35_wayfinder/EXP-20260321T010416Z-QWEN35CUDA-TRITON-SCALE-9B-262144.ndjson","controls":{"baseline_run_path":"benchmarks/cuda/qwen35_wayfinder/EXP-20260321T003052Z-QWEN35CUDA-TRITON-SCALE-9B.ndjson","one_process_at_a_time":true,"retro_backfill_inference":"off","model":"Qwen3.5-9B","model_path":"/home/hmbown/HF_Models/Qwen3.5-9B","device":"cuda","gpu":"NVIDIA GB10","path":"block_sparse","engine":"triton","block_size":128,"block_local_window_blocks":1,"block_partner_count":1,"block_sink_blocks":1,"block_partner_rule":"xor","dtype":"bfloat16","seq_lens":[262144],"warmup":1,"repeats":3,"forward_target":"backbone","phases":["wayfinder","dense"],"stop_gates":["nonzero exit","missing artifact","missing dense or wayfinder row for T=262144","record OOM/runtime error explicitly if present"]},"metrics":{"status":"pending","artifacts_expected":["benchmarks/cuda/qwen35_wayfinder/EXP-20260321T010416Z-QWEN35CUDA-TRITON-SCALE-9B-262144.ndjson"],"required":["one dense row and one wayfinder row for T=262144","absolute latency, delta vs 131072 baseline, and percentage delta","memory reduction convention 100*(1-wayfinder/dense)"]},"decision":"pending","next_action":"Run the dedicated T=262144 paired Triton benchmark and record whether max-context prefill still fits and speeds up."}
{"id":"EXP-20260321T010416Z-QWEN35CUDA-TRITON-SCALE-9B-262144-RESULT","date":"2026-03-21","question":"At Qwen3.5-9B's configured maximum text context T=262144, does the staged Wayfinder Triton block-sparse path still fit?","hypothesis":"If both phases fit on the DGX Spark, Wayfinder should remain parity-positive and likely improve beyond 1.22x at 131072.","change_set":["measurement only"],"command":".venv/bin/python scripts/bench_qwen35_cuda_wayfinder.py --model-path /home/hmbown/HF_Models/Qwen3.5-9B --seq-lens 262144 --warmup 1 --repeats 3 --path block_sparse --engine triton --phases wayfinder dense --forward-target backbone --output benchmarks/cuda/qwen35_wayfinder/EXP-20260321T010416Z-QWEN35CUDA-TRITON-SCALE-9B-262144.ndjson","controls":{"model":"Qwen3.5-9B","path":"block_sparse","engine":"triton","block_size":128},"metrics":{"status":"OOM_killed","artifact":"benchmarks/cuda/qwen35_wayfinder/EXP-20260321T010416Z-QWEN35CUDA-TRITON-SCALE-9B-262144.ndjson","detail":"Only experiment_meta emitted. Process killed by Linux OOM killer during Wayfinder phase. NVIDIA NV_ERR_NO_MEMORY logged. No valid benchmark row."},"decision":"follow-up","next_action":"Do not rerun full paired 262144 benchmark. Use guarded smoke with reduced repeats if max-context probing is needed."}
{"id":"EXP-20260321T011456Z-QWEN35CUDA-QUALITY-DIVERGENCE-PRERUN","date":"2026-03-21","question":"What is the logit divergence between dense and Wayfinder Triton block-sparse attention on Qwen3.5-9B at T=4096 and T=16384?","hypothesis":"Since only 8 of 32 layers are swapped and the block topology includes local+partner+sink blocks, cosine similarity should remain above 0.99 and top-1 agreement above 0.95 at both sequence lengths. Divergence may increase slightly at 16384 because more positions are affected by the sparse topology.","change_set":["measurement only"],"command":".venv/bin/python scripts/bench_qwen35_cuda_wayfinder.py --model-path /home/hmbown/HF_Models/Qwen3.5-9B --seq-lens 4096 16384 --warmup 1 --repeats 1 --path block_sparse --engine triton --phases divergence --forward-target causal_lm --allow-large-logits --output benchmarks/cuda/qwen35_wayfinder/EXP-20260321T011456Z-QWEN35CUDA-QUALITY-DIVERGENCE.ndjson","controls":{"model":"Qwen3.5-9B","path":"block_sparse","engine":"triton","block_size":128,"block_local_window_blocks":1,"block_partner_count":1,"block_sink_blocks":1,"block_partner_rule":"xor","dtype":"bfloat16","forward_target":"causal_lm","phases":["divergence"],"retro_backfill_inference":"off"},"metrics":{"status":"pending","required":["divergence row for T=4096 and T=16384","cosine_similarity","l2_relative","top1_agreement"]},"decision":"pending","next_action":"Run divergence measurement and record RESULT entry."}
{"id":"EXP-20260321T011456Z-QWEN35CUDA-DECODE-TTFT-TPOT-PRERUN","date":"2026-03-21","question":"What is the TTFT and TPOT impact of Wayfinder block-sparse attention on Qwen3.5-9B decode at prompt lengths 4096 and 16384?","hypothesis":"TTFT should show Wayfinder speedup consistent with prefill measurements (modest at 4096, clearer at 16384). TPOT should be near-parity since decode is q_len=1 and falls back to dense. Peak memory should be similar.","change_set":["measurement only"],"command":".venv/bin/python scripts/bench_decode_wayfinder.py --model-path /home/hmbown/HF_Models/Qwen3.5-9B --prompt-lens 4096 16384 --max-new-tokens 32","controls":{"model":"Qwen3.5-9B","engine":"sdpa","block_size":128,"block_local_window_blocks":1,"block_partner_count":1,"block_sink_blocks":1,"block_partner_rule":"xor","dense_fallback_q_len":0,"max_new_tokens":32,"retro_backfill_inference":"off"},"metrics":{"status":"pending","required":["TTFT_ms","TPOT_ms","decode_tok_per_sec","peak_mem_gb for both dense and wayfinder at both prompt lengths"]},"decision":"pending","next_action":"Run decode benchmark after quality evaluation completes."}
{"id":"EXP-20260321T012000Z-QWEN35CUDA-GUARDED-262K-PROBE-PRERUN","date":"2026-03-21","question":"Can the Wayfinder Triton block-sparse path fit at T=262144 on the DGX Spark GB10 (120 GB unified memory) when run in isolation without a paired dense phase?","hypothesis":"With wayfinder-only, warmup=0, repeats=1, and backbone target, the estimated peak (~70 GB) should fit within available memory. Previous OOM was from running both phases in one process.","change_set":["measurement only"],"command":"Phase A: .venv/bin/python scripts/bench_qwen35_cuda_wayfinder.py --model-path /home/hmbown/HF_Models/Qwen3.5-9B --seq-lens 262144 --warmup 0 --repeats 1 --path block_sparse --engine triton --phases wayfinder --forward-target backbone --skip-divergence --output benchmarks/cuda/qwen35_wayfinder/EXP-20260321T012000Z-QWEN35CUDA-GUARDED-262K-PROBE-WF.ndjson","controls":{"model":"Qwen3.5-9B","path":"block_sparse","engine":"triton","block_size":128,"block_local_window_blocks":1,"block_partner_count":1,"block_sink_blocks":1,"block_partner_rule":"xor","dtype":"bfloat16","warmup":0,"repeats":1,"forward_target":"backbone","phases_a":["wayfinder"],"phases_b":["dense"],"retro_backfill_inference":"off"},"metrics":{"status":"pending","required":["wayfinder row for T=262144 in Phase A","dense row for T=262144 in Phase B if A succeeds"]},"decision":"pending","next_action":"Run Phase A (WF only) and record outcome."}
{"id":"EXP-20260321T011456Z-QWEN35CUDA-QUALITY-DIVERGENCE-RESULT","date":"2026-03-21","question":"What is the logit divergence between dense and Wayfinder Triton block-sparse attention on Qwen3.5-9B at T=4096 and T=16384?","hypothesis":"Cosine similarity above 0.99 and top-1 agreement above 0.95 at both lengths.","change_set":["measurement only"],"command":".venv/bin/python scripts/bench_qwen35_cuda_wayfinder.py --model-path /home/hmbown/HF_Models/Qwen3.5-9B --seq-lens 4096 16384 --warmup 1 --repeats 1 --path block_sparse --engine triton --phases divergence --forward-target causal_lm --allow-large-logits --output benchmarks/cuda/qwen35_wayfinder/EXP-20260321T011456Z-QWEN35CUDA-QUALITY-DIVERGENCE.ndjson","controls":{"model":"Qwen3.5-9B","path":"block_sparse","engine":"triton","block_size":128,"block_local_window_blocks":1,"block_partner_count":1,"block_sink_blocks":1,"block_partner_rule":"xor","dtype":"bfloat16","forward_target":"causal_lm","phases":["divergence"]},"metrics":{"artifact":"benchmarks/cuda/qwen35_wayfinder/EXP-20260321T011456Z-QWEN35CUDA-QUALITY-DIVERGENCE.ndjson","status":"completed","T4096":{"cosine_similarity_raw":2.740915,"l2_distance":23130.07,"l2_relative":0.291318,"top1_agreement":0.9988},"T16384":{"cosine_similarity_raw":8.244551,"l2_distance":32329.28,"l2_relative":0.339967,"top1_agreement":0.9444},"notes":"cosine_similarity values > 1 are anomalous (expected range [-1,1]); likely a computation artifact in the flattened cosine_similarity call. top1_agreement and l2_relative are the reliable metrics. Hypothesis partially met: T=4096 top1=99.88% exceeds threshold, T=16384 top1=94.44% falls below the 0.95 hypothesis."},"decision":"keep","next_action":"Report quality degradation honestly in documentation. Consider investigating cosine_sim anomaly. Run decode benchmark next."}
{"id":"EXP-20260321T011456Z-QWEN35CUDA-DECODE-TTFT-TPOT-RESULT","date":"2026-03-21","question":"What is the TTFT and TPOT impact of Wayfinder block-sparse attention on Qwen3.5-9B decode at prompt lengths 4096 and 16384?","hypothesis":"TTFT should show WF speedup consistent with prefill measurements. TPOT near-parity since decode is q_len=1.","change_set":["measurement only"],"command":".venv/bin/python scripts/bench_decode_wayfinder.py --model-path /home/hmbown/HF_Models/Qwen3.5-9B --prompt-lens 4096 16384 --max-new-tokens 32","controls":{"model":"Qwen3.5-9B","engine":"sdpa","block_size":128,"block_local_window_blocks":1,"block_partner_count":1,"block_sink_blocks":1,"block_partner_rule":"xor","dense_fallback_q_len":0,"max_new_tokens":32},"metrics":{"status":"completed","T4096":{"dense_ttft_ms":2586,"wf_ttft_ms":2788,"ttft_speedup":"0.93x","dense_tpot_ms":100.5,"wf_tpot_ms":110.0,"tpot_speedup":"0.91x","dense_decode_tok_s":10,"wf_decode_tok_s":9,"dense_peak_gb":17.7,"wf_peak_gb":18.3},"T16384":{"dense_ttft_ms":10426,"wf_ttft_ms":10945,"ttft_speedup":"0.95x","dense_tpot_ms":89.7,"wf_tpot_ms":97.6,"tpot_speedup":"0.92x","dense_decode_tok_s":11,"wf_decode_tok_s":10,"dense_peak_gb":20.6,"wf_peak_gb":20.6},"notes":"WF is SLOWER on decode. Decode script uses engine=sdpa (not triton) and dense_fallback_q_len=0 (WF active at q_len=1). In production with dense_fallback_q_len=1, TPOT would match dense since single-token decode falls back to stock attention. TTFT regression is because sdpa engine does not achieve Triton block-sparse speedup at these lengths. Hypothesis NOT met: WF adds 5-7% TTFT overhead and 8-9% TPOT overhead under these conditions."},"decision":"keep","next_action":"Note decode overhead honestly in documentation. The prefill speedup benefit applies to the backbone scaling benchmark with triton engine at longer contexts, not to sdpa-engine decode at short context."}
{"id":"EXP-20260321T012000Z-QWEN35CUDA-GUARDED-262K-PROBE-WF-RESULT","date":"2026-03-21","question":"Can the Wayfinder Triton block-sparse path fit at T=262144 on the DGX Spark?","hypothesis":"Estimated ~70 GB peak should fit within 120 GB unified.","change_set":["measurement only"],"command":"(see PRERUN)","controls":{"model":"Qwen3.5-9B","path":"block_sparse","engine":"triton"},"metrics":{"status":"OOM_machine_restart","artifact":"benchmarks/cuda/qwen35_wayfinder/EXP-20260321T012000Z-QWEN35CUDA-GUARDED-262K-PROBE-WF.ndjson","detail":"Only experiment_meta emitted. Linux OOM killer at 20:26:54 killed python (total-vm=154871128kB=~148GB), then cascaded to kill claude, nautilus, and others. Machine became unresponsive and required restart. Linear memory estimate was wrong — actual memory scaling is super-linear, likely from DeltaNet layer state and Triton intermediates at this scale."},"decision":"follow-up","next_action":"Do NOT attempt 262k again. Step incrementally from 131k: try 160k, then 192k if 160k fits. Each attempt wayfinder-only, warmup=0, repeats=1, backbone."}
{"id":"EXP-20260321T023000Z-QWEN35CUDA-INCREMENTAL-SCALE-PRERUN","date":"2026-03-21","question":"How far beyond 131k can Wayfinder Triton block-sparse prefill scale on the DGX Spark (120 GB unified) when stepping incrementally?","hypothesis":"160k should fit (~57 GB estimated), 192k is uncertain, 262k is a known OOM. Each step probes the boundary safely.","change_set":["measurement only"],"command":".venv/bin/python scripts/bench_qwen35_cuda_wayfinder.py --model-path /home/hmbown/HF_Models/Qwen3.5-9B --seq-lens 163840 --warmup 0 --repeats 1 --path block_sparse --engine triton --phases wayfinder --forward-target backbone --skip-divergence --output benchmarks/cuda/qwen35_wayfinder/EXP-20260321T023000Z-QWEN35CUDA-INCREMENTAL-SCALE-160K.ndjson","controls":{"model":"Qwen3.5-9B","path":"block_sparse","engine":"triton","block_size":128,"warmup":0,"repeats":1,"forward_target":"backbone","phases":["wayfinder"]},"metrics":{"status":"pending"},"decision":"pending","next_action":"Run 160k probe, then step up if successful."}
