{"id":"EXP-20260207-133728","date":"2026-02-07","question":"Can chunked batched permute attention reduce long-context memory vs dense?","hypothesis":"Eliminating global [T,W,dh] materialization and deferred GQA repeat will lower peak memory at T=8192.","change_set":["hcsa/mlx/attention.py batched chunked permute path","hcsa/integrations/qwen_mlx.py deferred KV repeat on permute path","scripts/bench_qwen_wayfinder_mlx.py output retention fix"],"command":"python3 scripts/bench_qwen_wayfinder_mlx.py --model-path mlx-community/Qwen3-1.7B-4bit --seq-lens 2048 8192 --batch 1 --warmup 1 --iters 1 --path permute --window 64 --landmark-stride 64 --seed 42 --full-swap","controls":{"model":"mlx-community/Qwen3-1.7B-4bit","window":64,"landmark_stride":64,"batch":1},"metrics":{"path":"benchmarks/mlx/qwen3_1.7b_4bit_wayfinder/20260207_133728/results.json","t8192_dense_peak_mem":1186678824,"t8192_wayfinder_peak_mem":1156994376,"t8192_mem_delta":-29684448},"decision":"keep","next_action":"improve latency while preserving memory win"}
{"id":"EXP-20260207-154622","date":"2026-02-07","question":"Can we cut Wayfinder latency without losing long-context memory advantage?","hypothesis":"Preallocating chunk output and tuning chunk policy will reduce overhead.","change_set":["hcsa/mlx/attention.py preallocated y_pi chunk writes","hcsa/integrations/qwen_mlx.py chunk policy h<=2,q<=384"],"command":"python3 scripts/bench_qwen_wayfinder_mlx.py --model-path mlx-community/Qwen3-1.7B-4bit --seq-lens 2048 8192 --batch 1 --warmup 1 --iters 1 --path permute --window 64 --landmark-stride 64 --seed 42 --full-swap","controls":{"model":"mlx-community/Qwen3-1.7B-4bit","window":64,"landmark_stride":64,"batch":1},"metrics":{"path":"benchmarks/mlx/qwen3_1.7b_4bit_wayfinder/20260207_154622/results.json","t8192_dense_peak_mem":1186678824,"t8192_wayfinder_peak_mem":1162467674,"t8192_mem_delta":-24211150,"t8192_wayfinder_latency_ms":96.2842080007249,"previous_wayfinder_latency_ms":162.40641699914704,"wayfinder_latency_improvement_pct":40.714037179189425},"decision":"keep","next_action":"run isolated per-seq matrix for clean short-vs-long profile"}
{"id":"EXP-20260207-QWEN-ISO-BASE","date":"2026-02-07","question":"What is clean isolated performance/memory curve for Qwen permute path (retro off)?","hypothesis":"Short contexts remain slower; long contexts should show memory reduction.","change_set":["measurement only"],"command":"python3 scripts/bench_qwen_wayfinder_mlx.py ... isolated per T in {256,512,1024,2048,4096,8192} with retro disabled","controls":{"model":"mlx-community/Qwen3-1.7B-4bit","window":64,"landmark_stride":64,"batch":1,"warmup":1,"iters":1},"metrics":{"paths":["benchmarks/mlx/qwen3_1.7b_4bit_wayfinder/20260207_qwen_matrix_isolated_base/T256/results.json","benchmarks/mlx/qwen3_1.7b_4bit_wayfinder/20260207_qwen_matrix_isolated_base/T512/results.json","benchmarks/mlx/qwen3_1.7b_4bit_wayfinder/20260207_qwen_matrix_isolated_base/T1024/results.json","benchmarks/mlx/qwen3_1.7b_4bit_wayfinder/20260207_qwen_matrix_isolated_base/T2048/results.json","benchmarks/mlx/qwen3_1.7b_4bit_wayfinder/20260207_qwen_matrix_isolated_base/T4096/results.json","benchmarks/mlx/qwen3_1.7b_4bit_wayfinder/20260207_qwen_long_cmp_base2/results.json"],"t8192_dense_peak_mem":225182248,"t8192_wayfinder_peak_mem":200971098,"t8192_memory_reduction_pct":10.75},"decision":"keep","next_action":"compare retro variant on same isolated protocol"}
{"id":"EXP-20260207-QWEN-ISO-RETRO-A02","date":"2026-02-07","question":"Does retro backfill (alpha=0.2, offsets [1,2,4]) improve Qwen metrics?","hypothesis":"Retro may improve representational flow but likely increases runtime/memory.","change_set":["retro_backfill_enabled=true","retro_backfill_alpha=0.2","retro_backfill_offsets=[1,2,4]","retro_backfill_training_only=false for inference ablation"],"command":"python3 scripts/bench_qwen_wayfinder_mlx.py ... isolated per T in {256,512,1024,2048,4096,8192} with --retro-backfill --retro-alpha 0.2 --retro-offsets 1 2 4 --retro-allow-inference","controls":{"model":"mlx-community/Qwen3-1.7B-4bit","window":64,"landmark_stride":64,"batch":1,"warmup":1,"iters":1},"metrics":{"paths":["benchmarks/mlx/qwen3_1.7b_4bit_wayfinder/20260207_qwen_matrix_isolated_retro_infer/T256/results.json","benchmarks/mlx/qwen3_1.7b_4bit_wayfinder/20260207_qwen_matrix_isolated_retro_infer/T512/results.json","benchmarks/mlx/qwen3_1.7b_4bit_wayfinder/20260207_qwen_matrix_isolated_retro_infer/T1024/results.json","benchmarks/mlx/qwen3_1.7b_4bit_wayfinder/20260207_qwen_matrix_isolated_retro_infer/T2048/results.json","benchmarks/mlx/qwen3_1.7b_4bit_wayfinder/20260207_qwen_matrix_isolated_retro_infer/T4096/results.json","benchmarks/mlx/qwen3_1.7b_4bit_wayfinder/20260207_qwen_long_cmp_retro_infer2/results.json"],"t8192_dense_peak_mem":225182248,"t8192_wayfinder_peak_mem":262084974,"t8192_memory_reduction_pct":-16.39},"decision":"reject_default","next_action":"keep retro as training-only research path and tune on original non-Qwen first"}
{"id":"EXP-20260207-RETRO-SIMPLE","date":"2026-02-07","question":"Can a simplified Hamiltonian-local retro backfill reduce overhead while maintaining representational benefit?","hypothesis":"Replacing multi-offset gated retro with single mx.roll(+alpha) reduces O(T*k) to O(T), eliminates extra allocations, and maintains training-time representational flexibility.","change_set":["hcsa/mlx/attention.py: remove retro_backfill_offsets parameter","hcsa/mlx/attention.py: replace gated multi-offset loop with mx.roll(y_pi, shift=-1, axis=2)","hcsa/mlx/attention.py: keep retro_backfill_training_only=True as causal-safe default","tests/mlx/test_permute_retro_backfill.py: add alpha_zero test, causality test, multi-head perm test"],"command":"pytest tests/mlx/test_permute_retro_backfill.py -v && python3 scripts/bench_qwen_wayfinder_mlx.py --model-path mlx-community/Qwen3-1.7B-4bit --seq-lens 1024 4096 --batch 1 --warmup 1 --iters 1 --path permute --window 64 --landmark-stride 64 --seed 42","controls":{"model":"mlx-community/Qwen3-1.7B-4bit","window":64,"landmark_stride":64,"batch":1,"warmup":1,"iters":1,"baseline":"EXP-20260207-QWEN-ISO-BASE"},"metrics":{"expected":"memory closer to baseline (no multi-offset materialization)","causal_safety":"retro only active when training=True OR retro_backfill_training_only=False"},"decision":"pending_test","next_action":"run isolated matrix on original non-Qwen HCSA to validate before Qwen re-benchmark"}
{"id":"EXP-20260207-TINY-SCALE-REFRESH","date":"2026-02-07","question":"Does the original tiny MLX path still show long-context memory reduction after current permute and retro safety updates?","hypothesis":"Tiny permute remains memory-efficient at T>=2048 with retro disabled.","change_set":["measurement only"],"command":"PYTHONPATH=. python3 scripts/bench_mlx_wayfinder_scale.py --seq-lens 1024 2048 4096 --batch 1 --heads 8 --embd 512 --window 64 --landmark-stride 64 --warmup 1 --iters 1 --out-dir benchmarks/mlx/tiny_wayfinder/20260207_tiny_scale_refresh","controls":{"batch":1,"heads":8,"embd":512,"window":64,"landmark_stride":64,"warmup":1,"iters":1},"metrics":{"status":"pending"},"decision":"pending","next_action":"run benchmark and compare wayfinder_permute vs dense"}
{"id":"EXP-20260207-GPT2-WAYFINDER-BASE","date":"2026-02-07","question":"Does GPT-2 show the same long-context memory trend as Qwen under Wayfinder permute?","hypothesis":"Short contexts may be slower, but long contexts should reduce peak attention memory vs dense.","change_set":["add hcsa/integrations/gpt2_mlx.py","add scripts/bench_gpt2_wayfinder_mlx.py"],"command":"PYTHONPATH=. python3 scripts/bench_gpt2_wayfinder_mlx.py --model-path openai-community/gpt2 --seq-lens 1024 2048 4096 --batch 1 --warmup 1 --iters 1 --path permute --window 64 --landmark-stride 64 --seed 42 --full-swap --out-dir benchmarks/mlx/gpt2_wayfinder/20260207_gpt2_base","controls":{"model":"openai-community/gpt2","window":64,"landmark_stride":64,"batch":1,"warmup":1,"iters":1},"metrics":{"status":"pending"},"decision":"pending","next_action":"run benchmark and compare memory deltas"}
{"id":"EXP-20260207-QWEN-RETRO-CAUSAL","date":"2026-02-07","question":"Does Hamiltonian-local retro with causal-only guard avoid prior Qwen memory regression?","hypothesis":"Causal-only retro should avoid major memory blowup and stay near retro-off baseline.","change_set":["hcsa/mlx/attention.py causal-only retro guard","hcsa/integrations/qwen_mlx.py retro_backfill_causal_only","scripts/bench_qwen_wayfinder_mlx.py retro causal CLI"],"command":"python3 scripts/bench_qwen_wayfinder_mlx.py --model-path mlx-community/Qwen3-1.7B-4bit --seq-lens 4096 8192 --batch 1 --warmup 1 --iters 1 --path permute --window 64 --landmark-stride 64 --seed 42 --full-swap --retro-backfill --retro-alpha 0.2 --retro-allow-inference --retro-causal-only --out-dir benchmarks/mlx/qwen3_1.7b_4bit_wayfinder/20260207_qwen_retro_causal","controls":{"model":"mlx-community/Qwen3-1.7B-4bit","window":64,"landmark_stride":64,"batch":1,"warmup":1,"iters":1},"metrics":{"status":"pending"},"decision":"pending","next_action":"compare against EXP-20260207-QWEN-ISO-BASE and EXP-20260207-QWEN-ISO-RETRO-A02"}
{"id":"EXP-20260207-TOPOLOGY-FIRST-EXTRACTION","date":"2026-02-07","question":"Can graph construction be extracted to a first-class topology runtime without regressions?","hypothesis":"Shared topology runtime preserves behavior/tests while enabling graph injection into attention.","change_set":["add hcsa/topology/core.py","wire Topology into hcsa/mlx/attention.py","wire Topology into hcsa/torch/attention_wayfinder_sparse.py","wire Topology into hcsa/integrations/qwen_mlx.py","add tests/mlx/test_topology_first_class.py"],"command":"python3 -m pytest tests/mlx/ -v && python3 -m pytest tests/pytorch -q","controls":{"baseline":"pre-topology extraction on current branch"},"metrics":{"mlx_tests_passed":35,"pytorch_tests":"pass","notes":"warning-only unknown pytest mark"},"decision":"keep","next_action":"revalidate tiny long-context benchmark under original README settings"}
{"id":"EXP-20260207-TINY-BASELINE-TOPOLOGY-CHECK","date":"2026-02-07","question":"Does topology extraction preserve original tiny long-context win pattern?","hypothesis":"T>=2048 should retain throughput crossover and strong memory reduction.","change_set":["measurement only after topology extraction"],"command":"PYTHONPATH=. python3 scripts/bench_mlx_wayfinder_scale.py --seq-lens 256 512 1024 2048 4096 --batch 2 --heads 4 --embd 128 --window 32 --landmark-stride 32 --warmup 2 --iters 4 --out-dir benchmarks/mlx/tiny_wayfinder/20260207_tiny_readme_repro_topology && PYTHONPATH=. python3 scripts/bench_mlx_wayfinder_scale.py --seq-lens 2048 4096 --batch 2 --heads 4 --embd 128 --window 32 --landmark-stride 32 --warmup 2 --iters 6 --out-dir benchmarks/mlx/tiny_wayfinder/20260207_tiny_readme_repro_topology_rerun","controls":{"batch":2,"heads":4,"embd":128,"window":32,"landmark_stride":32},"metrics":{"path_primary":"benchmarks/mlx/tiny_wayfinder/20260207_tiny_readme_repro_topology/results.json","path_rerun":"benchmarks/mlx/tiny_wayfinder/20260207_tiny_readme_repro_topology_rerun/results.json","t2048_ratio_rerun":1.078,"t2048_memory_reduction_pct_rerun":35.4,"t4096_ratio_rerun":2.196,"t4096_memory_reduction_pct_rerun":66.41},"decision":"keep","next_action":"use topology injection in training/ablation flows for controlled graph experiments"}
{"id":"EXP-20260207-TINY-BASELINE-GATE-REPRO","date":"2026-02-07","question":"What is the exact current Tiny baseline under the original apples-to-apples gate settings?","hypothesis":"Current topology-first Tiny path remains below historical 2048/4096 targets, motivating batched permute routing.","change_set":["measurement only pre-optimization"],"command":"PYTHONPATH=. python3 scripts/bench_mlx_wayfinder_scale.py --seq-lens 256 512 1024 2048 4096 --batch 2 --heads 4 --embd 128 --window 32 --landmark-stride 32 --warmup 2 --iters 6 --out-dir benchmarks/mlx/tiny_wayfinder/20260207_tiny_baseline_gate_repro","controls":{"batch":2,"heads":4,"embd":128,"window":32,"landmark_stride":32,"warmup":2,"iters":6,"baseline":"benchmarks/mlx/tiny_wayfinder/20260207_tiny_readme_repro_topology_rerun/results.json"},"metrics":{"status":"pending"},"decision":"pending","next_action":"run exact gate benchmark and quantify delta vs historical targets"}
{"id":"EXP-20260207-TINY-BATCHED-PERMUTE-GATE","date":"2026-02-07","question":"Does routing Tiny wayfinder_permute through chunked batched permute restore/beat historical long-context throughput without regressing memory?","hypothesis":"Batched path removes per-head loop overhead and improves throughput at T=2048/4096 while keeping memory reduction stable.","change_set":["hcsa/mlx/attention.py route WayfinderAttentionMLX permute path through batched kernel","hcsa/mlx/model.py expose retro config fields in GPTConfigMLX/WayfinderAttentionMLX wiring","tests/mlx add WayfinderAttentionMLX retro path coverage"],"command":"PYTHONPATH=. python3 scripts/bench_mlx_wayfinder_scale.py --seq-lens 256 512 1024 2048 4096 --batch 2 --heads 4 --embd 128 --window 32 --landmark-stride 32 --warmup 2 --iters 6 --out-dir benchmarks/mlx/tiny_wayfinder/20260207_tiny_batched_gate","controls":{"batch":2,"heads":4,"embd":128,"window":32,"landmark_stride":32,"warmup":2,"iters":6,"baseline_run":"EXP-20260207-TINY-BASELINE-GATE-REPRO"},"metrics":{"status":"pending"},"decision":"pending","next_action":"run gate benchmark and compare against historical and baseline"}
{"id":"EXP-20260207-TINY-LONG-RETRO-CONTROL","date":"2026-02-07","question":"On tiny-long training, what are quality/throughput/memory with retro explicitly disabled?","hypothesis":"Control run provides causal-safe quality/perf baseline before retro treatment.","change_set":["configuration-only run with retro disabled"],"command":"PYTHONPATH=. python3 scripts/run_mlx_experiment_tiny_long.py --wayfinder-attn wayfinder_permute --retro-backfill-enabled false --retro-backfill-alpha 0.0 --retro-backfill-training-only true --retro-backfill-causal-only true --out-dir runs/mlx/tiny_long/20260207_retro_control","controls":{"dataset":"data/tinyshakespeare.txt","matched_with":"EXP-20260207-TINY-LONG-RETRO-TREATMENT"},"metrics":{"status":"pending"},"decision":"pending","next_action":"execute treatment with same training schedule and compare val ppl/tok-s/memory"}
{"id":"EXP-20260207-TINY-LONG-RETRO-TREATMENT","date":"2026-02-07","question":"Does training-time retrocausal backfill improve tiny-long validation perplexity at comparable compute?","hypothesis":"Retro-on training with causal-only guard improves val ppl at similar or acceptable throughput/memory tradeoff.","change_set":["same code as control","retro_backfill_enabled=true","retro_backfill_alpha=0.2","retro_backfill_training_only=true","retro_backfill_causal_only=true"],"command":"PYTHONPATH=. python3 scripts/run_mlx_experiment_tiny_long.py --wayfinder-attn wayfinder_permute --retro-backfill-enabled true --retro-backfill-alpha 0.2 --retro-backfill-training-only true --retro-backfill-causal-only true --out-dir runs/mlx/tiny_long/20260207_retro_treatment","controls":{"dataset":"data/tinyshakespeare.txt","matched_with":"EXP-20260207-TINY-LONG-RETRO-CONTROL"},"metrics":{"status":"pending"},"decision":"pending","next_action":"compare quality/perf and decide keep as training-only feature or reject"}
{"id":"EXP-20260207-TINY-BASELINE-GATE-REPRO-RESULT","date":"2026-02-07","question":"What is the exact Tiny baseline under original apples-to-apples gate settings?","hypothesis":"Topology-first Tiny path would remain near-but-below historical throughput targets while preserving memory reduction.","change_set":["measurement only pre-optimization"],"command":"PYTHONPATH=. python3 scripts/bench_mlx_wayfinder_scale.py --seq-lens 256 512 1024 2048 4096 --batch 2 --heads 4 --embd 128 --window 32 --landmark-stride 32 --warmup 2 --iters 6 --out-dir benchmarks/mlx/tiny_wayfinder/20260207_tiny_baseline_gate_repro","controls":{"batch":2,"heads":4,"embd":128,"window":32,"landmark_stride":32,"warmup":2,"iters":6,"baseline_path":"benchmarks/mlx/tiny_wayfinder/20260207_tiny_readme_repro_topology_rerun/results.json"},"metrics":{"path":"benchmarks/mlx/tiny_wayfinder/20260207_tiny_baseline_gate_repro/results.json","t2048_ratio":1.1825336616034943,"t2048_mem_reduction_pct":41.56801448473825,"t4096_ratio":2.41955922090347,"t4096_mem_reduction_pct":68.77308166178841},"decision":"keep","next_action":"route Tiny permute path through batched kernel and re-run gate"}
{"id":"EXP-20260207-TINY-BATCHED-PERMUTE-GATE-RESULT","date":"2026-02-07","question":"Does batched permute routing restore/beat historical Tiny long-context targets without memory regression?","hypothesis":"Batched routing removes per-head loop overhead and raises T=2048/4096 throughput while maintaining/improving memory reduction.","change_set":["hcsa/mlx/attention.py WayfinderAttentionMLX permute path uses wayfinder_permute_window_attention_batched","hcsa/mlx/attention.py cache includes all_perms/all_inv_perms","hcsa/mlx/model.py GPTConfigMLX exposes retro_backfill_* fields and wires into WayfinderAttentionMLX","tests/mlx/test_wayfinder_attention_retro_path.py model-path retro coverage"],"command":"PYTHONPATH=. python3 scripts/bench_mlx_wayfinder_scale.py --seq-lens 256 512 1024 2048 4096 --batch 2 --heads 4 --embd 128 --window 32 --landmark-stride 32 --warmup 2 --iters 6 --out-dir benchmarks/mlx/tiny_wayfinder/20260207_tiny_batched_gate_mlx306","controls":{"batch":2,"heads":4,"embd":128,"window":32,"landmark_stride":32,"warmup":2,"iters":6,"mlx_version":"0.30.6","baseline_run":"EXP-20260207-TINY-BASELINE-GATE-REPRO-RESULT","historical_targets":{"t2048_ratio":1.19,"t2048_mem_reduction_pct":37.0,"t4096_ratio":2.45,"t4096_mem_reduction_pct":67.0}},"metrics":{"path":"benchmarks/mlx/tiny_wayfinder/20260207_tiny_batched_gate_mlx306/results.json","t2048":{"dense_tokens_per_sec":532143.83925384,"wayfinder_tokens_per_sec":2278641.850096691,"ratio":4.282003627612697,"dense_step_intermediate_bytes":561922092,"wayfinder_step_intermediate_bytes":118458644,"mem_reduction_pct":78.9190270881893,"delta_ratio_vs_baseline":3.0994699660092033,"delta_ratio_pct_vs_baseline":262.1041638515709,"delta_mem_reduction_pp_vs_baseline":37.351012603451046,"delta_ratio_vs_historical":3.0920036276126974,"delta_ratio_pct_vs_historical":259.8322376145124,"delta_mem_reduction_pp_vs_historical":41.919027088189296},"t4096":{"dense_tokens_per_sec":261828.23515200196,"wayfinder_tokens_per_sec":2420297.4099335796,"ratio":9.243836550051595,"dense_step_intermediate_bytes":2203552300,"wayfinder_step_intermediate_bytes":227425708,"mem_reduction_pct":89.67913273490265,"delta_ratio_vs_baseline":6.824277329148125,"delta_ratio_pct_vs_baseline":282.0463029047051,"delta_mem_reduction_pp_vs_baseline":20.90605107311424,"delta_ratio_vs_historical":6.793836550051595,"delta_ratio_pct_vs_historical":277.29945102251406,"delta_mem_reduction_pp_vs_historical":22.67913273490265}},"decision":"keep","next_action":"run tiny-long retro control/treatment on matched settings"}
{"id":"EXP-20260207-TINY-LONG-RETRO-CONTROL-RESULT","date":"2026-02-07","question":"What are tiny-long wayfinder quality/perf/memory metrics with retro disabled?","hypothesis":"Retro-off run provides stable control baseline under causal-safe defaults.","change_set":["configuration-only run with retro disabled"],"command":"PYTHONPATH=. python3 scripts/run_mlx_experiment_tiny_long.py --wayfinder-attn wayfinder_permute --retro-backfill-enabled false --retro-backfill-alpha 0.0 --retro-backfill-training-only true --retro-backfill-causal-only true --out-dir runs/mlx/tiny_long/20260207_retro_control","controls":{"matched_treatment":"EXP-20260207-TINY-LONG-RETRO-TREATMENT-RESULT","dataset":"data/tinyshakespeare.txt","steps":1000,"batch_size":8,"seq_len":128},"metrics":{"path":"runs/mlx/tiny_long/20260207_retro_control/summary.json","wayfinder_final_val_ppl":91.01875122412511,"wayfinder_avg_tokens_per_sec":236987.46944582716,"wayfinder_peak_memory_bytes":120135536},"decision":"keep","next_action":"run retro-on treatment with same settings for A/B comparison"}
{"id":"EXP-20260207-TINY-LONG-RETRO-TREATMENT-RESULT","date":"2026-02-07","question":"Does retro-on training improve tiny-long quality at acceptable performance/memory cost?","hypothesis":"Retro backfill should improve wayfinder val ppl with moderate compute overhead.","change_set":["retro_backfill_enabled=true","retro_backfill_alpha=0.2","retro_backfill_training_only=true","retro_backfill_causal_only=true"],"command":"PYTHONPATH=. python3 scripts/run_mlx_experiment_tiny_long.py --wayfinder-attn wayfinder_permute --retro-backfill-enabled true --retro-backfill-alpha 0.2 --retro-backfill-training-only true --retro-backfill-causal-only true --out-dir runs/mlx/tiny_long/20260207_retro_treatment","controls":{"baseline_run":"EXP-20260207-TINY-LONG-RETRO-CONTROL-RESULT","dataset":"data/tinyshakespeare.txt","steps":1000,"batch_size":8,"seq_len":128},"metrics":{"path":"runs/mlx/tiny_long/20260207_retro_treatment/summary.json","wayfinder_final_val_ppl":79.92043940800953,"wayfinder_avg_tokens_per_sec":218823.10403951837,"wayfinder_peak_memory_bytes":121956224,"delta_val_ppl_vs_control":-11.09831181611558,"delta_val_ppl_pct_vs_control":-12.19421946008311,"delta_tokens_per_sec_vs_control":-18164.36540630879,"delta_tokens_per_sec_pct_vs_control":-7.664639755811994,"delta_peak_memory_bytes_vs_control":1820688,"delta_peak_memory_pct_vs_control":1.5155235681668497},"decision":"keep_training_only","next_action":"document retro as training-time feature with causal-safe inference default off"}
