{"id":"EXP-20260217T183144Z-SECTION4-NANBEIGE-QCHUNK-SWEEP-PRERUN","date":"2026-02-17","question":"At T=8192 decode_len=32 on Nanbeige4.1-3B, does query_chunk_size tuning reduce the mid-scale decode penalty and/or change dense-fallback behavior?","hypothesis":"Increasing query_chunk_size toward 8W-scale (512 for W=64) reduces dispatch/fragmentation overhead, improving decode_tok/s and lowering decode_sec vs q=384; fallback share/reasons may shift measurably with q_chunk.","change_set":["measurement only"],"command":"python3 scripts/bench_qwen_consumer_mlx.py --model-path Nanbeige/Nanbeige4.1-3B --mode dense --seq-lens 8192 --decode-len 32 --repeats 1 --skip-multi-turn --skip-quality --out-dir benchmarks/mlx/nanbeige4_1_3b_wayfinder/diag_qchunk_sweep_20260217T183144Z/dense32_T8192 && python3 scripts/bench_qwen_consumer_mlx.py --model-path Nanbeige/Nanbeige4.1-3B --mode wayfinder --seq-lens 8192 --decode-len 32 --repeats 1 --skip-multi-turn --skip-quality --hsa-trace --window 64 --head-chunk-size 2 --query-chunk-size 192 --out-dir benchmarks/mlx/nanbeige4_1_3b_wayfinder/diag_qchunk_sweep_20260217T183144Z/wayfinder32_T8192_q192 && python3 scripts/bench_qwen_consumer_mlx.py --model-path Nanbeige/Nanbeige4.1-3B --mode wayfinder --seq-lens 8192 --decode-len 32 --repeats 1 --skip-multi-turn --skip-quality --hsa-trace --window 64 --head-chunk-size 2 --query-chunk-size 384 --out-dir benchmarks/mlx/nanbeige4_1_3b_wayfinder/diag_qchunk_sweep_20260217T183144Z/wayfinder32_T8192_q384 && python3 scripts/bench_qwen_consumer_mlx.py --model-path Nanbeige/Nanbeige4.1-3B --mode wayfinder --seq-lens 8192 --decode-len 32 --repeats 1 --skip-multi-turn --skip-quality --hsa-trace --window 64 --head-chunk-size 2 --query-chunk-size 512 --out-dir benchmarks/mlx/nanbeige4_1_3b_wayfinder/diag_qchunk_sweep_20260217T183144Z/wayfinder32_T8192_q512","controls":{"model":"Nanbeige/Nanbeige4.1-3B","entrypoint":"scripts/bench_qwen_consumer_mlx.py","seq_len":8192,"decode_len":32,"repeats":1,"skip_multi_turn":true,"skip_quality":true,"retro_backfill_inference":"off","wayfinder":{"window":64,"head_chunk_size":2,"query_chunk_sizes":[192,384,512]},"baseline_dense":"benchmarks/mlx/nanbeige4_1_3b_wayfinder/diag_qchunk_sweep_20260217T183144Z/dense32_T8192/results.json","stop_gates":["nonzero exit","missing results.json","timeout/hang"]},"metrics":{"status":"pending","required":["single_turn.prefill_sec","single_turn.decode_sec","single_turn.e2e_sec","single_turn.decode_tok_s","single_turn.peak_memory_bytes","single_turn.path_counts","single_turn.dense_fallback_reason_counts","single_turn.dense_fallback_share_run","delta_vs_dense_abs","delta_vs_dense_pct","memory_reduction_pct_convention=100*(1-wayfinder/dense)"]},"decision":"pending","next_action":"Run the 4-command sweep and append RESULT entry with absolute metrics and deltas vs the named dense baseline path."}
{"id":"EXP-20260217T183144Z-SECTION4-QWEN3-1_7B-DECODELEN-SWEEP-PRERUN","date":"2026-02-17","question":"On Qwen3-1.7B at T=8192, is the 'diagnostic fast (decode_len=16) vs gated slow (decode_len=64)' split reproducible when quality is skipped and controls are matched?","hypothesis":"If the fast/slow split persists with --skip-quality, it indicates a decode-length-dependent routing/kernel issue (not purely measurement-mode driven). If it disappears, prior collapse likely coupled to quality/mode differences.","change_set":["measurement only"],"command":"python3 scripts/bench_qwen_consumer_mlx.py --model-path mlx-community/Qwen3-1.7B-4bit --mode dense --seq-lens 8192 --decode-len 16 --repeats 3 --chunk-size 4096 --kv-step 4096 --cooldown-sec 0 --seed 42 --skip-multi-turn --skip-quality --out-dir benchmarks/mlx/qwen3_1_7b_wayfinder/diag_decode_len_sweep_20260217T183144Z/dense_d16 && python3 scripts/bench_qwen_consumer_mlx.py --model-path mlx-community/Qwen3-1.7B-4bit --mode wayfinder --seq-lens 8192 --decode-len 16 --repeats 3 --chunk-size 4096 --kv-step 4096 --cooldown-sec 0 --window 64 --landmark-stride 64 --num-cycles 1 --seed 42 --hsa-trace --skip-multi-turn --skip-quality --out-dir benchmarks/mlx/qwen3_1_7b_wayfinder/diag_decode_len_sweep_20260217T183144Z/wayfinder_d16 && python3 scripts/bench_qwen_consumer_mlx.py --model-path mlx-community/Qwen3-1.7B-4bit --mode dense --seq-lens 8192 --decode-len 64 --repeats 3 --chunk-size 4096 --kv-step 4096 --cooldown-sec 0 --seed 42 --skip-multi-turn --skip-quality --out-dir benchmarks/mlx/qwen3_1_7b_wayfinder/diag_decode_len_sweep_20260217T183144Z/dense_d64 && python3 scripts/bench_qwen_consumer_mlx.py --model-path mlx-community/Qwen3-1.7B-4bit --mode wayfinder --seq-lens 8192 --decode-len 64 --repeats 3 --chunk-size 4096 --kv-step 4096 --cooldown-sec 0 --window 64 --landmark-stride 64 --num-cycles 1 --seed 42 --hsa-trace --skip-multi-turn --skip-quality --out-dir benchmarks/mlx/qwen3_1_7b_wayfinder/diag_decode_len_sweep_20260217T183144Z/wayfinder_d64","controls":{"model":"mlx-community/Qwen3-1.7B-4bit","entrypoint":"scripts/bench_qwen_consumer_mlx.py","seq_len":8192,"decode_lens":[16,64],"repeats":3,"chunk_size":4096,"kv_step":4096,"cooldown_sec":0,"seed":42,"skip_multi_turn":true,"skip_quality":true,"retro_backfill_inference":"off","wayfinder":{"window":64,"landmark_stride":64,"num_cycles":1},"baselines":{"dense_d16":"benchmarks/mlx/qwen3_1_7b_wayfinder/diag_decode_len_sweep_20260217T183144Z/dense_d16/results.json","dense_d64":"benchmarks/mlx/qwen3_1_7b_wayfinder/diag_decode_len_sweep_20260217T183144Z/dense_d64/results.json"},"stop_gates":["nonzero exit","missing results.json","timeout/hang","fallback present but reasons missing/unspecified"]},"metrics":{"status":"pending","required":["single_turn.prefill_sec","single_turn.decode_sec","single_turn.e2e_sec","single_turn.decode_tok_s","single_turn.ttft_sec","single_turn.itl_p95_sec","single_turn.peak_memory_bytes","single_turn.path_counts","single_turn.dense_fallback_reason_counts","single_turn.dense_fallback_share_run","delta_vs_dense_abs","delta_vs_dense_pct","memory_reduction_pct_convention=100*(1-wayfinder/dense)"]},"decision":"pending","next_action":"Run the 4-command decode_len sweep and append RESULT entry with absolute metrics, deltas vs dense, and the observed fallback reason histogram (or stop-gate if missing)."}
{"id":"EXP-20260217T183144Z-SECTION4-QUEUE-SCRIPT-RESULT","date":"2026-02-17","question":"Can we queue and stop-gate the Section 4 discriminating experiments from the ledger without manual command orchestration?","hypothesis":"A single runner script can execute the PRERUN command sequences and enforce stop-gates (nonzero exit, missing results.json, timeout/hang, and fallback-without-reasons) before any RESULTS are recorded.","change_set":["scripts/run_section4_queue.py (new)","notes/experiments.ndjson (append Section 4 PRERUN entries)","notes/LAB_NOTEBOOK.md (append queue runbook section)"],"command":"python3 -m py_compile scripts/run_section4_queue.py","controls":{"scope":"tooling only","no_benchmark_or_inference_run":true},"metrics":{"compile_passed":true},"decision":"keep","next_action":"Run `python3 scripts/run_section4_queue.py --dry-run` then `python3 scripts/run_section4_queue.py` to execute the two Section 4 PRERUN queues with stop-gates enforced."}
{"id":"EXP-20260218T044120Z-NANBEIGE41-3B-HANG-DEBUG-PRERUN","date":"2026-02-18","question":"Can we reproduce and characterize the non-completing wayfinder behavior at Nanbeige/Nanbeige4.1-3B, T=131072 for decode_len=256 and traced decode_len=32 using fresh output directories?","hypothesis":"At T=131072, wayfinder decode256 will likely reproduce the prior non-completing/hanging behavior; traced decode32 may complete but should show elevated dense-fallback share relative to 8k runs.","change_set":["measurement only"],"command":"python3 scripts/bench_qwen_consumer_mlx.py --model-path Nanbeige/Nanbeige4.1-3B --mode wayfinder --seq-lens 131072 --decode-len 256 --repeats 1 --skip-multi-turn --skip-quality --window 64 --head-chunk-size 2 --query-chunk-size 384 --out-dir benchmarks/mlx/nanbeige4_1_3b_wayfinder/hang_debug_20260218/wayfinder256_T131072 && python3 scripts/bench_qwen_consumer_mlx.py --model-path Nanbeige/Nanbeige4.1-3B --mode wayfinder --seq-lens 131072 --decode-len 32 --repeats 1 --skip-multi-turn --skip-quality --hsa-trace --window 64 --head-chunk-size 2 --query-chunk-size 384 --out-dir benchmarks/mlx/nanbeige4_1_3b_wayfinder/hang_debug_20260218/trace32_T131072","controls":{"model":"Nanbeige/Nanbeige4.1-3B","entrypoint":"scripts/bench_qwen_consumer_mlx.py","seq_len":131072,"decode_lens":[256,32],"repeats":1,"skip_multi_turn":true,"skip_quality":true,"retro_backfill_inference":"off","wayfinder":{"window":64,"head_chunk_size":2,"query_chunk_size":384},"baselines":{"dense_decode256":"benchmarks/mlx/nanbeige4_1_3b_wayfinder/core_dense256/results.json","dense_decode32":"benchmarks/mlx/nanbeige4_1_3b_wayfinder/long_dense32_T131072/results.json"},"stop_gates":["timeout/hang","nonzero exit","missing results.json"]},"metrics":{"status":"pending","required":["single_turn.e2e_sec","single_turn.prefill_sec","single_turn.decode_sec","single_turn.decode_tok_s","single_turn.peak_memory_bytes","single_turn.path_counts","single_turn.dense_fallback_reason_counts","single_turn.dense_fallback_share_run","delta_vs_dense_abs","delta_vs_dense_pct","memory_reduction_pct_convention=100*(1-wayfinder/dense)"]},"decision":"pending","next_action":"Run decode256 first with fail-fast timeout; only run traced decode32 if decode256 completes."}
{"id":"EXP-20260217T183144Z-SECTION4-NANBEIGE-QCHUNK-SWEEP-RESULT","date":"2026-02-18","question":"At T=8192 decode_len=32 on Nanbeige4.1-3B, does query_chunk_size tuning reduce the mid-scale decode penalty and/or change dense-fallback behavior?","hypothesis":"Increasing query_chunk_size toward 8W-scale (512 for W=64) reduces dispatch/fragmentation overhead, improving decode_tok/s and lowering decode_sec vs q=384; fallback share/reasons may shift measurably with q_chunk.","change_set":["measurement only"],"command":"python3 scripts/run_section4_queue.py --timeout-sec 1800","controls":{"model":"Nanbeige/Nanbeige4.1-3B","entrypoint":"scripts/bench_qwen_consumer_mlx.py","seq_len":8192,"decode_len":32,"repeats":1,"skip_multi_turn":true,"skip_quality":true,"retro_backfill_inference":"off","wayfinder":{"window":64,"head_chunk_size":2,"query_chunk_sizes":[192,384,512]},"baseline_dense":"benchmarks/mlx/nanbeige4_1_3b_wayfinder/diag_qchunk_sweep_20260217T183144Z/dense32_T8192/results.json","stop_gates":["nonzero exit","missing results.json","timeout/hang"]},"metrics":{"dense":{"e2e_sec":6.890094084083103,"prefill_sec":6.048258209018968,"decode_sec":0.8418358750641346,"decode_tok_s":38.012160027703864,"peak_memory_bytes":10369209376},"q192":{"e2e_sec":7.244441249873489,"prefill_sec":5.910491999937221,"decode_sec":1.3339492499362677,"decode_tok_s":23.9889186200516,"peak_memory_bytes":10382925276,"delta_vs_dense_abs":0.3543471657903865,"delta_vs_dense_pct":5.142849451199346,"memory_reduction_pct_convention":-0.13227527290311514,"path_counts":{"permute":264,"permute_dense_fallback":8},"dense_fallback_reason_counts":{"active_large_q":8},"dense_fallback_share_run":0.029411764705882353},"q384":{"e2e_sec":7.204720792011358,"prefill_sec":5.946888374979608,"decode_sec":1.25783241703175,"decode_tok_s":25.440590945743022,"peak_memory_bytes":10382925276,"delta_vs_dense_abs":0.3146267079282552,"delta_vs_dense_pct":4.566363014622377,"memory_reduction_pct_convention":-0.13227527290311514,"path_counts":{"permute":264,"permute_dense_fallback":8},"dense_fallback_reason_counts":{"active_large_q":8},"dense_fallback_share_run":0.029411764705882353},"q512":{"e2e_sec":7.176584709086455,"prefill_sec":5.900648709037341,"decode_sec":1.2759360000491142,"decode_tok_s":25.079627817357792,"peak_memory_bytes":10382925276,"delta_vs_dense_abs":0.28649062500335276,"delta_vs_dense_pct":4.158007445285523,"memory_reduction_pct_convention":-0.13227527290311514,"path_counts":{"permute":264,"permute_dense_fallback":8},"dense_fallback_reason_counts":{"active_large_q":8},"dense_fallback_share_run":0.029411764705882353}},"decision":"follow-up","next_action":"Keep q=512 as best of tested q-chunks at 8k, but continue optimization because all wayfinder settings remain slower than dense at this operating point."}
{"id":"EXP-20260217T183144Z-SECTION4-QWEN3-1_7B-DECODELEN-SWEEP-RESULT","date":"2026-02-18","question":"On Qwen3-1.7B at T=8192, is the 'diagnostic fast (decode_len=16) vs gated slow (decode_len=64)' split reproducible when quality is skipped and controls are matched?","hypothesis":"If the fast/slow split persists with --skip-quality, it indicates a decode-length-dependent routing/kernel issue (not purely measurement-mode driven). If it disappears, prior collapse likely coupled to quality/mode differences.","change_set":["measurement only"],"command":"python3 scripts/run_section4_queue.py --timeout-sec 1800","controls":{"model":"mlx-community/Qwen3-1.7B-4bit","entrypoint":"scripts/bench_qwen_consumer_mlx.py","seq_len":8192,"decode_lens":[16,64],"repeats":3,"chunk_size":4096,"kv_step":4096,"cooldown_sec":0,"seed":42,"skip_multi_turn":true,"skip_quality":true,"retro_backfill_inference":"off","wayfinder":{"window":64,"landmark_stride":64,"num_cycles":1},"baselines":{"dense_d16":"benchmarks/mlx/qwen3_1_7b_wayfinder/diag_decode_len_sweep_20260217T183144Z/dense_d16/results.json","dense_d64":"benchmarks/mlx/qwen3_1_7b_wayfinder/diag_decode_len_sweep_20260217T183144Z/dense_d64/results.json"},"stop_gates":["nonzero exit","missing results.json","timeout/hang","fallback present but reasons missing/unspecified"]},"metrics":{"d16":{"repeats":3,"dense_mean":{"e2e_sec":3.6390368193387985,"prefill_sec":3.501633222331293,"decode_sec":0.1374035970075056,"decode_tok_s":116.44651070202084,"ttft_sec":0.026270583737641573,"itl_p95_sec":0.007429236002887289,"peak_memory_bytes":3840100388.0},"wayfinder_mean":{"e2e_sec":3.688116680675497,"prefill_sec":3.4103175279839584,"decode_sec":0.27779915269153815,"decode_tok_s":57.61606263081268,"ttft_sec":0.03864168034245571,"itl_p95_sec":0.01609912464239945,"peak_memory_bytes":3844819428.0,"dense_fallback_share_run":0.05555555555555555},"delta_vs_dense_abs":0.04907986133669828,"delta_vs_dense_pct":1.348704719772963,"memory_reduction_pct_convention":-0.12288845402965709,"wayfinder_path_counts_agg":{"permute":408,"permute_dense_fallback":24},"wayfinder_dense_fallback_reason_counts_agg":{"active_large_q":24}},"d64":{"repeats":3,"dense_mean":{"e2e_sec":3.9767852916847914,"prefill_sec":3.4981028890470043,"decode_sec":0.47868240263778716,"decode_tok_s":133.700638700386,"ttft_sec":0.025879971993466217,"itl_p95_sec":0.007258972308288018,"peak_memory_bytes":3840100388.0},"wayfinder_mean":{"e2e_sec":4.4457081386741875,"prefill_sec":3.413649763640327,"decode_sec":1.0320583750338603,"decode_tok_s":62.02082851190711,"ttft_sec":0.038418986019678414,"itl_p95_sec":0.01809516700450331,"peak_memory_bytes":3844819428.0,"dense_fallback_share_run":0.015151515151515152},"delta_vs_dense_abs":0.468922846989396,"delta_vs_dense_pct":11.791505263557585,"memory_reduction_pct_convention":-0.12288845402965709,"wayfinder_path_counts_agg":{"permute":1560,"permute_dense_fallback":24},"wayfinder_dense_fallback_reason_counts_agg":{"active_large_q":24}}},"decision":"follow-up","next_action":"Treat decode-length-dependent slowdown as reproducible under matched skip-quality controls; prioritize decode-path optimization and active_large_q fallback-pressure reduction before broader claims."}
{"id":"EXP-20260218T044120Z-NANBEIGE41-3B-HANG-DEBUG-RESULT","date":"2026-02-18","question":"Can we reproduce and characterize the non-completing wayfinder behavior at Nanbeige/Nanbeige4.1-3B, T=131072 for decode_len=256 and traced decode_len=32 using fresh output directories?","hypothesis":"At T=131072, wayfinder decode256 will likely reproduce the prior non-completing/hanging behavior; traced decode32 may complete but should show elevated dense-fallback share relative to 8k runs.","change_set":["measurement only"],"command":"python3 scripts/bench_qwen_consumer_mlx.py --model-path Nanbeige/Nanbeige4.1-3B --mode wayfinder --seq-lens 131072 --decode-len 256 --repeats 1 --skip-multi-turn --skip-quality --window 64 --head-chunk-size 2 --query-chunk-size 384 --out-dir benchmarks/mlx/nanbeige4_1_3b_wayfinder/hang_debug_20260218/wayfinder256_T131072","controls":{"model":"Nanbeige/Nanbeige4.1-3B","entrypoint":"scripts/bench_qwen_consumer_mlx.py","seq_len":131072,"decode_len":256,"repeats":1,"skip_multi_turn":true,"skip_quality":true,"retro_backfill_inference":"off","wayfinder":{"window":64,"head_chunk_size":2,"query_chunk_size":384},"stop_gates":["timeout/hang","nonzero exit","missing results.json"]},"metrics":{"status":"stop_gated_manual_interrupt","artifact":"benchmarks/mlx/nanbeige4_1_3b_wayfinder/hang_debug_20260218/wayfinder256_T131072/results.json","artifact_shape":{"single_turn":null},"stderr_signal":"KeyboardInterrupt while command remained non-completing during long-context pre-run phase","delta_vs_dense_abs":"n/a","delta_vs_dense_pct":"n/a","memory_reduction_pct_convention":"n/a"},"decision":"follow-up","next_action":"Do not proceed to traced decode32 in this block; isolate prefill/prompt-build progress visibility at T=131072 and add explicit internal stage timers before the next attempt."}
{"id":"EXP-20260218T050026Z-NANBEIGE-INSTRUMENTED-BOUNDARY-PRERUN","date":"2026-02-18","question":"With stage timers/heartbeats/status instrumentation enabled, can Nanbeige/Nanbeige4.1-3B wayfinder complete T=131072 decode_len=256 and produce a usable boundary row?","hypothesis":"Instrumentation will expose where long-boundary non-completion occurs; if the run still fails, results.json should carry explicit terminal status and stage context rather than null-only artifacts.","change_set":["scripts/bench_qwen_consumer_mlx.py: add stage timers, heartbeat logging, per-stage timeout, explicit terminal status in results payload"],"command":"python3 scripts/bench_qwen_consumer_mlx.py --model-path Nanbeige/Nanbeige4.1-3B --mode wayfinder --seq-lens 131072 --decode-len 256 --repeats 1 --skip-multi-turn --skip-quality --window 64 --head-chunk-size 2 --query-chunk-size 384 --stage-timeout-sec 900 --heartbeat-sec 30 --out-dir benchmarks/mlx/nanbeige4_1_3b_wayfinder/hang_debug_20260218/instrumented_wayfinder256_T131072 && python3 scripts/bench_qwen_consumer_mlx.py --model-path Nanbeige/Nanbeige4.1-3B --mode dense --seq-lens 131072 --decode-len 256 --repeats 1 --skip-multi-turn --skip-quality --stage-timeout-sec 900 --heartbeat-sec 30 --out-dir benchmarks/mlx/nanbeige4_1_3b_wayfinder/hang_debug_20260218/instrumented_dense256_T131072 && python3 scripts/bench_qwen_consumer_mlx.py --model-path Nanbeige/Nanbeige4.1-3B --mode wayfinder --seq-lens 131072 --decode-len 32 --repeats 1 --skip-multi-turn --skip-quality --hsa-trace --window 64 --head-chunk-size 2 --query-chunk-size 384 --stage-timeout-sec 900 --heartbeat-sec 30 --out-dir benchmarks/mlx/nanbeige4_1_3b_wayfinder/hang_debug_20260218/instrumented_trace32_T131072 && python3 scripts/bench_qwen_consumer_mlx.py --model-path Nanbeige/Nanbeige4.1-3B --mode dense --seq-lens 131072 --decode-len 32 --repeats 1 --skip-multi-turn --skip-quality --stage-timeout-sec 900 --heartbeat-sec 30 --out-dir benchmarks/mlx/nanbeige4_1_3b_wayfinder/hang_debug_20260218/instrumented_dense32_T131072","controls":{"model":"Nanbeige/Nanbeige4.1-3B","entrypoint":"scripts/bench_qwen_consumer_mlx.py","seq_len":131072,"decode_lens":[256,32],"repeats":1,"skip_multi_turn":true,"skip_quality":true,"retro_backfill_inference":"off","wayfinder":{"window":64,"head_chunk_size":2,"query_chunk_size":384},"instrumentation":{"stage_timeout_sec":900,"heartbeat_sec":30},"stop_gates":["terminal status != completed","missing usable single_turn row","nonzero exit"]},"metrics":{"status":"pending","required":["status","status_reason","progress.last_stage","timing.writeout_sec_total","single_turn.e2e_sec","single_turn.prefill_sec","single_turn.decode_sec","single_turn.decode_tok_s","single_turn.peak_memory_bytes","single_turn.path_counts","single_turn.dense_fallback_reason_counts","single_turn.dense_fallback_share_run","delta_vs_dense_abs","delta_vs_dense_pct","memory_reduction_pct_convention=100*(1-wayfinder/dense)"]},"decision":"pending","next_action":"Run instrumented wayfinder boundary first; only continue to paired dense/trace runs if completed status and usable row are present."}
{"id":"EXP-20260218T053200Z-INSTALL-VERIFY-HARDENING-PRERUN","date":"2026-02-18","question":"Can we make Wayfinder install and verification reproducible for external users with a sequential fail-fast path that avoids concurrent model runs?","hypothesis":"Documented preflight/env-check/queue guidance plus a one-command verifier script will make setup validation repeatable before benchmark campaigns.","change_set":["README.md (install + preflight/env-check + sequential stop-gates + queue usage)","scripts/verify_install_and_preflight.sh (new helper)"],"command":"./scripts/bench_protocol_preflight_setup.sh --run-id EXP-20260218T000000Z-README-VERIFY --out-dir /tmp/wayfinder-preflight && python3 scripts/env_check_mlx.py --json-out /tmp/wayfinder-preflight/env_check_mlx.json && python3 scripts/run_section4_queue.py --dry-run --overwrite && ./scripts/verify_install_and_preflight.sh --run-id EXP-20260218T000200Z-VERIFY-INSTALL --out-dir /tmp/wayfinder-preflight","controls":{"mode":"tooling verification only","one_process_at_a_time":true,"inference_disabled":true,"output_dir":"/tmp/wayfinder-preflight"},"metrics":{"status":"pending","required":["preflight_status","env_check_json_present","queue_dry_run_pass","one_command_verifier_pass","artifact_paths"]},"decision":"pending","next_action":"Run the sequential verification commands and record resulting artifacts/exit status."}
