{"id":"EXP-20260321T060615Z-QWEN35MOE-FP8-BLOCK-SPARSE-CAMPAIGN-PRERUN","date":"2026-03-21","question":"Does the current CUDA Wayfinder block-sparse path work on Qwen3.5-35B-A3B-FP8, and if so what paired dense-vs-Wayfinder prefill scaling curve and max-context ceiling fit on the DGX Spark GB10?","hypothesis":"With the repo .venv (transformers 5.3.0) and the new native-FP8 loader path, AutoModelForCausalLM should load the text-only qwen3_5_moe checkpoint without torchao, swap_qwen_attention_with_wayfinder_cuda() should replace the 10 full_attention layers directly, and the Triton block-sparse path should run with num_key_value_groups=8. Expect an 8k smoke pass, positive paired scaling by 32k+, and a ceiling somewhere between 192k and 262k depending on recurrent-state growth.","change_set":["hcsa/integrations/qwen_torch.py","scripts/bench_qwen35_cuda_wayfinder.py","scripts/serve_qwen_wayfinder_cuda.py","tests/pytorch/test_torch_qwen_sparse_gqa.py","tests/test_qwen_cuda_wayfinder_cli.py","notes/LAB_NOTEBOOK.md","notes/experiments.ndjson"],"command":".venv/bin/python scripts/bench_qwen35_cuda_wayfinder.py --model-path /home/hmbown/HF_Models/Qwen3.5-35B-A3B-FP8 --seq-lens 8192 --quantize none --warmup 0 --repeats 1 --path block_sparse --engine auto --phases wayfinder dense --forward-target backbone --skip-divergence --output benchmarks/cuda/qwen35_wayfinder/EXP-20260321T060615Z-QWEN35MOE-FP8-SMOKE.ndjson ; .venv/bin/python scripts/bench_qwen35_cuda_wayfinder.py --model-path /home/hmbown/HF_Models/Qwen3.5-35B-A3B-FP8 --seq-lens 32768 65536 131072 --quantize none --warmup 1 --repeats 1 --path block_sparse --engine auto --phases wayfinder dense --forward-target backbone --skip-divergence --output benchmarks/cuda/qwen35_wayfinder/EXP-20260321T060615Z-QWEN35MOE-FP8-SCALE.ndjson ; .venv/bin/python scripts/bench_qwen35_cuda_wayfinder.py --model-path /home/hmbown/HF_Models/Qwen3.5-35B-A3B-FP8 --seq-lens 163840 --quantize none --warmup 0 --repeats 1 --path block_sparse --engine auto --phases wayfinder --forward-target backbone --skip-divergence --output benchmarks/cuda/qwen35_wayfinder/EXP-20260321T060615Z-QWEN35MOE-FP8-WF-163840.ndjson ; .venv/bin/python scripts/bench_qwen35_cuda_wayfinder.py --model-path /home/hmbown/HF_Models/Qwen3.5-35B-A3B-FP8 --seq-lens 196608 --quantize none --warmup 0 --repeats 1 --path block_sparse --engine auto --phases wayfinder --forward-target backbone --skip-divergence --output benchmarks/cuda/qwen35_wayfinder/EXP-20260321T060615Z-QWEN35MOE-FP8-WF-196608.ndjson ; .venv/bin/python scripts/bench_qwen35_cuda_wayfinder.py --model-path /home/hmbown/HF_Models/Qwen3.5-35B-A3B-FP8 --seq-lens 229376 --quantize none --warmup 0 --repeats 1 --path block_sparse --engine auto --phases wayfinder --forward-target backbone --skip-divergence --output benchmarks/cuda/qwen35_wayfinder/EXP-20260321T060615Z-QWEN35MOE-FP8-WF-229376.ndjson ; .venv/bin/python scripts/bench_qwen35_cuda_wayfinder.py --model-path /home/hmbown/HF_Models/Qwen3.5-35B-A3B-FP8 --seq-lens 262144 --quantize none --warmup 0 --repeats 1 --path block_sparse --engine auto --phases wayfinder --forward-target backbone --skip-divergence --output benchmarks/cuda/qwen35_wayfinder/EXP-20260321T060615Z-QWEN35MOE-FP8-WF-262144.ndjson ; .venv/bin/python scripts/bench_qwen35_cuda_wayfinder.py --model-path /home/hmbown/HF_Models/Qwen3.5-35B-A3B-FP8 --seq-lens 262144 --quantize none --warmup 0 --repeats 1 --path block_sparse --engine auto --phases wayfinder dense --forward-target backbone --skip-divergence --output benchmarks/cuda/qwen35_wayfinder/EXP-20260321T060615Z-QWEN35MOE-FP8-PAIR-262144.ndjson","controls":{"baseline_run_path":null,"one_process_at_a_time":true,"retro_backfill_inference":"off","model_path":"/home/hmbown/HF_Models/Qwen3.5-35B-A3B-FP8","runtime_python":"/home/hmbown/Projects/Wayfinder/.venv/bin/python","device":"cuda","gpu":"NVIDIA GB10","torch":"2.10.0+cu130","transformers":"5.3.0","quantization":"native_fp8_checkpoint","path":"block_sparse","engine_request":"auto","forward_target":"backbone","block_size":128,"block_local_window_blocks":1,"block_partner_count":1,"block_sink_blocks":1,"block_partner_rule":"xor","repeats":1,"stop_gates":["nonzero exit","artifact missing requested rows","any row contains error or OOM","smoke must emit dense and wayfinder rows at 8192","do not open next ceiling rung after a kernel fault","do not open next ceiling rung if peak_mem_gb > 110","do not run paired 262144 unless wayfinder-only 262144 succeeds with peak_mem_gb <= 110"]},"metrics":{"status":"pending","artifacts_expected":["benchmarks/cuda/qwen35_wayfinder/EXP-20260321T060615Z-QWEN35MOE-FP8-SMOKE.ndjson","benchmarks/cuda/qwen35_wayfinder/EXP-20260321T060615Z-QWEN35MOE-FP8-SCALE.ndjson","benchmarks/cuda/qwen35_wayfinder/EXP-20260321T060615Z-QWEN35MOE-FP8-WF-163840.ndjson","benchmarks/cuda/qwen35_wayfinder/EXP-20260321T060615Z-QWEN35MOE-FP8-WF-196608.ndjson","benchmarks/cuda/qwen35_wayfinder/EXP-20260321T060615Z-QWEN35MOE-FP8-WF-229376.ndjson","benchmarks/cuda/qwen35_wayfinder/EXP-20260321T060615Z-QWEN35MOE-FP8-WF-262144.ndjson","benchmarks/cuda/qwen35_wayfinder/EXP-20260321T060615Z-QWEN35MOE-FP8-PAIR-262144.ndjson"],"required":["smoke dense row at 8192","smoke wayfinder row at 8192","paired rows at 32768 65536 131072","wayfinder-only rows or explicit OOM/error rows at 163840 196608 229376 262144","absolute latency, delta vs dense, percentage delta vs dense, and memory reduction convention 100*(1-wayfinder/dense)"]},"decision":"pending","next_action":"Run the guarded smoke and scaling queue, stop on the stated memory gates, and append a RESULT entry with measured dense-vs-Wayfinder deltas plus the observed ceiling."}
{"id":"EXP-20260321T060610Z-QWEN35A3B-FP8-BRINGUP-PRERUN","date":"2026-03-21","question":"Can the Wayfinder CUDA path load Qwen3.5-35B-A3B-FP8, swap its 10 full-attention layers, and complete a short text-only prefill on GB10 without stacking runtime quantization on top of the checkpoint's native FP8 format?","hypothesis":"With transformers upgraded to a build that exposes qwen3_5_moe and FineGrainedFP8Config, plus decoder discovery at model.language_model.layers, the checkpoint should load through the conditional-generation auto class, Wayfinder should replace 10 full-attention layers, and a short dense/Wayfinder backbone smoke should complete using the checkpoint's native FP8 config with --quantize none.","change_set":["hcsa/integrations/qwen_torch.py","scripts/bench_qwen35_cuda_wayfinder.py","scripts/serve_qwen_wayfinder_cuda.py","tests/test_qwen_cuda_wayfinder_cli.py","environment: transformers==5.3.0"],"command":"python -m py_compile hcsa/integrations/qwen_torch.py scripts/bench_qwen35_cuda_wayfinder.py scripts/serve_qwen_wayfinder_cuda.py tests/test_qwen_cuda_wayfinder_cli.py && pytest tests/test_qwen_cuda_wayfinder_cli.py -q && python scripts/bench_qwen35_cuda_wayfinder.py --model-path /home/hmbown/HF_Models/Qwen3.5-35B-A3B-FP8 --seq-lens 512 --warmup 0 --repeats 1 --path block_sparse --engine triton --phases wayfinder dense --skip-divergence --forward-target backbone --output benchmarks/cuda/qwen35_wayfinder/EXP-20260321T060610Z-QWEN35A3B-FP8-BRINGUP.ndjson","controls":{"baseline_loader_failure":"transformers==4.48.2 rejected model_type=qwen3_5_moe","model":"Qwen3.5-35B-A3B-FP8","model_path":"/home/hmbown/HF_Models/Qwen3.5-35B-A3B-FP8","quantize":"none","native_quantization_expected":"fp8","path":"block_sparse","engine":"triton","block_size":128,"block_local_window_blocks":1,"block_partner_count":1,"block_sink_blocks":1,"block_partner_rule":"xor","warmup":0,"repeats":1,"forward_target":"backbone","phases":["wayfinder","dense"],"stop_gates":["py_compile failure","pytest failure","model load failure","swap count != 10","missing dense or wayfinder bench row in artifact"]},"metrics":{"status":"pending","required":["py_compile passes","targeted pytest passes","native_quantization_method=fp8","model_loader resolves to conditional-generation auto class","10 replaced layers","artifact contains dense and wayfinder rows at seq_len 512"]},"decision":"pending","next_action":"Run compile/test validation and the 512-token bringup smoke, then append the RESULT entry with swap count, memory, and any blockers for the long-context scaling queue."}
{"id":"EXP-20260321T061023Z-QWEN35A3B-FP8-SCALE-PRERUN","date":"2026-03-21","question":"On Qwen3.5-35B-A3B-FP8, what are the dense-vs-Wayfinder prefill timings at T=8192, 32768, 65536, 131072, and 262144, and does the model still fit at the full 262K context on GB10?","hypothesis":"The native FP8 checkpoint should fit at least through T=131072 with both phases. Wayfinder will likely be slower at short context because only 10 of 40 layers are swapped, but may recover relative to dense as sequence length grows. T=262144 is plausible but not guaranteed; if it fails, a follow-up incremental probe is required to bracket the ceiling.","change_set":["same code path as EXP-20260321T060610Z-QWEN35A3B-FP8-BRINGUP-PRERUN"],"command":"python scripts/bench_qwen35_cuda_wayfinder.py --model-path /home/hmbown/HF_Models/Qwen3.5-35B-A3B-FP8 --seq-lens 8192 32768 65536 131072 262144 --warmup 0 --repeats 1 --path block_sparse --engine triton --phases wayfinder dense --skip-divergence --forward-target backbone --output benchmarks/cuda/qwen35_wayfinder/EXP-20260321T061023Z-QWEN35A3B-FP8-SCALE.ndjson","controls":{"baseline_run_path":"benchmarks/cuda/qwen35_wayfinder/EXP-20260321T060610Z-QWEN35A3B-FP8-BRINGUP.ndjson","model":"Qwen3.5-35B-A3B-FP8","model_path":"/home/hmbown/HF_Models/Qwen3.5-35B-A3B-FP8","quantize":"none","native_quantization_expected":"fp8","path":"block_sparse","engine":"triton","block_size":128,"block_local_window_blocks":1,"block_partner_count":1,"block_sink_blocks":1,"block_partner_rule":"xor","warmup":0,"repeats":1,"forward_target":"backbone","phases":["wayfinder","dense"],"stop_gates":["nonzero exit","missing artifact","missing dense or wayfinder row for any completed sequence length","explicit error or OOM row at T=262144 triggers ceiling follow-up rather than retry"]},"metrics":{"status":"pending","required":["dense and wayfinder rows for 8192, 32768, 65536, 131072","attempted row or explicit failure for 262144","absolute metrics plus speedup and memory reduction convention 100*(1-wayfinder/dense)"]},"decision":"pending","next_action":"Run the full scaling sweep once, then inspect whether 262144 needs a separate incremental ceiling probe."}
{"id":"EXP-20260321T062613Z-QWEN35A3B-FP8-SAFETY-BACKFILL-PRERUN","date":"2026-03-21","question":"After the interrupted T=262144 Wayfinder pass pushed live unified-memory usage to 116.9 GiB without emitting a row, what safer follow-up queue can recover paired dense rows through T=131072 and bracket the 35B Wayfinder ceiling above T=131072 on GB10?","hypothesis":"Dense-only backfill at 8192, 32768, 65536, and 131072 should complete cleanly because the native-FP8 checkpoint leaves enough headroom for the stock hybrid path. Wayfinder-only probes should fit at 163840 and likely 196608, while 229376+ is likely to breach the 110 GiB stop-gate or require manual abort before row emission. T=262144 is therefore treated as not safely feasible until a lower rung clears with substantial margin.","change_set":["measurement-only","notes/LAB_NOTEBOOK.md","notes/experiments.ndjson"],"command":".venv/bin/python scripts/bench_qwen35_cuda_wayfinder.py --model-path /home/hmbown/HF_Models/Qwen3.5-35B-A3B-FP8 --seq-lens 8192 32768 65536 131072 --warmup 0 --repeats 1 --path block_sparse --engine triton --phases dense --skip-divergence --forward-target backbone --output benchmarks/cuda/qwen35_wayfinder/EXP-20260321T062613Z-QWEN35A3B-FP8-DENSE-BACKFILL.ndjson ; .venv/bin/python scripts/bench_qwen35_cuda_wayfinder.py --model-path /home/hmbown/HF_Models/Qwen3.5-35B-A3B-FP8 --seq-lens 163840 --warmup 0 --repeats 1 --path block_sparse --engine triton --phases wayfinder --skip-divergence --forward-target backbone --output benchmarks/cuda/qwen35_wayfinder/EXP-20260321T062613Z-QWEN35A3B-FP8-WF-163840.ndjson ; .venv/bin/python scripts/bench_qwen35_cuda_wayfinder.py --model-path /home/hmbown/HF_Models/Qwen3.5-35B-A3B-FP8 --seq-lens 196608 --warmup 0 --repeats 1 --path block_sparse --engine triton --phases wayfinder --skip-divergence --forward-target backbone --output benchmarks/cuda/qwen35_wayfinder/EXP-20260321T062613Z-QWEN35A3B-FP8-WF-196608.ndjson ; .venv/bin/python scripts/bench_qwen35_cuda_wayfinder.py --model-path /home/hmbown/HF_Models/Qwen3.5-35B-A3B-FP8 --seq-lens 229376 --warmup 0 --repeats 1 --path block_sparse --engine triton --phases wayfinder --skip-divergence --forward-target backbone --output benchmarks/cuda/qwen35_wayfinder/EXP-20260321T062613Z-QWEN35A3B-FP8-WF-229376.ndjson","controls":{"baseline_run_path":"benchmarks/cuda/qwen35_wayfinder/EXP-20260321T061023Z-QWEN35A3B-FP8-SCALE.ndjson","observed_live_stop_evidence":{"nvidia_smi_used_gpu_memory_mib":116887,"free_h_available_before_sigterm":"176 MiB"},"one_process_at_a_time":true,"retro_backfill_inference":"off","model":"Qwen3.5-35B-A3B-FP8","model_path":"/home/hmbown/HF_Models/Qwen3.5-35B-A3B-FP8","quantize":"none","load_dtype_effective_expected":"torch.bfloat16","native_quantization_expected":"fp8","path":"block_sparse","engine":"triton","block_size":128,"block_local_window_blocks":1,"block_partner_count":1,"block_sink_blocks":1,"block_partner_rule":"xor","warmup":0,"repeats":1,"forward_target":"backbone","dense_backfill_seq_lens":[8192,32768,65536,131072],"ceiling_probe_seq_lens":[163840,196608,229376],"manual_stop_gates":["live nvidia-smi usage > 110 GiB","free -h available memory < 4 GiB"]},"metrics":{"status":"pending","artifacts_expected":["benchmarks/cuda/qwen35_wayfinder/EXP-20260321T062613Z-QWEN35A3B-FP8-DENSE-BACKFILL.ndjson","benchmarks/cuda/qwen35_wayfinder/EXP-20260321T062613Z-QWEN35A3B-FP8-WF-163840.ndjson","benchmarks/cuda/qwen35_wayfinder/EXP-20260321T062613Z-QWEN35A3B-FP8-WF-196608.ndjson","benchmarks/cuda/qwen35_wayfinder/EXP-20260321T062613Z-QWEN35A3B-FP8-WF-229376.ndjson"],"required":["dense rows for 8192 32768 65536 131072","wayfinder rows or explicit abort/error for 163840 196608 229376","absolute metrics plus delta vs dense where available","memory reduction convention 100*(1-wayfinder/dense)"]},"decision":"pending","next_action":"Run the dense backfill first, then open the Wayfinder ceiling rungs one at a time with live memory checks between commands."}
{"id":"EXP-20260321T060610Z-QWEN35A3B-FP8-BRINGUP-RESULT","date":"2026-03-21","question":"Can the Wayfinder CUDA path load Qwen3.5-35B-A3B-FP8, swap its 10 full-attention layers, and complete a short text-only prefill on GB10 without stacking runtime quantization on top of the checkpoint's native FP8 format?","hypothesis":"With transformers upgraded to a build that exposes qwen3_5_moe and FineGrainedFP8Config, plus decoder discovery at model.language_model.layers, the checkpoint should load through the conditional-generation auto class, Wayfinder should replace 10 full-attention layers, and a short dense/Wayfinder backbone smoke should complete using the checkpoint's native FP8 config with --quantize none.","change_set":["hcsa/integrations/qwen_torch.py","scripts/bench_qwen35_cuda_wayfinder.py","scripts/serve_qwen_wayfinder_cuda.py","tests/test_qwen_cuda_wayfinder_cli.py","environment: transformers==5.3.0","notes/LAB_NOTEBOOK.md","notes/experiments.ndjson"],"command":"python -m py_compile hcsa/integrations/qwen_torch.py scripts/bench_qwen35_cuda_wayfinder.py scripts/serve_qwen_wayfinder_cuda.py tests/test_qwen_cuda_wayfinder_cli.py && pytest tests/test_qwen_cuda_wayfinder_cli.py -q && python scripts/bench_qwen35_cuda_wayfinder.py --model-path /home/hmbown/HF_Models/Qwen3.5-35B-A3B-FP8 --seq-lens 512 --warmup 0 --repeats 1 --path block_sparse --engine triton --phases wayfinder dense --skip-divergence --forward-target backbone --output benchmarks/cuda/qwen35_wayfinder/EXP-20260321T060610Z-QWEN35A3B-FP8-BRINGUP.ndjson","controls":{"baseline_loader_failure":"transformers==4.48.2 rejected model_type=qwen3_5_moe","model":"Qwen3.5-35B-A3B-FP8","model_path":"/home/hmbown/HF_Models/Qwen3.5-35B-A3B-FP8","quantize":"none","native_quantization_expected":"fp8","path":"block_sparse","engine":"triton","block_size":128,"block_local_window_blocks":1,"block_partner_count":1,"block_sink_blocks":1,"block_partner_rule":"xor","warmup":0,"repeats":1,"forward_target":"backbone","phases":["wayfinder","dense"]},"metrics":{"status":"completed","artifacts":{"bringup":"benchmarks/cuda/qwen35_wayfinder/EXP-20260321T060610Z-QWEN35A3B-FP8-BRINGUP.ndjson","dtype_auto_failure":"benchmarks/cuda/qwen35_wayfinder/EXP-20260321T060615Z-QWEN35MOE-FP8-SMOKE.ndjson"},"loader":{"model_loader":"AutoModelForImageTextToText","native_quantization_method":"fp8","load_dtype_effective":"torch.bfloat16","dtype_auto_result":"failed_before_model_load"},"swap":{"replaced_full_attention_layers":10,"q_heads":16,"kv_heads":2},"T512":{"dense_ms":1687.15,"wayfinder_ms":9616.73,"dense_tok_s":303.5,"wayfinder_tok_s":53.2,"dense_peak_gb":34.2,"wayfinder_peak_gb":34.2,"latency_delta_ms":7929.58,"latency_delta_pct":470.0,"throughput_delta_tok_s":-250.3,"throughput_delta_pct":-82.5,"memory_reduction_pct_convention":0.0},"notes":"The working native-FP8 path on this stack is --quantize none with BF16 compute. dtype='auto' hit a Float8_e4m3fnStorage default-dtype error and is not safe to use here."},"decision":"keep","next_action":"Run long-context scaling and bracket the safe Wayfinder ceiling above 131072."}
{"id":"EXP-20260321T061023Z-QWEN35A3B-FP8-SCALE-RESULT","date":"2026-03-21","question":"On Qwen3.5-35B-A3B-FP8, what are the dense-vs-Wayfinder prefill timings at T=8192, 32768, 65536, 131072, and 262144, and does the model still fit at the full 262K context on GB10?","hypothesis":"The native FP8 checkpoint should fit at least through T=131072 with both phases. Wayfinder will likely be slower at short context because only 10 of 40 layers are swapped, but may recover relative to dense as sequence length grows. T=262144 is plausible but not guaranteed; if it fails, a follow-up incremental probe is required to bracket the ceiling.","change_set":["measurement-only","notes/LAB_NOTEBOOK.md","notes/experiments.ndjson"],"command":"python scripts/bench_qwen35_cuda_wayfinder.py --model-path /home/hmbown/HF_Models/Qwen3.5-35B-A3B-FP8 --seq-lens 8192 32768 65536 131072 262144 --warmup 0 --repeats 1 --path block_sparse --engine triton --phases wayfinder dense --skip-divergence --forward-target backbone --output benchmarks/cuda/qwen35_wayfinder/EXP-20260321T061023Z-QWEN35A3B-FP8-SCALE.ndjson","controls":{"baseline_run_path":"benchmarks/cuda/qwen35_wayfinder/EXP-20260321T060610Z-QWEN35A3B-FP8-BRINGUP.ndjson","model":"Qwen3.5-35B-A3B-FP8","model_path":"/home/hmbown/HF_Models/Qwen3.5-35B-A3B-FP8","quantize":"none","native_quantization_expected":"fp8","path":"block_sparse","engine":"triton","block_size":128,"block_local_window_blocks":1,"block_partner_count":1,"block_sink_blocks":1,"block_partner_rule":"xor","warmup":0,"repeats":1,"forward_target":"backbone","phases":["wayfinder","dense"]},"metrics":{"status":"completed_with_followup","artifacts":{"wayfinder_partial":"benchmarks/cuda/qwen35_wayfinder/EXP-20260321T061023Z-QWEN35A3B-FP8-SCALE.ndjson","dense_backfill":"benchmarks/cuda/qwen35_wayfinder/EXP-20260321T061023Z-QWEN35A3B-FP8-DENSE-131K.ndjson","unsafe_262k_wayfinder":"benchmarks/cuda/qwen35_wayfinder/EXP-20260321T061023Z-QWEN35A3B-FP8-WF-262144.ndjson"},"paired":{"8192":{"dense_ms":8799.56,"wayfinder_ms":8588.5,"speedup":"1.02x","dense_tok_s":931.0,"wayfinder_tok_s":953.8,"dense_peak_gb":35.7,"wayfinder_peak_gb":35.7,"latency_delta_ms":-211.06,"latency_delta_pct":-2.4,"throughput_delta_tok_s":22.8,"throughput_delta_pct":2.45,"memory_reduction_pct_convention":0.0},"32768":{"dense_ms":25602.31,"wayfinder_ms":25186.41,"speedup":"1.02x","dense_tok_s":1279.9,"wayfinder_tok_s":1301.0,"dense_peak_gb":40.5,"wayfinder_peak_gb":40.5,"latency_delta_ms":-415.9,"latency_delta_pct":-1.62,"throughput_delta_tok_s":21.1,"throughput_delta_pct":1.65,"memory_reduction_pct_convention":0.0},"65536":{"dense_ms":52809.69,"wayfinder_ms":49432.61,"speedup":"1.07x","dense_tok_s":1241.0,"wayfinder_tok_s":1325.8,"dense_peak_gb":46.89,"wayfinder_peak_gb":46.9,"latency_delta_ms":-3377.08,"latency_delta_pct":-6.39,"throughput_delta_tok_s":84.8,"throughput_delta_pct":6.83,"memory_reduction_pct_convention":-0.0213},"131072":{"dense_ms":115919.15,"wayfinder_ms":98459.86,"speedup":"1.18x","dense_tok_s":1130.7,"wayfinder_tok_s":1331.2,"dense_peak_gb":59.69,"wayfinder_peak_gb":59.69,"latency_delta_ms":-17459.29,"latency_delta_pct":-15.06,"throughput_delta_tok_s":200.5,"throughput_delta_pct":17.73,"memory_reduction_pct_convention":0.0}},"unsafe_262144":{"rows_emitted":"experiment_meta only","attempt_1_live_used_gpu_memory_mib":116887,"attempt_1_host_available":"176 MiB","attempt_2_live_used_gpu_memory_mib":116817,"attempt_2_host_available":"341 MiB","conclusion":"262144 not safely feasible on current GB10 path"}},"decision":"follow-up","next_action":"Use one-rung-at-a-time Wayfinder probes above 131072 and stop before reopening 262144."}
