{"id":"EXP-20260209-fused-allhead-dispatch-RESULT","date":"2026-02-09","question":"Does eliminating per-head-chunk mx.eval barriers via fused all-head dispatch improve GLM-4.7 prefill throughput?","hypothesis":"Processing all heads in a single lazy MLX compute graph per query chunk will reduce GPU sync overhead, yielding 1.3-2x speedup on prefill attention for T=8192-32768.","change_set":["hcsa/mlx/fused_attention.py","hcsa/mlx/attention.py","hcsa/integrations/glm_mlx.py","hcsa/integrations/qwen_mlx.py","hcsa/compiler/passes/specialize_fused_kernels_pass.py","hcsa/mlx/kernels/metal/__init__.py","tests/mlx/test_fused_attention.py"],"command":"PYTHONPATH=/Volumes/VIXinSSD/wayfinder python3 scripts/bench_glm_chunked_prefill_mlx.py --seq-lens 8192 32768 --chunk-sizes 4096 --decode-lens 0","controls":{"model_path":"mlx-community/GLM-4.7-Flash-4bit","path":"permute","window":64,"head_chunk_size":2,"query_chunk_size":192,"use_fused_dispatch":true,"baseline":"use_fused_dispatch=false (chunked path)","retro_backfill_enabled":false,"circular":false,"multi_cycle_mode":"average"},"metrics":{"T8192":{"artifact_baseline":"benchmarks/mlx/glm_4_7_flash_4bit_wayfinder/20260209_fused_baseline/results.json","artifact_treatment":"benchmarks/mlx/glm_4_7_flash_4bit_wayfinder/20260209_fused_treatment/results.json","prefill_only":{"sec":{"absolute":66.09,"baseline":70.57,"delta_vs_baseline":-4.48,"delta_pct_vs_baseline":-6.35},"tok_s":{"absolute":123.95,"baseline":116.08,"delta_vs_baseline":7.88,"delta_pct_vs_baseline":6.79},"peak_memory_bytes":{"absolute":21442494248,"baseline":21443706664,"delta_vs_baseline":-1212416,"delta_pct_vs_baseline":-0.006},"chunk_0_attention_ms":{"fused":0.36,"baseline":273.82},"chunk_1_attention_ms":{"fused":571.36,"baseline":616.56}}},"T32768":{"artifact_baseline":"benchmarks/mlx/glm_4_7_flash_4bit_wayfinder/20260209_fused_baseline_32k/results.json","artifact_treatment":"benchmarks/mlx/glm_4_7_flash_4bit_wayfinder/20260209_fused_treatment_32k/results.json","prefill_only":{"sec":{"absolute":257.84,"baseline":275.09,"delta_vs_baseline":-17.25,"delta_pct_vs_baseline":-6.27},"tok_s":{"absolute":127.09,"baseline":119.12,"delta_vs_baseline":7.97,"delta_pct_vs_baseline":6.69},"peak_memory_bytes":{"absolute":22312830972,"baseline":22314043388,"delta_vs_baseline":-1212416,"delta_pct_vs_baseline":-0.005},"chunk_0_attention_ms":{"fused":0.36,"baseline":279.14}}}},"decision":"keep","next_action":"Apply fused dispatch to active-row path (wayfinder_permute_window_attention_active_batched) to capture speedups on chunks 1..N."}
{"id": "EXP-20260209-fused-active-row-dispatch-RESULT", "date": "2026-02-09", "question": "Does extending fused all-head dispatch to the active-row path improve GLM chunked-prefill throughput at T=32768?", "hypothesis": "Processing all heads in a single lazy MLX graph per query chunk in the active-row path should improve end-to-end throughput by 15-30% on GLM chunked prefill at T=32768, since chunks 1-7 (87% of compute) currently have 20 eval barriers per layer per chunk.", "change_set": ["hcsa/mlx/fused_attention.py", "hcsa/mlx/attention.py", "hcsa/integrations/glm_mlx.py", "tests/mlx/test_fused_attention.py"], "command": "PYTHONPATH=/Volumes/VIXinSSD/wayfinder python3 scripts/bench_glm_chunked_prefill_mlx.py --seq-lens 8192 32768 --chunk-sizes 4096 --decode-lens 0", "controls": {"model_path": "mlx-community/GLM-4.7-Flash-4bit", "path": "permute", "window": 64, "head_chunk_size": 2, "query_chunk_size": 192, "use_fused_dispatch": true, "baseline": "use_fused_dispatch=false (both paths chunked)", "retro_backfill_enabled": false, "circular": false, "multi_cycle_mode": "average"}, "metrics": {"v1_vectorized": {"result": "REGRESSION - 3x slower, 2x memory from vectorized gather", "T8192": {"sec": 197.0, "tok_s": 41.6, "peak_memory_GB": 42.1}}, "v2_loop_no_eval": {"T8192": {"baseline": {"sec": 67.3, "tok_s": 121.7, "peak_memory_GB": 21.44}, "fused": {"sec": 67.6, "tok_s": 121.2, "peak_memory_GB": 20.14}, "delta_tok_s_pct": -0.4, "delta_memory_GB": -1.3}, "T32768": {"baseline": {"sec": 248.0, "tok_s": 132.1, "peak_memory_GB": 22.31}, "fused": {"sec": 260.7, "tok_s": 125.7, "peak_memory_GB": 21.01}, "delta_tok_s_pct": -4.9, "delta_memory_GB": -1.3}}}, "decision": "keep-off-by-default", "next_action": "Active-row bottleneck is compute, not dispatch. Target Metal kernels (K4/K6) for future optimization."}
{"id":"EXP-20260209-GPT2-SPARSE-FINETUNE-SMOKE","date":"2026-02-09","question":"Does the GPT-2 sparse finetune harness run end-to-end and emit metrics for all four configs?","hypothesis":"The script completes without errors and produces summary.json/metrics.jsonl; sparse configs may be noisy at 5 steps but should train.","change_set":["scripts/finetune_sparse_gpt2_mlx.py","hcsa/integrations/qwen_mlx.py","hcsa/integrations/gpt2_mlx.py"],"command":"python3 scripts/finetune_sparse_gpt2_mlx.py --seq-len 128 --steps 5 --eval-every 5 --eval-batches 1 --batch-size 1 --out-dir results/finetune_sparse_comparison/smoke_20260209","controls":{"model_path":"openai-community/gpt2","data":"data/tinyshakespeare.txt","seq_len":128,"steps":5,"batch_size":1,"window":64,"max_degree":130,"seed":42,"eval_every":5,"eval_batches":1},"metrics":{"status":"pending"},"decision":"pending","next_action":"Run smoke command and record summary metrics."}
{"id":"EXP-20260209-GPT2-SPARSE-FINETUNE-FULL","date":"2026-02-09","question":"After finetuning GPT-2 with sparse attention, does window+cycle beat window+landmarks at the same edge budget?","hypothesis":"window+cycle yields lower validation perplexity than window+landmarks; multicycle matches or improves further.","change_set":["scripts/finetune_sparse_gpt2_mlx.py","hcsa/integrations/qwen_mlx.py","hcsa/integrations/gpt2_mlx.py"],"command":"python3 scripts/finetune_sparse_gpt2_mlx.py","controls":{"model_path":"openai-community/gpt2","data":"data/tinyshakespeare.txt","seq_len":512,"steps":800,"batch_size":4,"window":64,"max_degree":130,"seed":42,"eval_every":100,"eval_batches":8},"metrics":{"status":"pending"},"decision":"pending","next_action":"Run full sweep and record comparison deltas."}
{"id":"EXP-20260209-GPT2-SPARSE-FINETUNE-SMOKE-RESULT","date":"2026-02-09","question":"Does the GPT-2 sparse finetune harness run end-to-end and emit metrics for all four configs?","hypothesis":"The script completes without errors and produces summary.json/metrics.jsonl; sparse configs may be noisy at 5 steps but should train.","change_set":["scripts/finetune_sparse_gpt2_mlx.py","hcsa/integrations/qwen_mlx.py","hcsa/integrations/gpt2_mlx.py"],"command":"python3 scripts/finetune_sparse_gpt2_mlx.py --seq-len 128 --steps 5 --eval-every 5 --eval-batches 1 --batch-size 1 --out-dir results/finetune_sparse_comparison/smoke_20260209","controls":{"model_path":"openai-community/gpt2","data":"data/tinyshakespeare.txt","seq_len":128,"steps":5,"batch_size":1,"window":64,"max_degree":130,"seed":42,"eval_every":5,"eval_batches":1},"metrics":{"artifact":"results/finetune_sparse_comparison/smoke_20260209/summary.json","data":{"raw_tokens":603,"total_tokens":1809,"repeats":3,"train_tokens":1629,"val_tokens":180},"val_ppl":{"dense":56.55515357523123,"window_landmarks":55.74561113282869,"window_cycle":59.16899111320265,"window_multicycle":130.2685890483732},"delta_cycle_vs_landmarks":{"absolute":3.4233799803739586,"delta_pct_vs_landmarks":6.141075343522289},"delta_multicycle_vs_landmarks":{"absolute":74.52297791554452,"delta_pct_vs_landmarks":133.68402713887875}},"decision":"proceed","next_action":"Run full sweep and record comparison deltas."}
{"id":"EXP-20260209-GPT2-SPARSE-FINETUNE-FULL-RESULT","date":"2026-02-09","question":"After finetuning GPT-2 with sparse attention, does window+cycle beat window+landmarks at the same edge budget?","hypothesis":"window+cycle yields lower validation perplexity than window+landmarks; multicycle matches or improves further.","change_set":["scripts/finetune_sparse_gpt2_mlx.py","hcsa/integrations/qwen_mlx.py","hcsa/integrations/gpt2_mlx.py"],"command":"python3 scripts/finetune_sparse_gpt2_mlx.py","controls":{"model_path":"openai-community/gpt2","data":"data/tinyshakespeare.txt","seq_len":512,"steps":800,"batch_size":4,"window":64,"max_degree":130,"seed":42,"eval_every":100,"eval_batches":8},"metrics":{"artifact":"results/finetune_sparse_comparison/20260209_170757/summary.json","data":{"raw_tokens":603,"total_tokens":5427,"repeats":9,"train_tokens":4885,"val_tokens":542},"val_ppl":{"dense":1.0080256784595876,"window_landmarks":1.0079505951515444,"window_cycle":1.0077473206771523,"window_multicycle":1.0075463992321823},"delta_cycle_vs_landmarks":{"absolute":-0.0002032744743920567,"delta_pct_vs_landmarks":-0.020167106936575058},"delta_multicycle_vs_landmarks":{"absolute":-0.00040419591936213806,"delta_pct_vs_landmarks":-0.04010076697274707}},"decision":"keep","next_action":"Validate on larger corpus or longer training to confirm the tiny deltas."}
{"id":"EXP-20260209-GPT2-TOKEN-MEM-BENCH","date":"2026-02-09","question":"At seq_len=512, how do tokens/sec and peak memory compare for sparse configs (landmarks, cycle, multicycle) vs dense baseline?","hypothesis":"Sparse gather will reduce tok/s vs dense; cycle and multicycle should be within ~10% of landmarks, with multicycle slightly higher memory due to more cycle edges.","change_set":["scripts/bench_gpt2_wayfinder_mlx.py"],"command":"python3 scripts/bench_gpt2_wayfinder_mlx.py --seq-lens 512 --batch 1 --warmup 1 --iters 2 --path sparse --window 64 --landmark-stride 8 --num-cycles 0 --allow-non-hamiltonian --full-swap --out-dir benchmarks/mlx/gpt2_wayfinder/20260209_sparse_landmarks_512 && python3 scripts/bench_gpt2_wayfinder_mlx.py --seq-lens 512 --batch 1 --warmup 1 --iters 2 --path sparse --window 64 --landmark-stride 9 --num-cycles 1 --full-swap --out-dir benchmarks/mlx/gpt2_wayfinder/20260209_sparse_cycle_512 && python3 scripts/bench_gpt2_wayfinder_mlx.py --seq-lens 512 --batch 1 --warmup 1 --iters 2 --path sparse --window 64 --landmark-stride 0 --num-cycles 18 --no-edge-disjoint --full-swap --out-dir benchmarks/mlx/gpt2_wayfinder/20260209_sparse_multicycle_512","controls":{"model_path":"openai-community/gpt2","dtype":"float16","seq_len":512,"batch":1,"window":64,"baseline":"level_a_real_qkv.baseline_attention in each results.json"},"metrics":{"status":"pending"},"decision":"pending","next_action":"Run the three commands and record token/s + memory deltas vs baseline."}
{"id":"EXP-20260209-GPT2-TOKEN-MEM-BENCH-RESULT","date":"2026-02-09","question":"At seq_len=512, how do tokens/sec and peak memory compare for sparse configs (landmarks, cycle, multicycle) vs dense baseline?","hypothesis":"Sparse gather will reduce tok/s vs dense; cycle and multicycle should be within ~10% of landmarks, with multicycle slightly higher memory due to more cycle edges.","change_set":["scripts/bench_gpt2_wayfinder_mlx.py"],"command":"python3 scripts/bench_gpt2_wayfinder_mlx.py --seq-lens 512 --batch 1 --warmup 1 --iters 2 --path sparse --window 64 --landmark-stride 8 --num-cycles 0 --allow-non-hamiltonian --full-swap --out-dir benchmarks/mlx/gpt2_wayfinder/20260209_sparse_landmarks_512 && python3 scripts/bench_gpt2_wayfinder_mlx.py --seq-lens 512 --batch 1 --warmup 1 --iters 2 --path sparse --window 64 --landmark-stride 9 --num-cycles 1 --full-swap --out-dir benchmarks/mlx/gpt2_wayfinder/20260209_sparse_cycle_512 && python3 scripts/bench_gpt2_wayfinder_mlx.py --seq-lens 512 --batch 1 --warmup 1 --iters 2 --path sparse --window 64 --landmark-stride 0 --num-cycles 18 --no-edge-disjoint --full-swap --out-dir benchmarks/mlx/gpt2_wayfinder/20260209_sparse_multicycle_512","controls":{"model_path":"openai-community/gpt2","dtype":"float16","seq_len":512,"batch":1,"window":64,"baseline":"level_a_real_qkv.baseline_attention in each results.json"},"metrics":{"artifacts":{"landmarks":"benchmarks/mlx/gpt2_wayfinder/20260209_sparse_landmarks_512/results.json","cycle":"benchmarks/mlx/gpt2_wayfinder/20260209_sparse_cycle_512/results.json","multicycle":"benchmarks/mlx/gpt2_wayfinder/20260209_sparse_multicycle_512/results.json"},"baseline_attention":{"peak_memory_bytes":22818844,"tokens_per_sec_landmarks":514034.80654676666,"tokens_per_sec_cycle":523394.8291236463,"tokens_per_sec_multicycle":499959.4760775521},"wayfinder_attention":{"landmarks":{"tokens_per_sec":66459.15919088709,"peak_memory_bytes":442913276,"tok_delta_pct":-87.0710780000769,"mem_delta_pct":1840.9978700060353,"memory_reduction_pct":-1840.9978700060353},"cycle":{"tokens_per_sec":69118.94472005399,"peak_memory_bytes":428716540,"tok_delta_pct":-86.79411012986424,"mem_delta_pct":1778.7829041646457,"memory_reduction_pct":-1778.7829041646457},"multicycle":{"tokens_per_sec":78060.6799826006,"peak_memory_bytes":374682108,"tok_delta_pct":-84.38659857094255,"mem_delta_pct":1541.9854923413297,"memory_reduction_pct":-1541.9854923413297}},"full_swap":{"landmarks":{"tokens_per_sec":394.0446662742372,"peak_memory_bytes":818376276},"cycle":{"tokens_per_sec":2249.139837993495,"peak_memory_bytes":863710992},"multicycle":{"tokens_per_sec":1315.3627042044468,"peak_memory_bytes":894996240}}},"decision":"use-permute-path","next_action":"If performance is priority, benchmark permute path (window+cycle/multicycle) to compare tok/s and memory."}
{"id":"EXP-20260209-QWEN3-1P7B-SPARSE-PERMUTE-SWEEP","date":"2026-02-09","question":"Across sparse and permute paths on Qwen3-1.7B-4bit, how do landmarks (num_cycles=0), cycle (num_cycles=1), and multicycle (num_cycles=auto) compare vs dense from 2048 to 32768 context?","hypothesis":"Permute should remain strongest at long context with better tok/s and memory reduction vs dense; sparse may regress at short context and improve later; multicycle may trade memory for connectivity unless no-edge-disjoint offsets it.","change_set":["scripts/bench_qwen_wayfinder_mlx.py","hcsa/integrations/qwen_mlx.py"],"command":"STAMP=$(date -u +%Y%m%d_%H%M%S); BASE=benchmarks/mlx; PYTHONPATH=. python3 scripts/bench_qwen_wayfinder_mlx.py --model-path mlx-community/Qwen3-1.7B-4bit --seq-lens 2048 4096 8192 16384 32768 --batch 1 --warmup 1 --iters 1 --path sparse --window 64 --max-degree 130 --landmark-stride-from-max-degree --num-cycles 0 --allow-non-hamiltonian --out-dir ${BASE}/qwen3_1.7b_sparse_landmarks_${STAMP} && PYTHONPATH=. python3 scripts/bench_qwen_wayfinder_mlx.py --model-path mlx-community/Qwen3-1.7B-4bit --seq-lens 2048 4096 8192 16384 32768 --batch 1 --warmup 1 --iters 1 --path sparse --window 64 --max-degree 130 --landmark-stride-from-max-degree --num-cycles 1 --out-dir ${BASE}/qwen3_1.7b_sparse_cycle_${STAMP} && PYTHONPATH=. python3 scripts/bench_qwen_wayfinder_mlx.py --model-path mlx-community/Qwen3-1.7B-4bit --seq-lens 2048 4096 8192 16384 32768 --batch 1 --warmup 1 --iters 1 --path sparse --window 64 --landmark-stride 0 --num-cycles auto --no-edge-disjoint --out-dir ${BASE}/qwen3_1.7b_sparse_multicycle_${STAMP} && PYTHONPATH=. python3 scripts/bench_qwen_wayfinder_mlx.py --model-path mlx-community/Qwen3-1.7B-4bit --seq-lens 2048 4096 8192 16384 32768 --batch 1 --warmup 1 --iters 1 --path permute --window 64 --max-degree 130 --landmark-stride-from-max-degree --num-cycles 0 --allow-non-hamiltonian --out-dir ${BASE}/qwen3_1.7b_permute_landmarks_${STAMP} && PYTHONPATH=. python3 scripts/bench_qwen_wayfinder_mlx.py --model-path mlx-community/Qwen3-1.7B-4bit --seq-lens 2048 4096 8192 16384 32768 --batch 1 --warmup 1 --iters 1 --path permute --window 64 --max-degree 130 --landmark-stride-from-max-degree --num-cycles 1 --out-dir ${BASE}/qwen3_1.7b_permute_cycle_${STAMP} && PYTHONPATH=. python3 scripts/bench_qwen_wayfinder_mlx.py --model-path mlx-community/Qwen3-1.7B-4bit --seq-lens 2048 4096 8192 16384 32768 --batch 1 --warmup 1 --iters 1 --path permute --window 64 --landmark-stride 0 --num-cycles auto --no-edge-disjoint --out-dir ${BASE}/qwen3_1.7b_permute_multicycle_${STAMP}","controls":{"model_path":"mlx-community/Qwen3-1.7B-4bit","seq_lens":[2048,4096,8192,16384,32768],"batch":1,"warmup":1,"iters":1,"window":64,"max_degree":130,"seed":42,"retro_backfill_enabled":false},"metrics":{"status":"pending"},"decision":"pending","next_action":"Run full sparse+permute sweep, compute deltas vs dense baseline, and select keep/revert/follow-up per config."}
{"id":"EXP-20260209-GLM47-CHUNKED-DENSE-VS-WAYFINDER","date":"2026-02-09","question":"On GLM-4.7-Flash, does Wayfinder permute improve chunked prefill tok/s and reduce peak memory versus dense baseline at seq_len 2048, 8192, and 32768?","hypothesis":"In the chunked prefill regime, Wayfinder permute should improve prefill throughput at longer context and show positive memory reduction versus dense, with smaller gains (or neutral) at 2K.","change_set":["none (measurement-only pivot benchmark)"],"command":"PYTHONPATH=. python3 scripts/bench_glm_chunked_prefill_mlx.py --model-path mlx-community/GLM-4.7-Flash-4bit --seq-lens 2048 8192 32768 --chunk-sizes 4096 --decode-lens 0 --path permute --window 64 --landmark-stride 0 --head-chunk-size 2 --query-chunk-size 192 --permute-prepermute-mode auto --no-swap --out-dir benchmarks/mlx/glm4_7_flash_dense_20260209_183815 && PYTHONPATH=. python3 scripts/bench_glm_chunked_prefill_mlx.py --model-path mlx-community/GLM-4.7-Flash-4bit --seq-lens 2048 8192 32768 --chunk-sizes 4096 --decode-lens 0 --path permute --window 64 --landmark-stride 64 --head-chunk-size 2 --query-chunk-size 192 --permute-prepermute-mode auto --baseline-path benchmarks/mlx/glm4_7_flash_dense_20260209_183815/results.json --out-dir benchmarks/mlx/glm4_7_flash_wayfinder_20260209_183815","controls":{"model_path":"mlx-community/GLM-4.7-Flash-4bit","seq_lens":[2048,8192,32768],"chunk_size":4096,"decode_len":0,"path":"permute","window":64,"dense_landmark_stride":0,"wayfinder_landmark_stride":64,"head_chunk_size":2,"query_chunk_size":192,"permute_prepermute_mode":"auto","retro_backfill_enabled":false},"metrics":{"status":"pending"},"decision":"pending","next_action":"Run dense then Wayfinder and compute per-seq tok/s and peak memory deltas vs dense baseline."}
{"id":"EXP-20260209-GLM47-CHUNKED-DENSE-VS-WAYFINDER-RESULT","date":"2026-02-09","question":"On GLM-4.7-Flash, does Wayfinder permute improve chunked prefill tok/s and reduce peak memory versus dense baseline at seq_len 2048, 8192, and 32768?","hypothesis":"In the chunked prefill regime, Wayfinder permute should improve prefill throughput at longer context and show positive memory reduction versus dense, with smaller gains (or neutral) at 2K.","change_set":["none (measurement-only pivot benchmark)"],"command":"PYTHONPATH=. python3 scripts/bench_glm_chunked_prefill_mlx.py --model-path mlx-community/GLM-4.7-Flash-4bit --seq-lens 2048 8192 32768 --chunk-sizes 4096 --decode-lens 0 --path permute --window 64 --landmark-stride 0 --head-chunk-size 2 --query-chunk-size 192 --permute-prepermute-mode auto --no-swap --out-dir benchmarks/mlx/glm4_7_flash_dense_20260209_183815 && PYTHONPATH=. python3 scripts/bench_glm_chunked_prefill_mlx.py --model-path mlx-community/GLM-4.7-Flash-4bit --seq-lens 2048 8192 32768 --chunk-sizes 4096 --decode-lens 0 --path permute --window 64 --landmark-stride 64 --head-chunk-size 2 --query-chunk-size 192 --permute-prepermute-mode auto --baseline-path benchmarks/mlx/glm4_7_flash_dense_20260209_183815/results.json --out-dir benchmarks/mlx/glm4_7_flash_wayfinder_20260209_183815","controls":{"model_path":"mlx-community/GLM-4.7-Flash-4bit","seq_lens":[2048,8192,32768],"chunk_size":4096,"decode_len":0,"path":"permute","window":64,"dense_landmark_stride":0,"wayfinder_landmark_stride":64,"head_chunk_size":2,"query_chunk_size":192,"permute_prepermute_mode":"auto","retro_backfill_enabled":false,"baseline_path":"benchmarks/mlx/glm4_7_flash_dense_20260209_183815/results.json"},"metrics":{"artifacts":{"dense":"benchmarks/mlx/glm4_7_flash_dense_20260209_183815/results.json","wayfinder":"benchmarks/mlx/glm4_7_flash_wayfinder_20260209_183815/results.json"},"prefill_only":{"2048":{"tok_s":{"dense":95.70701740725156,"wayfinder":92.7860853049146,"delta_vs_baseline":-2.9209321023369644,"delta_pct_vs_baseline":-3.0519524330472443},"peak_memory_bytes":{"dense":18144343308,"wayfinder":18194790400,"delta_vs_baseline":50447092,"delta_pct_vs_baseline":0.27803158122857425},"memory_reduction_pct":-0.2780315812285758},"8192":{"tok_s":{"dense":459.85808726574026,"wayfinder":901.2548118850085,"delta_vs_baseline":441.3967246192683,"delta_pct_vs_baseline":95.98542176272453},"peak_memory_bytes":{"dense":20660500140,"wayfinder":20054294096,"delta_vs_baseline":-606206044,"delta_pct_vs_baseline":-2.9341309305727914},"memory_reduction_pct":2.934130930572788},"32768":{"tok_s":{"dense":192.04482689839573,"wayfinder":607.1856460571536,"delta_vs_baseline":415.1408191587579,"delta_pct_vs_baseline":216.1687066493848},"peak_memory_bytes":{"dense":26017775484,"wayfinder":25420220192,"delta_vs_baseline":-597555292,"delta_pct_vs_baseline":-2.2967193101176724},"memory_reduction_pct":2.296719310117671}}},"decision":"keep","next_action":"Use GLM permute as the primary long-context benchmark path and run a focused 2K tuning pass (or dense fallback threshold) to remove the short-context regression."}
