{"id":"EXP-20260318T220001Z-QWEN35CUDA-SPARSE-4096-NOMETRICS-PRERUN","date":"2026-03-18","question":"If the T=4096 stall was caused by cache-miss graph-metric diagnostics rather than the sparse attention path itself, does the same sparse Hamiltonian configuration complete cleanly at T=4096 once compute_graph_metrics is disabled?","hypothesis":"With compute_graph_metrics=false, the T=4096 sparse run should complete and emit a real Wayfinder row. Any remaining slowdown should then reflect graph build + sparse attention, not the diagnostic BFS path in graph_metrics(abi).","change_set":["measurement-only"],"command":".venv/bin/python scripts/bench_qwen35_cuda_wayfinder.py --model-path /home/hmbown/HF_Models/Qwen3.5-9B --seq-lens 4096 --path sparse --strategy random --engine auto --warmup 1 --repeats 1 --forward-target backbone --phases dense wayfinder --skip-divergence --output benchmarks/cuda/qwen35_wayfinder/EXP-20260318T220001Z-QWEN35CUDA-SPARSE-4096-NOMETRICS.ndjson && journalctl -b -k --since '2026-03-18 17:00:01' | rg -n 'NVRM|Xid|Out of memory|hung task|BUG:|Call Trace'","controls":{"baseline_run_path":"benchmarks/cuda/qwen35_wayfinder/EXP-20260318T213005Z-QWEN35CUDA-SPARSE-2048.ndjson","failed_diagnostic_run_path":"benchmarks/cuda/qwen35_wayfinder/EXP-20260318T213717Z-QWEN35CUDA-SPARSE-4096.ndjson","one_process_at_a_time":true,"lock_file":"benchmarks/cuda/qwen35_wayfinder/.bench_qwen35_cuda_wayfinder.lock","retro_backfill_inference":"off","model_path":"/home/hmbown/HF_Models/Qwen3.5-9B","device":"cuda","gpu":"NVIDIA GB10","device_capability":[12,1],"torch":"2.10.0+cu130","transformers":"5.3.0","path":"sparse","strategy":"random","compute_graph_metrics":false,"forward_target":"backbone","window":64,"landmark_stride":64,"num_cycles":1,"engine_request":"auto","warmup":1,"repeats":1,"seq_lens":[4096],"kernel_log_since":"2026-03-18 17:00:01"},"metrics":{"status":"pending","artifacts_expected":["benchmarks/cuda/qwen35_wayfinder/EXP-20260318T220001Z-QWEN35CUDA-SPARSE-4096-NOMETRICS.ndjson"],"required":["bench[label=dense].median_ms","bench[label=dense].prefill_tok_per_sec","bench[label=dense].peak_mem_gb","bench[label=wayfinder].median_ms","bench[label=wayfinder].prefill_tok_per_sec","bench[label=wayfinder].peak_mem_gb","bench[label=wayfinder].wayfinder_profiles","bench[label=wayfinder].wayfinder_profiles[].path==sparse","bench[label=wayfinder].wayfinder_active_layers==8","zero new kernel fault lines after kernel_log_since"]},"decision":"pending","next_action":"Run the sparse 4096 checkpoint with graph metrics disabled and confirm whether the real sparse path completes cleanly."}
{"id":"EXP-20260318T220414Z-QWEN35CUDA-SPARSE-RUNTIME-FIX-PRERUN","date":"2026-03-18","question":"Can the Qwen CUDA sparse Wayfinder path be corrected so static graph work is shared once, graph metrics are no longer paid in the timed forward path, and sparse attention stops expanding grouped-query K/V into giant per-query-head gather tensors?","hypothesis":"Sharing static graph/cache objects across layers, computing graph metrics lazily outside the timed forward path, and switching the sparse path to grouped-query chunked execution should remove the T=4096 pre-row stall, materially reduce sparse-path peak memory, and preserve small-shape correctness.","change_set":["planned edits to hcsa/integrations/qwen_torch.py","planned edits to hcsa/torch/attention_wayfinder_sparse.py","planned edits to scripts/bench_qwen35_cuda_wayfinder.py","planned edits to hcsa/torch/__init__.py","planned tests in tests/pytorch/test_torch_qwen_sparse_gqa.py","notes/LAB_NOTEBOOK.md","notes/experiments.ndjson"],"command":".venv/bin/python -m py_compile hcsa/integrations/qwen_torch.py hcsa/torch/attention_wayfinder_sparse.py scripts/bench_qwen35_cuda_wayfinder.py tests/pytorch/test_torch_qwen_sparse_gqa.py && .venv/bin/python -m pytest tests/pytorch/test_torch_qwen_sparse_gqa.py tests/pytorch/test_torch_causality.py tests/pytorch/test_torch_dense_limit_equivalence.py tests/pytorch/test_torch_matches_mlx_reference_small.py tests/test_qwen_cuda_wayfinder_cli.py -q","controls":{"no_benchmark_or_generation_inference":true,"runtime":".venv","torch":"2.10.0+cu130","transformers":"5.3.0","path":"sparse","strategy":"random","window":64,"landmark_stride":64,"num_cycles":1},"metrics":{"status":"pending","required":["shared static graph/cache behavior present in qwen_torch","graph metrics computed outside timed forward path","grouped-query sparse path matches repeated-KV reference on small tensors","benchmark cache-clear helper clears shared caches too","targeted py_compile and pytest commands exit 0"]},"decision":"pending","next_action":"Patch the Qwen sparse runtime, validate with the targeted non-inference test suite, and record a RESULT entry before any further long-context run."}
{"id":"EXP-20260318T220414Z-QWEN35CUDA-SPARSE-RUNTIME-FIX-RESULT","date":"2026-03-18","question":"Can the Qwen CUDA sparse Wayfinder path be corrected so static graph work is shared once, graph metrics are no longer paid in the timed forward path, and sparse attention stops expanding grouped-query K/V into giant per-query-head gather tensors?","hypothesis":"Sharing static graph/cache objects across layers, computing graph metrics lazily outside the timed forward path, and switching the sparse path to grouped-query chunked execution should remove the T=4096 pre-row stall, materially reduce sparse-path peak memory, and preserve small-shape correctness.","change_set":["hcsa/integrations/qwen_torch.py","hcsa/torch/attention_wayfinder_sparse.py","scripts/bench_qwen35_cuda_wayfinder.py","hcsa/torch/__init__.py","tests/pytorch/test_torch_qwen_sparse_gqa.py","notes/LAB_NOTEBOOK.md","notes/experiments.ndjson"],"command":".venv/bin/python -m py_compile hcsa/integrations/qwen_torch.py hcsa/torch/attention_wayfinder_sparse.py scripts/bench_qwen35_cuda_wayfinder.py tests/pytorch/test_torch_qwen_sparse_gqa.py && .venv/bin/python -m pytest tests/pytorch/test_torch_qwen_sparse_gqa.py tests/pytorch/test_torch_causality.py tests/pytorch/test_torch_dense_limit_equivalence.py tests/pytorch/test_torch_matches_mlx_reference_small.py tests/test_qwen_cuda_wayfinder_cli.py -q","controls":{"no_benchmark_or_generation_inference":true,"runtime":".venv","torch":"2.10.0+cu130","transformers":"5.3.0","path":"sparse","strategy":"random","window":64,"landmark_stride":64,"num_cycles":1},"metrics":{"status":"completed","validation":{"py_compile":"pass","pytest":{"passed":20,"skipped":1,"failed":0}},"warnings":["existing torch.jit.script_method deprecation warnings","existing GB10 capability 12.1 vs PyTorch max advertised 12.0 warning"],"code_outcomes":["static sparse Qwen caches shared across wrapped layers by cache key","graph_metrics moved off cache-build/timed-forward path and collected lazily during profile harvest","Qwen sparse path now uses grouped-query chunked execution without repeating KV heads","benchmark cache clear flushes both per-layer caches and shared static Qwen cache","new regression tests cover grouped sparse equivalence, static-cache sharing, one-shot lazy metrics, dynamic non-sharing, and benchmark cache clearing"]},"decision":"keep","next_action":"Run the queued measurement-only checkpoint EXP-20260318T220001Z-QWEN35CUDA-SPARSE-4096-NOMETRICS before any longer sparse sweep, then compare peak memory and wall time against the interrupted EXP-20260318T213717Z-QWEN35CUDA-SPARSE-4096 baseline."}
{"id":"EXP-20260318T222540Z-QWEN35CUDA-SPARSE-4096-NOMETRICS-RERUN-PRERUN","date":"2026-03-18","question":"After the sparse runtime fixes, does the T=4096 Qwen CUDA sparse Hamiltonian run now complete cleanly with compute_graph_metrics=false, without any new current-boot NVIDIA or OOM kernel events?","hypothesis":"With shared static caches, lazy graph metrics, and grouped-query chunked sparse execution, the T=4096 sparse run should emit a real Wayfinder row instead of stalling pre-row. Peak memory and wall time should improve materially versus the interrupted EXP-20260318T213717Z-QWEN35CUDA-SPARSE-4096 attempt.","change_set":["measurement-only run on top of hcsa/integrations/qwen_torch.py","measurement-only run on top of hcsa/torch/attention_wayfinder_sparse.py","measurement-only run on top of scripts/bench_qwen35_cuda_wayfinder.py","notes/LAB_NOTEBOOK.md","notes/experiments.ndjson"],"command":".venv/bin/python scripts/bench_qwen35_cuda_wayfinder.py --model-path /home/hmbown/HF_Models/Qwen3.5-9B --seq-lens 4096 --path sparse --strategy random --engine auto --warmup 1 --repeats 1 --forward-target backbone --phases dense wayfinder --skip-divergence --output benchmarks/cuda/qwen35_wayfinder/EXP-20260318T222540Z-QWEN35CUDA-SPARSE-4096-NOMETRICS.ndjson && journalctl -b -k --since '2026-03-18 17:25:40' | rg -n 'NVRM|Xid|Out of memory|hung task|BUG:|Call Trace'","controls":{"baseline_run_path":"benchmarks/cuda/qwen35_wayfinder/EXP-20260318T213717Z-QWEN35CUDA-SPARSE-4096.ndjson","supplemental_baseline_path":"benchmarks/cuda/qwen35_wayfinder/EXP-20260318T213005Z-QWEN35CUDA-SPARSE-2048.ndjson","partial_abandoned_artifact":"benchmarks/cuda/qwen35_wayfinder/EXP-20260318T220001Z-QWEN35CUDA-SPARSE-4096-NOMETRICS.ndjson","one_process_at_a_time":true,"lock_file":"benchmarks/cuda/qwen35_wayfinder/.bench_qwen35_cuda_wayfinder.lock","retro_backfill_inference":"off","model_path":"/home/hmbown/HF_Models/Qwen3.5-9B","device":"cuda","gpu":"NVIDIA GB10","device_capability":[12,1],"torch":"2.10.0+cu130","transformers":"5.3.0","path":"sparse","strategy":"random","compute_graph_metrics":false,"forward_target":"backbone","window":64,"landmark_stride":64,"num_cycles":1,"engine_request":"auto","warmup":1,"repeats":1,"seq_lens":[4096],"kernel_log_since":"2026-03-18 17:25:40"},"metrics":{"status":"pending","artifacts_expected":["benchmarks/cuda/qwen35_wayfinder/EXP-20260318T222540Z-QWEN35CUDA-SPARSE-4096-NOMETRICS.ndjson"],"required":["bench[label=dense].median_ms","bench[label=dense].prefill_tok_per_sec","bench[label=dense].peak_mem_gb","bench[label=wayfinder].median_ms","bench[label=wayfinder].prefill_tok_per_sec","bench[label=wayfinder].peak_mem_gb","bench[label=wayfinder].wayfinder_profiles","bench[label=wayfinder].wayfinder_profiles[].path==sparse","bench[label=wayfinder].wayfinder_active_layers==8","zero new kernel fault lines after kernel_log_since"]},"decision":"pending","next_action":"Run the sparse 4096 no-metrics rerun, inspect the artifact and current-boot kernel log, and record RESULT with deltas versus the interrupted 4096 baseline and the completed 2048 sparse baseline."}
{"id":"EXP-20260318T222540Z-QWEN35CUDA-SPARSE-4096-NOMETRICS-RERUN-RESULT","date":"2026-03-18","question":"After the sparse runtime fixes, does the T=4096 Qwen CUDA sparse Hamiltonian run now complete cleanly with compute_graph_metrics=false, without any new current-boot NVIDIA or OOM kernel events?","hypothesis":"With shared static caches, lazy graph metrics, and grouped-query chunked sparse execution, the T=4096 sparse run should emit a real Wayfinder row instead of stalling pre-row. Peak memory and wall time should improve materially versus the interrupted EXP-20260318T213717Z-QWEN35CUDA-SPARSE-4096 attempt.","change_set":["measurement-only run on top of hcsa/integrations/qwen_torch.py","measurement-only run on top of hcsa/torch/attention_wayfinder_sparse.py","measurement-only run on top of scripts/bench_qwen35_cuda_wayfinder.py","notes/LAB_NOTEBOOK.md","notes/experiments.ndjson"],"command":".venv/bin/python scripts/bench_qwen35_cuda_wayfinder.py --model-path /home/hmbown/HF_Models/Qwen3.5-9B --seq-lens 4096 --path sparse --strategy random --engine auto --warmup 1 --repeats 1 --forward-target backbone --phases dense wayfinder --skip-divergence --output benchmarks/cuda/qwen35_wayfinder/EXP-20260318T222540Z-QWEN35CUDA-SPARSE-4096-NOMETRICS.ndjson && journalctl -b -k --since '2026-03-18 17:25:40' | rg -n 'NVRM|Xid|Out of memory|hung task|BUG:|Call Trace'","controls":{"baseline_run_path":"benchmarks/cuda/qwen35_wayfinder/EXP-20260318T213717Z-QWEN35CUDA-SPARSE-4096.ndjson","supplemental_baseline_path":"benchmarks/cuda/qwen35_wayfinder/EXP-20260318T213005Z-QWEN35CUDA-SPARSE-2048.ndjson","partial_abandoned_artifact":"benchmarks/cuda/qwen35_wayfinder/EXP-20260318T220001Z-QWEN35CUDA-SPARSE-4096-NOMETRICS.ndjson","one_process_at_a_time":true,"lock_file":"benchmarks/cuda/qwen35_wayfinder/.bench_qwen35_cuda_wayfinder.lock","retro_backfill_inference":"off","model_path":"/home/hmbown/HF_Models/Qwen3.5-9B","device":"cuda","gpu":"NVIDIA GB10","device_capability":[12,1],"torch":"2.10.0+cu130","transformers":"5.3.0","path":"sparse","strategy":"random","compute_graph_metrics":false,"forward_target":"backbone","window":64,"landmark_stride":64,"num_cycles":1,"engine_request":"auto","warmup":1,"repeats":1,"seq_lens":[4096],"kernel_log_since":"2026-03-18 17:25:40"},"metrics":{"status":"completed","artifact":"benchmarks/cuda/qwen35_wayfinder/EXP-20260318T222540Z-QWEN35CUDA-SPARSE-4096-NOMETRICS.ndjson","kernel_fault_lines_after_start":0,"dense":{"median_ms":2476.75,"prefill_tok_per_sec":1653.8,"peak_mem_gb":17.54},"wayfinder":{"median_ms":5963.43,"prefill_tok_per_sec":686.9,"peak_mem_gb":17.57,"wayfinder_active_layers":8,"wayfinder_graph_cache_entries_total":8,"engine":"batched"},"wayfinder_profile_summary":{"path":"sparse","graph_source":"runtime","graph_cache_hit_all_layers":true,"graph_metrics_present":false,"per_layer_graph_build_ms_range":[0.03129600008833222,0.0448320024588611]},"delta_vs_dense_abs":{"median_ms":3486.68,"prefill_tok_per_sec":-966.9,"peak_mem_gb":0.03},"delta_vs_dense_pct":{"median_ms":140.78,"prefill_tok_per_sec":-58.47,"peak_mem_gb":0.17},"memory_reduction_pct_convention":"100*(1-wayfinder/dense)","memory_reduction_pct":-0.17,"dense_delta_vs_interrupted_4096_abs":{"median_ms":-62.26,"prefill_tok_per_sec":40.6,"peak_mem_gb":0.0},"dense_delta_vs_interrupted_4096_pct":{"median_ms":-2.45,"prefill_tok_per_sec":2.52,"peak_mem_gb":0.0},"wayfinder_delta_vs_completed_sparse_2048_abs":{"median_ms":3017.39,"prefill_tok_per_sec":-8.3,"peak_mem_gb":-8.88},"wayfinder_delta_vs_completed_sparse_2048_pct":{"median_ms":102.42,"prefill_tok_per_sec":-1.19,"peak_mem_gb":-33.57},"memory_reduction_vs_completed_sparse_2048_pct":33.57,"wayfinder_peak_memory_delta_vs_interrupted_observed_gpu_mem_abs_gb":-33.17,"wayfinder_peak_memory_reduction_vs_interrupted_observed_gpu_mem_pct":65.37},"decision":"keep","next_action":"Because T=4096 now completes cleanly and memory is bounded, the next guarded checkpoint should be T=8192 sparse with compute_graph_metrics=false under the same controls before re-enabling graph diagnostics or testing alternative Hamiltonian strategies."}
{"id":"EXP-20260318T224711Z-QWEN35CUDA-HCSA-KAPPA-GATHER-PRERUN","date":"2026-03-18","question":"Can the Qwen CUDA Wayfinder/HCSA kernel lower empirical kappa at T=4096 by removing duplicate grouped-query K/V gather work and staging K/V materialization so the hot path moves less data at once?","hypothesis":"At the current graph family (window=64, landmark_stride=64, num_cycles=1), D(4096) ~= 97, so the path to a lower kappa is reducing the realization constant factor b, not changing the graph. Reusing one gathered K/V neighborhood across all query heads in the same KV group and delaying V gather until after weights are known should materially reduce per-layer attn_kernel_ms, improve T=4096 Wayfinder/HCSA latency and tok/s, and move the dense crossover earlier than the current ~32130-token estimate without weakening causality or activation coverage.","change_set":["planned edits to hcsa/torch/attention_wayfinder_sparse.py","possible small wiring-only edits to hcsa/integrations/qwen_torch.py","possible regression coverage updates in tests/pytorch/test_torch_qwen_sparse_gqa.py","notes/LAB_NOTEBOOK.md","notes/experiments.ndjson"],"command":".venv/bin/python -m py_compile hcsa/integrations/qwen_torch.py hcsa/torch/attention_wayfinder_sparse.py scripts/bench_qwen35_cuda_wayfinder.py tests/pytorch/test_torch_qwen_sparse_gqa.py && .venv/bin/python -m pytest tests/pytorch/test_torch_qwen_sparse_gqa.py tests/pytorch/test_torch_causality.py tests/pytorch/test_torch_dense_limit_equivalence.py tests/pytorch/test_torch_matches_mlx_reference_small.py tests/test_qwen_cuda_wayfinder_cli.py -q && .venv/bin/python scripts/bench_qwen35_cuda_wayfinder.py --model-path /home/hmbown/HF_Models/Qwen3.5-9B --seq-lens 4096 --path sparse --strategy random --engine auto --warmup 1 --repeats 1 --forward-target backbone --phases dense wayfinder --skip-divergence --output benchmarks/cuda/qwen35_wayfinder/EXP-20260318T224711Z-QWEN35CUDA-HCSA-4096-KAPPA-GATHER.ndjson && journalctl -b -k --since '2026-03-18 17:49:06 CDT' | rg -n 'NVRM|Xid|Out of memory|hung task|BUG:|Call Trace'","controls":{"baseline_run_path":"benchmarks/cuda/qwen35_wayfinder/EXP-20260318T222540Z-QWEN35CUDA-SPARSE-4096-NOMETRICS.ndjson","one_process_at_a_time":true,"lock_file":"benchmarks/cuda/qwen35_wayfinder/.bench_qwen35_cuda_wayfinder.lock","retro_backfill_inference":"off","model_path":"/home/hmbown/HF_Models/Qwen3.5-9B","device":"cuda","gpu":"NVIDIA GB10","device_capability":[12,1],"torch":"2.10.0+cu130","transformers":"5.3.0","path":"sparse","strategy":"random","compute_graph_metrics":false,"forward_target":"backbone","window":64,"landmark_stride":64,"num_cycles":1,"engine_request":"auto","warmup":1,"repeats":1,"seq_lens":[4096],"degree_estimate":97.0,"baseline_dense_ms":2476.75,"baseline_wayfinder_ms":5963.43,"baseline_kappa":101.67218755040433,"baseline_crossover_tokens":32129.999483962263,"kernel_log_since":"2026-03-18 17:49:06 CDT"},"metrics":{"status":"pending","artifacts_expected":["benchmarks/cuda/qwen35_wayfinder/EXP-20260318T224711Z-QWEN35CUDA-HCSA-4096-KAPPA-GATHER.ndjson"],"required":["py_compile exits 0","targeted pytest exits 0","bench[label=dense].median_ms","bench[label=dense].prefill_tok_per_sec","bench[label=dense].peak_mem_gb","bench[label=wayfinder].median_ms","bench[label=wayfinder].prefill_tok_per_sec","bench[label=wayfinder].peak_mem_gb","bench[label=wayfinder].wayfinder_profiles","bench[label=wayfinder].wayfinder_active_layers==8","zero new kernel fault lines after kernel_log_since","recomputed kappa < 101.67218755040433","updated crossover estimate earlier than 32129.999483962263"]},"decision":"pending","next_action":"Patch the Wayfinder/HCSA kernel to remove duplicate grouped-query gather work, validate with the non-inference gate, run the guarded T=4096 checkpoint, and only then decide whether the ladder can continue to T=8192."}
