{"id":"EXP-20260219T040010Z-GLM47-STRICT-OBS-RERUN-PRERUN","date":"2026-02-19","question":"After explicit fallback-reason labeling, do wayfinder decode fallback traces remain OOM-safe and become fully informative (no unspecified) at T=8192 and T=32768?","hypothesis":"Adding dense_fallback_reason labels in GLM wayfinder dense-fallback paths will remove unspecified counts while preserving prior OOM-safe behavior.","change_set":["hcsa/integrations/glm_mlx.py: emit explicit dense_fallback_reason labels for all dense fallback routes"],"command":"gtimeout 2400 python3 scripts/bench_glm_consumer_mlx.py --model-path mlx-community/GLM-4.7-Flash-4bit --mode wayfinder --seq-lens 8192 --decode-len 32 --repeats 1 --chunk-size 4096 --kv-step 4096 --cooldown-sec 0 --window 64 --head-chunk-size 2 --query-chunk-size 384 --debug-wayfinder-decode-backend dense --skip-multi-turn --skip-quality --seed 42 --out-dir benchmarks/mlx/first_release/EXP-20260219T040010Z-GLM47-STRICT-OBS-RERUN/wayfinder_t8192_s42 && gtimeout 2400 python3 scripts/bench_glm_consumer_mlx.py --model-path mlx-community/GLM-4.7-Flash-4bit --mode wayfinder --seq-lens 32768 --decode-len 32 --repeats 1 --chunk-size 4096 --kv-step 4096 --cooldown-sec 0 --window 64 --head-chunk-size 2 --query-chunk-size 384 --debug-wayfinder-decode-backend dense --skip-multi-turn --skip-quality --seed 42 --out-dir benchmarks/mlx/first_release/EXP-20260219T040010Z-GLM47-STRICT-OBS-RERUN/wayfinder_t32768_s42","controls":{"model":"mlx-community/GLM-4.7-Flash-4bit","entrypoint":"scripts/bench_glm_consumer_mlx.py","run_root":"benchmarks/mlx/first_release/EXP-20260219T040010Z-GLM47-STRICT-OBS-RERUN","seq_lens":[8192,32768],"decode_len":32,"repeats":1,"chunk_size":4096,"kv_step":4096,"cooldown_sec":0,"skip_multi_turn":true,"skip_quality":true,"seed":42,"wayfinder":{"window":64,"head_chunk_size":2,"query_chunk_size":384,"decode_backend":"dense"},"retro_backfill_inference":"off","one_process_at_a_time":true,"safety_cap_peak_memory_bytes":28000000000,"baseline_path":"benchmarks/mlx/first_release/EXP-20260219T032934Z-GLM47-FALSIFY-VALIDATE/falsification_summary.json","stop_gates":["nonzero exit","timeout","missing results.json","missing usable single_turn row","observability_fallback_share_known=false","decode fallback not observed","prefill fallback > 0","dense_fallback_reason_counts includes unspecified/empty","no informative fallback reasons","peak memory over 28GB cap"]},"metrics":{"status":"pending","required":["per_run single_turn.path_counts","per_run single_turn.dense_fallback_reason_counts","per_run single_turn.dense_fallback_share_decode_steps","per_run single_turn.dense_fallback_share_prefill_steps","per_run single_turn.observability_fallback_share_known","per_run single_turn.peak_memory_bytes","strict gate report with pass/fail per run","absolute + delta + percent delta vs EXP-20260219T032934Z baseline rows"]},"decision":"pending","next_action":"Execute sequential rerun, compute strict observability gate report, and append RESULT entry."}
{"id":"EXP-20260219T040010Z-GLM47-STRICT-OBS-RERUN-RESULT","date":"2026-02-19","question":"After explicit fallback-reason labeling, do wayfinder decode fallback traces remain OOM-safe and become fully informative (no unspecified) at T=8192 and T=32768?","hypothesis":"Adding dense_fallback_reason labels in GLM wayfinder dense-fallback paths will remove unspecified counts while preserving prior OOM-safe behavior.","change_set":["hcsa/integrations/glm_mlx.py: emit explicit dense_fallback_reason labels for all dense fallback routes","measurement only reruns at T=8192 and T=32768 in wayfinder mode"],"command":"gtimeout 2400 python3 scripts/bench_glm_consumer_mlx.py --model-path mlx-community/GLM-4.7-Flash-4bit --mode wayfinder --seq-lens 8192 --decode-len 32 --repeats 1 --chunk-size 4096 --kv-step 4096 --cooldown-sec 0 --window 64 --head-chunk-size 2 --query-chunk-size 384 --debug-wayfinder-decode-backend dense --skip-multi-turn --skip-quality --seed 42 --out-dir benchmarks/mlx/first_release/EXP-20260219T040010Z-GLM47-STRICT-OBS-RERUN/wayfinder_t8192_s42 && gtimeout 2400 python3 scripts/bench_glm_consumer_mlx.py --model-path mlx-community/GLM-4.7-Flash-4bit --mode wayfinder --seq-lens 32768 --decode-len 32 --repeats 1 --chunk-size 4096 --kv-step 4096 --cooldown-sec 0 --window 64 --head-chunk-size 2 --query-chunk-size 384 --debug-wayfinder-decode-backend dense --skip-multi-turn --skip-quality --seed 42 --out-dir benchmarks/mlx/first_release/EXP-20260219T040010Z-GLM47-STRICT-OBS-RERUN/wayfinder_t32768_s42","controls":{"model":"mlx-community/GLM-4.7-Flash-4bit","entrypoint":"scripts/bench_glm_consumer_mlx.py","run_root":"benchmarks/mlx/first_release/EXP-20260219T040010Z-GLM47-STRICT-OBS-RERUN","seq_lens":[8192,32768],"decode_len":32,"repeats":1,"chunk_size":4096,"kv_step":4096,"cooldown_sec":0,"skip_multi_turn":true,"skip_quality":true,"seed":42,"wayfinder":{"window":64,"head_chunk_size":2,"query_chunk_size":384,"decode_backend":"dense"},"retro_backfill_inference":"off","one_process_at_a_time":true,"safety_cap_peak_memory_bytes":28000000000,"baseline_paths":{"strict_baseline_8192":"benchmarks/mlx/first_release/EXP-20260219T032934Z-GLM47-FALSIFY-VALIDATE/wayfinder_t8192_s42/results.json","strict_baseline_32768":"benchmarks/mlx/first_release/EXP-20260219T032934Z-GLM47-FALSIFY-VALIDATE/wayfinder_t32768_s42/results.json"}},"metrics":{"status":"completed","summary_artifact":"benchmarks/mlx/first_release/EXP-20260219T040010Z-GLM47-STRICT-OBS-RERUN/strict_obs_gate_report.json","gate_passed":true,"gate_violations":[],"cases":{"wayfinder_t8192_s42":{"candidate":{"e2e_sec":10.663361166996765,"prefill_sec":9.86591429199325,"decode_sec":0.7974468750035157,"decode_tok_s":40.12806495712824,"peak_memory_bytes":20071482232,"path_counts":{"wayfinder":16,"wayfinder_dense_fallback":256},"dense_fallback_reason_counts":{"wayfinder_decode_dense":256},"dense_fallback_share_decode_steps":1.0,"dense_fallback_share_prefill_steps":0.0,"observability_fallback_share_known":true},"delta_vs_baseline_abs":{"e2e_sec":-0.1357303340046201,"prefill_sec":-0.1820996250025928,"decode_sec":0.04636929099797271,"decode_tok_s":-2.4773871046175415,"peak_memory_bytes":0},"delta_vs_baseline_pct":{"e2e_sec":-1.2568680799864878,"prefill_sec":-1.8122947132326126,"decode_sec":6.173701889847707,"decode_tok_s":-5.81471850369572,"peak_memory_bytes":0.0}},"wayfinder_t32768_s42":{"candidate":{"e2e_sec":188.7892819999979,"prefill_sec":181.34925137499522,"decode_sec":7.4400306250026915,"decode_tok_s":4.301057564529638,"peak_memory_bytes":21978678158,"path_counts":{"wayfinder":64,"wayfinder_dense_fallback":256},"dense_fallback_reason_counts":{"wayfinder_decode_dense":256},"dense_fallback_share_decode_steps":1.0,"dense_fallback_share_prefill_steps":0.0,"observability_fallback_share_known":true},"delta_vs_baseline_abs":{"e2e_sec":36.70202929100196,"prefill_sec":34.094824665997294,"decode_sec":2.6072046250046697,"decode_tok_s":-2.320327107712462,"peak_memory_bytes":0},"delta_vs_baseline_pct":{"e2e_sec":24.13221926049759,"prefill_sec":23.153684020226432,"decode_sec":53.94782731688947,"decode_tok_s":-35.04292867079061,"peak_memory_bytes":0.0}}}},"decision":"keep","next_action":"Keep fallback-reason observability patch; if performance stability remains a concern, rerun paired dense+wayfinder with thermal/state controls before updating headline performance claims."}
{"id":"EXP-20260219T145347Z-PUBLIC-LAUNCH-DOCS-RESULT","date":"2026-02-19","question":"Can we ship a decision-complete public launch documentation package that clarifies Wayfinder's mechanism, validated scope, and release controls without changing runtime behavior?","hypothesis":"A docs-first package (positioning, glossary, visual storyboard, release gate, security/contributing policy) plus README/architecture integration will improve public clarity and trust while preserving existing technical claims.","change_set":["README.md: add launch snapshot, visual story sequence, release-controls status table, and links to new public docs","docs/ARCHITECTURE.md: add links to positioning/release gate docs and new visual references","docs/FIRST_RELEASE.md: add links to release controls and positioning contract",".gitignore: unignore new markdown policy/docs files","add docs/PUBLIC_POSITIONING.md","add docs/GLOSSARY.md","add docs/VISUAL_STORYBOARD.md","add docs/RELEASE_GATE.md","add SECURITY.md","add CONTRIBUTING.md","add scripts/viz/wayfinder_metric_card.py","generate docs/assets/attention_comparison_5panel.png","generate docs/assets/wayfinder_metric_card.png"],"command":"python3 scripts/viz/attention_pattern_comparison.py --seq-len 64 --window 8 --out docs/assets/attention_comparison_5panel.png && python3 scripts/viz/graph_viz.py --seq-len 32 --window 4 --landmark-stride 8 --out docs/assets/hcsa_graph_circle.png && python3 scripts/viz/wayfinder_metric_card.py --stable-summary-json benchmarks/mlx/first_release/EXP-20260218T151213Z-STABLE-PROFILE/stable_profile_summary.json --out docs/assets/wayfinder_metric_card.png && python3 -m py_compile scripts/viz/wayfinder_metric_card.py","controls":{"mode":"documentation/visualization only","benchmark_execution":"none","runtime_behavior_change":"none","evidence_source_locked_to":"docs/FIRST_RELEASE.md and existing stable-profile artifacts"},"metrics":{"status":"completed","new_docs_files":6,"updated_docs_files":4,"new_policy_files":2,"new_script_files":1,"generated_assets":["docs/assets/attention_comparison_5panel.png","docs/assets/hcsa_graph_circle.png","docs/assets/wayfinder_metric_card.png"],"validation_checks":{"metric_card_compile":"pass","visual_generation_commands":"pass"}},"decision":"keep","next_action":"Run a final reviewer pass on messaging tone and then publish as phased soft-launch documentation baseline."}
{"id":"EXP-20260219T210000Z-QWEN3-4B-CONSUMER-T2048-PRERUN","date":"2026-02-19","question":"On Qwen3-4B-4bit at T=2048 (decode_len=64), what are dense vs Wayfinder single-turn throughput/latency/peak-memory and what is the observed dense-fallback share (with informative reasons if fallback occurs)?","hypothesis":"At T=2048, Wayfinder may be slower than dense but should remain stable with auditable fallback behavior; if fallback occurs, reason counts should be informative (no 'unspecified').","change_set":["measurement only"],"command":"python3 scripts/bench_qwen_consumer_mlx.py --model-path mlx-community/Qwen3-4B-4bit --mode dense --seq-lens 2048 --decode-len 64 --repeats 3 --chunk-size 4096 --kv-step 4096 --cooldown-sec 0 --seed 42 --skip-multi-turn --skip-quality --out-dir benchmarks/mlx/qwen3_4b_wayfinder/queue_20260219T210000Z/t2048/dense && python3 scripts/bench_qwen_consumer_mlx.py --model-path mlx-community/Qwen3-4B-4bit --mode wayfinder --seq-lens 2048 --decode-len 64 --repeats 3 --chunk-size 4096 --kv-step 4096 --cooldown-sec 0 --window 64 --landmark-stride 64 --num-cycles 1 --head-chunk-size 2 --query-chunk-size 384 --seed 42 --skip-multi-turn --skip-quality --out-dir benchmarks/mlx/qwen3_4b_wayfinder/queue_20260219T210000Z/t2048/wayfinder","controls":{"model":"mlx-community/Qwen3-4B-4bit","entrypoint":"scripts/bench_qwen_consumer_mlx.py","seq_len":2048,"decode_len":64,"repeats":3,"chunk_size":4096,"kv_step":4096,"cooldown_sec":0,"seed":42,"skip_multi_turn":true,"skip_quality":true,"retro_backfill_inference":"off","wayfinder":{"window":64,"landmark_stride":64,"num_cycles":1,"head_chunk_size":2,"query_chunk_size":384},"baseline_path":"benchmarks/mlx/qwen3_4b_wayfinder/queue_20260219T210000Z/t2048/dense/results.json","stop_gates":["nonzero exit","missing results.json","timeout/hang","fallback present but reasons missing/unspecified","observability_fallback_share_known must be true"]},"metrics":{"status":"pending","artifacts_expected":["benchmarks/mlx/qwen3_4b_wayfinder/queue_20260219T210000Z/t2048/dense/results.json","benchmarks/mlx/qwen3_4b_wayfinder/queue_20260219T210000Z/t2048/wayfinder/results.json"],"required":["single_turn[].prefill_sec","single_turn[].decode_sec","single_turn[].e2e_sec","single_turn[].decode_tok_s","single_turn[].peak_memory_bytes","single_turn[].path_counts","single_turn[].dense_fallback_reason_counts","single_turn[].dense_fallback_share_run","single_turn[].dense_fallback_share_decode_steps","single_turn[].observability_fallback_share_known"]},"decision":"pending","next_action":"Run dense then wayfinder; compute absolute metrics and deltas vs dense; append RESULT entry."}
{"id":"EXP-20260219T210000Z-QWEN3-4B-CONSUMER-T8192-PRERUN","date":"2026-02-19","question":"On Qwen3-4B-4bit at T=8192 (decode_len=64), what are dense vs Wayfinder single-turn throughput/latency/peak-memory and what is the observed dense-fallback share (with informative reasons if fallback occurs)?","hypothesis":"At T=8192, Wayfinder should begin to show clearer memory/throughput tradeoffs; any dense fallback must be explainable via informative reason counts.","change_set":["measurement only"],"command":"python3 scripts/bench_qwen_consumer_mlx.py --model-path mlx-community/Qwen3-4B-4bit --mode dense --seq-lens 8192 --decode-len 64 --repeats 3 --chunk-size 4096 --kv-step 4096 --cooldown-sec 0 --seed 42 --skip-multi-turn --skip-quality --out-dir benchmarks/mlx/qwen3_4b_wayfinder/queue_20260219T210000Z/t8192/dense && python3 scripts/bench_qwen_consumer_mlx.py --model-path mlx-community/Qwen3-4B-4bit --mode wayfinder --seq-lens 8192 --decode-len 64 --repeats 3 --chunk-size 4096 --kv-step 4096 --cooldown-sec 0 --window 64 --landmark-stride 64 --num-cycles 1 --head-chunk-size 2 --query-chunk-size 384 --seed 42 --skip-multi-turn --skip-quality --out-dir benchmarks/mlx/qwen3_4b_wayfinder/queue_20260219T210000Z/t8192/wayfinder","controls":{"model":"mlx-community/Qwen3-4B-4bit","entrypoint":"scripts/bench_qwen_consumer_mlx.py","seq_len":8192,"decode_len":64,"repeats":3,"chunk_size":4096,"kv_step":4096,"cooldown_sec":0,"seed":42,"skip_multi_turn":true,"skip_quality":true,"retro_backfill_inference":"off","wayfinder":{"window":64,"landmark_stride":64,"num_cycles":1,"head_chunk_size":2,"query_chunk_size":384},"baseline_path":"benchmarks/mlx/qwen3_4b_wayfinder/queue_20260219T210000Z/t8192/dense/results.json","stop_gates":["nonzero exit","missing results.json","timeout/hang","fallback present but reasons missing/unspecified","observability_fallback_share_known must be true"]},"metrics":{"status":"pending","artifacts_expected":["benchmarks/mlx/qwen3_4b_wayfinder/queue_20260219T210000Z/t8192/dense/results.json","benchmarks/mlx/qwen3_4b_wayfinder/queue_20260219T210000Z/t8192/wayfinder/results.json"],"required":["single_turn[].prefill_sec","single_turn[].decode_sec","single_turn[].e2e_sec","single_turn[].decode_tok_s","single_turn[].peak_memory_bytes","single_turn[].path_counts","single_turn[].dense_fallback_reason_counts","single_turn[].dense_fallback_share_run","single_turn[].dense_fallback_share_decode_steps","single_turn[].observability_fallback_share_known"]},"decision":"pending","next_action":"Run dense then wayfinder; compute absolute metrics and deltas vs dense; append RESULT entry."}
{"id":"EXP-20260219T210000Z-QWEN3-30B-A3B-CONSUMER-T2048-PRERUN","date":"2026-02-19","question":"On Qwen3-30B-A3B-4bit at T=2048 (decode_len=64), what are dense vs Wayfinder single-turn throughput/latency/peak-memory and what is the observed dense-fallback share (with informative reasons if fallback occurs)?","hypothesis":"At T=2048, Wayfinder should run stably on the A3B model; if fallback occurs, it should be auditable via informative reason counts and not appear as silent dense routing.","change_set":["measurement only"],"command":"python3 scripts/bench_qwen_consumer_mlx.py --model-path mlx-community/Qwen3-30B-A3B-4bit --mode dense --seq-lens 2048 --decode-len 64 --repeats 1 --chunk-size 4096 --kv-step 4096 --cooldown-sec 10 --seed 42 --skip-multi-turn --skip-quality --out-dir benchmarks/mlx/qwen3_30b_a3b_wayfinder/queue_20260219T210000Z/t2048/dense && python3 scripts/bench_qwen_consumer_mlx.py --model-path mlx-community/Qwen3-30B-A3B-4bit --mode wayfinder --seq-lens 2048 --decode-len 64 --repeats 1 --chunk-size 4096 --kv-step 4096 --cooldown-sec 10 --window 64 --landmark-stride 64 --num-cycles 1 --head-chunk-size 2 --query-chunk-size 384 --seed 42 --skip-multi-turn --skip-quality --out-dir benchmarks/mlx/qwen3_30b_a3b_wayfinder/queue_20260219T210000Z/t2048/wayfinder","controls":{"model":"mlx-community/Qwen3-30B-A3B-4bit","entrypoint":"scripts/bench_qwen_consumer_mlx.py","seq_len":2048,"decode_len":64,"repeats":1,"chunk_size":4096,"kv_step":4096,"cooldown_sec":10,"seed":42,"skip_multi_turn":true,"skip_quality":true,"retro_backfill_inference":"off","wayfinder":{"window":64,"landmark_stride":64,"num_cycles":1,"head_chunk_size":2,"query_chunk_size":384},"baseline_path":"benchmarks/mlx/qwen3_30b_a3b_wayfinder/queue_20260219T210000Z/t2048/dense/results.json","stop_gates":["nonzero exit","missing results.json","timeout/hang","fallback present but reasons missing/unspecified","observability_fallback_share_known must be true"]},"metrics":{"status":"pending","artifacts_expected":["benchmarks/mlx/qwen3_30b_a3b_wayfinder/queue_20260219T210000Z/t2048/dense/results.json","benchmarks/mlx/qwen3_30b_a3b_wayfinder/queue_20260219T210000Z/t2048/wayfinder/results.json"],"required":["single_turn[].prefill_sec","single_turn[].decode_sec","single_turn[].e2e_sec","single_turn[].decode_tok_s","single_turn[].peak_memory_bytes","single_turn[].path_counts","single_turn[].dense_fallback_reason_counts","single_turn[].dense_fallback_share_run","single_turn[].dense_fallback_share_decode_steps","single_turn[].observability_fallback_share_known"]},"decision":"pending","next_action":"Run dense then wayfinder; compute absolute metrics and deltas vs dense; append RESULT entry."}
{"id":"EXP-20260219T210000Z-QWEN3-30B-A3B-CONSUMER-T8192-PRERUN","date":"2026-02-19","question":"On Qwen3-30B-A3B-4bit at T=8192 (decode_len=64), what are dense vs Wayfinder single-turn throughput/latency/peak-memory and what is the observed dense-fallback share (with informative reasons if fallback occurs)?","hypothesis":"At T=8192, Wayfinder should either (a) run with measurable tradeoffs vs dense and auditable fallback behavior, or (b) fail fast via explicit stop-gates (OOM/nonzero/missing artifacts) so we do not record partial outputs as evidence.","change_set":["measurement only"],"command":"python3 scripts/bench_qwen_consumer_mlx.py --model-path mlx-community/Qwen3-30B-A3B-4bit --mode dense --seq-lens 8192 --decode-len 64 --repeats 1 --chunk-size 4096 --kv-step 4096 --cooldown-sec 10 --seed 42 --skip-multi-turn --skip-quality --out-dir benchmarks/mlx/qwen3_30b_a3b_wayfinder/queue_20260219T210000Z/t8192/dense && python3 scripts/bench_qwen_consumer_mlx.py --model-path mlx-community/Qwen3-30B-A3B-4bit --mode wayfinder --seq-lens 8192 --decode-len 64 --repeats 1 --chunk-size 4096 --kv-step 4096 --cooldown-sec 10 --window 64 --landmark-stride 64 --num-cycles 1 --head-chunk-size 2 --query-chunk-size 384 --seed 42 --skip-multi-turn --skip-quality --out-dir benchmarks/mlx/qwen3_30b_a3b_wayfinder/queue_20260219T210000Z/t8192/wayfinder","controls":{"model":"mlx-community/Qwen3-30B-A3B-4bit","entrypoint":"scripts/bench_qwen_consumer_mlx.py","seq_len":8192,"decode_len":64,"repeats":1,"chunk_size":4096,"kv_step":4096,"cooldown_sec":10,"seed":42,"skip_multi_turn":true,"skip_quality":true,"retro_backfill_inference":"off","wayfinder":{"window":64,"landmark_stride":64,"num_cycles":1,"head_chunk_size":2,"query_chunk_size":384},"baseline_path":"benchmarks/mlx/qwen3_30b_a3b_wayfinder/queue_20260219T210000Z/t8192/dense/results.json","stop_gates":["nonzero exit","missing results.json","timeout/hang","fallback present but reasons missing/unspecified","observability_fallback_share_known must be true"]},"metrics":{"status":"pending","artifacts_expected":["benchmarks/mlx/qwen3_30b_a3b_wayfinder/queue_20260219T210000Z/t8192/dense/results.json","benchmarks/mlx/qwen3_30b_a3b_wayfinder/queue_20260219T210000Z/t8192/wayfinder/results.json"],"required":["single_turn[].prefill_sec","single_turn[].decode_sec","single_turn[].e2e_sec","single_turn[].decode_tok_s","single_turn[].peak_memory_bytes","single_turn[].path_counts","single_turn[].dense_fallback_reason_counts","single_turn[].dense_fallback_share_run","single_turn[].dense_fallback_share_decode_steps","single_turn[].observability_fallback_share_known"]},"decision":"pending","next_action":"Run dense then wayfinder; compute absolute metrics and deltas vs dense; append RESULT entry."}
