{"id": "EXP-20260212T013118Z-GLM-LAST4-HELDOUT-RESULT", "date": "2026-02-12", "question": "On the 24-task held-out extract-heavy set, do last4 and last4+t16384 remain dense-like before default lock?", "hypothesis": "Both variants remain near dense and outperform full-wayfinder on held-out extract tasks.", "change_set": ["benchmarks/mlx/glm_4_7_flash_4bit_wayfinder/quality_eval_glm47_consumer_extract_holdout_v1.json"], "command": "Run holdout quartet via scripts/bench_glm_consumer_mlx.py at seed 42 for dense/full/last4/last4_t16384 in quality-only mode; summarize to heldout_quality_summary.json and heldout_category_summary.json", "controls": {"run_root": "/Volumes/VIXinSSD/wayfinder/benchmarks/mlx/post_reboot_20260211_20260211T202821Z/last4_confirmation_gate_20260212T013118Z", "dataset": "benchmarks/mlx/glm_4_7_flash_4bit_wayfinder/quality_eval_glm47_consumer_extract_holdout_v1.json", "seed": 42, "fixed": {"model": "mlx-community/GLM-4.7-Flash-4bit", "seq_len": 8192, "decode_len": 64, "chunk_size": 4096, "kv_step": 4096, "path": "permute", "window": 64, "landmark_stride": 0, "head_chunk_size": 2, "query_chunk_size": 192, "skip_single_turn": true, "skip_multi_turn": true, "retro_backfill_default_inference_off": true}, "baseline_dense_path": "holdout_s42_dense/results.json", "baseline_full_wayfinder_path": "holdout_s42_full_wayfinder/results.json"}, "metrics": {"artifacts": ["/Volumes/VIXinSSD/wayfinder/benchmarks/mlx/post_reboot_20260211_20260211T202821Z/last4_confirmation_gate_20260212T013118Z/heldout_quality_summary.json", "/Volumes/VIXinSSD/wayfinder/benchmarks/mlx/post_reboot_20260211_20260211T202821Z/last4_confirmation_gate_20260212T013118Z/heldout_category_summary.json", "/Volumes/VIXinSSD/wayfinder/benchmarks/mlx/post_reboot_20260211_20260211T202821Z/last4_confirmation_gate_20260212T013118Z/run_holdout_20260212T023038Z.log"], "dense": {"accuracy_abs": 0.125, "correct_abs": 3, "num_tasks_abs": 24}, "full_wayfinder": {"accuracy_abs": 0.0, "correct_abs": 0, "num_tasks_abs": 24, "delta_vs_dense_abs": -0.125, "delta_vs_dense_pct": -100.0}, "last4": {"accuracy_abs": 0.16666666666666666, "correct_abs": 4, "num_tasks_abs": 24, "drift_vs_dense_abs": 0.04166666666666666, "delta_vs_dense_pct": 33.33333333333333, "delta_vs_full_wayfinder_abs": 0.16666666666666666}, "last4_t16384": {"accuracy_abs": 0.16666666666666666, "correct_abs": 4, "num_tasks_abs": 24, "drift_vs_dense_abs": 0.04166666666666666, "delta_vs_dense_pct": 33.33333333333333, "delta_vs_full_wayfinder_abs": 0.16666666666666666}, "extract_category": {"dense_abs": 0.1875, "full_wayfinder_abs": 0.0, "last4_abs": 0.25, "last4_t16384_abs": 0.25, "last4_delta_vs_dense_abs": 0.0625, "last4_delta_vs_dense_pct": 33.33333333333333}}, "decision": "follow-up", "next_action": "Held-out quality supports last4 variants, but keep default lock blocked until confirmation memory gate (<= +1% vs dense) passes."}
{"id":"EXP-20260212T024915Z-GLM-DECODE-FASTPATH-PRERUN","date":"2026-02-12","question":"Can a strict q_len=1 decode specialization in GLM Wayfinder permute path beat dense decode throughput at seq_len=8192 while preserving quality and memory non-regression?","hypothesis":"Decode slowdown is dominated by active-permute q_len=1 overhead; a decode-specialized dispatch/gating change will push candidate median decode tok/s to >=5% over dense.","change_set":["planned edits in hcsa/integrations/glm_mlx.py decode gating/specialization","supporting kernel dispatch edits only if profiling evidence requires"],"command":"Run dense and candidate via scripts/bench_glm_consumer_mlx.py with fixed controls (seq_len=8192, decode_len=64, repeats>=3, seeds 42/7/99), then held-out seed42 run on quality_eval_glm47_consumer_extract_holdout_v1.json.","controls":{"baseline_run_root":"/Volumes/VIXinSSD/wayfinder/benchmarks/mlx/post_reboot_20260211_20260211T202821Z/last4_confirmation_gate_20260212T013118Z","fixed":{"model":"mlx-community/GLM-4.7-Flash-4bit","seq_len":8192,"decode_len":64,"chunk_size":4096,"kv_step":4096,"path":"permute","window":64,"head_chunk_size":2,"query_chunk_size":192,"seeds":[42,7,99],"retro_backfill_default_inference_off":true}},"metrics":{"status":"pending","required":["dense_decode_tok_s_median","candidate_decode_tok_s_median","decode_delta_vs_dense_abs","decode_delta_vs_dense_pct","quality_drift_vs_dense","peak_memory_delta_vs_dense_abs","peak_memory_delta_vs_dense_pct","heldout_drift_vs_dense"]},"decision":"pending","next_action":"Capture profile evidence, implement candidate(s), run compact sweep, then execute full acceptance gate."}
{"id":"EXP-20260212T024915Z-GLM-DECODE-FASTPATH-RESULT","date":"2026-02-12","question":"Can a strict q_len=1 decode specialization in GLM Wayfinder permute path beat dense decode throughput at seq_len=8192 while preserving quality and memory non-regression?","hypothesis":"Decode slowdown is dominated by q_len=1 active-permute full-prefill overhead; forcing small-query gather dispatch should recover throughput.","change_set":["hcsa/integrations/glm_mlx.py: pass prefer_gather_for_small_tq for q_len==1 decode","hcsa/mlx/attention.py: plumb prefer_gather_for_small_tq through active fused dispatch","hcsa/mlx/fused_attention.py: add small-query gather specialization in wayfinder_fused_permute_window_attention_active"],"command":"Run dense and candidate with scripts/bench_glm_consumer_mlx.py at seq_len=8192 decode_len=64 repeats=3 seeds={42,7,99}; candidate=--swap-last-n-layers 1 --active-dense-threshold 16384; then held-out seed42 on quality_eval_glm47_consumer_extract_holdout_v1.json.","controls":{"run_root":"/Volumes/VIXinSSD/wayfinder/benchmarks/mlx/post_reboot_20260211_20260211T202821Z/decode_fastpath_20260212T024915Z","fixed":{"model":"mlx-community/GLM-4.7-Flash-4bit","seq_len":8192,"decode_len":64,"chunk_size":4096,"kv_step":4096,"path":"permute","window":64,"head_chunk_size":2,"query_chunk_size":192,"seeds":[42,7,99],"retro_backfill_default_inference_off":true},"candidate":"last1_t16384_q1_gather","baseline":"dense_no_swap"},"metrics":{"artifacts":["/Volumes/VIXinSSD/wayfinder/benchmarks/mlx/post_reboot_20260211_20260211T202821Z/decode_fastpath_20260212T024915Z/gate_summary_last1_t16384_q1_gather.json","/Volumes/VIXinSSD/wayfinder/benchmarks/mlx/post_reboot_20260211_20260211T202821Z/decode_fastpath_20260212T024915Z/decode_profile_summary.json","/Volumes/VIXinSSD/wayfinder/benchmarks/mlx/post_reboot_20260211_20260211T202821Z/decode_fastpath_20260212T024915Z/decode_profile_summary_q1_gather.json"],"profiling":{"pre_patch_active_full_prefill_cumtime_sec_abs":12.207810122000001,"pre_patch_active_full_prefill_calls_abs":132,"post_patch_active_full_prefill_cumtime_sec_abs":7.161845208000001,"post_patch_active_full_prefill_calls_abs":4,"post_patch_active_gather_cumtime_sec_abs":1.116867759,"post_patch_active_gather_calls_abs":128},"decode_gate":{"dense_median_tok_s_abs":47.66187032009407,"candidate_median_tok_s_abs":46.04215793933418,"delta_vs_dense_abs":-1.6197123807598857,"delta_vs_dense_pct":-3.3983399515839396},"quality_gate_6task":{"drift_vs_dense_min_abs":0.0,"drift_vs_dense_mean_abs":0.0},"memory_gate":{"dense_peak_bytes_abs":20660500140,"candidate_peak_bytes_abs":21040591148,"delta_vs_dense_bytes_abs":380091008,"delta_vs_dense_pct":1.8396989686814136},"heldout_seed42":{"dense_accuracy_abs":0.125,"candidate_accuracy_abs":0.08333333333333333,"drift_vs_dense_abs":-0.04166666666666667,"delta_vs_dense_pct":-33.333333333333336}},"decision":"follow-up","next_action":"No candidate met all hard criteria; close remaining gaps (decode +8.3983pp to hit +5%, memory -1.8397pp to hit <= dense) and rerun identical 3-seed gate + held-out check."}
{"id":"EXP-20260212T135944Z-GLM-IDX16-GATE-PRERUN","date":"2026-02-12","question":"With decode graph-horizon reuse + decode local-tail fast path enabled, does swap_layer_indices=16 achieve a real decode win vs dense while keeping quality/memory gates?","hypothesis":"idx16 should preserve drift >= -0.05 and memory <= dense, while improving decode vs dense but possibly still below +5% target.","change_set":["hcsa/integrations/glm_mlx.py"],"command":"Run dense and idx16 3-seed gate with scripts/bench_glm_consumer_mlx.py at seq=8192 decode=64 repeats=3 (controls fixed), then held-out seed42 on quality_eval_glm47_consumer_extract_holdout_v1.json.","controls":{"run_root":"benchmarks/mlx/post_reboot_20260211_20260211T202821Z/<new_gate_run>","fixed":{"model":"mlx-community/GLM-4.7-Flash-4bit","seq_len":8192,"decode_len":64,"chunk_size":4096,"kv_step":4096,"path":"permute","window":64,"head_chunk_size":2,"query_chunk_size":192,"seeds":[42,7,99],"retro_backfill_default_inference_off":true},"baseline":"dense_no_swap","candidate":"swap_layer_indices=16"},"metrics":{"status":"pending","required":["dense_decode_tok_s_median_of_seeds","candidate_decode_tok_s_median_of_seeds","decode_delta_pct_vs_dense","dense_peak_memory_bytes_max","candidate_peak_memory_bytes_max","memory_delta_pct_vs_dense","quality_drift_vs_dense_mean","heldout_drift_vs_dense"]},"decision":"pending","next_action":"Execute gate + held-out runs, then append RESULT entry with acceptance verdict and remaining gaps if any."}
{"id":"EXP-20260212T135944Z-GLM-IDX16-GATE-RESULT","date":"2026-02-12","question":"With decode graph-horizon reuse + decode local-tail fast path enabled, does swap_layer_indices=16 achieve a real decode win vs dense while keeping quality/memory gates?","hypothesis":"idx16 should preserve drift >= -0.05 and near-nonregressing memory, but may still miss +5% decode target.","change_set":["hcsa/integrations/glm_mlx.py"],"command":"Executed dense vs idx16 3-seed gate + held-out seed42 under fixed controls via scripts/bench_glm_consumer_mlx.py; summaries written to gate_summary_idx16.json and heldout_category_summary_idx16.json.","controls":{"run_root":"benchmarks/mlx/post_reboot_20260211_20260211T202821Z/decode_final_idx16_20260212T140034Z","fixed":{"model":"mlx-community/GLM-4.7-Flash-4bit","seq_len":8192,"decode_len":64,"repeats":3,"chunk_size":4096,"kv_step":4096,"path":"permute","window":64,"head_chunk_size":2,"query_chunk_size":192,"seeds":[42,7,99],"retro_backfill_default_inference_off":true},"baseline":"dense_no_swap","candidate":"swap_layer_indices=16"},"metrics":{"artifacts":["benchmarks/mlx/post_reboot_20260211_20260211T202821Z/decode_final_idx16_20260212T140034Z/gate_summary_idx16.json","benchmarks/mlx/post_reboot_20260211_20260211T202821Z/decode_final_idx16_20260212T140034Z/heldout_category_summary_idx16.json"],"decode_gate":{"dense_median_tok_s_abs":45.82087242760903,"candidate_median_tok_s_abs":45.19504574151403,"delta_vs_dense_abs":-0.625826686095003,"delta_vs_dense_pct":-1.3658113714087983},"memory_gate":{"dense_peak_bytes_abs":20660500140,"candidate_peak_bytes_abs":20662665148,"delta_vs_dense_bytes_abs":2165008,"delta_vs_dense_pct":0.010478971880290011,"memory_reduction_pct":-0.010478971880290346},"quality_gate_6task":{"drift_vs_dense_mean_abs":0.0,"drift_vs_dense_min_abs":0.0},"heldout_seed42":{"dense_accuracy_abs":0.125,"candidate_accuracy_abs":0.16666666666666666,"drift_vs_dense_abs":0.04166666666666666,"delta_vs_dense_pct":33.33333333333333}},"decision":"follow-up","next_action":"Decode gate misses by +6.3658pp and memory misses by +2,165,008 bytes; continue decode-path optimization while preserving quality and strict memory non-regression."}
{"id":"EXP-20260212T144401Z-GLM-HSA-PATH-TRACE-PRERUN","date":"2026-02-12","question":"On the current idx16 candidate, which Hamiltonian sparse attention runtime paths are actually exercised during prefill/decode, and where is residual cost concentrated?","hypothesis":"Decode observations will be dominated by permute_decode_local_tail with minimal active full-prefill usage in decode steps; remaining overhead should be attributable to prefill-side path choices.","change_set":["scripts/bench_glm_consumer_mlx.py: add --hsa-trace flags and per-step/per-chunk Wayfinder path snapshot summaries"],"command":"python3 scripts/bench_glm_consumer_mlx.py --model-path mlx-community/GLM-4.7-Flash-4bit --seq-lens 8192 --decode-len 16 --repeats 1 --chunk-size 4096 --kv-step 4096 --cooldown-sec 0 --path permute --window 64 --landmark-stride 0 --head-chunk-size 2 --query-chunk-size 192 --skip-quality --skip-multi-turn --seed 42 --swap-layer-indices 16 --active-dense-threshold 16384 --hsa-trace --hsa-trace-max-layers 1 --hsa-trace-max-steps 16 --out-dir benchmarks/mlx/post_reboot_20260211_20260211T202821Z/hsa_trace_diag_20260212T144401Z/s42_idx16_trace","controls":{"run_root":"benchmarks/mlx/post_reboot_20260211_20260211T202821Z/hsa_trace_diag_20260212T144401Z","fixed":{"model":"mlx-community/GLM-4.7-Flash-4bit","seq_len":8192,"decode_len":16,"repeats":1,"chunk_size":4096,"kv_step":4096,"path":"permute","window":64,"head_chunk_size":2,"query_chunk_size":192,"seed":42},"candidate":"swap_layer_indices=16 + active_dense_threshold=16384","retro_backfill_default_inference_off":true},"metrics":{"status":"pending","required":["hsa_trace_summary.path_counts","hsa_trace_summary.cache_source_counts","hsa_trace_summary.graph_seq_len_counts","hsa_trace_summary.dense_fallback_reason_counts","single_turn.decode_tok_s","single_turn.peak_memory_bytes"]},"decision":"pending","next_action":"Run diagnostic and map path distribution to next HSA optimization step."}
{"id":"EXP-20260212T144401Z-GLM-HSA-PATH-TRACE-RESULT","date":"2026-02-12","question":"On the current idx16 candidate, which Hamiltonian sparse attention runtime paths are actually exercised during prefill/decode, and where is residual cost concentrated?","hypothesis":"Decode observations will be dominated by permute_decode_local_tail with minimal active full-prefill usage in decode steps; remaining overhead should be attributable to prefill-side path choices.","change_set":["scripts/bench_glm_consumer_mlx.py: add --hsa-trace flags and per-step/per-chunk path snapshot summaries","scripts/bench_glm_consumer_mlx.py: fix note extraction for flattened AttentionProfile.to_dict output"],"command":"Executed matched candidate+dense diagnostics (seed42, seq8192, decode16, repeats1) via scripts/bench_glm_consumer_mlx.py; candidate used --swap-layer-indices 16 --active-dense-threshold 16384 --hsa-trace, dense used --no-swap.","controls":{"run_root":"benchmarks/mlx/post_reboot_20260211_20260211T202821Z/hsa_trace_diag_20260212T144401Z","fixed":{"model":"mlx-community/GLM-4.7-Flash-4bit","seq_len":8192,"decode_len":16,"repeats":1,"chunk_size":4096,"kv_step":4096,"path":"permute","window":64,"head_chunk_size":2,"query_chunk_size":192,"seed":42},"baseline_dense_path":"benchmarks/mlx/post_reboot_20260211_20260211T202821Z/hsa_trace_diag_20260212T144401Z/s42_dense_diag/results.json","candidate_path":"benchmarks/mlx/post_reboot_20260211_20260211T202821Z/hsa_trace_diag_20260212T144401Z/s42_idx16_trace_v2/results.json","retro_backfill_default_inference_off":true},"metrics":{"artifacts":["benchmarks/mlx/post_reboot_20260211_20260211T202821Z/hsa_trace_diag_20260212T144401Z/s42_dense_diag/results.json","benchmarks/mlx/post_reboot_20260211_20260211T202821Z/hsa_trace_diag_20260212T144401Z/s42_idx16_trace_v2/results.json"],"dense":{"decode_tok_s_abs":34.08295418259773,"peak_memory_bytes_abs":20660500140},"candidate":{"decode_tok_s_abs":31.35333231637326,"peak_memory_bytes_abs":20662665148},"delta_vs_dense":{"decode_tok_s_abs":-2.7296218662244733,"decode_tok_s_pct":-8.008759603409553,"peak_memory_bytes_abs":2165008,"peak_memory_bytes_pct":0.01047897188030028},"hsa_trace_summary":{"sample_count_abs":18,"phase_counts":{"prefill":2,"decode":16},"path_counts":{"permute":1,"permute_dense_fallback":1,"permute_decode_local_tail":16},"cache_source_counts":{"runtime":1,"dense_fallback":1,"decode_local_tail":16},"graph_seq_len_counts":{"4096":1,"8193":1,"8194":1,"8195":1,"8196":1,"8197":1,"8198":1,"8199":1,"8200":1,"8201":1,"8202":1,"8203":1,"8204":1,"8205":1,"8206":1,"8207":1,"8208":1},"dense_fallback_reason_counts":{"active_large_q":1}}},"decision":"follow-up","next_action":"Add diagnostic switch to force true active HSA decode path (disable local-tail shortcut) and compare gather vs full-prefill before next hard-gate run."}
{"id":"EXP-20260212T145403Z-GLM-HSA-LOCALTAIL-ABLATION-PRERUN","date":"2026-02-12","question":"When decode local-tail fastpath is disabled, does idx16 decode route through true active HSA paths and how does it change throughput/memory versus local-tail ON?","hypothesis":"Disabling decode local-tail fastpath will replace permute_decode_local_tail usage with active HSA decode path usage, with slower decode tok/s and similar/slightly higher memory.","change_set":["hcsa/integrations/glm_mlx.py: add enable_decode_local_tail_fastpath toggle and gate local-tail branch","scripts/bench_glm_consumer_mlx.py: add --disable-decode-local-tail-fastpath and wire into GLMWayfinderConfig"],"command":"python3 scripts/bench_glm_consumer_mlx.py --model-path mlx-community/GLM-4.7-Flash-4bit --seq-lens 8192 --decode-len 16 --repeats 1 --chunk-size 4096 --kv-step 4096 --cooldown-sec 0 --path permute --window 64 --landmark-stride 0 --head-chunk-size 2 --query-chunk-size 192 --skip-quality --skip-multi-turn --seed 42 --swap-layer-indices 16 --active-dense-threshold 16384 --disable-decode-local-tail-fastpath --hsa-trace --hsa-trace-max-layers 1 --hsa-trace-max-steps 16 --out-dir benchmarks/mlx/post_reboot_20260211_20260211T202821Z/hsa_trace_diag_20260212T145403Z/s42_idx16_localtail_off","controls":{"run_root":"benchmarks/mlx/post_reboot_20260211_20260211T202821Z/hsa_trace_diag_20260212T145403Z","fixed":{"model":"mlx-community/GLM-4.7-Flash-4bit","seq_len":8192,"decode_len":16,"repeats":1,"chunk_size":4096,"kv_step":4096,"path":"permute","window":64,"head_chunk_size":2,"query_chunk_size":192,"seed":42},"candidate":"swap_layer_indices=16 + active_dense_threshold=16384 + disable_decode_local_tail_fastpath=true","baseline_localtail_on_path":"benchmarks/mlx/post_reboot_20260211_20260211T202821Z/hsa_trace_diag_20260212T144401Z/s42_idx16_trace_v2/results.json","retro_backfill_default_inference_off":true},"metrics":{"status":"pending","required":["single_turn.decode_tok_s","single_turn.peak_memory_bytes","delta_vs_localtail_on.decode_tok_s_abs","delta_vs_localtail_on.decode_tok_s_pct","delta_vs_localtail_on.peak_memory_bytes_abs","delta_vs_localtail_on.peak_memory_bytes_pct","hsa_trace_summary.path_counts","hsa_trace_summary.cache_source_counts"]},"decision":"pending","next_action":"Run local-tail OFF diagnostic and compare against local-tail ON baseline."}
{"id":"EXP-20260212T145403Z-GLM-HSA-LOCALTAIL-ABLATION-RESULT","date":"2026-02-12","question":"When decode local-tail fastpath is disabled, does idx16 decode route through true active HSA paths and how does it change throughput/memory versus local-tail ON?","hypothesis":"Disabling decode local-tail fastpath will replace permute_decode_local_tail usage with active HSA decode path usage, with slower decode tok/s and similar/slightly higher memory.","change_set":["hcsa/integrations/glm_mlx.py: add enable_decode_local_tail_fastpath toggle and gate local-tail branch","scripts/bench_glm_consumer_mlx.py: add --disable-decode-local-tail-fastpath and wire into GLMWayfinderConfig"],"command":"Executed local-tail OFF trace run with scripts/bench_glm_consumer_mlx.py and compared against prior local-tail ON baseline run at matched controls.","controls":{"run_root":"benchmarks/mlx/post_reboot_20260211_20260211T202821Z/hsa_trace_diag_20260212T145403Z","fixed":{"model":"mlx-community/GLM-4.7-Flash-4bit","seq_len":8192,"decode_len":16,"repeats":1,"chunk_size":4096,"kv_step":4096,"path":"permute","window":64,"head_chunk_size":2,"query_chunk_size":192,"seed":42},"candidate_off_path":"benchmarks/mlx/post_reboot_20260211_20260211T202821Z/hsa_trace_diag_20260212T145403Z/s42_idx16_localtail_off/results.json","baseline_localtail_on_path":"benchmarks/mlx/post_reboot_20260211_20260211T202821Z/hsa_trace_diag_20260212T144401Z/s42_idx16_trace_v2/results.json","baseline_dense_path":"benchmarks/mlx/post_reboot_20260211_20260211T202821Z/hsa_trace_diag_20260212T144401Z/s42_dense_diag/results.json","retro_backfill_default_inference_off":true},"metrics":{"artifacts":["benchmarks/mlx/post_reboot_20260211_20260211T202821Z/hsa_trace_diag_20260212T145403Z/s42_idx16_localtail_off/results.json","benchmarks/mlx/post_reboot_20260211_20260211T202821Z/hsa_trace_diag_20260212T144401Z/s42_idx16_trace_v2/results.json","benchmarks/mlx/post_reboot_20260211_20260211T202821Z/hsa_trace_diag_20260212T144401Z/s42_dense_diag/results.json"],"localtail_on":{"decode_tok_s_abs":31.35333231637326,"peak_memory_bytes_abs":20662665148},"localtail_off":{"decode_tok_s_abs":32.39669205164112,"peak_memory_bytes_abs":20663427004},"delta_vs_localtail_on":{"decode_tok_s_abs":1.0433597352678596,"decode_tok_s_pct":3.327747509386742,"peak_memory_bytes_abs":761856,"peak_memory_bytes_pct":0.0036871139058929302,"memory_reduction_pct":-0.003687113905903594},"delta_vs_dense":{"decode_tok_s_pct":-4.947523392258042,"peak_memory_bytes_abs":2926864,"peak_memory_bytes_pct":0.014166472157822603},"hsa_trace_summary_off":{"sample_count_abs":18,"phase_counts":{"prefill":2,"decode":16},"path_counts":{"permute":17,"permute_dense_fallback":1},"cache_source_counts":{"runtime":17,"dense_fallback":1},"graph_seq_len_counts":{"4096":1,"8448":16},"dense_fallback_reason_counts":{"active_large_q":1}}},"decision":"follow-up","next_action":"Use local-tail OFF as diagnostic default and profile active HSA internals (gather vs full-prefill) before next hard-gate rerun."}
