{"id":"EXP-20260319T054523Z-QWEN35CUDA-KERNEL-FLAT3D-GATHER-RESULT","date":"2026-03-19","question":"If the remaining hot spot is the current 5D query-axis-expanded gather in _gather_kv_head_block_chunk, can a flatter 3D gather over [B*H, T, dh] lower per-chunk transport overhead enough to improve 8192 kappa without reintroducing streamed degree blocks?","hypothesis":"Replacing the query-axis-expanded gather helper with a flatter 3D torch.gather path should reduce per-chunk gather overhead while keeping the same peak-live-byte budget and full-degree auto mode.","change_set":["hcsa/torch/attention_wayfinder_sparse.py","tests/pytorch/test_torch_qwen_sparse_gqa.py","notes/LAB_NOTEBOOK.md","notes/experiments.ndjson"],"command":".venv/bin/python -m py_compile hcsa/integrations/qwen_torch.py hcsa/torch/attention_wayfinder_sparse.py scripts/bench_qwen35_cuda_wayfinder.py tests/pytorch/test_torch_qwen_sparse_gqa.py tests/test_qwen_cuda_wayfinder_cli.py && .venv/bin/python -m pytest tests/pytorch/test_torch_qwen_sparse_gqa.py tests/pytorch/test_torch_causality.py tests/pytorch/test_torch_dense_limit_equivalence.py tests/pytorch/test_torch_matches_mlx_reference_small.py tests/test_qwen_cuda_wayfinder_cli.py -q && .venv/bin/python scripts/bench_qwen35_cuda_wayfinder.py --model-path /home/hmbown/HF_Models/Qwen3.5-9B --seq-lens 4096 8192 --path sparse --strategy random --engine auto --warmup 1 --repeats 1 --forward-target backbone --phases dense wayfinder --skip-divergence --output benchmarks/cuda/qwen35_wayfinder/EXP-20260319T054523Z-QWEN35CUDA-KERNEL-FLAT3D-GATHER-4096-8192.ndjson && journalctl -b -k --since '2026-03-19 00:46:13 CDT' | rg -n 'NVRM|Xid|Out of memory|hung task|BUG:|Call Trace'","controls":{"baseline_run_path":"benchmarks/cuda/qwen35_wayfinder/EXP-20260319T043357Z-QWEN35CUDA-BACKBONE-RESIDENCY-TIEBREAK-4096-8192.ndjson","latest_full_degree_run":"benchmarks/cuda/qwen35_wayfinder/EXP-20260319T051254Z-QWEN35CUDA-KERNEL-PEAK-BUDGET-FULLDEGREE-4096-8192.ndjson","one_process_at_a_time":true,"lock_file":"benchmarks/cuda/qwen35_wayfinder/.bench_qwen35_cuda_wayfinder.lock","retro_backfill_inference":"off","model_path":"/home/hmbown/HF_Models/Qwen3.5-9B","device":"cuda","gpu":"NVIDIA GB10","device_capability":[12,1],"torch":"2.10.0+cu130","transformers":"5.3.0","path":"sparse","strategy":"random","compute_graph_metrics":false,"forward_target":"backbone","window":64,"landmark_stride":64,"num_cycles":1,"engine_request":"auto","warmup":1,"repeats":1,"kernel_log_since":"2026-03-19 00:46:13 CDT","current_anchor_4096":{"D_estimate":97.0,"kappa":64.25912658830366,"crossover_tokens_estimate":8387.646804924101},"current_anchor_8192":{"D_estimate":129.0,"kappa":116.42635492705567,"crossover_tokens_estimate":83695.9546355498},"latest_full_degree_4096":{"D_estimate":97.0,"kappa":65.8442925724288},"latest_full_degree_8192":{"D_estimate":129.0,"kappa":118.79319912524429}},"metrics":{"status":"completed","validation":{"py_compile":"pass","pytest":{"passed":36,"skipped":1,"failed":0}},"warnings":["existing torch.jit.script_method deprecation warnings","existing GB10 capability 12.1 vs PyTorch max advertised 12.0 warning"],"artifact":"benchmarks/cuda/qwen35_wayfinder/EXP-20260319T054523Z-QWEN35CUDA-KERNEL-FLAT3D-GATHER-4096-8192.ndjson","kernel_fault_lines_after_start":0,"benchmark_residency":{"dense_benchmark_module_device_counts":{"cuda:0":428},"wayfinder_benchmark_module_device_counts":{"cuda:0":428},"result":"single_gpu_comparable"},"4096":{"dense":{"median_ms":2532.79,"prefill_tok_per_sec":1617.2,"peak_mem_gb":17.54},"wayfinder":{"median_ms":3881.27,"prefill_tok_per_sec":1055.3,"peak_mem_gb":17.57,"wayfinder_active_layers":8,"attn_kernel_ms_mean":218.8384382507138,"effective_chunking":{"query_chunk_size":2048,"kv_head_chunk_size":1,"degree_chunk_size":130,"num_query_chunks":2,"num_head_blocks":4,"num_degree_blocks":1,"streamed_degree":false}},"delta_vs_anchor_wayfinder_abs":{"median_ms":-222.1600000000003,"prefill_tok_per_sec":57.09999999999991,"peak_mem_gb":0.0,"attn_kernel_ms_mean":-15.617976499015642},"delta_vs_anchor_wayfinder_pct":{"median_ms":-5.414007306082967,"prefill_tok_per_sec":5.72029653376076,"peak_mem_gb":0.0,"attn_kernel_ms_mean":-6.660633829547728},"delta_vs_anchor_dense_abs":{"median_ms":-163.71000000000004,"prefill_tok_per_sec":102.0,"peak_mem_gb":0.0},"delta_vs_anchor_dense_pct":{"median_ms":-6.071203411830151,"prefill_tok_per_sec":6.732445881731785,"peak_mem_gb":0.0},"delta_vs_latest_full_degree_wayfinder_abs":{"median_ms":-15.610000000000127,"prefill_tok_per_sec":4.2000000000000455,"attn_kernel_ms_mean":1.712456377390481},"delta_vs_latest_full_degree_wayfinder_pct":{"median_ms":-0.40057687175381657,"prefill_tok_per_sec":0.399581391875177,"attn_kernel_ms_mean":0.7886825537533598},"memory_reduction_pct":-0.17103762827823665,"degree_estimate":97.0,"kappa":64.70873149421669,"crossover_tokens":8506.333634041292},"8192":{"dense":{"median_ms":5063.97,"prefill_tok_per_sec":1617.7,"peak_mem_gb":18.38},"wayfinder":{"median_ms":9418.21,"prefill_tok_per_sec":869.8,"peak_mem_gb":18.49,"wayfinder_active_layers":8,"attn_kernel_ms_mean":647.9522402523799,"effective_chunking":{"query_chunk_size":1536,"kv_head_chunk_size":1,"degree_chunk_size":194,"num_query_chunks":6,"num_head_blocks":4,"num_degree_blocks":1,"streamed_degree":false}},"delta_vs_anchor_wayfinder_abs":{"median_ms":-500.71000000000095,"prefill_tok_per_sec":43.89999999999998,"peak_mem_gb":0.0,"attn_kernel_ms_mean":-34.67406862273481},"delta_vs_anchor_wayfinder_pct":{"median_ms":-5.048029422558111,"prefill_tok_per_sec":5.315413488315774,"peak_mem_gb":0.0,"attn_kernel_ms_mean":-5.078793892202389},"delta_vs_anchor_dense_abs":{"median_ms":-346.22999999999956,"prefill_tok_per_sec":80.5,"peak_mem_gb":0.0},"delta_vs_anchor_dense_pct":{"median_ms":-6.3995785738050275,"prefill_tok_per_sec":5.236794171220399,"peak_mem_gb":0.0},"delta_vs_latest_full_degree_wayfinder_abs":{"median_ms":47.56999999999971,"prefill_tok_per_sec":-4.400000000000091,"attn_kernel_ms_mean":7.077466751979955},"delta_vs_latest_full_degree_wayfinder_pct":{"median_ms":0.5076494241588592,"prefill_tok_per_sec":-0.5033173186913788,"attn_kernel_ms_mean":1.104324336646265},"memory_reduction_pct":-0.5984766050054269,"degree_estimate":129.0,"kappa":118.10750057562,"crossover_tokens":99333.27894540105},"stop_gate_tripped":"kappa_regressed"},"decision":"stop","next_action":"Do not run 16384 from this branch. The helper-level gather change did not improve the honest 8192 kappa gate, and 8192 attn_kernel_ms worsened versus the latest full-degree branch. Attack the explicit score/softmax/V contraction next."}
{"id":"EXP-20260319T055559Z-QWEN35CUDA-KERNEL-SDPA-CONTRACTION-PRERUN","date":"2026-03-19","question":"If gather-helper changes are no longer moving 8192, can a batched SDPA contraction over fixed-degree neighborhoods lower the remaining scores->softmax->V constant factor enough to improve kappa?","hypothesis":"The flat3D-gather result showed the helper itself is not the dominant cost. The remaining full-degree path still materializes explicit score and weight tensors before the V contraction. Reshaping each (batch, kv_head, token) neighborhood into an SDPA batch with enable_gqa=True and a broadcast float mask/bias should let PyTorch fuse score, normalization, and V accumulation, remove explicit weight tensor materialization from the benchmark path, and lower attn_kernel_ms enough to improve 8192 kappa versus the repaired-loader anchor (~116.43), the latest full-degree branch (~118.79), and the flat3D-gather branch (~118.11).","change_set":["planned edits to hcsa/torch/attention_wayfinder_sparse.py","possible regression updates in tests/pytorch/test_torch_qwen_sparse_gqa.py","notes/LAB_NOTEBOOK.md","notes/experiments.ndjson"],"command":".venv/bin/python -m py_compile hcsa/integrations/qwen_torch.py hcsa/torch/attention_wayfinder_sparse.py scripts/bench_qwen35_cuda_wayfinder.py tests/pytorch/test_torch_qwen_sparse_gqa.py tests/test_qwen_cuda_wayfinder_cli.py && .venv/bin/python -m pytest tests/pytorch/test_torch_qwen_sparse_gqa.py tests/pytorch/test_torch_causality.py tests/pytorch/test_torch_dense_limit_equivalence.py tests/pytorch/test_torch_matches_mlx_reference_small.py tests/test_qwen_cuda_wayfinder_cli.py -q && .venv/bin/python scripts/bench_qwen35_cuda_wayfinder.py --model-path /home/hmbown/HF_Models/Qwen3.5-9B --seq-lens 4096 8192 --path sparse --strategy random --engine auto --warmup 1 --repeats 1 --forward-target backbone --phases dense wayfinder --skip-divergence --output benchmarks/cuda/qwen35_wayfinder/EXP-20260319T055559Z-QWEN35CUDA-KERNEL-SDPA-CONTRACTION-4096-8192.ndjson && journalctl -b -k --since '2026-03-19 00:55:59 CDT' | rg -n 'NVRM|Xid|Out of memory|hung task|BUG:|Call Trace'","controls":{"baseline_run_path":"benchmarks/cuda/qwen35_wayfinder/EXP-20260319T043357Z-QWEN35CUDA-BACKBONE-RESIDENCY-TIEBREAK-4096-8192.ndjson","latest_full_degree_run":"benchmarks/cuda/qwen35_wayfinder/EXP-20260319T051254Z-QWEN35CUDA-KERNEL-PEAK-BUDGET-FULLDEGREE-4096-8192.ndjson","flat3d_gather_run":"benchmarks/cuda/qwen35_wayfinder/EXP-20260319T054523Z-QWEN35CUDA-KERNEL-FLAT3D-GATHER-4096-8192.ndjson","one_process_at_a_time":true,"lock_file":"benchmarks/cuda/qwen35_wayfinder/.bench_qwen35_cuda_wayfinder.lock","retro_backfill_inference":"off","model_path":"/home/hmbown/HF_Models/Qwen3.5-9B","device":"cuda","gpu":"NVIDIA GB10","device_capability":[12,1],"torch":"2.10.0+cu130","transformers":"5.3.0","path":"sparse","strategy":"random","compute_graph_metrics":false,"forward_target":"backbone","window":64,"landmark_stride":64,"num_cycles":1,"engine_request":"auto","warmup":1,"repeats":1,"seq_lens_gate":[4096,8192],"seq_len_contingent":[16384],"kernel_log_since":"2026-03-19 00:55:59 CDT","current_anchor_4096":{"D_estimate":97.0,"kappa":64.25912658830366,"crossover_tokens_estimate":8387.646804924101},"current_anchor_8192":{"D_estimate":129.0,"kappa":116.42635492705567,"crossover_tokens_estimate":83695.9546355498},"latest_full_degree_4096":{"D_estimate":97.0,"kappa":65.8442925724288},"latest_full_degree_8192":{"D_estimate":129.0,"kappa":118.79319912524429},"flat3d_gather_4096":{"D_estimate":97.0,"kappa":64.70873149421669},"flat3d_gather_8192":{"D_estimate":129.0,"kappa":118.10750057562}},"metrics":{"status":"pending","artifacts_expected":["benchmarks/cuda/qwen35_wayfinder/EXP-20260319T055559Z-QWEN35CUDA-KERNEL-SDPA-CONTRACTION-4096-8192.ndjson","benchmarks/cuda/qwen35_wayfinder/EXP-20260319T055559Z-QWEN35CUDA-KERNEL-SDPA-CONTRACTION-16384.ndjson"],"required":["py_compile success","pytest selected suite passes","bench[label=dense][seq_len=4096].median_ms","bench[label=wayfinder][seq_len=4096].median_ms","bench[label=dense][seq_len=8192].median_ms","bench[label=wayfinder][seq_len=8192].median_ms","dense and wayfinder residency metadata for backbone module","no cpu or meta residency in backbone benchmark module","matching real-device placement for dense and wayfinder","bench[label=wayfinder].wayfinder_profiles","bench[label=wayfinder].wayfinder_active_layers==8","bench[label=wayfinder].wayfinder_profiles[*].sparse_contraction_backend","wayfinder D_estimate","wayfinder empirical kappa","wayfinder crossover_estimate","zero new kernel fault lines after kernel_log_since"]},"decision":"pending","next_action":"Replace the explicit scores->softmax->V contraction in the full-degree path with a batched SDPA path, rerun the guarded 4096/8192 checkpoint, and only if 8192 kappa improves while stability holds continue automatically to 16384."}
{"id":"EXP-20260319T055559Z-QWEN35CUDA-KERNEL-SDPA-CONTRACTION-RESULT","date":"2026-03-19","question":"If gather-helper changes are no longer moving 8192, can a batched SDPA contraction over fixed-degree neighborhoods lower the remaining scores->softmax->V constant factor enough to improve kappa?","hypothesis":"Replacing the explicit score/softmax/V contraction with an SDPA-backed full-degree contraction should remove explicit weight materialization and lower the realized Wayfinder/HCSA kernel constant.","change_set":["hcsa/torch/attention_wayfinder_sparse.py","hcsa/integrations/qwen_torch.py","tests/pytorch/test_torch_qwen_sparse_gqa.py","notes/LAB_NOTEBOOK.md","notes/experiments.ndjson"],"command":".venv/bin/python -m py_compile hcsa/integrations/qwen_torch.py hcsa/torch/attention_wayfinder_sparse.py scripts/bench_qwen35_cuda_wayfinder.py tests/pytorch/test_torch_qwen_sparse_gqa.py tests/test_qwen_cuda_wayfinder_cli.py && .venv/bin/python -m pytest tests/pytorch/test_torch_qwen_sparse_gqa.py tests/pytorch/test_torch_causality.py tests/pytorch/test_torch_dense_limit_equivalence.py tests/pytorch/test_torch_matches_mlx_reference_small.py tests/test_qwen_cuda_wayfinder_cli.py -q && .venv/bin/python scripts/bench_qwen35_cuda_wayfinder.py --model-path /home/hmbown/HF_Models/Qwen3.5-9B --seq-lens 4096 8192 --path sparse --strategy random --engine auto --warmup 1 --repeats 1 --forward-target backbone --phases dense wayfinder --skip-divergence --output benchmarks/cuda/qwen35_wayfinder/EXP-20260319T055559Z-QWEN35CUDA-KERNEL-SDPA-CONTRACTION-4096-8192.ndjson && journalctl -b -k --since '2026-03-19 00:55:59 CDT' | rg -n 'NVRM|Xid|Out of memory|hung task|BUG:|Call Trace'","controls":{"baseline_run_path":"benchmarks/cuda/qwen35_wayfinder/EXP-20260319T043357Z-QWEN35CUDA-BACKBONE-RESIDENCY-TIEBREAK-4096-8192.ndjson","latest_full_degree_run":"benchmarks/cuda/qwen35_wayfinder/EXP-20260319T051254Z-QWEN35CUDA-KERNEL-PEAK-BUDGET-FULLDEGREE-4096-8192.ndjson","flat3d_gather_run":"benchmarks/cuda/qwen35_wayfinder/EXP-20260319T054523Z-QWEN35CUDA-KERNEL-FLAT3D-GATHER-4096-8192.ndjson","one_process_at_a_time":true,"lock_file":"benchmarks/cuda/qwen35_wayfinder/.bench_qwen35_cuda_wayfinder.lock","retro_backfill_inference":"off","model_path":"/home/hmbown/HF_Models/Qwen3.5-9B","device":"cuda","gpu":"NVIDIA GB10","device_capability":[12,1],"torch":"2.10.0+cu130","transformers":"5.3.0","path":"sparse","strategy":"random","compute_graph_metrics":false,"forward_target":"backbone","kernel_log_since":"2026-03-19 00:55:59 CDT"},"metrics":{"status":"completed","validation":{"py_compile":"pass","pytest":{"passed":37,"skipped":1,"failed":0}},"warnings":["existing torch.jit.script_method deprecation warnings","existing GB10 capability 12.1 vs PyTorch max advertised 12.0 warning"],"artifact":"benchmarks/cuda/qwen35_wayfinder/EXP-20260319T055559Z-QWEN35CUDA-KERNEL-SDPA-CONTRACTION-4096-8192.ndjson","kernel_fault_lines_after_start":0,"benchmark_residency":{"dense_benchmark_module_device_counts":{"cuda:0":428},"wayfinder_benchmark_module_device_counts":{"cuda:0":428},"result":"single_gpu_comparable"},"4096":{"dense":{"median_ms":2653.13,"prefill_tok_per_sec":1543.8,"peak_mem_gb":17.54},"wayfinder":{"median_ms":5616.31,"prefill_tok_per_sec":729.3,"peak_mem_gb":20.76,"wayfinder_active_layers":8,"attn_kernel_ms_mean":23.37,"sparse_contraction_backend_present":false},"delta_vs_anchor_wayfinder_abs":{"median_ms":1512.88,"prefill_tok_per_sec":-268.9,"peak_mem_gb":3.19},"delta_vs_anchor_wayfinder_pct":{"median_ms":36.87,"prefill_tok_per_sec":-26.94,"peak_mem_gb":18.16},"delta_vs_anchor_dense_abs":{"median_ms":-43.37,"prefill_tok_per_sec":24.8,"peak_mem_gb":0.0},"delta_vs_anchor_dense_pct":{"median_ms":-1.61,"prefill_tok_per_sec":1.63,"peak_mem_gb":0.0},"memory_reduction_pct":-18.36,"degree_estimate":97.0,"kappa":89.39,"crossover_tokens":19261.3},"8192":{"dense":{"median_ms":5419.76,"prefill_tok_per_sec":1511.5,"peak_mem_gb":18.38},"wayfinder":{"median_ms":14147.13,"prefill_tok_per_sec":579.1,"peak_mem_gb":21.49,"wayfinder_active_layers":8,"attn_kernel_ms_mean":34.13,"sparse_contraction_backend_present":false},"delta_vs_anchor_wayfinder_abs":{"median_ms":4228.21,"prefill_tok_per_sec":-246.8,"peak_mem_gb":3.0},"delta_vs_anchor_wayfinder_pct":{"median_ms":42.63,"prefill_tok_per_sec":-29.88,"peak_mem_gb":16.22},"delta_vs_anchor_dense_abs":{"median_ms":9.56,"prefill_tok_per_sec":-2.7,"peak_mem_gb":0.0},"delta_vs_anchor_dense_pct":{"median_ms":0.18,"prefill_tok_per_sec":-0.18,"peak_mem_gb":0.0},"memory_reduction_pct":-16.92,"degree_estimate":129.0,"kappa":165.76,"crossover_tokens":null},"profile_observability":{"issue":"host_async_timing_and_missing_backend_field","evidence":"artifact wall time and memory worsened sharply while profile-side attn_kernel_ms remained implausibly tiny and wayfinder_profiles omitted sparse_contraction_backend"},"stop_gate_tripped":"kappa_regressed_and_memory_blowup"},"decision":"stop","next_action":"Do not run 16384 from this branch. Repair sparse profile/backend attribution first so future kernel comparisons expose the true sparse contraction backend and an honest CUDA-side timing signal before the next fused fixed-degree contraction experiment."}
{"id":"EXP-20260319T064808Z-QWEN35CUDA-KERNEL-PROFILE-ATTRIBUTION-HONESTY-PRERUN","date":"2026-03-19","question":"Are the current sparse profile fields understating the realized Wayfinder/HCSA contraction cost on CUDA and dropping backend attribution, making the SDPA branch and future kernel comparisons uninterpretable?","hypothesis":"The current sparse attn_kernel_ms field is a host-side async timer, so it can undercount queued CUDA work, and the benchmark collector currently drops sparse_contraction_backend. If the sparse path records CUDA events around the realized contraction and the benchmark artifact preserves the backend field, the rerun should expose the true sparse contraction backend (sdpa on the current branch) and a materially larger, more believable sparse contraction timing signal without changing the graph family. This step attacks measurement error in the realized-kernel term b so the next fused-contract branch can be judged honestly against kappa.","change_set":["planned edits to hcsa/integrations/qwen_torch.py","planned edits to scripts/bench_qwen35_cuda_wayfinder.py","possible regression updates in tests/pytorch/test_torch_qwen_sparse_gqa.py","possible regression updates in tests/test_qwen_cuda_wayfinder_cli.py","notes/LAB_NOTEBOOK.md","notes/experiments.ndjson"],"command":".venv/bin/python -m py_compile hcsa/integrations/qwen_torch.py hcsa/torch/attention_wayfinder_sparse.py scripts/bench_qwen35_cuda_wayfinder.py tests/pytorch/test_torch_qwen_sparse_gqa.py tests/test_qwen_cuda_wayfinder_cli.py && .venv/bin/python -m pytest tests/pytorch/test_torch_qwen_sparse_gqa.py tests/pytorch/test_torch_causality.py tests/pytorch/test_torch_dense_limit_equivalence.py tests/pytorch/test_torch_matches_mlx_reference_small.py tests/test_qwen_cuda_wayfinder_cli.py -q && .venv/bin/python scripts/bench_qwen35_cuda_wayfinder.py --model-path /home/hmbown/HF_Models/Qwen3.5-9B --seq-lens 4096 8192 --path sparse --strategy random --engine auto --warmup 1 --repeats 1 --forward-target backbone --phases dense wayfinder --skip-divergence --output benchmarks/cuda/qwen35_wayfinder/EXP-20260319T064808Z-QWEN35CUDA-KERNEL-PROFILE-ATTRIBUTION-HONESTY-4096-8192.ndjson && journalctl -b -k --since '2026-03-19 01:48:08 CDT' | rg -n 'NVRM|Xid|Out of memory|hung task|BUG:|Call Trace'","controls":{"baseline_run_path":"benchmarks/cuda/qwen35_wayfinder/EXP-20260319T043357Z-QWEN35CUDA-BACKBONE-RESIDENCY-TIEBREAK-4096-8192.ndjson","dead_sdpa_run":"benchmarks/cuda/qwen35_wayfinder/EXP-20260319T055559Z-QWEN35CUDA-KERNEL-SDPA-CONTRACTION-4096-8192.ndjson","one_process_at_a_time":true,"lock_file":"benchmarks/cuda/qwen35_wayfinder/.bench_qwen35_cuda_wayfinder.lock","retro_backfill_inference":"off","model_path":"/home/hmbown/HF_Models/Qwen3.5-9B","device":"cuda","gpu":"NVIDIA GB10","device_capability":[12,1],"torch":"2.10.0+cu130","transformers":"5.3.0","path":"sparse","strategy":"random","compute_graph_metrics":false,"forward_target":"backbone","window":64,"landmark_stride":64,"num_cycles":1,"engine_request":"auto","warmup":1,"repeats":1,"seq_lens_gate":[4096,8192],"kernel_log_since":"2026-03-19 01:48:08 CDT"},"metrics":{"status":"pending","artifacts_expected":["benchmarks/cuda/qwen35_wayfinder/EXP-20260319T064808Z-QWEN35CUDA-KERNEL-PROFILE-ATTRIBUTION-HONESTY-4096-8192.ndjson"],"required":["py_compile success","pytest selected suite passes","bench[label=dense][seq_len=4096].median_ms","bench[label=wayfinder][seq_len=4096].median_ms","bench[label=dense][seq_len=8192].median_ms","bench[label=wayfinder][seq_len=8192].median_ms","dense and wayfinder residency metadata for backbone module","no cpu or meta residency in backbone benchmark module","matching real-device placement for dense and wayfinder","bench[label=wayfinder].wayfinder_profiles","bench[label=wayfinder].wayfinder_active_layers==8","bench[label=wayfinder].wayfinder_profiles[*].sparse_contraction_backend","bench[label=wayfinder].wayfinder_profiles[*].sparse_contraction_cuda_ms","zero new kernel fault lines after kernel_log_since"]},"decision":"pending","next_action":"Patch sparse profile collection so the artifact preserves sparse_contraction_backend and a CUDA-event timing field, rerun the guarded 4096/8192 checkpoint on the current SDPA branch, then use the repaired observability to choose the next fused fixed-degree kernel experiment."}
