{"id":"EXP-20260318T204752Z-QWEN35CUDA-LOWTOKEN-AUTO-2048-RESULT","date":"2026-03-18","question":"After clean guarded runs through T=1024, does engine=auto remain stable at T=2048 without producing any new current-boot NVIDIA or OOM kernel events?","hypothesis":"engine=auto should continue to resolve to the non-flex Wayfinder path on this GB10, complete T=2048 cleanly, and keep Wayfinder fully active across all 8 swapped layers with bounded cache.","change_set":["measurement-only","notes/LAB_NOTEBOOK.md","notes/experiments.ndjson"],"command":".venv/bin/python scripts/bench_qwen35_cuda_wayfinder.py --model-path /home/hmbown/HF_Models/Qwen3.5-9B --seq-lens 2048 --engine auto --warmup 1 --repeats 1 --forward-target backbone --phases dense wayfinder --skip-divergence --output benchmarks/cuda/qwen35_wayfinder/EXP-20260318T204752Z-QWEN35CUDA-LOWTOKEN-AUTO-2048.ndjson && journalctl -b -k --since '2026-03-18 15:47:52' | rg -n 'NVRM|Xid|Out of memory|hung task|BUG:|Call Trace'","controls":{"baseline_run_path":"benchmarks/cuda/qwen35_wayfinder/EXP-20260318T204303Z-QWEN35CUDA-LOWTOKEN-AUTO-1024.ndjson","one_process_at_a_time":true,"lock_file":"benchmarks/cuda/qwen35_wayfinder/.bench_qwen35_cuda_wayfinder.lock","retro_backfill_inference":"off","model_path":"/home/hmbown/HF_Models/Qwen3.5-9B","device":"cuda","gpu":"NVIDIA GB10","device_capability":[12,1],"torch":"2.10.0+cu130","transformers":"5.3.0","forward_target":"backbone","engine_request":"auto","expected_engine_resolution":"non-flex","window":64,"landmark_stride":64,"num_cycles":1,"warmup":1,"repeats":1,"seq_lens":[2048],"kernel_log_since":"2026-03-18 15:47:52"},"metrics":{"status":"completed","artifact":"benchmarks/cuda/qwen35_wayfinder/EXP-20260318T204752Z-QWEN35CUDA-LOWTOKEN-AUTO-2048.ndjson","dense":{"median_ms":1220.4,"prefill_tok_per_sec":1678.1,"peak_mem_gb":17.11},"wayfinder":{"median_ms":1831.75,"prefill_tok_per_sec":1118.1,"peak_mem_gb":21.32,"wayfinder_active_layers":8,"wayfinder_graph_cache_entries_total":8,"engine":"batched"},"delta_vs_dense_abs":{"median_ms":611.35,"prefill_tok_per_sec":-560.0,"peak_mem_gb":4.21},"delta_vs_dense_pct":{"median_ms":50.09,"prefill_tok_per_sec":-33.37,"peak_mem_gb":24.61},"memory_reduction_pct_convention":"100*(1-wayfinder/dense)","memory_reduction_pct":-24.61,"kernel_fault_lines_after_start":0},"decision":"keep","next_action":"Stop the guarded ladder here for today; treat T<=2048 on the non-flex path as the demonstrated safe envelope on this GB10 and do not resume long-context or explicit flex runs without a separate go/no-go checkpoint."}
{"id":"EXP-20260318T205616Z-QWEN35CUDA-HCSA-PATH-PRERUN","date":"2026-03-18","question":"Can the Qwen CUDA benchmark/config be corrected so it defaults to the true Hamiltonian HCSA sparse path instead of hardcoding the permute-window surrogate, while still preserving the guarded CUDA behavior?","hypothesis":"Exposing benchmark CLI controls for path / strategy / seed / graph metrics, defaulting the benchmark path to sparse, and propagating those settings through both the Wayfinder benchmark phase and divergence phase will make the Qwen CUDA harness reflect the real HCSA graph by default without weakening the existing unsupported-flex safety guard.","change_set":["planned edits to scripts/bench_qwen35_cuda_wayfinder.py","possible adjacent CLI/default cleanup in scripts/serve_qwen_wayfinder_cuda.py","notes/LAB_NOTEBOOK.md","notes/experiments.ndjson"],"command":".venv/bin/python -m py_compile scripts/bench_qwen35_cuda_wayfinder.py scripts/serve_qwen_wayfinder_cuda.py && .venv/bin/python scripts/bench_qwen35_cuda_wayfinder.py --help && .venv/bin/python scripts/serve_qwen_wayfinder_cuda.py --help && .venv/bin/python -m pytest tests/pytorch -q","controls":{"no_model_inference":true,"no_benchmark_execution":true,"runtime":".venv","torch":"2.10.0+cu130","transformers":"5.3.0","preserve_unsupported_arch_guard":true},"metrics":{"status":"pending","required":["edited benchmark no longer hardcodes permute in Wayfinder phase","edited benchmark no longer hardcodes permute in divergence phase","py_compile exits 0","bench help exits 0","serve help exits 0","tests/pytorch exits 0"]},"decision":"pending","next_action":"Patch the benchmark/config wiring, run the bounded non-inference validation commands, and record the resulting default/CLI behavior with file references."}
{"id":"EXP-20260318T210010Z-QWEN35CUDA-HCSA-WIRING-PRERUN","date":"2026-03-18","question":"Do the Qwen CUDA bench and serve entrypoints currently force the permute surrogate instead of the true Hamiltonian sparse HCSA path, and can we fix that wiring without breaking lightweight validation?","hypothesis":"The bench currently hardcodes path='permute' and strategy='random', while the serve script defaults to the same surrogate. Exposing --path and --strategy, defaulting to path='sparse', and adding a small CLI regression test should restore the intended HCSA wiring without touching kernels.","change_set":["scripts/bench_qwen35_cuda_wayfinder.py","scripts/serve_qwen_wayfinder_cuda.py","tests/test_qwen_cuda_wayfinder_cli.py"],"command":".venv/bin/python -m py_compile hcsa/integrations/qwen_torch.py hcsa/torch/attention_wayfinder_sparse.py hcsa/torch/attention_wayfinder_permute.py scripts/bench_qwen35_cuda_wayfinder.py scripts/serve_qwen_wayfinder_cuda.py tests/test_qwen_cuda_wayfinder_cli.py && .venv/bin/python scripts/bench_qwen35_cuda_wayfinder.py --help && .venv/bin/python scripts/serve_qwen_wayfinder_cuda.py --help && .venv/bin/python -m pytest tests/test_qwen_cuda_wayfinder_cli.py tests/pytorch/test_torch_causality.py tests/pytorch/test_torch_dense_limit_equivalence.py tests/pytorch/test_torch_matches_mlx_reference_small.py -q","controls":{"inference_runs":0,"kernel_runtime_changes":0,"qwen_cuda_integration_kernel_changes":0},"metrics":{"status":"pending","required":["py_compile success","bench help exposes --path/--strategy","serve help exposes --path","pytest selected suite passes"]},"decision":"pending","next_action":"Run the lightweight validation suite and confirm the scripts now wire the sparse Hamiltonian path instead of silently forcing permute."}
{"id":"EXP-20260318T210010Z-QWEN35CUDA-HCSA-WIRING-RESULT","date":"2026-03-18","question":"Do the Qwen CUDA bench and serve entrypoints currently force the permute surrogate instead of the true Hamiltonian sparse HCSA path, and can we fix that wiring without breaking lightweight validation?","hypothesis":"The bench currently hardcodes path='permute' and strategy='random', while the serve script defaults to the same surrogate. Exposing --path and --strategy, defaulting to path='sparse', and adding a small CLI regression test should restore the intended HCSA wiring without touching kernels.","change_set":["scripts/bench_qwen35_cuda_wayfinder.py","scripts/serve_qwen_wayfinder_cuda.py","tests/test_qwen_cuda_wayfinder_cli.py","notes/LAB_NOTEBOOK.md","notes/experiments.ndjson"],"command":".venv/bin/python -m py_compile hcsa/integrations/qwen_torch.py hcsa/torch/attention_wayfinder_sparse.py hcsa/torch/attention_wayfinder_permute.py scripts/bench_qwen35_cuda_wayfinder.py scripts/serve_qwen_wayfinder_cuda.py tests/test_qwen_cuda_wayfinder_cli.py && .venv/bin/python scripts/bench_qwen35_cuda_wayfinder.py --help && .venv/bin/python scripts/serve_qwen_wayfinder_cuda.py --help && .venv/bin/python -m pytest tests/test_qwen_cuda_wayfinder_cli.py tests/pytorch/test_torch_causality.py tests/pytorch/test_torch_dense_limit_equivalence.py tests/pytorch/test_torch_matches_mlx_reference_small.py -q","controls":{"inference_runs":0,"kernel_runtime_changes":0,"qwen_cuda_integration_kernel_changes":0},"metrics":{"status":"completed","py_compile_exit_code":0,"bench_help_exit_code":0,"bench_help_has_path":true,"bench_help_has_strategy":true,"bench_help_has_seed":true,"bench_help_has_compute_graph_metrics":true,"serve_help_exit_code":0,"serve_help_has_path":true,"serve_default_path_verified_by_test":"sparse","pytest":{"passed":10,"skipped":1,"failed":0},"warnings":["GB10 capability 12.1 exceeds this torch build's advertised max of 12.0"]},"decision":"keep","next_action":"If you want semantic on-device validation next, run a bounded low-token benchmark with --path sparse and --compute-graph-metrics before any longer sweep."}
{"id":"EXP-20260318T205616Z-QWEN35CUDA-HCSA-PATH-RESULT","date":"2026-03-18","question":"Can the Qwen CUDA benchmark/config be corrected so it defaults to the true Hamiltonian HCSA sparse path instead of hardcoding the permute-window surrogate, while still preserving the guarded CUDA behavior?","hypothesis":"Exposing benchmark CLI controls for path / strategy / seed / graph metrics, defaulting the benchmark path to sparse, and propagating those settings through both the Wayfinder benchmark phase and divergence phase will make the Qwen CUDA harness reflect the real HCSA graph by default without weakening the existing unsupported-flex safety guard.","change_set":["scripts/bench_qwen35_cuda_wayfinder.py","scripts/serve_qwen_wayfinder_cuda.py","notes/LAB_NOTEBOOK.md","notes/experiments.ndjson"],"command":".venv/bin/python -m py_compile scripts/bench_qwen35_cuda_wayfinder.py scripts/serve_qwen_wayfinder_cuda.py && .venv/bin/python scripts/bench_qwen35_cuda_wayfinder.py --help && .venv/bin/python scripts/serve_qwen_wayfinder_cuda.py --help && .venv/bin/python -m pytest tests/pytorch -q","controls":{"no_model_inference":true,"no_benchmark_execution":true,"runtime":".venv","torch":"2.10.0+cu130","transformers":"5.3.0","preserve_unsupported_arch_guard":true},"metrics":{"status":"completed","changed_defaults":{"bench_path":"sparse","serve_path":"sparse"},"new_bench_cli":["--path","--strategy","--seed","--compute-graph-metrics"],"wiring":{"wayfinder_phase_uses_user_path":true,"wayfinder_phase_uses_user_strategy":true,"divergence_phase_uses_user_path":true,"divergence_phase_uses_user_strategy":true,"result_rows_record_path_strategy_seed":true,"profile_rows_record_strategy_graph_source":true,"sparse_path_logs_engine_ignored":true},"validation":{"py_compile_exit_code":0,"bench_help_exit_code":0,"serve_help_exit_code":0,"pytest":{"passed":61,"skipped":1}},"warnings":["existing pytest.mark.slow registration warning","existing PyTorch GB10 capability 12.1 vs max advertised 12.0 warning"]},"decision":"keep","next_action":"Run the next bounded Qwen CUDA smoke with --path sparse --compute-graph-metrics at low token counts before any further long-context work, so the artifact itself proves the Hamiltonian graph metrics and sparse activation shape."}
{"id":"EXP-20260318T210720Z-QWEN35CUDA-SPARSE-LOWTOKEN-METRICS-PRERUN","date":"2026-03-18","question":"On the newly restored Hamiltonian HCSA path, does a bounded low-token Qwen CUDA run at T=64/128/256 complete cleanly while proving that the true sparse path and graph metrics are actually active?","hypothesis":"With --path sparse --compute-graph-metrics, Wayfinder should activate on all 8 swapped layers, report non-null graph metrics in the per-layer profiles, and complete 64/128/256 without any new current-boot NVIDIA or OOM kernel events. Performance may still trail dense at these short contexts, but the artifact should now prove Hamiltonian graph semantics instead of only a permute surrogate.","change_set":["measurement-only"],"command":".venv/bin/python scripts/bench_qwen35_cuda_wayfinder.py --model-path /home/hmbown/HF_Models/Qwen3.5-9B --seq-lens 64 128 256 --path sparse --strategy random --compute-graph-metrics --engine auto --warmup 1 --repeats 1 --forward-target backbone --phases dense wayfinder --skip-divergence --output benchmarks/cuda/qwen35_wayfinder/EXP-20260318T210720Z-QWEN35CUDA-SPARSE-LOWTOKEN-METRICS.ndjson && journalctl -b -k --since '2026-03-18 16:07:20' | rg -n 'NVRM|Xid|Out of memory|hung task|BUG:|Call Trace'","controls":{"baseline_run_path":"benchmarks/cuda/qwen35_wayfinder/EXP-20260318T201433Z-QWEN35CUDA-LOWTOKEN-BATCHED.ndjson","supplemental_baseline_path_t256":"benchmarks/cuda/qwen35_wayfinder/EXP-20260318T203050Z-QWEN35CUDA-LOWTOKEN-AUTO-256.ndjson","one_process_at_a_time":true,"lock_file":"benchmarks/cuda/qwen35_wayfinder/.bench_qwen35_cuda_wayfinder.lock","retro_backfill_inference":"off","model_path":"/home/hmbown/HF_Models/Qwen3.5-9B","device":"cuda","gpu":"NVIDIA GB10","device_capability":[12,1],"torch":"2.10.0+cu130","transformers":"5.3.0","path":"sparse","strategy":"random","compute_graph_metrics":true,"forward_target":"backbone","window":64,"landmark_stride":64,"num_cycles":1,"engine_request":"auto","warmup":1,"repeats":1,"seq_lens":[64,128,256],"kernel_log_since":"2026-03-18 16:07:20"},"metrics":{"status":"pending","artifacts_expected":["benchmarks/cuda/qwen35_wayfinder/EXP-20260318T210720Z-QWEN35CUDA-SPARSE-LOWTOKEN-METRICS.ndjson"],"required":["bench[label=dense].median_ms","bench[label=dense].prefill_tok_per_sec","bench[label=dense].peak_mem_gb","bench[label=wayfinder].median_ms","bench[label=wayfinder].prefill_tok_per_sec","bench[label=wayfinder].peak_mem_gb","bench[label=wayfinder].wayfinder_profiles","bench[label=wayfinder].wayfinder_profiles[].path==sparse","bench[label=wayfinder].wayfinder_profiles[].graph_metrics not all null","zero new kernel fault lines after kernel_log_since"]},"decision":"pending","next_action":"Run the bounded sparse low-token benchmark, inspect the artifact for sparse-path graph metrics and active layers, and stop immediately if any new kernel fault appears."}
{"id":"EXP-20260318T210720Z-QWEN35CUDA-SPARSE-LOWTOKEN-METRICS-RESULT","date":"2026-03-18","question":"On the newly restored Hamiltonian HCSA path, does a bounded low-token Qwen CUDA run at T=64/128/256 complete cleanly while proving that the true sparse path and graph metrics are actually active?","hypothesis":"With --path sparse --compute-graph-metrics, Wayfinder should activate on all 8 swapped layers, report non-null graph metrics in the per-layer profiles, and complete 64/128/256 without any new current-boot NVIDIA or OOM kernel events. Performance may still trail dense at these short contexts, but the artifact should now prove Hamiltonian graph semantics instead of only a permute surrogate.","change_set":["measurement-only","notes/LAB_NOTEBOOK.md","notes/experiments.ndjson"],"command":".venv/bin/python scripts/bench_qwen35_cuda_wayfinder.py --model-path /home/hmbown/HF_Models/Qwen3.5-9B --seq-lens 64 128 256 --path sparse --strategy random --compute-graph-metrics --engine auto --warmup 1 --repeats 1 --forward-target backbone --phases dense wayfinder --skip-divergence --output benchmarks/cuda/qwen35_wayfinder/EXP-20260318T210720Z-QWEN35CUDA-SPARSE-LOWTOKEN-METRICS.ndjson && journalctl -b -k --since '2026-03-18 16:07:20' | rg -n 'NVRM|Xid|Out of memory|hung task|BUG:|Call Trace'","controls":{"baseline_run_path":"benchmarks/cuda/qwen35_wayfinder/EXP-20260318T201433Z-QWEN35CUDA-LOWTOKEN-BATCHED.ndjson","supplemental_baseline_path_t256":"benchmarks/cuda/qwen35_wayfinder/EXP-20260318T203050Z-QWEN35CUDA-LOWTOKEN-AUTO-256.ndjson","one_process_at_a_time":true,"lock_file":"benchmarks/cuda/qwen35_wayfinder/.bench_qwen35_cuda_wayfinder.lock","retro_backfill_inference":"off","model_path":"/home/hmbown/HF_Models/Qwen3.5-9B","device":"cuda","gpu":"NVIDIA GB10","device_capability":[12,1],"torch":"2.10.0+cu130","transformers":"5.3.0","path":"sparse","strategy":"random","compute_graph_metrics":true,"forward_target":"backbone","window":64,"landmark_stride":64,"num_cycles":1,"engine_request":"auto","warmup":1,"repeats":1,"seq_lens":[64,128,256],"kernel_log_since":"2026-03-18 16:07:20"},"metrics":{"status":"completed","artifact":"benchmarks/cuda/qwen35_wayfinder/EXP-20260318T210720Z-QWEN35CUDA-SPARSE-LOWTOKEN-METRICS.ndjson","dense":{"64":{"median_ms":147.15,"prefill_tok_per_sec":434.9,"peak_mem_gb":16.71},"128":{"median_ms":165.14,"prefill_tok_per_sec":775.1,"peak_mem_gb":16.72},"256":{"median_ms":212.65,"prefill_tok_per_sec":1203.9,"peak_mem_gb":16.74}},"wayfinder":{"64":{"median_ms":179.98,"prefill_tok_per_sec":355.6,"peak_mem_gb":16.89,"wayfinder_active_layers":8,"wayfinder_graph_cache_entries_total":8},"128":{"median_ms":240.86,"prefill_tok_per_sec":531.4,"peak_mem_gb":17.11,"wayfinder_active_layers":8,"wayfinder_graph_cache_entries_total":8},"256":{"median_ms":352.44,"prefill_tok_per_sec":726.4,"peak_mem_gb":17.56,"wayfinder_active_layers":8,"wayfinder_graph_cache_entries_total":8}},"delta_vs_dense_abs":{"64":{"median_ms":32.83,"prefill_tok_per_sec":-79.3,"peak_mem_gb":0.18},"128":{"median_ms":75.72,"prefill_tok_per_sec":-243.7,"peak_mem_gb":0.39},"256":{"median_ms":139.79,"prefill_tok_per_sec":-477.5,"peak_mem_gb":0.82}},"delta_vs_dense_pct":{"64":{"median_ms":22.31,"prefill_tok_per_sec":-18.23,"peak_mem_gb":1.08},"128":{"median_ms":45.85,"prefill_tok_per_sec":-31.44,"peak_mem_gb":2.33},"256":{"median_ms":65.74,"prefill_tok_per_sec":-39.66,"peak_mem_gb":4.9}},"memory_reduction_pct_convention":"100*(1-wayfinder/dense)","memory_reduction_pct":{"64":-1.08,"128":-2.33,"256":-4.9},"delta_vs_perm_baseline_abs":{"64":{"median_ms":10.4,"prefill_tok_per_sec":-21.8,"peak_mem_gb":0.06},"128":{"median_ms":41.41,"prefill_tok_per_sec":-110.4,"peak_mem_gb":0.13},"256":{"median_ms":89.22,"prefill_tok_per_sec":-246.2,"peak_mem_gb":0.29}},"delta_vs_perm_baseline_pct":{"64":{"median_ms":6.13,"prefill_tok_per_sec":-5.78,"peak_mem_gb":0.36},"128":{"median_ms":20.76,"prefill_tok_per_sec":-17.2,"peak_mem_gb":0.77},"256":{"median_ms":33.9,"prefill_tok_per_sec":-25.31,"peak_mem_gb":1.68}},"graph_metrics":{"64":{"graph_source":"runtime","degree_mean":33.5,"max_degree":64,"shortcut_rate":0.984375,"reachability_proxy":64.0,"edge_type_counts":{"cycle":512,"window":7820,"landmark":244,"rewire":0}},"128":{"graph_source":"runtime","degree_mean":50.466796875,"max_degree":68,"shortcut_rate":0.990234375,"reachability_proxy":128.0,"edge_type_counts":{"cycle":1024,"window":24067,"landmark":748,"rewire":0}},"256":{"graph_source":"runtime","degree_mean":59.9111328125,"max_degree":70,"shortcut_rate":0.9931640625,"reachability_proxy":256.0,"edge_type_counts":{"cycle":2048,"window":56779,"landmark":2522,"rewire":0}}},"kernel_fault_lines_after_start":0},"decision":"keep","next_action":"The semantics are now proven. Compare Hamiltonian strategies next (regular_partition or greedy) at the same low-token window before attempting longer sparse runs."}
{"id":"EXP-20260318T211835Z-QWEN35CUDA-SPARSE-512-PRERUN","date":"2026-03-18","question":"After proving sparse Hamiltonian semantics at 64/128/256, does the same path=sparse configuration remain stable and semantically intact at T=512 without any new current-boot NVIDIA or OOM kernel events?","hypothesis":"T=512 should complete cleanly on the true sparse path, keep 8/8 active Wayfinder layers, and continue to report path='sparse', graph_source='runtime', and non-null graph metrics on every active profile. Performance may still trail dense at this context.","change_set":["measurement-only"],"command":".venv/bin/python scripts/bench_qwen35_cuda_wayfinder.py --model-path /home/hmbown/HF_Models/Qwen3.5-9B --seq-lens 512 --path sparse --strategy random --compute-graph-metrics --engine auto --warmup 1 --repeats 1 --forward-target backbone --phases dense wayfinder --skip-divergence --output benchmarks/cuda/qwen35_wayfinder/EXP-20260318T211835Z-QWEN35CUDA-SPARSE-512.ndjson && journalctl -b -k --since '2026-03-18 16:18:35' | rg -n 'NVRM|Xid|Out of memory|hung task|BUG:|Call Trace'","controls":{"baseline_run_path":"benchmarks/cuda/qwen35_wayfinder/EXP-20260318T210720Z-QWEN35CUDA-SPARSE-LOWTOKEN-METRICS.ndjson","supplemental_perm_baseline_path":"benchmarks/cuda/qwen35_wayfinder/EXP-20260318T203600Z-QWEN35CUDA-LOWTOKEN-AUTO-512.ndjson","one_process_at_a_time":true,"lock_file":"benchmarks/cuda/qwen35_wayfinder/.bench_qwen35_cuda_wayfinder.lock","retro_backfill_inference":"off","model_path":"/home/hmbown/HF_Models/Qwen3.5-9B","device":"cuda","gpu":"NVIDIA GB10","device_capability":[12,1],"torch":"2.10.0+cu130","transformers":"5.3.0","path":"sparse","strategy":"random","compute_graph_metrics":true,"forward_target":"backbone","window":64,"landmark_stride":64,"num_cycles":1,"engine_request":"auto","warmup":1,"repeats":1,"seq_lens":[512],"kernel_log_since":"2026-03-18 16:18:35"},"metrics":{"status":"pending","artifacts_expected":["benchmarks/cuda/qwen35_wayfinder/EXP-20260318T211835Z-QWEN35CUDA-SPARSE-512.ndjson"],"required":["bench[label=dense].median_ms","bench[label=dense].prefill_tok_per_sec","bench[label=dense].peak_mem_gb","bench[label=wayfinder].median_ms","bench[label=wayfinder].prefill_tok_per_sec","bench[label=wayfinder].peak_mem_gb","bench[label=wayfinder].wayfinder_profiles","bench[label=wayfinder].wayfinder_profiles[].path==sparse","bench[label=wayfinder].wayfinder_profiles[].graph_metrics not all null","zero new kernel fault lines after kernel_log_since"]},"decision":"pending","next_action":"Run the sparse 512 checkpoint, inspect the artifact for sparse-path graph metrics and active layers, and stop immediately if any new kernel fault appears."}
