{"id":"EXP-20260215T202508Z-GLM65K-REGRESSION-TRACE-PRERUN","date":"2026-02-15","question":"Why is Wayfinder slower than dense at T=65536 despite sparse theoretical advantage, and which operational bottleneck dominates?","hypothesis":"The 65k regression is dominated by overhead (graph build/cache and/or permutation gather bandwidth) rather than sparse arithmetic; dense fallback share may contribute during prefill.","change_set":["measurement only"],"command":"dense: python3 scripts/bench_glm_consumer_mlx.py --model-path mlx-community/GLM-4.7-Flash-4bit --mode dense --seq-lens 65536 --decode-len 32 --repeats 1 --skip-multi-turn --skip-quality --out-dir benchmarks/mlx/glm_4_7_flash_4bit_wayfinder/20260215_glm65k_regression_dense ; wayfinder+trace: python3 scripts/bench_glm_consumer_mlx.py --model-path mlx-community/GLM-4.7-Flash-4bit --mode wayfinder --seq-lens 65536 --decode-len 32 --repeats 1 --skip-multi-turn --skip-quality --hsa-trace --out-dir benchmarks/mlx/glm_4_7_flash_4bit_wayfinder/20260215_glm65k_regression_wayfinder_trace ; microprofiles: python3 (construct_perms_only) + python3 (K/V gather bandwidth)","controls":{"model":"mlx-community/GLM-4.7-Flash-4bit","seq_len":65536,"decode_len":32,"repeats":1,"skip_multi_turn":true,"skip_quality":true,"baseline_dense":"benchmarks/mlx/glm_4_7_flash_4bit_wayfinder/20260215_glm65k_regression_dense/results.json","candidate_wayfinder_trace":"benchmarks/mlx/glm_4_7_flash_4bit_wayfinder/20260215_glm65k_regression_wayfinder_trace/results.json"},"metrics":{"status":"pending","required":["path_counts","dense_fallback_reason_counts","dense_fallback_share_run","graph_build_ms","attention_ms","prefill_vs_decode_responsibility","construct_perms_only_runtime_ms","kv_gather_effective_bandwidth_gbps","delta_vs_dense_abs","delta_vs_dense_pct"]},"decision":"pending","next_action":"Run paired 65k dense/wayfinder traces, attribute bottleneck, then implement bottleneck-specific fix without adding new tuning knobs."}
{"id":"EXP-20260215T211919Z-GLM65K-ACTIVE-LARGEQ-FIX-PRERUN","date":"2026-02-15","question":"Does removing large-q active prefill forced dense fallback (under fast perms-only build) reduce 65k wayfinder latency by increasing actual sparse/permute execution?","hypothesis":"At T=65536, current runtime is bottlenecked by routing (dense fallback share ~98%). Relaxing active_large_q dense fallback for fast-permute builds should lower prefill latency and increase non-fallback path counts.","change_set":["hcsa/integrations/glm_mlx.py (force_dense_large_active gating)"],"command":"python3 scripts/bench_glm_consumer_mlx.py --model-path mlx-community/GLM-4.7-Flash-4bit --mode wayfinder --seq-lens 65536 --decode-len 32 --repeats 1 --skip-multi-turn --skip-quality --hsa-trace --out-dir benchmarks/mlx/glm_4_7_flash_4bit_wayfinder/20260215_glm65k_regression_wayfinder_trace_fix_active_largeq","controls":{"same_flags_as_prefix_wayfinder_trace":true,"dense_baseline":"benchmarks/mlx/glm_4_7_flash_4bit_wayfinder/20260215_glm65k_regression_dense/results.json","prefix_wayfinder":"benchmarks/mlx/glm_4_7_flash_4bit_wayfinder/20260215_glm65k_regression_wayfinder_trace/results.json"},"metrics":{"status":"pending","required":["e2e_sec","prefill_sec","decode_sec","decode_tok_s","peak_memory_bytes","path_counts","dense_fallback_reason_counts","dense_fallback_share_run","delta_vs_dense_abs","delta_vs_dense_pct","delta_vs_prefix_abs","delta_vs_prefix_pct"]},"decision":"pending","next_action":"Apply code patch, run post-fix wayfinder trace benchmark, and compare routing/timing deltas."}
{"id":"EXP-20260215T214915Z-GLM65K-DECODE-GATING-FIX-PRERUN","date":"2026-02-15","question":"Is wayfinder_decode_backend=dense incorrectly forcing dense fallback during active prefill, and does decode-only gating restore sparse routing and lower 65k latency?","hypothesis":"The decode backend gate currently applies to all active queries; adding q_len<=2 will stop prefill from being forced dense by decode policy and increase wayfinder-path share.","change_set":["hcsa/integrations/glm_mlx.py (force_dense_wayfinder_decode condition)"],"command":"python3 scripts/bench_glm_consumer_mlx.py --model-path mlx-community/GLM-4.7-Flash-4bit --mode wayfinder --seq-lens 65536 --decode-len 32 --repeats 1 --skip-multi-turn --skip-quality --hsa-trace --out-dir benchmarks/mlx/glm_4_7_flash_4bit_wayfinder/20260215_glm65k_regression_wayfinder_trace_fix_decode_gate","controls":{"same_flags":true,"dense_baseline":"benchmarks/mlx/glm_4_7_flash_4bit_wayfinder/20260215_glm65k_regression_dense/results.json","prior_wayfinder":"benchmarks/mlx/glm_4_7_flash_4bit_wayfinder/20260215_glm65k_regression_wayfinder_trace/results.json","intermediate_patch_wayfinder":"benchmarks/mlx/glm_4_7_flash_4bit_wayfinder/20260215_glm65k_regression_wayfinder_trace_fix_active_largeq/results.json"},"metrics":{"status":"pending","required":["path_counts","dense_fallback_reason_counts","dense_fallback_share_run","dense_fallback_share_prefill_steps","dense_fallback_share_decode_steps","e2e_sec","prefill_sec","decode_sec","decode_tok_s","peak_memory_bytes","delta_vs_dense_abs","delta_vs_dense_pct","delta_vs_prior_wayfinder_abs","delta_vs_prior_wayfinder_pct"]},"decision":"pending","next_action":"Apply decode-only gate patch and run one 65k wayfinder trace benchmark."}
{"id":"EXP-20260215T220805Z-GLM65K-ACTIVE-GATHER-INDEX-MEM-FIX-PRERUN","date":"2026-02-15","question":"Can large-q active prefill complete at 65k if the gather index broadcast in _active_via_gather is removed?","hypothesis":"Broadcasting gather indices to [B,N,dh] is a major transient-memory spike; using mx.take with 1-D indices should reduce memory pressure and let the run complete.","change_set":["hcsa/mlx/fused_attention.py (K/V gather indexing path)"],"command":"python3 scripts/bench_glm_consumer_mlx.py --model-path mlx-community/GLM-4.7-Flash-4bit --mode wayfinder --seq-lens 65536 --decode-len 32 --repeats 1 --skip-multi-turn --skip-quality --hsa-trace --out-dir benchmarks/mlx/glm_4_7_flash_4bit_wayfinder/20260215_glm65k_regression_wayfinder_trace_fix_decode_gate_gathermem","controls":{"same_flags":true,"requires_existing_glm_gating_patches":true,"dense_baseline":"benchmarks/mlx/glm_4_7_flash_4bit_wayfinder/20260215_glm65k_regression_dense/results.json"},"metrics":{"status":"pending","required":["single_turn_present","e2e_sec","prefill_sec","decode_sec","decode_tok_s","peak_memory_bytes","path_counts","dense_fallback_reason_counts","dense_fallback_share_run"]},"decision":"pending","next_action":"Patch gather indexing to avoid broadcast expansion, then run one 65k wayfinder trace benchmark."}
{"id":"EXP-20260215T224128Z-GLM65K-LARGEQ-GATHER-POLICY-PRERUN","date":"2026-02-15","question":"For large active prefill blocks at 65k, is gather-path routing faster than full-prefill active routing?","hypothesis":"Full-prefill active path is too expensive for large Tq due padded full-length attention; forcing gather for large active blocks should reduce prefill latency.","change_set":["hcsa/mlx/fused_attention.py (active path selection policy)"],"command":"python3 scripts/bench_glm_consumer_mlx.py --model-path mlx-community/GLM-4.7-Flash-4bit --mode wayfinder --seq-lens 65536 --decode-len 32 --repeats 1 --skip-multi-turn --skip-quality --hsa-trace --out-dir benchmarks/mlx/glm_4_7_flash_4bit_wayfinder/20260215_glm65k_regression_wayfinder_trace_fix_largeq_gather_policy","controls":{"same_flags":true,"retains_prior_gating_and_gather_index_patches":true,"dense_baseline":"benchmarks/mlx/glm_4_7_flash_4bit_wayfinder/20260215_glm65k_regression_dense/results.json","pre_fix_wayfinder":"benchmarks/mlx/glm_4_7_flash_4bit_wayfinder/20260215_glm65k_regression_wayfinder_trace/results.json"},"metrics":{"status":"pending","required":["single_turn_present","e2e_sec","prefill_sec","decode_sec","decode_tok_s","path_counts","dense_fallback_reason_counts","dense_fallback_share_run","graph_seq_len_counts","delta_vs_dense_abs","delta_vs_dense_pct","delta_vs_pre_fix_abs","delta_vs_pre_fix_pct"]},"decision":"pending","next_action":"Patch active path policy for large Tq and run one 65k trace benchmark."}
{"id":"EXP-20260215T230713Z-GLM65K-DECODE256-POSTPATCH-PRERUN","date":"2026-02-15","question":"With current patches, does wayfinder still regress at T=65536 decode_len=256 versus dense baseline?","hypothesis":"Reducing dense-fallback overuse should narrow or eliminate the observed long-context decode256 slowdown.","change_set":["existing local patches in hcsa/integrations/glm_mlx.py and hcsa/mlx/fused_attention.py"],"command":"python3 scripts/bench_glm_consumer_mlx.py --model-path mlx-community/GLM-4.7-Flash-4bit --mode wayfinder --seq-lens 65536 --decode-len 256 --repeats 1 --skip-multi-turn --skip-quality --out-dir benchmarks/mlx/glm_4_7_flash_4bit_wayfinder/20260215_glm65k_decode256_wayfinder_postpatch","controls":{"model":"mlx-community/GLM-4.7-Flash-4bit","seq_len":65536,"decode_len":256,"skip_multi_turn":true,"skip_quality":true,"dense_baseline_path":"benchmarks/mlx/glm_4_7_flash_4bit_wayfinder/20260215_glm47_longctx_dense_rerun1/results.json"},"metrics":{"status":"pending","required":["e2e_sec","prefill_sec","decode_sec","ttft_sec","decode_tok_s","peak_memory_bytes","delta_vs_dense_abs","delta_vs_dense_pct","memory_reduction_pct_convention"]},"decision":"pending","next_action":"Run decode256 wayfinder benchmark and compare against dense baseline."}
{"id":"EXP-20260215T231628Z-GLM65K-DECODE256-DENSE-COMPANION-PRERUN","date":"2026-02-15","question":"What is same-session dense baseline at T=65536 decode_len=256 with identical skip settings?","hypothesis":"A same-session dense run provides the correct denominator for post-patch wayfinder deltas.","change_set":["measurement only"],"command":"python3 scripts/bench_glm_consumer_mlx.py --model-path mlx-community/GLM-4.7-Flash-4bit --mode dense --seq-lens 65536 --decode-len 256 --repeats 1 --skip-multi-turn --skip-quality --out-dir benchmarks/mlx/glm_4_7_flash_4bit_wayfinder/20260215_glm65k_decode256_dense_postpatch","controls":{"same_as_postpatch_wayfinder_decode256":true},"metrics":{"status":"pending","required":["e2e_sec","prefill_sec","decode_sec","ttft_sec","decode_tok_s","peak_memory_bytes"]},"decision":"pending","next_action":"Run dense companion and compute final dense-vs-wayfinder deltas."}
{"id":"EXP-20260215T202508Z-GLM65K-REGRESSION-TRACE-RESULT","date":"2026-02-15","question":"Why is Wayfinder slower than dense at T=65536 despite sparse theoretical advantage, and which operational bottleneck dominates?","hypothesis":"The 65k regression is dominated by overhead (graph build/cache and/or permutation gather bandwidth) rather than sparse arithmetic; dense fallback share may contribute during prefill.","change_set":["measurement only"],"command":"dense+wayfinder trace pair at T=65536 decode_len=32 plus construct_perms_only and gather microprofiles","controls":{"model":"mlx-community/GLM-4.7-Flash-4bit","seq_len":65536,"decode_len":32,"repeats":1,"skip_multi_turn":true,"skip_quality":true,"dense_path":"benchmarks/mlx/glm_4_7_flash_4bit_wayfinder/20260215_glm65k_regression_dense/results.json","wayfinder_path":"benchmarks/mlx/glm_4_7_flash_4bit_wayfinder/20260215_glm65k_regression_wayfinder_trace/results.json"},"metrics":{"dense":{"e2e_sec":1576.6736350410501,"prefill_sec":1540.1386148750316,"decode_sec":36.53502016601851,"decode_tok_s":0.8758719676241874,"peak_memory_bytes":33160809276},"wayfinder":{"e2e_sec":1165.4216264179558,"prefill_sec":1125.6156107090064,"decode_sec":39.80601570894942,"decode_tok_s":0.8038985924633893,"peak_memory_bytes":33162810412},"delta_vs_dense":{"e2e_sec":-411.2520086230943,"e2e_pct":-26.083521629534122,"prefill_sec":-414.5230041660252,"prefill_pct":-26.914655613622152,"decode_sec":3.2709955429309048,"decode_pct":8.953041569615117,"memory_reduction_pct_convention":-0.006034641625740633},"trace":{"path_counts":{"wayfinder":8,"wayfinder_dense_fallback":376},"dense_fallback_reason_counts":{"active_large_q":120,"unspecified":256},"dense_fallback_share_run":0.9791666666666666,"dense_fallback_share_prefill_steps":0.9375,"dense_fallback_share_decode_steps":1.0},"microprofiles":{"construct_perms_only_ms_mean":18.408380121400114,"construct_perms_only_ms_p50":19.09649997833185,"gather_mean_ms":4.631847017056619,"gather_effective_gib_s_read_only":101.99216589739655}},"decision":"follow-up","next_action":"Target dense-fallback routing bottleneck; graph build was not dominant."}
{"id":"EXP-20260215T211919Z-GLM65K-ACTIVE-LARGEQ-FIX-RESULT","date":"2026-02-15","question":"Does removing large-q active prefill forced dense fallback (under fast perms-only build) reduce 65k wayfinder latency by increasing actual sparse/permute execution?","hypothesis":"At T=65536, current runtime is bottlenecked by routing (dense fallback share ~98%). Relaxing active_large_q dense fallback for fast-permute builds should lower prefill latency and increase non-fallback path counts.","change_set":["hcsa/integrations/glm_mlx.py force_dense_large_active gating"],"command":"python3 scripts/bench_glm_consumer_mlx.py --model-path mlx-community/GLM-4.7-Flash-4bit --mode wayfinder --seq-lens 65536 --decode-len 32 --repeats 1 --skip-multi-turn --skip-quality --hsa-trace --out-dir benchmarks/mlx/glm_4_7_flash_4bit_wayfinder/20260215_glm65k_regression_wayfinder_trace_fix_active_largeq","controls":{"dense_baseline":"benchmarks/mlx/glm_4_7_flash_4bit_wayfinder/20260215_glm65k_regression_dense/results.json","prefix_wayfinder":"benchmarks/mlx/glm_4_7_flash_4bit_wayfinder/20260215_glm65k_regression_wayfinder_trace/results.json"},"metrics":{"e2e_sec":1593.613803834014,"prefill_sec":1547.3235251670121,"decode_sec":46.290278667001985,"decode_tok_s":0.6912898544033003,"peak_memory_bytes":33162810412,"path_counts":{"wayfinder":8,"wayfinder_dense_fallback":376},"dense_fallback_reason_counts":{"unspecified":376},"dense_fallback_share_run":0.9791666666666666,"delta_vs_dense_e2e_sec":16.94016879296396,"delta_vs_dense_e2e_pct":1.0744245617148929},"decision":"revert_or_supersede","next_action":"Isolate decode-only dense gating; this change alone did not improve routing."}
{"id":"EXP-20260215T214915Z-GLM65K-DECODE-GATING-FIX-RESULT","date":"2026-02-15","question":"Is wayfinder_decode_backend=dense incorrectly forcing dense fallback during active prefill, and does decode-only gating restore sparse routing and lower 65k latency?","hypothesis":"The decode backend gate currently applies to all active queries; adding q_len<=2 will stop prefill from being forced dense by decode policy and increase wayfinder-path share.","change_set":["hcsa/integrations/glm_mlx.py force_dense_wayfinder_decode condition"],"command":"python3 scripts/bench_glm_consumer_mlx.py --model-path mlx-community/GLM-4.7-Flash-4bit --mode wayfinder --seq-lens 65536 --decode-len 32 --repeats 1 --skip-multi-turn --skip-quality --hsa-trace --out-dir benchmarks/mlx/glm_4_7_flash_4bit_wayfinder/20260215_glm65k_regression_wayfinder_trace_fix_decode_gate","controls":{"same_flags":true},"metrics":{"single_turn_present":false,"status":"serialization_failed"},"decision":"follow-up","next_action":"Reduce active gather memory pressure and rerun."}
{"id":"EXP-20260215T220805Z-GLM65K-ACTIVE-GATHER-INDEX-MEM-FIX-RESULT","date":"2026-02-15","question":"Can large-q active prefill complete at 65k if the gather index broadcast in _active_via_gather is removed?","hypothesis":"Broadcasting gather indices to [B,N,dh] is a major transient-memory spike; using mx.take with 1-D indices should reduce memory pressure and let the run complete.","change_set":["hcsa/mlx/fused_attention.py gather indexing"],"command":"python3 scripts/bench_glm_consumer_mlx.py --model-path mlx-community/GLM-4.7-Flash-4bit --mode wayfinder --seq-lens 65536 --decode-len 32 --repeats 1 --skip-multi-turn --skip-quality --hsa-trace --out-dir benchmarks/mlx/glm_4_7_flash_4bit_wayfinder/20260215_glm65k_regression_wayfinder_trace_fix_decode_gate_gathermem","controls":{"dense_baseline":"benchmarks/mlx/glm_4_7_flash_4bit_wayfinder/20260215_glm65k_regression_dense/results.json"},"metrics":{"single_turn_present":true,"e2e_sec":1732.251701415982,"prefill_sec":1690.32191233302,"decode_sec":41.92978908296209,"decode_tok_s":0.7631805620744943,"peak_memory_bytes":32641251032,"path_counts":{"wayfinder":128,"wayfinder_dense_fallback":256},"dense_fallback_share_run":0.6666666666666666,"dense_fallback_share_prefill_steps":0.0,"dense_fallback_share_decode_steps":1.0,"delta_vs_dense_e2e_sec":155.57806637493195,"delta_vs_dense_e2e_pct":9.867487025676148},"decision":"follow-up","next_action":"Change large-Tq active policy away from full-prefill path."}
{"id":"EXP-20260215T224128Z-GLM65K-LARGEQ-GATHER-POLICY-RESULT","date":"2026-02-15","question":"For large active prefill blocks at 65k, is gather-path routing faster than full-prefill active routing?","hypothesis":"Full-prefill active path is too expensive for large Tq due padded full-length attention; forcing gather for large active blocks should reduce prefill latency.","change_set":["hcsa/mlx/fused_attention.py full-prefill gate: Tq <= query_chunk_size"],"command":"python3 scripts/bench_glm_consumer_mlx.py --model-path mlx-community/GLM-4.7-Flash-4bit --mode wayfinder --seq-lens 65536 --decode-len 32 --repeats 1 --skip-multi-turn --skip-quality --hsa-trace --out-dir benchmarks/mlx/glm_4_7_flash_4bit_wayfinder/20260215_glm65k_regression_wayfinder_trace_fix_largeq_gather_policy","controls":{"dense_baseline":"benchmarks/mlx/glm_4_7_flash_4bit_wayfinder/20260215_glm65k_regression_dense/results.json","pre_fix_wayfinder":"benchmarks/mlx/glm_4_7_flash_4bit_wayfinder/20260215_glm65k_regression_wayfinder_trace/results.json"},"metrics":{"single_turn_present":true,"e2e_sec":1267.1919847920071,"prefill_sec":1228.065528291976,"decode_sec":39.126456500031054,"decode_tok_s":0.8178609274257842,"peak_memory_bytes":23795994534,"path_counts":{"wayfinder":128,"wayfinder_dense_fallback":256},"dense_fallback_share_run":0.6666666666666666,"dense_fallback_share_prefill_steps":0.0,"dense_fallback_share_decode_steps":1.0,"delta_vs_dense_e2e_sec":-309.481650249043,"delta_vs_dense_e2e_pct":-19.628770556627295,"memory_reduction_pct_convention":28.240609763338153},"decision":"keep","next_action":"Validate at decode_len=256 regression shape."}
{"id":"EXP-20260215T230713Z-GLM65K-DECODE256-POSTPATCH-RESULT","date":"2026-02-15","question":"With current patches, does wayfinder still regress at T=65536 decode_len=256 versus dense baseline?","hypothesis":"Reducing dense-fallback overuse should narrow or eliminate the observed long-context decode256 slowdown.","change_set":["current in-tree patch set in hcsa/integrations/glm_mlx.py and hcsa/mlx/fused_attention.py"],"command":"python3 scripts/bench_glm_consumer_mlx.py --model-path mlx-community/GLM-4.7-Flash-4bit --mode wayfinder --seq-lens 65536 --decode-len 256 --repeats 1 --skip-multi-turn --skip-quality --out-dir benchmarks/mlx/glm_4_7_flash_4bit_wayfinder/20260215_glm65k_decode256_wayfinder_postpatch","controls":{"dense_companion":"benchmarks/mlx/glm_4_7_flash_4bit_wayfinder/20260215_glm65k_decode256_dense_postpatch/results.json"},"metrics":{"e2e_sec":370.53068079199875,"prefill_sec":345.0641641250113,"decode_sec":25.466516666987445,"ttft_sec":10.943642124999315,"itl_p95_sec":0.05582474998664111,"decode_tok_s":10.052415230067798,"peak_memory_bytes":23795994534},"decision":"pending_dense_delta","next_action":"Combine with dense companion to compute final deltas."}
{"id":"EXP-20260215T231628Z-GLM65K-DECODE256-DENSE-COMPANION-RESULT","date":"2026-02-15","question":"What is same-session dense baseline at T=65536 decode_len=256 with identical skip settings?","hypothesis":"A same-session dense run provides the correct denominator for post-patch wayfinder deltas.","change_set":["measurement only"],"command":"python3 scripts/bench_glm_consumer_mlx.py --model-path mlx-community/GLM-4.7-Flash-4bit --mode dense --seq-lens 65536 --decode-len 256 --repeats 1 --skip-multi-turn --skip-quality --out-dir benchmarks/mlx/glm_4_7_flash_4bit_wayfinder/20260215_glm65k_decode256_dense_postpatch","controls":{"wayfinder_companion":"benchmarks/mlx/glm_4_7_flash_4bit_wayfinder/20260215_glm65k_decode256_wayfinder_postpatch/results.json"},"metrics":{"dense":{"e2e_sec":1007.7333569570328,"prefill_sec":966.2167501660297,"decode_sec":41.51660679100314,"ttft_sec":27.764311708975583,"itl_p95_sec":0.055008416005875915,"decode_tok_s":6.166207206882729,"peak_memory_bytes":33160809276},"wayfinder_postpatch":{"e2e_sec":370.53068079199875,"prefill_sec":345.0641641250113,"decode_sec":25.466516666987445,"decode_tok_s":10.052415230067798,"peak_memory_bytes":23795994534},"delta_wayfinder_vs_dense":{"e2e_sec":-637.2026761650341,"e2e_pct":-63.23127757615775,"prefill_sec":-621.1525860410184,"prefill_pct":-64.28708526676677,"decode_sec":-16.050090124015696,"decode_pct":-38.65944585696207,"decode_tok_s_delta":3.886208023185069,"decode_tok_s_pct":63.02428531508441,"memory_reduction_pct_convention":28.240609763338153}},"decision":"keep","next_action":"Use this configuration as the new long-context baseline and run full quality/multi-turn validation before docs updates."}
