{"id":"EXP-20260319T064808Z-QWEN35CUDA-KERNEL-PROFILE-ATTRIBUTION-HONESTY-RESULT","date":"2026-03-19","question":"Are the current sparse profile fields understating the realized Wayfinder/HCSA contraction cost on CUDA and dropping backend attribution, making the SDPA branch and future kernel comparisons uninterpretable?","hypothesis":"CUDA-event timing around the sparse contraction plus preserved backend attribution should expose the real contraction cost on the current SDPA branch without changing the graph family.","change_set":["hcsa/integrations/qwen_torch.py","scripts/bench_qwen35_cuda_wayfinder.py","tests/pytorch/test_torch_qwen_sparse_gqa.py","tests/test_qwen_cuda_wayfinder_cli.py","notes/LAB_NOTEBOOK.md","notes/experiments.ndjson"],"command":".venv/bin/python -m py_compile hcsa/integrations/qwen_torch.py hcsa/torch/attention_wayfinder_sparse.py scripts/bench_qwen35_cuda_wayfinder.py tests/pytorch/test_torch_qwen_sparse_gqa.py tests/test_qwen_cuda_wayfinder_cli.py && .venv/bin/python -m pytest tests/pytorch/test_torch_qwen_sparse_gqa.py tests/pytorch/test_torch_causality.py tests/pytorch/test_torch_dense_limit_equivalence.py tests/pytorch/test_torch_matches_mlx_reference_small.py tests/test_qwen_cuda_wayfinder_cli.py -q && .venv/bin/python scripts/bench_qwen35_cuda_wayfinder.py --model-path /home/hmbown/HF_Models/Qwen3.5-9B --seq-lens 4096 8192 --path sparse --strategy random --engine auto --warmup 1 --repeats 1 --forward-target backbone --phases dense wayfinder --skip-divergence --output benchmarks/cuda/qwen35_wayfinder/EXP-20260319T064808Z-QWEN35CUDA-KERNEL-PROFILE-ATTRIBUTION-HONESTY-4096-8192.ndjson && journalctl -b -k --since '2026-03-19 01:48:08 CDT' | rg -n 'NVRM|Xid|Out of memory|hung task|BUG:|Call Trace'","controls":{"baseline_run_path":"benchmarks/cuda/qwen35_wayfinder/EXP-20260319T043357Z-QWEN35CUDA-BACKBONE-RESIDENCY-TIEBREAK-4096-8192.ndjson","dead_sdpa_run":"benchmarks/cuda/qwen35_wayfinder/EXP-20260319T055559Z-QWEN35CUDA-KERNEL-SDPA-CONTRACTION-4096-8192.ndjson","one_process_at_a_time":true,"lock_file":"benchmarks/cuda/qwen35_wayfinder/.bench_qwen35_cuda_wayfinder.lock","retro_backfill_inference":"off","model_path":"/home/hmbown/HF_Models/Qwen3.5-9B","device":"cuda","gpu":"NVIDIA GB10","device_capability":[12,1],"torch":"2.10.0+cu130","transformers":"5.3.0","path":"sparse","strategy":"random","compute_graph_metrics":false,"forward_target":"backbone","kernel_log_since":"2026-03-19 01:48:08 CDT"},"metrics":{"status":"completed","validation":{"py_compile":"pass","pytest":{"passed":37,"skipped":1,"failed":0}},"warnings":["existing torch.jit.script_method deprecation warnings","existing GB10 capability 12.1 vs PyTorch max advertised 12.0 warning"],"artifact":"benchmarks/cuda/qwen35_wayfinder/EXP-20260319T064808Z-QWEN35CUDA-KERNEL-PROFILE-ATTRIBUTION-HONESTY-4096-8192.ndjson","kernel_fault_lines_after_start":0,"benchmark_residency":{"dense_benchmark_module_device_counts":{"cuda:0":428},"wayfinder_benchmark_module_device_counts":{"cuda:0":428},"result":"single_gpu_comparable"},"4096":{"dense":{"median_ms":2517.94,"prefill_tok_per_sec":1626.7,"peak_mem_gb":17.54},"wayfinder":{"median_ms":5627.6,"prefill_tok_per_sec":727.8,"peak_mem_gb":20.76,"wayfinder_active_layers":8,"attn_kernel_ms_mean":370.24,"attn_kernel_ms_host_mean":22.94,"sparse_contraction_cuda_ms_mean":370.24,"sparse_contraction_backend":"sdpa"},"delta_vs_anchor_wayfinder_abs":{"median_ms":1524.17,"prefill_tok_per_sec":-270.4,"peak_mem_gb":3.19},"delta_vs_anchor_wayfinder_pct":{"median_ms":37.14,"prefill_tok_per_sec":-27.09,"peak_mem_gb":18.16},"delta_vs_anchor_dense_abs":{"median_ms":-178.56,"prefill_tok_per_sec":107.7,"peak_mem_gb":0.0},"delta_vs_anchor_dense_pct":{"median_ms":-6.62,"prefill_tok_per_sec":7.09,"peak_mem_gb":0.0},"delta_vs_old_sdpa_wayfinder_abs":{"median_ms":11.29,"pct":0.2},"memory_reduction_pct":-18.36,"degree_estimate":97.0,"kappa":94.38,"crossover_tokens":23353.5},"8192":{"dense":{"median_ms":5143.75,"prefill_tok_per_sec":1592.6,"peak_mem_gb":18.38},"wayfinder":{"median_ms":14362.57,"prefill_tok_per_sec":570.4,"peak_mem_gb":21.49,"wayfinder_active_layers":8,"attn_kernel_ms_mean":1125.5,"attn_kernel_ms_host_mean":35.32,"sparse_contraction_cuda_ms_mean":1125.5,"sparse_contraction_backend":"sdpa"},"delta_vs_anchor_wayfinder_abs":{"median_ms":4443.65,"prefill_tok_per_sec":-255.5,"peak_mem_gb":3.0},"delta_vs_anchor_wayfinder_pct":{"median_ms":44.8,"prefill_tok_per_sec":-30.94,"peak_mem_gb":16.22},"delta_vs_anchor_dense_abs":{"median_ms":-266.45,"prefill_tok_per_sec":78.4,"peak_mem_gb":0.0},"delta_vs_anchor_dense_pct":{"median_ms":-4.92,"prefill_tok_per_sec":5.18,"peak_mem_gb":0.0},"delta_vs_old_sdpa_wayfinder_abs":{"median_ms":215.44,"pct":1.52},"memory_reduction_pct":-16.92,"degree_estimate":129.0,"kappa":177.32,"crossover_tokens":null},"observability":{"backend_complete":true,"cuda_timing_complete":true,"host_async_underreport_factor":{"4096":16.14,"8192":31.87}},"stop_gate_tripped":"sdpa_branch_still_dead_but_observability_fixed"},"decision":"keep","next_action":"Keep the attribution fix. The next coherent branch is a benchmark-only fused fixed-degree no-weights backend that removes explicit neighborhood materialization from the contraction path and must beat the honest 8192 kappa gate before earning 16384."}
{"id":"EXP-20260319T070017Z-QWEN35CUDA-FUSED-FIXEDDEGREE-NOWEIGHTS-PRERUN","date":"2026-03-19","question":"Can a benchmark-only fused fixed-degree Wayfinder/HCSA contraction lower the realized sparse kernel constant enough to improve 8192 kappa by removing explicit neighborhood realization from the contraction path?","hypothesis":"The repaired observability run confirmed that the dominant b term is the realized SDPA contraction over materialized neighborhoods, not graph build or loader residency. A benchmark-only fused fixed-degree no-weights backend over q, base k, base v, neigh_idx, neigh_mask, gqa_ratio, and fixed padded D, with online softmax and direct V accumulation, should attack the dominant constant factor directly. The smallest honest step is to add this backend behind sparse_row_attention_gqa_chunked for return_weights=False while leaving the reference path untouched; if it works, 8192 kappa should improve versus the honest anchor ~116.43 and the repaired-observability SDPA rerun ~177.32.","change_set":["planned edits to hcsa/torch/attention_wayfinder_sparse.py","planned edits to hcsa/integrations/qwen_torch.py","possible new kernel helper files if the fused backend needs a Triton entry point","possible regression updates in tests/pytorch/test_torch_qwen_sparse_gqa.py","possible regression updates in tests/test_qwen_cuda_wayfinder_cli.py","notes/LAB_NOTEBOOK.md","notes/experiments.ndjson"],"command":".venv/bin/python -m py_compile hcsa/integrations/qwen_torch.py hcsa/torch/attention_wayfinder_sparse.py scripts/bench_qwen35_cuda_wayfinder.py tests/pytorch/test_torch_qwen_sparse_gqa.py tests/test_qwen_cuda_wayfinder_cli.py && .venv/bin/python -m pytest tests/pytorch/test_torch_qwen_sparse_gqa.py tests/pytorch/test_torch_causality.py tests/pytorch/test_torch_dense_limit_equivalence.py tests/pytorch/test_torch_matches_mlx_reference_small.py tests/test_qwen_cuda_wayfinder_cli.py -q && .venv/bin/python scripts/bench_qwen35_cuda_wayfinder.py --model-path /home/hmbown/HF_Models/Qwen3.5-9B --seq-lens 4096 8192 --path sparse --strategy random --engine auto --warmup 1 --repeats 1 --forward-target backbone --phases dense wayfinder --skip-divergence --output benchmarks/cuda/qwen35_wayfinder/EXP-20260319T070017Z-QWEN35CUDA-FUSED-FIXEDDEGREE-NOWEIGHTS-4096-8192.ndjson && journalctl -b -k --since '2026-03-19 02:00:17 CDT' | rg -n 'NVRM|Xid|Out of memory|hung task|BUG:|Call Trace'","controls":{"baseline_run_path":"benchmarks/cuda/qwen35_wayfinder/EXP-20260319T043357Z-QWEN35CUDA-BACKBONE-RESIDENCY-TIEBREAK-4096-8192.ndjson","observability_repaired_sdpa_run":"benchmarks/cuda/qwen35_wayfinder/EXP-20260319T064808Z-QWEN35CUDA-KERNEL-PROFILE-ATTRIBUTION-HONESTY-4096-8192.ndjson","one_process_at_a_time":true,"lock_file":"benchmarks/cuda/qwen35_wayfinder/.bench_qwen35_cuda_wayfinder.lock","retro_backfill_inference":"off","model_path":"/home/hmbown/HF_Models/Qwen3.5-9B","device":"cuda","gpu":"NVIDIA GB10","device_capability":[12,1],"torch":"2.10.0+cu130","transformers":"5.3.0","path":"sparse","strategy":"random","compute_graph_metrics":false,"forward_target":"backbone","window":64,"landmark_stride":64,"num_cycles":1,"engine_request":"auto","warmup":1,"repeats":1,"seq_lens_gate":[4096,8192],"seq_len_contingent":[16384],"kernel_log_since":"2026-03-19 02:00:17 CDT","current_anchor_4096":{"D_estimate":97.0,"kappa":64.25912658830366},"current_anchor_8192":{"D_estimate":129.0,"kappa":116.42635492705567},"observability_sdpa_4096":{"D_estimate":97.0,"kappa":94.38},"observability_sdpa_8192":{"D_estimate":129.0,"kappa":177.32}},"metrics":{"status":"pending","artifacts_expected":["benchmarks/cuda/qwen35_wayfinder/EXP-20260319T070017Z-QWEN35CUDA-FUSED-FIXEDDEGREE-NOWEIGHTS-4096-8192.ndjson","benchmarks/cuda/qwen35_wayfinder/EXP-20260319T070017Z-QWEN35CUDA-FUSED-FIXEDDEGREE-NOWEIGHTS-16384.ndjson"],"required":["py_compile success","pytest selected suite passes","bench[label=dense][seq_len=4096].median_ms","bench[label=wayfinder][seq_len=4096].median_ms","bench[label=dense][seq_len=8192].median_ms","bench[label=wayfinder][seq_len=8192].median_ms","dense and wayfinder residency metadata for backbone module","no cpu or meta residency in backbone benchmark module","matching real-device placement for dense and wayfinder","bench[label=wayfinder].wayfinder_profiles","bench[label=wayfinder].wayfinder_active_layers==8","bench[label=wayfinder].wayfinder_profiles[*].sparse_contraction_backend","bench[label=wayfinder].wayfinder_profiles[*].sparse_contraction_cuda_ms","zero new kernel fault lines after kernel_log_since"]},"decision":"pending","next_action":"Add a benchmark-only fused fixed-degree no-weights backend behind sparse_row_attention_gqa_chunked, validate it against the reference path, then rerun the guarded 4096/8192 gate before considering 16384."}
{"id":"EXP-20260319T070017Z-QWEN35CUDA-FUSED-FIXEDDEGREE-NOWEIGHTS-RESULT","date":"2026-03-19","question":"Can a Triton fused fixed-degree no-weights backend lower 8192 kappa by eliminating gathered K/V materialization?","hypothesis":"Fused Triton kernel with online softmax and direct V accumulation from base K/V should eliminate the dominant materialization cost.","change_set":["new hcsa/torch/triton_fused_sparse_attn.py","hcsa/torch/attention_wayfinder_sparse.py","tests/pytorch/test_torch_qwen_sparse_gqa.py","notes/LAB_NOTEBOOK.md","notes/experiments.ndjson"],"command":".venv/bin/python scripts/bench_qwen35_cuda_wayfinder.py --model-path /home/hmbown/HF_Models/Qwen3.5-9B --seq-lens 4096 8192 --path sparse --strategy random --engine auto --warmup 1 --repeats 1 --forward-target backbone --phases dense wayfinder --skip-divergence","controls":{"baseline":"EXP-20260319T043357Z","path":"sparse","strategy":"random","window":64,"landmark_stride":64,"num_cycles":1,"forward_target":"backbone","engine":"auto","warmup":1,"repeats":1,"triton":"3.6.0","gpu":"NVIDIA GB10","capability":[12,1]},"metrics":{"validation":"39 passed, 2 skipped","kernel_log":"clean","T4096":{"dense_ms":2505.3,"wf_ms":2573.4,"speedup":"0.97x","dense_peak_gb":17.54,"wf_peak_gb":17.57,"D":97,"kappa":43.37,"kappa_delta_vs_anchor":-20.88,"kappa_pct_vs_anchor":-32.5,"sparse_contraction_cuda_ms_mean":11.69},"T8192":{"dense_ms":5046.7,"wf_ms":5252.5,"speedup":"0.96x","dense_peak_gb":18.38,"wf_peak_gb":18.49,"D":129,"kappa":66.09,"kappa_delta_vs_anchor":-50.33,"kappa_pct_vs_anchor":-43.2,"sparse_contraction_cuda_ms_mean":32.44},"T16384":{"dense_ms":10126.5,"wf_ms":9173.5,"speedup":"1.10x","dense_peak_gb":20.08,"wf_peak_gb":20.43,"D":322,"kappa":46.09,"sparse_contraction_cuda_ms_mean":88.99},"contraction_backend":"triton_fused","active_layers":"8/8","success_gate":"PASSED: 8192 kappa 66.09 < 116.43","breakthrough":"T=16384: Wayfinder 1.10x FASTER than dense"},"decision":"keep","next_action":"Continue scaling to 32768/65536. Validate causality. Extend kernel for training paths."}
{"id":"EXP-20260319T073000Z-QWEN35CUDA-FUSED-SCALE-32768-RESULT","date":"2026-03-19","question":"Does Triton fused speedup continue at T=32768?","hypothesis":"Speedup should increase with T since sparse is O(T*D) vs dense O(T^2).","metrics":{"T32768":{"dense_ms":17839.3,"wf_ms":19381.8,"speedup":"0.92x","D":578,"kappa":61.59,"dense_peak_gb":23.46,"wf_peak_gb":24.73},"contraction_backend":"triton_fused","active_layers":"8/8"},"decision":"keep","next_action":"D grows as T/64 (landmarks). Graph-schedule optimization needed to extend crossover."}
{"id":"EXP-20260319T074000Z-QWEN35CUDA-FUSED-SCALE-65536-RESULT","date":"2026-03-19","question":"Confirm scaling model at T=65536.","hypothesis":"D≈1090 at T=65536 should slow Wayfinder vs dense but validate O(T*D) model.","metrics":{"T65536":{"dense_ms":38969.6,"wf_ms":43377.7,"speedup":"0.90x","D":1090,"kappa":66.93,"dense_peak_gb":30.23,"wf_peak_gb":35.02},"contraction_backend":"triton_fused","active_layers":"8/8"},"decision":"keep","next_action":"Scaling model confirmed. Investigate larger landmark strides for extended crossover."}
{"id":"EXP-20260319T075000Z-QWEN35CUDA-FUSED-NOLM-32768-65536-RESULT","date":"2026-03-19","question":"Does constant-degree graph (no landmarks) enable Wayfinder speedup at 32k-65k?","hypothesis":"Without landmarks, D≈130 is fixed, making attention O(T*130) vs dense O(T^2).","metrics":{"T32768_nolm":{"dense_ms":17856.1,"wf_ms":17628.5,"speedup":"1.01x","dense_peak_gb":23.46,"wf_peak_gb":23.61},"T65536_nolm":{"dense_ms":38758.7,"wf_ms":36253.6,"speedup":"1.07x","dense_peak_gb":30.23,"wf_peak_gb":30.53},"contraction_backend":"triton_fused","active_layers":"8/8","landmark_stride":0},"decision":"keep","next_action":"Proves sub-quadratic scaling with fixed degree. Investigate stride=128/256 for quality-speed balance."}
{"id":"EXP-20260319T145856Z-QWEN35CUDA-QUALITY-MULTILEN-DIVERGENCE-PRERUN","date":"2026-03-19","question":"Can the Qwen CUDA Wayfinder quality harness report divergence at every requested sequence length so we can honestly validate the Hamiltonian quality gate for landmark strides 64, 0, and 128?","hypothesis":"The current divergence phase only records min(seq_lens), so the first honest step is to make it emit one divergence row per requested sequence length while preserving resume keys. With that fixed harness, the fused Hamiltonian path should hold cosine_similarity > 0.99 and top1_agreement > 0.90 through T=4096 for stride 64 and likely stride 128; stride 0 is the highest-risk quality branch because it removes all landmark shortcuts.","change_set":["planned edits to scripts/bench_qwen35_cuda_wayfinder.py","planned regression coverage in tests/test_qwen_cuda_wayfinder_cli.py","notes/LAB_NOTEBOOK.md","notes/experiments.ndjson"],"command":".venv/bin/python -m py_compile scripts/bench_qwen35_cuda_wayfinder.py tests/test_qwen_cuda_wayfinder_cli.py && .venv/bin/python -m pytest tests/test_qwen_cuda_wayfinder_cli.py tests/pytorch/test_torch_qwen_sparse_gqa.py tests/pytorch/test_torch_causality.py tests/pytorch/test_torch_dense_limit_equivalence.py tests/pytorch/test_torch_matches_mlx_reference_small.py -q && .venv/bin/python scripts/bench_qwen35_cuda_wayfinder.py --model-path /home/hmbown/HF_Models/Qwen3.5-9B --seq-lens 64 256 1024 4096 --window 64 --dtype bfloat16 --num-cycles 1 --strategy random --path sparse --forward-target causal_lm --phases divergence --landmark-stride 64 --output benchmarks/cuda/qwen35_wayfinder/EXP-20260319T145856Z-QWEN35CUDA-QUALITY-DIVERGENCE-STRIDE64.ndjson && .venv/bin/python scripts/bench_qwen35_cuda_wayfinder.py --model-path /home/hmbown/HF_Models/Qwen3.5-9B --seq-lens 64 256 1024 4096 --window 64 --dtype bfloat16 --num-cycles 1 --strategy random --path sparse --forward-target causal_lm --phases divergence --landmark-stride 0 --output benchmarks/cuda/qwen35_wayfinder/EXP-20260319T145856Z-QWEN35CUDA-QUALITY-DIVERGENCE-STRIDE0.ndjson && .venv/bin/python scripts/bench_qwen35_cuda_wayfinder.py --model-path /home/hmbown/HF_Models/Qwen3.5-9B --seq-lens 64 256 1024 4096 --window 64 --dtype bfloat16 --num-cycles 1 --strategy random --path sparse --forward-target causal_lm --phases divergence --landmark-stride 128 --output benchmarks/cuda/qwen35_wayfinder/EXP-20260319T145856Z-QWEN35CUDA-QUALITY-DIVERGENCE-STRIDE128.ndjson","controls":{"baseline_harness_location":"scripts/bench_qwen35_cuda_wayfinder.py:755-757","reference_divergence_artifacts":["benchmarks/cuda/qwen35_wayfinder/EXP-20260318T170606Z-QWEN35CUDA-FLEX-SHORT.ndjson","benchmarks/cuda/qwen35_wayfinder/EXP-20260318T171044Z-QWEN35CUDA-FLEX-SHORT.ndjson"],"latest_performance_context":"benchmarks/cuda/qwen35_wayfinder/EXP-20260319T075000Z-QWEN35CUDA-FUSED-NOLM-32768-65536.ndjson","one_process_at_a_time":true,"lock_file":"benchmarks/cuda/qwen35_wayfinder/.bench_qwen35_cuda_wayfinder.lock","retro_backfill_inference":"off","model_path":"/home/hmbown/HF_Models/Qwen3.5-9B","device":"cuda","gpu":"NVIDIA GB10","path":"sparse","strategy":"random","window":64,"num_cycles":1,"seq_lens":[64,256,1024,4096],"dtype":"bfloat16","forward_target":"causal_lm","landmark_strides":[64,0,128]},"metrics":{"status":"pending","artifacts_expected":["benchmarks/cuda/qwen35_wayfinder/EXP-20260319T145856Z-QWEN35CUDA-QUALITY-DIVERGENCE-STRIDE64.ndjson","benchmarks/cuda/qwen35_wayfinder/EXP-20260319T145856Z-QWEN35CUDA-QUALITY-DIVERGENCE-STRIDE0.ndjson","benchmarks/cuda/qwen35_wayfinder/EXP-20260319T145856Z-QWEN35CUDA-QUALITY-DIVERGENCE-STRIDE128.ndjson"],"required":["py_compile success","targeted pytest passes","artifact divergence rows for seq_len 64, 256, 1024, and 4096 for each stride","each divergence row includes cosine_similarity, top1_agreement, and l2_relative","no lock contention or benchmark error rows","quality gate evaluation against cosine_similarity > 0.99 and top1_agreement > 0.90"]},"decision":"pending","next_action":"Patch the divergence phase to emit one row per requested seq_len, validate it, then run the three guarded quality artifacts for strides 64, 0, and 128."}
