{"id": "EXP-20260208-K1-GLM-PERMUTE-BOUND-RESULT", "date": "2026-02-08", "question": "On bounded GLM prefill (T=2048), does K1-integrated permute path produce a favorable dense-vs-wayfinder attention delta on the original non-Qwen path?", "hypothesis": "Wayfinder permute path should improve attention throughput vs dense baseline in this bounded setting.", "change_set": ["/Volumes/VIXinSSD/wayfinder/hcsa/mlx/kernels/metal/hcsa_permute_window_fused_discovered.metal", "/Volumes/VIXinSSD/wayfinder/hcsa/integrations/glm_mlx.py"], "command": "PYTHONPATH=/Volumes/VIXinSSD/wayfinder python3 scripts/bench_glm_wayfinder_mlx.py --model-path mlx-community/GLM-4.7-Flash-4bit --seq-lens 2048 --batch 1 --warmup 1 --iters 2 --dtype bfloat16 --path permute --window 64 --landmark-stride 0 --num-cycles 1 --seed 42 --permute-head-chunk-size 2 --permute-query-chunk-size 384 --full-swap --out-dir benchmarks/mlx/k1_glm_permute_bound_20260208", "controls": {"model_path": "mlx-community/GLM-4.7-Flash-4bit", "original_non_qwen_path": true, "retro_backfill_default_off": true, "baseline_path": "benchmarks/mlx/k1_glm_permute_bound_20260208/results.json::results[0].level_a_real_qkv.baseline_attention"}, "metrics": {"artifact": "/Volumes/VIXinSSD/wayfinder/benchmarks/mlx/k1_glm_permute_bound_20260208/results.json", "attention": {"tok_s": {"absolute": 90626.65306865347, "baseline": 73500.90102663367, "delta_vs_baseline": 17125.752042019798, "delta_pct_vs_baseline": 23.300057282038132}, "peak_memory_bytes": {"absolute": 213849214, "baseline": 426232364, "delta_vs_baseline": -212383150, "delta_pct_vs_baseline": -49.82802056767327}, "memory_reduction_pct_vs_baseline": 49.82802056767327}, "block": {"tok_s": {"absolute": 41924.829509917654, "baseline": 38029.77396175629, "delta_vs_baseline": 3895.055548161363, "delta_pct_vs_baseline": 10.24212121817587}, "peak_memory_bytes": {"absolute": 377596464, "baseline": 604891708, "delta_vs_baseline": -227295244, "delta_pct_vs_baseline": -37.57618776946435}, "memory_reduction_pct_vs_baseline": 37.576187769464354}, "sanity_mae": 0.0036605261266231537, "graph_build_ms_first": 801.1822080016136, "graph_build_ms_cached": 0.0015409886837005615}, "decision": "keep", "next_action": "Consolidate K4+K1 outcomes and schedule long-context K4 rerun with watchdog instrumentation."}
{"id":"EXP-20260208-laplacian-diag","date":"2026-02-08","question":"Can Laplacian spectral gap and Fiedler bridge candidates correctly identify graph connectivity?","hypothesis":"Connected graph has positive Fiedler; bridges cross sign boundary","change_set":["hcsa/graph/analysis.py","tests/test_laplacian_diagnostics.py"],"command":"python3 -m pytest tests/test_laplacian_diagnostics.py -v","controls":{},"metrics":{},"decision":"pending","next_action":"run tests"}
{"id":"EXP-20260208-K4-DISCOVER-SEARCH","date":"2026-02-08","question":"Can ZMLX Discover find an optimized Metal kernel for K4 active-row microkernel (softmax(scores[W]) @ values[W,D] -> out[D])?","hypothesis":"PUCT tree search with claude-code backend should find >= 1.3x speedup over naive seed. Optimizations: SIMD reductions, shared memory, vectorized loads.","change_set":["discover_sessions/hcsa_active_row_session.json","hcsa/mlx/kernels/metal/hcsa_active_row_fused_discovered.metal","hcsa/mlx/kernels/metal/hcsa_active_row_fused_discovered.py"],"command":"cd /Volumes/VIXinSSD/ZMLX && python -m zmlx.discover search hcsa_active_row --llm claude-code --steps 10 --candidates-per-step 8 --warmup 5 --iters 20 --session-dir /Volumes/VIXinSSD/wayfinder/discover_sessions -v","controls":{"retro_backfill":"off","D":128,"W":65,"baseline":"naive_seed_kernel"},"metrics":{},"decision":"pending","next_action":"pending"}

{"id":"EXP-20260208-d-selection","date":"2026-02-08","question":"Does recommended_num_cycles provide correct O(log T) scaling?","hypothesis":"ceil(2*log2(1024))=20, ceil(2*log2(2))=2→max(1,2)=2→actually 1 since log2(2)=1, ceil(2*1)=2","change_set":["hcsa/cycles.py","hcsa/mlx/model.py","hcsa/integrations/qwen_mlx.py","tests/test_d_selection.py"],"command":"python3 -m pytest tests/test_d_selection.py -v","controls":{"expansion_constant":2.0},"metrics":{},"decision":"pending","next_action":"run tests"}
{"id":"EXP-20260208-circular-wrap","date":"2026-02-08","question":"Does circular wrap-around correctly close the Hamiltonian cycle?","hypothesis":"Boundary positions get full degree, causality preserved, linear mode unchanged","change_set":["hcsa/mlx/attention.py","tests/mlx/test_circular_wrap.py"],"command":"python3 -m pytest tests/mlx/test_circular_wrap.py -v","controls":{"circular_default":false},"metrics":{},"decision":"pending","next_action":"run tests"}
{"id":"EXP-20260208-circular-wrap","date":"2026-02-08","question":"Does circular wrap-around correctly close the Hamiltonian cycle?","hypothesis":"Boundary positions get full degree, causality preserved, linear mode unchanged","change_set":["hcsa/mlx/attention.py","tests/mlx/test_circular_wrap.py"],"command":"python3 -m pytest tests/mlx/test_circular_wrap.py -v","controls":{"circular_default":false},"metrics":{"tests_passed":5,"tests_total":5},"decision":"keep","next_action":"implement union multigraph"}
{"id":"EXP-20260208-d-selection","date":"2026-02-08","question":"Does recommended_num_cycles provide correct O(log T) scaling?","hypothesis":"ceil(2*log2(1024))=20, max_edge_disjoint(100)=49","change_set":["hcsa/cycles.py","hcsa/mlx/model.py","hcsa/integrations/qwen_mlx.py","tests/test_d_selection.py"],"command":"python3 -m pytest tests/test_d_selection.py -v","controls":{"expansion_constant":2.0},"metrics":{"tests_passed":5,"tests_total":5},"decision":"keep","next_action":"wire auto into runtime"}
{"id":"EXP-20260208-laplacian-diag","date":"2026-02-08","question":"Can Laplacian spectral gap and Fiedler bridge candidates correctly identify graph connectivity?","hypothesis":"Connected graph has positive Fiedler; bridges cross sign boundary","change_set":["hcsa/graph/analysis.py","tests/test_laplacian_diagnostics.py"],"command":"python3 -m pytest tests/test_laplacian_diagnostics.py -v","controls":{},"metrics":{"tests_passed":4,"tests_total":4},"decision":"keep","next_action":"wire log_diagnostics flag"}
{"id":"EXP-20260208-union-multigraph","date":"2026-02-08","question":"Can union multigraph mode replace averaging with single-pass attention?","hypothesis":"Union graph has >= single-cycle degree, multiplicity tracked, output valid, weights sum to 1","change_set":["hcsa/mlx/attention.py","hcsa/graph/abi.py","tests/mlx/test_union_multigraph.py"],"command":"python3 -m pytest tests/mlx/test_union_multigraph.py -v","controls":{"multi_cycle_mode_default":"average"},"metrics":{"tests_passed":8,"tests_total":8},"decision":"keep","next_action":"end-to-end validation"}
{"id":"EXP-20260208-K1-DISCOVER-SEARCH-REAL","date":"2026-02-08","question":"Can ZMLX Discover find an optimized Metal kernel for K1 permute-window with a real LLM backend?","hypothesis":"PUCT search with claude-code should find >= 1.5x speedup over naive baseline.","change_set":["discover_sessions/hcsa_permute_window_session.json","hcsa/mlx/kernels/metal/hcsa_permute_window_fused_discovered.metal","hcsa/mlx/kernels/metal/hcsa_permute_window_fused_discovered.py"],"command":"cd /Volumes/VIXinSSD/ZMLX && python -m zmlx.discover search hcsa_permute_window --llm claude-code --steps 10 --session-dir /Volumes/VIXinSSD/wayfinder/discover_sessions -v","controls":{"retro_backfill":"off","SEQ":256,"D":128,"W":65},"metrics":{},"decision":"pending","next_action":"pending"}
{"id":"EXP-20260209-dispatch-kv-default","date":"2026-02-09","question":"Does forcing permute_prepermute_mode=kv reduce chunked-prefill dispatch overhead vs auto on GLM-4.7-Flash-4bit?","hypothesis":"KV-only prepermute will reduce per-q-chunk gather overhead and improve prefill tok/s plus attention_ms on active chunks, with neutral or better peak memory.","change_set":["hcsa/integrations/glm_mlx.py","scripts/bench_glm_chunked_prefill_mlx.py"],"command":"PYTHONPATH=/Volumes/VIXinSSD/wayfinder python3 scripts/bench_glm_chunked_prefill_mlx.py --seq-lens 8192 --chunk-sizes 4096 --decode-lens 0 --permute-prepermute-mode kv --baseline-path benchmarks/mlx/glm_4_7_flash_4bit_wayfinder/20260209_ab_hcsa_with_decode/results.json --out-dir benchmarks/mlx/glm_4_7_flash_4bit_wayfinder/20260209_dispatch_kv_default","controls":{"model_path":"mlx-community/GLM-4.7-Flash-4bit","path":"permute","window":64,"head_chunk_size":2,"query_chunk_size":192,"cache_mode":"normal","decode_len":0,"retro_backfill_enabled":false,"baseline_path":"benchmarks/mlx/glm_4_7_flash_4bit_wayfinder/20260209_ab_hcsa_with_decode/results.json"},"metrics":{"status":"pending"},"decision":"pending","next_action":"Run benchmark and record absolute/delta/% deltas for sec, tok_s, and peak memory bytes."}
{"id":"EXP-20260209-dispatch-kv-vs-auto-tiebreak","date":"2026-02-09","question":"Is the observed kv slowdown real or run-to-run variance, when compared to a same-session auto rerun?","hypothesis":"A controlled auto rerun in the same environment will match or beat kv, indicating kv is not a safe global default.","change_set":["none (measurement-only rerun)"],"command":"PYTHONPATH=/Volumes/VIXinSSD/wayfinder python3 scripts/bench_glm_chunked_prefill_mlx.py --seq-lens 8192 --chunk-sizes 4096 --decode-lens 0 --permute-prepermute-mode auto --baseline-path benchmarks/mlx/glm_4_7_flash_4bit_wayfinder/20260209_dispatch_kv_default/results.json --out-dir benchmarks/mlx/glm_4_7_flash_4bit_wayfinder/20260209_dispatch_auto_tiebreak","controls":{"model_path":"mlx-community/GLM-4.7-Flash-4bit","path":"permute","window":64,"head_chunk_size":2,"query_chunk_size":192,"cache_mode":"normal","decode_len":0,"retro_backfill_enabled":false,"baseline_path":"benchmarks/mlx/glm_4_7_flash_4bit_wayfinder/20260209_dispatch_kv_default/results.json"},"metrics":{"status":"pending"},"decision":"pending","next_action":"Run tie-break benchmark and decide whether to keep or revert kv default."}
{"id":"EXP-20260209-dispatch-headchunk8","date":"2026-02-09","question":"Can raising head_chunk_size from 2 to 8 reduce dispatch overhead and improve GLM chunked-prefill throughput at seq_len=8192?","hypothesis":"Fewer head chunks reduce Python dispatches and improve prefill tok/s while keeping peak memory near baseline.","change_set":["none (measurement-only benchmark override)"],"command":"PYTHONPATH=/Volumes/VIXinSSD/wayfinder python3 scripts/bench_glm_chunked_prefill_mlx.py --seq-lens 8192 --chunk-sizes 4096 --decode-lens 0 --head-chunk-size 8 --permute-prepermute-mode auto --baseline-path benchmarks/mlx/glm_4_7_flash_4bit_wayfinder/20260209_dispatch_auto_tiebreak/results.json --out-dir benchmarks/mlx/glm_4_7_flash_4bit_wayfinder/20260209_dispatch_headchunk8","controls":{"model_path":"mlx-community/GLM-4.7-Flash-4bit","path":"permute","window":64,"query_chunk_size":192,"head_chunk_size":8,"cache_mode":"normal","decode_len":0,"retro_backfill_enabled":false,"baseline_path":"benchmarks/mlx/glm_4_7_flash_4bit_wayfinder/20260209_dispatch_auto_tiebreak/results.json"},"metrics":{"status":"pending"},"decision":"pending","next_action":"Run benchmark and determine if head_chunk_size default should be increased."}
{"id":"EXP-20260209-dispatch-querychunk384","date":"2026-02-09","question":"Can raising query_chunk_size from 192 to 384 reduce dispatch overhead and improve GLM chunked-prefill throughput at seq_len=8192?","hypothesis":"Larger query chunks reduce dispatch frequency and improve prefill tok/s, potentially with modest memory change.","change_set":["none (measurement-only benchmark override)"],"command":"PYTHONPATH=/Volumes/VIXinSSD/wayfinder python3 scripts/bench_glm_chunked_prefill_mlx.py --seq-lens 8192 --chunk-sizes 4096 --decode-lens 0 --query-chunk-size 384 --permute-prepermute-mode auto --baseline-path benchmarks/mlx/glm_4_7_flash_4bit_wayfinder/20260209_dispatch_auto_tiebreak/results.json --out-dir benchmarks/mlx/glm_4_7_flash_4bit_wayfinder/20260209_dispatch_querychunk384","controls":{"model_path":"mlx-community/GLM-4.7-Flash-4bit","path":"permute","window":64,"head_chunk_size":2,"query_chunk_size":384,"cache_mode":"normal","decode_len":0,"retro_backfill_enabled":false,"baseline_path":"benchmarks/mlx/glm_4_7_flash_4bit_wayfinder/20260209_dispatch_auto_tiebreak/results.json"},"metrics":{"status":"pending"},"decision":"pending","next_action":"Run benchmark and determine if query_chunk_size default should be increased."}
{"id":"EXP-20260209-k6-discovery-target","date":"2026-02-09","question":"Does adding a k6 fused all-head/all-query discovery target integrate cleanly with wayc discover tooling and tests?","hypothesis":"Adding k6 to registry/aliases plus a seed scaffold will pass existing discovery tests and expose k6 in discover-targets CLI output.","change_set":["hcsa/discover/targets.py","hcsa/mlx/kernels/metal/seeds/hcsa_fused_attention.metal","tests/test_discover_targets.py","scripts/wayc.py","NEXT_SESSION_PROMPT.md"],"command":"python3 scripts/wayc.py discover-targets --targets k6 && python3 -m pytest tests/test_discover_targets.py tests/test_discover_setup.py tests/test_wayc_discover_cli.py -q","controls":{"models_loaded":false,"inference_executed":false,"attention_benchmark_executed":false,"retro_backfill_default_off":true,"baseline_path":"N/A setup-only"},"metrics":{"status":"pending"},"decision":"pending","next_action":"Run setup-only validation command and record pytest/CLI outcomes."}
{"id":"EXP-20260209-dispatch-kv-default-RESULT","date":"2026-02-09","question":"Does forcing permute_prepermute_mode=kv reduce chunked-prefill dispatch overhead vs auto on GLM-4.7-Flash-4bit?","hypothesis":"KV-only prepermute will reduce per-q-chunk gather overhead and improve prefill tok/s plus attention_ms on active chunks, with neutral or better peak memory.","change_set":["hcsa/integrations/glm_mlx.py","scripts/bench_glm_chunked_prefill_mlx.py"],"command":"PYTHONPATH=/Volumes/VIXinSSD/wayfinder python3 scripts/bench_glm_chunked_prefill_mlx.py --seq-lens 8192 --chunk-sizes 4096 --decode-lens 0 --permute-prepermute-mode kv --baseline-path benchmarks/mlx/glm_4_7_flash_4bit_wayfinder/20260209_ab_hcsa_with_decode/results.json --out-dir benchmarks/mlx/glm_4_7_flash_4bit_wayfinder/20260209_dispatch_kv_default","controls":{"model_path":"mlx-community/GLM-4.7-Flash-4bit","path":"permute","window":64,"head_chunk_size":2,"query_chunk_size":192,"cache_mode":"normal","decode_len":0,"retro_backfill_enabled":false,"baseline_path":"benchmarks/mlx/glm_4_7_flash_4bit_wayfinder/20260209_ab_hcsa_with_decode/results.json"},"metrics":{"artifact":"benchmarks/mlx/glm_4_7_flash_4bit_wayfinder/20260209_dispatch_kv_default/results.json","prefill_only":{"sec":{"absolute":104.74076025001705,"delta_vs_baseline":37.450735916994745,"delta_pct_vs_baseline":55.655702740793856},"tok_s":{"absolute":78.21214950555667,"delta_vs_baseline":-43.52952143599789,"delta_pct_vs_baseline":-35.75564644327532},"peak_memory_bytes":{"absolute":21443723048.0,"delta_vs_baseline":16384.0,"delta_pct_vs_baseline":0.00007640470118678546},"memory_reduction_pct_vs_baseline":-0.00007640470118808196},"chunk_index_1_attention_ms":842.9740000069141},"decision":"revert","next_action":"Keep runtime default at auto; run same-session auto tie-break to confirm regression."}
{"id":"EXP-20260209-dispatch-kv-vs-auto-tiebreak-RESULT","date":"2026-02-09","question":"Is the observed kv slowdown real or run-to-run variance, when compared to a same-session auto rerun?","hypothesis":"A controlled auto rerun in the same environment will match or beat kv, indicating kv is not a safe global default.","change_set":["none (measurement-only rerun)"],"command":"PYTHONPATH=/Volumes/VIXinSSD/wayfinder python3 scripts/bench_glm_chunked_prefill_mlx.py --seq-lens 8192 --chunk-sizes 4096 --decode-lens 0 --permute-prepermute-mode auto --baseline-path benchmarks/mlx/glm_4_7_flash_4bit_wayfinder/20260209_dispatch_kv_default/results.json --out-dir benchmarks/mlx/glm_4_7_flash_4bit_wayfinder/20260209_dispatch_auto_tiebreak","controls":{"model_path":"mlx-community/GLM-4.7-Flash-4bit","path":"permute","window":64,"head_chunk_size":2,"query_chunk_size":192,"cache_mode":"normal","decode_len":0,"retro_backfill_enabled":false,"baseline_path":"benchmarks/mlx/glm_4_7_flash_4bit_wayfinder/20260209_dispatch_kv_default/results.json"},"metrics":{"artifact":"benchmarks/mlx/glm_4_7_flash_4bit_wayfinder/20260209_dispatch_auto_tiebreak/results.json","prefill_only":{"sec":{"absolute":70.78170229200623,"delta_vs_baseline":-33.95905795801082,"delta_pct_vs_baseline":-32.42200827734138},"tok_s":{"absolute":115.73612578861596,"delta_vs_baseline":37.5239762830593,"delta_pct_vs_baseline":47.97717045277392},"peak_memory_bytes":{"absolute":21443706664.0,"delta_vs_baseline":-16384.0,"delta_pct_vs_baseline":-0.00007640464281004643},"memory_reduction_pct_vs_baseline":0.00007640464281255532},"chunk_index_1_attention_ms":649.5345830023289},"decision":"keep","next_action":"Retain auto as default; evaluate alternate dispatch levers."}
{"id":"EXP-20260209-dispatch-headchunk8-RESULT","date":"2026-02-09","question":"Can raising head_chunk_size from 2 to 8 reduce dispatch overhead and improve GLM chunked-prefill throughput at seq_len=8192?","hypothesis":"Fewer head chunks reduce Python dispatches and improve prefill tok/s while keeping peak memory near baseline.","change_set":["none (measurement-only benchmark override)"],"command":"PYTHONPATH=/Volumes/VIXinSSD/wayfinder python3 scripts/bench_glm_chunked_prefill_mlx.py --seq-lens 8192 --chunk-sizes 4096 --decode-lens 0 --head-chunk-size 8 --permute-prepermute-mode auto --baseline-path benchmarks/mlx/glm_4_7_flash_4bit_wayfinder/20260209_dispatch_auto_tiebreak/results.json --out-dir benchmarks/mlx/glm_4_7_flash_4bit_wayfinder/20260209_dispatch_headchunk8","controls":{"model_path":"mlx-community/GLM-4.7-Flash-4bit","path":"permute","window":64,"query_chunk_size":192,"head_chunk_size":8,"cache_mode":"normal","decode_len":0,"retro_backfill_enabled":false,"baseline_path":"benchmarks/mlx/glm_4_7_flash_4bit_wayfinder/20260209_dispatch_auto_tiebreak/results.json"},"metrics":{"artifact":"benchmarks/mlx/glm_4_7_flash_4bit_wayfinder/20260209_dispatch_headchunk8/results.json","prefill_only":{"sec":{"absolute":94.02581858399208,"delta_vs_baseline":23.244116291985847,"delta_pct_vs_baseline":32.83915975359487},"tok_s":{"absolute":87.12500591188355,"delta_vs_baseline":-28.611119876732417,"delta_pct_vs_baseline":-24.72099327826875},"peak_memory_bytes":{"absolute":21443706664.0,"delta_vs_baseline":0.0,"delta_pct_vs_baseline":0.0},"memory_reduction_pct_vs_baseline":0.0},"chunk_index_1_attention_ms":896.4303340017796},"decision":"revert","next_action":"Do not raise head_chunk default for this workload."}
{"id":"EXP-20260209-dispatch-querychunk384-RESULT","date":"2026-02-09","question":"Can raising query_chunk_size from 192 to 384 reduce dispatch overhead and improve GLM chunked-prefill throughput at seq_len=8192?","hypothesis":"Larger query chunks reduce dispatch frequency and improve prefill tok/s, potentially with modest memory change.","change_set":["none (measurement-only benchmark override)"],"command":"PYTHONPATH=/Volumes/VIXinSSD/wayfinder python3 scripts/bench_glm_chunked_prefill_mlx.py --seq-lens 8192 --chunk-sizes 4096 --decode-lens 0 --query-chunk-size 384 --permute-prepermute-mode auto --baseline-path benchmarks/mlx/glm_4_7_flash_4bit_wayfinder/20260209_dispatch_auto_tiebreak/results.json --out-dir benchmarks/mlx/glm_4_7_flash_4bit_wayfinder/20260209_dispatch_querychunk384","controls":{"model_path":"mlx-community/GLM-4.7-Flash-4bit","path":"permute","window":64,"head_chunk_size":2,"query_chunk_size":384,"cache_mode":"normal","decode_len":0,"retro_backfill_enabled":false,"baseline_path":"benchmarks/mlx/glm_4_7_flash_4bit_wayfinder/20260209_dispatch_auto_tiebreak/results.json"},"metrics":{"artifact":"benchmarks/mlx/glm_4_7_flash_4bit_wayfinder/20260209_dispatch_querychunk384/results.json","prefill_only":{"sec":{"absolute":71.08474250001018,"delta_vs_baseline":0.3030402080039494,"delta_pct_vs_baseline":0.42813354043644325},"tok_s":{"absolute":115.24273299574556,"delta_vs_baseline":-0.4933927928704094,"delta_pct_vs_baseline":-0.42630837131316907},"peak_memory_bytes":{"absolute":21441617192.0,"delta_vs_baseline":-2089472.0,"delta_pct_vs_baseline":-0.009743987048227232},"memory_reduction_pct_vs_baseline":0.009743987048227432},"chunk_index_1_attention_ms":656.0337910354137},"decision":"follow-up","next_action":"Keep as tuning option only; prioritize fused-kernel implementation for real dispatch elimination."}
{"id":"EXP-20260209-k6-discovery-target-RESULT","date":"2026-02-09","question":"Does adding a k6 fused all-head/all-query discovery target integrate cleanly with wayc discover tooling and tests?","hypothesis":"Adding k6 to registry/aliases plus a seed scaffold will pass existing discovery tests and expose k6 in discover-targets CLI output.","change_set":["hcsa/discover/targets.py","hcsa/mlx/kernels/metal/seeds/hcsa_fused_attention.metal","tests/test_discover_targets.py","scripts/wayc.py","NEXT_SESSION_PROMPT.md"],"command":"python3 scripts/wayc.py discover-targets --targets k6 && python3 -m pytest tests/test_discover_targets.py tests/test_discover_setup.py tests/test_wayc_discover_cli.py -q","controls":{"models_loaded":false,"inference_executed":false,"attention_benchmark_executed":false,"retro_backfill_default_off":true,"baseline_path":"N/A setup-only"},"metrics":{"discover_targets":{"target_count":1,"target_id":"k6","kernel_name":"hcsa_fused_attention","discover_target":"hcsa_fused_attention","priority":"P0"},"pytest":{"passed":7,"failed":0}},"decision":"keep","next_action":"Run discover-setup for k6 and launch initial ZMLX search for hcsa_fused_attention."}
