{"id":"EXP-20260210T091500Z-ZMLX-QWEN3-GLM-KERNEL-COMBO-RESULT","date":"2026-02-10","question":"Which Qwen3 MoE custom-kernel combination is fastest while preserving fidelity, and do the same toggles transfer to GLM-4.7-Flash?","hypothesis":"Qwen3 control plus optional router argpartition remains fidelity-safe with neutral memory; fp32 no-FMA combine regresses fidelity and throughput.","change_set":["measurement-only from repro capsules"],"command":"python -m zmlx.validate mlx-community/Qwen3-30B-A3B-4bit --runs 5 --max-tokens 200 --patterns moe_mlp; ZMLX_QWEN_ROUTER_ARGPARTITION_LOGITS=1 python -m zmlx.validate mlx-community/Qwen3-30B-A3B-4bit --runs 5 --max-tokens 200 --patterns moe_mlp; ZMLX_QWEN_COMBINE_MODE=fp32_no_fma python -m zmlx.validate mlx-community/Qwen3-30B-A3B-4bit --runs 3 --max-tokens 200 --patterns moe_mlp; ZMLX_QWEN_ROUTER_ARGPARTITION_LOGITS=1 ZMLX_QWEN_COMBINE_MODE=fp32_no_fma python -m zmlx.validate mlx-community/Qwen3-30B-A3B-4bit --runs 3 --max-tokens 200 --patterns moe_mlp; python -m zmlx.validate mlx-community/GLM-4.7-Flash-4bit --patterns swiglu_mlp moe_mlp --runs 3 --max-tokens 200","controls":{"device":"Apple M4 Max","memory_gb":36,"macos":"26.1","mlx_version":"0.30.7.dev20260207+8fe1d092","zmlx_version":"0.8.3","git_commit":"094296f","python":"3.14","has_gather_qmm_swiglu":true},"metrics":{"capsules":["benchmarks/repro_capsules/qwen3_a3b_combo_v2_control_t200_r5.json","benchmarks/repro_capsules/qwen3_a3b_combo_v2_router_t200_r5.json","benchmarks/repro_capsules/qwen3_a3b_combo_v1_combine_t200_r3.json","benchmarks/repro_capsules/qwen3_a3b_combo_v1_router_combine_t200_r3.json","benchmarks/repro_capsules/glm47_combo_transfer_v1_control_qwenrouterenv_t200_r3.json"],"qwen3_control":{"path":"benchmarks/repro_capsules/qwen3_a3b_combo_v2_control_t200_r5.json","variant":"control_patterns_moe_mlp","command":"python -m zmlx.validate mlx-community/Qwen3-30B-A3B-4bit --runs 5 --max-tokens 200 --patterns moe_mlp","fidelity":{"matched":200,"total":200,"verdict":"PASS"},"decode":{"baseline":108.8,"patched":114.5,"delta":5.7,"delta_pct":5.239,"speedup":1.0524},"prefill":{"baseline":323.5,"patched":330.7,"delta":7.2,"delta_pct":2.2257},"peak_mem":{"baseline":17.24,"patched":17.24,"delta":0.0,"delta_pct":0.0},"meta":{"date":"2026-02-10","device":"Apple M4 Max","memory_gb":36,"macos":"26.1","mlx_version":"0.30.7.dev20260207+8fe1d092","zmlx_version":"0.8.3","git_commit":"094296f","python":"3.14","has_gather_qmm_swiglu":true}},"qwen3_router_argpartition":{"path":"benchmarks/repro_capsules/qwen3_a3b_combo_v2_router_t200_r5.json","variant":"qwen_router_argpartition_logits","command":"ZMLX_QWEN_ROUTER_ARGPARTITION_LOGITS=1 python -m zmlx.validate mlx-community/Qwen3-30B-A3B-4bit --runs 5 --max-tokens 200 --patterns moe_mlp","fidelity":{"matched":200,"total":200,"verdict":"PASS"},"decode":{"baseline":112.9,"patched":115.4,"delta":2.5,"delta_pct":2.2143,"speedup":1.0221},"prefill":{"baseline":329.1,"patched":331.5,"delta":2.4,"delta_pct":0.7293},"peak_mem":{"baseline":17.24,"patched":17.24,"delta":0.0,"delta_pct":0.0},"meta":{"date":"2026-02-10","device":"Apple M4 Max","memory_gb":36,"macos":"26.1","mlx_version":"0.30.7.dev20260207+8fe1d092","zmlx_version":"0.8.3","git_commit":"094296f","python":"3.14","has_gather_qmm_swiglu":true}},"qwen3_combine_fp32_no_fma":{"path":"benchmarks/repro_capsules/qwen3_a3b_combo_v1_combine_t200_r3.json","variant":"qwen_combine_fp32_no_fma","command":"ZMLX_QWEN_COMBINE_MODE=fp32_no_fma python -m zmlx.validate mlx-community/Qwen3-30B-A3B-4bit --runs 3 --max-tokens 200 --patterns moe_mlp","fidelity":{"matched":93,"total":200,"verdict":"FAIL"},"decode":{"baseline":111.7,"patched":41.8,"delta":-69.9,"delta_pct":-62.5783,"speedup":0.3742},"prefill":{"baseline":334.8,"patched":207.4,"delta":-127.4,"delta_pct":-38.0526},"peak_mem":{"baseline":17.24,"patched":17.71,"delta":0.47,"delta_pct":2.7262},"meta":{"date":"2026-02-10","device":"Apple M4 Max","memory_gb":36,"macos":"26.1","mlx_version":"0.30.7.dev20260207+8fe1d092","zmlx_version":"0.8.3","git_commit":"094296f","python":"3.14","has_gather_qmm_swiglu":true}},"qwen3_router_plus_combine_fp32_no_fma":{"path":"benchmarks/repro_capsules/qwen3_a3b_combo_v1_router_combine_t200_r3.json","variant":"qwen_router_argpartition_logits_combine_fp32_no_fma","command":"ZMLX_QWEN_ROUTER_ARGPARTITION_LOGITS=1 ZMLX_QWEN_COMBINE_MODE=fp32_no_fma python -m zmlx.validate mlx-community/Qwen3-30B-A3B-4bit --runs 3 --max-tokens 200 --patterns moe_mlp","fidelity":{"matched":93,"total":200,"verdict":"FAIL"},"decode":{"baseline":114.7,"patched":42.7,"delta":-72.0,"delta_pct":-62.7724,"speedup":0.3723},"prefill":{"baseline":338.8,"patched":210.3,"delta":-128.5,"delta_pct":-37.928},"peak_mem":{"baseline":17.24,"patched":17.72,"delta":0.48,"delta_pct":2.7842},"meta":{"date":"2026-02-10","device":"Apple M4 Max","memory_gb":36,"macos":"26.1","mlx_version":"0.30.7.dev20260207+8fe1d092","zmlx_version":"0.8.3","git_commit":"094296f","python":"3.14","has_gather_qmm_swiglu":true}},"glm47_control_qwen_router_env":{"path":"benchmarks/repro_capsules/glm47_combo_transfer_v1_control_qwenrouterenv_t200_r3.json","variant":"control_swiglu_moe","command":"python -m zmlx.validate mlx-community/GLM-4.7-Flash-4bit --patterns swiglu_mlp moe_mlp --runs 3 --max-tokens 200","fidelity":{"matched":200,"total":200,"verdict":"PASS"},"decode":{"baseline":80.3,"patched":78.7,"delta":-1.6,"delta_pct":-1.9925,"speedup":0.9801},"prefill":{"baseline":271.2,"patched":262.4,"delta":-8.8,"delta_pct":-3.2448},"peak_mem":{"baseline":16.91,"patched":16.91,"delta":0.0,"delta_pct":0.0},"meta":{"date":"2026-02-10","device":"Apple M4 Max","memory_gb":36,"macos":"26.1","mlx_version":"0.30.7.dev20260207+8fe1d092","zmlx_version":"0.8.3","git_commit":"094296f","python":"3.14","has_gather_qmm_swiglu":true}}},"decision":"keep qwen3 control default; router argpartition optional; combine fp32_no_fma disabled","next_action":"Only pursue new kernels that keep fidelity PASS and beat control at matched run settings."}
{"id":"EXP-20260210T093500Z-ZMLX-QWEN3-GLM-ISO-SWEEP-RESULT","date":"2026-02-10","question":"Can we identify the best Qwen3 custom-kernel combo with stable memory by running each candidate in process-isolated mode, and does the Qwen router env transfer to GLM?","hypothesis":"Isolated single-variant runs avoid OOM and preserve fidelity; router argpartition is near control; Qwen router env does not materially change GLM.","change_set":["measurement-only"],"command":"python benchmarks/bench_qwen3_a3b_experiments.py --runs 3 --max-tokens 200 --json-out benchmarks/repro_capsules/qwen3_a3b_combo_v3_full_eval_t200_r3.json --variants control_patterns_moe_mlp qwen_router_argpartition_logits qwen_fused_downproj_combine qwen_fused_downproj_combine_kvec qwen_combine_fp32_no_fma qwen_router_argpartition_logits_combine_fp32_no_fma | python benchmarks/bench_qwen3_a3b_experiments.py --runs 3 --max-tokens 200 --json-out benchmarks/repro_capsules/qwen3_a3b_combo_v3_control_iso_t200_r3.json --variants control_patterns_moe_mlp | python benchmarks/bench_qwen3_a3b_experiments.py --runs 3 --max-tokens 200 --json-out benchmarks/repro_capsules/qwen3_a3b_combo_v3_router_iso_t200_r3.json --variants qwen_router_argpartition_logits | python benchmarks/bench_glm47_flash_experiments.py --runs 3 --max-tokens 200 --json-out benchmarks/repro_capsules/glm47_combo_transfer_v2_control_t200_r3.json --variants control_swiglu_moe | ZMLX_QWEN_ROUTER_ARGPARTITION_LOGITS=1 python benchmarks/bench_glm47_flash_experiments.py --runs 3 --max-tokens 200 --json-out benchmarks/repro_capsules/glm47_combo_transfer_v2_control_qwenrouterenv_t200_r3.json --variants control_swiglu_moe","controls":{"device":"Apple M4 Max","memory_gb":36,"macos":"26.1","mlx_version":"0.30.7.dev20260207+8fe1d092","zmlx_version":"0.8.3","git_commit":"094296f","python":"3.14"},"metrics":{"oom_observed":true,"oom_context":"multi-variant qwen sweep in single process","qwen3_control_iso":{"path":"benchmarks/repro_capsules/qwen3_a3b_combo_v3_control_iso_t200_r3.json","variant":"control_patterns_moe_mlp","fidelity":{"matched":200,"total":200,"verdict":"PASS"},"decode":{"base":118.7,"patched":120.5,"delta":1.8,"pct":1.52,"speedup":1.0152},"prefill":{"base":337.0,"patched":340.2,"delta":3.2,"pct":0.95},"mem":{"base":17.24,"patched":17.24,"delta":0.0,"pct":0.0},"meta":{"date":"2026-02-10","device":"Apple M4 Max","memory_gb":36,"macos":"26.1","mlx_version":"0.30.7.dev20260207+8fe1d092","zmlx_version":"0.8.3","git_commit":"094296f","python":"3.14","has_gather_qmm_swiglu":true,"command_control_patterns_moe_mlp":"python -m zmlx.validate mlx-community/Qwen3-30B-A3B-4bit --runs 3 --max-tokens 200 --patterns moe_mlp"}},"qwen3_router_iso":{"path":"benchmarks/repro_capsules/qwen3_a3b_combo_v3_router_iso_t200_r3.json","variant":"qwen_router_argpartition_logits","fidelity":{"matched":200,"total":200,"verdict":"PASS"},"decode":{"base":118.6,"patched":120.5,"delta":1.9,"pct":1.6,"speedup":1.016},"prefill":{"base":338.2,"patched":340.8,"delta":2.6,"pct":0.77},"mem":{"base":17.24,"patched":17.24,"delta":0.0,"pct":0.0},"meta":{"date":"2026-02-10","device":"Apple M4 Max","memory_gb":36,"macos":"26.1","mlx_version":"0.30.7.dev20260207+8fe1d092","zmlx_version":"0.8.3","git_commit":"094296f","python":"3.14","has_gather_qmm_swiglu":true,"command_qwen_router_argpartition_logits":"ZMLX_QWEN_ROUTER_ARGPARTITION_LOGITS=1 python -m zmlx.validate mlx-community/Qwen3-30B-A3B-4bit --runs 3 --max-tokens 200 --patterns moe_mlp"}},"qwen3_combine_reference":{"path":"benchmarks/repro_capsules/qwen3_a3b_combo_v1_combine_t200_r3.json","variant":"qwen_combine_fp32_no_fma","fidelity":{"matched":93,"total":200,"verdict":"FAIL"},"decode":{"base":111.7,"patched":41.8,"delta":-69.9,"pct":-62.58,"speedup":0.3742},"prefill":{"base":334.8,"patched":207.4,"delta":-127.4,"pct":-38.05},"mem":{"base":17.24,"patched":17.71,"delta":0.47,"pct":2.73},"meta":{"date":"2026-02-10","device":"Apple M4 Max","memory_gb":36,"macos":"26.1","mlx_version":"0.30.7.dev20260207+8fe1d092","zmlx_version":"0.8.3","git_commit":"094296f","python":"3.14","has_gather_qmm_swiglu":true,"command_qwen_combine_fp32_no_fma":"ZMLX_QWEN_COMBINE_MODE=fp32_no_fma python -m zmlx.validate mlx-community/Qwen3-30B-A3B-4bit --runs 3 --max-tokens 200 --patterns moe_mlp"}},"qwen3_router_combine_reference":{"path":"benchmarks/repro_capsules/qwen3_a3b_combo_v1_router_combine_t200_r3.json","variant":"qwen_router_argpartition_logits_combine_fp32_no_fma","fidelity":{"matched":93,"total":200,"verdict":"FAIL"},"decode":{"base":114.7,"patched":42.7,"delta":-72.0,"pct":-62.77,"speedup":0.3723},"prefill":{"base":338.8,"patched":210.3,"delta":-128.5,"pct":-37.93},"mem":{"base":17.24,"patched":17.72,"delta":0.48,"pct":2.78},"meta":{"date":"2026-02-10","device":"Apple M4 Max","memory_gb":36,"macos":"26.1","mlx_version":"0.30.7.dev20260207+8fe1d092","zmlx_version":"0.8.3","git_commit":"094296f","python":"3.14","has_gather_qmm_swiglu":true,"command_qwen_router_argpartition_logits_combine_fp32_no_fma":"ZMLX_QWEN_ROUTER_ARGPARTITION_LOGITS=1 ZMLX_QWEN_COMBINE_MODE=fp32_no_fma python -m zmlx.validate mlx-community/Qwen3-30B-A3B-4bit --runs 3 --max-tokens 200 --patterns moe_mlp"}},"glm47_control_iso":{"path":"benchmarks/repro_capsules/glm47_combo_transfer_v2_control_t200_r3.json","variant":"control_swiglu_moe","fidelity":{"matched":200,"total":200,"verdict":"PASS"},"decode":{"base":86.4,"patched":90.6,"delta":4.2,"pct":4.86,"speedup":1.0486},"prefill":{"base":277.3,"patched":274.2,"delta":-3.1,"pct":-1.12},"mem":{"base":16.91,"patched":16.91,"delta":0.0,"pct":0.0},"meta":{"date":"2026-02-10","device":"Apple M4 Max","memory_gb":36,"macos":"26.1","mlx_version":"0.30.7.dev20260207+8fe1d092","zmlx_version":"0.8.3","git_commit":"094296f","python":"3.14","has_gather_qmm_swiglu":true,"command_control_swiglu_moe":"python -m zmlx.validate mlx-community/GLM-4.7-Flash-4bit --patterns swiglu_mlp moe_mlp --runs 3 --max-tokens 200"}},"glm47_control_iso_qwen_router_env":{"path":"benchmarks/repro_capsules/glm47_combo_transfer_v2_control_qwenrouterenv_t200_r3.json","variant":"control_swiglu_moe","fidelity":{"matched":200,"total":200,"verdict":"PASS"},"decode":{"base":86.6,"patched":90.9,"delta":4.3,"pct":4.97,"speedup":1.0497},"prefill":{"base":278.2,"patched":272.7,"delta":-5.5,"pct":-1.98},"mem":{"base":16.91,"patched":16.91,"delta":0.0,"pct":0.0},"meta":{"date":"2026-02-10","device":"Apple M4 Max","memory_gb":36,"macos":"26.1","mlx_version":"0.30.7.dev20260207+8fe1d092","zmlx_version":"0.8.3","git_commit":"094296f","python":"3.14","has_gather_qmm_swiglu":true,"command_control_swiglu_moe":"python -m zmlx.validate mlx-community/GLM-4.7-Flash-4bit --patterns swiglu_mlp moe_mlp --runs 3 --max-tokens 200"}}},"decision":"keep qwen control default, router optional, combine disabled; use process-isolated benchmarking","next_action":"Only promote kernels with fidelity PASS and win over isolated control."}
{"id":"EXP-20260210T085850Z-GLM-POST-REBOOT-PREFLIGHT-RESULT","date":"2026-02-11","question":"Is the host/session safe to start the post-reboot GLM benchmark sequence without running inference yet?","hypothesis":"The setup preflight script will pass file/help checks and produce baseline safety artifacts for swap/compressor tracking.","change_set":["none"],"command":"bash /Volumes/VIXinSSD/wayfinder/scripts/bench_protocol_preflight_setup.sh --run-id EXP-20260210T085850Z-GLM-POST-REBOOT-PREFLIGHT --out-dir /Volumes/VIXinSSD/wayfinder/notes/preflight","controls":{"inference_executed":false,"one_process_at_a_time":true,"retro_backfill_default_inference_off":true},"metrics":{"status":"pass","checks":{"files_ok":5,"files_total":5,"help_ok":6,"help_total":6},"pre_run":{"swap_used_mb":1340.00,"swap_free_mb":1732.00,"pages_occupied_by_compressor":42743},"post_run":{"swap_used_mb":1340.00,"swap_free_mb":1732.00,"pages_occupied_by_compressor":42743},"safety_deltas":{"swap_used_mb":0.00,"pages_occupied_by_compressor":0}},"decision":"keep","next_action":"proceed with Step 2 helpers and Step 3 throughput benchmarks."}
{"id":"EXP-20260210T085850Z-GLM-PERM-T8192-RESULT","date":"2026-02-11","question":"At seq_len=8192, does Wayfinder permute improve throughput and reduce peak memory versus embedded dense baseline?","hypothesis":"At 8k, Wayfinder should show positive memory reduction and competitive-to-positive throughput delta under strict memory gates.","change_set":["none"],"command":"run_with_mem_gate glm_perm_t8192 python3 scripts/bench_glm_wayfinder_mlx.py --model-path mlx-community/GLM-4.7-Flash-4bit --seq-lens 8192 --batch 1 --warmup 1 --iters 1 --dtype bfloat16 --path permute --window 64 --landmark-stride 0 --num-cycles 1 --seed 42 --permute-head-chunk-size 2 --permute-query-chunk-size 192 --permute-prepermute-mode auto --permute-memory-budget-multiplier 1.0","controls":{"one_process_at_a_time":true,"memory_gates_enabled":true,"retro_backfill_off":true},"metrics":{"tokens_per_sec":{"dense_absolute":21746.63,"wayfinder_absolute":102936.88,"delta_pct_vs_baseline":373.35},"peak_memory_bytes":{"dense_absolute":3719072300,"wayfinder_absolute":1186794032,"memory_reduction_pct":68.09},"memory_gate":"PASS"},"decision":"keep","next_action":"run T=32768 benchmark"}
{"id":"EXP-20260210T085850Z-GLM-PERM-T32768-RESULT","date":"2026-02-11","question":"At seq_len=32768, does Wayfinder permute outperform dense on throughput/memory tradeoff?","hypothesis":"At 32k, Wayfinder should outperform dense which has O(n^2) memory.","change_set":["none"],"command":"run_with_mem_gate glm_perm_t32768 python3 scripts/bench_glm_wayfinder_mlx.py --model-path mlx-community/GLM-4.7-Flash-4bit --seq-lens 32768 --batch 1 --warmup 1 --iters 1 --dtype bfloat16 --path permute --window 64 --landmark-stride 0 --num-cycles 1 --seed 42 --permute-head-chunk-size 2 --permute-query-chunk-size 192 --permute-prepermute-mode auto --permute-memory-budget-multiplier 1.0","controls":{"one_process_at_a_time":true,"memory_gates_enabled":true},"metrics":{"status":"dense_oom","error":"RuntimeError: [metal::malloc] Attempting to allocate 42949672960 bytes > 22613000192 max","implication":"dense cannot scale to 32k - wayfinder win by default"},"decision":"follow-up","next_action":"investigate wayfinder-only mode for T=32768"}
{"id":"EXP-20260210T085850Z-CONSUMER-DENSE-QUALITY-RESULT","date":"2026-02-11","question":"What is the dense quality baseline on the fixed consumer dataset at seq_len=8192?","hypothesis":"Dense run provides reference correct/num_tasks/accuracy for parity judgment.","change_set":["none"],"command":"run_with_mem_gate consumer_dense_quality python3 scripts/bench_glm_consumer_mlx.py --model-path mlx-community/GLM-4.7-Flash-4bit --seq-lens 8192 --decode-len 64 --repeats 1 --chunk-size 4096 --kv-step 4096 --cooldown-sec 0 --path permute --window 64 --landmark-stride 0 --head-chunk-size 2 --query-chunk-size 192 --active-dense-threshold 0 --seed 42 --quality-dataset benchmarks/mlx/glm_4_7_flash_4bit_wayfinder/quality_eval_glm47_consumer_v1.json --skip-single-turn --skip-multi-turn --no-swap","controls":{"quality_only_mode":true,"memory_gates_enabled":true},"metrics":{"correct":3,"num_tasks":6,"accuracy":0.5,"memory_gate":"WARN (delta_comp_pages=+168946 > 100k)"},"decision":"keep","next_action":"run wayfinder quality comparison"}
{"id":"EXP-20260210T085850Z-CONSUMER-WAYFINDER-QUALITY-RESULT","date":"2026-02-11","question":"Does Wayfinder preserve quality parity versus dense on the same consumer dataset?","hypothesis":"Wayfinder quality should remain near dense with matching task IDs and small accuracy delta.","change_set":["none"],"command":"run_with_mem_gate consumer_wayfinder_quality python3 scripts/bench_glm_consumer_mlx.py --model-path mlx-community/GLM-4.7-Flash-4bit --seq-lens 8192 --decode-len 64 --repeats 1 --chunk-size 4096 --kv-step 4096 --cooldown-sec 0 --path permute --window 64 --landmark-stride 0 --head-chunk-size 2 --query-chunk-size 192 --active-dense-threshold 0 --seed 42 --quality-dataset benchmarks/mlx/glm_4_7_flash_4bit_wayfinder/quality_eval_glm47_consumer_v1.json --skip-single-turn --skip-multi-turn","controls":{"quality_only_mode":true,"memory_gates_enabled":true},"metrics":{"correct":2,"num_tasks":6,"accuracy":0.3333},"decision":"keep","next_action":"run quality comparator"}
{"id":"EXP-20260210T085850Z-CONSUMER-QUALITY-COMPARE-RESULT","date":"2026-02-11","question":"Do dense and Wayfinder quality outputs match task IDs and remain within acceptable accuracy drift?","hypothesis":"Comparator will confirm task-ID parity and report small accuracy delta.","change_set":["none"],"command":"python3 comparator block from protocol Step 4C","controls":{"no_model_execution":true},"metrics":{"dense_accuracy":0.5,"wayfinder_accuracy":0.3333,"accuracy_delta":-0.1667,"task_ids_match":true},"decision":"follow-up","next_action":"investigate quality drift root cause"}
{"id": "EXP-20260211T204824Z-GLM-DRIFT-REPEATABILITY-PRERUN", "date": "2026-02-11", "question": "Is -16.7% quality drift repeatable at fixed settings, or mostly run-to-run noise on a 6-task set?", "hypothesis": "If drift is mostly noise, repeated dense/Wayfinder runs at identical settings will show unstable sign and high variance.", "change_set": ["none (measurement-only)"], "command": "run_with_mem_gate drift_repeat_dense_r1 -> drift_repeat_wayfinder_r1 -> drift_repeat_dense_r2 -> drift_repeat_wayfinder_r2 using scripts/bench_glm_consumer_mlx.py at seq_len=8192 decode_len=64 seed=42 with fixed dataset", "controls": {"baseline_run_root": "/Volumes/VIXinSSD/wayfinder/benchmarks/mlx/post_reboot_20260211_20260211T202821Z", "diag_root": "/Volumes/VIXinSSD/wayfinder/benchmarks/mlx/post_reboot_20260211_20260211T202821Z/quality_drift_diag_20260211T204824Z", "one_process_at_a_time": true, "one_seq_len_per_process": true, "retro_backfill_default_inference_off": true, "memory_stop_gates": {"swap_used_delta_mb_max": 1024, "compressor_pages_delta_max": 100000}}, "metrics": {"status": "pending", "required": ["dense.correct", "dense.accuracy", "wayfinder.correct", "wayfinder.accuracy", "accuracy_delta", "delta_vs_baseline_drift", "delta_pct_vs_baseline_drift"]}, "decision": "pending", "next_action": "Execute four repeatability runs and compute pooled drift summary."}
{"id": "EXP-20260211T204824Z-GLM-DRIFT-SEED-SENSITIVITY-PRERUN", "date": "2026-02-11", "question": "Does Wayfinder quality vary materially with seed at fixed decode settings?", "hypothesis": "If attention-path sensitivity is real, Wayfinder seed changes will materially move per-task outcomes while dense stays near baseline.", "change_set": ["none (measurement-only)"], "command": "run_with_mem_gate drift_seed_dense_s7, drift_seed_wayfinder_s7, drift_seed_wayfinder_s99 using scripts/bench_glm_consumer_mlx.py at seq_len=8192 decode_len=64", "controls": {"baseline_run_root": "/Volumes/VIXinSSD/wayfinder/benchmarks/mlx/post_reboot_20260211_20260211T202821Z", "diag_root": "/Volumes/VIXinSSD/wayfinder/benchmarks/mlx/post_reboot_20260211_20260211T202821Z/quality_drift_diag_20260211T204824Z", "one_process_at_a_time": true, "one_seq_len_per_process": true, "retro_backfill_default_inference_off": true, "memory_stop_gates": {"swap_used_delta_mb_max": 1024, "compressor_pages_delta_max": 100000}}, "metrics": {"status": "pending", "required": ["dense_seed7_accuracy", "wayfinder_seed7_accuracy", "wayfinder_seed99_accuracy", "drift_vs_dense_each_seed", "delta_vs_baseline_and_pct"]}, "decision": "pending", "next_action": "Execute seed runs and merge into variance/tie-break summary."}
