{"id":"EXP-20260208-GLM65K-CF52DA4-TH47104-R01-RESULT","date":"2026-02-08","question":"Result for EXP-20260208-GLM65K-CF52DA4-TH47104-R01","hypothesis":"Measured outcome from planned run.","change_set":["measurement only"],"command":"PYTHONPATH=. python3 scripts/bench_glm_chunked_prefill_mlx.py --model-path mlx-community/GLM-4.7-Flash-4bit --seq-lens 65536 --chunk-sizes 4096 --decode-lens 0 --cache-modes normal --path permute --window 64 --landmark-stride 0 --head-chunk-size 2 --kv-step 4096 --baseline-path benchmarks/mlx/glm_4_7_flash_4bit_wayfinder/20260207_201347_fullmodel_prefill_kv_checkpoint/results.json --active-dense-threshold 47104 --query-chunk-size 384 --out-dir benchmarks/mlx/glm_4_7_flash_4bit_wayfinder/20260208_glm65k_cf52da4_phase2_thresh47104_q384_h2_r01","controls":{"model":"mlx-community/GLM-4.7-Flash-4bit","seq_len":65536,"chunk_size":4096,"decode_len":0,"path":"permute","window":64,"landmark_stride":0,"head_chunk_size":2,"kv_step":4096,"retro_backfill_enabled":false,"baseline_path":"benchmarks/mlx/glm_4_7_flash_4bit_wayfinder/20260207_201347_fullmodel_prefill_kv_checkpoint/results.json","dense_control_median_path_pair":["benchmarks/mlx/glm_4_7_flash_4bit_wayfinder/20260208_glm65k_cf52da4_phase2_dense_noswap_r01/results.json","benchmarks/mlx/glm_4_7_flash_4bit_wayfinder/20260208_glm65k_cf52da4_phase2_dense_noswap_r02/results.json"]},"metrics":{"path":"benchmarks/mlx/glm_4_7_flash_4bit_wayfinder/20260208_glm65k_cf52da4_phase2_thresh47104_q384_h2_r01/results.json","prefill_sec":525.4169470830093,"prefill_tok_s":124.73141638053433,"peak_memory_bytes":28696790168,"delta_sec_vs_monolithic_dense":398.72749729100906,"delta_tok_s_vs_monolithic_dense":-392.56501286118663,"delta_peak_bytes_vs_monolithic_dense":-16194101772,"delta_sec_vs_dense_control_median":-206.84961887549434,"delta_tok_s_vs_dense_control_median":34.76046973060622,"peak_memory_reduction_pct_vs_dense_control_median":13.462501090939249},"decision":"recorded","next_action":"aggregate campaign-level medians/std and update README"}
{"id":"EXP-20260208-GLM65K-CF52DA4-TH49152-R03-RESULT","date":"2026-02-08","question":"Result for EXP-20260208-GLM65K-CF52DA4-TH49152-R03","hypothesis":"Measured outcome from planned run.","change_set":["measurement only"],"command":"PYTHONPATH=. python3 scripts/bench_glm_chunked_prefill_mlx.py --model-path mlx-community/GLM-4.7-Flash-4bit --seq-lens 65536 --chunk-sizes 4096 --decode-lens 0 --cache-modes normal --path permute --window 64 --landmark-stride 0 --head-chunk-size 2 --kv-step 4096 --baseline-path benchmarks/mlx/glm_4_7_flash_4bit_wayfinder/20260207_201347_fullmodel_prefill_kv_checkpoint/results.json --active-dense-threshold 49152 --query-chunk-size 384 --out-dir benchmarks/mlx/glm_4_7_flash_4bit_wayfinder/20260208_glm65k_cf52da4_phase2_thresh49152_q384_h2_r03","controls":{"model":"mlx-community/GLM-4.7-Flash-4bit","seq_len":65536,"chunk_size":4096,"decode_len":0,"path":"permute","window":64,"landmark_stride":0,"head_chunk_size":2,"kv_step":4096,"retro_backfill_enabled":false,"baseline_path":"benchmarks/mlx/glm_4_7_flash_4bit_wayfinder/20260207_201347_fullmodel_prefill_kv_checkpoint/results.json","dense_control_median_path_pair":["benchmarks/mlx/glm_4_7_flash_4bit_wayfinder/20260208_glm65k_cf52da4_phase2_dense_noswap_r01/results.json","benchmarks/mlx/glm_4_7_flash_4bit_wayfinder/20260208_glm65k_cf52da4_phase2_dense_noswap_r02/results.json"]},"metrics":{"path":"benchmarks/mlx/glm_4_7_flash_4bit_wayfinder/20260208_glm65k_cf52da4_phase2_thresh49152_q384_h2_r03/results.json","prefill_sec":512.6925909999991,"prefill_tok_s":127.82708615346485,"peak_memory_bytes":29589653008,"delta_sec_vs_monolithic_dense":386.00314120799885,"delta_tok_s_vs_monolithic_dense":-389.4693430882561,"delta_peak_bytes_vs_monolithic_dense":-15301238932,"delta_sec_vs_dense_control_median":-219.57397495850455,"delta_tok_s_vs_dense_control_median":37.85613950353674,"peak_memory_reduction_pct_vs_dense_control_median":10.77000075936555},"decision":"recorded","next_action":"aggregate campaign-level medians/std and update README"}
{"id":"EXP-20260208-GLM65K-CF52DA4-TH51200-R01-RESULT","date":"2026-02-08","question":"Result for EXP-20260208-GLM65K-CF52DA4-TH51200-R01","hypothesis":"Measured outcome from planned run.","change_set":["measurement only"],"command":"PYTHONPATH=. python3 scripts/bench_glm_chunked_prefill_mlx.py --model-path mlx-community/GLM-4.7-Flash-4bit --seq-lens 65536 --chunk-sizes 4096 --decode-lens 0 --cache-modes normal --path permute --window 64 --landmark-stride 0 --head-chunk-size 2 --kv-step 4096 --baseline-path benchmarks/mlx/glm_4_7_flash_4bit_wayfinder/20260207_201347_fullmodel_prefill_kv_checkpoint/results.json --active-dense-threshold 51200 --query-chunk-size 384 --out-dir benchmarks/mlx/glm_4_7_flash_4bit_wayfinder/20260208_glm65k_cf52da4_phase2_thresh51200_q384_h2_r01","controls":{"model":"mlx-community/GLM-4.7-Flash-4bit","seq_len":65536,"chunk_size":4096,"decode_len":0,"path":"permute","window":64,"landmark_stride":0,"head_chunk_size":2,"kv_step":4096,"retro_backfill_enabled":false,"baseline_path":"benchmarks/mlx/glm_4_7_flash_4bit_wayfinder/20260207_201347_fullmodel_prefill_kv_checkpoint/results.json","dense_control_median_path_pair":["benchmarks/mlx/glm_4_7_flash_4bit_wayfinder/20260208_glm65k_cf52da4_phase2_dense_noswap_r01/results.json","benchmarks/mlx/glm_4_7_flash_4bit_wayfinder/20260208_glm65k_cf52da4_phase2_dense_noswap_r02/results.json"]},"metrics":{"path":"benchmarks/mlx/glm_4_7_flash_4bit_wayfinder/20260208_glm65k_cf52da4_phase2_thresh51200_q384_h2_r01/results.json","prefill_sec":525.5959826670005,"prefill_tok_s":124.68892868521286,"peak_memory_bytes":29589653008,"delta_sec_vs_monolithic_dense":398.90653287500027,"delta_tok_s_vs_monolithic_dense":-392.60750055650806,"delta_peak_bytes_vs_monolithic_dense":-15301238932,"delta_sec_vs_dense_control_median":-206.67058329150314,"delta_tok_s_vs_dense_control_median":34.71798203528475,"peak_memory_reduction_pct_vs_dense_control_median":10.77000075936555},"decision":"recorded","next_action":"aggregate campaign-level medians/std and update README"}
{"id":"EXP-20260208-GLM65K-CF52DA4-Q320-R01-RESULT","date":"2026-02-08","question":"Result for EXP-20260208-GLM65K-CF52DA4-Q320-R01","hypothesis":"Measured outcome from planned run.","change_set":["measurement only"],"command":"PYTHONPATH=. python3 scripts/bench_glm_chunked_prefill_mlx.py --model-path mlx-community/GLM-4.7-Flash-4bit --seq-lens 65536 --chunk-sizes 4096 --decode-lens 0 --cache-modes normal --path permute --window 64 --landmark-stride 0 --head-chunk-size 2 --kv-step 4096 --baseline-path benchmarks/mlx/glm_4_7_flash_4bit_wayfinder/20260207_201347_fullmodel_prefill_kv_checkpoint/results.json --active-dense-threshold 49152 --query-chunk-size 320 --out-dir benchmarks/mlx/glm_4_7_flash_4bit_wayfinder/20260208_glm65k_cf52da4_phase2_q320_th49152_h2_r01","controls":{"model":"mlx-community/GLM-4.7-Flash-4bit","seq_len":65536,"chunk_size":4096,"decode_len":0,"path":"permute","window":64,"landmark_stride":0,"head_chunk_size":2,"kv_step":4096,"retro_backfill_enabled":false,"baseline_path":"benchmarks/mlx/glm_4_7_flash_4bit_wayfinder/20260207_201347_fullmodel_prefill_kv_checkpoint/results.json","dense_control_median_path_pair":["benchmarks/mlx/glm_4_7_flash_4bit_wayfinder/20260208_glm65k_cf52da4_phase2_dense_noswap_r01/results.json","benchmarks/mlx/glm_4_7_flash_4bit_wayfinder/20260208_glm65k_cf52da4_phase2_dense_noswap_r02/results.json"]},"metrics":{"path":"benchmarks/mlx/glm_4_7_flash_4bit_wayfinder/20260208_glm65k_cf52da4_phase2_q320_th49152_h2_r01/results.json","prefill_sec":634.620596290988,"prefill_tok_s":103.2680004131953,"peak_memory_bytes":29589653008,"delta_sec_vs_monolithic_dense":507.9311464989878,"delta_tok_s_vs_monolithic_dense":-414.02842882852565,"delta_peak_bytes_vs_monolithic_dense":-15301238932,"delta_sec_vs_dense_control_median":-97.6459696675156,"delta_tok_s_vs_dense_control_median":13.297053763267186,"peak_memory_reduction_pct_vs_dense_control_median":10.77000075936555},"decision":"recorded","next_action":"aggregate campaign-level medians/std and update README"}
{"id":"EXP-20260208-GLM65K-CF52DA4-Q384-R03-RESULT","date":"2026-02-08","question":"Result for EXP-20260208-GLM65K-CF52DA4-Q384-R03","hypothesis":"Measured outcome from planned run.","change_set":["measurement only"],"command":"PYTHONPATH=. python3 scripts/bench_glm_chunked_prefill_mlx.py --model-path mlx-community/GLM-4.7-Flash-4bit --seq-lens 65536 --chunk-sizes 4096 --decode-lens 0 --cache-modes normal --path permute --window 64 --landmark-stride 0 --head-chunk-size 2 --kv-step 4096 --baseline-path benchmarks/mlx/glm_4_7_flash_4bit_wayfinder/20260207_201347_fullmodel_prefill_kv_checkpoint/results.json --active-dense-threshold 49152 --query-chunk-size 384 --out-dir benchmarks/mlx/glm_4_7_flash_4bit_wayfinder/20260208_glm65k_cf52da4_phase2_q384_th49152_h2_r03","controls":{"model":"mlx-community/GLM-4.7-Flash-4bit","seq_len":65536,"chunk_size":4096,"decode_len":0,"path":"permute","window":64,"landmark_stride":0,"head_chunk_size":2,"kv_step":4096,"retro_backfill_enabled":false,"baseline_path":"benchmarks/mlx/glm_4_7_flash_4bit_wayfinder/20260207_201347_fullmodel_prefill_kv_checkpoint/results.json","dense_control_median_path_pair":["benchmarks/mlx/glm_4_7_flash_4bit_wayfinder/20260208_glm65k_cf52da4_phase2_dense_noswap_r01/results.json","benchmarks/mlx/glm_4_7_flash_4bit_wayfinder/20260208_glm65k_cf52da4_phase2_dense_noswap_r02/results.json"]},"metrics":{"path":"benchmarks/mlx/glm_4_7_flash_4bit_wayfinder/20260208_glm65k_cf52da4_phase2_q384_th49152_h2_r03/results.json","prefill_sec":582.2055635830038,"prefill_tok_s":112.56505279111211,"peak_memory_bytes":29589653008,"delta_sec_vs_monolithic_dense":455.5161137910036,"delta_tok_s_vs_monolithic_dense":-404.7313764506088,"delta_peak_bytes_vs_monolithic_dense":-15301238932,"delta_sec_vs_dense_control_median":-150.0610023754998,"delta_tok_s_vs_dense_control_median":22.594106141184,"peak_memory_reduction_pct_vs_dense_control_median":10.77000075936555},"decision":"recorded","next_action":"aggregate campaign-level medians/std and update README"}
{"id":"EXP-20260208-GLM65K-CF52DA4-Q448-R01-RESULT","date":"2026-02-08","question":"Result for EXP-20260208-GLM65K-CF52DA4-Q448-R01","hypothesis":"Measured outcome from planned run.","change_set":["measurement only"],"command":"PYTHONPATH=. python3 scripts/bench_glm_chunked_prefill_mlx.py --model-path mlx-community/GLM-4.7-Flash-4bit --seq-lens 65536 --chunk-sizes 4096 --decode-lens 0 --cache-modes normal --path permute --window 64 --landmark-stride 0 --head-chunk-size 2 --kv-step 4096 --baseline-path benchmarks/mlx/glm_4_7_flash_4bit_wayfinder/20260207_201347_fullmodel_prefill_kv_checkpoint/results.json --active-dense-threshold 49152 --query-chunk-size 448 --out-dir benchmarks/mlx/glm_4_7_flash_4bit_wayfinder/20260208_glm65k_cf52da4_phase2_q448_th49152_h2_r01","controls":{"model":"mlx-community/GLM-4.7-Flash-4bit","seq_len":65536,"chunk_size":4096,"decode_len":0,"path":"permute","window":64,"landmark_stride":0,"head_chunk_size":2,"kv_step":4096,"retro_backfill_enabled":false,"baseline_path":"benchmarks/mlx/glm_4_7_flash_4bit_wayfinder/20260207_201347_fullmodel_prefill_kv_checkpoint/results.json","dense_control_median_path_pair":["benchmarks/mlx/glm_4_7_flash_4bit_wayfinder/20260208_glm65k_cf52da4_phase2_dense_noswap_r01/results.json","benchmarks/mlx/glm_4_7_flash_4bit_wayfinder/20260208_glm65k_cf52da4_phase2_dense_noswap_r02/results.json"]},"metrics":{"path":"benchmarks/mlx/glm_4_7_flash_4bit_wayfinder/20260208_glm65k_cf52da4_phase2_q448_th49152_h2_r01/results.json","prefill_sec":628.7084905000083,"prefill_tok_s":104.23908852873863,"peak_memory_bytes":29589653008,"delta_sec_vs_monolithic_dense":502.0190407080081,"delta_tok_s_vs_monolithic_dense":-413.0573407129823,"delta_peak_bytes_vs_monolithic_dense":-15301238932,"delta_sec_vs_dense_control_median":-103.5580754584953,"delta_tok_s_vs_dense_control_median":14.268141878810525,"peak_memory_reduction_pct_vs_dense_control_median":10.77000075936555},"decision":"recorded","next_action":"aggregate campaign-level medians/std and update README"}
{"id":"EXP-20260208-GLM65K-CF52DA4-CAMPAIGN-SUMMARY-RESULT","date":"2026-02-08","question":"What is the reproducible best config for GLM-4.7-Flash 65k chunked prefill after fresh reruns from cf52da4?","hypothesis":"th=49152,q=384,h=2 remains the highest-confidence default; nearby settings may look faster on singles but need stability evidence.","change_set":["measurement only (no code changes)"],"command":"campaign batch: tuned x2, dense x2, thresholds {47104,49152,51200}, q-sweep {320,384,448}","controls":{"seq_len":65536,"chunk_size":4096,"decode_len":0,"path":"permute","head_chunk_size":2,"kv_step":4096,"retro_backfill_enabled":false,"baseline_path":"benchmarks/mlx/glm_4_7_flash_4bit_wayfinder/20260207_201347_fullmodel_prefill_kv_checkpoint/results.json"},"metrics":{"tuned_pair":{"median_prefill_sec":680.8013776250082,"median_prefill_tok_s":100.05414227870571,"median_peak_memory_bytes":29589653008.0,"std_prefill_sec":132.5215485000008,"std_prefill_tok_s":19.476062041573662},"dense_pair":{"median_prefill_sec":732.2665659585036,"median_prefill_tok_s":89.97094664992811,"median_peak_memory_bytes":33161104180.0,"std_prefill_sec":53.12151920850738,"std_prefill_tok_s":6.526849091376633},"tuned_vs_dense_median":{"delta_sec":-51.46518833349546,"delta_tok_s":10.083195628777602,"peak_memory_reduction_pct":10.77000075936555},"best_threshold_single":{"id":"EXP-20260208-GLM65K-CF52DA4-TH49152-R03","prefill_sec":512.6925909999991,"prefill_tok_s":127.82708615346485},"best_q_single":{"id":"EXP-20260208-GLM65K-CF52DA4-Q384-R03","prefill_sec":582.2055635830038,"prefill_tok_s":112.56505279111211}},"decision":"keep_default_th49152_q384_h2_due_to_best_single_and_prior_repeat_evidence; mark current-session variance high","next_action":"run 2 additional warmed repeats at th=49152,q=384,h=2 with fixed thermal guard to tighten variance estimate"}
{"id":"EXP-20260208-GLM47-CONSUMER-HCSA-R01","date":"2026-02-08","question":"Under consumer-like single-turn + multi-turn + quality workloads, does Hamiltonian permute (th=49152,q=384,h=2) beat chunked dense on latency while reducing memory and preserving quality?","hypothesis":"Hamiltonian should improve long-context E2E and TTFT while keeping ITL p95 within 5% of dense and reducing peak memory by at least 8%.","change_set":["scripts/bench_glm_chunked_prefill_mlx.py: add TTFT/ITL metric fields and baseline comparisons","scripts/bench_glm_consumer_mlx.py: new consumer-like benchmark harness (single-turn, multi-turn, quality)","benchmarks/mlx/glm_4_7_flash_4bit_wayfinder/quality_eval_glm47_consumer_v1.json: fixed objective quality set"],"command":"PYTHONPATH=. python3 scripts/bench_glm_consumer_mlx.py --model-path mlx-community/GLM-4.7-Flash-4bit --seq-lens 2048 8192 32768 65536 --decode-len 256 --repeats 3 --turns 8 --multi-decode-len 128 --multi-target-context 65536 --chunk-size 4096 --kv-step 4096 --cooldown-sec 60 --path permute --window 64 --landmark-stride 0 --head-chunk-size 2 --query-chunk-size 384 --active-dense-threshold 49152 --quality-dataset benchmarks/mlx/glm_4_7_flash_4bit_wayfinder/quality_eval_glm47_consumer_v1.json --out-dir benchmarks/mlx/glm_4_7_flash_4bit_wayfinder/20260208_glm47_consumer_hcsa_r01","controls":{"model":"mlx-community/GLM-4.7-Flash-4bit","chunk_size":4096,"kv_step":4096,"window":64,"landmark_stride":0,"head_chunk_size":2,"retro_backfill_enabled":false,"warmup":"1 unlogged run per measured set"},"metrics":{"status":"pending"},"decision":"pending","next_action":"run dense control under identical workload and compute absolute/delta/% comparisons"}
{"id":"EXP-20260208-GLM47-CONSUMER-DENSE-R01","date":"2026-02-08","question":"What are dense chunked control metrics under the same consumer-like workload suite?","hypothesis":"Dense chunked control will consume more peak memory and underperform Hamiltonian on long-context E2E/TTFT.","change_set":["measurement only (--no-swap)"],"command":"PYTHONPATH=. python3 scripts/bench_glm_consumer_mlx.py --model-path mlx-community/GLM-4.7-Flash-4bit --seq-lens 2048 8192 32768 65536 --decode-len 256 --repeats 3 --turns 8 --multi-decode-len 128 --multi-target-context 65536 --chunk-size 4096 --kv-step 4096 --cooldown-sec 60 --path permute --window 64 --landmark-stride 0 --head-chunk-size 2 --query-chunk-size 384 --active-dense-threshold 49152 --quality-dataset benchmarks/mlx/glm_4_7_flash_4bit_wayfinder/quality_eval_glm47_consumer_v1.json --no-swap --out-dir benchmarks/mlx/glm_4_7_flash_4bit_wayfinder/20260208_glm47_consumer_dense_r01","controls":{"model":"mlx-community/GLM-4.7-Flash-4bit","chunk_size":4096,"kv_step":4096,"window":64,"landmark_stride":0,"head_chunk_size":2,"retro_backfill_enabled":false,"matched_run":"EXP-20260208-GLM47-CONSUMER-HCSA-R01"},"metrics":{"status":"pending"},"decision":"pending","next_action":"aggregate medians/std/CV and gate against victory criteria"}
{"id":"EXP-20260208-GLM47-CONSUMER-THRESH-SWEEP-R01","date":"2026-02-08","question":"On seq=65536 decode=256, does threshold micro-retune (47104/49152/51200) improve consumer E2E/TTFT without harming ITL p95?","hypothesis":"49152 remains best or tied-best when decode metrics are included.","change_set":["measurement-only threshold sweep"],"command":"for th in 47104 49152 51200; do PYTHONPATH=. python3 scripts/bench_glm_consumer_mlx.py --model-path mlx-community/GLM-4.7-Flash-4bit --seq-lens 65536 --decode-len 256 --repeats 1 --chunk-size 4096 --kv-step 4096 --cooldown-sec 60 --path permute --window 64 --landmark-stride 0 --head-chunk-size 2 --query-chunk-size 384 --active-dense-threshold $th --skip-multi-turn --skip-quality --out-dir benchmarks/mlx/glm_4_7_flash_4bit_wayfinder/20260208_glm47_consumer_thresh_${th}_r01; sleep 60; done","controls":{"model":"mlx-community/GLM-4.7-Flash-4bit","seq_len":65536,"decode_len":256,"chunk_size":4096,"kv_step":4096,"path":"permute","retro_backfill_enabled":false},"metrics":{"status":"pending"},"decision":"pending","next_action":"pick threshold for confirmation reruns if victory gates look reachable"}
{"id":"EXP-20260208-GLM47-CONSUMER-REDUCED-HCSA-R02","date":"2026-02-08","question":"Can we obtain complete artifacted consumer metrics quickly enough to make a strict go/no-go call tonight?","hypothesis":"Single-repeat full-suite data including 65k and multi-turn will support no-victory/victory gating without extrapolation.","change_set":["measurement protocol reduced: repeats=1,cooldown=0","checkpointed writes in scripts/bench_glm_consumer_mlx.py"],"command":"PYTHONPATH=. python3 scripts/bench_glm_consumer_mlx.py --model-path mlx-community/GLM-4.7-Flash-4bit --seq-lens 2048 8192 32768 65536 --decode-len 256 --repeats 1 --turns 8 --multi-decode-len 128 --multi-target-context 65536 --chunk-size 4096 --kv-step 4096 --cooldown-sec 0 --path permute --window 64 --landmark-stride 0 --head-chunk-size 2 --query-chunk-size 384 --active-dense-threshold 49152 --quality-dataset benchmarks/mlx/glm_4_7_flash_4bit_wayfinder/quality_eval_glm47_consumer_v1.json --out-dir benchmarks/mlx/glm_4_7_flash_4bit_wayfinder/20260208_glm47_consumer_hcsa_r02_reduced","controls":{"model":"mlx-community/GLM-4.7-Flash-4bit","chunk_size":4096,"kv_step":4096,"window":64,"landmark_stride":0,"head_chunk_size":2,"retro_backfill_enabled":false,"repeats":1},"metrics":{"status":"pending"},"decision":"pending","next_action":"run matched dense control and compare absolute/delta/%"}
{"id":"EXP-20260208-GLM47-CONSUMER-REDUCED-DENSE-R02","date":"2026-02-08","question":"Under identical reduced protocol, how does chunked dense compare to Hamiltonian on consumer metrics?","hypothesis":"Dense remains slower at long context and uses more memory, with near-par quality.","change_set":["measurement only (--no-swap)"] ,"command":"PYTHONPATH=. python3 scripts/bench_glm_consumer_mlx.py --model-path mlx-community/GLM-4.7-Flash-4bit --seq-lens 2048 8192 32768 65536 --decode-len 256 --repeats 1 --turns 8 --multi-decode-len 128 --multi-target-context 65536 --chunk-size 4096 --kv-step 4096 --cooldown-sec 0 --path permute --window 64 --landmark-stride 0 --head-chunk-size 2 --query-chunk-size 384 --active-dense-threshold 49152 --quality-dataset benchmarks/mlx/glm_4_7_flash_4bit_wayfinder/quality_eval_glm47_consumer_v1.json --no-swap --out-dir benchmarks/mlx/glm_4_7_flash_4bit_wayfinder/20260208_glm47_consumer_dense_r02_reduced","controls":{"model":"mlx-community/GLM-4.7-Flash-4bit","chunk_size":4096,"kv_step":4096,"window":64,"landmark_stride":0,"head_chunk_size":2,"retro_backfill_enabled":false,"repeats":1,"matched_run":"EXP-20260208-GLM47-CONSUMER-REDUCED-HCSA-R02"},"metrics":{"status":"pending"},"decision":"pending","next_action":"compute victory gates and decide promote/hold"}
{"id":"EXP-20260208-GLM47-CONSUMER-DENSE-PARTIAL-R03","date":"2026-02-08","question":"For completed lengths (2k/8k/32k), what are dense control single-turn metrics under identical settings?","hypothesis":"Dense will be slower and use more memory than Hamiltonian at 8k/32k.","change_set":["measurement only","bounded single-turn control slice"],"command":"PYTHONPATH=. python3 scripts/bench_glm_consumer_mlx.py --model-path mlx-community/GLM-4.7-Flash-4bit --seq-lens 2048 8192 32768 --decode-len 256 --repeats 1 --chunk-size 4096 --kv-step 4096 --cooldown-sec 0 --path permute --window 64 --landmark-stride 0 --head-chunk-size 2 --query-chunk-size 384 --active-dense-threshold 49152 --no-swap --skip-multi-turn --skip-quality --out-dir benchmarks/mlx/glm_4_7_flash_4bit_wayfinder/20260208_glm47_consumer_dense_partial_r03","controls":{"model":"mlx-community/GLM-4.7-Flash-4bit","chunk_size":4096,"kv_step":4096,"window":64,"landmark_stride":0,"head_chunk_size":2,"retro_backfill_enabled":false},"metrics":{"status":"pending"},"decision":"pending","next_action":"compare against HCSA partial medians and record deltas"}
