{"id":"EXP-20260216T041912Z-GLM-PREFILL-STABILITY-MATRIX32-PRERUN","date":"2026-02-16","question":"On the current in-tree patch set, is Wayfinder prefill routing operationally correct across T={2048,8192,32768,65536} at decode_len=32, and what is graph-build vs attention attribution by phase?","hypothesis":"Prefill remains on Wayfinder path (near-zero prefill fallback share) at all tested contexts; decode remains dense by policy; long-context runtime is attention-dominated rather than graph-build dominated.","change_set":["scripts/bench_glm_consumer_mlx.py observability-only fields for prefill fallback share and timing_ms_by_phase"],"command":"dense: python3 scripts/bench_glm_consumer_mlx.py --model-path mlx-community/GLM-4.7-Flash-4bit --mode dense --seq-lens 2048 8192 32768 65536 --decode-len 32 --repeats 1 --skip-multi-turn --skip-quality --out-dir benchmarks/mlx/glm_4_7_flash_4bit_wayfinder/20260216_glm_prefill_matrix32_dense ; wayfinder_trace: python3 scripts/bench_glm_consumer_mlx.py --model-path mlx-community/GLM-4.7-Flash-4bit --mode wayfinder --seq-lens 2048 8192 32768 65536 --decode-len 32 --repeats 1 --skip-multi-turn --skip-quality --hsa-trace --out-dir benchmarks/mlx/glm_4_7_flash_4bit_wayfinder/20260216_glm_prefill_matrix32_wayfinder_trace","controls":{"model":"mlx-community/GLM-4.7-Flash-4bit","seq_lens":[2048,8192,32768,65536],"decode_len":32,"repeats":1,"skip_multi_turn":true,"skip_quality":true,"retro_backfill_enabled":false,"dense_baseline":"benchmarks/mlx/glm_4_7_flash_4bit_wayfinder/20260216_glm_prefill_matrix32_dense/results.json"},"metrics":{"status":"pending","required":["path_counts","dense_fallback_reason_counts","dense_fallback_share_prefill_steps","dense_fallback_share_decode_steps","timing_ms_by_phase.prefill.graph_build_ms","timing_ms_by_phase.prefill.attention_ms","timing_ms_by_phase.decode.graph_build_ms","timing_ms_by_phase.decode.attention_ms","e2e_sec","prefill_sec","decode_sec","ttft_sec","itl_p95_sec","decode_tok_s","peak_memory_bytes","delta_vs_dense_abs","delta_vs_dense_pct"]},"decision":"pending","next_action":"Run dense + wayfinder trace pair and compute context-wise routing and attribution table."}
{"id":"EXP-20260216T041913Z-GLM-PREFILL-STABILITY-MATRIX256-PRERUN","date":"2026-02-16","question":"With the same patch set, is dense-vs-wayfinder performance stable across T={2048,8192,32768,65536} at decode_len=256?","hypothesis":"Wayfinder should preserve or improve e2e/prefill at medium+long contexts and reduce peak memory at long context.","change_set":["measurement only"],"command":"dense: python3 scripts/bench_glm_consumer_mlx.py --model-path mlx-community/GLM-4.7-Flash-4bit --mode dense --seq-lens 2048 8192 32768 65536 --decode-len 256 --repeats 1 --skip-multi-turn --skip-quality --out-dir benchmarks/mlx/glm_4_7_flash_4bit_wayfinder/20260216_glm_prefill_matrix256_dense ; wayfinder: python3 scripts/bench_glm_consumer_mlx.py --model-path mlx-community/GLM-4.7-Flash-4bit --mode wayfinder --seq-lens 2048 8192 32768 65536 --decode-len 256 --repeats 1 --skip-multi-turn --skip-quality --out-dir benchmarks/mlx/glm_4_7_flash_4bit_wayfinder/20260216_glm_prefill_matrix256_wayfinder","controls":{"model":"mlx-community/GLM-4.7-Flash-4bit","seq_lens":[2048,8192,32768,65536],"decode_len":256,"repeats":1,"skip_multi_turn":true,"skip_quality":true,"retro_backfill_enabled":false,"dense_baseline":"benchmarks/mlx/glm_4_7_flash_4bit_wayfinder/20260216_glm_prefill_matrix256_dense/results.json"},"metrics":{"status":"pending","required":["e2e_sec","prefill_sec","decode_sec","ttft_sec","itl_p95_sec","decode_tok_s","peak_memory_bytes","delta_vs_dense_abs","delta_vs_dense_pct","memory_reduction_pct_convention"]},"decision":"pending","next_action":"Run dense + wayfinder decode256 pair and merge with decode32 findings."}
{"id":"EXP-20260216T041914Z-GLM-LONGCTX-QUALITY-SANITY-PRERUN","date":"2026-02-16","question":"After performance validation, does long-context Wayfinder pass a targeted quality sanity check?","hypothesis":"At T=65536 the stabilized Wayfinder path should avoid catastrophic quality failure on targeted extract/lookup tasks.","change_set":["measurement only"],"command":"python3 scripts/bench_glm_consumer_mlx.py --model-path mlx-community/GLM-4.7-Flash-4bit --mode wayfinder --seq-lens 65536 --decode-len 64 --repeats 1 --skip-multi-turn --quality-task-id-filter extract-01,lookup-01 --out-dir benchmarks/mlx/glm_4_7_flash_4bit_wayfinder/20260216_glm_longctx_quality_sanity_wayfinder","controls":{"model":"mlx-community/GLM-4.7-Flash-4bit","seq_len":65536,"decode_len":64,"quality_task_id_filter":["extract-01","lookup-01"],"dense_reference":"benchmarks/mlx/glm_4_7_flash_4bit_wayfinder/20260215_glm47_taskaware_formula/dense_t65536/results.json"},"metrics":{"status":"pending","required":["quality.correct","quality.num_tasks","quality.accuracy","single_turn.e2e_sec","single_turn.prefill_sec","single_turn.decode_sec","single_turn.peak_memory_bytes","delta_vs_dense_quality_abs","delta_vs_dense_quality_pct"]},"decision":"pending","next_action":"Run targeted long-context quality sanity and record keep/follow-up decision."}
{"id":"EXP-20260216T053256Z-GLM8192-TIEBREAK-PRERUN","date":"2026-02-16","question":"At T=8192, is the observed Wayfinder slowdown versus dense stable behavior change or run-to-run noise?","hypothesis":"H1: slowdown is real due to routing/policy shift with zero prefill fallback; H2: slowdown is mostly variance and should shrink on immediate rerun.","change_set":["measurement only"],"command":"dense32: python3 scripts/bench_glm_consumer_mlx.py --model-path mlx-community/GLM-4.7-Flash-4bit --mode dense --seq-lens 8192 --decode-len 32 --repeats 2 --skip-multi-turn --skip-quality --out-dir benchmarks/mlx/glm_4_7_flash_4bit_wayfinder/20260216_glm8192_tiebreak_dense32 ; wayfinder32_trace: python3 scripts/bench_glm_consumer_mlx.py --model-path mlx-community/GLM-4.7-Flash-4bit --mode wayfinder --seq-lens 8192 --decode-len 32 --repeats 2 --skip-multi-turn --skip-quality --hsa-trace --out-dir benchmarks/mlx/glm_4_7_flash_4bit_wayfinder/20260216_glm8192_tiebreak_wayfinder32_trace ; dense256: python3 scripts/bench_glm_consumer_mlx.py --model-path mlx-community/GLM-4.7-Flash-4bit --mode dense --seq-lens 8192 --decode-len 256 --repeats 2 --skip-multi-turn --skip-quality --out-dir benchmarks/mlx/glm_4_7_flash_4bit_wayfinder/20260216_glm8192_tiebreak_dense256 ; wayfinder256_trace: python3 scripts/bench_glm_consumer_mlx.py --model-path mlx-community/GLM-4.7-Flash-4bit --mode wayfinder --seq-lens 8192 --decode-len 256 --repeats 2 --skip-multi-turn --skip-quality --hsa-trace --out-dir benchmarks/mlx/glm_4_7_flash_4bit_wayfinder/20260216_glm8192_tiebreak_wayfinder256_trace","controls":{"model":"mlx-community/GLM-4.7-Flash-4bit","seq_len":8192,"decode_lens":[32,256],"repeats":2,"skip_multi_turn":true,"skip_quality":true,"retro_backfill_enabled":false},"metrics":{"status":"pending","required":["mean_e2e_sec_dense","mean_e2e_sec_wayfinder","mean_delta_e2e_abs","mean_delta_e2e_pct","mean_prefill_delta_abs","mean_decode_delta_abs","mean_decode_tok_s_delta","mean_peak_memory_delta","wayfinder_path_counts","wayfinder_dense_fallback_shares"]},"decision":"pending","next_action":"Run tie-break matrix and choose H1 or H2 with evidence."}
{"id":"EXP-20260216T054319Z-GLM8192-CHUNK-POLICY-FIX-PRERUN","date":"2026-02-16","question":"Can we recover 8k Wayfinder efficiency by relaxing only the 8k query-chunk cap (192->384) while keeping long-context caps unchanged?","hypothesis":"8k slowdown is caused by over-fragmented active gather chunks; larger 8k query chunks will reduce prefill overhead and improve dense-relative e2e.","change_set":["hcsa/integrations/glm_mlx.py _effective_permute_chunking policy split at T>=32768 vs T>=8192"],"command":"wayfinder32_trace: python3 scripts/bench_glm_consumer_mlx.py --model-path mlx-community/GLM-4.7-Flash-4bit --mode wayfinder --seq-lens 8192 --decode-len 32 --repeats 2 --skip-multi-turn --skip-quality --hsa-trace --out-dir benchmarks/mlx/glm_4_7_flash_4bit_wayfinder/20260216_glm8192_chunkfix_wayfinder32_trace ; wayfinder256_trace: python3 scripts/bench_glm_consumer_mlx.py --model-path mlx-community/GLM-4.7-Flash-4bit --mode wayfinder --seq-lens 8192 --decode-len 256 --repeats 2 --skip-multi-turn --skip-quality --hsa-trace --out-dir benchmarks/mlx/glm_4_7_flash_4bit_wayfinder/20260216_glm8192_chunkfix_wayfinder256_trace","controls":{"model":"mlx-community/GLM-4.7-Flash-4bit","seq_len":8192,"decode_lens":[32,256],"repeats":2,"dense_baselines":["benchmarks/mlx/glm_4_7_flash_4bit_wayfinder/20260216_glm8192_tiebreak_dense32/results.json","benchmarks/mlx/glm_4_7_flash_4bit_wayfinder/20260216_glm8192_tiebreak_dense256/results.json"],"retro_backfill_enabled":false},"metrics":{"status":"pending","required":["mean_e2e_sec_wayfinder_postfix","mean_e2e_delta_vs_dense_abs","mean_e2e_delta_vs_dense_pct","mean_prefill_delta_vs_dense_abs","mean_decode_delta_vs_dense_abs","mean_decode_tok_s_delta_vs_dense","mean_peak_memory_delta_vs_dense","path_counts","dense_fallback_share_prefill_steps","dense_fallback_share_decode_steps"]},"decision":"pending","next_action":"Run post-fix wayfinder 8k decode32/decode256 and compare against tie-break dense baselines."}
{"id":"EXP-20260216T041912Z-GLM-PREFILL-STABILITY-MATRIX32-RESULT","date":"2026-02-16","question":"On the current in-tree patch set, is Wayfinder prefill routing operationally correct across T={2048,8192,32768,65536} at decode_len=32, and what is graph-build vs attention attribution by phase?","hypothesis":"Prefill remains on Wayfinder path (near-zero prefill fallback share) at all tested contexts; decode remains dense by policy; long-context runtime is attention-dominated rather than graph-build dominated.","change_set":["scripts/bench_glm_consumer_mlx.py observability-only fields for prefill fallback share and timing_ms_by_phase"],"command":"dense+wayfinder decode32 matrix pair","controls":{"dense_path":"benchmarks/mlx/glm_4_7_flash_4bit_wayfinder/20260216_glm_prefill_matrix32_dense/results.json","wayfinder_path":"benchmarks/mlx/glm_4_7_flash_4bit_wayfinder/20260216_glm_prefill_matrix32_wayfinder_trace/results.json","seq_lens":[2048,8192,32768,65536],"decode_len":32},"metrics":{"per_context_delta_vs_dense":{"2048":{"e2e_sec":{"dense":3.0998344169929624,"wayfinder":2.608578666986432,"delta_wayfinder_vs_dense":-0.49125575000653043,"delta_pct_wayfinder_vs_dense":-15.847806170339895},"prefill_sec":{"dense":2.4761838749982417,"wayfinder":2.03367466700729,"delta_wayfinder_vs_dense":-0.44250920799095184,"delta_pct_wayfinder_vs_dense":-17.870611809523478},"decode_sec":{"dense":0.6236505419947207,"wayfinder":0.5749039999791421,"delta_wayfinder_vs_dense":-0.0487465420155786,"delta_pct_wayfinder_vs_dense":-7.816323202360216},"ttft_sec":{"dense":0.12547816697042435,"wayfinder":0.07111625000834465,"delta_wayfinder_vs_dense":-0.054361916962079704,"delta_pct_wayfinder_vs_dense":-43.323805467203705},"itl_p95_sec":{"dense":0.017060792015399784,"wayfinder":0.016725875029806048,"delta_wayfinder_vs_dense":-0.00033491698559373617,"delta_pct_wayfinder_vs_dense":-1.9630799396149141},"decode_tok_s":{"dense":51.31078680321404,"wayfinder":55.66146695998111,"delta_wayfinder_vs_dense":4.350680156767069,"delta_pct_wayfinder_vs_dense":8.47907511816706},"peak_memory_bytes":{"dense":18284344600.0,"wayfinder":18318769672.0,"delta_wayfinder_vs_dense":34425072.0,"delta_pct_wayfinder_vs_dense":0.18827621527106855},"memory_reduction_pct_convention":-0.18827621527106597},"8192":{"e2e_sec":{"dense":16.928754999942612,"wayfinder":20.126854291011114,"delta_wayfinder_vs_dense":3.1980992910685018,"delta_pct_wayfinder_vs_dense":18.89152091266808},"prefill_sec":{"dense":16.131147582957055,"wayfinder":19.365511499985587,"delta_wayfinder_vs_dense":3.2343639170285314,"delta_pct_wayfinder_vs_dense":20.050426669245248},"decode_sec":{"dense":0.7976074169855565,"wayfinder":0.7613427910255268,"delta_wayfinder_vs_dense":-0.03626462596002966,"delta_pct_wayfinder_vs_dense":-4.546676120075042},"ttft_sec":{"dense":0.20581758400658146,"wayfinder":0.1504675829783082,"delta_wayfinder_vs_dense":-0.055350001028273255,"delta_pct_wayfinder_vs_dense":-26.892746455766055},"itl_p95_sec":{"dense":0.019244084018282592,"wayfinder":0.01984866603743285,"delta_wayfinder_vs_dense":0.0006045820191502571,"delta_pct_wayfinder_vs_dense":3.1416513177550143},"decode_tok_s":{"dense":40.11998800229245,"wayfinder":42.031001511022495,"delta_wayfinder_vs_dense":1.9110135087300435,"delta_pct_wayfinder_vs_dense":4.763245464133361},"peak_memory_bytes":{"dense":20660500140.0,"wayfinder":20610120350.0,"delta_wayfinder_vs_dense":-50379790.0,"delta_pct_wayfinder_vs_dense":-0.24384593624847262},"memory_reduction_pct_convention":0.24384593624847684},"32768":{"e2e_sec":{"dense":177.96882962499512,"wayfinder":123.03240691596875,"delta_wayfinder_vs_dense":-54.936422709026374,"delta_pct_wayfinder_vs_dense":-30.868564357469225},"prefill_sec":{"dense":167.81290566700045,"wayfinder":121.76944070798345,"delta_wayfinder_vs_dense":-46.043464959017,"delta_pct_wayfinder_vs_dense":-27.437380203870227},"decode_sec":{"dense":10.155923957994673,"wayfinder":1.2629662079853006,"delta_wayfinder_vs_dense":-8.892957750009373,"delta_pct_wayfinder_vs_dense":-87.56424119352427},"ttft_sec":{"dense":9.043374209024478,"wayfinder":0.20335600001271814,"delta_wayfinder_vs_dense":-8.84001820901176,"delta_pct_wayfinder_vs_dense":-97.75132605029451},"itl_p95_sec":{"dense":0.03595020802458748,"wayfinder":0.03416687500430271,"delta_wayfinder_vs_dense":-0.001783333020284772,"delta_pct_wayfinder_vs_dense":-4.960563841703208},"decode_tok_s":{"dense":3.15087038189271,"wayfinder":25.337178301109734,"delta_wayfinder_vs_dense":22.186307919217025,"delta_pct_wayfinder_vs_dense":704.1326754256974},"peak_memory_bytes":{"dense":26017775484.0,"wayfinder":21978678158.0,"delta_wayfinder_vs_dense":-4039097326.0,"delta_pct_wayfinder_vs_dense":-15.524376126944059},"memory_reduction_pct_convention":15.524376126944063},"65536":{"e2e_sec":{"dense":1065.6872362919967,"wayfinder":351.51994954101974,"delta_wayfinder_vs_dense":-714.1672867509769,"delta_pct_wayfinder_vs_dense":-67.01471711680482},"prefill_sec":{"dense":1033.5840451669646,"wayfinder":341.4813877500128,"delta_wayfinder_vs_dense":-692.1026574169518,"delta_pct_wayfinder_vs_dense":-66.96143005043677},"decode_sec":{"dense":32.103191125032026,"wayfinder":10.038561791006941,"delta_wayfinder_vs_dense":-22.064629334025085,"delta_pct_wayfinder_vs_dense":-68.73033041509848},"ttft_sec":{"dense":30.323858249990735,"wayfinder":8.280718374997377,"delta_wayfinder_vs_dense":-22.043139874993358,"delta_pct_wayfinder_vs_dense":-72.69239848461596},"itl_p95_sec":{"dense":0.05427708401111886,"wayfinder":0.05457583401584998,"delta_wayfinder_vs_dense":0.0002987500047311187,"delta_pct_wayfinder_vs_dense":0.5504164606004233},"decode_tok_s":{"dense":0.9967856427533908,"wayfinder":3.187707628463994,"delta_wayfinder_vs_dense":2.1909219857106033,"delta_pct_wayfinder_vs_dense":219.79871014781932},"peak_memory_bytes":{"dense":33160809276.0,"wayfinder":23795994534.0,"delta_wayfinder_vs_dense":-9364814742.0,"delta_pct_wayfinder_vs_dense":-28.240609763338153},"memory_reduction_pct_convention":28.240609763338153}},"root_cause_by_context":{"2048":{"path_counts":{"wayfinder":8,"wayfinder_dense_fallback":256},"dense_fallback_reason_counts":{"unspecified":256},"dense_fallback_share_run":0.9696969696969697,"dense_fallback_share_prefill_steps":0.0,"dense_fallback_share_decode_steps":1.0,"timing_ms_by_phase":{"overall":{"graph_build_ms":0.00920802354812622,"attention_ms":2.0518354773521423,"total_profile_ms":11.609221160411835,"graph_vs_attention_total_ms":2.0610435009002686,"graph_build_share_of_graph_plus_attention":0.004467651237882235,"attention_share_of_graph_plus_attention":0.9955323487621177,"layer_observations_with_timing":264},"prefill":{"graph_build_ms":0.00920802354812622,"attention_ms":0.731917142868042,"total_profile_ms":2.960459887981415,"graph_vs_attention_total_ms":0.7411251664161682,"graph_build_share_of_graph_plus_attention":0.012424383849563661,"attention_share_of_graph_plus_attention":0.9875756161504363,"layer_observations_with_timing":8},"decode":{"graph_build_ms":0.0,"attention_ms":1.3199183344841003,"total_profile_ms":8.64876127243042,"graph_vs_attention_total_ms":1.3199183344841003,"graph_build_share_of_graph_plus_attention":0.0,"attention_share_of_graph_plus_attention":1.0,"layer_observations_with_timing":256}}},"8192":{"path_counts":{"wayfinder":16,"wayfinder_dense_fallback":256},"dense_fallback_reason_counts":{"unspecified":256},"dense_fallback_share_run":0.9411764705882353,"dense_fallback_share_prefill_steps":0.0,"dense_fallback_share_decode_steps":1.0,"timing_ms_by_phase":{"overall":{"graph_build_ms":12.872956335544586,"attention_ms":2578.0831639170647,"total_profile_ms":2602.522163808346,"graph_vs_attention_total_ms":2590.9561202526093,"graph_build_share_of_graph_plus_attention":0.004968419277702594,"attention_share_of_graph_plus_attention":0.9950315807222974,"layer_observations_with_timing":272},"prefill":{"graph_build_ms":12.872956335544586,"attention_ms":2576.751665055752,"total_profile_ms":2593.794456899166,"graph_vs_attention_total_ms":2589.6246213912964,"graph_build_share_of_graph_plus_attention":0.004970973873668411,"attention_share_of_graph_plus_attention":0.9950290261263316,"layer_observations_with_timing":16},"decode":{"graph_build_ms":0.0,"attention_ms":1.3314988613128662,"total_profile_ms":8.727706909179688,"graph_vs_attention_total_ms":1.3314988613128662,"graph_build_share_of_graph_plus_attention":0.0,"attention_share_of_graph_plus_attention":1.0,"layer_observations_with_timing":256}}},"32768":{"path_counts":{"wayfinder":64,"wayfinder_dense_fallback":256},"dense_fallback_reason_counts":{"unspecified":256},"dense_fallback_share_run":0.8,"dense_fallback_share_prefill_steps":0.0,"dense_fallback_share_decode_steps":1.0,"timing_ms_by_phase":{"overall":{"graph_build_ms":115.08833432197571,"attention_ms":19548.51687449217,"total_profile_ms":19691.54706311226,"graph_vs_attention_total_ms":19663.605208814144,"graph_build_share_of_graph_plus_attention":0.005852860302056296,"attention_share_of_graph_plus_attention":0.9941471396979437,"layer_observations_with_timing":320},"prefill":{"graph_build_ms":115.08833432197571,"attention_ms":19547.207169651985,"total_profile_ms":19682.799333155155,"graph_vs_attention_total_ms":19662.29550397396,"graph_build_share_of_graph_plus_attention":0.005853250160883561,"attention_share_of_graph_plus_attention":0.9941467498391164,"layer_observations_with_timing":64},"decode":{"graph_build_ms":0.0,"attention_ms":1.309704840183258,"total_profile_ms":8.74772995710373,"graph_vs_attention_total_ms":1.309704840183258,"graph_build_share_of_graph_plus_attention":0.0,"attention_share_of_graph_plus_attention":1.0,"layer_observations_with_timing":256}}},"65536":{"path_counts":{"wayfinder":128,"wayfinder_dense_fallback":256},"dense_fallback_reason_counts":{"unspecified":256},"dense_fallback_share_run":0.6666666666666666,"dense_fallback_share_prefill_steps":0.0,"dense_fallback_share_decode_steps":1.0,"timing_ms_by_phase":{"overall":{"graph_build_ms":287.6262511610985,"attention_ms":48515.96777719259,"total_profile_ms":48855.2748028636,"graph_vs_attention_total_ms":48803.59402835369,"graph_build_share_of_graph_plus_attention":0.005893546507947646,"attention_share_of_graph_plus_attention":0.9941064534920524,"layer_observations_with_timing":384},"prefill":{"graph_build_ms":287.6262511610985,"attention_ms":48509.88670492172,"total_profile_ms":48839.070710361004,"graph_vs_attention_total_ms":48797.51295608282,"graph_build_share_of_graph_plus_attention":0.005894280952800989,"attention_share_of_graph_plus_attention":0.994105719047199,"layer_observations_with_timing":128},"decode":{"graph_build_ms":0.0,"attention_ms":6.081072270870209,"total_profile_ms":16.204092502593994,"graph_vs_attention_total_ms":6.081072270870209,"graph_build_share_of_graph_plus_attention":0.0,"attention_share_of_graph_plus_attention":1.0,"layer_observations_with_timing":256}}}}},"decision":"keep_with_follow_up","next_action":"Use decode32 root-cause table plus decode256 matrix for final stabilization verdict; treat 8k slowdown as a stable residual behavior."}
