{"id":"EXP-20260319T235004Z-SHA3319-NONQWEN-BASELINE-RELOCK-RESULT","date":"2026-03-19","question":"What is the best validated original non-Qwen baseline/config in this repo right now, and what exact relock queue should run before more Qwen promotion?","hypothesis":"Existing GLM/MLX artifacts should still identify a strong long-prefill baseline and a separate quality-preserving decode candidate, but the best release artifact will likely still need a strict-observability relock and the current host may be unable to run MLX at all.","change_set":["notes/SHA-3319_NONQWEN_BASELINE_RELOCK_20260319.md","notes/LAB_NOTEBOOK.md","notes/experiments.ndjson"],"command":"python3 -c \"import mlx, sys; print(getattr(mlx, '__version__', 'unknown'))\" && python3 scripts/bench_glm_consumer_mlx.py --help && python3 -m pytest tests/mlx/test_mlx_causality.py tests/mlx/test_permute_retro_backfill.py tests/mlx/test_glm_hamiltonian_e2e.py -q","controls":{"inference":"off","strategy_order":"original non-Qwen first","baseline_artifacts":["benchmarks/mlx/first_release/EXP-20260218T151213Z-STABLE-PROFILE/stable_profile_summary.json","benchmarks/mlx/first_release/EXP-20260218T183512Z-GLM47-TOKENLEN-SWEEP/token_length_summary.json","benchmarks/mlx/post_reboot_20260211_20260211T202821Z/happy_median_search_20260212T005058Z/happy_median_final_summary.json","benchmarks/mlx/post_reboot_20260211_20260211T202821Z/mode3_cleanup_20260212T150726Z/mode3_summary.json"]},"metrics":{"memo":"notes/SHA-3319_NONQWEN_BASELINE_RELOCK_20260319.md","best_long_prefill_baseline":{"artifact":"benchmarks/mlx/first_release/EXP-20260218T151213Z-STABLE-PROFILE/stable_profile_summary.json","config":{"path":"permute","window":64,"landmark_stride":0,"num_cycles":1,"head_chunk_size":2,"query_chunk_size":384,"wayfinder_decode_backend":"dense"},"abs":{"dense_e2e_sec":17.147269542001595,"wayfinder_e2e_sec":10.556340832998103,"dense_prefill_sec":16.35862916699989,"wayfinder_prefill_sec":9.753327874997922,"dense_peak_memory_bytes":20660500140.0,"wayfinder_peak_memory_bytes":20071482232.0},"delta_pct":{"e2e_sec":-38.43719078923475,"prefill_sec":-40.378085624232995,"peak_memory_bytes":-2.8509373152086726}},"scaling_baseline":{"artifact":"benchmarks/mlx/first_release/EXP-20260218T183512Z-GLM47-TOKENLEN-SWEEP/token_length_summary.json","seq65536":{"e2e_delta_pct":-72.89519195030294,"prefill_delta_pct":-72.49989077414796,"decode_tok_s_delta_pct":628.0962733289945,"memory_reduction_pct":28.240609763338153}},"lock_gap":{"stable_profile_dense_fallback_share_run":0.9411764705882353,"stable_profile_dense_fallback_reason_counts":{"unspecified":256},"strict_relock_needed":true},"best_quality_candidate":{"artifact":"benchmarks/mlx/post_reboot_20260211_20260211T202821Z/happy_median_search_20260212T005058Z/happy_median_final_summary.json","label":"p16_last4_t16384","config":{"path":"permute","window":64,"landmark_stride":0,"head_chunk_size":2,"query_chunk_size":192,"swap_last_n_layers":4,"active_dense_threshold":16384},"abs":{"accuracy":0.5,"tok_per_sec":58.050519022306226,"peak_memory_bytes_mean":16935884001.166666},"delta_pct_vs_dense":{"tok_per_sec":-17.50690650580788,"peak_memory_bytes":0.09164951272243302}},"mode3_counterevidence":{"artifact":"benchmarks/mlx/post_reboot_20260211_20260211T202821Z/mode3_cleanup_20260212T150726Z/mode3_summary.json","wayfinder":{"decode_tok_s_median_of_seeds":26.807927690618367,"decode_delta_vs_dense_pct":-42.18398465085033,"six_task_accuracy_mean":0.05555555555555555,"heldout_accuracy_mean":0.0},"sparse":{"peak_memory_bytes_median_of_seeds":33502935292.0}},"local_blocker":{"mlx_import":"ModuleNotFoundError","bench_help":"ModuleNotFoundError","mlx_host_runnable":false}},"decision":"follow-up","next_action":"Use the memo's relock queue on an MLX-capable machine; while MLX is blocked here, continue only with the safe bounded Qwen smoke in SHA-3316 if more local execution is needed."}
{"id":"EXP-20260319T235457Z-QWEN35CUDA-BLOCK-SPARSE-GUARDED-SMOKE-PRERUN","date":"2026-03-19","question":"After the unsupported-arch longrun guard landed, does the bounded Qwen block_sparse smoke still execute cleanly on GB10 at T=512 and T=4096 without --unsafe-longrun?","hypothesis":"The guarded CLI should still run the bounded block_sparse smoke exactly through the validated unsupported-arch cap (<=4096), emit block_sparse_backend=flex_attention, and avoid silent dense fallback.","change_set":["measurement only"],"command":".venv/bin/python scripts/bench_qwen35_cuda_wayfinder.py --model-path /home/hmbown/HF_Models/Qwen3.5-9B --seq-lens 512 4096 --warmup 1 --repeats 1 --path block_sparse --block-size 128 --engine flex --allow-unsupported-arch --strategy random --forward-target backbone --phases wayfinder --skip-divergence --output benchmarks/cuda/qwen35_wayfinder/EXP-20260319T235457Z-QWEN35CUDA-BLOCK-SPARSE-GUARDED-SMOKE.ndjson","controls":{"model":"Qwen3.5-9B","path":"block_sparse","block_size":128,"strategy":"random","num_cycles":1,"forward_target":"backbone","phases":["wayfinder"],"allow_unsupported_arch":true,"engine":"flex","unsafe_longrun":false,"seq_lens":[512,4096],"baseline_smoke":"benchmarks/cuda/qwen35_wayfinder/EXP-20260319T213047Z-QWEN35CUDA-BLOCK-SPARSE-SMOKE.ndjson"},"metrics":{"status":"pending","required":["completed wayfinder row for seq_len 512 and 4096","block_sparse_backend=flex_attention in profiles","no silent dense fallback","no crash / no lockup"]},"decision":"pending","next_action":"Run the bounded smoke and compare against the earlier unsupported-arch smoke artifact."}
{"id":"EXP-20260319T235457Z-QWEN35CUDA-BLOCK-SPARSE-GUARDED-SMOKE-RESULT","date":"2026-03-19","question":"After the unsupported-arch longrun guard landed, does the bounded Qwen block_sparse smoke still execute cleanly on GB10 at T=512 and T=4096 without --unsafe-longrun?","hypothesis":"The guarded CLI should still run the bounded block_sparse smoke exactly through the validated unsupported-arch cap (<=4096), emit block_sparse_backend=flex_attention, and avoid silent dense fallback.","change_set":["measurement only"],"command":".venv/bin/python scripts/bench_qwen35_cuda_wayfinder.py --model-path /home/hmbown/HF_Models/Qwen3.5-9B --seq-lens 512 4096 --warmup 1 --repeats 1 --path block_sparse --block-size 128 --engine flex --allow-unsupported-arch --strategy random --forward-target backbone --phases wayfinder --skip-divergence --output benchmarks/cuda/qwen35_wayfinder/EXP-20260319T235457Z-QWEN35CUDA-BLOCK-SPARSE-GUARDED-SMOKE.ndjson","controls":{"model":"Qwen3.5-9B","path":"block_sparse","block_size":128,"strategy":"random","num_cycles":1,"forward_target":"backbone","phases":["wayfinder"],"allow_unsupported_arch":true,"engine":"flex","unsafe_longrun":false,"seq_lens":[512,4096],"baseline_smoke":"benchmarks/cuda/qwen35_wayfinder/EXP-20260319T213047Z-QWEN35CUDA-BLOCK-SPARSE-SMOKE.ndjson"},"metrics":{"artifact":"benchmarks/cuda/qwen35_wayfinder/EXP-20260319T235457Z-QWEN35CUDA-BLOCK-SPARSE-GUARDED-SMOKE.ndjson","run_status":"completed","meta":{"allow_unsupported_arch":true,"allow_unsafe_unsupported_flex_longrun":false,"flex_arch_supported_exact":false,"gpu":"NVIDIA GB10"},"execution":{"seq512":{"median_ms":326.93,"prefill_tok_per_sec":1566.1,"peak_mem_gb":16.8,"backend":"flex_attention","active_layers":8},"seq4096":{"median_ms":2517.58,"prefill_tok_per_sec":1627.0,"peak_mem_gb":17.54,"backend":"flex_attention","active_layers":8}},"delta_vs_baseline_abs":{"seq512":{"median_ms":37.45,"prefill_tok_per_sec":-202.6,"peak_mem_gb":0.0},"seq4096":{"median_ms":144.95,"prefill_tok_per_sec":-99.4,"peak_mem_gb":0.0}},"delta_vs_baseline_pct":{"seq512":{"median_ms":12.937,"prefill_tok_per_sec":-11.4547,"peak_mem_gb":0.0},"seq4096":{"median_ms":6.1093,"prefill_tok_per_sec":-5.7576,"peak_mem_gb":0.0}},"memory_reduction_pct_convention":"100*(1-wayfinder/baseline_wayfinder)","memory_reduction_pct":{"seq512":0.0,"seq4096":0.0},"stop_gates":{"rows_present":true,"backend_present":true,"silent_dense_fallback":false,"crash_or_lockup":false}},"decision":"keep","next_action":"Treat this as the safe unsupported-arch sanity baseline on GB10 and move any longer paired block_sparse evidence to supported flex hardware or an exact-supported build."}
{"id":"EXP-20260320T171047Z-QWEN35CUDA-WAYFINDER-BLOCK-CUTOVER-PRERUN","date":"2026-03-20","question":"Can we cut over the Qwen CUDA block_sparse path to a staged Wayfinder topology, add cached-KV sparse execution, and keep build/test validation green without running any model benchmarks?","hypothesis":"Folding the staged block schedule into block_sparse_topology=wayfinder and using precomputed sparse gather for cached KV should replace the parallel relay path cleanly, preserve static cache semantics, and pass targeted compile/test validation.","change_set":["hcsa/integrations/qwen_torch.py","hcsa/torch/attention_wayfinder_permute.py","hcsa/torch/attention_wayfinder_sparse.py","scripts/bench_qwen35_cuda_wayfinder.py","scripts/serve_qwen_wayfinder_cuda.py","tests/pytorch/test_torch_qwen_sparse_gqa.py","tests/test_qwen_cuda_wayfinder_cli.py","docs/readme updates for the new Wayfinder block topology"],"command":"python -m py_compile hcsa/integrations/qwen_torch.py hcsa/torch/attention_wayfinder_permute.py hcsa/torch/attention_wayfinder_sparse.py scripts/bench_qwen35_cuda_wayfinder.py scripts/serve_qwen_wayfinder_cuda.py tests/pytorch/test_torch_qwen_sparse_gqa.py tests/test_qwen_cuda_wayfinder_cli.py && pytest tests/pytorch/test_torch_qwen_sparse_gqa.py tests/test_qwen_cuda_wayfinder_cli.py -q","controls":{"inference":"off","benchmark_model_runs":"off","validation_scope":"py_compile + targeted pytest","path_under_test":"block_sparse","topology_under_test":"wayfinder","one_process_at_a_time":true},"metrics":{"status":"pending","required":["py_compile passes","targeted pytest passes","no stale relay_* interface required","cached-KV Wayfinder path uses sparse backend in tests"]},"decision":"pending","next_action":"Run compile validation and targeted pytest, then append the RESULT entry with pass/fail counts and any remaining blockers."}
{"id":"EXP-20260320T171047Z-QWEN35CUDA-WAYFINDER-BLOCK-CUTOVER-RESULT","date":"2026-03-20","question":"Can we cut over the Qwen CUDA block_sparse path to a staged Wayfinder topology, add cached-KV sparse execution, and keep build/test validation green without running any model benchmarks?","hypothesis":"Folding the staged block schedule into block_sparse_topology=wayfinder and using precomputed sparse gather for cached KV should replace the parallel relay path cleanly, preserve static cache semantics, and pass targeted compile/test validation.","change_set":["hcsa/integrations/qwen_torch.py","hcsa/torch/attention_wayfinder_permute.py","hcsa/torch/attention_wayfinder_sparse.py","scripts/bench_qwen35_cuda_wayfinder.py","scripts/serve_qwen_wayfinder_cuda.py","tests/pytorch/test_torch_qwen_sparse_gqa.py","tests/test_qwen_cuda_wayfinder_cli.py","README.md","docs/WAYFINDER_BLOCK_SPARSE.md"],"command":"python -m py_compile hcsa/integrations/qwen_torch.py hcsa/torch/attention_wayfinder_permute.py hcsa/torch/attention_wayfinder_sparse.py scripts/bench_qwen35_cuda_wayfinder.py scripts/serve_qwen_wayfinder_cuda.py tests/pytorch/test_torch_qwen_sparse_gqa.py tests/test_qwen_cuda_wayfinder_cli.py && pytest tests/pytorch/test_torch_qwen_sparse_gqa.py tests/test_qwen_cuda_wayfinder_cli.py -q","controls":{"inference":"off","benchmark_model_runs":"off","validation_scope":"py_compile + targeted pytest","path_under_test":"block_sparse","topology_under_test":"wayfinder","tests_collected":37},"metrics":{"py_compile":"pass","pytest":{"passed":35,"skipped":2,"failed":0},"warnings":{"count":15,"types":["unsupported torch-cuda arch warning on GB10","torch.jit.script_method deprecation warnings"]},"cutover":{"path":"block_sparse","block_sparse_topology":"wayfinder","cached_kv_backend":"sparse_gqa_precomputed","relay_interface_removed_from_validated_cli":true,"readme_note":"README.md","architecture_note":"docs/WAYFINDER_BLOCK_SPARSE.md"}},"decision":"keep","next_action":"Run the first guarded dense vs block_sparse_topology=wayfinder vs block_sparse_topology=hamiltonian benchmark queue before making any performance claims."}
{"id":"EXP-20260320T171834Z-QWEN35CUDA-WAYFINDER-PLAN-CUTOVER-PRERUN","date":"2026-03-20","question":"Can we replace the stale relay-named Qwen CUDA experiment plan with a Wayfinder-named no-inference setup that matches the current block_sparse topology interface?","hypothesis":"Renaming the plan file and switching its queued commands, stop gates, and output paths to --path block_sparse --block-sparse-topology wayfinder plus the --block-* controls will remove the last active relay mismatch without disturbing runtime code or historical records.","change_set":["configs/experiments/qwen3_5_9b_wayfinder_cuda_setup.yaml","notes/LAB_NOTEBOOK.md","notes/experiments.ndjson"],"command":"rg -n \"relay_block_sparse|--relay-|qwen35_relay\" configs/experiments","controls":{"inference":"off","benchmark_model_runs":"off","validation_scope":"config rename + static search","active_qwen_cuda_path":"block_sparse","active_topology":"wayfinder","baseline_config":"configs/experiments/qwen3_5_9b_relay_cuda_setup.yaml","one_process_at_a_time":true},"metrics":{"status":"pending","required":["configs/experiments/qwen3_5_9b_wayfinder_cuda_setup.yaml exists","configs/experiments/qwen3_5_9b_relay_cuda_setup.yaml removed","zero active relay queue/flag hits under configs/experiments"]},"decision":"pending","next_action":"Apply the config rename/cutover, run the static search, and append the RESULT entry."}
{"id":"EXP-20260320T171834Z-QWEN35CUDA-WAYFINDER-PLAN-CUTOVER-RESULT","date":"2026-03-20","question":"Can we replace the stale relay-named Qwen CUDA experiment plan with a Wayfinder-named no-inference setup that matches the current block_sparse topology interface?","hypothesis":"Renaming the plan file and switching its queued commands, stop gates, and output paths to --path block_sparse --block-sparse-topology wayfinder plus the --block-* controls will remove the last active relay mismatch without disturbing runtime code or historical records.","change_set":["configs/experiments/qwen3_5_9b_wayfinder_cuda_setup.yaml","notes/LAB_NOTEBOOK.md","notes/experiments.ndjson"],"command":"rg -n \"relay_block_sparse|--relay-|qwen35_relay\" configs/experiments","controls":{"inference":"off","benchmark_model_runs":"off","validation_scope":"config rename + static search","active_qwen_cuda_path":"block_sparse","active_topology":"wayfinder","baseline_config":"configs/experiments/qwen3_5_9b_relay_cuda_setup.yaml","one_process_at_a_time":true},"metrics":{"active_setup":"configs/experiments/qwen3_5_9b_wayfinder_cuda_setup.yaml","removed_setup":"configs/experiments/qwen3_5_9b_relay_cuda_setup.yaml","active_relay_hits_in_configs":0,"queue_contract":{"path":"block_sparse","block_sparse_topology":"wayfinder","output_root":"benchmarks/cuda/qwen35_wayfinder/<RUN_ID>"}},"decision":"keep","next_action":"Use configs/experiments/qwen3_5_9b_wayfinder_cuda_setup.yaml as the Phase 0 queue source for the first guarded dense-vs-Wayfinder-vs-Hamiltonian benchmark run when model execution is allowed."}
{"id":"EXP-20260320T165252Z-RELAY-BLOCK-SPARSE-SCAFFOLD-PRERUN","date":"2026-03-20","question":"Can we add a first fixed-schedule Relay block-sparse path for Qwen CUDA without disturbing the current Hamiltonian paths, and validate it with targeted compile/tests only?","hypothesis":"A separate relay_block_sparse path that uses a static XOR-stage block schedule with local blocks plus optional sink blocks should fit the existing flex-attention benchmark harness cleanly, expose explicit config/CLI controls, and validate without heavy inference.","change_set":["notes/LAB_NOTEBOOK.md","notes/experiments.ndjson","hcsa/torch/attention_relay_block_sparse.py","hcsa/integrations/qwen_torch.py","scripts/bench_qwen35_cuda_wayfinder.py","tests/pytorch/test_torch_qwen_sparse_gqa.py","tests/test_qwen_cuda_wayfinder_cli.py","docs/RELAY_ATTENTION.md"],"command":".venv/bin/python -m py_compile hcsa/torch/attention_relay_block_sparse.py hcsa/integrations/qwen_torch.py scripts/bench_qwen35_cuda_wayfinder.py tests/pytorch/test_torch_qwen_sparse_gqa.py tests/test_qwen_cuda_wayfinder_cli.py && .venv/bin/python -m pytest tests/pytorch/test_torch_qwen_sparse_gqa.py tests/test_qwen_cuda_wayfinder_cli.py -q","controls":{"inference":"off","benchmark":"off","retro_backfill_inference":"off","validation_scope":"py_compile + targeted pytest only","baseline":"EXP-20260319T212553Z-BLOCK-SPARSE-FLEX-PROTOTYPE-RESULT"},"metrics":{"status":"pending","required":["py_compile success","targeted pytest passes","relay_block_sparse path visible in config/CLI surfaces"]},"decision":"pending","next_action":"Implement the Relay layout/mask builder, wire the Qwen benchmark path, and run targeted validation."}
{"id":"EXP-20260320T165252Z-RELAY-BLOCK-SPARSE-SCAFFOLD-RESULT","date":"2026-03-20","question":"Can we add a first fixed-schedule Relay block-sparse path for Qwen CUDA without disturbing the current Hamiltonian paths, and validate it with targeted compile/tests only?","hypothesis":"A separate relay_block_sparse path that uses a static XOR-stage block schedule with local blocks plus optional sink blocks should fit the existing flex-attention benchmark harness cleanly, expose explicit config/CLI controls, and validate without heavy inference.","change_set":["notes/LAB_NOTEBOOK.md","notes/experiments.ndjson","hcsa/torch/attention_relay_block_sparse.py","hcsa/integrations/qwen_torch.py","scripts/bench_qwen35_cuda_wayfinder.py","tests/pytorch/test_torch_qwen_sparse_gqa.py","tests/test_qwen_cuda_wayfinder_cli.py","docs/RELAY_ATTENTION.md"],"command":".venv/bin/python -m py_compile hcsa/torch/attention_relay_block_sparse.py hcsa/integrations/qwen_torch.py scripts/bench_qwen35_cuda_wayfinder.py tests/pytorch/test_torch_qwen_sparse_gqa.py tests/test_qwen_cuda_wayfinder_cli.py && .venv/bin/python -m pytest tests/pytorch/test_torch_qwen_sparse_gqa.py tests/test_qwen_cuda_wayfinder_cli.py -q && python scripts/bench_qwen35_cuda_wayfinder.py --help | rg \"relay_block_sparse|relay-local-window-blocks|relay-long-range-blocks|relay-sink-blocks\"","controls":{"inference":"off","benchmark":"off","retro_backfill_inference":"off","validation_scope":"py_compile + targeted pytest only","baseline":"EXP-20260319T212553Z-BLOCK-SPARSE-FLEX-PROTOTYPE-RESULT"},"metrics":{"py_compile":"pass","pytest":{"failed":0,"skipped":2},"cli_help":{"relay_block_sparse":true,"relay_local_window_blocks":true,"relay_long_range_blocks":true,"relay_sink_blocks":true},"implementation":{"stage_schedule":"layer_idx mod ceil(log2(n_blocks))","partner_rule":"xor","causality":"token-level kv_idx <= q_idx"},"compatibility":{"existing_paths_preserved":["permute","sparse","block_sparse"],"unsupported_arch_caps":{"relay_block_sparse":4096}}},"decision":"keep","next_action":"Run a guarded real-model relay_block_sparse smoke at T=512 and T=4096, then compare against dense and Hamiltonian block_sparse on the backbone path."}
{"id":"EXP-20260321T003052Z-QWEN35CUDA-TRITON-SCALE-9B-PRERUN","date":"2026-03-21","question":"Does the staged Wayfinder Triton block-sparse path keep improving versus dense on Qwen3.5-9B when the scaling curve is extended to T=8192, 32768, 65536, 98304, and 131072 with matched warmup=1, repeats=3, and forward_target=backbone?","hypothesis":"The current Triton block-sparse path should stay near parity at 8k, cross clearly positive by 32k, and reach its strongest speedup at 131072 because only the 8 full-attention layers are swapped while the block topology keeps memory overhead near zero on this hardware.","change_set":["measurement only"],"command":".venv/bin/python scripts/bench_qwen35_cuda_wayfinder.py --model-path /home/hmbown/HF_Models/Qwen3.5-9B --seq-lens 8192 32768 65536 98304 131072 --warmup 1 --repeats 3 --path block_sparse --engine triton --phases wayfinder dense --forward-target backbone --output benchmarks/cuda/qwen35_wayfinder/EXP-20260321T003052Z-QWEN35CUDA-TRITON-SCALE-9B.ndjson","controls":{"baseline_run_path":"benchmarks/cuda/qwen35_wayfinder/EXP-20260320T204420Z-Qwen3.5-9B.ndjson","one_process_at_a_time":true,"retro_backfill_inference":"off","model":"Qwen3.5-9B","model_path":"/home/hmbown/HF_Models/Qwen3.5-9B","device":"cuda","gpu":"NVIDIA GB10","path":"block_sparse","engine":"triton","block_size":128,"block_local_window_blocks":1,"block_partner_count":1,"block_sink_blocks":1,"block_partner_rule":"xor","dtype":"bfloat16","seq_lens":[8192,32768,65536,98304,131072],"warmup":1,"repeats":3,"forward_target":"backbone","phases":["wayfinder","dense"],"stop_gates":["nonzero exit","missing artifact","missing dense or wayfinder row for any requested seq_len","error row for a requested comparison point"]},"metrics":{"status":"pending","artifacts_expected":["benchmarks/cuda/qwen35_wayfinder/EXP-20260321T003052Z-QWEN35CUDA-TRITON-SCALE-9B.ndjson"],"required":["dense and wayfinder rows for 8192, 32768, 65536, 98304, and 131072","absolute latency, delta vs baseline artifact, and percentage delta vs baseline for overlapping 65536 and 131072 rows","memory reduction convention 100*(1-wayfinder/dense)"]},"decision":"pending","next_action":"Run the extended Triton scaling command, then append a RESULT entry with absolute metrics and deltas versus the named baseline artifact and dense rows."}
