{"id":"EXP-20260207-TINY-GATE-SDPA-DENSE-RESULT","date":"2026-02-07","question":"After switching dense baseline to fused SDPA, what is the Tiny gate throughput/memory profile?","hypothesis":"Ratios and memory reductions vs dense would shrink relative to naive dense baseline, but long-context throughput crossover should remain.","change_set":["hcsa/mlx/attention.py dense_causal_attention now uses mx.fast.scaled_dot_product_attention(mask='causal') when return_weights=false"],"command":"PYTHONPATH=. python3 scripts/bench_mlx_wayfinder_scale.py --seq-lens 256 512 1024 2048 4096 --batch 2 --heads 4 --embd 128 --window 32 --landmark-stride 32 --warmup 2 --iters 6 --out-dir benchmarks/mlx/tiny_wayfinder/20260207_tiny_batched_gate_mlx306_sdpa_dense","controls":{"batch":2,"heads":4,"embd":128,"window":32,"landmark_stride":32,"warmup":2,"iters":6,"mlx_version":"0.30.6","baseline_run":"EXP-20260207-TINY-BASELINE-GATE-REPRO-RESULT","pre_sdpa_run":"EXP-20260207-TINY-BATCHED-PERMUTE-GATE-RESULT","historical_targets":{"t2048_ratio":1.19,"t2048_mem_reduction_pct":37.0,"t4096_ratio":2.45,"t4096_mem_reduction_pct":67.0}},"metrics":{"path":"benchmarks/mlx/tiny_wayfinder/20260207_tiny_batched_gate_mlx306_sdpa_dense/results.json","t2048":{"dense_tokens_per_sec":1323736.7440761237,"wayfinder_tokens_per_sec":2081234.683015279,"ratio":1.5720149987334513,"dense_step_intermediate_bytes":553646268,"wayfinder_step_intermediate_bytes":406800548,"mem_reduction_pct":26.528126823161017,"delta_ratio_vs_historical":0.3820149987334514,"delta_ratio_pct_vs_historical":32.10210073474466,"delta_mem_reduction_pp_vs_historical":-10.471873176838983},"t4096":{"dense_tokens_per_sec":710205.6005667684,"wayfinder_tokens_per_sec":2287003.6033787876,"ratio":3.2197640915175514,"dense_step_intermediate_bytes":2203341196,"wayfinder_step_intermediate_bytes":833248604,"mem_reduction_pct":62.18078624832056,"delta_ratio_vs_historical":0.7697640915175514,"delta_ratio_pct_vs_historical":31.418942510920466,"delta_mem_reduction_pp_vs_historical":-4.819213751679441}},"decision":"keep","next_action":"use SDPA dense as fairness baseline for subsequent GPT-2 and Qwen comparisons"}
{"id":"EXP-20260207-TINY-LONG-RETRO-CONTROL-SDPA-RESULT","date":"2026-02-07","question":"Under SDPA dense baseline, what is tiny-long control quality/perf/memory with retro disabled?","hypothesis":"Control remains stable and serves as fair baseline for retro-on treatment.","change_set":["configuration-only run with retro disabled"],"command":"PYTHONPATH=. python3 scripts/run_mlx_experiment_tiny_long.py --wayfinder-attn wayfinder_permute --retro-backfill-enabled false --retro-backfill-alpha 0.0 --retro-backfill-training-only true --retro-backfill-causal-only true --out-dir runs/mlx/tiny_long/20260207_retro_control_sdpa_dense","controls":{"matched_treatment":"EXP-20260207-TINY-LONG-RETRO-TREATMENT-SDPA-RESULT","dataset":"data/tinyshakespeare.txt","steps":1000,"batch_size":8,"seq_len":128},"metrics":{"path":"runs/mlx/tiny_long/20260207_retro_control_sdpa_dense/summary.json","wayfinder_final_val_ppl":91.48653840230688,"wayfinder_avg_tokens_per_sec":208759.36570068184,"wayfinder_peak_memory_bytes":120135536},"decision":"keep","next_action":"run retro-on treatment under identical settings"}
{"id":"EXP-20260207-TINY-LONG-RETRO-TREATMENT-SDPA-RESULT","date":"2026-02-07","question":"Under SDPA dense baseline, does retro-on training improve tiny-long quality at acceptable perf/memory cost?","hypothesis":"Retro-on should improve val ppl with moderate throughput/memory overhead.","change_set":["retro_backfill_enabled=true","retro_backfill_alpha=0.2","retro_backfill_training_only=true","retro_backfill_causal_only=true"],"command":"PYTHONPATH=. python3 scripts/run_mlx_experiment_tiny_long.py --wayfinder-attn wayfinder_permute --retro-backfill-enabled true --retro-backfill-alpha 0.2 --retro-backfill-training-only true --retro-backfill-causal-only true --out-dir runs/mlx/tiny_long/20260207_retro_treatment_sdpa_dense","controls":{"baseline_run":"EXP-20260207-TINY-LONG-RETRO-CONTROL-SDPA-RESULT","dataset":"data/tinyshakespeare.txt","steps":1000,"batch_size":8,"seq_len":128},"metrics":{"path":"runs/mlx/tiny_long/20260207_retro_treatment_sdpa_dense/summary.json","wayfinder_final_val_ppl":79.68043253420048,"wayfinder_avg_tokens_per_sec":194631.0165578781,"wayfinder_peak_memory_bytes":121972608,"delta_val_ppl_vs_control":-11.8061058681064,"delta_val_ppl_pct_vs_control":-12.904746506190579,"delta_tokens_per_sec_vs_control":-14128.349142803752,"delta_tokens_per_sec_pct_vs_control":-6.7677678054746115,"delta_peak_memory_bytes_vs_control":1837072,"delta_peak_memory_pct_vs_control":1.5291661910926901},"decision":"keep_training_only","next_action":"carry retro as optional training-time feature in non-Qwen and GPT-2 staging"}
{"id":"EXP-20260207-QWEN4B-SDPA-REALITY-SLICE-DEFER","date":"2026-02-07","question":"Should we run Qwen3-4B slice now?","hypothesis":"No; enforce progression order Tiny -> GPT-2 -> Qwen3-1.7B -> Qwen3-4B.","change_set":["planning update only"],"command":"deferred","controls":{"protocol_order":["Tiny","GPT-2","Qwen3-1.7B","Qwen3-4B"]},"metrics":{"status":"deferred"},"decision":"defer","next_action":"run GPT-2 baseline next"}
{"id":"EXP-20260207-GPT2-PREPERM-ADAPTIVE","date":"2026-02-07","question":"Can adaptive pre-permute in the core batched permute kernel improve GPT-2 throughput at T=2048/4096/8192 without model-specific paths?","hypothesis":"Pre-permuting Q/K/V once per head-chunk removes repeated gather cost and should improve throughput materially; memory may increase modestly but remain bounded by head chunking.","change_set":["hcsa/mlx/attention.py adaptive pre-permute mode in wayfinder_permute_window_attention_batched","hcsa/integrations/gpt2_mlx.py config + pass-through","scripts/bench_gpt2_wayfinder_mlx.py expose permute tuning flags"],"command":"PYTHONPATH=. python3 scripts/bench_gpt2_wayfinder_mlx.py --model-path openai-community/gpt2 --seq-lens 2048 4096 8192 --batch 1 --warmup 2 --iters 4 --path permute --window 64 --landmark-stride 64 --seed 42 --permute-prepermute-mode auto --permute-head-chunk-size 8 --permute-query-chunk-size 256 --out-dir benchmarks/mlx/gpt2_wayfinder/20260207_gpt2_preperm_adaptive_v1","controls":{"model":"openai-community/gpt2","window":64,"landmark_stride":64,"batch":1,"warmup":2,"iters":4,"baseline_paths":["benchmarks/mlx/gpt2_wayfinder/20260207_gpt2_base_sdpa_steady_v4/results.json","benchmarks/mlx/gpt2_wayfinder/20260207_gpt2_8192_v4/results.json"]},"metrics":{"status":"pending"},"decision":"pending","next_action":"implement kernel change and benchmark"}
{"id":"EXP-20260207-GPT2-PREPERM-KV-AUTO","date":"2026-02-07","question":"Can KV-only pre-permute recover memory while retaining GPT-2 long-context throughput gains?","hypothesis":"Pre-permuting only K/V should retain most speed benefit and lower memory overhead relative to QKV pre-permute.","change_set":["hcsa/mlx/attention.py separate pre-permute controls for Q and KV","hcsa/integrations/gpt2_mlx.py permit auto/off/kv/qkv","scripts/bench_gpt2_wayfinder_mlx.py CLI choices include kv and qkv"],"command":"PYTHONPATH=. python3 scripts/bench_gpt2_wayfinder_mlx.py --model-path openai-community/gpt2 --seq-lens 2048 4096 8192 --batch 1 --warmup 2 --iters 4 --path permute --window 64 --landmark-stride 64 --seed 42 --permute-prepermute-mode auto --permute-head-chunk-size 8 --permute-query-chunk-size 256 --out-dir benchmarks/mlx/gpt2_wayfinder/20260207_gpt2_preperm_kv_auto_v2","controls":{"model":"openai-community/gpt2","window":64,"landmark_stride":64,"batch":1,"warmup":2,"iters":4,"baseline_path":"benchmarks/mlx/gpt2_wayfinder/20260207_gpt2_preperm_adaptive_v1/results.json"},"metrics":{"status":"pending"},"decision":"pending","next_action":"implement KV-only pre-permute auto mode and benchmark"}
{"id":"EXP-20260207-GPT2-STREAM-ACCUM-INFER","date":"2026-02-07","question":"Does forcing streaming inference accumulation reduce Wayfinder memory overhead while keeping long-context throughput gains?","hypothesis":"Streaming accumulation avoids chunk-list concat buffers and should lower peak memory without materially hurting throughput.","change_set":["hcsa/mlx/attention.py always stream y accumulation in inference"],"command":"PYTHONPATH=. python3 scripts/bench_gpt2_wayfinder_mlx.py --model-path openai-community/gpt2 --seq-lens 2048 4096 8192 --batch 1 --warmup 2 --iters 4 --path permute --window 64 --landmark-stride 64 --seed 42 --permute-prepermute-mode auto --permute-head-chunk-size 8 --permute-query-chunk-size 256 --out-dir benchmarks/mlx/gpt2_wayfinder/20260207_gpt2_stream_accum_v3","controls":{"model":"openai-community/gpt2","window":64,"landmark_stride":64,"batch":1,"warmup":2,"iters":4,"baseline_path":"benchmarks/mlx/gpt2_wayfinder/20260207_gpt2_preperm_kv_auto_v2/results.json"},"metrics":{"status":"pending"},"decision":"pending","next_action":"benchmark and compare throughput/memory deltas"}
{"id":"EXP-20260207-GPT2-AUTO-PLANNER-BUDGET1","date":"2026-02-07","question":"Can a non-hardcoded planner pick off/kv/qkv by math under explicit memory budget and improve GPT-2 Pareto behavior?","hypothesis":"Planner with budget multiplier 1.0 should keep memory closer to dense and still pick faster modes when feasible.","change_set":["hcsa/mlx/attention.py auto plan solver for pre-permute mode","hcsa/integrations/gpt2_mlx.py runtime memory budget pass-through","scripts/bench_gpt2_wayfinder_mlx.py derive per-seq budget from dense peak"],"command":"PYTHONPATH=. python3 scripts/bench_gpt2_wayfinder_mlx.py --model-path openai-community/gpt2 --seq-lens 2048 4096 8192 --batch 1 --warmup 2 --iters 4 --path permute --window 64 --landmark-stride 64 --seed 42 --permute-prepermute-mode auto --permute-memory-budget-multiplier 1.0 --permute-head-chunk-size 8 --permute-query-chunk-size 256 --out-dir benchmarks/mlx/gpt2_wayfinder/20260207_gpt2_auto_planner_budget1_v4","controls":{"model":"openai-community/gpt2","window":64,"landmark_stride":64,"batch":1,"warmup":2,"iters":4,"budget_multiplier":1.0,"baseline_paths":["benchmarks/mlx/gpt2_wayfinder/20260207_gpt2_preperm_kv_auto_v2/results.json","benchmarks/mlx/gpt2_wayfinder/20260207_gpt2_base_sdpa_steady_v4/results.json","benchmarks/mlx/gpt2_wayfinder/20260207_gpt2_8192_v4/results.json"]},"metrics":{"status":"pending"},"decision":"pending","next_action":"run planner benchmark and compare Pareto"}
{"id":"EXP-20260207-GPT2-AUTO-PLANNER-BUDGET-SWEEP","date":"2026-02-07","question":"Which planner memory-budget multiplier gives the best GPT-2 throughput/memory Pareto point at 2048/4096/8192?","hypothesis":"A mid-range budget multiplier should retain most long-context throughput gains while limiting memory regression.","change_set":["measurement only"],"command":"for m in 0.50 0.70 0.85 1.00; do PYTHONPATH=. python3 scripts/bench_gpt2_wayfinder_mlx.py --model-path openai-community/gpt2 --seq-lens 2048 4096 8192 --batch 1 --warmup 1 --iters 3 --path permute --window 64 --landmark-stride 64 --seed 42 --permute-prepermute-mode auto --permute-memory-budget-multiplier $m --permute-head-chunk-size 8 --permute-query-chunk-size 256 --out-dir benchmarks/mlx/gpt2_wayfinder/20260207_gpt2_auto_planner_sweep_m${m}; done","controls":{"model":"openai-community/gpt2","window":64,"landmark_stride":64,"batch":1,"warmup":1,"iters":3,"planner_mode":"auto"},"metrics":{"status":"pending"},"decision":"pending","next_action":"extract Pareto frontier and pick default budget"}
{"id":"EXP-20260207-GPT2-AUTO-PLANNER-BUDGET-SWEEP-M010","date":"2026-02-07","question":"Does a very low planner budget multiplier (0.10) force a different execution mode and alter memory/throughput?","hypothesis":"If planner estimates are calibrated enough, multiplier 0.10 should prefer memory-safe plan(s) and reduce memory regression.","change_set":["measurement only"],"command":"PYTHONPATH=. python3 scripts/bench_gpt2_wayfinder_mlx.py --model-path openai-community/gpt2 --seq-lens 2048 4096 8192 --batch 1 --warmup 1 --iters 3 --path permute --window 64 --landmark-stride 64 --seed 42 --permute-prepermute-mode auto --permute-memory-budget-multiplier 0.10 --permute-head-chunk-size 8 --permute-query-chunk-size 256 --out-dir benchmarks/mlx/gpt2_wayfinder/20260207_gpt2_auto_planner_sweep_m0.10","controls":{"model":"openai-community/gpt2","window":64,"landmark_stride":64,"batch":1,"warmup":1,"iters":3,"planner_mode":"auto","budget_multiplier":0.1},"metrics":{"status":"pending"},"decision":"pending","next_action":"compare against prior sweep points"}
{"id":"EXP-20260207-GPT2-AUTO-PLANNER-BUDGET-SWEEP-M020_040","date":"2026-02-07","question":"Where is the budget-multiplier phase transition between memory-safe and throughput-fast plans?","hypothesis":"A transition should occur between 0.10 and 0.50 multipliers; measuring 0.20/0.30/0.40 locates it.","change_set":["measurement only"],"command":"for m in 0.20 0.30 0.40; do PYTHONPATH=. python3 scripts/bench_gpt2_wayfinder_mlx.py --model-path openai-community/gpt2 --seq-lens 2048 4096 8192 --batch 1 --warmup 1 --iters 3 --path permute --window 64 --landmark-stride 64 --seed 42 --permute-prepermute-mode auto --permute-memory-budget-multiplier $m --permute-head-chunk-size 8 --permute-query-chunk-size 256 --out-dir benchmarks/mlx/gpt2_wayfinder/20260207_gpt2_auto_planner_sweep_m${m}; done","controls":{"model":"openai-community/gpt2","window":64,"landmark_stride":64,"batch":1,"warmup":1,"iters":3,"planner_mode":"auto"},"metrics":{"status":"pending"},"decision":"pending","next_action":"select default multiplier by Pareto frontier"}
{"id":"EXP-20260207-GPT2-AUTO-PLANNER-REFINE-M010-M020","date":"2026-02-07","question":"At stable settings, which budget multiplier (0.10 vs 0.20) is the better default tradeoff?","hypothesis":"0.20 should offer better long-context throughput with acceptable memory regression relative to 0.10.","change_set":["measurement only"],"command":"A/B runs for m=0.10 and m=0.20 with warmup=2 iters=4 at seq-lens 2048/4096/8192","controls":{"model":"openai-community/gpt2","window":64,"landmark_stride":64,"batch":1,"warmup":2,"iters":4,"planner_mode":"auto"},"metrics":{"status":"pending"},"decision":"pending","next_action":"pick default budget multiplier and update docs"}
{"id":"EXP-20260207-GPT2-AUTO-PLANNER-REFINE-M015","date":"2026-02-07","question":"Does budget multiplier 0.15 provide a better Pareto compromise than 0.10 or 0.20?","hypothesis":"0.15 may retain some 8192 speedup while avoiding the worst 4096 memory regression of 0.20.","change_set":["measurement only"],"command":"PYTHONPATH=. python3 scripts/bench_gpt2_wayfinder_mlx.py --model-path openai-community/gpt2 --seq-lens 2048 4096 8192 --batch 1 --warmup 2 --iters 4 --path permute --window 64 --landmark-stride 64 --seed 42 --permute-prepermute-mode auto --permute-memory-budget-multiplier 0.15 --permute-head-chunk-size 8 --permute-query-chunk-size 256 --out-dir benchmarks/mlx/gpt2_wayfinder/20260207_gpt2_auto_planner_refine_m015","controls":{"model":"openai-community/gpt2","window":64,"landmark_stride":64,"batch":1,"warmup":2,"iters":4,"planner_mode":"auto","budget_multiplier":0.15},"metrics":{"status":"pending"},"decision":"pending","next_action":"compare against m010/m020 and choose default"}
{"id":"EXP-20260207-180248-NORTHSTAR-GPT2-BEFORE","date":"2026-02-07","question":"Under stable North Star settings, what is the current GPT-2 Wayfinder/HCSA permute throughput ratio and memory vs fused dense SDPA at T=2048/4096/8192?","hypothesis":"Throughput ratio grows with T but remains <1.0x at T=4096 due to Python loop + per-iteration mx.eval synchronization overhead (C too large).","change_set":["reporting-only: add scripts/report_northstar.py"],"command":"PYTHONPATH=. python3 scripts/bench_gpt2_wayfinder_mlx.py --model-path openai-community/gpt2 --seq-lens 2048 4096 8192 --batch 1 --warmup 2 --iters 4 --path permute --window 64 --landmark-stride 64 --seed 42 --permute-prepermute-mode auto --permute-memory-budget-multiplier 1.0 --permute-head-chunk-size 8 --permute-query-chunk-size 256 --out-dir benchmarks/mlx/gpt2_wayfinder/20260207_180248_northstar_before","controls":{"model":"openai-community/gpt2","window":64,"landmark_stride":64,"batch":1,"warmup":2,"iters":4},"metrics":{"path":"benchmarks/mlx/gpt2_wayfinder/20260207_180248_northstar_before/results.json","t2048_attn_ratio":0.704,"t4096_attn_ratio":0.812,"t8192_attn_ratio":1.186,"C_fit":39.083,"T_star":5041.692},"decision":"baseline_locked","next_action":"micro-profile to identify dominant term in C"}
{"id":"EXP-20260207-NORTHSTAR-MICRO-PROFILE","date":"2026-02-07","question":"Which term dominates constant C in R(T)=T/(W*C): Python loop, mx.eval sync, gather, mask, or SDPA?","hypothesis":"Per-query-chunk mx.eval GPU sync is the dominant cost (>80% of total).","change_set":["add scripts/profile_hcsa_micro.py"],"command":"PYTHONPATH=. python3 scripts/profile_hcsa_micro.py --T 2048 4096 8192 --warmup 1","controls":{"B":1,"H":12,"dh":64,"window":64,"head_chunk_size":8,"query_chunk_size":256},"metrics":{"path":"benchmarks/mlx/gpt2_wayfinder/northstar_micro_profile.json","t2048_eval_sync_pct":86.8,"t4096_eval_sync_pct":87.7,"t8192_eval_sync_pct":89.3,"t8192_eval_count_current":66,"t8192_eval_count_lazy":2,"lazy_speedup_t8192":3.67},"decision":"confirmed_root_cause","next_action":"remove per-query-chunk mx.eval from batched permute attention"}
{"id":"EXP-20260207-NORTHSTAR-GPT2-AFTER","date":"2026-02-07","question":"After removing all internal mx.eval syncs from wayfinder_permute_window_attention_batched (keeping 1 per head chunk), does GPT-2 meet the North Star gate?","hypothesis":"Eliminating per-query-chunk and prepermute mx.eval calls should reduce C by ~3x, pushing T=4096 ratio above 0.95x and T=8192 well above 1.0x.","change_set":["hcsa/mlx/attention.py: remove inference_fast_path with per-chunk mx.eval(y_pi)","hcsa/mlx/attention.py: remove prepermute mx.eval(q_pi_buf/k_pi_buf/v_pi_buf)","hcsa/mlx/attention.py: remove retro mx.eval(y_pi)","all paths now use lazy chunk-list accumulation with single mx.eval(y_h) per head chunk"],"command":"PYTHONPATH=. python3 scripts/bench_gpt2_wayfinder_mlx.py --model-path openai-community/gpt2 --seq-lens 2048 4096 8192 --batch 1 --warmup 4 --iters 8 --path permute --window 64 --landmark-stride 64 --seed 42 --permute-prepermute-mode auto --permute-memory-budget-multiplier 1.0 --permute-head-chunk-size 8 --permute-query-chunk-size 256 --out-dir benchmarks/mlx/gpt2_wayfinder/20260207_northstar_after_v3_stable","controls":{"model":"openai-community/gpt2","window":64,"landmark_stride":64,"batch":1,"warmup":4,"iters":8,"baseline":"EXP-20260207-180248-NORTHSTAR-GPT2-BEFORE"},"metrics":{"path":"benchmarks/mlx/gpt2_wayfinder/20260207_northstar_after_v3_stable/results.json","t2048_attn_ratio":0.481,"t4096_attn_ratio":0.979,"t8192_attn_ratio":1.747,"t2048_block_ratio":0.951,"t4096_block_ratio":1.01,"t8192_block_ratio":1.382,"t2048_block_mem_delta_pct":-4.2,"t4096_block_mem_delta_pct":-4.8,"t8192_block_mem_delta_pct":-5.1,"C_fit":32.99,"T_star":4255.767},"decision":"keep","next_action":"update LAB_NOTEBOOK.md and README.md with fairness correction"}
{"id":"EXP-20260207-185738-GLM-INTEGRATION-SMOKE","date":"2026-02-07","question":"Does GLM-4.7-Flash MLA integration run correctly with Wayfinder swap while keeping retro off by default?","hypothesis":"MLA extraction + value-dim padding inside Wayfinder kernels will preserve shape correctness and enable benchmark smoke without MoE routing changes.","change_set":["add hcsa/integrations/glm_mlx.py","update hcsa/integrations/__init__.py exports","add scripts/bench_glm_wayfinder_mlx.py"],"command":"PYTHONPATH=. python3 -m pytest tests/mlx/ -x -q && PYTHONPATH=. python3 scripts/bench_glm_wayfinder_mlx.py --model-path mlx-community/GLM-4.7-Flash-4bit --seq-lens 2048 --batch 1 --warmup 1 --iters 1 --path permute --window 64 --landmark-stride 64 --seed 42 --permute-prepermute-mode auto --permute-memory-budget-multiplier 1.0 --out-dir benchmarks/mlx/glm_4_7_flash_4bit_wayfinder/20260207_glm_integration_smoke","controls":{"retro_backfill_enabled":false,"batch":1,"window":64,"landmark_stride":64,"path":"permute","baseline_path":"benchmarks/mlx/gpt2_wayfinder/20260207_northstar_after_v3_stable/results.json"},"metrics":{"status":"pending"},"decision":"pending","next_action":"run validation/test + GLM smoke benchmark and record absolute metrics and deltas"}
{"id":"EXP-20260207-190227-GLM-LONG-SMOKE","date":"2026-02-07","question":"At T=8192 on GLM-4.7-Flash MLA, does Wayfinder permute exceed dense throughput with reduced memory (retro off)?","hypothesis":"Wayfinder should cross >1.0x throughput at T=8192 and reduce peak memory vs dense due O(T\u00b7W) local attention.","change_set":["hcsa/integrations/glm_mlx.py","scripts/bench_glm_wayfinder_mlx.py","hcsa/mlx/attention.py bfloat16 itemsize planner fix"],"command":"PYTHONPATH=. python3 scripts/bench_glm_wayfinder_mlx.py --model-path mlx-community/GLM-4.7-Flash-4bit --seq-lens 4096 8192 --batch 1 --warmup 1 --iters 1 --path permute --window 64 --landmark-stride 64 --seed 42 --permute-prepermute-mode auto --permute-memory-budget-multiplier 1.0 --out-dir benchmarks/mlx/glm_4_7_flash_4bit_wayfinder/20260207_glm_long_smoke","controls":{"retro_backfill_enabled":false,"batch":1,"window":64,"landmark_stride":64,"path":"permute","baseline_path":"benchmarks/mlx/glm_4_7_flash_4bit_wayfinder/20260207_glm_integration_smoke/results.json"},"metrics":{"status":"pending"},"decision":"pending","next_action":"run long-context benchmark and compute absolute/delta/% metrics vs dense baseline"}
