{"id":"EXP-20260321T062613Z-QWEN35A3B-FP8-SAFETY-BACKFILL-RESULT","date":"2026-03-21","question":"After the interrupted T=262144 Wayfinder pass pushed live unified-memory usage to 116.9 GiB without emitting a row, what safer follow-up queue can recover paired dense rows through T=131072 and bracket the 35B Wayfinder ceiling above T=131072 on GB10?","hypothesis":"Dense-only backfill at 8192, 32768, 65536, and 131072 should complete cleanly because the native-FP8 checkpoint leaves enough headroom for the stock hybrid path. Wayfinder-only probes should fit at 163840 and likely 196608, while 229376+ is likely to breach the 110 GiB stop-gate or require manual abort before row emission. T=262144 is therefore treated as not safely feasible until a lower rung clears with substantial margin.","change_set":["measurement-only","README.md","notes/LAB_NOTEBOOK.md","notes/experiments.ndjson"],"command":"dense backfill reused from benchmarks/cuda/qwen35_wayfinder/EXP-20260321T061023Z-QWEN35A3B-FP8-DENSE-131K.ndjson ; .venv/bin/python scripts/bench_qwen35_cuda_wayfinder.py --model-path /home/hmbown/HF_Models/Qwen3.5-35B-A3B-FP8 --seq-lens 163840 --warmup 0 --repeats 1 --path block_sparse --engine triton --phases wayfinder --skip-divergence --forward-target backbone --output benchmarks/cuda/qwen35_wayfinder/EXP-20260321T062613Z-QWEN35A3B-FP8-WF-163840.ndjson ; .venv/bin/python scripts/bench_qwen35_cuda_wayfinder.py --model-path /home/hmbown/HF_Models/Qwen3.5-35B-A3B-FP8 --seq-lens 196608 --warmup 0 --repeats 1 --path block_sparse --engine triton --phases wayfinder --skip-divergence --forward-target backbone --output benchmarks/cuda/qwen35_wayfinder/EXP-20260321T062613Z-QWEN35A3B-FP8-WF-196608.ndjson ; .venv/bin/python scripts/bench_qwen35_cuda_wayfinder.py --model-path /home/hmbown/HF_Models/Qwen3.5-35B-A3B-FP8 --seq-lens 229376 --warmup 0 --repeats 1 --path block_sparse --engine triton --phases wayfinder --skip-divergence --forward-target backbone --output benchmarks/cuda/qwen35_wayfinder/EXP-20260321T062613Z-QWEN35A3B-FP8-WF-229376.ndjson","controls":{"baseline_run_path":"benchmarks/cuda/qwen35_wayfinder/EXP-20260321T061023Z-QWEN35A3B-FP8-SCALE.ndjson","one_process_at_a_time":true,"retro_backfill_inference":"off","model":"Qwen3.5-35B-A3B-FP8","model_path":"/home/hmbown/HF_Models/Qwen3.5-35B-A3B-FP8","quantize":"none","load_dtype_effective":"torch.bfloat16","native_quantization_method":"fp8","path":"block_sparse","engine":"triton","block_size":128,"block_local_window_blocks":1,"block_partner_count":1,"block_sink_blocks":1,"block_partner_rule":"xor","warmup":0,"repeats":1,"forward_target":"backbone","manual_stop_gates":["live nvidia-smi usage > 110 GiB","free -h available memory < 4 GiB"]},"metrics":{"status":"completed","artifacts":{"dense_backfill":"benchmarks/cuda/qwen35_wayfinder/EXP-20260321T061023Z-QWEN35A3B-FP8-DENSE-131K.ndjson","wf_163840":"benchmarks/cuda/qwen35_wayfinder/EXP-20260321T062613Z-QWEN35A3B-FP8-WF-163840.ndjson","wf_196608":"benchmarks/cuda/qwen35_wayfinder/EXP-20260321T062613Z-QWEN35A3B-FP8-WF-196608.ndjson","wf_229376":"benchmarks/cuda/qwen35_wayfinder/EXP-20260321T062613Z-QWEN35A3B-FP8-WF-229376.ndjson","unsafe_262k_wayfinder":"benchmarks/cuda/qwen35_wayfinder/EXP-20260321T061023Z-QWEN35A3B-FP8-WF-262144.ndjson"},"wayfinder_only":{"163840":{"ms":125504.32,"tok_s":1305.5,"peak_gb":66.09},"196608":{"ms":144105.8,"tok_s":1364.3,"peak_gb":72.49,"live_midpass_used_gpu_memory_mib":96409,"live_midpass_host_available":"19 GiB"},"229376":{"ms":185970.16,"tok_s":1233.4,"peak_gb":78.89,"live_midpass_used_gpu_memory_mib":106637,"live_midpass_host_available":"8.7 GiB"}},"ceiling":{"safe_through":229376,"unsafe_at":262144,"bracket":"229376 < safe ceiling < 262144"}},"decision":"keep","next_action":"Document the measured 35B curve and the current ceiling in README; do not claim 262144 support for 35B on GB10 yet."}
{"id":"EXP-20260321T-NEMOTRON3SUPER-NVFP4-BRINGUP-PRERUN","date":"2026-03-21","question":"Can the Nemotron 3 Super 120B-A12B-NVFP4 model load on GB10 with the existing Wayfinder integration?","hypothesis":"Model should load within 119Gi budget (75G ckpt + 44G headroom). 8 attention layers should swap via existing nemotron_h_torch.py. Short-sequence forward pass should succeed.","change_set":["measurement-only"],"command":"Phase 0: config load → Phase 1: dense T=64 → Phase 2: wayfinder T=64 → Phase 3: wayfinder T=512,2048","controls":{"model":"~/HF_Models/NVIDIA-Nemotron-3-Super-120B-A12B-NVFP4","trust_remote_code":true,"dtype":"bfloat16","device_map":"auto","wayfinder_config":{"path":"permute","strategy":"random","engine":"auto","window":64,"landmark_stride":64,"num_cycles":1,"seed":42},"quantize":"none","baseline_run_path":null,"one_process_at_a_time":true},"metrics":{"status":"pending","artifacts_expected":["stdout timing/memory"],"required":["model_load_success","attention_swap_success","forward_pass_T64"]},"decision":"pending","next_action":"Run phase 0-3 sequentially, stop on any OOM or error."}
{"id":"EXP-20260321T-NEMOTRON3SUPER-NVFP4-BRINGUP-RESULT","date":"2026-03-21","question":"Can the Nemotron 3 Super 120B-A12B-NVFP4 model load on GB10 with the existing Wayfinder integration?","hypothesis":"Model should load within 119Gi budget","change_set":["installed mamba_ssm 2.3.1 + causal_conv1d 1.6.1 + nvidia-modelopt 0.42.0 + mock selective_scan_cuda"],"command":"Multiple load attempts: trust_remote_code=True (mamba_ssm import fail), trust_remote_code=False (OOM at 81%), modelopt[hf] install + retry (shape mismatch)","controls":{"model":"~/HF_Models/NVIDIA-Nemotron-3-Super-120B-A12B-NVFP4"},"metrics":{"status":"blocked","reason":"NVFP4 requires modelopt QuantLinear which needs 240G BF16 model creation first. FP8 variant is 128G (exceeds 119Gi system). No loadable path exists on GB10 via HF transformers.","mamba_ssm_cuda":"not compiled for sm_121","modelopt_quant":"not recognized by transformers 4.57.6 or 5.3.0","shape_mismatch":"[1024,1344] vs expected [1024,2688] — packed FP4 weights"},"decision":"blocked","next_action":"Pivot to Qwen3.5-35B-A3B-GPTQ-Int4 (Track A). Nemotron needs vLLM/SGLang runtime, not HF loading."}
{"id":"EXP-20260321T-QWEN35A3B-GPTQ-INT4-BRINGUP-PRERUN","date":"2026-03-21","question":"Can Qwen3.5-35B-A3B-GPTQ-Int4 extend the safe context ceiling beyond 229K?","hypothesis":"~15G lighter than FP8 should allow 240K+ context on GB10","change_set":["install gptqmodel 5.8.0","download Qwen/Qwen3.5-35B-A3B-GPTQ-Int4"],"command":"Phase 0: download → Phase 1: dense T=512 → Phase 2: wayfinder T=512 → Phase 3: paired scale → Phase 4: ceiling probes","controls":{"model":"~/HF_Models/Qwen3.5-35B-A3B-GPTQ-Int4","dtype":"bfloat16","device_map":"auto","wayfinder_config":"same as FP8 run","baseline_run_path":"benchmarks/cuda/qwen35_wayfinder/EXP-20260321T061023Z-QWEN35A3B-FP8-SCALE.ndjson","seed":42},"metrics":{"status":"pending"},"decision":"pending","next_action":"Download checkpoint, then run phase 0-4."}
{"id":"EXP-20260321T-QWEN35A3B-GPTQ-INT4-BRINGUP-RESULT","date":"2026-03-21","question":"Can Qwen3.5-35B-A3B-GPTQ-Int4 extend the safe context ceiling beyond 229K?","hypothesis":"~15G lighter than FP8 should allow 240K+ context","change_set":["download Qwen/Qwen3.5-35B-A3B-GPTQ-Int4 (23G)","install gptqmodel 5.8.0"],"command":"Attempted load with transformers 5.3.0, 5.2.0, and 4.57.6","controls":{"model":"~/HF_Models/Qwen3.5-35B-A3B-GPTQ-Int4"},"metrics":{"status":"blocked","reason":"Architecture version mismatch: GPTQ checkpoint stores per-expert weights (experts.{i}.gate_proj.qweight), transformers 5.x expects fused weights (experts.gate_up_proj). Result: 64.6G random-weight model, garbage output. Transformers 4.57.6 does not support qwen3_5_moe model_type at all.","alloc_gb_with_random_weights":64.6},"decision":"blocked","next_action":"File HuggingFace issue about Qwen3.5 MoE GPTQ weight format mismatch with transformers 5.x."}
{"id":"EXP-20260321T-QWEN35A3B-FP8-BNB4BIT-RESULT","date":"2026-03-21","question":"Can BNB 4-bit on FP8 reduce memory enough for 262K?","hypothesis":"BNB 4-bit should reduce weights from 35G to 18-20G","change_set":["measurement-only"],"command":"AutoModelForCausalLM.from_pretrained with BitsAndBytesConfig(load_in_4bit=True)","controls":{"model":"~/HF_Models/Qwen3.5-35B-A3B-FP8"},"metrics":{"status":"blocked","reason":"BNB 4-bit overrides native FP8 quantizer. weight_scale_inv tensors marked UNEXPECTED and ignored. Result: 62.6G (worse than 35G FP8), garbage output.","alloc_gb":62.6},"decision":"blocked","next_action":"BNB on FP8 is a fundamental conflict. Not fixable."}
{"id":"EXP-20260321T-NEMOTRON3NANO-FP8-BRINGUP-PRERUN","date":"2026-03-21","question":"Can Nemotron 3 Nano 30B-A3B-FP8 load and demonstrate Wayfinder on the nemotron_h architecture?","hypothesis":"33G checkpoint should load. No quantization_config means no modelopt blocker. 6 attention layers swappable.","change_set":["download nvidia/NVIDIA-Nemotron-3-Nano-30B-A3B-FP8"],"command":"Phase 0: download → Phase 1: dense T=64 → Phase 2: decode → Phase 3: wayfinder T=64 → Phase 4: paired scale","controls":{"model":"~/HF_Models/NVIDIA-Nemotron-3-Nano-30B-A3B-FP8","trust_remote_code":true,"dtype":"bfloat16","wayfinder_config":{"path":"permute","strategy":"random","engine":"auto","window":64,"landmark_stride":64,"num_cycles":1,"seed":42}},"metrics":{"status":"pending"},"decision":"pending","next_action":"Download then run phases."}
{"id":"EXP-20260321T-NEMOTRON3NANO-FP8-BRINGUP-RESULT","date":"2026-03-21","question":"Can Nemotron 3 Nano 30B-A3B-FP8 load and run Wayfinder?","hypothesis":"33G checkpoint should load, 6 attention layers swappable","change_set":["download nvidia/NVIDIA-Nemotron-3-Nano-30B-A3B-FP8 (31G)","patch _ensure_nemotron_attention_attrs","fix return value (attn_output, None)"],"command":"AutoModelForCausalLM.from_pretrained trust_remote_code=False + swap_nemotron_h_attention_with_wayfinder","controls":{"model":"~/HF_Models/NVIDIA-Nemotron-3-Nano-30B-A3B-FP8"},"metrics":{"status":"success_structural","layers_swapped":6,"swap_positions":[5,12,19,26,33,42],"engine":"flex","graph_build_ms":85,"attn_kernel_ms":1,"T2048_forward_ms":911,"alloc_after_load_gb":58.8,"alloc_after_T2048_gb":60.7,"logits_valid":true,"output_coherent":false,"fp8_scales_applied":false},"decision":"keep","next_action":"Download BF16 checkpoint for quality validation, or investigate FP8 scale restoration."}
{"id":"EXP-20260321T172541Z-QWEN27B-FP8-BRINGUP-PRERUN","date":"2026-03-21","question":"Can Qwen3.5-27B-FP8 load on GB10 through the existing Qwen CUDA path, produce coherent greedy text, and allow Wayfinder to swap all 16 full-attention layers without code changes?","hypothesis":"Yes. Remote config inspection already matches the known-good integration surface: model_type=qwen3_5, architectures=['Qwen3_5ForConditionalGeneration'], 64 layers with 16 full_attention and 48 linear_attention, 24 Q heads / 4 KV heads, and native quant_method=fp8. The current loader/swap path that works for Qwen3.5-9B and Qwen3.5-35B-A3B-FP8 should therefore work unchanged here, with --quantize none and BF16 compute.","change_set":["download Qwen/Qwen3.5-27B-FP8 to ~/HF_Models/Qwen3.5-27B-FP8","measurement-only unless the model exposes a real integration blocker"],"command":"Phase 0: snapshot_download Qwen/Qwen3.5-27B-FP8 to ~/HF_Models/Qwen3.5-27B-FP8 ; Phase 1: dense text-only load with trust_remote_code=True + BF16 compute + memory capture ; Phase 2: greedy decode several prompts and verify coherent output ; Phase 3: scripts/bench_qwen35_cuda_wayfinder.py --model-path ~/HF_Models/Qwen3.5-27B-FP8 --seq-lens 512 --warmup 0 --repeats 1 --quantize none --path block_sparse --engine triton --block-size 128 --phases wayfinder dense --skip-divergence --forward-target backbone --output benchmarks/cuda/qwen35_wayfinder/EXP-20260321T172541Z-QWEN27B-FP8-BRINGUP.ndjson","controls":{"bringup_path_reference":"benchmarks/cuda/qwen35_wayfinder/EXP-20260321T060610Z-QWEN35A3B-FP8-BRINGUP.ndjson","dense_wayfinder_baseline":"benchmarks/cuda/qwen35_wayfinder/EXP-20260320T204420Z-Qwen3.5-9B.ndjson","model":"~/HF_Models/Qwen3.5-27B-FP8","loader":"AutoModelForImageTextToText selected from checkpoint architecture","trust_remote_code":true,"dtype":"torch.bfloat16","quantize":"none","wayfinder_config":{"path":"block_sparse","engine":"triton","block_size":128,"window":64,"landmark_stride":64,"num_cycles":1,"seed":0},"one_process_at_a_time":true,"stop_gates":["download failure","model load failure","NaN/Inf or obviously incoherent greedy decode","Wayfinder swap count != 16","post-load allocation > 35G or host available memory < 16G before scale queue"]},"metrics":{"status":"pending","required":["checkpoint downloaded","dense load succeeds","greedy decode is coherent","Wayfinder smoke succeeds","swap_count=16"]},"decision":"pending","next_action":"Download the checkpoint, run dense coherence checks, then execute the T=512 Wayfinder smoke before any scale run."}
{"id":"EXP-20260321T172541Z-QWEN27B-FP8-SCALE-PRERUN","date":"2026-03-21","question":"On Qwen3.5-27B-FP8, what are the paired dense-vs-Wayfinder prefill timings at T=8192, 32768, 65536, 131072, how close is Wayfinder to dense logits at longer context, and how far beyond 131072 can the Wayfinder path safely scale on GB10?","hypothesis":"With native FP8 weights and 16 swappable attention layers, the 27B path should beat the 9B crossover behavior and should compare favorably against dense by T=32768 or T=65536, with the strongest relative gain at T=131072. Relative to the 35B FP8 model, lower weight residency should leave materially more headroom, making 262144 plausible and potentially allowing safe Wayfinder-only probes above that.","change_set":["measurement-only"],"command":"Phase 1: python scripts/bench_qwen35_cuda_wayfinder.py --model-path ~/HF_Models/Qwen3.5-27B-FP8 --seq-lens 8192 32768 65536 131072 --warmup 2 --repeats 3 --quantize none --path block_sparse --engine triton --block-size 128 --phases wayfinder dense --skip-divergence --forward-target backbone --output benchmarks/cuda/qwen35_wayfinder/EXP-20260321T172541Z-QWEN27B-FP8-SCALE.ndjson ; Phase 2: python scripts/bench_qwen35_cuda_wayfinder.py --model-path ~/HF_Models/Qwen3.5-27B-FP8 --seq-lens 4096 16384 --warmup 0 --repeats 1 --quantize none --path block_sparse --engine triton --block-size 128 --phases divergence --forward-target causal_lm --allow-large-logits --output benchmarks/cuda/qwen35_wayfinder/EXP-20260321T172541Z-QWEN27B-FP8-DIVERGENCE.ndjson ; Phase 3: guarded Wayfinder-only ceiling probes at T=196608, 262144, 327680, 393216, 524288 with live memory checks between commands","controls":{"paired_baseline_9b":"benchmarks/cuda/qwen35_wayfinder/EXP-20260320T204420Z-Qwen3.5-9B.ndjson","quality_baseline_9b":"benchmarks/cuda/qwen35_wayfinder/EXP-20260321T011456Z-QWEN35CUDA-QUALITY-DIVERGENCE.ndjson","paired_baseline_35b":"benchmarks/cuda/qwen35_wayfinder/EXP-20260321T061023Z-QWEN35A3B-FP8-SCALE.ndjson","ceiling_baseline_35b":"benchmarks/cuda/qwen35_wayfinder/EXP-20260321T062613Z-QWEN35A3B-FP8-WF-229376.ndjson","model":"~/HF_Models/Qwen3.5-27B-FP8","quantize":"none","dtype":"torch.bfloat16","wayfinder_config":{"path":"block_sparse","engine":"triton","block_size":128,"window":64,"landmark_stride":64,"num_cycles":1,"block_local_window_blocks":1,"block_partner_count":1,"block_sink_blocks":1,"block_partner_rule":"xor"},"forward_target":{"paired":"backbone","divergence":"causal_lm","ceiling":"backbone"},"one_process_at_a_time":true,"stop_gates":["any OOM or CUDA runtime failure","live unified-memory usage > 105 GiB during a ceiling probe","free -g available memory < 8G after any rung","divergence top-1 agreement < 0.90 at T=16384","no README/public claim without absolute metric, delta vs baseline, and percentage delta"]},"metrics":{"status":"pending","required":["paired dense and wayfinder rows for T=8192, 32768, 65536, 131072","divergence rows at T=4096 and T=16384 with cosine, L2, and top1_agreement","Wayfinder ceiling rows or explicit stop/error for each rung","absolute metrics plus delta vs 9B/35B baselines and percentage deltas","memory sign convention 100*(1-wayfinder/dense)"]},"decision":"pending","next_action":"Run the bring-up queue first. If swap_count=16 and coherence passes, execute the paired scale run, then open the ceiling rungs one at a time."}
{"id":"EXP-20260321T172541Z-QWEN27B-FP8-BRINGUP-RESULT","date":"2026-03-21","question":"Can Qwen3.5-27B-FP8 load on GB10 through the existing Qwen CUDA path, produce coherent greedy text, and allow Wayfinder to swap all 16 full-attention layers without code changes?","hypothesis":"Confirmed.","change_set":["measurement-only","download Qwen/Qwen3.5-27B-FP8 to ~/HF_Models/Qwen3.5-27B-FP8"],"command":"snapshot_download('Qwen/Qwen3.5-27B-FP8', local_dir='~/HF_Models/Qwen3.5-27B-FP8', local_dir_use_symlinks=False) ; ad hoc .venv/bin/python trust_remote_code load+decode probe via AutoConfig + AutoModelForImageTextToText.from_pretrained(..., trust_remote_code=True, torch_dtype=torch.bfloat16, device_map='auto') ; .venv/bin/python scripts/bench_qwen35_cuda_wayfinder.py --model-path /home/hmbown/HF_Models/Qwen3.5-27B-FP8 --seq-lens 512 --warmup 0 --repeats 1 --quantize none --path block_sparse --engine triton --block-size 128 --phases wayfinder dense --skip-divergence --forward-target backbone --output benchmarks/cuda/qwen35_wayfinder/EXP-20260321T172541Z-QWEN27B-FP8-BRINGUP.ndjson","controls":{"baseline_run_path":"benchmarks/cuda/qwen35_wayfinder/EXP-20260321T060610Z-QWEN35A3B-FP8-BRINGUP.ndjson","model":"~/HF_Models/Qwen3.5-27B-FP8","loader":"AutoModelForImageTextToText selected from checkpoint architecture","trust_remote_code":true,"dtype":"torch.bfloat16","quantize":"none","wayfinder_config":{"path":"block_sparse","engine":"triton","block_size":128,"window":64,"landmark_stride":64,"num_cycles":1,"seed":0},"one_process_at_a_time":true},"metrics":{"status":"success","artifact":"benchmarks/cuda/qwen35_wayfinder/EXP-20260321T172541Z-QWEN27B-FP8-BRINGUP.ndjson","checkpoint_size_on_disk":"29G","post_load_allocated_gb":28.31,"post_load_reserved_gb":28.36,"load_seconds":199.93,"full_attention_layers":[3,7,11,15,19,23,27,31,35,39,43,47,51,55,59,63],"greedy_decode":"coherent_with_default_thinking_process_preamble","smoke":{"wayfinder":{"seq_len":512,"mean_ms":2342.41,"prefill_tok_per_sec":218.6,"peak_mem_gb":28.48,"graph_cache_entries_total":16},"dense":{"seq_len":512,"mean_ms":1101.72,"prefill_tok_per_sec":464.7,"peak_mem_gb":28.48}},"vs_baseline_35b_bringup":{"wayfinder":{"latency_delta_ms":-7274.32,"latency_delta_pct":-75.6423,"throughput_delta_tok_s":165.4,"throughput_delta_pct":310.9023,"peak_mem_delta_gb":-5.72,"peak_mem_delta_pct":-16.7251},"dense":{"latency_delta_ms":-585.43,"latency_delta_pct":-34.6993,"throughput_delta_tok_s":161.2,"throughput_delta_pct":53.1137,"peak_mem_delta_gb":-5.72,"peak_mem_delta_pct":-16.7251}}},"decision":"keep","next_action":"Record the paired scale and quality result separately; bring-up itself is validated."}
