{"id": "EXP-20260208-E2E-P4A-GLM-ATTENTION-SWAP-RESULT", "date": "2026-02-08", "question": "For GLM-4.7-Flash full attention swap, what are attention-level and block-level dense-vs-wayfinder throughput/memory outcomes across 2K/8K/32K?", "hypothesis": "Long context should show clear throughput gains with modest memory reduction; short contexts may be neutral.", "change_set": ["none (measurement-only benchmark run)", "retro_backfill_enabled=false"], "command": "PYTHONPATH=/Volumes/VIXinSSD/wayfinder python3 scripts/bench_glm_wayfinder_mlx.py --model-path mlx-community/GLM-4.7-Flash-4bit --seq-lens 2048 8192 32768 --batch 1 --warmup 1 --iters 3 --dtype bfloat16 --path permute --window 64 --landmark-stride 0 --num-cycles 1 --seed 42 --permute-head-chunk-size 2 --permute-query-chunk-size 384 --permute-memory-budget-multiplier 1.0 --full-swap --out-dir benchmarks/mlx/e2e_validation_20260208_192216/glm47_attention_swap", "controls": {"model_path": "mlx-community/GLM-4.7-Flash-4bit", "seq_lens": [2048, 8192, 32768], "batch": 1, "warmup": 1, "iters": 3, "dtype": "bfloat16", "path": "permute", "window": 64, "landmark_stride": 0, "num_cycles": 1, "seed": 42, "permute_head_chunk_size": 2, "permute_query_chunk_size": 384, "permute_memory_budget_multiplier": 1.0, "full_swap": true}, "metrics": {"artifact": "benchmarks/mlx/e2e_validation_20260208_192216/glm47_attention_swap/results.json", "per_seq": {"2048": {"sanity_mae": 0.0037139488849788904, "graph_build_ms_first": 841.274332985282, "attention": {"dense_tokens_per_sec": 76809.36019045446, "wayfinder_tokens_per_sec": 94964.4805993547, "delta_tokens_per_sec": 18155.120408900242, "pct_delta_tokens_per_sec": 23.636598929978437, "dense_peak_memory_bytes": 426232364, "wayfinder_peak_memory_bytes": 213849214, "delta_peak_memory_bytes": -212383150, "pct_delta_peak_memory_bytes": -49.82802056767327, "memory_reduction_pct": 49.82802056767327, "throughput_ratio": 1.2363659892997843, "memory_ratio": 1.9931444031400556, "joint_utility": 2.464255951805583}, "block": {"dense_tokens_per_sec": 35175.178141470096, "wayfinder_tokens_per_sec": 40877.76782871949, "delta_tokens_per_sec": 5702.58968724939, "pct_delta_tokens_per_sec": 16.21197102204941, "dense_peak_memory_bytes": 604891708, "wayfinder_peak_memory_bytes": 377596464, "delta_peak_memory_bytes": -227295244, "pct_delta_peak_memory_bytes": -37.57618776946435, "memory_reduction_pct": 37.576187769464354, "throughput_ratio": 1.162119710220494, "memory_ratio": 1.6019527873544916, "joint_utility": 1.8616609090273146}}, "8192": {"sanity_mae": 0.00411853427067399, "graph_build_ms_first": 4048.7697909921408, "attention": {"dense_tokens_per_sec": 26319.425034282107, "wayfinder_tokens_per_sec": 101362.30342471463, "delta_tokens_per_sec": 75042.87839043252, "pct_delta_tokens_per_sec": 285.1235476940935, "dense_peak_memory_bytes": 20563475508, "wayfinder_peak_memory_bytes": 17639455800, "delta_peak_memory_bytes": -2924019708, "pct_delta_peak_memory_bytes": -14.219482046517095, "memory_reduction_pct": 14.219482046517095, "throughput_ratio": 3.8512354769409347, "memory_ratio": 1.1657658683551904, "joint_utility": 4.489638870016364}, "block": {"dense_tokens_per_sec": 17705.79515174678, "wayfinder_tokens_per_sec": 42962.97897861851, "delta_tokens_per_sec": 25257.183826871726, "pct_delta_tokens_per_sec": 142.64924907583128, "dense_peak_memory_bytes": 20748483646, "wayfinder_peak_memory_bytes": 18176326716, "delta_peak_memory_bytes": -2572156930, "pct_delta_peak_memory_bytes": -12.396842939873698, "memory_reduction_pct": 12.396842939873698, "throughput_ratio": 2.4264924907583127, "memory_ratio": 1.1415113719173973, "joint_utility": 2.769868772072784}}, "32768": {"status": "error", "error": "RuntimeError: [metal::malloc] Attempting to allocate 42949672960 bytes which is greater than the maximum allowed buffer size of 22613000192 bytes."}}}, "decision": "follow-up", "next_action": "use consumer/chunked GLM paths for 32k+ comparisons under memory constraints"}
{"id": "EXP-20260208-E2E-P4B-GLM-CONSUMER-DENSE", "date": "2026-02-08", "question": "What is the GLM consumer dense control baseline (single-turn, chunked settings) at 2K/8K/32K?", "hypothesis": "Dense control provides stable baseline for end-to-end comparison; 32K should be feasible with consumer harness.", "change_set": ["none (measurement-only benchmark run)", "no_swap=true"], "command": "PYTHONPATH=/Volumes/VIXinSSD/wayfinder python3 scripts/bench_glm_consumer_mlx.py --model-path mlx-community/GLM-4.7-Flash-4bit --seq-lens 2048 8192 32768 --decode-len 256 --repeats 1 --chunk-size 4096 --kv-step 4096 --cooldown-sec 0 --path permute --window 64 --landmark-stride 0 --head-chunk-size 2 --query-chunk-size 384 --active-dense-threshold 49152 --quality-dataset benchmarks/mlx/glm_4_7_flash_4bit_wayfinder/quality_eval_glm47_consumer_v1.json --skip-multi-turn --no-swap --out-dir benchmarks/mlx/e2e_validation_20260208_192216/glm47_consumer_dense", "controls": {"model_path": "mlx-community/GLM-4.7-Flash-4bit", "seq_lens": [2048, 8192, 32768], "decode_len": 256, "repeats": 1, "chunk_size": 4096, "kv_step": 4096, "cooldown_sec": 0, "path": "permute", "window": 64, "landmark_stride": 0, "head_chunk_size": 2, "query_chunk_size": 384, "active_dense_threshold": 49152, "quality_dataset": "benchmarks/mlx/glm_4_7_flash_4bit_wayfinder/quality_eval_glm47_consumer_v1.json", "skip_multi_turn": true, "no_swap": true}, "metrics": {"status": "pending"}, "decision": "pending", "next_action": "run dense control and record E2E/TTFT/memory/quality"}
{"id": "EXP-20260208-E2E-P4B-GLM-CONSUMER-DENSE-RESULT", "date": "2026-02-08", "question": "What is the GLM consumer dense control baseline (single-turn, chunked settings) at 2K/8K/32K?", "hypothesis": "Dense control provides stable baseline for end-to-end comparison; 32K should be feasible with consumer harness.", "change_set": ["none (measurement-only benchmark run)", "no_swap=true"], "command": "PYTHONPATH=/Volumes/VIXinSSD/wayfinder python3 scripts/bench_glm_consumer_mlx.py --model-path mlx-community/GLM-4.7-Flash-4bit --seq-lens 2048 8192 32768 --decode-len 256 --repeats 1 --chunk-size 4096 --kv-step 4096 --cooldown-sec 0 --path permute --window 64 --landmark-stride 0 --head-chunk-size 2 --query-chunk-size 384 --active-dense-threshold 49152 --quality-dataset benchmarks/mlx/glm_4_7_flash_4bit_wayfinder/quality_eval_glm47_consumer_v1.json --skip-multi-turn --no-swap --out-dir benchmarks/mlx/e2e_validation_20260208_192216/glm47_consumer_dense", "controls": {"model_path": "mlx-community/GLM-4.7-Flash-4bit", "seq_lens": [2048, 8192, 32768], "decode_len": 256, "repeats": 1, "chunk_size": 4096, "kv_step": 4096, "path": "permute", "window": 64, "landmark_stride": 0, "head_chunk_size": 2, "query_chunk_size": 384, "active_dense_threshold": 49152, "quality_dataset": "benchmarks/mlx/glm_4_7_flash_4bit_wayfinder/quality_eval_glm47_consumer_v1.json", "skip_multi_turn": true, "no_swap": true}, "metrics": {"artifact": "benchmarks/mlx/e2e_validation_20260208_192216/glm47_consumer_dense/results.json", "single_turn": {"2048": {"seq_len": 2048, "decode_len": 256, "repeat": 1, "prefill_sec": 2.4536627500056056, "ttft_sec": 0.10698716698971111, "itl_p50_sec": 0.015946792002068833, "itl_p95_sec": 0.016502208993188106, "decode_sec": 4.207839958005934, "e2e_sec": 6.66150270801154, "decode_tok_s": 60.838815771243496, "peak_memory_bytes": 18284344600, "sample_output_text": "marize the policy and list three key constraints with exact numbers.\nAssistant:\nUser: Summarize the policy and list three key constraints with exact numbers.\nAssistant"}, "8192": {"seq_len": 8192, "decode_len": 256, "repeat": 1, "prefill_sec": 28.90035799999896, "ttft_sec": 99.60972520901123, "itl_p50_sec": 0.020010250009363517, "itl_p95_sec": 0.02103033299499657, "decode_sec": 163.0115214999969, "e2e_sec": 191.91187949999585, "decode_tok_s": 1.5704411421005287, "peak_memory_bytes": 20660500140, "sample_output_text": "  } } } } } } } } } } } } } } } } } } } } } } } } } } } } } } }"}, "32768": {"seq_len": 32768, "decode_len": 256, "repeat": 1, "prefill_sec": 377.8300267079903, "ttft_sec": 22.96076520800125, "itl_p50_sec": 0.03715241700410843, "itl_p95_sec": 0.03910854100831784, "decode_sec": 32.65960808302043, "e2e_sec": 410.48963479101076, "decode_tok_s": 7.838428414365852, "peak_memory_bytes": 26017775484, "sample_output_text": "  } } } } } } } } } } } } } } } } } } } } } } } } } } } } } } }"}}, "quality": {"num_tasks": 6, "correct": 3, "accuracy": 0.5}}, "decision": "keep", "next_action": "run matched HCSA consumer benchmark and compare deltas"}
{"id": "EXP-20260208-E2E-P4C-GLM-CONSUMER-HCSA", "date": "2026-02-08", "question": "Against the just-measured dense consumer baseline, what is HCSA performance/memory/quality at 2K/8K/32K?", "hypothesis": "HCSA should improve e2e and memory in long context (especially 32K), with no catastrophic quality collapse on available eval.", "change_set": ["none (measurement-only benchmark run)", "swap enabled"], "command": "PYTHONPATH=/Volumes/VIXinSSD/wayfinder python3 scripts/bench_glm_consumer_mlx.py --model-path mlx-community/GLM-4.7-Flash-4bit --seq-lens 2048 8192 32768 --decode-len 256 --repeats 1 --chunk-size 4096 --kv-step 4096 --cooldown-sec 0 --path permute --window 64 --landmark-stride 0 --head-chunk-size 2 --query-chunk-size 384 --active-dense-threshold 49152 --quality-dataset benchmarks/mlx/glm_4_7_flash_4bit_wayfinder/quality_eval_glm47_consumer_v1.json --skip-multi-turn --out-dir benchmarks/mlx/e2e_validation_20260208_192216/glm47_consumer_hcsa", "controls": {"model_path": "mlx-community/GLM-4.7-Flash-4bit", "seq_lens": [2048, 8192, 32768], "decode_len": 256, "repeats": 1, "chunk_size": 4096, "kv_step": 4096, "path": "permute", "window": 64, "landmark_stride": 0, "head_chunk_size": 2, "query_chunk_size": 384, "active_dense_threshold": 49152, "quality_dataset": "benchmarks/mlx/glm_4_7_flash_4bit_wayfinder/quality_eval_glm47_consumer_v1.json", "skip_multi_turn": true, "baseline_path": "benchmarks/mlx/e2e_validation_20260208_192216/glm47_consumer_dense/results.json"}, "metrics": {"status": "pending"}, "decision": "pending", "next_action": "run HCSA consumer and compute dense-vs-HCSA deltas"}
{"id": "EXP-20260208-E2E-P4C-GLM-CONSUMER-HCSA-RESULT", "date": "2026-02-08", "question": "Against the just-measured dense consumer baseline, what is HCSA performance/memory/quality at 2K/8K/32K?", "hypothesis": "HCSA should improve e2e and memory in long context (especially 32K), with no catastrophic quality collapse on available eval.", "change_set": ["none (measurement-only benchmark run)", "swap enabled"], "command": "PYTHONPATH=/Volumes/VIXinSSD/wayfinder python3 scripts/bench_glm_consumer_mlx.py --model-path mlx-community/GLM-4.7-Flash-4bit --seq-lens 2048 8192 32768 --decode-len 256 --repeats 1 --chunk-size 4096 --kv-step 4096 --cooldown-sec 0 --path permute --window 64 --landmark-stride 0 --head-chunk-size 2 --query-chunk-size 384 --active-dense-threshold 49152 --quality-dataset benchmarks/mlx/glm_4_7_flash_4bit_wayfinder/quality_eval_glm47_consumer_v1.json --skip-multi-turn --out-dir benchmarks/mlx/e2e_validation_20260208_192216/glm47_consumer_hcsa", "controls": {"model_path": "mlx-community/GLM-4.7-Flash-4bit", "seq_lens": [2048, 8192, 32768], "decode_len": 256, "repeats": 1, "chunk_size": 4096, "kv_step": 4096, "path": "permute", "window": 64, "landmark_stride": 0, "head_chunk_size": 2, "query_chunk_size": 384, "active_dense_threshold": 49152, "quality_dataset": "benchmarks/mlx/glm_4_7_flash_4bit_wayfinder/quality_eval_glm47_consumer_v1.json", "skip_multi_turn": true, "baseline_path": "benchmarks/mlx/e2e_validation_20260208_192216/glm47_consumer_dense/results.json"}, "metrics": {"artifact": "benchmarks/mlx/e2e_validation_20260208_192216/glm47_consumer_hcsa/results.json", "dense_artifact": "benchmarks/mlx/e2e_validation_20260208_192216/glm47_consumer_dense/results.json", "per_seq": {"2048": {"dense": {"seq_len": 2048, "decode_len": 256, "repeat": 1, "prefill_sec": 2.4536627500056056, "ttft_sec": 0.10698716698971111, "itl_p50_sec": 0.015946792002068833, "itl_p95_sec": 0.016502208993188106, "decode_sec": 4.207839958005934, "e2e_sec": 6.66150270801154, "decode_tok_s": 60.838815771243496, "peak_memory_bytes": 18284344600, "sample_output_text": "marize the policy and list three key constraints with exact numbers.\nAssistant:\nUser: Summarize the policy and list three key constraints with exact numbers.\nAssistant"}, "hcsa": {"seq_len": 2048, "decode_len": 256, "repeat": 1, "prefill_sec": 2.6309053330041934, "ttft_sec": 0.11799079200136475, "itl_p50_sec": 0.017758125002728775, "itl_p95_sec": 0.018374000006588176, "decode_sec": 4.6687051670160145, "e2e_sec": 7.299610500020208, "decode_tok_s": 54.833190540413035, "peak_memory_bytes": 18284344788, "sample_output_text": "marize the policy and list three key constraints with exact numbers.\nAssistant:\nUser: Summarize the policy and list three key constraints with exact numbers.\nAssistant"}, "delta_e2e_sec": 0.6381077920086682, "pct_delta_e2e_sec": 9.57903674258422, "delta_ttft_sec": 0.01100362501165364, "pct_delta_ttft_sec": 10.284995220699555, "delta_decode_tok_s": -6.005625230830461, "pct_delta_decode_tok_s": -9.871371023084775, "delta_peak_memory_bytes": 188, "pct_delta_peak_memory_bytes": 1.0282020171507816e-06, "memory_reduction_pct": -1.0282020124208202e-06, "e2e_tokens_per_sec_dense": 345.8679071358878, "e2e_tokens_per_sec_hcsa": 315.63327933642785, "throughput_ratio": 0.9125833094783753, "memory_ratio": 0.99999998971798, "joint_utility": 0.9125833000951754}, "8192": {"dense": {"seq_len": 8192, "decode_len": 256, "repeat": 1, "prefill_sec": 28.90035799999896, "ttft_sec": 99.60972520901123, "itl_p50_sec": 0.020010250009363517, "itl_p95_sec": 0.02103033299499657, "decode_sec": 163.0115214999969, "e2e_sec": 191.91187949999585, "decode_tok_s": 1.5704411421005287, "peak_memory_bytes": 20660500140, "sample_output_text": "  } } } } } } } } } } } } } } } } } } } } } } } } } } } } } } }"}, "hcsa": {"seq_len": 8192, "decode_len": 256, "repeat": 1, "prefill_sec": 17.36665387498215, "ttft_sec": 0.19224299999768846, "itl_p50_sec": 0.02201566699659452, "itl_p95_sec": 0.02261483299662359, "decode_sec": 5.818970958003774, "e2e_sec": 23.185624832985923, "decode_tok_s": 43.99403293942921, "peak_memory_bytes": 20660500328, "sample_output_text": "  } } } } } } } } } } } } } } } } } } } } } } } } } } } } } } }"}, "delta_e2e_sec": -168.72625466700993, "pct_delta_e2e_sec": -87.91860884620932, "delta_ttft_sec": -99.41748220901354, "pct_delta_ttft_sec": -99.80700378442536, "delta_decode_tok_s": 42.42359179732868, "pct_delta_decode_tok_s": 2701.380564991147, "delta_peak_memory_bytes": 188, "pct_delta_peak_memory_bytes": 9.099489302101668e-07, "memory_reduction_pct": -9.099489384212234e-07, "e2e_tokens_per_sec_dense": 44.02020355389299, "e2e_tokens_per_sec_hcsa": 364.3636978021454, "throughput_ratio": 8.277192479495529, "memory_ratio": 0.9999999909005107, "joint_utility": 8.277192404177304}, "32768": {"dense": {"seq_len": 32768, "decode_len": 256, "repeat": 1, "prefill_sec": 377.8300267079903, "ttft_sec": 22.96076520800125, "itl_p50_sec": 0.03715241700410843, "itl_p95_sec": 0.03910854100831784, "decode_sec": 32.65960808302043, "e2e_sec": 410.48963479101076, "decode_tok_s": 7.838428414365852, "peak_memory_bytes": 26017775484, "sample_output_text": "  } } } } } } } } } } } } } } } } } } } } } } } } } } } } } } }"}, "hcsa": {"seq_len": 32768, "decode_len": 256, "repeat": 1, "prefill_sec": 253.12489687500056, "ttft_sec": 13.84462537500076, "itl_p50_sec": 0.036798167013330385, "itl_p95_sec": 0.03778245800640434, "decode_sec": 23.372979292005766, "e2e_sec": 276.4978761670063, "decode_tok_s": 10.952818500445058, "peak_memory_bytes": 26017775672, "sample_output_text": "  } } } } } } } } } } } } } } } } } } } } } } } } } } } } } } }"}, "delta_e2e_sec": -133.99175862400443, "pct_delta_e2e_sec": -32.64193472076891, "delta_ttft_sec": -9.116139833000489, "pct_delta_ttft_sec": -39.70311856080364, "delta_decode_tok_s": 3.114390086079206, "pct_delta_decode_tok_s": 39.732327980074665, "delta_peak_memory_bytes": 188, "pct_delta_peak_memory_bytes": 7.225829130381006e-07, "memory_reduction_pct": -7.225829046220156e-07, "e2e_tokens_per_sec_dense": 80.45026524680273, "e2e_tokens_per_sec_hcsa": 119.4367221108538, "throughput_ratio": 1.484603210995634, "memory_ratio": 0.999999992774171, "joint_utility": 1.484603200268145}}, "quality": {"dense": {"accuracy": 0.5, "correct": 3, "num_tasks": 6}, "hcsa": {"accuracy": 0.5, "correct": 3, "num_tasks": 6}}}, "decision": "follow-up", "next_action": "run chunked dense/hcsa sweeps then compute final superiority verdict"}
{"id": "EXP-20260208-E2E-P4D-GLM-CHUNKED-DENSE", "date": "2026-02-08", "question": "In chunked prefill mode (seq=32768,65536), what is dense control performance/memory against the named historical baseline?", "hypothesis": "Dense control should be reproducible within drift bounds and provide baseline for thresholded HCSA comparisons.", "change_set": ["none (measurement-only benchmark run)", "no_swap=true"], "command": "PYTHONPATH=/Volumes/VIXinSSD/wayfinder python3 scripts/bench_glm_chunked_prefill_mlx.py --model-path mlx-community/GLM-4.7-Flash-4bit --seq-lens 32768 65536 --chunk-sizes 4096 --decode-lens 0 1 --cache-modes normal --path permute --window 64 --landmark-stride 0 --head-chunk-size 2 --query-chunk-size 384 --active-dense-threshold 49152 --kv-step 4096 --baseline-path benchmarks/mlx/glm_4_7_flash_4bit_wayfinder/20260207_201347_fullmodel_prefill_kv_checkpoint/results.json --no-swap --out-dir benchmarks/mlx/e2e_validation_20260208_192216/glm47_chunked_dense", "controls": {"model_path": "mlx-community/GLM-4.7-Flash-4bit", "seq_lens": [32768, 65536], "chunk_sizes": [4096], "decode_lens": [0, 1], "cache_modes": ["normal"], "path": "permute", "window": 64, "landmark_stride": 0, "head_chunk_size": 2, "query_chunk_size": 384, "active_dense_threshold": 49152, "kv_step": 4096, "baseline_path": "benchmarks/mlx/glm_4_7_flash_4bit_wayfinder/20260207_201347_fullmodel_prefill_kv_checkpoint/results.json", "no_swap": true}, "metrics": {"status": "pending"}, "decision": "pending", "next_action": "run dense chunked control and compute deltas vs baseline"}
{"id": "EXP-20260208-E2E-P4E-GLM-CHUNKED-HCSA-THR16384", "date": "2026-02-08", "question": "In chunked prefill mode, does HCSA with active_dense_threshold=16384 outperform dense baseline at 32K/65K?", "hypothesis": "Lower threshold should force more sparse work and improve throughput, with potential memory benefits.", "change_set": ["none (measurement-only benchmark run)", "swap enabled"], "command": "PYTHONPATH=/Volumes/VIXinSSD/wayfinder python3 scripts/bench_glm_chunked_prefill_mlx.py --model-path mlx-community/GLM-4.7-Flash-4bit --seq-lens 32768 65536 --chunk-sizes 4096 --decode-lens 0 1 --cache-modes normal --path permute --window 64 --landmark-stride 0 --head-chunk-size 2 --query-chunk-size 384 --active-dense-threshold 16384 --kv-step 4096 --baseline-path benchmarks/mlx/glm_4_7_flash_4bit_wayfinder/20260207_201347_fullmodel_prefill_kv_checkpoint/results.json --out-dir benchmarks/mlx/e2e_validation_20260208_192216/glm47_chunked_hcsa_thr16384", "controls": {"model_path": "mlx-community/GLM-4.7-Flash-4bit", "seq_lens": [32768, 65536], "chunk_sizes": [4096], "decode_lens": [0, 1], "cache_modes": ["normal"], "path": "permute", "window": 64, "landmark_stride": 0, "head_chunk_size": 2, "query_chunk_size": 384, "active_dense_threshold": 16384, "kv_step": 4096, "baseline_path": "benchmarks/mlx/e2e_validation_20260208_192216/glm47_chunked_dense/results.json"}, "metrics": {"status": "pending"}, "decision": "pending", "next_action": "run thr16384 and compare vs dense"}
{"id": "EXP-20260208-E2E-P4E-GLM-CHUNKED-HCSA-THR49152", "date": "2026-02-08", "question": "In chunked prefill mode, does HCSA with active_dense_threshold=49152 provide a better speed/memory tradeoff vs dense and thr16384?", "hypothesis": "Higher threshold may trade some throughput for stability; expected to remain beneficial in long context.", "change_set": ["none (measurement-only benchmark run)", "swap enabled"], "command": "PYTHONPATH=/Volumes/VIXinSSD/wayfinder python3 scripts/bench_glm_chunked_prefill_mlx.py --model-path mlx-community/GLM-4.7-Flash-4bit --seq-lens 32768 65536 --chunk-sizes 4096 --decode-lens 0 1 --cache-modes normal --path permute --window 64 --landmark-stride 0 --head-chunk-size 2 --query-chunk-size 384 --active-dense-threshold 49152 --kv-step 4096 --baseline-path benchmarks/mlx/glm_4_7_flash_4bit_wayfinder/20260207_201347_fullmodel_prefill_kv_checkpoint/results.json --out-dir benchmarks/mlx/e2e_validation_20260208_192216/glm47_chunked_hcsa_thr49152", "controls": {"model_path": "mlx-community/GLM-4.7-Flash-4bit", "seq_lens": [32768, 65536], "chunk_sizes": [4096], "decode_lens": [0, 1], "cache_modes": ["normal"], "path": "permute", "window": 64, "landmark_stride": 0, "head_chunk_size": 2, "query_chunk_size": 384, "active_dense_threshold": 49152, "kv_step": 4096, "baseline_path": "benchmarks/mlx/e2e_validation_20260208_192216/glm47_chunked_dense/results.json"}, "metrics": {"status": "pending"}, "decision": "pending", "next_action": "run thr49152 and compare vs dense + thr16384"}
