{"id":"EXP-20260218T151213Z-FIRST-RUN-DENSE-SANITY-RESULT","date":"2026-02-18","question":"Does the README first successful run dense command execute cleanly and produce expected artifacts for a new user?","hypothesis":"The documented dense sanity command at T=2048 decode_len=8 will complete with a usable single_turn row and results.json output under first_release artifacts.","change_set":["measurement only"],"command":"python3 scripts/bench_glm_consumer_mlx.py --mode dense --seq-lens 2048 --decode-len 8 --repeats 1 --skip-multi-turn --skip-quality --out-dir benchmarks/mlx/first_release/first_run_dense_t2048","controls":{"model":"mlx-community/GLM-4.7-Flash-4bit","mode":"dense","seq_len":2048,"decode_len":8,"repeats":1,"skip_multi_turn":true,"skip_quality":true,"retro_backfill_inference":"off","one_process_at_a_time":true},"metrics":{"status":"completed","results":"benchmarks/mlx/first_release/first_run_dense_t2048/results.json","single_turn":{"e2e_sec":3.4232085830008145,"prefill_sec":2.6489613330049906,"decode_sec":0.774247249995824,"decode_tok_s":10.332616615742774,"peak_memory_bytes":18284344600,"ttft_sec":0.6606242089983425,"itl_p95_sec":0.016759417005232535,"path_counts":{"dense":9},"dense_fallback_reason_counts":{},"dense_fallback_share_run":0.0}},"decision":"keep","next_action":"Keep the command in README as the first successful run sanity check."}
{"id":"EXP-20260218T183512Z-GLM47-TOKENLEN-SWEEP-PRERUN","date":"2026-02-18","question":"Across GLM-4.7 token lengths T={2048,8192,32768,65536}, how does wayfinder compare to dense on single-turn latency, decode throughput, and peak memory under release-safe controls?","hypothesis":"Wayfinder will keep stronger prefill gains at larger T, decode throughput will remain near-dense due to dense decode routing, and peak memory will be modestly lower than dense.","change_set":["measurement only"],"command":"python3 scripts/bench_glm_consumer_mlx.py --model-path mlx-community/GLM-4.7-Flash-4bit --mode dense --seq-lens 2048 8192 32768 65536 --decode-len 32 --repeats 1 --chunk-size 4096 --kv-step 4096 --cooldown-sec 0 --skip-multi-turn --skip-quality --out-dir benchmarks/mlx/first_release/EXP-20260218T183512Z-GLM47-TOKENLEN-SWEEP/dense && python3 scripts/bench_glm_consumer_mlx.py --model-path mlx-community/GLM-4.7-Flash-4bit --mode wayfinder --seq-lens 2048 8192 32768 65536 --decode-len 32 --repeats 1 --chunk-size 4096 --kv-step 4096 --cooldown-sec 0 --window 64 --head-chunk-size 2 --query-chunk-size 384 --skip-multi-turn --skip-quality --out-dir benchmarks/mlx/first_release/EXP-20260218T183512Z-GLM47-TOKENLEN-SWEEP/wayfinder","controls":{"model":"mlx-community/GLM-4.7-Flash-4bit","entrypoint":"scripts/bench_glm_consumer_mlx.py","seq_lens":[2048,8192,32768,65536],"decode_len":32,"repeats":1,"skip_multi_turn":true,"skip_quality":true,"chunk_size":4096,"kv_step":4096,"cooldown_sec":0,"window":64,"head_chunk_size":2,"query_chunk_size":384,"retro_backfill_inference":"off","one_process_at_a_time":true,"baseline_paths":{"paired_dense":"benchmarks/mlx/first_release/EXP-20260218T183512Z-GLM47-TOKENLEN-SWEEP/dense/results.json","prior_release_8192":"benchmarks/mlx/first_release/EXP-20260218T151213Z-STABLE-PROFILE/stable_profile_summary.json"},"stop_gates":["nonzero exit","missing results.json","missing usable single_turn row for any target T"]},"metrics":{"status":"pending","required":["per_T dense.e2e_sec","per_T wayfinder.e2e_sec","per_T delta_e2e_abs","per_T delta_e2e_pct","per_T dense.prefill_sec","per_T wayfinder.prefill_sec","per_T delta_prefill_abs","per_T delta_prefill_pct","per_T dense.decode_sec","per_T wayfinder.decode_sec","per_T delta_decode_abs","per_T delta_decode_pct","per_T dense.decode_tok_s","per_T wayfinder.decode_tok_s","per_T delta_decode_tok_s_abs","per_T delta_decode_tok_s_pct","per_T dense.peak_memory_bytes","per_T wayfinder.peak_memory_bytes","per_T memory_reduction_pct_convention=100*(1-wayfinder/dense)"]},"decision":"pending","next_action":"Run dense+wayfinder sweep, compute per-token-length deltas vs paired dense baseline, and update README with measured multi-length table."}
{"id":"EXP-20260218T183512Z-GLM47-TOKENLEN-SWEEP-RESULT","date":"2026-02-18","question":"Across GLM-4.7 token lengths T={2048,8192,32768,65536}, how does wayfinder compare to dense on single-turn latency, decode throughput, and peak memory under release-safe controls?","hypothesis":"Wayfinder will keep stronger prefill gains at larger T, decode throughput will remain near-dense due to dense decode routing, and peak memory will be modestly lower than dense.","change_set":["measurement only","README.md: add follow-up token-length benchmark chart and artifact links"],"command":"python3 scripts/bench_glm_consumer_mlx.py --model-path mlx-community/GLM-4.7-Flash-4bit --mode dense --seq-lens 2048 8192 32768 --decode-len 32 --repeats 1 --chunk-size 4096 --kv-step 4096 --cooldown-sec 0 --skip-multi-turn --skip-quality --out-dir benchmarks/mlx/first_release/EXP-20260218T183512Z-GLM47-TOKENLEN-SWEEP/dense && python3 scripts/bench_glm_consumer_mlx.py --model-path mlx-community/GLM-4.7-Flash-4bit --mode wayfinder --seq-lens 2048 8192 32768 --decode-len 32 --repeats 1 --chunk-size 4096 --kv-step 4096 --cooldown-sec 0 --window 64 --head-chunk-size 2 --query-chunk-size 384 --skip-multi-turn --skip-quality --out-dir benchmarks/mlx/first_release/EXP-20260218T183512Z-GLM47-TOKENLEN-SWEEP/wayfinder && gtimeout 1800 python3 scripts/bench_glm_consumer_mlx.py --model-path mlx-community/GLM-4.7-Flash-4bit --mode dense --seq-lens 65536 --decode-len 32 --repeats 1 --chunk-size 4096 --kv-step 4096 --cooldown-sec 0 --skip-multi-turn --skip-quality --out-dir benchmarks/mlx/first_release/EXP-20260218T183512Z-GLM47-TOKENLEN-SWEEP/dense_t65536 && gtimeout 1800 python3 scripts/bench_glm_consumer_mlx.py --model-path mlx-community/GLM-4.7-Flash-4bit --mode wayfinder --seq-lens 65536 --decode-len 32 --repeats 1 --chunk-size 4096 --kv-step 4096 --cooldown-sec 0 --window 64 --head-chunk-size 2 --query-chunk-size 384 --skip-multi-turn --skip-quality --out-dir benchmarks/mlx/first_release/EXP-20260218T183512Z-GLM47-TOKENLEN-SWEEP/wayfinder_t65536","controls":{"model":"mlx-community/GLM-4.7-Flash-4bit","entrypoint":"scripts/bench_glm_consumer_mlx.py","seq_lens":[2048,8192,32768,65536],"decode_len":32,"repeats":1,"skip_multi_turn":true,"skip_quality":true,"chunk_size":4096,"kv_step":4096,"cooldown_sec":0,"window":64,"head_chunk_size":2,"query_chunk_size":384,"retro_backfill_inference":"off","one_process_at_a_time":true,"baseline_paths":{"paired_dense":"benchmarks/mlx/first_release/EXP-20260218T183512Z-GLM47-TOKENLEN-SWEEP/dense/results.json","paired_dense_65536":"benchmarks/mlx/first_release/EXP-20260218T183512Z-GLM47-TOKENLEN-SWEEP/dense_t65536/results.json","prior_release_8192":"benchmarks/mlx/first_release/EXP-20260218T151213Z-STABLE-PROFILE/stable_profile_summary.json"}},"metrics":{"status":"completed","dense_partial_full_sweep_run":{"status":"interrupted_at_T65536","artifact":"benchmarks/mlx/first_release/EXP-20260218T183512Z-GLM47-TOKENLEN-SWEEP/dense/results.json","completed_seq_lens":[2048,8192,32768]},"dense_65536_isolated":{"status":"completed","artifact":"benchmarks/mlx/first_release/EXP-20260218T183512Z-GLM47-TOKENLEN-SWEEP/dense_t65536/results.json","e2e_sec":990.0789377089823,"prefill_sec":961.6473680419736,"decode_sec":28.431569667008706,"decode_tok_s":1.1255087639697552,"peak_memory_bytes":33160809276},"wayfinder_65536_isolated":{"status":"completed","artifact":"benchmarks/mlx/first_release/EXP-20260218T183512Z-GLM47-TOKENLEN-SWEEP/wayfinder_t65536/results.json","e2e_sec":268.3589956659705,"prefill_sec":264.45407679100754,"decode_sec":3.904918874962954,"decode_tok_s":8.194791926840852,"peak_memory_bytes":23795994534},"per_t":{"2048":{"dense":{"e2e_sec":3.1354244999976363,"prefill_sec":2.4643814999947795,"decode_sec":0.6710430000028568,"decode_tok_s":47.68693514919262,"peak_memory_bytes":18284344600},"wayfinder":{"e2e_sec":2.5830743330002297,"prefill_sec":2.0189054580058446,"decode_sec":0.5641688749943851,"decode_tok_s":56.72057612980156,"peak_memory_bytes":18318769672},"delta_wayfinder_vs_dense_pct":{"e2e_sec":-17.617310261716188,"prefill_sec":-18.07601730704098,"decode_sec":-15.9267120770095,"decode_tok_s":18.943807407565496,"peak_memory_bytes":0.18828148631632027},"memory_reduction_pct_convention":-0.1882814863163232},"8192":{"dense":{"e2e_sec":16.897831583002873,"prefill_sec":16.07446666600334,"decode_sec":0.8233649169995338,"decode_tok_s":38.86492386332942,"peak_memory_bytes":20660500140},"wayfinder":{"e2e_sec":9.381945833002857,"prefill_sec":8.649114791007945,"decode_sec":0.7328310419949129,"decode_tok_s":43.66629674624177,"peak_memory_bytes":20071482232},"delta_wayfinder_vs_dense_pct":{"e2e_sec":-44.481293588645924,"prefill_sec":-46.19254783066036,"decode_sec":-10.995751450402241,"decode_tok_s":12.353247211953225,"peak_memory_bytes":-2.8509373152086726},"memory_reduction_pct_convention":2.850937315208668},"32768":{"dense":{"e2e_sec":203.30192520900164,"prefill_sec":193.35504437499912,"decode_sec":9.946880834002513,"decode_tok_s":3.21708890797313,"peak_memory_bytes":26017775484},"wayfinder":{"e2e_sec":112.09598266601143,"prefill_sec":110.75781079198373,"decode_sec":1.3381718740276992,"decode_tok_s":23.913218553186755,"peak_memory_bytes":21978678158},"delta_wayfinder_vs_dense_pct":{"e2e_sec":-44.862115023575264,"prefill_sec":-42.71710147326489,"decode_sec":-86.5472329508368,"decode_tok_s":643.3194490641865,"peak_memory_bytes":-15.52493595000067},"memory_reduction_pct_convention":15.52493595000067},"65536":{"dense":{"e2e_sec":990.0789377089823,"prefill_sec":961.6473680419736,"decode_sec":28.431569667008706,"decode_tok_s":1.1255087639697552,"peak_memory_bytes":33160809276},"wayfinder":{"e2e_sec":268.3589956659705,"prefill_sec":264.45407679100754,"decode_sec":3.904918874962954,"decode_tok_s":8.194791926840852,"peak_memory_bytes":23795994534},"delta_wayfinder_vs_dense_pct":{"e2e_sec":-72.89509225009548,"prefill_sec":-72.50079069083849,"decode_sec":-86.26505046820427,"decode_tok_s":628.1038074030994,"peak_memory_bytes":-28.24023991626176},"memory_reduction_pct_convention":28.24023991626176}},"summary_artifacts":{"json":"benchmarks/mlx/first_release/EXP-20260218T183512Z-GLM47-TOKENLEN-SWEEP/token_length_summary.json","md":"benchmarks/mlx/first_release/EXP-20260218T183512Z-GLM47-TOKENLEN-SWEEP/token_length_summary.md"}},"decision":"keep","next_action":"Publish the follow-up token-length chart in README with links to run artifacts; keep T=8192 stable profile as the official validated default while treating this as scaling evidence."}
{"id":"EXP-20260219T032934Z-GLM47-FALSIFY-VALIDATE-PRERUN","date":"2026-02-19","question":"Under strict paired controls and OOM-safe limits, do Wayfinder gains hold with low variance, acceptable quality, and auditable fallback behavior?","hypothesis":"At T=8192 and T=32768, wayfinder retains >=10% prefill gain vs dense, keeps peak memory <= +5% vs dense and below absolute safety cap, and quality drift on the 6-task set is <= 1 task.","change_set":["measurement only"],"command":"(1) seeds 42,7,99: dense+wayfinder at T=8192 decode_len=32 skip_multi_turn skip_quality; (2) dense+wayfinder at T=32768 decode_len=32 skip_multi_turn skip_quality; (3) dense+wayfinder quality-only at T=8192 on quality_eval_glm47_consumer_v1.json","controls":{"model":"mlx-community/GLM-4.7-Flash-4bit","entrypoint":"scripts/bench_glm_consumer_mlx.py","run_root":"benchmarks/mlx/first_release/EXP-20260219T032934Z-GLM47-FALSIFY-VALIDATE","seq_lens":{"variance":[8192],"falsification":[32768],"quality":[8192]},"decode_len":32,"repeats":1,"chunk_size":4096,"kv_step":4096,"cooldown_sec":0,"skip_multi_turn":true,"wayfinder":{"window":64,"head_chunk_size":2,"query_chunk_size":384,"landmark_stride":"off"},"retro_backfill_inference":"off","quality_dataset":"benchmarks/mlx/glm_4_7_flash_4bit_wayfinder/quality_eval_glm47_consumer_v1.json","seeds":[42,7,99],"one_process_at_a_time":true,"baseline_paths":{"stable_profile":"benchmarks/mlx/first_release/EXP-20260218T151213Z-STABLE-PROFILE/stable_profile_summary.json","tokenlen_followup":"benchmarks/mlx/first_release/EXP-20260218T183512Z-GLM47-TOKENLEN-SWEEP/token_length_summary.json"},"stop_gates":["nonzero exit","missing results.json","missing usable single_turn row","dense path contamination","observability fallback share unknown","wayfinder prefill fallback > 0","prefill gain < 10%","wayfinder peak > dense peak * 1.05","absolute peak > 28GB safety cap","quality drift > 1/6 vs dense"]},"metrics":{"status":"pending","required":["per_run single_turn.e2e_sec","per_run single_turn.prefill_sec","per_run single_turn.decode_sec","per_run single_turn.decode_tok_s","per_run single_turn.peak_memory_bytes","per_run path_counts","per_run dense_fallback_reason_counts","per_run dense_fallback_share_run","variance summary across 3 seeds at T=8192","paired deltas at T=32768","quality accuracy dense vs wayfinder","quality delta tasks and percent","gate verdicts"]},"decision":"pending","next_action":"Execute sequential queue, evaluate stop-gates, and append RESULT entry with full deltas and keep/revert/follow-up decision."}
{"id":"EXP-20260219T032934Z-GLM47-MASK-ABLATION-PRERUN","date":"2026-02-19","question":"At T=8192, which mask ingredients drive speed/memory changes: window-only, cycle-only, or full HCSA?","hypothesis":"Full HCSA and cycle-only should outperform window-only on attention-stage throughput while staying within memory safety bounds.","change_set":["measurement only"],"command":"gtimeout 1800 python3 scripts/bench_glm_wayfinder_mlx.py --model-path mlx-community/GLM-4.7-Flash-4bit --seq-lens 8192 --batch 1 --warmup 1 --iters 1 --path permute --full-swap --window 64 --num-cycles 0 --landmark-stride 0 --allow-non-hamiltonian --out-dir benchmarks/mlx/first_release/EXP-20260219T032934Z-GLM47-MASK-ABLATION/window_only && gtimeout 1800 python3 scripts/bench_glm_wayfinder_mlx.py --model-path mlx-community/GLM-4.7-Flash-4bit --seq-lens 8192 --batch 1 --warmup 1 --iters 1 --path permute --full-swap --window 0 --num-cycles 1 --landmark-stride 0 --out-dir benchmarks/mlx/first_release/EXP-20260219T032934Z-GLM47-MASK-ABLATION/cycle_only && gtimeout 1800 python3 scripts/bench_glm_wayfinder_mlx.py --model-path mlx-community/GLM-4.7-Flash-4bit --seq-lens 8192 --batch 1 --warmup 1 --iters 1 --path permute --full-swap --window 64 --num-cycles 1 --landmark-stride 64 --out-dir benchmarks/mlx/first_release/EXP-20260219T032934Z-GLM47-MASK-ABLATION/full_hcsa","controls":{"model":"mlx-community/GLM-4.7-Flash-4bit","entrypoint":"scripts/bench_glm_wayfinder_mlx.py","seq_len":8192,"batch":1,"warmup":1,"iters":1,"path":"permute","full_swap":true,"variants":{"window_only":{"window":64,"num_cycles":0,"landmark_stride":0,"allow_non_hamiltonian":true},"cycle_only":{"window":0,"num_cycles":1,"landmark_stride":0},"full_hcsa":{"window":64,"num_cycles":1,"landmark_stride":64}},"one_process_at_a_time":true,"safety_cap_peak_memory_bytes":28000000000,"stop_gates":["nonzero exit","missing results.json","missing usable row for seq_len=8192","peak memory over safety cap"]},"metrics":{"status":"pending","required":["per_variant baseline_attention.tokens_per_sec","per_variant wayfinder_attention.tokens_per_sec","per_variant baseline_attention.peak_memory_bytes","per_variant wayfinder_attention.peak_memory_bytes","delta vs window_only","delta vs full_hcsa"]},"decision":"pending","next_action":"Run three variants and append RESULT entry with throughput/memory comparison and keep/revert/follow-up decision."}
{"id":"EXP-20260219T032934Z-GLM47-FALSIFY-VALIDATE-RESULT","date":"2026-02-19","question":"Under strict paired controls and OOM-safe limits, do Wayfinder gains hold with low variance, acceptable quality, and auditable fallback behavior?","hypothesis":"At T=8192 and T=32768, wayfinder retains >=10% prefill gain vs dense, keeps peak memory <= +5% vs dense and below absolute safety cap, and quality drift on the 6-task set is <= 1 task.","change_set":["measurement only"],"command":"Sequential queue under benchmarks/mlx/first_release/EXP-20260219T032934Z-GLM47-FALSIFY-VALIDATE: seeds 42/7/99 dense+wayfinder at T=8192, dense+wayfinder at T=32768, then quality-only dense+wayfinder on quality_eval_glm47_consumer_v1.json.","controls":{"model":"mlx-community/GLM-4.7-Flash-4bit","entrypoint":"scripts/bench_glm_consumer_mlx.py","run_root":"benchmarks/mlx/first_release/EXP-20260219T032934Z-GLM47-FALSIFY-VALIDATE","decode_len":32,"repeats":1,"chunk_size":4096,"kv_step":4096,"cooldown_sec":0,"skip_multi_turn":true,"wayfinder":{"window":64,"head_chunk_size":2,"query_chunk_size":384,"landmark_stride":"off"},"quality_dataset":"benchmarks/mlx/glm_4_7_flash_4bit_wayfinder/quality_eval_glm47_consumer_v1.json","seeds":[42,7,99],"retro_backfill_inference":"off","one_process_at_a_time":true,"safety_cap_peak_memory_bytes":28000000000},"metrics":{"status":"completed","summary_artifact":"benchmarks/mlx/first_release/EXP-20260219T032934Z-GLM47-FALSIFY-VALIDATE/falsification_summary.json","t8192_aggregate":{"e2e_delta_pct_mean":-36.22732740769314,"e2e_delta_pct_stdev":3.9554539357573154,"prefill_delta_pct_mean":-39.43421121687466,"prefill_delta_pct_stdev":1.715086331761062,"decode_delta_pct_mean":31.09121548689575,"decode_delta_pct_stdev":53.002150363232225,"decode_tok_s_delta_pct_mean":-12.175786664632652,"decode_tok_s_delta_pct_stdev":28.88565290952917,"memory_reduction_pct_convention_mean":2.850937315208668},"t32768_pair":{"delta_wayfinder_vs_dense_pct":{"e2e_sec":-64.07861913914746,"prefill_sec":-61.907650746836305,"decode_sec":-86.8638207965523,"decode_tok_s":661.0102504958929,"peak_memory_bytes":-15.52493595000067},"memory_reduction_pct_convention":15.52493595000067},"quality_gate":{"dense":{"num_tasks":6,"correct":3,"accuracy":0.5},"wayfinder":{"num_tasks":6,"correct":3,"accuracy":0.5},"delta":{"accuracy_abs":0.0,"task_count_delta":0}},"gate_violations":["T32768_seed42: strict fallback reasons non-informative"],"gate_passed":false},"decision":"follow-up","next_action":"Treat performance and quality gates as passed but keep strict path-audit as open until wayfinder decode dense-fallback reasons are emitted as informative labels (not 'unspecified')."}
{"id":"EXP-20260219T032934Z-GLM47-MASK-ABLATION-RESULT","date":"2026-02-19","question":"At T=8192, which mask ingredients drive speed/memory changes: window-only, cycle-only, or full HCSA?","hypothesis":"Full HCSA and cycle-only should outperform window-only on attention-stage throughput while staying within memory safety bounds.","change_set":["measurement only"],"command":"gtimeout 1800 python3 scripts/bench_glm_wayfinder_mlx.py ... (window_only, cycle_only, full_hcsa variants at T=8192, iters=1, warmup=1, full-swap).","controls":{"model":"mlx-community/GLM-4.7-Flash-4bit","entrypoint":"scripts/bench_glm_wayfinder_mlx.py","run_root":"benchmarks/mlx/first_release/EXP-20260219T032934Z-GLM47-MASK-ABLATION","seq_len":8192,"batch":1,"warmup":1,"iters":1,"path":"permute","full_swap":true,"one_process_at_a_time":true,"safety_cap_peak_memory_bytes":28000000000},"metrics":{"status":"completed","summary_artifact":"benchmarks/mlx/first_release/EXP-20260219T032934Z-GLM47-MASK-ABLATION/mask_ablation_summary.json","variants":{"window_only":{"level_a_wayfinder_tokens_per_sec":105182.01025798949,"level_a_wayfinder_peak_memory_bytes":1186138668,"level_b_smoke_tokens_per_sec":11.9819240973913,"level_b_smoke_peak_memory_bytes":17356661108},"cycle_only":{"level_a_wayfinder_tokens_per_sec":121369.32998402359,"level_a_wayfinder_peak_memory_bytes":1175489072,"level_b_smoke_tokens_per_sec":10.050433743867628,"level_b_smoke_peak_memory_bytes":17355396984},"full_hcsa":{"level_a_wayfinder_tokens_per_sec":59386.06042150964,"level_a_wayfinder_peak_memory_bytes":1074268720,"level_b_smoke_tokens_per_sec":11.886232278637995,"level_b_smoke_peak_memory_bytes":17357336952}},"gate_violations":[],"gate_passed":true},"decision":"follow-up","next_action":"Do not treat this as consumer e2e evidence; if mask-component attribution is required, add num_cycles/window knobs to the consumer benchmark path and rerun paired e2e ablations."}
