{"id":"EXP-20260208-GLM65K-CF52DA4-TUNED-R01","date":"2026-02-08","question":"Reproduce tuned baseline run 1 in fresh session window.","hypothesis":"th=49152,q=384,h=2 will remain in the high-performance, low-variance regime versus chunked dense control.","change_set":["measurement only"],"command":"PYTHONPATH=. python3 scripts/bench_glm_chunked_prefill_mlx.py --model-path mlx-community/GLM-4.7-Flash-4bit --seq-lens 65536 --chunk-sizes 4096 --decode-lens 0 --cache-modes normal --path permute --window 64 --landmark-stride 0 --head-chunk-size 2 --kv-step 4096 --baseline-path benchmarks/mlx/glm_4_7_flash_4bit_wayfinder/20260207_201347_fullmodel_prefill_kv_checkpoint/results.json --active-dense-threshold 49152 --query-chunk-size 384 --out-dir benchmarks/mlx/glm_4_7_flash_4bit_wayfinder/20260208_glm65k_cf52da4_phase2_tuned_th49152_q384_h2_r01","controls":{"model":"mlx-community/GLM-4.7-Flash-4bit","seq_len":65536,"chunk_size":4096,"decode_len":0,"path":"permute","window":64,"landmark_stride":0,"head_chunk_size":2,"kv_step":4096,"retro_backfill_enabled":false,"baseline_path":"benchmarks/mlx/glm_4_7_flash_4bit_wayfinder/20260207_201347_fullmodel_prefill_kv_checkpoint/results.json"},"metrics":{"status":"pending"},"decision":"pending","next_action":"run benchmark and append result entry with absolute and delta metrics vs fresh baselines"}
{"id":"EXP-20260208-GLM65K-CF52DA4-TUNED-R02","date":"2026-02-08","question":"Reproduce tuned baseline run 2 in fresh session window.","hypothesis":"Second repeat should stay close to run 1 (low variance) and support stable medians.","change_set":["measurement only"],"command":"PYTHONPATH=. python3 scripts/bench_glm_chunked_prefill_mlx.py --model-path mlx-community/GLM-4.7-Flash-4bit --seq-lens 65536 --chunk-sizes 4096 --decode-lens 0 --cache-modes normal --path permute --window 64 --landmark-stride 0 --head-chunk-size 2 --kv-step 4096 --baseline-path benchmarks/mlx/glm_4_7_flash_4bit_wayfinder/20260207_201347_fullmodel_prefill_kv_checkpoint/results.json --active-dense-threshold 49152 --query-chunk-size 384 --out-dir benchmarks/mlx/glm_4_7_flash_4bit_wayfinder/20260208_glm65k_cf52da4_phase2_tuned_th49152_q384_h2_r02","controls":{"model":"mlx-community/GLM-4.7-Flash-4bit","seq_len":65536,"chunk_size":4096,"decode_len":0,"path":"permute","window":64,"landmark_stride":0,"head_chunk_size":2,"kv_step":4096,"retro_backfill_enabled":false,"baseline_path":"benchmarks/mlx/glm_4_7_flash_4bit_wayfinder/20260207_201347_fullmodel_prefill_kv_checkpoint/results.json"},"metrics":{"status":"pending"},"decision":"pending","next_action":"run benchmark and append result entry with absolute and delta metrics vs fresh baselines"}
{"id":"EXP-20260208-GLM65K-CF52DA4-DENSE-R01","date":"2026-02-08","question":"Reproduce chunked dense control run 1 in same session window.","hypothesis":"Chunked dense no-swap control remains materially slower than tuned HCSA while using more memory.","change_set":["measurement only"],"command":"PYTHONPATH=. python3 scripts/bench_glm_chunked_prefill_mlx.py --model-path mlx-community/GLM-4.7-Flash-4bit --seq-lens 65536 --chunk-sizes 4096 --decode-lens 0 --cache-modes normal --path permute --window 64 --landmark-stride 0 --head-chunk-size 2 --kv-step 4096 --baseline-path benchmarks/mlx/glm_4_7_flash_4bit_wayfinder/20260207_201347_fullmodel_prefill_kv_checkpoint/results.json --no-swap --out-dir benchmarks/mlx/glm_4_7_flash_4bit_wayfinder/20260208_glm65k_cf52da4_phase2_dense_noswap_r01","controls":{"model":"mlx-community/GLM-4.7-Flash-4bit","seq_len":65536,"chunk_size":4096,"decode_len":0,"path":"permute","window":64,"landmark_stride":0,"head_chunk_size":2,"kv_step":4096,"retro_backfill_enabled":false,"baseline_path":"benchmarks/mlx/glm_4_7_flash_4bit_wayfinder/20260207_201347_fullmodel_prefill_kv_checkpoint/results.json"},"metrics":{"status":"pending"},"decision":"pending","next_action":"run benchmark and append result entry with absolute and delta metrics vs fresh baselines"}
{"id":"EXP-20260208-GLM65K-CF52DA4-DENSE-R02","date":"2026-02-08","question":"Reproduce chunked dense control run 2 in same session window.","hypothesis":"Second dense control captures variance and enables robust median comparison.","change_set":["measurement only"],"command":"PYTHONPATH=. python3 scripts/bench_glm_chunked_prefill_mlx.py --model-path mlx-community/GLM-4.7-Flash-4bit --seq-lens 65536 --chunk-sizes 4096 --decode-lens 0 --cache-modes normal --path permute --window 64 --landmark-stride 0 --head-chunk-size 2 --kv-step 4096 --baseline-path benchmarks/mlx/glm_4_7_flash_4bit_wayfinder/20260207_201347_fullmodel_prefill_kv_checkpoint/results.json --no-swap --out-dir benchmarks/mlx/glm_4_7_flash_4bit_wayfinder/20260208_glm65k_cf52da4_phase2_dense_noswap_r02","controls":{"model":"mlx-community/GLM-4.7-Flash-4bit","seq_len":65536,"chunk_size":4096,"decode_len":0,"path":"permute","window":64,"landmark_stride":0,"head_chunk_size":2,"kv_step":4096,"retro_backfill_enabled":false,"baseline_path":"benchmarks/mlx/glm_4_7_flash_4bit_wayfinder/20260207_201347_fullmodel_prefill_kv_checkpoint/results.json"},"metrics":{"status":"pending"},"decision":"pending","next_action":"run benchmark and append result entry with absolute and delta metrics vs fresh baselines"}
{"id":"EXP-20260208-GLM65K-CF52DA4-TH47104-R01","date":"2026-02-08","question":"Retune threshold candidate 47104 with tuned q/h settings.","hypothesis":"Lowering threshold to 47104 may improve latency modestly but could increase variance.","change_set":["measurement only"],"command":"PYTHONPATH=. python3 scripts/bench_glm_chunked_prefill_mlx.py --model-path mlx-community/GLM-4.7-Flash-4bit --seq-lens 65536 --chunk-sizes 4096 --decode-lens 0 --cache-modes normal --path permute --window 64 --landmark-stride 0 --head-chunk-size 2 --kv-step 4096 --baseline-path benchmarks/mlx/glm_4_7_flash_4bit_wayfinder/20260207_201347_fullmodel_prefill_kv_checkpoint/results.json --active-dense-threshold 47104 --query-chunk-size 384 --out-dir benchmarks/mlx/glm_4_7_flash_4bit_wayfinder/20260208_glm65k_cf52da4_phase2_thresh47104_q384_h2_r01","controls":{"model":"mlx-community/GLM-4.7-Flash-4bit","seq_len":65536,"chunk_size":4096,"decode_len":0,"path":"permute","window":64,"landmark_stride":0,"head_chunk_size":2,"kv_step":4096,"retro_backfill_enabled":false,"baseline_path":"benchmarks/mlx/glm_4_7_flash_4bit_wayfinder/20260207_201347_fullmodel_prefill_kv_checkpoint/results.json"},"metrics":{"status":"pending"},"decision":"pending","next_action":"run benchmark and append result entry with absolute and delta metrics vs fresh baselines"}
{"id":"EXP-20260208-GLM65K-CF52DA4-TH49152-R03","date":"2026-02-08","question":"Retune threshold reference 49152 in same sweep window.","hypothesis":"49152 will remain strongest reproducible threshold once measured side-by-side with nearby thresholds.","change_set":["measurement only"],"command":"PYTHONPATH=. python3 scripts/bench_glm_chunked_prefill_mlx.py --model-path mlx-community/GLM-4.7-Flash-4bit --seq-lens 65536 --chunk-sizes 4096 --decode-lens 0 --cache-modes normal --path permute --window 64 --landmark-stride 0 --head-chunk-size 2 --kv-step 4096 --baseline-path benchmarks/mlx/glm_4_7_flash_4bit_wayfinder/20260207_201347_fullmodel_prefill_kv_checkpoint/results.json --active-dense-threshold 49152 --query-chunk-size 384 --out-dir benchmarks/mlx/glm_4_7_flash_4bit_wayfinder/20260208_glm65k_cf52da4_phase2_thresh49152_q384_h2_r03","controls":{"model":"mlx-community/GLM-4.7-Flash-4bit","seq_len":65536,"chunk_size":4096,"decode_len":0,"path":"permute","window":64,"landmark_stride":0,"head_chunk_size":2,"kv_step":4096,"retro_backfill_enabled":false,"baseline_path":"benchmarks/mlx/glm_4_7_flash_4bit_wayfinder/20260207_201347_fullmodel_prefill_kv_checkpoint/results.json"},"metrics":{"status":"pending"},"decision":"pending","next_action":"run benchmark and append result entry with absolute and delta metrics vs fresh baselines"}
{"id":"EXP-20260208-GLM65K-CF52DA4-TH51200-R01","date":"2026-02-08","question":"Retune threshold candidate 51200 with tuned q/h settings.","hypothesis":"Raising threshold to 51200 likely hurts latency due to denser late chunks.","change_set":["measurement only"],"command":"PYTHONPATH=. python3 scripts/bench_glm_chunked_prefill_mlx.py --model-path mlx-community/GLM-4.7-Flash-4bit --seq-lens 65536 --chunk-sizes 4096 --decode-lens 0 --cache-modes normal --path permute --window 64 --landmark-stride 0 --head-chunk-size 2 --kv-step 4096 --baseline-path benchmarks/mlx/glm_4_7_flash_4bit_wayfinder/20260207_201347_fullmodel_prefill_kv_checkpoint/results.json --active-dense-threshold 51200 --query-chunk-size 384 --out-dir benchmarks/mlx/glm_4_7_flash_4bit_wayfinder/20260208_glm65k_cf52da4_phase2_thresh51200_q384_h2_r01","controls":{"model":"mlx-community/GLM-4.7-Flash-4bit","seq_len":65536,"chunk_size":4096,"decode_len":0,"path":"permute","window":64,"landmark_stride":0,"head_chunk_size":2,"kv_step":4096,"retro_backfill_enabled":false,"baseline_path":"benchmarks/mlx/glm_4_7_flash_4bit_wayfinder/20260207_201347_fullmodel_prefill_kv_checkpoint/results.json"},"metrics":{"status":"pending"},"decision":"pending","next_action":"run benchmark and append result entry with absolute and delta metrics vs fresh baselines"}
{"id":"EXP-20260208-GLM65K-CF52DA4-Q320-R01","date":"2026-02-08","question":"Low-risk query chunk sweep at q=320 if threshold retune stalls.","hypothesis":"q=320 may lower per-chunk working-set pressure but likely gives lower throughput than q=384.","change_set":["measurement only"],"command":"PYTHONPATH=. python3 scripts/bench_glm_chunked_prefill_mlx.py --model-path mlx-community/GLM-4.7-Flash-4bit --seq-lens 65536 --chunk-sizes 4096 --decode-lens 0 --cache-modes normal --path permute --window 64 --landmark-stride 0 --head-chunk-size 2 --kv-step 4096 --baseline-path benchmarks/mlx/glm_4_7_flash_4bit_wayfinder/20260207_201347_fullmodel_prefill_kv_checkpoint/results.json --active-dense-threshold 49152 --query-chunk-size 320 --out-dir benchmarks/mlx/glm_4_7_flash_4bit_wayfinder/20260208_glm65k_cf52da4_phase2_q320_th49152_h2_r01","controls":{"model":"mlx-community/GLM-4.7-Flash-4bit","seq_len":65536,"chunk_size":4096,"decode_len":0,"path":"permute","window":64,"landmark_stride":0,"head_chunk_size":2,"kv_step":4096,"retro_backfill_enabled":false,"baseline_path":"benchmarks/mlx/glm_4_7_flash_4bit_wayfinder/20260207_201347_fullmodel_prefill_kv_checkpoint/results.json"},"metrics":{"status":"pending"},"decision":"pending","next_action":"run benchmark and append result entry with absolute and delta metrics vs fresh baselines"}
{"id":"EXP-20260208-GLM65K-CF52DA4-Q384-R03","date":"2026-02-08","question":"Low-risk query chunk sweep reference at q=384 in same window.","hypothesis":"q=384 should remain best tradeoff between dispatch overhead and memory pressure.","change_set":["measurement only"],"command":"PYTHONPATH=. python3 scripts/bench_glm_chunked_prefill_mlx.py --model-path mlx-community/GLM-4.7-Flash-4bit --seq-lens 65536 --chunk-sizes 4096 --decode-lens 0 --cache-modes normal --path permute --window 64 --landmark-stride 0 --head-chunk-size 2 --kv-step 4096 --baseline-path benchmarks/mlx/glm_4_7_flash_4bit_wayfinder/20260207_201347_fullmodel_prefill_kv_checkpoint/results.json --active-dense-threshold 49152 --query-chunk-size 384 --out-dir benchmarks/mlx/glm_4_7_flash_4bit_wayfinder/20260208_glm65k_cf52da4_phase2_q384_th49152_h2_r03","controls":{"model":"mlx-community/GLM-4.7-Flash-4bit","seq_len":65536,"chunk_size":4096,"decode_len":0,"path":"permute","window":64,"landmark_stride":0,"head_chunk_size":2,"kv_step":4096,"retro_backfill_enabled":false,"baseline_path":"benchmarks/mlx/glm_4_7_flash_4bit_wayfinder/20260207_201347_fullmodel_prefill_kv_checkpoint/results.json"},"metrics":{"status":"pending"},"decision":"pending","next_action":"run benchmark and append result entry with absolute and delta metrics vs fresh baselines"}
{"id":"EXP-20260208-GLM65K-CF52DA4-Q448-R01","date":"2026-02-08","question":"Low-risk query chunk sweep at q=448 if threshold retune stalls.","hypothesis":"q=448 may match or slightly degrade q=384 depending on kernel pressure.","change_set":["measurement only"],"command":"PYTHONPATH=. python3 scripts/bench_glm_chunked_prefill_mlx.py --model-path mlx-community/GLM-4.7-Flash-4bit --seq-lens 65536 --chunk-sizes 4096 --decode-lens 0 --cache-modes normal --path permute --window 64 --landmark-stride 0 --head-chunk-size 2 --kv-step 4096 --baseline-path benchmarks/mlx/glm_4_7_flash_4bit_wayfinder/20260207_201347_fullmodel_prefill_kv_checkpoint/results.json --active-dense-threshold 49152 --query-chunk-size 448 --out-dir benchmarks/mlx/glm_4_7_flash_4bit_wayfinder/20260208_glm65k_cf52da4_phase2_q448_th49152_h2_r01","controls":{"model":"mlx-community/GLM-4.7-Flash-4bit","seq_len":65536,"chunk_size":4096,"decode_len":0,"path":"permute","window":64,"landmark_stride":0,"head_chunk_size":2,"kv_step":4096,"retro_backfill_enabled":false,"baseline_path":"benchmarks/mlx/glm_4_7_flash_4bit_wayfinder/20260207_201347_fullmodel_prefill_kv_checkpoint/results.json"},"metrics":{"status":"pending"},"decision":"pending","next_action":"run benchmark and append result entry with absolute and delta metrics vs fresh baselines"}
{"id":"EXP-20260208-GLM65K-CF52DA4-TUNED-R01-RESULT","date":"2026-02-08","question":"Result for EXP-20260208-GLM65K-CF52DA4-TUNED-R01","hypothesis":"Measured outcome from planned run.","change_set":["measurement only"],"command":"PYTHONPATH=. python3 scripts/bench_glm_chunked_prefill_mlx.py --model-path mlx-community/GLM-4.7-Flash-4bit --seq-lens 65536 --chunk-sizes 4096 --decode-lens 0 --cache-modes normal --path permute --window 64 --landmark-stride 0 --head-chunk-size 2 --kv-step 4096 --baseline-path benchmarks/mlx/glm_4_7_flash_4bit_wayfinder/20260207_201347_fullmodel_prefill_kv_checkpoint/results.json --active-dense-threshold 49152 --query-chunk-size 384 --out-dir benchmarks/mlx/glm_4_7_flash_4bit_wayfinder/20260208_glm65k_cf52da4_phase2_tuned_th49152_q384_h2_r01","controls":{"model":"mlx-community/GLM-4.7-Flash-4bit","seq_len":65536,"chunk_size":4096,"decode_len":0,"path":"permute","window":64,"landmark_stride":0,"head_chunk_size":2,"kv_step":4096,"retro_backfill_enabled":false,"baseline_path":"benchmarks/mlx/glm_4_7_flash_4bit_wayfinder/20260207_201347_fullmodel_prefill_kv_checkpoint/results.json","dense_control_median_path_pair":["benchmarks/mlx/glm_4_7_flash_4bit_wayfinder/20260208_glm65k_cf52da4_phase2_dense_noswap_r01/results.json","benchmarks/mlx/glm_4_7_flash_4bit_wayfinder/20260208_glm65k_cf52da4_phase2_dense_noswap_r02/results.json"]},"metrics":{"path":"benchmarks/mlx/glm_4_7_flash_4bit_wayfinder/20260208_glm65k_cf52da4_phase2_tuned_th49152_q384_h2_r01/results.json","prefill_sec":813.322926125009,"prefill_tok_s":80.57808023713206,"peak_memory_bytes":29589653008,"delta_sec_vs_monolithic_dense":686.6334763330087,"delta_tok_s_vs_monolithic_dense":-436.7183490045889,"delta_peak_bytes_vs_monolithic_dense":-15301238932,"delta_sec_vs_dense_control_median":81.05636016650533,"delta_tok_s_vs_dense_control_median":-9.392866412796053,"peak_memory_reduction_pct_vs_dense_control_median":10.77000075936555},"decision":"recorded","next_action":"aggregate campaign-level medians/std and update README"}
{"id":"EXP-20260208-GLM65K-CF52DA4-TUNED-R02-RESULT","date":"2026-02-08","question":"Result for EXP-20260208-GLM65K-CF52DA4-TUNED-R02","hypothesis":"Measured outcome from planned run.","change_set":["measurement only"],"command":"PYTHONPATH=. python3 scripts/bench_glm_chunked_prefill_mlx.py --model-path mlx-community/GLM-4.7-Flash-4bit --seq-lens 65536 --chunk-sizes 4096 --decode-lens 0 --cache-modes normal --path permute --window 64 --landmark-stride 0 --head-chunk-size 2 --kv-step 4096 --baseline-path benchmarks/mlx/glm_4_7_flash_4bit_wayfinder/20260207_201347_fullmodel_prefill_kv_checkpoint/results.json --active-dense-threshold 49152 --query-chunk-size 384 --out-dir benchmarks/mlx/glm_4_7_flash_4bit_wayfinder/20260208_glm65k_cf52da4_phase2_tuned_th49152_q384_h2_r02","controls":{"model":"mlx-community/GLM-4.7-Flash-4bit","seq_len":65536,"chunk_size":4096,"decode_len":0,"path":"permute","window":64,"landmark_stride":0,"head_chunk_size":2,"kv_step":4096,"retro_backfill_enabled":false,"baseline_path":"benchmarks/mlx/glm_4_7_flash_4bit_wayfinder/20260207_201347_fullmodel_prefill_kv_checkpoint/results.json","dense_control_median_path_pair":["benchmarks/mlx/glm_4_7_flash_4bit_wayfinder/20260208_glm65k_cf52da4_phase2_dense_noswap_r01/results.json","benchmarks/mlx/glm_4_7_flash_4bit_wayfinder/20260208_glm65k_cf52da4_phase2_dense_noswap_r02/results.json"]},"metrics":{"path":"benchmarks/mlx/glm_4_7_flash_4bit_wayfinder/20260208_glm65k_cf52da4_phase2_tuned_th49152_q384_h2_r02/results.json","prefill_sec":548.2798291250074,"prefill_tok_s":119.53020432027938,"peak_memory_bytes":29589653008,"delta_sec_vs_monolithic_dense":421.59037933300715,"delta_tok_s_vs_monolithic_dense":-397.76622492144156,"delta_peak_bytes_vs_monolithic_dense":-15301238932,"delta_sec_vs_dense_control_median":-183.98673683349625,"delta_tok_s_vs_dense_control_median":29.559257670351272,"peak_memory_reduction_pct_vs_dense_control_median":10.77000075936555},"decision":"recorded","next_action":"aggregate campaign-level medians/std and update README"}
{"id":"EXP-20260208-GLM65K-CF52DA4-DENSE-R01-RESULT","date":"2026-02-08","question":"Result for EXP-20260208-GLM65K-CF52DA4-DENSE-R01","hypothesis":"Measured outcome from planned run.","change_set":["measurement only"],"command":"PYTHONPATH=. python3 scripts/bench_glm_chunked_prefill_mlx.py --model-path mlx-community/GLM-4.7-Flash-4bit --seq-lens 65536 --chunk-sizes 4096 --decode-lens 0 --cache-modes normal --path permute --window 64 --landmark-stride 0 --head-chunk-size 2 --kv-step 4096 --baseline-path benchmarks/mlx/glm_4_7_flash_4bit_wayfinder/20260207_201347_fullmodel_prefill_kv_checkpoint/results.json --no-swap --out-dir benchmarks/mlx/glm_4_7_flash_4bit_wayfinder/20260208_glm65k_cf52da4_phase2_dense_noswap_r01","controls":{"model":"mlx-community/GLM-4.7-Flash-4bit","seq_len":65536,"chunk_size":4096,"decode_len":0,"path":"permute","window":64,"landmark_stride":0,"head_chunk_size":2,"kv_step":4096,"retro_backfill_enabled":false,"baseline_path":"benchmarks/mlx/glm_4_7_flash_4bit_wayfinder/20260207_201347_fullmodel_prefill_kv_checkpoint/results.json","dense_control_median_path_pair":["benchmarks/mlx/glm_4_7_flash_4bit_wayfinder/20260208_glm65k_cf52da4_phase2_dense_noswap_r01/results.json","benchmarks/mlx/glm_4_7_flash_4bit_wayfinder/20260208_glm65k_cf52da4_phase2_dense_noswap_r02/results.json"]},"metrics":{"path":"benchmarks/mlx/glm_4_7_flash_4bit_wayfinder/20260208_glm65k_cf52da4_phase2_dense_noswap_r01/results.json","prefill_sec":679.1450467499963,"prefill_tok_s":96.49779574130474,"peak_memory_bytes":33161104180,"delta_sec_vs_monolithic_dense":552.455596957996,"delta_tok_s_vs_monolithic_dense":-420.7986335004162,"delta_peak_bytes_vs_monolithic_dense":-11729787760,"delta_sec_vs_dense_control_median":-53.12151920850738,"delta_tok_s_vs_dense_control_median":6.526849091376633,"peak_memory_reduction_pct_vs_dense_control_median":0.0},"decision":"recorded","next_action":"aggregate campaign-level medians/std and update README"}
{"id":"EXP-20260208-GLM65K-CF52DA4-DENSE-R02-RESULT","date":"2026-02-08","question":"Result for EXP-20260208-GLM65K-CF52DA4-DENSE-R02","hypothesis":"Measured outcome from planned run.","change_set":["measurement only"],"command":"PYTHONPATH=. python3 scripts/bench_glm_chunked_prefill_mlx.py --model-path mlx-community/GLM-4.7-Flash-4bit --seq-lens 65536 --chunk-sizes 4096 --decode-lens 0 --cache-modes normal --path permute --window 64 --landmark-stride 0 --head-chunk-size 2 --kv-step 4096 --baseline-path benchmarks/mlx/glm_4_7_flash_4bit_wayfinder/20260207_201347_fullmodel_prefill_kv_checkpoint/results.json --no-swap --out-dir benchmarks/mlx/glm_4_7_flash_4bit_wayfinder/20260208_glm65k_cf52da4_phase2_dense_noswap_r02","controls":{"model":"mlx-community/GLM-4.7-Flash-4bit","seq_len":65536,"chunk_size":4096,"decode_len":0,"path":"permute","window":64,"landmark_stride":0,"head_chunk_size":2,"kv_step":4096,"retro_backfill_enabled":false,"baseline_path":"benchmarks/mlx/glm_4_7_flash_4bit_wayfinder/20260207_201347_fullmodel_prefill_kv_checkpoint/results.json","dense_control_median_path_pair":["benchmarks/mlx/glm_4_7_flash_4bit_wayfinder/20260208_glm65k_cf52da4_phase2_dense_noswap_r01/results.json","benchmarks/mlx/glm_4_7_flash_4bit_wayfinder/20260208_glm65k_cf52da4_phase2_dense_noswap_r02/results.json"]},"metrics":{"path":"benchmarks/mlx/glm_4_7_flash_4bit_wayfinder/20260208_glm65k_cf52da4_phase2_dense_noswap_r02/results.json","prefill_sec":785.388085167011,"prefill_tok_s":83.44409755855148,"peak_memory_bytes":33161104180,"delta_sec_vs_monolithic_dense":658.6986353750108,"delta_tok_s_vs_monolithic_dense":-433.8523316831695,"delta_peak_bytes_vs_monolithic_dense":-11729787760,"delta_sec_vs_dense_control_median":53.12151920850738,"delta_tok_s_vs_dense_control_median":-6.526849091376633,"peak_memory_reduction_pct_vs_dense_control_median":0.0},"decision":"recorded","next_action":"aggregate campaign-level medians/std and update README"}
