{"id":"EXP-20260208-GLM47-CONSUMER-HCSA-PARTIAL-R04","date":"2026-02-08","question":"On a bounded single-turn slice (2k/8k/32k), what are Hamiltonian metrics for direct matched comparison to dense partial R03?","hypothesis":"Hamiltonian should be competitive at 2k, mixed at 8k, and better E2E/memory at 32k.","change_set":["measurement only","bounded single-turn HCSA slice"],"command":"PYTHONPATH=. python3 scripts/bench_glm_consumer_mlx.py --model-path mlx-community/GLM-4.7-Flash-4bit --seq-lens 2048 8192 32768 --decode-len 256 --repeats 1 --chunk-size 4096 --kv-step 4096 --cooldown-sec 0 --path permute --window 64 --landmark-stride 0 --head-chunk-size 2 --query-chunk-size 384 --active-dense-threshold 49152 --skip-multi-turn --skip-quality --out-dir benchmarks/mlx/glm_4_7_flash_4bit_wayfinder/20260208_glm47_consumer_hcsa_partial_r04","controls":{"model":"mlx-community/GLM-4.7-Flash-4bit","chunk_size":4096,"kv_step":4096,"window":64,"landmark_stride":0,"head_chunk_size":2,"retro_backfill_enabled":false},"metrics":{"status":"pending"},"decision":"pending","next_action":"compute dense-vs-HCSA deltas and record NO VICTORY gate status"}
{"id":"EXP-20260208-GLM47-CONSUMER-HCSA-R01-RESULT","date":"2026-02-08","question":"Under consumer-like single-turn + multi-turn + quality workloads, does Hamiltonian permute (th=49152,q=384,h=2) beat chunked dense on latency while reducing memory and preserving quality?","hypothesis":"Hamiltonian should improve long-context E2E and TTFT while keeping ITL p95 within 5% of dense and reducing peak memory by at least 8%.","change_set":["scripts/bench_glm_chunked_prefill_mlx.py: TTFT/ITL fields","scripts/bench_glm_consumer_mlx.py: consumer harness"],"command":"PYTHONPATH=. python3 scripts/bench_glm_consumer_mlx.py --model-path mlx-community/GLM-4.7-Flash-4bit --seq-lens 2048 8192 32768 65536 --decode-len 256 --repeats 3 --turns 8 --multi-decode-len 128 --multi-target-context 65536 --chunk-size 4096 --kv-step 4096 --cooldown-sec 60 --path permute --window 64 --landmark-stride 0 --head-chunk-size 2 --query-chunk-size 384 --active-dense-threshold 49152 --quality-dataset benchmarks/mlx/glm_4_7_flash_4bit_wayfinder/quality_eval_glm47_consumer_v1.json --out-dir benchmarks/mlx/glm_4_7_flash_4bit_wayfinder/20260208_glm47_consumer_hcsa_r01","controls":{"model":"mlx-community/GLM-4.7-Flash-4bit","chunk_size":4096,"kv_step":4096,"window":64,"landmark_stride":0,"head_chunk_size":2,"retro_backfill_enabled":false},"metrics":{"status":"interrupted","partial_artifact":"benchmarks/mlx/glm_4_7_flash_4bit_wayfinder/20260208_glm47_consumer_partial_interrupted/partial_metrics.json","completed_single_turn_seq":[2048,8192,32768]},"decision":"interrupted_partial_only","next_action":"run bounded matched HCSA/dense slices and preserve strict no-victory gating"}
{"id":"EXP-20260208-GLM47-CONSUMER-REDUCED-HCSA-R02-RESULT","date":"2026-02-08","question":"Can we obtain complete artifacted consumer metrics quickly enough to make a strict go/no-go call tonight?","hypothesis":"Single-repeat full-suite data including 65k and multi-turn will support no-victory/victory gating without extrapolation.","change_set":["measurement protocol reduced: repeats=1,cooldown=0","checkpoint write patch in consumer script"],"command":"PYTHONPATH=. python3 scripts/bench_glm_consumer_mlx.py --model-path mlx-community/GLM-4.7-Flash-4bit --seq-lens 2048 8192 32768 65536 --decode-len 256 --repeats 1 --turns 8 --multi-decode-len 128 --multi-target-context 65536 --chunk-size 4096 --kv-step 4096 --cooldown-sec 0 --path permute --window 64 --landmark-stride 0 --head-chunk-size 2 --query-chunk-size 384 --active-dense-threshold 49152 --quality-dataset benchmarks/mlx/glm_4_7_flash_4bit_wayfinder/quality_eval_glm47_consumer_v1.json --out-dir benchmarks/mlx/glm_4_7_flash_4bit_wayfinder/20260208_glm47_consumer_hcsa_r02_reduced","controls":{"model":"mlx-community/GLM-4.7-Flash-4bit","chunk_size":4096,"kv_step":4096,"window":64,"landmark_stride":0,"head_chunk_size":2,"retro_backfill_enabled":false,"repeats":1},"metrics":{"status":"interrupted","partial_artifact":"benchmarks/mlx/glm_4_7_flash_4bit_wayfinder/20260208_glm47_consumer_partial_interrupted/partial_metrics.json","completed_single_turn_seq":[2048,8192,32768]},"decision":"interrupted_partial_only","next_action":"use bounded matched comparison plus strict NO VICTORY decision"}
{"id":"EXP-20260208-GLM47-CONSUMER-DENSE-PARTIAL-R03-RESULT","date":"2026-02-08","question":"For completed lengths (2k/8k/32k), what are dense control single-turn metrics under identical settings?","hypothesis":"Dense will be slower and use more memory than Hamiltonian at 8k/32k.","change_set":["measurement only","bounded single-turn control slice"],"command":"PYTHONPATH=. python3 scripts/bench_glm_consumer_mlx.py --model-path mlx-community/GLM-4.7-Flash-4bit --seq-lens 2048 8192 32768 --decode-len 256 --repeats 1 --chunk-size 4096 --kv-step 4096 --cooldown-sec 0 --path permute --window 64 --landmark-stride 0 --head-chunk-size 2 --query-chunk-size 384 --active-dense-threshold 49152 --no-swap --skip-multi-turn --skip-quality --out-dir benchmarks/mlx/glm_4_7_flash_4bit_wayfinder/20260208_glm47_consumer_dense_partial_r03","controls":{"model":"mlx-community/GLM-4.7-Flash-4bit","chunk_size":4096,"kv_step":4096,"window":64,"landmark_stride":0,"head_chunk_size":2,"retro_backfill_enabled":false},"metrics":{"artifact":"benchmarks/mlx/glm_4_7_flash_4bit_wayfinder/20260208_glm47_consumer_dense_partial_r03/results.json","seq2048":{"e2e_sec":6.180730167005095,"ttft_sec":0.08452150000084657,"itl_p95_sec":0.01575116599269677,"decode_tok_s":62.87537373323599,"peak_memory_bytes":18355369054},"seq8192":{"e2e_sec":17.477267333000782,"ttft_sec":0.1559395840013167,"itl_p95_sec":0.019843874993966892,"decode_tok_s":49.70641420991957,"peak_memory_bytes":21800155168},"seq32768":{"e2e_sec":159.11766575000365,"ttft_sec":5.4200870000058785,"itl_p95_sec":0.03455466699961107,"decode_tok_s":17.996215803964834,"peak_memory_bytes":35716954144}},"decision":"recorded","next_action":"run bounded HCSA slice and compute absolute/delta/% comparisons"}
{"id":"EXP-20260208-GLM47-CONSUMER-HCSA-PARTIAL-R04-RESULT","date":"2026-02-08","question":"On a bounded single-turn slice (2k/8k/32k), what are Hamiltonian metrics for direct matched comparison to dense partial R03?","hypothesis":"Hamiltonian should be competitive at 2k, mixed at 8k, and better E2E/memory at 32k.","change_set":["measurement only","bounded single-turn HCSA slice"],"command":"PYTHONPATH=. python3 scripts/bench_glm_consumer_mlx.py --model-path mlx-community/GLM-4.7-Flash-4bit --seq-lens 2048 8192 32768 --decode-len 256 --repeats 1 --chunk-size 4096 --kv-step 4096 --cooldown-sec 0 --path permute --window 64 --landmark-stride 0 --head-chunk-size 2 --query-chunk-size 384 --active-dense-threshold 49152 --skip-multi-turn --skip-quality --out-dir benchmarks/mlx/glm_4_7_flash_4bit_wayfinder/20260208_glm47_consumer_hcsa_partial_r04","controls":{"model":"mlx-community/GLM-4.7-Flash-4bit","chunk_size":4096,"kv_step":4096,"window":64,"landmark_stride":0,"head_chunk_size":2,"retro_backfill_enabled":false},"metrics":{"artifact":"benchmarks/mlx/glm_4_7_flash_4bit_wayfinder/20260208_glm47_consumer_hcsa_partial_r04/results.json","seq2048":{"e2e_sec":6.580195457994705,"ttft_sec":0.07041787498746999,"itl_p95_sec":0.016194625000935048,"decode_tok_s":61.76317644830569,"peak_memory_bytes":18284328404},"seq8192":{"e2e_sec":21.117382583994186,"ttft_sec":0.12969600000360515,"itl_p95_sec":0.019928583002183586,"decode_tok_s":49.704650095747674,"peak_memory_bytes":20660500328},"seq32768":{"e2e_sec":151.54713583301054,"ttft_sec":0.21713554199959617,"itl_p95_sec":0.03416904200275894,"decode_tok_s":28.901470624780256,"peak_memory_bytes":30027907880},"comparison_artifact":"benchmarks/mlx/glm_4_7_flash_4bit_wayfinder/20260208_glm47_consumer_partial_interrupted/campaign_summary_partial.json"},"decision":"recorded","next_action":"finalize campaign decision block with strict gates"}
{"id":"EXP-20260208-GLM47-CONSUMER-PARTIAL-CAMPAIGN-RESULT","date":"2026-02-08","question":"Do current consumer-style results satisfy strict victory gates?","hypothesis":"Likely no due missing 65k+multi-turn+quality+repeat gates.","change_set":["measurement and reporting only"],"command":"aggregate artifacts from partial interrupted and bounded matched slices","controls":{"required_victory_gates":["seq65536 single-turn E2E+TTFT >=10% better","multi-turn E2E+per-turn TTFT/ITL p95 gate","memory reduction >=8% on 65536 + multi-turn","quality parity within 2pp","repro >=3 repeats + 2-run confirmation"]},"metrics":{"campaign_summary_artifact":"benchmarks/mlx/glm_4_7_flash_4bit_wayfinder/20260208_glm47_consumer_partial_interrupted/campaign_summary_partial.json","bounded_single_turn_comparison":{"seq2048":{"delta_e2e_pct_vs_dense":6.463076047585707,"delta_ttft_pct_vs_dense":-16.68643482810329,"delta_itl_p95_pct_vs_dense":2.8154043227269256,"memory_reduction_pct":0.38702926533922266},"seq8192":{"delta_e2e_pct_vs_dense":20.827713976315366,"delta_ttft_pct_vs_dense":-16.829327951451987,"delta_itl_p95_pct_vs_dense":0.42687231320721214,"memory_reduction_pct":5.227737285433987},"seq32768":{"delta_e2e_pct_vs_dense":-4.757818612603004,"delta_ttft_pct_vs_dense":-95.99387349318636,"delta_itl_p95_pct_vs_dense":-1.115985278794526,"memory_reduction_pct":15.92813945182302}},"interrupted_n3_hcsa_evidence":{"seq2048":{"median_sec":7.467,"std_sec":0.04115823125451349,"cv":0.005512017042254385},"seq8192":{"median_sec":21.172,"std_sec":0.9852439066320365,"cv":0.046535230806349734},"seq32768":{"median_sec":198.556,"std_sec":14.771301191462063,"cv":0.07439362795111738}}},"decision":"NO VICTORY","next_action":"execute isolated 65536 x3 (HCSA+dense), then multi-turn+quality full suite with checkpointed per-seq persistence"}
{"id":"EXP-20260208-GLM47-CONSUMER-CHECKPOINT-FIX-RESULT","date":"2026-02-08","question":"Can consumer benchmark writes survive mid-run interruption by checkpointing each completed single-turn row?","hypothesis":"Persisting payload['single_turn'] incrementally on each row avoids loss during long 65k runs.","change_set":["scripts/bench_glm_consumer_mlx.py: append completed single-turn row into payload before flush"],"command":"python3 -m py_compile scripts/bench_glm_consumer_mlx.py","controls":{"scope":"instrumentation reliability only","runtime_behavior":"no attention algorithm changes"},"metrics":{"compile_passed":true},"decision":"keep","next_action":"run isolated 65k repeated jobs with checkpointed persistence"}
{"id":"EXP-20260208-GLM47-CONSUMER-65K-HCSA-R05","date":"2026-02-08","question":"At seq=65536 decode=256, what is HCSA consumer E2E/TTFT/ITL with promoted config?","hypothesis":"HCSA should beat chunked dense at 65k due to O(T·W) vs O(T²) scaling advantage. Prior prefill-only showed 680.80s vs 732.27s (7% faster). With decode the gap should hold.","change_set":["measurement only"],"command":"PYTHONPATH=. python3 scripts/bench_glm_consumer_mlx.py --model-path mlx-community/GLM-4.7-Flash-4bit --seq-lens 65536 --decode-len 256 --repeats 3 --chunk-size 4096 --kv-step 4096 --cooldown-sec 90 --path permute --window 64 --landmark-stride 0 --head-chunk-size 2 --query-chunk-size 384 --active-dense-threshold 49152 --skip-multi-turn --skip-quality --out-dir benchmarks/mlx/glm_4_7_flash_4bit_wayfinder/20260208_glm47_consumer_65k_hcsa_r05","controls":{"model":"mlx-community/GLM-4.7-Flash-4bit","config":"th=49152,q=384,h=2","retro":"off","seed":42},"metrics":{"status":"pending"},"decision":"pending","next_action":"run and record results"}
{"id":"EXP-20260208-GLM47-CONSUMER-65K-DENSE-R05","date":"2026-02-08","question":"At seq=65536 decode=256, what is chunked dense consumer E2E/TTFT/ITL?","hypothesis":"Dense at 65k will be slower on prefill due to O(T²) and have worse TTFT. ITL should be comparable.","change_set":["measurement only"],"command":"PYTHONPATH=. python3 scripts/bench_glm_consumer_mlx.py --model-path mlx-community/GLM-4.7-Flash-4bit --seq-lens 65536 --decode-len 256 --repeats 3 --chunk-size 4096 --kv-step 4096 --cooldown-sec 90 --path permute --window 64 --landmark-stride 0 --head-chunk-size 2 --query-chunk-size 384 --active-dense-threshold 49152 --no-swap --skip-multi-turn --skip-quality --out-dir benchmarks/mlx/glm_4_7_flash_4bit_wayfinder/20260208_glm47_consumer_65k_dense_r05","controls":{"model":"mlx-community/GLM-4.7-Flash-4bit","no_swap":true,"retro":"off","seed":42},"metrics":{"status":"pending"},"decision":"pending","next_action":"run and record results"}
{"id":"EXP-20260208-HCY-IDEA4-SPECTRAL","date":"2026-02-08","question":"Do random-cycle + local-window graphs in HCSA satisfy strong expansion proxies (d/lambda) at small sequence lengths?","hypothesis":"Random cycles with window augmentation will produce expansion ratios above threshold while deliberately bad cycles fail.","change_set":["hcsa/graph/analysis.py (new) spectral_gap + expansion_proxy","optional spectral verification wiring in graph runtimes (default off)","tests/test_spectral.py (new)"],"command":"python3 -m pytest","controls":{"retro_backfill_enabled":false,"verify_spectral_gap_default":false},"metrics":{"status":"pending","targets":["expansion_ratio","lambda_2","spectral_gap","proxy_directional_agreement"]},"decision":"pending","next_action":"implement Idea 4 and run tests"}
{"id":"EXP-20260208-HCY-IDEA1-DISJOINT","date":"2026-02-08","question":"Can we enforce edge-disjoint multi-cycle packing and consume all cycles in permute attention?","hypothesis":"Edge-disjoint generation will eliminate overlap waste and multi-cycle permute will produce correct outputs with near-linear compute scaling in cycle count.","change_set":["hcsa/cycles.py edge_disjoint_random_cycles + verify utility","hcsa/graph_strategies.py + hcsa/graph/abi.py all-cycle metadata","hcsa/mlx/attention.py and integrations multi-cycle averaging","tests/test_edge_disjoint_cycles.py (new)"],"command":"python3 -m pytest && PYTHONPATH=. python3 scripts/bench_mlx_wayfinder_scale.py --seq-lens 2048 4096 --batch 2 --heads 4 --embd 128 --window 32 --landmark-stride 32 --warmup 2 --iters 4 --num-cycles 1 --out-dir benchmarks/mlx/tiny_wayfinder/disjoint_d1 && PYTHONPATH=. python3 scripts/bench_mlx_wayfinder_scale.py --seq-lens 2048 4096 --batch 2 --heads 4 --embd 128 --window 32 --landmark-stride 32 --warmup 2 --iters 4 --num-cycles 2 --out-dir benchmarks/mlx/tiny_wayfinder/disjoint_d2","controls":{"seq_lens":[2048,4096],"batch":2,"heads":4,"embd":128,"window":32,"landmark_stride":32,"retro_backfill_enabled":false,"baseline_path":"benchmarks/mlx/tiny_wayfinder/disjoint_d1/results.json"},"metrics":{"status":"pending","targets":["tokens_per_sec","attention_ms","peak_memory_bytes","delta_vs_baseline","pct_delta_vs_baseline"]},"decision":"pending","next_action":"implement Idea 1 and run d1 vs d2 benchmark"}
{"id":"EXP-20260208-HCY-IDEA2-RESILIENCE","date":"2026-02-08","question":"Under window-drop, does the cycle+window graph maintain resilience signals at practical drop rates?","hypothesis":"At drop_rate=0.3 survival remains high, while drop_rate=0.8 significantly degrades resilience.","change_set":["hcsa/graph/analysis.py check_resilience","docs/resilience.md (new)","attention window_drop theorem comment","tests/test_resilience.py (new)"],"command":"python3 -m pytest && python3 -c \"from hcsa.graph.analysis import check_resilience; import numpy as np; p=np.random.default_rng(42).permutation(128); print(check_resilience(p, window=32, drop_rate=0.3, num_trials=100)); print(check_resilience(p, window=32, drop_rate=0.8, num_trials=100))\"","controls":{"T":128,"window":32,"seed":42},"metrics":{"status":"pending","targets":["survival_rate","min_degree_mean","min_degree_min","theoretical_threshold"]},"decision":"pending","next_action":"implement Idea 2 and run resilience checks"}
{"id":"EXP-20260208-HCY-IDEA5-REGULARITY","date":"2026-02-08","question":"Can regular-partition cycle construction improve cluster regularity while preserving runtime feasibility?","hypothesis":"regular_partition should reduce cluster-pair deviation relative to random/worst-case cycles at similar runtime complexity.","change_set":["hcsa/cycles.py regular_partition_cycle","hcsa/graph/analysis.py check_regularity","strategy/config wiring for regular_partition","tests/test_regularity.py (new)"],"command":"python3 -m pytest && PYTHONPATH=. python3 scripts/bench_mlx_wayfinder_scale.py --seq-lens 2048 4096 --batch 2 --heads 4 --embd 128 --window 32 --landmark-stride 32 --warmup 2 --iters 4 --strategy random --num-cycles 1 --out-dir benchmarks/mlx/tiny_wayfinder/regularity_random && PYTHONPATH=. python3 scripts/bench_mlx_wayfinder_scale.py --seq-lens 2048 4096 --batch 2 --heads 4 --embd 128 --window 32 --landmark-stride 32 --warmup 2 --iters 4 --strategy regular_partition --regular-num-clusters 8 --num-cycles 1 --out-dir benchmarks/mlx/tiny_wayfinder/regularity_reg8 && PYTHONPATH=. python3 scripts/bench_mlx_wayfinder_scale.py --seq-lens 2048 4096 --batch 2 --heads 4 --embd 128 --window 32 --landmark-stride 32 --warmup 2 --iters 4 --strategy regular_partition --regular-num-clusters 16 --num-cycles 1 --out-dir benchmarks/mlx/tiny_wayfinder/regularity_reg16","controls":{"seq_lens":[2048,4096],"batch":2,"heads":4,"embd":128,"window":32,"landmark_stride":32,"baseline_path":"benchmarks/mlx/tiny_wayfinder/regularity_random/results.json"},"metrics":{"status":"pending","targets":["regularity_deviation","tokens_per_sec","peak_memory_bytes","delta_vs_baseline","pct_delta_vs_baseline"]},"decision":"pending","next_action":"implement Idea 5 and run strategy benchmark"}
{"id":"EXP-20260208-HCY-IDEA3-COVERING","date":"2026-02-08","question":"Do additional covering cycles move permute outputs closer to dense attention in small-T regimes?","hypothesis":"Increasing covering cycles from 1 to 4 to 8 improves approximation quality to dense outputs (lower L2 distance), at near-linear extra compute.","change_set":["hcsa/cycles.py covering_cycles","hcsa/graph/analysis.py compute_edge_coverage","hcsa/mlx/attention.py wayfinder_covering_attention","tests/test_covering.py (new)"],"command":"python3 -m pytest && python3 -m pytest tests/test_covering.py -q","controls":{"fixed_seed":42,"same_qkv":true},"metrics":{"status":"pending","targets":["coverage_fraction","l2_to_dense_single","l2_to_dense_4cycle","l2_to_dense_8cycle"]},"decision":"pending","next_action":"implement Idea 3 and run coverage quality tests"}
{"id":"EXP-20260208-HCY-IDEA4-SPECTRAL-RESULT","date":"2026-02-08","question":"Do random-cycle + local-window graphs in HCSA satisfy strong expansion proxies (d/lambda) at small sequence lengths?","hypothesis":"Random cycles with window augmentation will produce expansion ratios above threshold while deliberately bad cycles fail.","change_set":["hcsa/graph/analysis.py (new) spectral_gap + expansion_proxy","hcsa/graph/__init__.py exports analysis APIs","hcsa/integrations/qwen_mlx.py + hcsa/integrations/glm_mlx.py + hcsa/integrations/gpt2_mlx.py spectral verification toggles","hcsa/mlx/attention.py + hcsa/mlx/model.py spectral verification toggles","tests/test_spectral.py (new)"],"command":"python3 -m pytest tests/test_spectral.py -q && python3 -m pytest -q","controls":{"retro_backfill_enabled":false,"verify_spectral_gap_default":false},"metrics":{"tests_test_spectral":{"passed":3,"failed":0},"pytest_full":{"status":"pass","failures":0},"warnings":["PytestUnknownMarkWarning: pytest.mark.slow in existing tests/pytorch/test_perf_regression.py"]},"decision":"keep","next_action":"implement Idea 1 edge-disjoint packing and run d=1 vs d=2 tiny benchmark"}
{"id":"EXP-20260208-HCY-IDEA1-DISJOINT-RESULT","date":"2026-02-08","question":"Can we enforce edge-disjoint multi-cycle packing and consume all cycles in permute attention?","hypothesis":"Edge-disjoint generation will eliminate overlap waste and multi-cycle permute will produce correct outputs with near-linear compute scaling in cycle count.","change_set":["measurement only (no new code changes)"],"command":"python3 -m pytest tests/test_edge_disjoint_cycles.py -q && python3 -m pytest -q && PYTHONPATH=. python3 scripts/bench_mlx_wayfinder_scale.py --seq-lens 2048 4096 --batch 2 --heads 4 --embd 128 --window 32 --landmark-stride 32 --warmup 2 --iters 4 --num-cycles 1 --out-dir benchmarks/mlx/tiny_wayfinder/disjoint_d1 && PYTHONPATH=. python3 scripts/bench_mlx_wayfinder_scale.py --seq-lens 2048 4096 --batch 2 --heads 4 --embd 128 --window 32 --landmark-stride 32 --warmup 2 --iters 4 --num-cycles 2 --out-dir benchmarks/mlx/tiny_wayfinder/disjoint_d2","controls":{"seq_lens":[2048,4096],"batch":2,"heads":4,"embd":128,"window":32,"landmark_stride":32,"warmup":2,"iters":4,"retro_backfill_enabled":false,"baseline_path":"benchmarks/mlx/tiny_wayfinder/disjoint_d1/results.json","row_filter":"mode=wayfinder_permute"},"metrics":{"tests":{"edge_disjoint_cycles":{"passed":5,"failed":0},"pytest_full":{"status":"pass","failures":0,"warnings":["PytestUnknownMarkWarning: pytest.mark.slow in tests/pytorch/test_perf_regression.py"]}},"seq2048":{"tokens_per_sec":{"d1":3189824.9692907403,"d2":1785284.268023977,"delta":-1404540.7012667633,"delta_pct":-44.03190503518642},"peak_memory_bytes":{"d1":67258324,"d2":67487700,"delta":229376,"delta_pct":0.3410373413408279}},"seq4096":{"tokens_per_sec":{"d1":3312325.3520641136,"d2":1909139.906987293,"delta":-1403185.4450768207,"delta_pct":-42.36254884208188},"peak_memory_bytes":{"d1":144986324,"d2":145445076,"delta":458752,"delta_pct":0.31641053262375285}}},"decision":"follow-up","next_action":"profile multi-cycle path overhead and optimize num-cycles>1 aggregation"}
