{"id":"EXP-20260318T170629Z-QWEN35-9B-CUDA-LONG-FLEX-PRERUN","date":"2026-03-18","question":"On Qwen3.5-9B CUDA with flex_attention, does Wayfinder remain viable from 16384 through 262144 while dense becomes much slower or OOMs, and does the flex path improve on the earlier non-flex long-run baseline?","hypothesis":"Dense should continue to worsen sharply and may OOM at high T, while Wayfinder should keep linear-memory behavior and survive farther into the 64k to 256k regime; compared with the earlier non-flex long artifact, the flex path should materially reduce Wayfinder latency.","change_set":["measurement-only"],"command":"source .venv/bin/activate && python scripts/bench_qwen35_cuda_wayfinder.py --model-path /home/hmbown/HF_Models/Qwen3.5-9B --seq-lens 16384 32768 65536 131072 262144 --engine flex --warmup 1 --repeats 3 --output benchmarks/cuda/qwen35_wayfinder/EXP-20260318T170629Z-Qwen3.5-9B-long-flex.ndjson","controls":{"baseline_run_path":"benchmarks/cuda/qwen35_wayfinder/EXP-long-seq-Qwen3.5-9B.ndjson","one_process_at_a_time":true,"retro_backfill_inference":"off","model_path":"/home/hmbown/HF_Models/Qwen3.5-9B","seq_lens":[16384,32768,65536,131072,262144],"warmup":1,"repeats":3,"dtype":"bfloat16","engine":"flex","window":64,"landmark_stride":64,"num_cycles":1},"metrics":{"status":"pending","artifacts_expected":["benchmarks/cuda/qwen35_wayfinder/EXP-20260318T170629Z-Qwen3.5-9B-long-flex.ndjson"],"required":["experiment_meta","bench[dense|wayfinder].seq_len","bench[dense|wayfinder].median_ms","bench[dense|wayfinder].prefill_tok_per_sec","bench[dense|wayfinder].peak_mem_gb","bench[wayfinder].wayfinder_profiles","divergence.cosine_similarity","divergence.top1_agreement","divergence.l2_relative"]},"decision":"pending","next_action":"Run the long Qwen CUDA flex benchmark, confirm every requested seq_len has either a benchmark row or an OOM/error row, then append a RESULT entry with dense-vs-Wayfinder deltas and deltas vs the prior long baseline."}
{"id":"EXP-20260318T170629Z-NEMOTRON-120B-CUDA-SHORT-FLEX-PRERUN","date":"2026-03-18","question":"On Nemotron 3 Super 120B CUDA with flex_attention, does the short-context (64 through 8192) dense-vs-Wayfinder benchmark run cleanly, and is Wayfinder roughly comparable to dense before long-context scaling work?","hypothesis":"The short sweep should validate the Nemotron integration path end-to-end on the local model and hardware, with Wayfinder close to dense at short T; if not, the run should surface engine or integration failures early before any longer-context queue.","change_set":["measurement-only"],"command":"source .venv/bin/activate && python scripts/bench_nemotron_cuda_wayfinder.py --model-path /home/hmbown/HF_Models/NVIDIA-Nemotron-3-Super-120B-A12B-NVFP4 --seq-lens 64 128 256 512 1024 2048 4096 8192 --engine flex --warmup 2 --repeats 5 --output benchmarks/cuda/nemotron_wayfinder/EXP-20260318T170629Z-NVIDIA-Nemotron-3-Super-120B-A12B-NVFP4-short-flex.ndjson","controls":{"baseline_run_path":null,"one_process_at_a_time":true,"retro_backfill_inference":"off","model_path":"/home/hmbown/HF_Models/NVIDIA-Nemotron-3-Super-120B-A12B-NVFP4","seq_lens":[64,128,256,512,1024,2048,4096,8192],"warmup":2,"repeats":5,"dtype":"bfloat16","engine":"flex","window":64,"landmark_stride":64,"num_cycles":1},"metrics":{"status":"pending","artifacts_expected":["benchmarks/cuda/nemotron_wayfinder/EXP-20260318T170629Z-NVIDIA-Nemotron-3-Super-120B-A12B-NVFP4-short-flex.ndjson"],"required":["experiment_meta","bench[dense].seq_len","bench[dense].median_ms","bench[dense].prefill_tok_per_sec","bench[dense].peak_mem_gb","bench[wayfinder].seq_len","bench[wayfinder].median_ms","bench[wayfinder].prefill_tok_per_sec","bench[wayfinder].peak_mem_gb","bench[wayfinder].wayfinder_profiles","divergence.cosine_similarity","divergence.top1_agreement","divergence.l2_relative"]},"decision":"pending","next_action":"Run the short Nemotron CUDA flex benchmark, inspect for engine or integration failures, then append a RESULT entry with absolute metrics and dense-vs-Wayfinder deltas."}
{"id":"EXP-20260318T170606Z-QWEN35CUDA-FLEX-SHORT-PRERUN","date":"2026-03-18","question":"On the DGX Spark GB10, does the current CUDA flex Wayfinder path for Qwen3.5-9B complete a clean short-sequence validation sweep with full observability fields present?","hypothesis":"At T<=8192, dense and Wayfinder should remain near parity on median prefill latency, Wayfinder should activate on all 8 full-attention layers with graph_cache_hit=true after warmup, and the fresh artifact should include prefill_tok_per_sec plus peak_mem_gb fields missing from the earlier same-day baseline file.","change_set":["measurement-only"],"command":".venv/bin/python scripts/bench_qwen35_cuda_wayfinder.py --model-path /home/hmbown/HF_Models/Qwen3.5-9B --seq-lens 64 128 256 512 1024 2048 4096 8192 --engine flex --warmup 2 --repeats 5 --output benchmarks/cuda/qwen35_wayfinder/EXP-20260318T170606Z-QWEN35CUDA-FLEX-SHORT.ndjson","controls":{"baseline_run_path":"benchmarks/cuda/qwen35_wayfinder/EXP-flex-engine-Qwen3.5-9B.ndjson","one_process_at_a_time":true,"retro_backfill_inference":"off","model_path":"/home/hmbown/HF_Models/Qwen3.5-9B","device":"cuda","gpu":"NVIDIA GB10","dtype":"bfloat16","engine":"flex","path":"permute","window":64,"landmark_stride":64,"num_cycles":1,"warmup":2,"repeats":5,"seq_lens":[64,128,256,512,1024,2048,4096,8192],"stop_gates":["nonzero exit","missing output artifact","missing dense or wayfinder bench row for any requested seq_len","successful bench row missing prefill_tok_per_sec or peak_mem_gb","wayfinder row missing wayfinder_profiles or showing zero mode=wayfinder layers","missing divergence row when min(seq_len)>=4"]},"metrics":{"status":"pending","artifacts_expected":["benchmarks/cuda/qwen35_wayfinder/EXP-20260318T170606Z-QWEN35CUDA-FLEX-SHORT.ndjson"],"required":["experiment_meta.engine","bench[label=dense].median_ms","bench[label=dense].prefill_tok_per_sec","bench[label=dense].peak_mem_gb","bench[label=wayfinder].median_ms","bench[label=wayfinder].prefill_tok_per_sec","bench[label=wayfinder].peak_mem_gb","bench[label=wayfinder].wayfinder_profiles","divergence.cosine_similarity","divergence.top1_agreement","divergence.l2_relative"]},"decision":"pending","next_action":"Run the short CUDA flex sweep, compare against EXP-flex-engine-Qwen3.5-9B, and append a RESULT entry before any 16k+ continuation."}
{"id":"EXP-20260318T170606Z-QWEN35CUDA-FLEX-SHORT-RESULT","date":"2026-03-18","question":"On the DGX Spark GB10, does the current CUDA flex Wayfinder path for Qwen3.5-9B complete a clean short-sequence validation sweep with full observability fields present?","hypothesis":"At T<=8192, dense and Wayfinder should remain near parity on median prefill latency, Wayfinder should activate on all 8 full-attention layers with graph_cache_hit=true after warmup, and the fresh artifact should include prefill_tok_per_sec plus peak_mem_gb fields missing from the earlier same-day baseline file.","change_set":["measurement-only","notes/LAB_NOTEBOOK.md","notes/experiments.ndjson"],"command":".venv/bin/python scripts/bench_qwen35_cuda_wayfinder.py --model-path /home/hmbown/HF_Models/Qwen3.5-9B --seq-lens 64 128 256 512 1024 2048 4096 8192 --engine flex --warmup 2 --repeats 5 --output benchmarks/cuda/qwen35_wayfinder/EXP-20260318T170606Z-QWEN35CUDA-FLEX-SHORT.ndjson","controls":{"baseline_run_path":"benchmarks/cuda/qwen35_wayfinder/EXP-flex-engine-Qwen3.5-9B.ndjson","one_process_at_a_time":true,"retro_backfill_inference":"off","model_path":"/home/hmbown/HF_Models/Qwen3.5-9B","device":"cuda","gpu":"NVIDIA GB10","dtype":"bfloat16","engine":"flex","path":"permute","window":64,"landmark_stride":64,"num_cycles":1,"warmup":2,"repeats":5,"seq_lens":[64,128,256,512,1024,2048,4096,8192]},"metrics":{"status":"failed_pre_measurement","artifact_created":false,"error":"AttributeError: 'torch._C._CudaDeviceProperties' object has no attribute 'total_mem'. Did you mean: 'total_memory'?","failure_site":"scripts/bench_qwen35_cuda_wayfinder.py::_gpu_mem_gb","blocked_before_first_seq_len":64},"decision":"follow-up","next_action":"Patch CUDA bench/serve helpers to use total_memory compatibility and rerun the short Qwen flex sweep under a new experiment id."}
{"id":"EXP-20260318T171044Z-CUDA-TOTALMEM-FIX-PRERUN","date":"2026-03-18","question":"Does replacing direct total_mem access with a compatible GPU-memory getter unblock the CUDA Qwen/Nemotron bench and serve scripts on the DGX Spark GB10?","hypothesis":"Using total_memory with fallback compatibility logic will restore GPU memory reporting on this PyTorch build, unblock scripts/bench_qwen35_cuda_wayfinder.py, and preserve behavior on environments that still expose total_mem.","change_set":["scripts/bench_qwen35_cuda_wayfinder.py","scripts/bench_nemotron_cuda_wayfinder.py","scripts/serve_qwen_wayfinder_cuda.py","scripts/serve_nemotron_wayfinder_cuda.py"],"command":".venv/bin/python -m py_compile scripts/bench_qwen35_cuda_wayfinder.py scripts/bench_nemotron_cuda_wayfinder.py scripts/serve_qwen_wayfinder_cuda.py scripts/serve_nemotron_wayfinder_cuda.py && .venv/bin/python scripts/bench_qwen35_cuda_wayfinder.py --model-path /home/hmbown/HF_Models/Qwen3.5-9B --seq-lens 64 128 256 512 1024 2048 4096 8192 --engine flex --warmup 2 --repeats 5 --output benchmarks/cuda/qwen35_wayfinder/EXP-20260318T171044Z-QWEN35CUDA-FLEX-SHORT.ndjson","controls":{"baseline_run_path":"EXP-20260318T170606Z-QWEN35CUDA-FLEX-SHORT-RESULT","one_process_at_a_time":true,"retro_backfill_inference":"off","model_path":"/home/hmbown/HF_Models/Qwen3.5-9B","device":"cuda","gpu":"NVIDIA GB10","dtype":"bfloat16","engine":"flex","path":"permute on Qwen3.5 full-attention layers only; stock Qwen3.5 linear-attention layers remain unchanged","window":64,"landmark_stride":64,"num_cycles":1,"warmup":2,"repeats":5,"seq_lens":[64,128,256,512,1024,2048,4096,8192],"stop_gates":["nonzero exit from compile or benchmark command","missing output artifact","missing dense or wayfinder bench row for any requested seq_len","successful bench row missing prefill_tok_per_sec or peak_mem_gb","wayfinder row missing wayfinder_profiles or showing zero mode=wayfinder layers","missing divergence row when min(seq_len)>=4"]},"metrics":{"status":"pending","artifacts_expected":["benchmarks/cuda/qwen35_wayfinder/EXP-20260318T171044Z-QWEN35CUDA-FLEX-SHORT.ndjson"],"required":["py_compile success","experiment_meta.engine","bench[label=dense].median_ms","bench[label=dense].prefill_tok_per_sec","bench[label=dense].peak_mem_gb","bench[label=wayfinder].median_ms","bench[label=wayfinder].prefill_tok_per_sec","bench[label=wayfinder].peak_mem_gb","bench[label=wayfinder].wayfinder_profiles","divergence.cosine_similarity","divergence.top1_agreement","divergence.l2_relative"]},"decision":"pending","next_action":"Apply the compatibility patch, rerun the short CUDA flex sweep, and append a RESULT entry with dense-vs-wayfinder deltas."}
{"id":"EXP-20260318T171044Z-CUDA-TOTALMEM-FIX-RESULT","date":"2026-03-18","question":"Does replacing direct total_mem access with a compatible GPU-memory getter unblock the CUDA Qwen/Nemotron bench and serve scripts on the DGX Spark GB10?","hypothesis":"Using total_memory with fallback compatibility logic will restore GPU memory reporting on this PyTorch build, unblock scripts/bench_qwen35_cuda_wayfinder.py, and preserve behavior on environments that still expose total_mem.","change_set":["scripts/bench_qwen35_cuda_wayfinder.py","scripts/bench_nemotron_cuda_wayfinder.py","scripts/serve_qwen_wayfinder_cuda.py","scripts/serve_nemotron_wayfinder_cuda.py","notes/LAB_NOTEBOOK.md","notes/experiments.ndjson"],"command":".venv/bin/python -m py_compile scripts/bench_qwen35_cuda_wayfinder.py scripts/bench_nemotron_cuda_wayfinder.py scripts/serve_qwen_wayfinder_cuda.py scripts/serve_nemotron_wayfinder_cuda.py && .venv/bin/python scripts/bench_qwen35_cuda_wayfinder.py --model-path /home/hmbown/HF_Models/Qwen3.5-9B --seq-lens 64 128 256 512 1024 2048 4096 8192 --engine flex --warmup 2 --repeats 5 --output benchmarks/cuda/qwen35_wayfinder/EXP-20260318T171044Z-QWEN35CUDA-FLEX-SHORT.ndjson","controls":{"baseline_run_path":"benchmarks/cuda/qwen35_wayfinder/EXP-flex-engine-Qwen3.5-9B.ndjson","one_process_at_a_time":true,"retro_backfill_inference":"off","model_path":"/home/hmbown/HF_Models/Qwen3.5-9B","device":"cuda","gpu":"NVIDIA GB10","dtype":"bfloat16","engine":"flex","path":"permute on Qwen3.5 full-attention layers only; stock Qwen3.5 linear-attention layers remain unchanged","window":64,"landmark_stride":64,"num_cycles":1,"warmup":2,"repeats":5,"seq_lens":[64,128,256,512,1024,2048,4096,8192]},"metrics":{"status":"completed","artifacts":{"short_run":"benchmarks/cuda/qwen35_wayfinder/EXP-20260318T171044Z-QWEN35CUDA-FLEX-SHORT.ndjson","baseline_incomplete":"benchmarks/cuda/qwen35_wayfinder/EXP-flex-engine-Qwen3.5-9B.ndjson"},"wayfinder_activation":{"replaced_layers":[3,7,11,15,19,23,27,31],"active_layers_all_seq_lens":"8/8"},"dense_vs_wayfinder":{"latency_delta_pct_range":{"best":-3.45,"worst":4.28},"peak_memory_delta_pct_range":{"best":0.06,"worst":13.32},"t1024":{"dense":{"median_ms":729.88,"prefill_tok_per_sec":1403.0,"peak_mem_gb":17.64},"wayfinder":{"median_ms":704.7,"prefill_tok_per_sec":1453.1,"peak_mem_gb":18.05},"delta_wayfinder_minus_dense":{"median_ms_abs":-25.18,"median_ms_pct":-3.45,"prefill_tok_per_sec_abs":50.1,"prefill_tok_per_sec_pct":3.57,"peak_mem_gb_abs":0.41,"peak_mem_gb_pct":2.32,"memory_reduction_pct_convention":-2.32}},"t8192":{"dense":{"median_ms":7809.77,"prefill_tok_per_sec":1048.9,"peak_mem_gb":24.33},"wayfinder":{"median_ms":7819.19,"prefill_tok_per_sec":1047.7,"peak_mem_gb":27.57},"delta_wayfinder_minus_dense":{"median_ms_abs":9.42,"median_ms_pct":0.12,"prefill_tok_per_sec_abs":-1.2,"prefill_tok_per_sec_pct":-0.11,"peak_mem_gb_abs":3.24,"peak_mem_gb_pct":13.32,"memory_reduction_pct_convention":-13.32}}},"divergence":{"seq_len":64,"cosine_similarity":0.999922,"top1_agreement":1.0,"l2_relative":0.012486},"delta_vs_baseline_median_ms_note":"Overlap with EXP-flex-engine-Qwen3.5-9B is uniformly slower by +23.59%..+70.84%, and that baseline is missing required throughput/peak-memory fields, so it should be treated as an incomplete historical artifact rather than a trustworthy perf baseline."},"decision":"keep","next_action":"Run the long prefill sweep at 16384/32768/65536/131072/262144, then add a dedicated CUDA decode/perplexity harness because the current benchmark only measures prefill, memory, and divergence."}
{"id":"EXP-20260318T172410Z-QWEN35CUDA-FLEX-LONG-PRERUN","date":"2026-03-18","question":"At long contexts (16384, 32768, 65536, 131072, 262144), does Wayfinder on Qwen3.5-9B overtake or out-survive the stock hybrid baseline on prefill latency and peak memory?","hypothesis":"Because only Qwen3.5's 8 full-attention layers are swapped while 24 linear-attention layers remain stock, crossover may not appear until well beyond 8k; the meaningful win condition is long-prefill latency and/or survival at 64k+, with dense OOM treated as a valid result rather than a failure.","change_set":["measurement-only"],"command":".venv/bin/python scripts/bench_qwen35_cuda_wayfinder.py --model-path /home/hmbown/HF_Models/Qwen3.5-9B --seq-lens 16384 32768 65536 131072 262144 --engine flex --warmup 1 --repeats 3 --output benchmarks/cuda/qwen35_wayfinder/EXP-20260318T172410Z-QWEN35CUDA-FLEX-LONG.ndjson","controls":{"baseline_run_path":"benchmarks/cuda/qwen35_wayfinder/EXP-20260318T171044Z-QWEN35CUDA-FLEX-SHORT.ndjson","one_process_at_a_time":true,"retro_backfill_inference":"off","model_path":"/home/hmbown/HF_Models/Qwen3.5-9B","device":"cuda","gpu":"NVIDIA GB10","dtype":"bfloat16","engine":"flex","path":"permute on Qwen3.5 full-attention layers only; stock Qwen3.5 linear-attention layers remain unchanged","window":64,"landmark_stride":64,"num_cycles":1,"warmup":1,"repeats":3,"seq_lens":[16384,32768,65536,131072,262144],"stop_gates":["nonzero exit from benchmark command","missing output artifact","missing dense or wayfinder row for any requested seq_len","successful bench row missing prefill_tok_per_sec or peak_mem_gb","wayfinder successful row missing wayfinder_profiles or showing zero mode=wayfinder layers","dense or wayfinder OOM rows are valid measurements, not stop-gate failures"]},"metrics":{"status":"pending","artifacts_expected":["benchmarks/cuda/qwen35_wayfinder/EXP-20260318T172410Z-QWEN35CUDA-FLEX-LONG.ndjson"],"required":["bench[label=dense].median_ms or bench[label=dense].error","bench[label=wayfinder].median_ms or bench[label=wayfinder].error","bench[label=wayfinder].wayfinder_profiles for successful rows","divergence.cosine_similarity","divergence.top1_agreement","divergence.l2_relative"]},"decision":"pending","next_action":"Launch the long prefill sweep, then summarize the first seq_len where Wayfinder wins or the first seq_len where dense OOMs."}
{"id":"EXP-20260318T175055Z-QWEN35CUDA-LONGRUN-HARDENING-PRERUN","date":"2026-03-18","question":"Can we harden the Qwen CUDA long-context benchmark so it does not silently lose intermediate results or accumulate avoidable memory across sequence lengths?","hypothesis":"Adding an exclusive lock, incremental NDJSON writes, resume support, backbone-only benchmarking, immediate output deletion, and per-seq Wayfinder graph-cache clearing will remove the main failure amplifiers seen in the crash investigation and let us restart long sweeps safely.","change_set":["scripts/bench_qwen35_cuda_wayfinder.py"],"command":".venv/bin/python -m py_compile scripts/bench_qwen35_cuda_wayfinder.py && .venv/bin/python scripts/bench_qwen35_cuda_wayfinder.py --model-path /home/hmbown/HF_Models/Qwen3.5-9B --seq-lens 64 128 --engine flex --warmup 1 --repeats 1 --forward-target backbone --phases dense wayfinder --skip-divergence --output benchmarks/cuda/qwen35_wayfinder/EXP-20260318T-smoke-backbone.ndjson","controls":{"baseline_run_path":"benchmarks/cuda/qwen35_wayfinder/EXP-long-seq-Qwen3.5-9B.ndjson","one_process_at_a_time":true,"lock_file":"benchmarks/cuda/qwen35_wayfinder/.bench_qwen35_cuda_wayfinder.lock","retro_backfill_inference":"off","model_path":"/home/hmbown/HF_Models/Qwen3.5-9B","device":"cuda","gpu":"NVIDIA GB10","dtype":"bfloat16","engine":"flex","forward_target":"backbone","window":64,"landmark_stride":64,"num_cycles":1,"warmup":1,"repeats":1,"seq_lens":[64,128],"stop_gates":["nonzero exit from compile or smoke command","missing meta row before first model load","missing dense row append before Wayfinder model load","missing wayfinder row or wayfinder_profiles","missing graph-cache clear evidence between seq_lens"]},"metrics":{"status":"pending","artifacts_expected":["benchmarks/cuda/qwen35_wayfinder/EXP-20260318T-smoke-backbone.ndjson"],"required":["py_compile success","experiment_meta.forward_target","bench[label=dense].median_ms","bench[label=wayfinder].median_ms","bench[label=wayfinder].wayfinder_profiles","bench[label=wayfinder].wayfinder_graph_cache_entries_total"]},"decision":"pending","next_action":"Run the compile+smoke sequence and append a RESULT entry before any 16k/32k continuation."}
