{"id": "EXP-20260208-E2E-P4E-GLM-CHUNKED-HCSA-THR49152-RESULT", "date": "2026-02-08", "question": "In chunked prefill mode, does HCSA with active_dense_threshold=49152 provide a better speed/memory tradeoff vs dense and thr16384?", "hypothesis": "Higher threshold may trade some throughput for stability; expected to remain beneficial in long context.", "change_set": ["none (measurement-only benchmark run)", "swap enabled"], "command": "PYTHONPATH=/Volumes/VIXinSSD/wayfinder python3 scripts/bench_glm_chunked_prefill_mlx.py --model-path mlx-community/GLM-4.7-Flash-4bit --seq-lens 32768 65536 --chunk-sizes 4096 --decode-lens 0 1 --cache-modes normal --path permute --window 64 --landmark-stride 0 --head-chunk-size 2 --query-chunk-size 384 --active-dense-threshold 49152 --kv-step 4096 --baseline-path benchmarks/mlx/glm_4_7_flash_4bit_wayfinder/20260207_201347_fullmodel_prefill_kv_checkpoint/results.json --out-dir benchmarks/mlx/e2e_validation_20260208_192216/glm47_chunked_hcsa_thr49152", "controls": {"model_path": "mlx-community/GLM-4.7-Flash-4bit", "seq_lens": [32768, 65536], "chunk_sizes": [4096], "decode_lens": [0, 1], "cache_modes": ["normal"], "path": "permute", "window": 64, "landmark_stride": 0, "head_chunk_size": 2, "query_chunk_size": 384, "active_dense_threshold": 49152, "kv_step": 4096, "baseline_path": "benchmarks/mlx/e2e_validation_20260208_192216/glm47_chunked_dense/results.json"}, "metrics": {"artifact": "benchmarks/mlx/e2e_validation_20260208_192216/glm47_chunked_hcsa_thr49152/results.json", "rows": {"32768": {"cache_mode": "normal", "chunk_size": 4096, "seq_len": 32768, "max_kv_size": null, "no_swap": false, "kv_step": 4096, "retro_backfill_enabled": false, "ok": true, "baseline_seq_len_match": true, "prefill_only": {"sec": 174.28233099999488, "tok_s": 188.01676459101847, "peak_memory_bytes": 26018070576, "chunk_reports": [{"chunk_index": 0, "start": 0, "end": 4096, "tokens": 4096, "k_len": 4096, "sec": 22.491288999997778, "cache_state": {"layers": 47, "layer_type": "KVCache", "offset_min": 4096, "offset_max": 4096, "size_min": 4096, "size_max": 4096}, "peak_memory_bytes_after_chunk": 18929169896, "profile_sample": {"path": "permute_dense_fallback", "graph_build_ms": 0.0, "attention_ms": 0.39512500166893005, "cache_hit": true, "seq_len": null, "q_len": null, "graph_seq_len": null, "active_query_mode": null, "active_dense_threshold": 49152, "active_dense_triggered": true}}, {"chunk_index": 1, "start": 4096, "end": 8192, "tokens": 4096, "k_len": 8192, "sec": 10.301973916997667, "cache_state": {"layers": 47, "layer_type": "KVCache", "offset_min": 8192, "offset_max": 8192, "size_min": 8192, "size_max": 8192}, "peak_memory_bytes_after_chunk": 20660893536, "profile_sample": {"path": "permute_dense_fallback", "graph_build_ms": 0.0, "attention_ms": 0.015000015497207642, "cache_hit": true, "seq_len": null, "q_len": null, "graph_seq_len": null, "active_query_mode": null, "active_dense_threshold": 49152, "active_dense_triggered": true}}, {"chunk_index": 2, "start": 8192, "end": 12288, "tokens": 4096, "k_len": 12288, "sec": 13.75669999999809, "cache_state": {"layers": 47, "layer_type": "KVCache", "offset_min": 12288, "offset_max": 12288, "size_min": 12288, "size_max": 12288}, "peak_memory_bytes_after_chunk": 21553756376, "profile_sample": {"path": "permute_dense_fallback", "graph_build_ms": 0.0, "attention_ms": 0.015040993690490723, "cache_hit": true, "seq_len": null, "q_len": null, "graph_seq_len": null, "active_query_mode": null, "active_dense_threshold": 49152, "active_dense_triggered": true}}, {"chunk_index": 3, "start": 12288, "end": 16384, "tokens": 4096, "k_len": 16384, "sec": 17.317689457995584, "cache_state": {"layers": 47, "layer_type": "KVCache", "offset_min": 16384, "offset_max": 16384, "size_min": 16384, "size_max": 16384}, "peak_memory_bytes_after_chunk": 22446619216, "profile_sample": {"path": "permute_dense_fallback", "graph_build_ms": 0.0, "attention_ms": 0.01641601324081421, "cache_hit": true, "seq_len": null, "q_len": null, "graph_seq_len": null, "active_query_mode": null, "active_dense_threshold": 49152, "active_dense_triggered": true}}, {"chunk_index": 4, "start": 16384, "end": 20480, "tokens": 4096, "k_len": 20480, "sec": 20.86536641701241, "cache_state": {"layers": 47, "layer_type": "KVCache", "offset_min": 20480, "offset_max": 20480, "size_min": 20480, "size_max": 20480}, "peak_memory_bytes_after_chunk": 23339498440, "profile_sample": {"path": "permute_dense_fallback", "graph_build_ms": 0.0, "attention_ms": 0.015749990940093994, "cache_hit": true, "seq_len": null, "q_len": null, "graph_seq_len": null, "active_query_mode": null, "active_dense_threshold": 49152, "active_dense_triggered": true}}, {"chunk_index": 5, "start": 20480, "end": 24576, "tokens": 4096, "k_len": 24576, "sec": 24.538834457984194, "cache_state": {"layers": 47, "layer_type": "KVCache", "offset_min": 24576, "offset_max": 24576, "size_min": 24576, "size_max": 24576}, "peak_memory_bytes_after_chunk": 24232344896, "profile_sample": {"path": "permute_dense_fallback", "graph_build_ms": 0.0, "attention_ms": 0.016082972288131714, "cache_hit": true, "seq_len": null, "q_len": null, "graph_seq_len": null, "active_query_mode": null, "active_dense_threshold": 49152, "active_dense_triggered": true}}, {"chunk_index": 6, "start": 24576, "end": 28672, "tokens": 4096, "k_len": 28672, "sec": 29.251949625002453, "cache_state": {"layers": 47, "layer_type": "KVCache", "offset_min": 28672, "offset_max": 28672, "size_min": 28672, "size_max": 28672}, "peak_memory_bytes_after_chunk": 25125207736, "profile_sample": {"path": "permute_dense_fallback", "graph_build_ms": 0.0, "attention_ms": 0.016041994094848633, "cache_hit": true, "seq_len": null, "q_len": null, "graph_seq_len": null, "active_query_mode": null, "active_dense_threshold": 49152, "active_dense_triggered": true}}, {"chunk_index": 7, "start": 28672, "end": 32768, "tokens": 4096, "k_len": 32768, "sec": 35.57326866700896, "cache_state": {"layers": 47, "layer_type": "KVCache", "offset_min": 32768, "offset_max": 32768, "size_min": 32768, "size_max": 32768}, "peak_memory_bytes_after_chunk": 26018070576, "profile_sample": {"path": "permute_dense_fallback", "graph_build_ms": 0.0, "attention_ms": 0.0239579975605011, "cache_hit": true, "seq_len": null, "q_len": null, "graph_seq_len": null, "active_query_mode": null, "active_dense_threshold": 49152, "active_dense_triggered": true}}], "cache_state_end": {"layers": 47, "layer_type": "KVCache", "offset_min": 32768, "offset_max": 32768, "size_min": 32768, "size_max": 32768}, "comparison_vs_baseline": {"sec": {"absolute": 174.28233099999488, "baseline": 61.28745470799913, "delta_vs_baseline": 112.99487629199575, "delta_pct_vs_baseline": 184.3686882255984}, "tok_s": {"absolute": 188.01676459101847, "baseline": 534.6608071116906, "delta_vs_baseline": -346.6440425206721, "delta_pct_vs_baseline": -64.83438432551092}, "peak_memory_bytes": {"absolute": 26018070576.0, "baseline": 28928288404, "delta_vs_baseline": -2910217828.0, "delta_pct_vs_baseline": -10.060110668689253}, "memory_reduction_pct_vs_baseline": 10.060110668689248}}, "prefill_plus_1": {"prefill_sec": 174.28233099999488, "decode_sec": 6.4599288330064155, "total_sec": 180.7422598330013, "prefill_tok_s": 188.01676459101847, "decode_tok_s": 0.15480046697892266, "peak_memory_bytes": 26018070576, "chunk_reports": [{"chunk_index": 0, "start": 0, "end": 4096, "tokens": 4096, "k_len": 4096, "sec": 22.491288999997778, "cache_state": {"layers": 47, "layer_type": "KVCache", "offset_min": 4096, "offset_max": 4096, "size_min": 4096, "size_max": 4096}, "peak_memory_bytes_after_chunk": 18929169896, "profile_sample": {"path": "permute_dense_fallback", "graph_build_ms": 0.0, "attention_ms": 0.39512500166893005, "cache_hit": true, "seq_len": null, "q_len": null, "graph_seq_len": null, "active_query_mode": null, "active_dense_threshold": 49152, "active_dense_triggered": true}}, {"chunk_index": 1, "start": 4096, "end": 8192, "tokens": 4096, "k_len": 8192, "sec": 10.301973916997667, "cache_state": {"layers": 47, "layer_type": "KVCache", "offset_min": 8192, "offset_max": 8192, "size_min": 8192, "size_max": 8192}, "peak_memory_bytes_after_chunk": 20660893536, "profile_sample": {"path": "permute_dense_fallback", "graph_build_ms": 0.0, "attention_ms": 0.015000015497207642, "cache_hit": true, "seq_len": null, "q_len": null, "graph_seq_len": null, "active_query_mode": null, "active_dense_threshold": 49152, "active_dense_triggered": true}}, {"chunk_index": 2, "start": 8192, "end": 12288, "tokens": 4096, "k_len": 12288, "sec": 13.75669999999809, "cache_state": {"layers": 47, "layer_type": "KVCache", "offset_min": 12288, "offset_max": 12288, "size_min": 12288, "size_max": 12288}, "peak_memory_bytes_after_chunk": 21553756376, "profile_sample": {"path": "permute_dense_fallback", "graph_build_ms": 0.0, "attention_ms": 0.015040993690490723, "cache_hit": true, "seq_len": null, "q_len": null, "graph_seq_len": null, "active_query_mode": null, "active_dense_threshold": 49152, "active_dense_triggered": true}}, {"chunk_index": 3, "start": 12288, "end": 16384, "tokens": 4096, "k_len": 16384, "sec": 17.317689457995584, "cache_state": {"layers": 47, "layer_type": "KVCache", "offset_min": 16384, "offset_max": 16384, "size_min": 16384, "size_max": 16384}, "peak_memory_bytes_after_chunk": 22446619216, "profile_sample": {"path": "permute_dense_fallback", "graph_build_ms": 0.0, "attention_ms": 0.01641601324081421, "cache_hit": true, "seq_len": null, "q_len": null, "graph_seq_len": null, "active_query_mode": null, "active_dense_threshold": 49152, "active_dense_triggered": true}}, {"chunk_index": 4, "start": 16384, "end": 20480, "tokens": 4096, "k_len": 20480, "sec": 20.86536641701241, "cache_state": {"layers": 47, "layer_type": "KVCache", "offset_min": 20480, "offset_max": 20480, "size_min": 20480, "size_max": 20480}, "peak_memory_bytes_after_chunk": 23339498440, "profile_sample": {"path": "permute_dense_fallback", "graph_build_ms": 0.0, "attention_ms": 0.015749990940093994, "cache_hit": true, "seq_len": null, "q_len": null, "graph_seq_len": null, "active_query_mode": null, "active_dense_threshold": 49152, "active_dense_triggered": true}}, {"chunk_index": 5, "start": 20480, "end": 24576, "tokens": 4096, "k_len": 24576, "sec": 24.538834457984194, "cache_state": {"layers": 47, "layer_type": "KVCache", "offset_min": 24576, "offset_max": 24576, "size_min": 24576, "size_max": 24576}, "peak_memory_bytes_after_chunk": 24232344896, "profile_sample": {"path": "permute_dense_fallback", "graph_build_ms": 0.0, "attention_ms": 0.016082972288131714, "cache_hit": true, "seq_len": null, "q_len": null, "graph_seq_len": null, "active_query_mode": null, "active_dense_threshold": 49152, "active_dense_triggered": true}}, {"chunk_index": 6, "start": 24576, "end": 28672, "tokens": 4096, "k_len": 28672, "sec": 29.251949625002453, "cache_state": {"layers": 47, "layer_type": "KVCache", "offset_min": 28672, "offset_max": 28672, "size_min": 28672, "size_max": 28672}, "peak_memory_bytes_after_chunk": 25125207736, "profile_sample": {"path": "permute_dense_fallback", "graph_build_ms": 0.0, "attention_ms": 0.016041994094848633, "cache_hit": true, "seq_len": null, "q_len": null, "graph_seq_len": null, "active_query_mode": null, "active_dense_threshold": 49152, "active_dense_triggered": true}}, {"chunk_index": 7, "start": 28672, "end": 32768, "tokens": 4096, "k_len": 32768, "sec": 35.57326866700896, "cache_state": {"layers": 47, "layer_type": "KVCache", "offset_min": 32768, "offset_max": 32768, "size_min": 32768, "size_max": 32768}, "peak_memory_bytes_after_chunk": 26018070576, "profile_sample": {"path": "permute_dense_fallback", "graph_build_ms": 0.0, "attention_ms": 0.0239579975605011, "cache_hit": true, "seq_len": null, "q_len": null, "graph_seq_len": null, "active_query_mode": null, "active_dense_threshold": 49152, "active_dense_triggered": true}}], "cache_state_after_prefill": {"layers": 47, "layer_type": "KVCache", "offset_min": 32768, "offset_max": 32768, "size_min": 32768, "size_max": 32768}, "cache_state_end": {"layers": 47, "layer_type": "KVCache", "offset_min": 32769, "offset_max": 32769, "size_min": 32769, "size_max": 32769}, "ttft_sec": 6.445882166997762, "itl_p50_sec": 6.445882166997762, "itl_p95_sec": 6.445882166997762, "comparison_vs_baseline": {"prefill_sec": {"absolute": 174.28233099999488, "baseline": 85.62437291700189, "delta_vs_baseline": 88.65795808299299, "delta_pct_vs_baseline": 103.54289913332462}, "decode_sec": {"absolute": 6.4599288330064155, "baseline": null, "delta_vs_baseline": null, "delta_pct_vs_baseline": null}, "total_sec": {"absolute": 180.7422598330013, "baseline": 106.03095458399912, "delta_vs_baseline": 74.71130524900218, "delta_pct_vs_baseline": 70.46178688301339}, "prefill_tok_s": {"absolute": 188.01676459101847, "baseline": 382.69477350523715, "delta_vs_baseline": -194.67800891421868, "delta_pct_vs_baseline": -50.87030772097925}, "decode_tok_s": {"absolute": 0.15480046697892266, "baseline": null, "delta_vs_baseline": null, "delta_pct_vs_baseline": null}, "ttft_sec": {"absolute": 6.445882166997762, "baseline": null, "delta_vs_baseline": null, "delta_pct_vs_baseline": null}, "itl_p50_sec": {"absolute": 6.445882166997762, "baseline": null, "delta_vs_baseline": null, "delta_pct_vs_baseline": null}, "itl_p95_sec": {"absolute": 6.445882166997762, "baseline": null, "delta_vs_baseline": null, "delta_pct_vs_baseline": null}, "peak_memory_bytes": {"absolute": 26018070576.0, "baseline": 29053543348, "delta_vs_baseline": -3035472772.0, "delta_pct_vs_baseline": -10.447857377124215}, "memory_reduction_pct_vs_baseline": 10.447857377124215}}, "case_elapsed_sec": 180.74985837499844}, "65536": {"cache_mode": "normal", "chunk_size": 4096, "seq_len": 65536, "max_kv_size": null, "no_swap": false, "kv_step": 4096, "retro_backfill_enabled": false, "ok": true, "baseline_seq_len_match": true, "prefill_only": {"sec": 511.3559894160135, "tok_s": 128.16120541551575, "peak_memory_bytes": 29589653016, "chunk_reports": [{"chunk_index": 0, "start": 0, "end": 4096, "tokens": 4096, "k_len": 4096, "sec": 6.407837250008015, "cache_state": {"layers": 47, "layer_type": "KVCache", "offset_min": 4096, "offset_max": 4096, "size_min": 4096, "size_max": 4096}, "peak_memory_bytes_after_chunk": 19768161776, "profile_sample": {"path": "permute_dense_fallback", "graph_build_ms": 0.0, "attention_ms": 0.01774996519088745, "cache_hit": true, "seq_len": null, "q_len": null, "graph_seq_len": null, "active_query_mode": null, "active_dense_threshold": 49152, "active_dense_triggered": true}}, {"chunk_index": 1, "start": 4096, "end": 8192, "tokens": 4096, "k_len": 8192, "sec": 9.628129207994789, "cache_state": {"layers": 47, "layer_type": "KVCache", "offset_min": 8192, "offset_max": 8192, "size_min": 8192, "size_max": 8192}, "peak_memory_bytes_after_chunk": 20661024616, "profile_sample": {"path": "permute_dense_fallback", "graph_build_ms": 0.0, "attention_ms": 0.014624983072280884, "cache_hit": true, "seq_len": null, "q_len": null, "graph_seq_len": null, "active_query_mode": null, "active_dense_threshold": 49152, "active_dense_triggered": true}}, {"chunk_index": 2, "start": 8192, "end": 12288, "tokens": 4096, "k_len": 12288, "sec": 12.834351875004359, "cache_state": {"layers": 47, "layer_type": "KVCache", "offset_min": 12288, "offset_max": 12288, "size_min": 12288, "size_max": 12288}, "peak_memory_bytes_after_chunk": 21553887456, "profile_sample": {"path": "permute_dense_fallback", "graph_build_ms": 0.0, "attention_ms": 0.014249980449676514, "cache_hit": true, "seq_len": null, "q_len": null, "graph_seq_len": null, "active_query_mode": null, "active_dense_threshold": 49152, "active_dense_triggered": true}}, {"chunk_index": 3, "start": 12288, "end": 16384, "tokens": 4096, "k_len": 16384, "sec": 16.045242207997944, "cache_state": {"layers": 47, "layer_type": "KVCache", "offset_min": 16384, "offset_max": 16384, "size_min": 16384, "size_max": 16384}, "peak_memory_bytes_after_chunk": 22446750296, "profile_sample": {"path": "permute_dense_fallback", "graph_build_ms": 0.0, "attention_ms": 0.015083014965057373, "cache_hit": true, "seq_len": null, "q_len": null, "graph_seq_len": null, "active_query_mode": null, "active_dense_threshold": 49152, "active_dense_triggered": true}}, {"chunk_index": 4, "start": 16384, "end": 20480, "tokens": 4096, "k_len": 20480, "sec": 19.260161583981244, "cache_state": {"layers": 47, "layer_type": "KVCache", "offset_min": 20480, "offset_max": 20480, "size_min": 20480, "size_max": 20480}, "peak_memory_bytes_after_chunk": 23339629520, "profile_sample": {"path": "permute_dense_fallback", "graph_build_ms": 0.0, "attention_ms": 0.025207996368408203, "cache_hit": true, "seq_len": null, "q_len": null, "graph_seq_len": null, "active_query_mode": null, "active_dense_threshold": 49152, "active_dense_triggered": true}}, {"chunk_index": 5, "start": 20480, "end": 24576, "tokens": 4096, "k_len": 24576, "sec": 22.449344541004393, "cache_state": {"layers": 47, "layer_type": "KVCache", "offset_min": 24576, "offset_max": 24576, "size_min": 24576, "size_max": 24576}, "peak_memory_bytes_after_chunk": 24232475976, "profile_sample": {"path": "permute_dense_fallback", "graph_build_ms": 0.0, "attention_ms": 0.015208005905151367, "cache_hit": true, "seq_len": null, "q_len": null, "graph_seq_len": null, "active_query_mode": null, "active_dense_threshold": 49152, "active_dense_triggered": true}}, {"chunk_index": 6, "start": 24576, "end": 28672, "tokens": 4096, "k_len": 28672, "sec": 26.36503491702024, "cache_state": {"layers": 47, "layer_type": "KVCache", "offset_min": 28672, "offset_max": 28672, "size_min": 28672, "size_max": 28672}, "peak_memory_bytes_after_chunk": 25125338816, "profile_sample": {"path": "permute_dense_fallback", "graph_build_ms": 0.0, "attention_ms": 0.014999985694885254, "cache_hit": true, "seq_len": null, "q_len": null, "graph_seq_len": null, "active_query_mode": null, "active_dense_threshold": 49152, "active_dense_triggered": true}}, {"chunk_index": 7, "start": 28672, "end": 32768, "tokens": 4096, "k_len": 32768, "sec": 30.282458208006574, "cache_state": {"layers": 47, "layer_type": "KVCache", "offset_min": 32768, "offset_max": 32768, "size_min": 32768, "size_max": 32768}, "peak_memory_bytes_after_chunk": 26018201656, "profile_sample": {"path": "permute_dense_fallback", "graph_build_ms": 0.0, "attention_ms": 0.01670798659324646, "cache_hit": true, "seq_len": null, "q_len": null, "graph_seq_len": null, "active_query_mode": null, "active_dense_threshold": 49152, "active_dense_triggered": true}}, {"chunk_index": 8, "start": 32768, "end": 36864, "tokens": 4096, "k_len": 36864, "sec": 33.69366970899864, "cache_state": {"layers": 47, "layer_type": "KVCache", "offset_min": 36864, "offset_max": 36864, "size_min": 36864, "size_max": 36864}, "peak_memory_bytes_after_chunk": 26911064496, "profile_sample": {"path": "permute_dense_fallback", "graph_build_ms": 0.0, "attention_ms": 0.018792003393173218, "cache_hit": true, "seq_len": null, "q_len": null, "graph_seq_len": null, "active_query_mode": null, "active_dense_threshold": 49152, "active_dense_triggered": true}}, {"chunk_index": 9, "start": 36864, "end": 40960, "tokens": 4096, "k_len": 40960, "sec": 40.19287812500261, "cache_state": {"layers": 47, "layer_type": "KVCache", "offset_min": 40960, "offset_max": 40960, "size_min": 40960, "size_max": 40960}, "peak_memory_bytes_after_chunk": 27803927336, "profile_sample": {"path": "permute_dense_fallback", "graph_build_ms": 0.0, "attention_ms": 0.017291009426116943, "cache_hit": true, "seq_len": null, "q_len": null, "graph_seq_len": null, "active_query_mode": null, "active_dense_threshold": 49152, "active_dense_triggered": true}}, {"chunk_index": 10, "start": 40960, "end": 45056, "tokens": 4096, "k_len": 45056, "sec": 52.76940312498482, "cache_state": {"layers": 47, "layer_type": "KVCache", "offset_min": 45056, "offset_max": 45056, "size_min": 45056, "size_max": 45056}, "peak_memory_bytes_after_chunk": 28696790176, "profile_sample": {"path": "permute_dense_fallback", "graph_build_ms": 0.0, "attention_ms": 0.014833003282546997, "cache_hit": true, "seq_len": null, "q_len": null, "graph_seq_len": null, "active_query_mode": null, "active_dense_threshold": 49152, "active_dense_triggered": true}}, {"chunk_index": 11, "start": 45056, "end": 49152, "tokens": 4096, "k_len": 49152, "sec": 64.62507195799844, "cache_state": {"layers": 47, "layer_type": "KVCache", "offset_min": 49152, "offset_max": 49152, "size_min": 49152, "size_max": 49152}, "peak_memory_bytes_after_chunk": 29589653016, "profile_sample": {"path": "permute_dense_fallback", "graph_build_ms": 0.0, "attention_ms": 0.0188329815864563, "cache_hit": true, "seq_len": null, "q_len": null, "graph_seq_len": null, "active_query_mode": null, "active_dense_threshold": 49152, "active_dense_triggered": true}}, {"chunk_index": 12, "start": 49152, "end": 53248, "tokens": 4096, "k_len": 53248, "sec": 74.45787166699301, "cache_state": {"layers": 47, "layer_type": "KVCache", "offset_min": 53248, "offset_max": 53248, "size_min": 53248, "size_max": 53248}, "peak_memory_bytes_after_chunk": 29589653016, "profile_sample": {"path": "permute", "graph_build_ms": 27043.88566699624, "attention_ms": 1292.6187500059605, "cache_hit": false, "seq_len": 53248, "q_len": 4096, "graph_seq_len": 65536, "active_query_mode": true, "active_dense_threshold": 49152, "active_dense_triggered": false}}, {"chunk_index": 13, "start": 53248, "end": 57344, "tokens": 4096, "k_len": 57344, "sec": 31.51797420802177, "cache_state": {"layers": 47, "layer_type": "KVCache", "offset_min": 57344, "offset_max": 57344, "size_min": 57344, "size_max": 57344}, "peak_memory_bytes_after_chunk": 29589653016, "profile_sample": {"path": "permute", "graph_build_ms": 0.004417002201080322, "attention_ms": 721.241084009409, "cache_hit": true, "seq_len": 57344, "q_len": 4096, "graph_seq_len": 65536, "active_query_mode": true, "active_dense_threshold": 49152, "active_dense_trigg