{"id":"EXP-20260208-DISCOVER-SETUP-SCAFFOLD","date":"2026-02-08","question":"Can we prepare K1-K5 fused-kernel discovery scaffolding and readiness checks without running model loading, inference, or attention benchmarks?","hypothesis":"A setup-only workflow will generate target metadata, seed kernel placeholders, and session stubs while preserving inference-safe defaults.","change_set":["Add hcsa/discover setup modules","Add wayc discover-* subcommands","Add setup-only docs and tests"],"command":"python3 scripts/wayc.py discover-setup --targets all --zmlx-root /Volumes/VIXinSSD/ZMLX --sessions-root discover_sessions --kernel-out-root hcsa/mlx/kernels/metal --dry-run && python3 -m pytest tests/test_discover_targets.py tests/test_discover_setup.py tests/test_wayc_discover_cli.py -q","controls":{"models_loaded":false,"inference_executed":false,"attention_bench_executed":false,"retro_backfill_default_off":true,"baseline_path":"N/A setup-only"},"metrics":{"status":"pending"},"decision":"pending","next_action":"Run setup-only validation and append result entry."}
{"id":"EXP-20260208-DISCOVER-SETUP-SCAFFOLD-RESULT","date":"2026-02-08","question":"Can we prepare K1-K5 fused-kernel discovery scaffolding and readiness checks without running model loading, inference, or attention benchmarks?","hypothesis":"A setup-only workflow will generate target metadata, seed kernel placeholders, and session stubs while preserving inference-safe defaults.","change_set":["Added hcsa/discover/{targets,readiness,session}.py","Added scripts/wayc.py discover-targets/discover-setup/discover-status","Added docs/discover_setup.md and README/docs wiring","Added tests/test_discover_targets.py, tests/test_discover_setup.py, tests/test_wayc_discover_cli.py"],"command":"python3 scripts/wayc.py discover-setup --targets all --zmlx-root /Volumes/VIXinSSD/ZMLX --sessions-root discover_sessions --kernel-out-root hcsa/mlx/kernels/metal --strict --overwrite --json-out runs/mlx/discover_setup_20260208_setup.json && python3 -m pytest tests/test_discover_targets.py tests/test_discover_setup.py tests/test_wayc_discover_cli.py -q && python3 scripts/wayc.py discover-status --manifest discover_sessions/manifest.json","controls":{"models_loaded":false,"inference_executed":false,"attention_bench_executed":false,"retro_backfill_default_off":true,"baseline_path":"N/A setup-only"},"metrics":{"artifact":"runs/mlx/discover_setup_20260208_setup.json","manifest":"discover_sessions/manifest.json","ready":true,"target_count":5,"seed_kernels_written":5,"session_stubs_written":5,"required_checks_total":12,"required_checks_passed":12,"pytest_passed":7,"pytest_failed":0,"comparison":{"absolute":1.0,"delta_vs_baseline":0.0,"delta_pct_vs_baseline":0.0}},"decision":"keep","next_action":"Use discover_sessions/hcsa_permute_window_session.stub.json to launch first K1 search when kernel search execution is approved."}
{"id": "EXP-20260208-K4-DISCOVER-SEARCH", "date": "2026-02-08", "question": "Can K4 (hcsa_active_row) run as a real discover search in ZMLX with correctness+timing evaluation enabled so we can export a candidate for integration?", "hypothesis": "A correctness-first seed will compile and pass reference checks, producing a valid session and exportable best candidate.", "change_set": ["/Volumes/VIXinSSD/ZMLX/src/zmlx/discover/targets.py: add hcsa_active_row and hcsa_permute_window target registrations"], "command": "PYTHONPATH=/Volumes/VIXinSSD/ZMLX/src python3 -m zmlx.discover search hcsa_active_row --llm mock --steps 2 --candidates-per-step 4 --warmup 3 --iters 10 --timeout 20 --session-dir /Volumes/VIXinSSD/wayfinder/discover_sessions -v", "controls": {"discover_pipeline": "compile_correctness_timing", "baseline_path": "/Volumes/VIXinSSD/wayfinder/discover_sessions/hcsa_active_row_session.json (metadata.baseline_us)", "retro_backfill_default_off": true}, "metrics": {"status": "pending"}, "decision": "pending", "next_action": "Execute search, export best candidate, and log baseline vs best speedup."}
{"id": "EXP-20260208-K4-DISCOVER-SEARCH-RESULT", "date": "2026-02-08", "question": "Can K4 (hcsa_active_row) run as a real discover search in ZMLX with correctness+timing evaluation enabled so we can export a candidate for integration?", "hypothesis": "A correctness-first seed will compile and pass reference checks, producing a valid session and exportable best candidate.", "change_set": ["/Volumes/VIXinSSD/ZMLX/src/zmlx/discover/targets.py: add hcsa_active_row and hcsa_permute_window target registrations", "/Volumes/VIXinSSD/wayfinder/hcsa/mlx/kernels/metal/hcsa_active_row_fused_discovered.py: exported discovered kernel wrapper", "/Volumes/VIXinSSD/wayfinder/hcsa/mlx/kernels/metal/hcsa_active_row_fused_discovered.metal: exported best kernel source"], "command": "PYTHONPATH=/Volumes/VIXinSSD/ZMLX/src python3 -m zmlx.discover search hcsa_active_row --llm mock --steps 2 --candidates-per-step 4 --warmup 3 --iters 10 --timeout 20 --session-dir /Volumes/VIXinSSD/wayfinder/discover_sessions -v", "controls": {"discover_pipeline": "compile_correctness_timing", "baseline_path": "/Volumes/VIXinSSD/wayfinder/discover_sessions/hcsa_active_row_session.json", "retro_backfill_default_off": true}, "metrics": {"artifact": "/Volumes/VIXinSSD/wayfinder/discover_sessions/hcsa_active_row_session.json", "baseline_us": 182.917, "best_median_us": 136.334, "delta_us_vs_baseline": -46.583, "delta_pct_vs_baseline": -25.4667417462565, "best_speedup": 1.3416829257558642, "total_candidates": 8, "total_evaluated": 8}, "decision": "keep", "next_action": "Integrate K4 dispatch into GLM q_len<k_len path with safe dense fallback, then benchmark chunked prefill vs named dense baseline."}
{"id": "EXP-20260208-K4-CHUNKED-PREFILL-INTEGRATION", "date": "2026-02-08", "question": "After wiring discovered-K4 availability into GLM dispatch, does chunked prefill (Q_len < K_len) stop dense fallback and improve throughput versus the named dense baseline?", "hypothesis": "With discovered K4 artifact present, active-row path should be used for Q_len < K_len, reducing prefill latency and increasing prefill tok/s versus dense baseline at T=32768.", "change_set": ["/Volumes/VIXinSSD/wayfinder/hcsa/mlx/kernels/metal/__init__.py", "/Volumes/VIXinSSD/wayfinder/hcsa/integrations/glm_mlx.py"], "command": "PYTHONPATH=/Volumes/VIXinSSD/wayfinder python3 scripts/bench_glm_chunked_prefill_mlx.py --model-path mlx-community/GLM-4.7-Flash-4bit --seq-lens 32768 --chunk-sizes 4096 --decode-lens 0 1 --cache-modes normal --path permute --window 64 --landmark-stride 0 --head-chunk-size 2 --query-chunk-size 384 --active-dense-threshold 49152 --kv-step 4096 --baseline-path benchmarks/mlx/e2e_validation_20260208_192216/glm47_chunked_dense/results.json --out-dir benchmarks/mlx/k4_active_row_discovered_20260208_225935", "controls": {"model_path": "mlx-community/GLM-4.7-Flash-4bit", "original_non_qwen_path": true, "retro_backfill_default_off": true, "baseline_path": "benchmarks/mlx/e2e_validation_20260208_192216/glm47_chunked_dense/results.json"}, "metrics": {"status": "pending"}, "decision": "pending", "next_action": "Run benchmark and report absolute/delta/% plus profile-path evidence for active-row dispatch."}
{"id": "EXP-20260208-K4-CHUNKED-PREFILL-INTEGRATION-RESULT", "date": "2026-02-08", "question": "After wiring discovered-K4 availability into GLM dispatch, does chunked prefill (Q_len < K_len) stop dense fallback and improve throughput versus the named dense baseline?", "hypothesis": "With discovered K4 artifact present, active-row path should be used for Q_len < K_len, reducing prefill latency and increasing prefill tok/s versus dense baseline at T=32768.", "change_set": ["/Volumes/VIXinSSD/wayfinder/hcsa/mlx/kernels/metal/__init__.py", "/Volumes/VIXinSSD/wayfinder/hcsa/integrations/glm_mlx.py"], "command": "PYTHONPATH=/Volumes/VIXinSSD/wayfinder python3 scripts/bench_glm_chunked_prefill_mlx.py --model-path mlx-community/GLM-4.7-Flash-4bit --seq-lens 32768 --chunk-sizes 4096 --decode-lens 0 1 --cache-modes normal --path permute --window 64 --landmark-stride 0 --head-chunk-size 2 --query-chunk-size 384 --active-dense-threshold 49152 --kv-step 4096 --baseline-path benchmarks/mlx/e2e_validation_20260208_192216/glm47_chunked_dense/results.json --out-dir benchmarks/mlx/k4_active_row_discovered_20260208_225935", "controls": {"model_path": "mlx-community/GLM-4.7-Flash-4bit", "original_non_qwen_path": true, "retro_backfill_default_off": true, "baseline_path": "benchmarks/mlx/e2e_validation_20260208_192216/glm47_chunked_dense/results.json"}, "metrics": {"status": "interrupted", "output_dir": "benchmarks/mlx/k4_active_row_discovered_20260208_225935", "results_present": false, "reason": "stalled_without_results"}, "decision": "follow_up", "next_action": "Run bounded T=8192 dense baseline and K4-enabled counterpart to capture actionable deltas."}
{"id": "EXP-20260208-K4-CHUNKED-8192-DENSE-BASELINE", "date": "2026-02-08", "question": "What is the bounded dense-control chunked-prefill baseline at T=8192, chunk=4096 on the original GLM path?", "hypothesis": "Dense control run will complete and provide a stable named baseline for K4-enabled comparison.", "change_set": ["none (measurement-only baseline run)"], "command": "PYTHONPATH=/Volumes/VIXinSSD/wayfinder python3 scripts/bench_glm_chunked_prefill_mlx.py --model-path mlx-community/GLM-4.7-Flash-4bit --seq-lens 8192 --chunk-sizes 4096 --decode-lens 0 1 --cache-modes normal --path permute --window 64 --landmark-stride 0 --head-chunk-size 2 --query-chunk-size 384 --active-dense-threshold 49152 --kv-step 4096 --no-swap --out-dir benchmarks/mlx/k4_active_row_20260208_8192_dense", "controls": {"model_path": "mlx-community/GLM-4.7-Flash-4bit", "original_non_qwen_path": true, "retro_backfill_default_off": true, "no_swap": true, "baseline_path": "N/A baseline-capture"}, "metrics": {"status": "pending"}, "decision": "pending", "next_action": "Execute baseline run and use its results.json for K4-enabled delta computation."}
{"id": "EXP-20260208-K4-CHUNKED-8192-DENSE-BASELINE-RESULT", "date": "2026-02-08", "question": "What is the bounded dense-control chunked-prefill baseline at T=8192, chunk=4096 on the original GLM path?", "hypothesis": "Dense control run will complete and provide a stable named baseline for K4-enabled comparison.", "change_set": ["none (measurement-only baseline run)"], "command": "PYTHONPATH=/Volumes/VIXinSSD/wayfinder python3 scripts/bench_glm_chunked_prefill_mlx.py --model-path mlx-community/GLM-4.7-Flash-4bit --seq-lens 8192 --chunk-sizes 4096 --decode-lens 0 1 --cache-modes normal --path permute --window 64 --landmark-stride 0 --head-chunk-size 2 --query-chunk-size 384 --active-dense-threshold 49152 --kv-step 4096 --no-swap --out-dir benchmarks/mlx/k4_active_row_20260208_8192_dense", "controls": {"model_path": "mlx-community/GLM-4.7-Flash-4bit", "original_non_qwen_path": true, "retro_backfill_default_off": true, "no_swap": true, "baseline_path": "benchmarks/mlx/k4_active_row_20260208_8192_dense/results.json"}, "metrics": {"artifact": "/Volumes/VIXinSSD/wayfinder/benchmarks/mlx/k4_active_row_20260208_8192_dense/results.json", "baseline_seq_len_match": false, "prefill_only": {"sec": 108.4069417080027, "tok_s": 75.56711656035269, "peak_memory_bytes": 20660795044}, "prefill_plus_1": {"total_sec": 108.93530520799686, "prefill_tok_s": 75.56711656035269, "decode_tok_s": 1.8926364141562748, "peak_memory_bytes": 20660795044}, "comparison": {"absolute": 1.0, "delta_vs_baseline": 0.0, "delta_pct_vs_baseline": 0.0}}, "decision": "keep", "next_action": "Run K4-enabled counterpart against this named baseline path and compute deltas."}
{"id": "EXP-20260208-K4-CHUNKED-8192-DISCOVERED", "date": "2026-02-08", "question": "With discovered K4 artifact present, does GLM chunked prefill at T=8192 improve versus the named dense baseline and avoid permute_dense_fallback for active chunks?", "hypothesis": "K4-enabled dispatch should route active chunks (Q_len < K_len) through permute active mode, improving prefill throughput and reducing latency vs dense baseline.", "change_set": ["/Volumes/VIXinSSD/wayfinder/hcsa/mlx/kernels/metal/hcsa_active_row_fused_discovered.metal", "/Volumes/VIXinSSD/wayfinder/hcsa/mlx/kernels/metal/__init__.py", "/Volumes/VIXinSSD/wayfinder/hcsa/integrations/glm_mlx.py"], "command": "PYTHONPATH=/Volumes/VIXinSSD/wayfinder python3 scripts/bench_glm_chunked_prefill_mlx.py --model-path mlx-community/GLM-4.7-Flash-4bit --seq-lens 8192 --chunk-sizes 4096 --decode-lens 0 1 --cache-modes normal --path permute --window 64 --landmark-stride 0 --head-chunk-size 2 --query-chunk-size 384 --active-dense-threshold 49152 --kv-step 4096 --baseline-path benchmarks/mlx/k4_active_row_20260208_8192_dense/results.json --out-dir benchmarks/mlx/k4_active_row_20260208_8192_k4", "controls": {"model_path": "mlx-community/GLM-4.7-Flash-4bit", "original_non_qwen_path": true, "retro_backfill_default_off": true, "baseline_path": "benchmarks/mlx/k4_active_row_20260208_8192_dense/results.json"}, "metrics": {"status": "pending"}, "decision": "pending", "next_action": "Run benchmark and compute absolute/delta/% plus active-path profile evidence."}
{"id": "EXP-20260208-K4-CHUNKED-8192-DISCOVERED-RESULT", "date": "2026-02-08", "question": "With discovered K4 artifact present, does GLM chunked prefill at T=8192 improve versus the named dense baseline and avoid permute_dense_fallback for active chunks?", "hypothesis": "K4-enabled dispatch should route active chunks (Q_len < K_len) through permute active mode, improving prefill throughput and reducing latency vs dense baseline.", "change_set": ["/Volumes/VIXinSSD/wayfinder/hcsa/mlx/kernels/metal/hcsa_active_row_fused_discovered.metal", "/Volumes/VIXinSSD/wayfinder/hcsa/mlx/kernels/metal/__init__.py", "/Volumes/VIXinSSD/wayfinder/hcsa/integrations/glm_mlx.py"], "command": "PYTHONPATH=/Volumes/VIXinSSD/wayfinder python3 scripts/bench_glm_chunked_prefill_mlx.py --model-path mlx-community/GLM-4.7-Flash-4bit --seq-lens 8192 --chunk-sizes 4096 --decode-lens 0 1 --cache-modes normal --path permute --window 64 --landmark-stride 0 --head-chunk-size 2 --query-chunk-size 384 --active-dense-threshold 49152 --kv-step 4096 --baseline-path benchmarks/mlx/k4_active_row_20260208_8192_dense/results.json --out-dir benchmarks/mlx/k4_active_row_20260208_8192_k4", "controls": {"model_path": "mlx-community/GLM-4.7-Flash-4bit", "original_non_qwen_path": true, "retro_backfill_default_off": true, "baseline_path": "benchmarks/mlx/k4_active_row_20260208_8192_dense/results.json"}, "metrics": {"artifact": "/Volumes/VIXinSSD/wayfinder/benchmarks/mlx/k4_active_row_20260208_8192_k4/results.json", "prefill_only": {"sec": {"absolute": 68.57933649999904, "baseline": 108.4069417080027, "delta_vs_baseline": -39.82760520800366, "delta_pct_vs_baseline": -36.73898053067533}, "tok_s": {"absolute": 119.45289088645694, "baseline": 75.56711656035269, "delta_vs_baseline": 43.885774326104254, "delta_pct_vs_baseline": 58.07522679663752}, "peak_memory_bytes": {"absolute": 21441617192.0, "baseline": 20660795044, "delta_vs_baseline": 780822148.0, "delta_pct_vs_baseline": 3.7792454082097615}, "memory_reduction_pct_vs_baseline": -3.7792454082097526}, "prefill_plus_1": {"total_sec": {"absolute": 68.96474120899802, "baseline": 108.93530520799686, "delta_vs_baseline": -39.97056399899884, "delta_pct_vs_baseline": -36.692020022967384}, "prefill_tok_s": {"absolute": 119.45289088645694, "baseline": 75.56711656035269, "delta_vs_baseline": 43.885774326104254, "delta_pct_vs_baseline": 58.07522679663752}, "peak_memory_bytes": {"absolute": 21441617192.0, "baseline": 20660795044, "delta_vs_baseline": 780822148.0, "delta_pct_vs_baseline": 3.7792454082097615}, "memory_reduction_pct_vs_baseline": -3.7792454082097526}, "path_evidence": [{"chunk_index": 0, "path": "permute", "active_query_mode": false, "active_dense_triggered": false}, {"chunk_index": 1, "path": "permute", "active_query_mode": true, "active_dense_triggered": false}]}, "decision": "keep", "next_action": "Run K1 discover search/export/integration and bounded benchmark against named baseline."}
{"id": "EXP-20260208-K1-DISCOVER-SEARCH", "date": "2026-02-08", "question": "Can K1 (hcsa_permute_window) run as a real discover search in ZMLX with correctness+timing evaluation enabled and yield an exportable candidate?", "hypothesis": "K1 search will produce a correctness-passing session with measurable baseline-vs-best speedup and exportable artifacts.", "change_set": ["/Volumes/VIXinSSD/ZMLX/src/zmlx/discover/targets.py: add hcsa_permute_window target registration"], "command": "PYTHONPATH=/Volumes/VIXinSSD/ZMLX/src python3 -m zmlx.discover search hcsa_permute_window --llm mock --steps 2 --candidates-per-step 4 --warmup 3 --iters 10 --timeout 20 --session-dir /Volumes/VIXinSSD/wayfinder/discover_sessions -v", "controls": {"discover_pipeline": "compile_correctness_timing", "baseline_path": "/Volumes/VIXinSSD/wayfinder/discover_sessions/hcsa_permute_window_session.json (metadata.baseline_us)", "retro_backfill_default_off": true}, "metrics": {"status": "pending"}, "decision": "pending", "next_action": "Execute search, export best candidate, and log baseline vs best speedup."}
{"id": "EXP-20260208-K1-DISCOVER-SEARCH-RESULT", "date": "2026-02-08", "question": "Can K1 (hcsa_permute_window) run as a real discover search in ZMLX with correctness+timing evaluation enabled and yield an exportable candidate?", "hypothesis": "K1 search will produce a correctness-passing session with measurable baseline-vs-best speedup and exportable artifacts.", "change_set": ["/Volumes/VIXinSSD/ZMLX/src/zmlx/discover/targets.py: add hcsa_permute_window target registration", "/Volumes/VIXinSSD/wayfinder/hcsa/mlx/kernels/metal/hcsa_permute_window_fused_discovered.py: exported discovered kernel wrapper", "/Volumes/VIXinSSD/wayfinder/hcsa/mlx/kernels/metal/hcsa_permute_window_fused_discovered.metal: exported best kernel source"], "command": "PYTHONPATH=/Volumes/VIXinSSD/ZMLX/src python3 -m zmlx.discover search hcsa_permute_window --llm mock --steps 2 --candidates-per-step 4 --warmup 3 --iters 10 --timeout 20 --session-dir /Volumes/VIXinSSD/wayfinder/discover_sessions -v", "controls": {"discover_pipeline": "compile_correctness_timing", "baseline_path": "/Volumes/VIXinSSD/wayfinder/discover_sessions/hcsa_permute_window_session.json", "retro_backfill_default_off": true}, "metrics": {"artifact": "/Volumes/VIXinSSD/wayfinder/discover_sessions/hcsa_permute_window_session.json", "baseline_us": 235.333, "best_median_us": 144.75, "delta_us_vs_baseline": -90.583, "delta_pct_vs_baseline": -38.491414293787955, "best_speedup": 1.625789291882556, "total_candidates": 8, "total_evaluated": 8}, "decision": "keep", "next_action": "Run bounded K1 integration benchmark and compare against named dense baseline path."}
{"id": "EXP-20260208-K1-GLM-PERMUTE-BOUND", "date": "2026-02-08", "question": "On bounded GLM prefill (T=2048), does K1-integrated permute path produce a favorable dense-vs-wayfinder attention delta on the original non-Qwen path?", "hypothesis": "Wayfinder permute path should improve attention throughput vs dense baseline in this bounded setting.", "change_set": ["/Volumes/VIXinSSD/wayfinder/hcsa/mlx/kernels/metal/hcsa_permute_window_fused_discovered.metal", "/Volumes/VIXinSSD/wayfinder/hcsa/integrations/glm_mlx.py"], "command": "PYTHONPATH=/Volumes/VIXinSSD/wayfinder python3 scripts/bench_glm_wayfinder_mlx.py --model-path mlx-community/GLM-4.7-Flash-4bit --seq-lens 2048 --batch 1 --warmup 1 --iters 2 --dtype bfloat16 --path permute --window 64 --landmark-stride 0 --num-cycles 1 --seed 42 --permute-head-chunk-size 2 --permute-query-chunk-size 384 --full-swap --out-dir benchmarks/mlx/k1_glm_permute_bound_20260208", "controls": {"model_path": "mlx-community/GLM-4.7-Flash-4bit", "original_non_qwen_path": true, "retro_backfill_default_off": true, "baseline_path": "benchmarks/mlx/k1_glm_permute_bound_20260208/results.json::rows[0].level_a_real_qkv.baseline_attention"}, "metrics": {"status": "pending"}, "decision": "pending", "next_action": "Run benchmark and compute absolute/delta/% from level_a_real_qkv dense-vs-wayfinder fields."}
