{"id": "EXP-20260211T204824Z-GLM-DRIFT-DECODE-CONTROLS-PRERUN", "date": "2026-02-11", "question": "Are dense and Wayfinder runs using identical decoding/control settings?", "hypothesis": "No decode mismatch exists; harness uses greedy argmax without temperature/top_p controls for both paths.", "change_set": ["none (analysis-only)"], "command": "python3 inline audit over baseline dense/wayfinder results command fields + scripts/bench_glm_consumer_mlx.py decode path; write decode_controls_audit.json", "controls": {"no_model_execution": true, "baseline_run_root": "/Volumes/VIXinSSD/wayfinder/benchmarks/mlx/post_reboot_20260211_20260211T202821Z", "diag_root": "/Volumes/VIXinSSD/wayfinder/benchmarks/mlx/post_reboot_20260211_20260211T202821Z/quality_drift_diag_20260211T204824Z"}, "metrics": {"status": "pending", "required": ["command_parity", "argmax_decode_confirmed", "sampling_controls_absent", "retro_backfill_off_confirmed"]}, "decision": "pending", "next_action": "Run audit and attach artifact-backed parity verdict."}
{"id": "EXP-20260211T204824Z-GLM-DRIFT-CATEGORY-SPLIT-PRERUN", "date": "2026-02-11", "question": "Is drift concentrated by category (extract/math/lookup) rather than uniform?", "hypothesis": "Observed errors are category-concentrated; math remains weak for both while drift is likely concentrated in extract/lookup edge cases.", "change_set": ["none (analysis-only)"], "command": "python3 inline analysis over baseline + diagnostic results.json files; map category from task id prefix and write category_split_summary.json", "controls": {"no_model_execution": true, "baseline_run_root": "/Volumes/VIXinSSD/wayfinder/benchmarks/mlx/post_reboot_20260211_20260211T202821Z", "diag_root": "/Volumes/VIXinSSD/wayfinder/benchmarks/mlx/post_reboot_20260211_20260211T202821Z/quality_drift_diag_20260211T204824Z"}, "metrics": {"status": "pending", "required": ["per_category_dense_accuracy", "per_category_wayfinder_accuracy", "per_category_delta", "per_category_delta_pct", "overall_pooled_delta"]}, "decision": "pending", "next_action": "Generate category split summary and use for root-cause decision."}
{"id": "EXP-20260211T204824Z-GLM-DRIFT-NONMATH-SANITY-PRERUN", "date": "2026-02-11", "question": "On an easier non-math subset, does Wayfinder remain close to dense?", "hypothesis": "If drift is task-specific, non-math subset drift should shrink relative to full-set baseline (-0.1667).", "change_set": ["create subset dataset artifact in diag_root (extract-01, extract-02, lookup-01)"], "command": "create quality_eval_glm47_consumer_nonmath_easy_v1.json then run_with_mem_gate drift_nonmath_dense and drift_nonmath_wayfinder at seq_len=8192 decode_len=64 seed=42", "controls": {"baseline_run_root": "/Volumes/VIXinSSD/wayfinder/benchmarks/mlx/post_reboot_20260211_20260211T202821Z", "diag_root": "/Volumes/VIXinSSD/wayfinder/benchmarks/mlx/post_reboot_20260211_20260211T202821Z/quality_drift_diag_20260211T204824Z", "one_process_at_a_time": true, "one_seq_len_per_process": true, "retro_backfill_default_inference_off": true, "memory_stop_gates": {"swap_used_delta_mb_max": 1024, "compressor_pages_delta_max": 100000}}, "metrics": {"status": "pending", "required": ["nonmath_dense_accuracy", "nonmath_wayfinder_accuracy", "nonmath_accuracy_delta", "delta_vs_fullset_drift", "delta_pct_vs_fullset_drift"]}, "decision": "pending", "next_action": "Execute non-math sanity runs and include tie-break evidence in final decision."}
{"id": "EXP-20260211T204824Z-GLM-DRIFT-REPEATABILITY-RESULT", "date": "2026-02-11", "question": "Is -16.7% quality drift repeatable at fixed settings, or mostly run-to-run noise on a 6-task set?", "hypothesis": "If drift is mostly noise, repeated dense/Wayfinder runs at identical settings will show unstable sign and high variance.", "change_set": ["none (measurement-only)"], "command": "drift_repeat_dense_r1 -> drift_repeat_wayfinder_r1 -> drift_repeat_dense_r2 -> drift_repeat_wayfinder_r2 (all seq_len=8192, decode_len=64, seed=42, one-process-at-a-time, memory-gated)", "controls": {"baseline_run_root": "/Volumes/VIXinSSD/wayfinder/benchmarks/mlx/post_reboot_20260211_20260211T202821Z", "diag_root": "/Volumes/VIXinSSD/wayfinder/benchmarks/mlx/post_reboot_20260211_20260211T202821Z/quality_drift_diag_20260211T204824Z", "one_process_at_a_time": true, "one_seq_len_per_process": true, "retro_backfill_default_inference_off": true, "memory_stop_gates": {"swap_used_delta_mb_max": 1024, "compressor_pages_delta_max": 100000}}, "metrics": {"artifacts": ["/Volumes/VIXinSSD/wayfinder/benchmarks/mlx/post_reboot_20260211_20260211T202821Z/quality_drift_diag_20260211T204824Z/drift_repeat_dense_r1/results.json", "/Volumes/VIXinSSD/wayfinder/benchmarks/mlx/post_reboot_20260211_20260211T202821Z/quality_drift_diag_20260211T204824Z/drift_repeat_wayfinder_r1/results.json", "/Volumes/VIXinSSD/wayfinder/benchmarks/mlx/post_reboot_20260211_20260211T202821Z/quality_drift_diag_20260211T204824Z/drift_repeat_dense_r2/results.json", "/Volumes/VIXinSSD/wayfinder/benchmarks/mlx/post_reboot_20260211_20260211T202821Z/quality_drift_diag_20260211T204824Z/drift_repeat_wayfinder_r2/results.json", "/Volumes/VIXinSSD/wayfinder/benchmarks/mlx/post_reboot_20260211_20260211T202821Z/quality_drift_diag_20260211T204824Z/repeatability_summary.json"], "baseline_pair": {"dense": {"accuracy": 0.5, "correct": 3, "num_tasks": 6}, "wayfinder": {"accuracy": 0.3333333333333333, "correct": 2, "num_tasks": 6}, "drift": -0.16666666666666669, "drift_delta_vs_baseline": 0.0, "drift_delta_pct_vs_baseline": 0.0, "drift_pct_vs_dense": -33.333333333333336}, "repeat_r1_pair": {"dense": {"accuracy": 0.5, "correct": 3, "num_tasks": 6}, "wayfinder": {"accuracy": 0.3333333333333333, "correct": 2, "num_tasks": 6}, "drift": -0.16666666666666669, "drift_delta_vs_baseline": 0.0, "drift_delta_pct_vs_baseline": 0.0, "drift_pct_vs_dense": -33.333333333333336}, "repeat_r2_pair": {"dense": {"accuracy": 0.5, "correct": 3, "num_tasks": 6}, "wayfinder": {"accuracy": 0.3333333333333333, "correct": 2, "num_tasks": 6}, "drift": -0.16666666666666669, "drift_delta_vs_baseline": 0.0, "drift_delta_pct_vs_baseline": 0.0, "drift_pct_vs_dense": -33.333333333333336}, "repeatability_aggregate": {"drifts": [-0.16666666666666669, -0.16666666666666669, -0.16666666666666669], "mean": -0.16666666666666666, "std": 2.7755575615628914e-17, "min": -0.16666666666666669, "max": -0.16666666666666669}, "memory_gate": {"drift_repeat_dense_r1": {"label": "drift_repeat_dense_r1", "delta_swap_mb": 0.0, "swap_free_mb": 749.94, "delta_compressor_pages": 65143, "status": "pass", "fails": []}, "drift_repeat_wayfinder_r1": {"label": "drift_repeat_wayfinder_r1", "delta_swap_mb": 0.0, "swap_free_mb": 749.94, "delta_compressor_pages": 7063, "status": "pass", "fails": []}, "drift_repeat_dense_r2": {"label": "drift_repeat_dense_r2", "delta_swap_mb": 0.0, "swap_free_mb": 749.94, "delta_compressor_pages": 16981, "status": "pass", "fails": []}, "drift_repeat_wayfinder_r2": {"label": "drift_repeat_wayfinder_r2", "delta_swap_mb": 0.0, "swap_free_mb": 749.94, "delta_compressor_pages": 5501, "status": "pass", "fails": []}}, "h1_vs_h3_tiebreak": "repeatability stable at drift=-0.1667 across baseline/r1/r2; supports stable drift over random noise"}, "decision": "follow-up", "next_action": "Run seed sensitivity and controls/category audits to localize cause."}
{"id": "EXP-20260211T204824Z-GLM-DRIFT-SEED-SENSITIVITY-RESULT", "date": "2026-02-11", "question": "Does Wayfinder quality vary materially with seed at fixed decode settings?", "hypothesis": "If attention-path sensitivity is real, Wayfinder seed changes will materially move per-task outcomes.", "change_set": ["none (measurement-only)"], "command": "drift_seed_dense_s7 + drift_seed_wayfinder_s7 + drift_seed_wayfinder_s99 (all seq_len=8192, decode_len=64)", "controls": {"baseline_run_root": "/Volumes/VIXinSSD/wayfinder/benchmarks/mlx/post_reboot_20260211_20260211T202821Z", "diag_root": "/Volumes/VIXinSSD/wayfinder/benchmarks/mlx/post_reboot_20260211_20260211T202821Z/quality_drift_diag_20260211T204824Z", "one_process_at_a_time": true, "one_seq_len_per_process": true, "retro_backfill_default_inference_off": true, "memory_stop_gates": {"swap_used_delta_mb_max": 1024, "compressor_pages_delta_max": 100000}}, "metrics": {"artifacts": ["/Volumes/VIXinSSD/wayfinder/benchmarks/mlx/post_reboot_20260211_20260211T202821Z/quality_drift_diag_20260211T204824Z/drift_seed_dense_s7/results.json", "/Volumes/VIXinSSD/wayfinder/benchmarks/mlx/post_reboot_20260211_20260211T202821Z/quality_drift_diag_20260211T204824Z/drift_seed_wayfinder_s7/results.json", "/Volumes/VIXinSSD/wayfinder/benchmarks/mlx/post_reboot_20260211_20260211T202821Z/quality_drift_diag_20260211T204824Z/drift_seed_wayfinder_s99/results.json", "/Volumes/VIXinSSD/wayfinder/benchmarks/mlx/post_reboot_20260211_20260211T202821Z/quality_drift_diag_20260211T204824Z/repeatability_summary.json"], "seed_sensitivity": {"wayfinder_seed42_accuracy": 0.3333333333333333, "wayfinder_seed7_accuracy": 0.3333333333333333, "wayfinder_seed99_accuracy": 0.3333333333333333, "seed7_delta_vs_seed42": 0.0, "seed99_delta_vs_seed42": 0.0, "seed7_delta_pct_vs_seed42": 0.0, "seed99_delta_pct_vs_seed42": 0.0}, "seed7_pair": {"dense": {"accuracy": 0.5, "correct": 3, "num_tasks": 6}, "wayfinder": {"accuracy": 0.3333333333333333, "correct": 2, "num_tasks": 6}, "drift": -0.16666666666666669, "drift_delta_vs_baseline": 0.0, "drift_delta_pct_vs_baseline": 0.0, "drift_pct_vs_dense": -33.333333333333336}, "wayfinder_seed7_delta_vs_seed42_abs": 0.0, "wayfinder_seed7_delta_vs_seed42_pct": 0.0, "wayfinder_seed99_delta_vs_seed42_abs": 0.0, "wayfinder_seed99_delta_vs_seed42_pct": 0.0, "memory_gate": {"drift_seed_dense_s7": {"label": "drift_seed_dense_s7", "delta_swap_mb": 0.0, "swap_free_mb": 749.94, "delta_compressor_pages": 9414, "status": "pass", "fails": []}, "drift_seed_wayfinder_s7": {"label": "drift_seed_wayfinder_s7", "delta_swap_mb": 0.0, "swap_free_mb": 749.94, "delta_compressor_pages": 8030, "status": "pass", "fails": []}, "drift_seed_wayfinder_s99": {"label": "drift_seed_wayfinder_s99", "delta_swap_mb": 0.0, "swap_free_mb": 749.94, "delta_compressor_pages": 2626, "status": "pass", "fails": []}}}, "decision": "follow-up", "next_action": "Eliminate decode-control mismatch and inspect category-specific behavior."}
{"id": "EXP-20260211T204824Z-GLM-DRIFT-DECODE-CONTROLS-RESULT", "date": "2026-02-11", "question": "Are dense and Wayfinder quality runs using identical decoding/control settings?", "hypothesis": "No decode mismatch exists; harness uses greedy argmax without temperature/top_p controls for both paths.", "change_set": ["none (analysis-only)"], "command": "inline audit over baseline command fields and scripts/bench_glm_consumer_mlx.py decode implementation", "controls": {"no_model_execution": true, "baseline_run_root": "/Volumes/VIXinSSD/wayfinder/benchmarks/mlx/post_reboot_20260211_20260211T202821Z", "diag_root": "/Volumes/VIXinSSD/wayfinder/benchmarks/mlx/post_reboot_20260211_20260211T202821Z/quality_drift_diag_20260211T204824Z"}, "metrics": {"artifact": "/Volumes/VIXinSSD/wayfinder/benchmarks/mlx/post_reboot_20260211_20260211T202821Z/quality_drift_diag_20260211T204824Z/decode_controls_audit.json", "command_parity_all_required": true, "required_parity_checks_passed_abs": 17, "required_parity_checks_total": 17, "required_parity_checks_delta_vs_baseline": 0, "required_parity_checks_delta_pct_vs_baseline": 0.0, "mismatch_count_abs": 0, "mismatch_count_delta_vs_baseline": 0, "mismatch_count_delta_pct_vs_baseline": 0.0, "sampling_flags_in_dense_command_abs": 0, "sampling_flags_in_wayfinder_command_abs": 0, "decode_harness": {"uses_argmax_greedy": true, "cli_exposes_temperature": false, "cli_exposes_top_p": false}, "retro_backfill": {"dense_results_flag": false, "wayfinder_results_flag": false, "both_off": true}}, "decision": "keep", "next_action": "Treat decode mismatch as unlikely; prioritize category-level fidelity analysis."}
{"id": "EXP-20260211T204824Z-GLM-DRIFT-CATEGORY-SPLIT-RESULT", "date": "2026-02-11", "question": "Is drift concentrated by category (extract/math/lookup) rather than uniform?", "hypothesis": "Observed errors are category-concentrated; math remains weak for both while drift is concentrated in extract edge cases.", "change_set": ["none (analysis-only)"], "command": "inline category analysis over baseline + diagnostic results using id-prefix category mapping", "controls": {"no_model_execution": true, "baseline_run_root": "/Volumes/VIXinSSD/wayfinder/benchmarks/mlx/post_reboot_20260211_20260211T202821Z", "diag_root": "/Volumes/VIXinSSD/wayfinder/benchmarks/mlx/post_reboot_20260211_20260211T202821Z/quality_drift_diag_20260211T204824Z"}, "metrics": {"artifact": "/Volumes/VIXinSSD/wayfinder/benchmarks/mlx/post_reboot_20260211_20260211T202821Z/quality_drift_diag_20260211T204824Z/category_split_summary.json", "baseline_categories": {"extract": {"dense_accuracy": 1.0, "wayfinder_accuracy": 0.5, "delta": -0.5, "delta_pct_vs_dense": -50.0, "n": 2}, "lookup": {"dense_accuracy": 0.5, "wayfinder_accuracy": 0.5, "delta": 0.0, "delta_pct_vs_dense": 0.0, "n": 2}, "math": {"dense_accuracy": 0.0, "wayfinder_accuracy": 0.0, "delta": 0.0, "delta_pct_vs_dense": null, "n": 2}}, "pooled_fullset_diagnostics": {"extract": {"dense_accuracy": 1.0, "wayfinder_accuracy": 0.5, "delta": -0.5, "delta_pct_vs_dense": -50.0, "dense_n": 8, "wayfinder_n": 10}, "lookup": {"dense_accuracy": 0.5, "wayfinder_accuracy": 0.5, "delta": 0.0, "delta_pct_vs_dense": 0.0, "dense_n": 8, "wayfinder_n": 10}, "math": {"dense_accuracy": 0.0, "wayfinder_accuracy": 0.0, "delta": 0.0, "delta_pct_vs_dense": null, "dense_n": 8, "wayfinder_n": 10}}, "extract_delta_abs": -0.5, "extract_delta_pct_vs_dense": -50.0, "lookup_delta_abs": 0.0, "lookup_delta_pct_vs_dense": 0.0, "math_delta_abs": 0.0, "math_delta_pct_vs_dense": null, "extract_delta_change_vs_baseline_abs": 0.0, "extract_delta_change_vs_baseline_pct": 0.0}, "decision": "follow-up", "next_action": "Run non-math sanity tie-break and finalize keep/follow-up/revert recommendation."}
{"id": "EXP-20260211T204824Z-GLM-DRIFT-NONMATH-SANITY-RESULT", "date": "2026-02-11", "question": "On an easier non-math subset, does Wayfinder remain close to dense?", "hypothesis": "If drift is task-specific, non-math subset drift should shrink relative to full-set baseline (-0.1667).", "change_set": ["created dataset /Volumes/VIXinSSD/wayfinder/benchmarks/mlx/post_reboot_20260211_20260211T202821Z/quality_drift_diag_20260211T204824Z/quality_eval_glm47_consumer_nonmath_easy_v1.json"], "command": "create subset dataset (extract-01, extract-02, lookup-01) then run drift_nonmath_dense + drift_nonmath_wayfinder at seq_len=8192 decode_len=64 seed=42", "controls": {"baseline_run_root": "/Volumes/VIXinSSD/wayfinder/benchmarks/mlx/post_reboot_20260211_20260211T202821Z", "diag_root": "/Volumes/VIXinSSD/wayfinder/benchmarks/mlx/post_reboot_20260211_20260211T202821Z/quality_drift_diag_20260211T204824Z", "one_process_at_a_time": true, "one_seq_len_per_process": true, "retro_backfill_default_inference_off": true, "memory_stop_gates": {"swap_used_delta_mb_max": 1024, "compressor_pages_delta_max": 100000}}, "metrics": {"artifacts": ["/Volumes/VIXinSSD/wayfinder/benchmarks/mlx/post_reboot_20260211_20260211T202821Z/quality_drift_diag_20260211T204824Z/quality_eval_glm47_consumer_nonmath_easy_v1.json", "/Volumes/VIXinSSD/wayfinder/benchmarks/mlx/post_reboot_20260211_20260211T202821Z/quality_drift_diag_20260211T204824Z/drift_nonmath_dense/results.json", "/Volumes/VIXinSSD/wayfinder/benchmarks/mlx/post_reboot_20260211_20260211T202821Z/quality_drift_diag_20260211T204824Z/drift_nonmath_wayfinder/results.json", "/Volumes/VIXinSSD/wayfinder/benchmarks/mlx/post_reboot_20260211_20260211T202821Z/quality_drift_diag_20260211T204824Z/nonmath_drift_summary.json"], "nonmath_summary": {"task_ids": ["extract-01", "extract-02", "lookup-01"], "dense_accuracy": 1.0, "wayfinder_accuracy": 0.6666666666666666, "dense_correct": 3, "wayfinder_correct": 2, "num_tasks": 3, "drift": -0.33333333333333337, "drift_delta_vs_fullset_baseline": -0.16666666666666669, "drift_delta_pct_vs_fullset_baseline": -100.0}, "nonmath_dense_abs": {"accuracy": 1.0, "correct": 3, "num_tasks": 3}, "nonmath_wayfinder_abs": {"accuracy": 0.6666666666666666, "correct": 2, "num_tasks": 3}, "nonmath_drift_abs": -0.33333333333333337, "nonmath_drift_delta_vs_fullset_abs": -0.16666666666666669, "nonmath_drift_delta_vs_fullset_pct": -100.0, "memory_gate": {"drift_nonmath_dense": {"label": "drift_nonmath_dense", "delta_swap_mb": 0.0, "swap_free_mb": 749.94, "delta_compressor_pages": 843, "status": "pass", "fails": []}, "drift_nonmath_wayfinder": {"label": "drift_nonmath_wayfinder", "delta_swap_mb": 0.0, "swap_free_mb": 749.94, "delta_compressor_pages": -3165, "status": "pass", "fails": []}}, "h4_vs_h3_tiebreak": "non-math drift worsened from -0.1667 to -0.3333, supporting real fidelity gap over a math-only issue"}, "decision": "follow-up", "next_action": "Keep scaling win; isolate and debug extract-path fidelity regression in Wayfinder swaps."}
{"id":"EXP-20260211T235102Z-GLM-DRIFT-LAYER-LOCALIZATION-PRERUN","date":"2026-02-11","question":"Is extract-focused quality drift concentrated in early or late layers on the GLM Wayfinder path?","hypothesis":"Last-layer-only swap (N=8) will stay closer to dense than first-layer-only swap if drift is primarily late-layer semantic routing.","change_set":["scripts/bench_glm_consumer_mlx.py: partial swap controls + swap metadata in results"],"command":"Run quality ablations with --swap-first-n-layers 8 and --swap-last-n-layers 8 at fixed baseline settings.","controls":{"baseline_run_root":"/Volumes/VIXinSSD/wayfinder/benchmarks/mlx/post_reboot_20260211_20260211T202821Z","baseline_drift":-0.16666666666666669,"fixed":{"model":"mlx-community/GLM-4.7-Flash-4bit","seed":42,"dataset":"quality_eval_glm47_consumer_v1.json","seq_len":8192,"decode_len":64,"chunk_size":4096,"kv_step":4096,"retro_backfill_enabled":false}},"metrics":{"status":"pending","required":["accuracy_abs","drift_vs_dense_abs","drift_delta_vs_baseline","drift_delta_pct_vs_baseline","extract_category_delta"]},"decision":"pending","next_action":"Execute both ablations and summarize localization signal."}
{"id":"EXP-20260211T235102Z-GLM-DRIFT-EXTRACT01-TRACE-PRERUN","date":"2026-02-11","question":"Where does dense vs Wayfinder first diverge on extract-01 decode trajectory?","hypothesis":"Divergence appears in early decode steps and is visible as a top-1 token switch with close competing logits.","change_set":["scripts/bench_glm_consumer_mlx.py: quality task filter + targeted per-step top-k decode trace"],"command":"Run dense and wayfinder quality with --quality-task-id-filter extract-01 and trace flags enabled; then diff traces.","controls":{"baseline_run_root":"/Volumes/VIXinSSD/wayfinder/benchmarks/mlx/post_reboot_20260211_20260211T202821Z","fixed":{"task_id":"extract-01","model":"mlx-community/GLM-4.7-Flash-4bit","seed":42,"decode_len":32,"trace_topk":8,"trace_max_steps":16,"seq_len":8192,"chunk_size":4096,"kv_step":4096}},"metrics":{"status":"pending","required":["first_divergence_step","dense_token_vs_wayfinder_token","dense_topk","wayfinder_topk"]},"decision":"pending","next_action":"Compute trace diff artifact and map to fidelity regression hypothesis."}
{"id":"EXP-20260211T235102Z-GLM-DRIFT-LAYER-LOCALIZATION-RESULT","date":"2026-02-11","question":"Is extract-focused quality drift concentrated in early or late layers on the GLM Wayfinder path?","hypothesis":"Last-layer-only swap (N=8) will stay closer to dense than first-layer-only swap.","change_set":["scripts/bench_glm_consumer_mlx.py partial swap controls + swap metadata","scripts/run_glm_drift_followup_bundle.sh follow-up run bundle","scripts/analyze_glm_drift_followup.py localization/trace analyzers"],"command":"Attempted --swap-first-n-layers 8 quality run at baseline settings; blocked at mlx import/device init before benchmark start.","controls":{"baseline_run_root":"/Volumes/VIXinSSD/wayfinder/benchmarks/mlx/post_reboot_20260211_20260211T202821Z","baseline_drift":-0.16666666666666669,"fixed":{"model":"mlx-community/GLM-4.7-Flash-4bit","seed":42,"dataset":"quality_eval_glm47_consumer_v1.json","seq_len":8192,"decode_len":64}},"metrics":{"status":"blocked","error_signature":"NSRangeException index 0 beyond bounds for empty array during libmlx metal::Device init","artifacts":["/Volumes/VIXinSSD/wayfinder/scripts/bench_glm_consumer_mlx.py","/Volumes/VIXinSSD/wayfinder/scripts/run_glm_drift_followup_bundle.sh","/Volumes/VIXinSSD/wayfinder/scripts/analyze_glm_drift_followup.py"],"benchmark_metrics":"not produced"},"decision":"follow-up","next_action":"Run scripts/run_glm_drift_followup_bundle.sh in a Metal-capable session and evaluate layer_localization_summary.json."}
{"id":"EXP-20260211T235102Z-GLM-DRIFT-EXTRACT01-TRACE-RESULT","date":"2026-02-11","question":"Where does dense vs Wayfinder first diverge on extract-01 decode trajectory?","hypothesis":"Divergence appears in early decode steps as top-1 token switch.","change_set":["scripts/bench_glm_consumer_mlx.py task filter + trace capture","scripts/analyze_glm_drift_followup.py trace-diff subcommand"],"command":"Trace run pair queued but not executed after upstream MLX initialization block.","controls":{"task_id":"extract-01","fixed":{"model":"mlx-community/GLM-4.7-Flash-4bit","seed":42,"decode_len":32,"trace_topk":8,"trace_max_steps":16}},"metrics":{"status":"blocked","error_signature":"Upstream MLX Metal init failure prevented trace runs","artifacts":["/Volumes/VIXinSSD/wayfinder/scripts/bench_glm_consumer_mlx.py","/Volumes/VIXinSSD/wayfinder/scripts/analyze_glm_drift_followup.py"],"trace_metrics":"not produced"},"decision":"follow-up","next_action":"Execute trace pair via scripts/run_glm_drift_followup_bundle.sh and summarize with analyze_glm_drift_followup.py trace-diff."}
