{"id":"EXP-20260218T053200Z-INSTALL-VERIFY-HARDENING-RESULT","date":"2026-02-18","question":"Can we make Wayfinder install and verification reproducible for external users with a sequential fail-fast path that avoids concurrent model runs?","hypothesis":"Documented preflight/env-check/queue guidance plus a one-command verifier script will make setup validation repeatable before benchmark campaigns.","change_set":["README.md (install + preflight/env-check + sequential stop-gates + queue usage)","scripts/verify_install_and_preflight.sh (new helper)"],"command":"./scripts/bench_protocol_preflight_setup.sh --run-id EXP-20260218T000000Z-README-VERIFY --out-dir /tmp/wayfinder-preflight && python3 scripts/env_check_mlx.py --json-out /tmp/wayfinder-preflight/env_check_mlx.json && python3 scripts/run_section4_queue.py --dry-run --overwrite && ./scripts/verify_install_and_preflight.sh --run-id EXP-20260218T000200Z-VERIFY-INSTALL --out-dir /tmp/wayfinder-preflight","controls":{"mode":"tooling verification only","one_process_at_a_time":true,"inference_disabled":true,"output_dir":"/tmp/wayfinder-preflight"},"metrics":{"preflight":{"status":"pass","delta_swap_used_mb":0.0,"delta_pages_occupied_by_compressor":0},"env_check":{"status":"pass","json":"/tmp/wayfinder-preflight/EXP-20260218T000200Z-VERIFY-INSTALL_env_check_mlx.json"},"queue_dry_run":{"status":"pass","command":"python3 scripts/run_section4_queue.py --dry-run --overwrite"},"one_command_verifier":{"status":"pass","summary_json":"/tmp/wayfinder-preflight/EXP-20260218T000200Z-VERIFY-INSTALL_summary.json","raw_txt":"/tmp/wayfinder-preflight/EXP-20260218T000200Z-VERIFY-INSTALL_raw.txt"}},"decision":"keep","next_action":"Use ./scripts/verify_install_and_preflight.sh as the default onboarding verification step before sequential benchmark runs."}
{"id":"EXP-20260218T050026Z-NANBEIGE-INSTRUMENTED-BOUNDARY-RESULT","date":"2026-02-18","question":"With stage timers/heartbeats/status instrumentation enabled, can Nanbeige/Nanbeige4.1-3B wayfinder complete T=131072 decode_len=256 and produce a usable boundary row?","hypothesis":"Instrumentation will expose where long-boundary non-completion occurs; if the run still fails, results.json should carry explicit terminal status and stage context rather than null-only artifacts.","change_set":["scripts/bench_qwen_consumer_mlx.py: add stage timers, heartbeat logging, per-stage timeout, explicit terminal status in results payload"],"command":"python3 scripts/bench_qwen_consumer_mlx.py --model-path Nanbeige/Nanbeige4.1-3B --mode wayfinder --seq-lens 131072 --decode-len 256 --repeats 1 --skip-multi-turn --skip-quality --window 64 --head-chunk-size 2 --query-chunk-size 384 --stage-timeout-sec 900 --heartbeat-sec 30 --out-dir benchmarks/mlx/nanbeige4_1_3b_wayfinder/hang_debug_20260218/instrumented_wayfinder256_T131072 && python3 scripts/bench_qwen_consumer_mlx.py --model-path Nanbeige/Nanbeige4.1-3B --mode dense --seq-lens 131072 --decode-len 256 --repeats 1 --skip-multi-turn --skip-quality --stage-timeout-sec 900 --heartbeat-sec 30 --out-dir benchmarks/mlx/nanbeige4_1_3b_wayfinder/hang_debug_20260218/instrumented_dense256_T131072","controls":{"model":"Nanbeige/Nanbeige4.1-3B","entrypoint":"scripts/bench_qwen_consumer_mlx.py","seq_len":131072,"decode_len":256,"repeats":1,"skip_multi_turn":true,"skip_quality":true,"retro_backfill_inference":"off","wayfinder":{"window":64,"head_chunk_size":2,"query_chunk_size":384},"instrumentation":{"stage_timeout_sec":900,"heartbeat_sec":30},"stop_gates":["terminal status != completed","missing usable single_turn row","nonzero exit"]},"metrics":{"wayfinder256":{"status":"completed","e2e_sec":584.4369925829815,"prefill_sec":425.75703487498686,"decode_sec":158.67995770799462,"decode_tok_s":1.613310235884328,"ttft_sec":40.84421258303337,"itl_p95_sec":0.2617539579514414,"peak_memory_bytes":27922247416,"path_counts":{"permute":2056,"permute_dense_fallback":248},"dense_fallback_reason_counts":{"active_large_q":248},"dense_fallback_share_run":0.1076388888888889},"dense256":{"status":"interrupted","single_turn":null},"delta_vs_dense":{"absolute":"not_computable_missing_dense_row","percentage":"not_computable_missing_dense_row","memory_reduction_pct_convention":"not_computable_missing_dense_row"}},"decision":"follow-up","next_action":"Re-run the missing dense256 companion sequentially with a fresh out_dir; if completed, compute deltas and continue to the decode_len=32 traced pair."}
{"id":"EXP-20260218T074600Z-NANBEIGE-INSTRUMENTED-DENSE256-COMPANION-RERUN-PRERUN","date":"2026-02-18","question":"Can we complete the missing dense companion for the instrumented Nanbeige boundary decode256 pair and close delta computation gates?","hypothesis":"Running dense256 in isolation with identical instrumentation knobs and a fresh out_dir will produce a completed single_turn row for paired comparison.","change_set":["measurement only"],"command":"python3 scripts/bench_qwen_consumer_mlx.py --model-path Nanbeige/Nanbeige4.1-3B --mode dense --seq-lens 131072 --decode-len 256 --repeats 1 --skip-multi-turn --skip-quality --stage-timeout-sec 900 --heartbeat-sec 30 --out-dir benchmarks/mlx/nanbeige4_1_3b_wayfinder/hang_debug_20260218/instrumented_dense256_T131072_rerun","controls":{"model":"Nanbeige/Nanbeige4.1-3B","entrypoint":"scripts/bench_qwen_consumer_mlx.py","seq_len":131072,"decode_len":256,"repeats":1,"skip_multi_turn":true,"skip_quality":true,"instrumentation":{"stage_timeout_sec":900,"heartbeat_sec":30},"compare_against_wayfinder":"benchmarks/mlx/nanbeige4_1_3b_wayfinder/hang_debug_20260218/instrumented_wayfinder256_T131072/results.json","one_process_at_a_time":true,"retro_backfill_inference":"off"},"metrics":{"status":"pending","required":["status","single_turn.e2e_sec","single_turn.prefill_sec","single_turn.decode_sec","single_turn.decode_tok_s","single_turn.peak_memory_bytes","delta_vs_wayfinder_abs","delta_vs_wayfinder_pct","memory_reduction_pct_convention=100*(1-wayfinder/dense)"]},"decision":"pending","next_action":"Run the dense companion sequentially and compute paired deltas against instrumented wayfinder256."}
{"id":"EXP-20260218T074600Z-NANBEIGE-INSTRUMENTED-DENSE256-COMPANION-RERUN-RESULT","date":"2026-02-18","question":"Can we complete the missing dense companion for the instrumented Nanbeige boundary decode256 pair and close delta computation gates?","hypothesis":"Running dense256 in isolation with identical instrumentation knobs and a fresh out_dir will produce a completed single_turn row for paired comparison.","change_set":["measurement only"],"command":"python3 scripts/bench_qwen_consumer_mlx.py --model-path Nanbeige/Nanbeige4.1-3B --mode dense --seq-lens 131072 --decode-len 256 --repeats 1 --skip-multi-turn --skip-quality --stage-timeout-sec 900 --heartbeat-sec 30 --out-dir benchmarks/mlx/nanbeige4_1_3b_wayfinder/hang_debug_20260218/instrumented_dense256_T131072_rerun","controls":{"model":"Nanbeige/Nanbeige4.1-3B","entrypoint":"scripts/bench_qwen_consumer_mlx.py","seq_len":131072,"decode_len":256,"repeats":1,"skip_multi_turn":true,"skip_quality":true,"instrumentation":{"stage_timeout_sec":900,"heartbeat_sec":30},"paired_wayfinder":"benchmarks/mlx/nanbeige4_1_3b_wayfinder/hang_debug_20260218/instrumented_wayfinder256_T131072/results.json","one_process_at_a_time":true,"retro_backfill_inference":"off"},"metrics":{"dense256":{"status":"completed","e2e_sec":404.07917974999873,"prefill_sec":375.89852149999933,"decode_sec":28.180658249999397,"decode_tok_s":9.084244865004369,"ttft_sec":9.604686540998955,"itl_p95_sec":0.04982450000170502,"peak_memory_bytes":18460513312},"wayfinder256":{"status":"completed","e2e_sec":584.4369925829815,"prefill_sec":425.75703487498686,"decode_sec":158.67995770799462,"decode_tok_s":1.613310235884328,"ttft_sec":40.84421258303337,"itl_p95_sec":0.2617539579514414,"peak_memory_bytes":27922247416,"path_counts":{"permute":2056,"permute_dense_fallback":248},"dense_fallback_reason_counts":{"active_large_q":248},"dense_fallback_share_run":0.1076388888888889},"delta_wayfinder_vs_dense":{"e2e_sec_abs":180.35781283298275,"e2e_sec_pct":44.63427513007945,"prefill_sec_abs":49.858513374987524,"prefill_sec_pct":13.263822687046034,"decode_sec_abs":130.49929945799522,"decode_sec_pct":463.08109022967204,"decode_tok_s_abs":-7.47093462912004,"decode_tok_s_pct":-82.24056859035854,"peak_memory_bytes_abs":9461734104,"peak_memory_bytes_pct":51.2539058047185,"memory_reduction_pct_convention":-51.253905804718514}},"decision":"follow-up","next_action":"Proceed to remaining instrumented T=131072 decode_len=32 wayfinder trace and paired dense run sequentially, then close Phase 1 boundary gate."}
{"id":"EXP-20260218T151213Z-FIRST-RELEASE-PUBLIC-PROFILE-PRERUN","date":"2026-02-18","question":"Can we ship a single public GLM stable profile command that runs dense+wayfinder sequentially with safe defaults and clear comparison artifacts?","hypothesis":"A dedicated wrapper with conservative defaults (GLM, T=8192, decode_len=32, repeats=1, skip multi-turn/quality) will provide a reliable first-run benchmark path and reproducible summary outputs for new users.","change_set":["scripts/run_public_stable_profile_glm.sh (new)","README.md first-release onboarding + support matrix","docs/FIRST_RELEASE.md (new)"],"command":"./scripts/run_public_stable_profile_glm.sh --run-id EXP-20260218T151213Z-STABLE-PROFILE --out-root benchmarks/mlx/first_release","controls":{"model":"mlx-community/GLM-4.7-Flash-4bit","seq_len":8192,"decode_len":32,"repeats":1,"skip_multi_turn":true,"skip_quality":true,"retro_backfill_inference":"off","one_process_at_a_time":true,"dense_out":"benchmarks/mlx/first_release/EXP-20260218T151213Z-STABLE-PROFILE/dense/results.json","wayfinder_out":"benchmarks/mlx/first_release/EXP-20260218T151213Z-STABLE-PROFILE/wayfinder/results.json"},"metrics":{"status":"pending","required":["dense.e2e_sec","wayfinder.e2e_sec","delta_e2e_abs","delta_e2e_pct","dense.decode_tok_s","wayfinder.decode_tok_s","delta_decode_tok_s_abs","delta_decode_tok_s_pct","dense.peak_memory_bytes","wayfinder.peak_memory_bytes","memory_reduction_pct_convention=100*(1-wayfinder/dense)","summary_json","summary_md"]},"decision":"pending","next_action":"Run wrapper sequentially after script/docs updates, then append RESULT entry with release decision."}
{"id":"EXP-20260218T151213Z-NANBEIGE-INSTRUMENTED-BOUNDARY32-PRERUN","date":"2026-02-18","question":"At Nanbeige T=131072 decode_len=32, does the remaining instrumented wayfinder trace + dense companion pair complete sequentially with complete fallback diagnostics and reproducible deltas?","hypothesis":"Both commands will complete under stage timeout/heartbeat instrumentation; wayfinder fallback reasons will be informative, and the pair will close the remaining boundary gate with explicit dense-relative deltas.","change_set":["measurement only"],"command":"python3 scripts/bench_qwen_consumer_mlx.py --model-path Nanbeige/Nanbeige4.1-3B --mode wayfinder --seq-lens 131072 --decode-len 32 --repeats 1 --skip-multi-turn --skip-quality --hsa-trace --window 64 --head-chunk-size 2 --query-chunk-size 384 --stage-timeout-sec 900 --heartbeat-sec 30 --out-dir benchmarks/mlx/nanbeige4_1_3b_wayfinder/hang_debug_20260218T151213Z/instrumented_trace32_T131072 && python3 scripts/bench_qwen_consumer_mlx.py --model-path Nanbeige/Nanbeige4.1-3B --mode dense --seq-lens 131072 --decode-len 32 --repeats 1 --skip-multi-turn --skip-quality --stage-timeout-sec 900 --heartbeat-sec 30 --out-dir benchmarks/mlx/nanbeige4_1_3b_wayfinder/hang_debug_20260218T151213Z/instrumented_dense32_T131072","controls":{"model":"Nanbeige/Nanbeige4.1-3B","entrypoint":"scripts/bench_qwen_consumer_mlx.py","seq_len":131072,"decode_len":32,"repeats":1,"skip_multi_turn":true,"skip_quality":true,"retro_backfill_inference":"off","wayfinder":{"window":64,"head_chunk_size":2,"query_chunk_size":384,"hsa_trace":true},"instrumentation":{"stage_timeout_sec":900,"heartbeat_sec":30},"one_process_at_a_time":true,"fresh_out_root":"benchmarks/mlx/nanbeige4_1_3b_wayfinder/hang_debug_20260218T151213Z","stop_gates":["nonzero exit","missing results.json","status != completed","missing usable single_turn row","missing or unspecified dense_fallback_reason_counts when fallback path observed"]},"metrics":{"status":"pending","required":["wayfinder.status","dense.status","wayfinder.single_turn.e2e_sec","dense.single_turn.e2e_sec","wayfinder.single_turn.prefill_sec","dense.single_turn.prefill_sec","wayfinder.single_turn.decode_sec","dense.single_turn.decode_sec","wayfinder.single_turn.decode_tok_s","dense.single_turn.decode_tok_s","wayfinder.single_turn.peak_memory_bytes","dense.single_turn.peak_memory_bytes","wayfinder.path_counts","wayfinder.dense_fallback_reason_counts","wayfinder.dense_fallback_share_run","delta_wayfinder_vs_dense_abs","delta_wayfinder_vs_dense_pct","memory_reduction_pct_convention=100*(1-wayfinder/dense)"]},"decision":"pending","next_action":"Run the sequential pair and append RESULT with gate verdict and release classification decision."}
{"id":"EXP-20260218T151213Z-NANBEIGE-INSTRUMENTED-BOUNDARY32-RESULT","date":"2026-02-18","question":"At Nanbeige T=131072 decode_len=32, does the remaining instrumented wayfinder trace + dense companion pair complete sequentially with complete fallback diagnostics and reproducible deltas?","hypothesis":"Both commands will complete under stage timeout/heartbeat instrumentation; wayfinder fallback reasons will be informative, and the pair will close the remaining boundary gate with explicit dense-relative deltas.","change_set":["measurement only"],"command":"python3 scripts/bench_qwen_consumer_mlx.py --model-path Nanbeige/Nanbeige4.1-3B --mode wayfinder --seq-lens 131072 --decode-len 32 --repeats 1 --skip-multi-turn --skip-quality --hsa-trace --window 64 --head-chunk-size 2 --query-chunk-size 384 --stage-timeout-sec 900 --heartbeat-sec 30 --out-dir benchmarks/mlx/nanbeige4_1_3b_wayfinder/hang_debug_20260218T151213Z/instrumented_trace32_T131072 && python3 scripts/bench_qwen_consumer_mlx.py --model-path Nanbeige/Nanbeige4.1-3B --mode dense --seq-lens 131072 --decode-len 32 --repeats 1 --skip-multi-turn --skip-quality --stage-timeout-sec 900 --heartbeat-sec 30 --out-dir benchmarks/mlx/nanbeige4_1_3b_wayfinder/hang_debug_20260218T151213Z/instrumented_dense32_T131072","controls":{"model":"Nanbeige/Nanbeige4.1-3B","entrypoint":"scripts/bench_qwen_consumer_mlx.py","seq_len":131072,"decode_len":32,"repeats":1,"skip_multi_turn":true,"skip_quality":true,"retro_backfill_inference":"off","instrumentation":{"stage_timeout_sec":900,"heartbeat_sec":30},"one_process_at_a_time":true},"metrics":{"wayfinder":{"status":"completed","results":"benchmarks/mlx/nanbeige4_1_3b_wayfinder/hang_debug_20260218T151213Z/instrumented_trace32_T131072/results.json","e2e_sec":471.7443621659986,"prefill_sec":425.2292379999999,"decode_sec":46.515124165998714,"decode_tok_s":0.6879482872237741,"peak_memory_bytes":18474229212,"ttft_sec":30.832881124995765,"itl_p95_sec":0.2630014169990318,"path_counts":{"permute":264,"permute_dense_fallback":248},"dense_fallback_reason_counts":{"active_large_q":248},"dense_fallback_share_run":0.484375},"dense":{"status":"completed","results":"benchmarks/mlx/nanbeige4_1_3b_wayfinder/hang_debug_20260218T151213Z/instrumented_dense32_T131072/results.json","e2e_sec":467.10972379099985,"prefill_sec":435.8844581249941,"decode_sec":31.225265666005726,"decode_tok_s":1.0248111366699342,"peak_memory_bytes":18460513312,"ttft_sec":25.380296041999827,"itl_p95_sec":0.05292583299888065},"delta_wayfinder_vs_dense_abs":{"e2e_sec":4.634638374998758,"prefill_sec":-10.65522012499423,"decode_sec":15.289858499992988,"decode_tok_s":-0.3368628494461601,"peak_memory_bytes":13715900},"delta_wayfinder_vs_dense_pct":{"e2e_sec":0.9921947968423039,"prefill_sec":-2.444505631338372,"decode_sec":48.966303965313344,"decode_tok_s":-32.87072489676262,"peak_memory_bytes":0.07429858405445405},"memory_reduction_pct_convention":-0.07429858405445522,"fallback_reason_completeness":{"status":"informative","notes":"dense_fallback_reason_counts populated with active_large_q and non-empty path_counts"}},"decision":"follow-up","next_action":"Keep Nanbeige long-boundary path experimental/non-default; target decode-path cost and active_large_q fallback pressure before reconsidering promotion."}
{"id":"EXP-20260218T151213Z-FIRST-RELEASE-PUBLIC-PROFILE-RESULT","date":"2026-02-18","question":"Can we ship a single public GLM stable profile command that runs dense+wayfinder sequentially with safe defaults and clear comparison artifacts?","hypothesis":"A dedicated wrapper with conservative defaults (GLM, T=8192, decode_len=32, repeats=1, skip multi-turn/quality) will provide a reliable first-run benchmark path and reproducible summary outputs for new users.","change_set":["scripts/run_public_stable_profile_glm.sh (new)","README.md first-release onboarding/support-matrix/troubleshooting updates","docs/FIRST_RELEASE.md (new)"],"command":"bash -n scripts/run_public_stable_profile_glm.sh && python3 -m py_compile scripts/bench_qwen_consumer_mlx.py scripts/bench_glm_consumer_mlx.py scripts/run_section4_queue.py scripts/env_check_mlx.py && ./scripts/verify_install_and_preflight.sh --run-id EXP-20260218T151213Z-VERIFY-INSTALL --out-dir /tmp/wayfinder-first-release-preflight && ./scripts/run_public_stable_profile_glm.sh --run-id EXP-20260218T151213Z-STABLE-PROFILE && python3 scripts/run_section4_queue.py --dry-run --overwrite","controls":{"model":"mlx-community/GLM-4.7-Flash-4bit","seq_len":8192,"decode_len":32,"repeats":1,"skip_multi_turn":true,"skip_quality":true,"retro_backfill_inference":"off","one_process_at_a_time":true},"metrics":{"verification":{"bash_n":"pass","py_compile":"pass","verify_install":"pass","verify_artifacts":{"env_json":"/tmp/wayfinder-first-release-preflight/EXP-20260218T151213Z-VERIFY-INSTALL_env_check_mlx.json","summary_json":"/tmp/wayfinder-first-release-preflight/EXP-20260218T151213Z-VERIFY-INSTALL_summary.json","raw_txt":"/tmp/wayfinder-first-release-preflight/EXP-20260218T151213Z-VERIFY-INSTALL_raw.txt"},"queue_dry_run_overwrite":"pass"},"stable_profile":{"run_id":"EXP-20260218T151213Z-STABLE-PROFILE","summary_json":"benchmarks/mlx/first_release/EXP-20260218T151213Z-STABLE-PROFILE/stable_profile_summary.json","summary_md":"benchmarks/mlx/first_release/EXP-20260218T151213Z-STABLE-PROFILE/stable_profile_summary.md","dense":{"e2e_sec":17.147269542001595,"prefill_sec":16.35862916699989,"decode_sec":0.7886403750017053,"decode_tok_s":40.576162487154946,"peak_memory_bytes":20660500140},"wayfinder":{"e2e_sec":10.556340832998103,"prefill_sec":9.753327874997922,"decode_sec":0.8030129580001812,"decode_tok_s":39.84991734092637,"peak_memory_bytes":20071482232},"delta_wayfinder_vs_dense_abs":{"e2e_sec":-6.590928709003492,"prefill_sec":-6.605301292001968,"decode_sec":0.014372582998475991,"decode_tok_s":-0.7262451462285782,"peak_memory_bytes":-589017908},"delta_wayfinder_vs_dense_pct":{"e2e_sec":-38.43719078923475,"prefill_sec":-40.378085624232995,"decode_sec":1.8224508222071325,"decode_tok_s":-1.7898320139527317,"peak_memory_bytes":-2.8509373152086726},"memory_reduction_pct_convention":2.850937315208668},"release_decision":{"validated_default":"GLM stable wrapper command","experimental_opt_in":"Qwen/Nanbeige diagnostic slices","known_regression_non_default":"Nanbeige T=131072 decode_len=256"}},"decision":"keep","next_action":"Publish first release with GLM stable wrapper as default and keep Nanbeige long-boundary slices experimental/non-default pending decode-path fixes."}
{"id":"EXP-20260218T151213Z-FIRST-RUN-DENSE-SANITY-PRERUN","date":"2026-02-18","question":"Does the README first successful run dense command execute cleanly and produce expected artifacts for a new user?","hypothesis":"The documented dense sanity command at T=2048 decode_len=8 will complete with a usable single_turn row and results.json output under first_release artifacts.","change_set":["measurement only"],"command":"python3 scripts/bench_glm_consumer_mlx.py --mode dense --seq-lens 2048 --decode-len 8 --repeats 1 --skip-multi-turn --skip-quality --out-dir benchmarks/mlx/first_release/first_run_dense_t2048","controls":{"model":"mlx-community/GLM-4.7-Flash-4bit","mode":"dense","seq_len":2048,"decode_len":8,"repeats":1,"skip_multi_turn":true,"skip_quality":true,"retro_backfill_inference":"off","one_process_at_a_time":true},"metrics":{"status":"pending","required":["single_turn.e2e_sec","single_turn.prefill_sec","single_turn.decode_sec","single_turn.decode_tok_s","single_turn.peak_memory_bytes","results_json_present"]},"decision":"pending","next_action":"Run the command and record absolute metrics and artifact path."}
