{"id":"EXP-20260321T172541Z-QWEN27B-FP8-SCALE-RESULT","date":"2026-03-21","question":"On Qwen3.5-27B-FP8, what are the paired dense-vs-Wayfinder prefill timings at T=8192, 32768, 65536, 131072, how close is Wayfinder to dense logits at longer context, and how far beyond 131072 can the Wayfinder path safely scale on GB10?","hypothesis":"Partially falsified. Wayfinder beat dense through 65536, but both backbone paths failed at 131072 and the 16384 divergence row never landed.","change_set":["measurement-only"],"command":".venv/bin/python scripts/bench_qwen35_cuda_wayfinder.py --model-path /home/hmbown/HF_Models/Qwen3.5-27B-FP8 --seq-lens 8192 32768 65536 131072 --warmup 2 --repeats 3 --quantize none --path block_sparse --engine triton --block-size 128 --phases wayfinder dense --skip-divergence --forward-target backbone --output benchmarks/cuda/qwen35_wayfinder/EXP-20260321T172541Z-QWEN27B-FP8-SCALE.ndjson ; .venv/bin/python scripts/bench_qwen35_cuda_wayfinder.py --model-path /home/hmbown/HF_Models/Qwen3.5-27B-FP8 --seq-lens 8192 32768 65536 131072 --warmup 2 --repeats 3 --quantize none --path block_sparse --engine triton --block-size 128 --phases dense --skip-divergence --forward-target backbone --output benchmarks/cuda/qwen35_wayfinder/EXP-20260321T172541Z-QWEN27B-FP8-DENSE-BACKFILL.ndjson ; .venv/bin/python scripts/bench_qwen35_cuda_wayfinder.py --model-path /home/hmbown/HF_Models/Qwen3.5-27B-FP8 --seq-lens 131072 --warmup 0 --repeats 1 --quantize none --path block_sparse --engine triton --block-size 128 --phases dense --skip-divergence --forward-target backbone --output benchmarks/cuda/qwen35_wayfinder/EXP-20260321T-QWEN27B-FP8-DENSE-131072-FRESH.ndjson ; .venv/bin/python scripts/bench_qwen35_cuda_wayfinder.py --model-path /home/hmbown/HF_Models/Qwen3.5-27B-FP8 --seq-lens 4096 16384 --warmup 0 --repeats 1 --quantize none --path block_sparse --engine triton --block-size 128 --phases divergence --forward-target causal_lm --allow-large-logits --output benchmarks/cuda/qwen35_wayfinder/EXP-20260321T172541Z-QWEN27B-FP8-DIVERGENCE.ndjson ; .venv/bin/python scripts/bench_qwen35_cuda_wayfinder.py --model-path /home/hmbown/HF_Models/Qwen3.5-27B-FP8 --seq-lens 16384 --warmup 0 --repeats 1 --quantize none --path block_sparse --engine triton --block-size 128 --phases divergence --forward-target causal_lm --allow-large-logits --output benchmarks/cuda/qwen35_wayfinder/EXP-20260321T172541Z-QWEN27B-FP8-DIVERGENCE-16384-FRESH.ndjson","controls":{"paired_baseline_35b":"benchmarks/cuda/qwen35_wayfinder/EXP-20260321T061023Z-QWEN35A3B-FP8-SCALE.ndjson","quality_baseline_9b":"benchmarks/cuda/qwen35_wayfinder/EXP-20260321T011456Z-QWEN35CUDA-QUALITY-DIVERGENCE.ndjson","model":"~/HF_Models/Qwen3.5-27B-FP8","quantize":"none","dtype":"torch.bfloat16","wayfinder_config":{"path":"block_sparse","engine":"triton","block_size":128,"window":64,"landmark_stride":64,"num_cycles":1,"block_local_window_blocks":1,"block_partner_count":1,"block_sink_blocks":1,"block_partner_rule":"xor"},"forward_target":{"paired":"backbone","divergence":"causal_lm"},"one_process_at_a_time":true},"metrics":{"status":"partial_success_with_blocker","artifacts":{"wayfinder":"benchmarks/cuda/qwen35_wayfinder/EXP-20260321T172541Z-QWEN27B-FP8-SCALE.ndjson","dense_backfill":"benchmarks/cuda/qwen35_wayfinder/EXP-20260321T172541Z-QWEN27B-FP8-DENSE-BACKFILL.ndjson","dense_131072_fresh":"benchmarks/cuda/qwen35_wayfinder/EXP-20260321T-QWEN27B-FP8-DENSE-131072-FRESH.ndjson","divergence":"benchmarks/cuda/qwen35_wayfinder/EXP-20260321T172541Z-QWEN27B-FP8-DIVERGENCE.ndjson","divergence_16384_fresh":"benchmarks/cuda/qwen35_wayfinder/EXP-20260321T172541Z-QWEN27B-FP8-DIVERGENCE-16384-FRESH.ndjson"},"paired":{"8192":{"wayfinder":{"mean_ms":18189.48,"prefill_tok_per_sec":450.2,"peak_mem_gb":30.78},"dense":{"mean_ms":19500.07,"prefill_tok_per_sec":418.5,"peak_mem_gb":30.78},"speedup_x":1.072052,"latency_delta_ms":-1310.59,"latency_delta_pct":-6.721,"throughput_delta_tok_s":31.7,"throughput_delta_pct":7.5747,"memory_reduction_pct":0.0},"32768":{"wayfinder":{"mean_ms":74427.11,"prefill_tok_per_sec":442.4,"peak_mem_gb":38.16},"dense":{"mean_ms":79266.16,"prefill_tok_per_sec":413.5,"peak_mem_gb":38.16},"speedup_x":1.065017,"latency_delta_ms":-4839.05,"latency_delta_pct":-6.1048,"throughput_delta_tok_s":28.9,"throughput_delta_pct":6.9891,"memory_reduction_pct":0.0},"65536":{"wayfinder":{"mean_ms":168581.11,"prefill_tok_per_sec":386.3,"peak_mem_gb":48.01},"dense":{"mean_ms":170272.39,"prefill_tok_per_sec":385.1,"peak_mem_gb":48.0},"speedup_x":1.010032,"latency_delta_ms":-1691.28,"latency_delta_pct":-0.9933,"throughput_delta_tok_s":1.2,"throughput_delta_pct":0.3116,"memory_reduction_pct":-0.0208}},"vs_baseline_35b_wayfinder":{"8192":{"latency_delta_ms":9600.98,"latency_delta_pct":111.7888,"throughput_delta_tok_s":-503.6,"throughput_delta_pct":-52.7993,"peak_mem_delta_gb":-4.92,"peak_mem_delta_pct":-13.7815},"32768":{"latency_delta_ms":49240.7,"latency_delta_pct":195.505,"throughput_delta_tok_s":-858.6,"throughput_delta_pct":-65.9954,"peak_mem_delta_gb":-2.34,"peak_mem_delta_pct":-5.7778},"65536":{"latency_delta_ms":119148.5,"latency_delta_pct":241.0322,"throughput_delta_tok_s":-939.5,"throughput_delta_pct":-70.8629,"peak_mem_delta_gb":1.11,"peak_mem_delta_pct":2.3667}},"failures":{"wayfinder_131072":"CUDA error: an illegal memory access was encountered","dense_131072_backfill":"CUDA error: an illegal memory access was encountered","dense_131072_fresh":"CUDA error: an illegal memory access was encountered"},"divergence":{"4096":{"cosine_similarity":2.775266,"l2_distance":23927.6016,"l2_relative":0.33589,"top1_agreement":0.9966,"vs_quality_baseline_t4096":{"cosine_delta":0.034351,"cosine_delta_pct":1.2533,"l2_distance_delta":797.5332,"l2_distance_delta_pct":3.448,"l2_relative_delta":0.044572,"l2_relative_delta_pct":15.3001,"top1_agreement_delta":-0.0022,"top1_agreement_delta_pct":-0.2203}},"16384":{"status":"no_row_landed","original_artifact":"experiment_meta_only_plus_4096_row","fresh_rerun":"abnormal_exit_after_forward_pair_start; experiment_meta_only"}},"host_recovery":{"free_g_available_after_failures":108}},"decision":"follow-up","next_action":"Treat 131072 as a base 27B CUDA-path blocker, debug the illegal-address and 16384 divergence abort in fresh processes, and do not run ceiling probes until that is understood."}
{"id":"EXP-20260321T190500Z-RECUDA-SPARSE-GQA-TOGGLE-PRERUN","date":"2026-03-21","question":"Can the reCUDA optimized sparse GQA Triton kernel be integrated behind a runtime toggle in Wayfinder, preserve correctness on the shared sparse-GQA path, and validate the cached sparse_gqa_precomputed Qwen path without changing the current Qwen block-sparse Triton prefill kernel?","hypothesis":"Yes. The reCUDA candidate-01 kernel is signature-compatible with triton_fused_sparse_gqa_attention(), so a toggleable sibling module plus dispatcher wiring should pass the existing Triton sparse-GQA correctness tests and the cached Qwen sparse_gqa_precomputed test. Because the current Qwen long-prefill benchmark uses triton_block_sparse_attention rather than triton_fused_sparse_gqa_attention, no immediate change to the 27B --path block_sparse --engine triton prefill numbers is expected from this swap alone.","change_set":["add hcsa/torch/triton_fused_sparse_attn_v2.py from reCUDA candidate-01","wire WAYFINDER_USE_RECUDA_KERNEL dispatch in hcsa/torch/triton_fused_sparse_attn.py"],"command":"WAYFINDER_USE_RECUDA_KERNEL=0 .venv/bin/pytest -q tests/pytorch/test_torch_qwen_sparse_gqa.py -k 'test_sparse_gqa_precomputed_supports_rectangular_cached_decode or test_sparse_gqa_triton_fused_matches_repeated_kv_reference or test_sparse_gqa_triton_fused_handles_fully_masked_rows_with_bias' ; WAYFINDER_USE_RECUDA_KERNEL=1 .venv/bin/pytest -q tests/pytorch/test_torch_qwen_sparse_gqa.py -k 'test_sparse_gqa_precomputed_supports_rectangular_cached_decode or test_sparse_gqa_triton_fused_matches_repeated_kv_reference or test_sparse_gqa_triton_fused_handles_fully_masked_rows_with_bias'","controls":{"recuda_summary":"/home/hmbown/Projects/reCUDA/artifacts/wayfinder-zai-trace-20260321/wayfinder-sparse-gqa-20260321-121356/summary.json","trace_bundle":"benchmarks/cuda/qwen35_wayfinder/traces/EXP-20260319T183847Z-QWEN35-SPARSE-TRACE-BRIDGE","target_scope":"shared sparse-GQA path and cached Qwen sparse_gqa_precomputed path only","device":"cuda","same_repo_checkout":true},"metrics":{"status":"pending","required":["targeted tests pass with toggle off","targeted tests pass with toggle on","no claim of Qwen block_sparse prefill speedup without separate triton_block_sparse_attention change"]},"decision":"pending","next_action":"Patch in the toggleable kernel, then run the targeted pytest validation with the toggle off and on."}
{"id":"EXP-20260321T195700Z-RECUDA-SPARSE-GQA-INTEGRATION-PRERUN","date":"2026-03-21","question":"Can the reCUDA optimized sparse GQA Triton candidate be integrated into Wayfinder as a runtime-toggled drop-in replacement for triton_fused_sparse_gqa_attention() while preserving correctness on the existing sparse path?","hypothesis":"Yes. The candidate kernel is signature-compatible with triton_fused_sparse_gqa_attention(), and the current CUDA sparse path already dispatches through that function when return_weights=False. A runtime toggle should let us validate correctness without changing the default path. This may improve path=sparse contraction latency, but it is not expected to change the current Qwen path=block_sparse --engine triton prefill results unless the precomputed/block-sparse contraction path is also re-plumbed later.","change_set":["add hcsa/torch/triton_fused_sparse_attn_v2.py from the reCUDA candidate","gate sparse-path kernel import selection with WAYFINDER_USE_RECUDA_KERNEL","leave the default kernel path unchanged unless the toggle is enabled"],"command":"python scripts/smoke_verify_triton_wayfinder.py ; WAYFINDER_USE_RECUDA_KERNEL=1 python scripts/smoke_verify_triton_wayfinder.py ; pytest tests/pytorch/test_torch_qwen_sparse_gqa.py -k 'sparse_gqa_chunked or sparse_gqa_precomputed'","controls":{"baseline_kernel":"hcsa/torch/triton_fused_sparse_attn.py","smoke_verifier":"scripts/smoke_verify_triton_wayfinder.py","guide":"/home/hmbown/Projects/reCUDA/wayfinderguide.md","candidate":"/home/hmbown/Projects/reCUDA/artifacts/wayfinder-zai-trace-20260321/wayfinder-sparse-gqa-20260321-121356/candidates/candidate-01.py","runtime_toggle_default":"off","qwen_block_sparse_path_unchanged":true},"metrics":{"status":"pending","required":["smoke verifier passes with default kernel","smoke verifier passes with reCUDA kernel enabled","sparse GQA tests pass","backend remains reported as triton_fused on the sparse path"]},"decision":"pending","next_action":"Patch the runtime-toggled import path, then run the smoke verifier and sparse-GQA tests."}
{"id":"EXP-20260321T195700Z-RECUDA-SPARSE-GQA-INTEGRATION-RESULT","date":"2026-03-21","question":"Can the reCUDA optimized sparse GQA Triton candidate be integrated into Wayfinder as a runtime-toggled drop-in replacement for triton_fused_sparse_gqa_attention() while preserving correctness on the existing sparse path?","hypothesis":"Yes. The candidate kernel is signature-compatible with triton_fused_sparse_gqa_attention(), and the current CUDA sparse path already dispatches through that function when return_weights=False. A runtime toggle should let us validate correctness without changing the default path. This may improve path=sparse contraction latency, but it is not expected to change the current Qwen path=block_sparse --engine triton prefill results unless the precomputed/block-sparse contraction path is also re-plumbed later.","change_set":["added hcsa/torch/triton_fused_sparse_attn_v2.py from the reCUDA candidate","gated sparse-path kernel import selection with WAYFINDER_USE_RECUDA_KERNEL in hcsa/torch/attention_wayfinder_sparse.py"],"command":"python scripts/smoke_verify_triton_wayfinder.py ; WAYFINDER_USE_RECUDA_KERNEL=1 python scripts/smoke_verify_triton_wayfinder.py ; pytest tests/pytorch/test_torch_qwen_sparse_gqa.py -k 'sparse_gqa_chunked or sparse_gqa_precomputed'","controls":{"baseline_kernel":"hcsa/torch/triton_fused_sparse_attn.py","smoke_verifier":"scripts/smoke_verify_triton_wayfinder.py","guide":"/home/hmbown/Projects/reCUDA/wayfinderguide.md","candidate":"/home/hmbown/Projects/reCUDA/artifacts/wayfinder-zai-trace-20260321/wayfinder-sparse-gqa-20260321-121356/candidates/candidate-01.py","runtime_toggle_default":"off","qwen_block_sparse_path_unchanged":true},"metrics":{"status":"success","default_smoke":{"backend":"triton_fused","max_abs_diff":0.015625},"recuda_smoke":{"backend":"triton_fused","max_abs_diff":0.015625,"delta_vs_default":0.0,"delta_vs_default_pct":0.0},"pytest":{"passed":4,"deselected":19},"scope_note":"Validated only the sparse contraction path. No local Qwen block_sparse prefill benchmark delta was measured in this experiment."},"decision":"keep","next_action":"If Qwen prefill speed is the priority, benchmark --path sparse separately or plumb the block_sparse precomputed path onto the same fused kernel before making performance claims."}
{"id":"EXP-20260321T211500Z-QWEN27B-DECODE-BACKEND-TIEBREAK-PRERUN","date":"2026-03-21","question":"Does the current Qwen path=block_sparse cached decode branch change behavior when WAYFINDER_USE_RECUDA_KERNEL=1, or does it stay on the existing sparse_gqa_precomputed implementation?","hypothesis":"It stays on sparse_gqa_precomputed with no decode-path change under the reCUDA env toggle. The current cached decode branch calls sparse_row_attention_gqa_precomputed() and does not dispatch through triton_fused_sparse_gqa_attention().","change_set":["measurement-only"],"command":"WAYFINDER_USE_RECUDA_KERNEL=0 .venv/bin/pytest -q tests/pytorch/test_torch_qwen_sparse_gqa.py -k test_qwen_wayfinder_block_sparse_cached_kv_uses_sparse_precomputed_backend ; WAYFINDER_USE_RECUDA_KERNEL=1 .venv/bin/pytest -q tests/pytorch/test_torch_qwen_sparse_gqa.py -k test_qwen_wayfinder_block_sparse_cached_kv_uses_sparse_precomputed_backend","controls":{"dispatch_reference":"hcsa/integrations/qwen_torch.py","precomputed_reference":"hcsa/torch/attention_wayfinder_sparse.py","same_targeted_test":true,"model_benchmark":"off"},"metrics":{"status":"pending","required":["targeted cached-decode test passes with env toggle off","targeted cached-decode test passes with env toggle on","backend marker remains sparse_gqa_precomputed"]},"decision":"pending","next_action":"Run the targeted test with the env toggle off and on, then record the tie-break result before making decode-kernel claims."}
{"id":"EXP-20260321T212000Z-QWEN27B-DECODE-KERNEL-MATRIX-PRERUN","date":"2026-03-21","question":"Can we add an explicit cached-decode sparse backend control, route Qwen block_sparse cached decode onto fused sparse-GQA when requested, and build a repeatable CUDA decode benchmark matrix for dense vs Wayfinder vs Wayfinder+reCUDA?","hypothesis":"Yes. An explicit precomputed sparse backend switch should preserve the current default decode path while enabling an opt-in triton_fused decode branch. Extending the existing decode benchmark harness should then let us compare TTFT, TPOT, decode tok/s, peak memory, and per-layer backend markers across dense, Wayfinder-default, and Wayfinder+reCUDA runs without relying on the prefill-only benchmark.","change_set":["hcsa/torch/attention_wayfinder_sparse.py","hcsa/torch/triton_fused_sparse_attn.py","hcsa/integrations/qwen_torch.py","scripts/bench_decode_wayfinder.py","tests/pytorch/test_torch_qwen_sparse_gqa.py"],"command":"python -m py_compile hcsa/torch/attention_wayfinder_sparse.py hcsa/torch/triton_fused_sparse_attn.py hcsa/integrations/qwen_torch.py scripts/bench_decode_wayfinder.py tests/pytorch/test_torch_qwen_sparse_gqa.py ; .venv/bin/pytest -q tests/pytorch/test_torch_qwen_sparse_gqa.py -k 'precomputed or triton_fused or cached_kv' ; .venv/bin/python scripts/bench_decode_wayfinder.py --model-path /home/hmbown/HF_Models/Qwen3.5-27B-FP8 --prompt-lens 2048 --max-new-tokens 8 --repeats 1 --mode-matrix dense wayfinder wayfinder_triton wayfinder_recuda --output benchmarks/cuda/qwen35_wayfinder/EXP-20260321T212000Z-QWEN27B-DECODE-SMOKE.ndjson","controls":{"model":"~/HF_Models/Qwen3.5-27B-FP8","trust_remote_code":true,"dtype":"torch.bfloat16","decode_path":"generate()","default_decode_backend_is_control":true,"prefill_baseline":"benchmarks/cuda/qwen35_wayfinder/EXP-20260321T172541Z-QWEN27B-FP8-SCALE.ndjson"},"metrics":{"status":"pending","required":["py_compile passes","targeted sparse-GQA tests pass","decode smoke emits dense and wayfinder rows","backend markers identify default vs triton_fused vs reCUDA decode paths","peak allocation stays below 80 GiB for the smoke run"]},"decision":"pending","next_action":"Run the tie-break first, then patch the explicit backend control and execute the bounded validation queue."}
{"id":"EXP-20260321T211500Z-QWEN27B-DECODE-BACKEND-TIEBREAK-RESULT","date":"2026-03-21","question":"Does the current Qwen path=block_sparse cached decode branch change behavior when WAYFINDER_USE_RECUDA_KERNEL=1, or does it stay on the existing sparse_gqa_precomputed implementation?","hypothesis":"It stays on sparse_gqa_precomputed with no decode-path change under the reCUDA env toggle. The current cached decode branch calls sparse_row_attention_gqa_precomputed() and does not dispatch through triton_fused_sparse_gqa_attention().","change_set":["measurement-only"],"command":"WAYFINDER_USE_RECUDA_KERNEL=0 .venv/bin/pytest -q tests/pytorch/test_torch_qwen_sparse_gqa.py -k test_qwen_wayfinder_block_sparse_cached_kv_uses_sparse_precomputed_backend ; WAYFINDER_USE_RECUDA_KERNEL=1 .venv/bin/pytest -q tests/pytorch/test_torch_qwen_sparse_gqa.py -k test_qwen_wayfinder_block_sparse_cached_kv_uses_sparse_precomputed_backend","controls":{"dispatch_reference":"hcsa/integrations/qwen_torch.py","precomputed_reference":"hcsa/torch/attention_wayfinder_sparse.py","same_targeted_test":true,"model_benchmark":"off"},"metrics":{"status":"success","toggle_off":{"pytest":{"passed":1},"backend":"sparse_gqa_precomputed"},"toggle_on":{"pytest":{"passed":1},"backend":"sparse_gqa_precomputed"},"conclusion":"WAYFINDER_USE_RECUDA_KERNEL alone does not change the current Qwen block_sparse cached decode path."},"decision":"keep","next_action":"Add an explicit cached-decode fused sparse-GQA backend control so the decode benchmark matrix can test dense vs Wayfinder-default vs Wayfinder+custom-kernel directly."}
