{"id":"EXP-20260209-GLM47-SPARSE-SUBSET-ABLATION","date":"2026-02-09","question":"Within GLM Wayfinder sparse path, how do sparse-only (num_cycles=0), sparse+cycle (num_cycles=1), and sparse+multicycle (num_cycles=auto) compare to dense baseline and to each other?","hypothesis":"sparse+multicycle should improve cycle/graph connectivity metrics versus sparse-only, but may trade throughput and memory; all sparse variants are likely below dense throughput at this scale.","change_set":["scripts/bench_glm_wayfinder_mlx.py","hcsa/integrations/glm_mlx.py"],"command":"PYTHONPATH=. python3 scripts/bench_glm_wayfinder_mlx.py --model-path mlx-community/GLM-4.7-Flash-4bit --seq-lens 2048 8192 32768 --batch 1 --warmup 1 --iters 1 --dtype bfloat16 --path sparse --window 64 --landmark-stride 64 --num-cycles 0 --allow-non-hamiltonian --collect-graph-stats --out-dir benchmarks/mlx/glm4_7_flash_sparse_landmarks_20260209_185519 && PYTHONPATH=. python3 scripts/bench_glm_wayfinder_mlx.py --model-path mlx-community/GLM-4.7-Flash-4bit --seq-lens 2048 8192 32768 --batch 1 --warmup 1 --iters 1 --dtype bfloat16 --path sparse --window 64 --landmark-stride 64 --num-cycles 1 --collect-graph-stats --out-dir benchmarks/mlx/glm4_7_flash_sparse_cycle_20260209_185519 && PYTHONPATH=. python3 scripts/bench_glm_wayfinder_mlx.py --model-path mlx-community/GLM-4.7-Flash-4bit --seq-lens 2048 8192 32768 --batch 1 --warmup 1 --iters 1 --dtype bfloat16 --path sparse --window 64 --landmark-stride 0 --num-cycles auto --no-edge-disjoint --collect-graph-stats --out-dir benchmarks/mlx/glm4_7_flash_sparse_multicycle_20260209_185519","controls":{"model_path":"mlx-community/GLM-4.7-Flash-4bit","seq_lens":[2048,8192,32768],"batch":1,"warmup":1,"iters":1,"dtype":"bfloat16","path":"sparse","window":64,"seed":42,"retro_backfill_enabled":false},"metrics":{"status":"pending"},"decision":"pending","next_action":"Run all three sparse variants and compare cycle usage plus throughput/memory trade-offs."}
{"id":"EXP-20260209-GLM47-CONSUMER-MULTITURN-PARITY","date":"2026-02-09","question":"Over longer multi-turn conversations, does Wayfinder preserve user-visible quality/latency behavior close to dense baseline?","hypothesis":"With matched settings, Wayfinder should maintain comparable quality accuracy while keeping multi-turn latency/memory within acceptable deltas versus dense.","change_set":["none (measurement-only)"],"command":"PYTHONPATH=. python3 scripts/bench_glm_consumer_mlx.py --model-path mlx-community/GLM-4.7-Flash-4bit --seq-lens 8192 --decode-len 256 --repeats 1 --turns 8 --multi-decode-len 128 --multi-target-context 65536 --chunk-size 4096 --kv-step 4096 --cooldown-sec 0 --path permute --window 64 --landmark-stride 0 --head-chunk-size 2 --query-chunk-size 384 --active-dense-threshold 49152 --seed 42 --quality-dataset benchmarks/mlx/glm_4_7_flash_4bit_wayfinder/quality_eval_glm47_consumer_v1.json --skip-single-turn --no-swap --out-dir benchmarks/mlx/glm4_7_flash_consumer_dense_mt8_20260209_185519 && PYTHONPATH=. python3 scripts/bench_glm_consumer_mlx.py --model-path mlx-community/GLM-4.7-Flash-4bit --seq-lens 8192 --decode-len 256 --repeats 1 --turns 8 --multi-decode-len 128 --multi-target-context 65536 --chunk-size 4096 --kv-step 4096 --cooldown-sec 0 --path permute --window 64 --landmark-stride 0 --head-chunk-size 2 --query-chunk-size 384 --active-dense-threshold 49152 --seed 42 --quality-dataset benchmarks/mlx/glm_4_7_flash_4bit_wayfinder/quality_eval_glm47_consumer_v1.json --skip-single-turn --out-dir benchmarks/mlx/glm4_7_flash_consumer_wayfinder_mt8_20260209_185519","controls":{"model_path":"mlx-community/GLM-4.7-Flash-4bit","seq_lens":[8192],"decode_len":256,"repeats":1,"turns":8,"multi_decode_len":128,"multi_target_context":65536,"chunk_size":4096,"kv_step":4096,"path":"permute","window":64,"landmark_stride":0,"head_chunk_size":2,"query_chunk_size":384,"active_dense_threshold":49152,"seed":42,"quality_dataset":"benchmarks/mlx/glm_4_7_flash_4bit_wayfinder/quality_eval_glm47_consumer_v1.json"},"metrics":{"status":"pending"},"decision":"pending","next_action":"Run dense and Wayfinder multi-turn tests, then compare per-turn latency/memory and quality parity."}
{"id":"EXP-20260209-GLM47-SPARSE-SUBSET-ABLATION-RESUME","date":"2026-02-09","question":"After crash recovery, do sparse-only, sparse+cycle, and sparse+multicycle show distinct cycle-usage and performance behavior on GLM in a completed sweep?","hypothesis":"Sparse variants will remain below dense throughput, but cycle-enabled variants (especially multicycle) will show stronger cycle share in edge_utilization_proxy and a measurable topology usage difference versus sparse-only.","change_set":["none (measurement-only resume run; uses newly added CLI knobs from prior local edits)"],"command":"PYTHONPATH=. python3 scripts/bench_glm_wayfinder_mlx.py --model-path mlx-community/GLM-4.7-Flash-4bit --seq-lens 2048 8192 16384 --batch 1 --warmup 1 --iters 1 --dtype bfloat16 --path sparse --window 64 --landmark-stride 64 --num-cycles 0 --allow-non-hamiltonian --compute-edge-utilization-proxy --out-dir benchmarks/mlx/glm4_7_flash_sparse_landmarks_20260209_234958_resume && PYTHONPATH=. python3 scripts/bench_glm_wayfinder_mlx.py --model-path mlx-community/GLM-4.7-Flash-4bit --seq-lens 2048 8192 16384 --batch 1 --warmup 1 --iters 1 --dtype bfloat16 --path sparse --window 64 --landmark-stride 64 --num-cycles 1 --compute-edge-utilization-proxy --out-dir benchmarks/mlx/glm4_7_flash_sparse_cycle_20260209_234958_resume && PYTHONPATH=. python3 scripts/bench_glm_wayfinder_mlx.py --model-path mlx-community/GLM-4.7-Flash-4bit --seq-lens 2048 8192 16384 --batch 1 --warmup 1 --iters 1 --dtype bfloat16 --path sparse --window 64 --landmark-stride 0 --num-cycles auto --no-edge-disjoint --compute-edge-utilization-proxy --out-dir benchmarks/mlx/glm4_7_flash_sparse_multicycle_20260209_234958_resume","controls":{"model_path":"mlx-community/GLM-4.7-Flash-4bit","seq_lens":[2048,8192,16384],"batch":1,"warmup":1,"iters":1,"dtype":"bfloat16","path":"sparse","window":64,"seed":42,"retro_backfill_enabled":false},"metrics":{"status":"pending"},"decision":"pending","next_action":"Run three sparse variants and summarize dense deltas plus cycle usage."}
{"id":"EXP-20260209-GLM47-CONSUMER-MULTITURN-PARITY-RESUME","date":"2026-02-09","question":"Over 8-turn conversations at 8K context, does Wayfinder preserve quality and user-experience timing close to dense baseline?","hypothesis":"Wayfinder should keep quality accuracy near dense while maintaining comparable or better multi-turn latency and memory under matched settings.","change_set":["none (measurement-only resume run)"],"command":"PYTHONPATH=. python3 scripts/bench_glm_consumer_mlx.py --model-path mlx-community/GLM-4.7-Flash-4bit --seq-lens 8192 --decode-len 256 --repeats 1 --turns 8 --multi-decode-len 128 --multi-target-context 65536 --chunk-size 4096 --kv-step 4096 --cooldown-sec 0 --path permute --window 64 --landmark-stride 0 --head-chunk-size 2 --query-chunk-size 384 --active-dense-threshold 49152 --seed 42 --quality-dataset benchmarks/mlx/glm_4_7_flash_4bit_wayfinder/quality_eval_glm47_consumer_v1.json --skip-single-turn --no-swap --out-dir benchmarks/mlx/glm4_7_flash_consumer_dense_mt8_20260209_234958_resume && PYTHONPATH=. python3 scripts/bench_glm_consumer_mlx.py --model-path mlx-community/GLM-4.7-Flash-4bit --seq-lens 8192 --decode-len 256 --repeats 1 --turns 8 --multi-decode-len 128 --multi-target-context 65536 --chunk-size 4096 --kv-step 4096 --cooldown-sec 0 --path permute --window 64 --landmark-stride 0 --head-chunk-size 2 --query-chunk-size 384 --active-dense-threshold 49152 --seed 42 --quality-dataset benchmarks/mlx/glm_4_7_flash_4bit_wayfinder/quality_eval_glm47_consumer_v1.json --skip-single-turn --out-dir benchmarks/mlx/glm4_7_flash_consumer_wayfinder_mt8_20260209_234958_resume","controls":{"model_path":"mlx-community/GLM-4.7-Flash-4bit","seq_lens":[8192],"decode_len":256,"repeats":1,"turns":8,"multi_decode_len":128,"multi_target_context":65536,"chunk_size":4096,"kv_step":4096,"path":"permute","window":64,"landmark_stride":0,"head_chunk_size":2,"query_chunk_size":384,"active_dense_threshold":49152,"seed":42,"quality_dataset":"benchmarks/mlx/glm_4_7_flash_4bit_wayfinder/quality_eval_glm47_consumer_v1.json"},"metrics":{"status":"pending"},"decision":"pending","next_action":"Run dense and Wayfinder and compute per-turn plus quality deltas vs dense."}
{"id":"EXP-20260209-GLM47-SPARSE-LANDMARKS-2048-SAFE-PRERUN","date":"2026-02-09","question":"With one-run-per-process constraints and graph metrics disabled, what is sparse landmarks baseline behavior for GLM-4.7-Flash at seq_len=2048?","hypothesis":"A single sparse-landmarks run at 2K should complete stably and provide a reproducible throughput/memory reference; sparse Wayfinder attention is expected to underperform dense at this short context.","change_set":["none (measurement-only)"],"command":"PYTHONPATH=. python3 scripts/bench_glm_wayfinder_mlx.py --model-path mlx-community/GLM-4.7-Flash-4bit --seq-lens 2048 --batch 1 --warmup 1 --iters 1 --dtype bfloat16 --path sparse --window 64 --landmark-stride 64 --num-cycles 0 --allow-non-hamiltonian --permute-head-chunk-size 2 --permute-query-chunk-size 192 --permute-prepermute-mode auto --out-dir benchmarks/mlx/glm4_7_flash_sparse_landmarks_20260209_safe_2048","controls":{"model_path":"mlx-community/GLM-4.7-Flash-4bit","seq_len":2048,"batch":1,"warmup":1,"iters":1,"dtype":"bfloat16","path":"sparse","window":64,"landmark_stride":64,"num_cycles":0,"allow_non_hamiltonian":true,"graph_metrics":false,"retro_backfill_enabled":false},"metrics":{"status":"pending"},"decision":"pending","next_action":"Run command and log absolute and delta metrics vs dense baseline."}
{"id":"EXP-20260209-GLM47-SPARSE-LANDMARKS-2048-SAFE-RESULT","date":"2026-02-09","question":"With one-run-per-process constraints and graph metrics disabled, what is sparse landmarks baseline behavior for GLM-4.7-Flash at seq_len=2048?","hypothesis":"A single sparse-landmarks run at 2K should complete stably and provide a reproducible throughput/memory reference; sparse Wayfinder attention is expected to underperform dense at this short context.","change_set":["none (measurement-only)"],"command":"PYTHONPATH=. python3 scripts/bench_glm_wayfinder_mlx.py --model-path mlx-community/GLM-4.7-Flash-4bit --seq-lens 2048 --batch 1 --warmup 1 --iters 1 --dtype bfloat16 --path sparse --window 64 --landmark-stride 64 --num-cycles 0 --allow-non-hamiltonian --permute-head-chunk-size 2 --permute-query-chunk-size 192 --permute-prepermute-mode auto --out-dir benchmarks/mlx/glm4_7_flash_sparse_landmarks_20260209_safe_2048","controls":{"model_path":"mlx-community/GLM-4.7-Flash-4bit","seq_len":2048,"batch":1,"warmup":1,"iters":1,"dtype":"bfloat16","path":"sparse","window":64,"landmark_stride":64,"num_cycles":0,"allow_non_hamiltonian":true,"graph_metrics":false,"retro_backfill_enabled":false,"baseline_path":"benchmarks/mlx/glm4_7_flash_sparse_landmarks_20260209_safe_2048/results.json (dense baseline embedded per row)"},"metrics":{"artifact":"benchmarks/mlx/glm4_7_flash_sparse_landmarks_20260209_safe_2048/results.json","level_a_real_qkv":{"tokens_per_sec":{"dense_absolute":64321.355522484344,"wayfinder_absolute":3629.6195943506373,"delta_vs_baseline":-60691.735928133705,"delta_pct_vs_baseline":-94.3570536334828},"peak_memory_bytes":{"dense_absolute":426232364.0,"wayfinder_absolute":11731143488.0,"delta_vs_baseline":11304911124.0,"delta_pct_vs_baseline":2652.288300660341},"memory_reduction_pct":-2652.288300660341},"resolved_num_cycles":0},"decision":"follow-up","next_action":"Run sparse cycle and sparse multicycle at seq_len=2048 one-by-one and compare against this sparse-landmarks baseline plus dense embedded baseline."}
{"id":"EXP-20260209-GLM47-SPARSE-CYCLE-MULTICYCLE-2048-SAFE-PRERUN","date":"2026-02-09","question":"At seq_len=2048, do cycle (num_cycles=1) and multicycle (num_cycles=auto, no-edge-disjoint) improve sparse behavior relative to sparse-landmarks?","hypothesis":"Adding cycle structure may improve sparse attention behavior versus landmarks-only at 2K; multicycle may trade additional overhead for connectivity.","change_set":["none (measurement-only)"],"command":"PYTHONPATH=. python3 scripts/bench_glm_wayfinder_mlx.py --model-path mlx-community/GLM-4.7-Flash-4bit --seq-lens 2048 --batch 1 --warmup 1 --iters 1 --dtype bfloat16 --path sparse --window 64 --landmark-stride 64 --num-cycles 1 --permute-head-chunk-size 2 --permute-query-chunk-size 192 --permute-prepermute-mode auto --out-dir benchmarks/mlx/glm4_7_flash_sparse_cycle_20260209_safe_2048 && PYTHONPATH=. python3 scripts/bench_glm_wayfinder_mlx.py --model-path mlx-community/GLM-4.7-Flash-4bit --seq-lens 2048 --batch 1 --warmup 1 --iters 1 --dtype bfloat16 --path sparse --window 64 --landmark-stride 0 --num-cycles auto --no-edge-disjoint --permute-head-chunk-size 2 --permute-query-chunk-size 192 --permute-prepermute-mode auto --out-dir benchmarks/mlx/glm4_7_flash_sparse_multicycle_20260209_safe_2048","controls":{"model_path":"mlx-community/GLM-4.7-Flash-4bit","seq_len":2048,"batch":1,"warmup":1,"iters":1,"dtype":"bfloat16","path":"sparse","window":64,"graph_metrics":false,"retro_backfill_enabled":false},"metrics":{"status":"pending"},"decision":"pending","next_action":"Execute cycle then multicycle one-by-one and compare against dense + sparse-landmarks."}
{"id":"EXP-20260209-GLM47-SPARSE-CYCLE-MULTICYCLE-2048-SAFE-RESULT","date":"2026-02-09","question":"At seq_len=2048, do cycle (num_cycles=1) and multicycle (num_cycles=auto, no-edge-disjoint) improve sparse behavior relative to sparse-landmarks?","hypothesis":"Adding cycle structure may improve sparse attention behavior versus landmarks-only at 2K; multicycle may trade additional overhead for connectivity.","change_set":["none (measurement-only)"],"command":"PYTHONPATH=. python3 scripts/bench_glm_wayfinder_mlx.py --model-path mlx-community/GLM-4.7-Flash-4bit --seq-lens 2048 --batch 1 --warmup 1 --iters 1 --dtype bfloat16 --path sparse --window 64 --landmark-stride 64 --num-cycles 1 --permute-head-chunk-size 2 --permute-query-chunk-size 192 --permute-prepermute-mode auto --out-dir benchmarks/mlx/glm4_7_flash_sparse_cycle_20260209_safe_2048 && PYTHONPATH=. python3 scripts/bench_glm_wayfinder_mlx.py --model-path mlx-community/GLM-4.7-Flash-4bit --seq-lens 2048 --batch 1 --warmup 1 --iters 1 --dtype bfloat16 --path sparse --window 64 --landmark-stride 0 --num-cycles auto --no-edge-disjoint --permute-head-chunk-size 2 --permute-query-chunk-size 192 --permute-prepermute-mode auto --out-dir benchmarks/mlx/glm4_7_flash_sparse_multicycle_20260209_safe_2048","controls":{"model_path":"mlx-community/GLM-4.7-Flash-4bit","seq_len":2048,"batch":1,"warmup":1,"iters":1,"dtype":"bfloat16","path":"sparse","window":64,"graph_metrics":false,"retro_backfill_enabled":false,"baseline_path":"benchmarks/mlx/glm4_7_flash_sparse_landmarks_20260209_safe_2048/results.json"},"metrics":{"landmarks":{"artifact":"benchmarks/mlx/glm4_7_flash_sparse_landmarks_20260209_safe_2048/results.json","tokens_per_sec":{"dense_absolute":64321.355522484344,"wayfinder_absolute":3629.6195943506373,"delta_vs_baseline":-60691.735928133705,"delta_pct_vs_baseline":-94.3570536334828},"peak_memory_bytes":{"dense_absolute":426232364.0,"wayfinder_absolute":11731143488.0,"delta_vs_baseline":11304911124.0,"delta_pct_vs_baseline":2652.288300660341},"memory_reduction_pct":-2652.288300660341,"resolved_num_cycles":0},"cycle":{"artifact":"benchmarks/mlx/glm4_7_flash_sparse_cycle_20260209_safe_2048/results.json","tokens_per_sec":{"dense_absolute":65194.122024108976,"wayfinder_absolute":3639.6999202488855,"delta_vs_baseline":-61554.42210386009,"delta_pct_vs_baseline":-94.41713484706042,"delta_vs_landmarks":10.080325898248248,"delta_pct_vs_landmarks":0.2777240324010231},"peak_memory_bytes":{"dense_absolute":426232364.0,"wayfinder_absolute":11973937984.0,"delta_vs_baseline":11547705620.0,"delta_pct_vs_baseline":2709.251243061402,"delta_vs_landmarks":242794496.0,"delta_pct_vs_landmarks":2.0696575423219303},"memory_reduction_pct":-2709.2512430614024,"resolved_num_cycles":1},"multicycle":{"artifact":"benchmarks/mlx/glm4_7_flash_sparse_multicycle_20260209_safe_2048/results.json","tokens_per_sec":{"dense_absolute":64587.00301372366,"wayfinder_absolute":3051.882754902961,"delta_vs_baseline":-61535.1202588207,"delta_pct_vs_baseline":-95.27477261291334,"delta_vs_landmarks":-577.7368394476762,"delta_pct_vs_landmarks":-15.917283462622398},"peak_memory_bytes":{"dense_absolute":426232364.0,"wayfinder_absolute":13367872320.0,"delta_vs_baseline":12941639956.0,"delta_pct_vs_baseline":3036.28749223745,"delta_vs_landmarks":1636728832.0,"delta_pct_vs_landmarks":13.95199737923451},"memory_reduction_pct":-3036.2874922374504,"resolved_num_cycles":22}},"decision":"follow-up","next_action":"Keep one-run-per-process protocol; focus next on permute path and cache-lifetime fixes before larger sparse contexts."}
{"id":"EXP-20260209-GLM47-SPARSE-SUBSET-4096-SAFE-PRERUN","date":"2026-02-09","question":"Under strict one-run-per-process constraints, how do sparse landmarks, cycle, and multicycle compare at seq_len=4096?","hypothesis":"Relative ordering from 2K will persist at 4K, with cycle near landmarks and multicycle slower/heavier; all sparse variants likely remain far below dense at this context.","change_set":["none (measurement-only)"],"command":"PYTHONPATH=. python3 scripts/bench_glm_wayfinder_mlx.py --model-path mlx-community/GLM-4.7-Flash-4bit --seq-lens 4096 --batch 1 --warmup 1 --iters 1 --dtype bfloat16 --path sparse --window 64 --landmark-stride 64 --num-cycles 0 --allow-non-hamiltonian --permute-head-chunk-size 2 --permute-query-chunk-size 192 --permute-prepermute-mode auto --out-dir benchmarks/mlx/glm4_7_flash_sparse_landmarks_20260209_safe_4096 && PYTHONPATH=. python3 scripts/bench_glm_wayfinder_mlx.py --model-path mlx-community/GLM-4.7-Flash-4bit --seq-lens 4096 --batch 1 --warmup 1 --iters 1 --dtype bfloat16 --path sparse --window 64 --landmark-stride 64 --num-cycles 1 --permute-head-chunk-size 2 --permute-query-chunk-size 192 --permute-prepermute-mode auto --out-dir benchmarks/mlx/glm4_7_flash_sparse_cycle_20260209_safe_4096 && PYTHONPATH=. python3 scripts/bench_glm_wayfinder_mlx.py --model-path mlx-community/GLM-4.7-Flash-4bit --seq-lens 4096 --batch 1 --warmup 1 --iters 1 --dtype bfloat16 --path sparse --window 64 --landmark-stride 0 --num-cycles auto --no-edge-disjoint --permute-head-chunk-size 2 --permute-query-chunk-size 192 --permute-prepermute-mode auto --out-dir benchmarks/mlx/glm4_7_flash_sparse_multicycle_20260209_safe_4096","controls":{"model_path":"mlx-community/GLM-4.7-Flash-4bit","seq_len":4096,"batch":1,"warmup":1,"iters":1,"dtype":"bfloat16","path":"sparse","window":64,"graph_metrics":false,"retro_backfill_enabled":false},"metrics":{"status":"pending"},"decision":"pending","next_action":"Execute three runs sequentially and record dense deltas and cross-config comparisons."}
{"id":"EXP-20260210-MLX-MEMORY-HARDENING-PRERUN","date":"2026-02-10","question":"Do minimal benchmark/runtime hardening changes reduce cache retention risk and host-memory spikes while preserving existing CLI functionality?","hypothesis":"Adding per-seq cleanup + one-seq-per-process guard and replacing NumPy-copy byte accounting with zero-copy size reads will eliminate obvious runaway memory vectors without breaking benchmark script interfaces.","change_set":["scripts/bench_glm_wayfinder_mlx.py","scripts/bench_qwen_wayfinder_mlx.py","hcsa/integrations/qwen_mlx.py"],"command":"python3 scripts/bench_glm_wayfinder_mlx.py --help && python3 scripts/bench_qwen_wayfinder_mlx.py --help && PYTHONPATH=. python3 -m pytest tests/mlx/test_glm_hamiltonian_e2e.py tests/mlx/test_graph_cache.py tests/mlx/test_cache_key_stability.py -q","controls":{"benchmark_model_runs":false,"parallel_benchmarks":false,"retro_backfill_default_inference_off":true},"metrics":{"status":"pending"},"decision":"pending","next_action":"Run validation commands and append result entry with command outcomes."}
{"id":"EXP-20260210-MLX-MEMORY-HARDENING-RESULT","date":"2026-02-10","question":"Do minimal benchmark/runtime hardening changes reduce cache retention risk and host-memory spikes while preserving existing CLI functionality?","hypothesis":"Adding per-seq cleanup + one-seq-per-process guard and replacing NumPy-copy byte accounting with zero-copy size reads will eliminate obvious runaway memory vectors without breaking benchmark script interfaces.","change_set":["scripts/bench_glm_wayfinder_mlx.py","scripts/bench_qwen_wayfinder_mlx.py","hcsa/integrations/qwen_mlx.py"],"command":"python3 scripts/bench_glm_wayfinder_mlx.py --help && python3 scripts/bench_qwen_wayfinder_mlx.py --help && PYTHONPATH=. python3 -m pytest tests/mlx/test_glm_hamiltonian_e2e.py tests/mlx/test_graph_cache.py tests/mlx/test_cache_key_stability.py -q && python3 scripts/bench_glm_wayfinder_mlx.py --seq-lens 1 2 && python3 scripts/bench_qwen_wayfinder_mlx.py --seq-lens 1 2","controls":{"benchmark_model_runs":false,"parallel_benchmarks":false,"retro_backfill_default_inference_off":true},"metrics":{"help_commands":"pass","pytest_selected_tests_passed":18,"glm_multi_seq_guard":"ValueError (expected)","qwen_multi_seq_guard":"ValueError (expected)","new_cli_flags":["--allow-multi-seq","--run-block-bench (glm+qwen)"],"integration_memory_accounting":"arr.nbytes fast-path added; avoids np.asarray in normal path"},"decision":"keep","next_action":"Run only single-seq isolated GLM commands with explicit stop thresholds; enable block/full-swap only when required."}
