{"id":"EXP-20260207-201256-GLM-FULLMODEL-PREFILL-KV-CHECKPOINT-RESULT","date":"2026-02-07","question":"At full-model scale, does prefill+1 token reveal KV-cache-dominated memory growth versus prefill-only?","hypothesis":"Wayfinder should keep attention workspace manageable, but full-model prefill+1 should increase peak memory beyond prefill-only due to retained KV cache.","change_set":["measurement only"],"command":"full-model Wayfinder full-swap prefill-only vs prefill+1 at T=[32768,65536]","controls":{"retro_backfill_enabled":false,"full_swap":true,"landmark_stride":null,"path":"permute","window":64,"batch":1,"baseline_path":"benchmarks/mlx/glm_4_7_flash_4bit_wayfinder/20260207_200939_maxctx_nolandmark_probe/summary.json"},"metrics":{"results_path":"benchmarks/mlx/glm_4_7_flash_4bit_wayfinder/20260207_201347_fullmodel_prefill_kv_checkpoint/results.json","t32768":{"prefill_only":{"sec":61.28745470799913,"tok_s":534.6608071116906,"peak_memory_bytes":28928288404},"prefill_plus_1":{"total_sec":106.03095458399912,"prefill_sec":85.62437291700189,"decode1_sec":20.406581666997226,"prefill_tok_s":382.69477350523715,"decode1_tok_s":0.04900379771185594,"peak_memory_bytes":29053543348},"delta_peak_memory_bytes":125254944,"delta_peak_memory_pct_vs_prefill":0.4329842894634604},"t65536":{"prefill_only":{"sec":126.68944979200023,"tok_s":517.296429241721,"peak_memory_bytes":44890891940},"prefill_plus_1":{"total_sec":227.30349020899303,"prefill_sec":140.66367929199623,"decode1_sec":86.6398109169968,"prefill_tok_s":465.9056291564599,"decode1_tok_s":0.011542038116380772,"peak_memory_bytes":44890891940},"delta_peak_memory_bytes":0,"delta_peak_memory_pct_vs_prefill":0.0},"prefill_only_scaling_65536_vs_32768":{"peak_memory_bytes_delta":15962603536,"peak_memory_pct_delta":55.179910104162275,"tok_s_delta":-17.364377869969644,"tok_s_pct_delta":-3.2477371894480807}},"decision":"follow_up","next_action":"instrument per-layer KV cache bytes and evaluate KV quantization/paging options"}
{"id":"EXP-20260207-230429-GLM-FULLMODEL-KVQ4-CHECKPOINT","date":"2026-02-07","question":"Does 4-bit quantized KV cache reduce full-model peak memory in prefill-only and prefill+1 scenarios at long context?","hypothesis":"Quantized KV cache should reduce peak memory at T=32768/65536 versus non-quantized baseline, with potential throughput cost.","change_set":["measurement only: convert prompt cache entries with to_quantized(group_size=64,bits=4)"],"command":"PYTHONPATH=. python3 - <<'PY' (full-model Wayfinder full-swap prefill-only vs prefill+1 with KVQ4 at T=[32768,65536]) PY","controls":{"retro_backfill_enabled":false,"full_swap":true,"landmark_stride":null,"path":"permute","window":64,"batch":1,"kv_quantization":{"bits":4,"group_size":64},"baseline_path":"benchmarks/mlx/glm_4_7_flash_4bit_wayfinder/20260207_201347_fullmodel_prefill_kv_checkpoint/results.json"},"metrics":{"status":"pending"},"decision":"pending","next_action":"run checkpoint and compute absolute/delta/% vs non-quantized baseline"}
{"id":"EXP-20260207-230429-GLM-FULLMODEL-KVQ4-CHECKPOINT-RESULT","date":"2026-02-07","question":"Does 4-bit quantized KV cache reduce full-model peak memory in prefill-only and prefill+1 scenarios at long context?","hypothesis":"Quantized KV cache should reduce peak memory at T=32768/65536 versus non-quantized baseline, with potential throughput cost.","change_set":["measurement only: convert prompt cache entries with to_quantized(group_size=64,bits=4)"],"command":"full-model Wayfinder full-swap prefill-only vs prefill+1 with KVQ4 at T=[32768,65536]","controls":{"retro_backfill_enabled":false,"full_swap":true,"landmark_stride":null,"path":"permute","window":64,"batch":1,"kv_quantization":{"bits":4,"group_size":64},"baseline_path":"benchmarks/mlx/glm_4_7_flash_4bit_wayfinder/20260207_201347_fullmodel_prefill_kv_checkpoint/results.json"},"metrics":{"results_path":"benchmarks/mlx/glm_4_7_flash_4bit_wayfinder/20260207_230511_fullmodel_prefill_kvq4_checkpoint/results.json","status":"failed","failure_seq_len":32768,"error":"TypeError: tuple indices must be integers or slices, not tuple","root_cause":"QuantizedKVCache.update_and_fetch returns quantized tuple trees incompatible with current GLM MLA dense slicing path"},"decision":"follow_up","next_action":"evaluate rotating/paged KV cache with max_kv_size and design GLM MLA quantized-cache compatibility shim"}
{"id":"EXP-20260207-230611-GLM-FULLMODEL-ROTATINGKV-CHECKPOINT","date":"2026-02-07","question":"Can rotating KV cache cap peak memory in full-model prefill+1 while remaining correct?","hypothesis":"max_kv_size=8192 should lower peak memory at T=32768/65536 versus unbounded KV baseline.","change_set":["measurement only: use make_prompt_cache(model,max_kv_size=8192)"],"command":"PYTHONPATH=. python3 - <<'PY' (full-model Wayfinder full-swap prefill-only vs prefill+1 with rotating KV at T=[32768,65536]) PY","controls":{"retro_backfill_enabled":false,"full_swap":true,"landmark_stride":null,"path":"permute","window":64,"batch":1,"rotating_kv":{"max_kv_size":8192},"baseline_path":"benchmarks/mlx/glm_4_7_flash_4bit_wayfinder/20260207_201347_fullmodel_prefill_kv_checkpoint/results.json"},"metrics":{"status":"pending"},"decision":"pending","next_action":"run checkpoint and compute absolute/delta/% vs baseline"}
{"id":"EXP-20260207-233428-GLM-CHUNKED-PREFILL-SWEEP","date":"2026-02-07","question":"Does full-model GLM Wayfinder with chunked prefill reduce long-context peak memory versus monolithic prefill baseline while keeping usable throughput?","hypothesis":"Chunked prefill with persistent cache at chunk sizes 4096/8192/16384 will reduce peak memory at fixed T=32768/65536/131072 and at least one T>=65536 run will complete with materially lower peak memory than baseline.","change_set":["scripts/bench_glm_chunked_prefill_mlx.py (new benchmark harness)"],"command":"PYTHONPATH=. python3 scripts/bench_glm_chunked_prefill_mlx.py --model-path mlx-community/GLM-4.7-Flash-4bit --seq-lens 32768 65536 131072 --chunk-sizes 4096 8192 16384 --decode-lens 0 1 64 --cache-modes normal --path permute --window 64 --landmark-stride 0 --baseline-path benchmarks/mlx/glm_4_7_flash_4bit_wayfinder/20260207_201347_fullmodel_prefill_kv_checkpoint/results.json --out-dir benchmarks/mlx/glm_4_7_flash_4bit_wayfinder/20260207_233428_chunked_prefill_fullmatrix","controls":{"model":"mlx-community/GLM-4.7-Flash-4bit","retro_backfill_enabled":false,"path":"permute","window":64,"landmark_stride":null,"batch":1,"seed":42,"full_swap":true,"baseline_path":"benchmarks/mlx/glm_4_7_flash_4bit_wayfinder/20260207_201347_fullmodel_prefill_kv_checkpoint/results.json"},"metrics":{"status":"pending"},"decision":"pending","next_action":"run full chunk-size/seq-len sweep and compute absolute/delta/% metrics vs baseline with required memory reduction sign convention"}
{"id":"EXP-20260208-000124-GLM-CHUNK-SWEEP-32768","date":"2026-02-08","question":"At fixed T=32768, which chunk size (4096/8192/16384) gives the best memory-throughput tradeoff for full-model GLM chunked prefill?","hypothesis":"Larger chunk sizes (8192 or 16384) should improve latency while keeping meaningful peak-memory reduction versus monolithic baseline.","change_set":["scripts/bench_glm_chunked_prefill_mlx.py cumulative prefill/decode path"],"command":"PYTHONPATH=. python3 scripts/bench_glm_chunked_prefill_mlx.py --model-path mlx-community/GLM-4.7-Flash-4bit --seq-lens 32768 --chunk-sizes 4096 8192 16384 --decode-lens 0 1 64 --cache-modes normal --path permute --window 64 --landmark-stride 0 --baseline-path benchmarks/mlx/glm_4_7_flash_4bit_wayfinder/20260207_201347_fullmodel_prefill_kv_checkpoint/results.json --out-dir benchmarks/mlx/glm_4_7_flash_4bit_wayfinder/20260208_000124_chunk_sweep_32768","controls":{"model":"mlx-community/GLM-4.7-Flash-4bit","retro_backfill_enabled":false,"path":"permute","window":64,"landmark_stride":null,"batch":1,"seed":42,"full_swap":true,"baseline_path":"benchmarks/mlx/glm_4_7_flash_4bit_wayfinder/20260207_201347_fullmodel_prefill_kv_checkpoint/results.json"},"metrics":{"status":"pending"},"decision":"pending","next_action":"run chunk-size sweep and pick best chunk for long-context length sweep"}
{"id":"EXP-20260208-001331-GLM-LENGTH-SWEEP-CHUNK4096","date":"2026-02-08","question":"With chunk size fixed at 4096, does chunked prefill preserve memory gains at longer contexts (65536, 131072) versus monolithic baseline?","hypothesis":"Chunk size 4096 will keep peak memory materially below baseline at T=65536 and complete at least one high-context run at T=131072 without causality breakage.","change_set":["measurement only (reuse scripts/bench_glm_chunked_prefill_mlx.py)"],"command":"PYTHONPATH=. python3 scripts/bench_glm_chunked_prefill_mlx.py --model-path mlx-community/GLM-4.7-Flash-4bit --seq-lens 32768 65536 131072 --chunk-sizes 4096 --decode-lens 0 1 64 --cache-modes normal --path permute --window 64 --landmark-stride 0 --baseline-path benchmarks/mlx/glm_4_7_flash_4bit_wayfinder/20260207_201347_fullmodel_prefill_kv_checkpoint/results.json --out-dir benchmarks/mlx/glm_4_7_flash_4bit_wayfinder/20260208_001331_length_sweep_chunk4096","controls":{"model":"mlx-community/GLM-4.7-Flash-4bit","retro_backfill_enabled":false,"path":"permute","window":64,"landmark_stride":null,"batch":1,"seed":42,"full_swap":true,"baseline_path":"benchmarks/mlx/glm_4_7_flash_4bit_wayfinder/20260207_201347_fullmodel_prefill_kv_checkpoint/results.json"},"metrics":{"status":"pending"},"decision":"pending","next_action":"run length sweep and quantify absolute/delta/% memory and latency vs baseline"}
{"id":"EXP-20260207-233428-GLM-CHUNKED-PREFILL-SWEEP-RESULT","date":"2026-02-08","question":"Does full-model GLM Wayfinder with chunked prefill reduce long-context peak memory versus monolithic prefill baseline while keeping usable throughput?","hypothesis":"Chunked prefill with persistent cache at chunk sizes 4096/8192/16384 will reduce peak memory at fixed T and complete at least one long-context checkpoint.","change_set":["scripts/bench_glm_chunked_prefill_mlx.py (new benchmark harness)","scripts/bench_glm_chunked_prefill_mlx.py one-prefill cumulative decode optimization"],"command":"PYTHONPATH=. python3 scripts/bench_glm_chunked_prefill_mlx.py --model-path mlx-community/GLM-4.7-Flash-4bit --seq-lens 32768 65536 131072 --chunk-sizes 4096 8192 16384 --decode-lens 0 1 64 --cache-modes normal --path permute --window 64 --landmark-stride 0 --baseline-path benchmarks/mlx/glm_4_7_flash_4bit_wayfinder/20260207_201347_fullmodel_prefill_kv_checkpoint/results.json --out-dir benchmarks/mlx/glm_4_7_flash_4bit_wayfinder/20260207_233428_chunked_prefill_fullmatrix","controls":{"model":"mlx-community/GLM-4.7-Flash-4bit","retro_backfill_enabled":false,"path":"permute","window":64,"landmark_stride":null,"batch":1,"seed":42,"full_swap":true,"baseline_path":"benchmarks/mlx/glm_4_7_flash_4bit_wayfinder/20260207_201347_fullmodel_prefill_kv_checkpoint/results.json"},"metrics":{"status":"interrupted","results_path":"benchmarks/mlx/glm_4_7_flash_4bit_wayfinder/20260207_233428_chunked_prefill_fullmatrix/results.json","completed_cases":1,"total_cases":9,"last_completed":{"seq_len":32768,"chunk_size":4096}},"decision":"follow_up","next_action":"split into targeted chunk-size and length sweeps to complete required comparisons"}
{"id":"EXP-20260208-000124-GLM-CHUNK-SWEEP-32768-RESULT","date":"2026-02-08","question":"At fixed T=32768, which chunk size (4096/8192/16384) gives the best memory-throughput tradeoff for full-model GLM chunked prefill?","hypothesis":"Larger chunk sizes (8192 or 16384) should improve latency while keeping meaningful peak-memory reduction versus monolithic baseline.","change_set":["scripts/bench_glm_chunked_prefill_mlx.py cumulative prefill/decode path"],"command":"PYTHONPATH=. python3 scripts/bench_glm_chunked_prefill_mlx.py --model-path mlx-community/GLM-4.7-Flash-4bit --seq-lens 32768 --chunk-sizes 4096 8192 16384 --decode-lens 0 1 64 --cache-modes normal --path permute --window 64 --landmark-stride 0 --baseline-path benchmarks/mlx/glm_4_7_flash_4bit_wayfinder/20260207_201347_fullmodel_prefill_kv_checkpoint/results.json --out-dir benchmarks/mlx/glm_4_7_flash_4bit_wayfinder/20260208_000124_chunk_sweep_32768","controls":{"model":"mlx-community/GLM-4.7-Flash-4bit","retro_backfill_enabled":false,"path":"permute","window":64,"landmark_stride":null,"batch":1,"seed":42,"full_swap":true,"baseline_path":"benchmarks/mlx/glm_4_7_flash_4bit_wayfinder/20260207_201347_fullmodel_prefill_kv_checkpoint/results.json"},"metrics":{"results_path":"benchmarks/mlx/glm_4_7_flash_4bit_wayfinder/20260208_000124_chunk_sweep_32768/results.json","t32768":{"chunk4096":{"prefill_only":{"sec":163.51107658299588,"tok_s":200.40232554745262,"peak_memory_bytes":26021806692,"delta_sec_vs_baseline":102.22362187499675,"delta_sec_pct_vs_baseline":166.7937139207948,"delta_tok_s_vs_baseline":-334.25848156423797,"delta_tok_s_pct_vs_baseline":-62.517857512307124,"delta_peak_memory_bytes_vs_baseline":-2906481712,"delta_peak_memory_pct_vs_baseline":-10.04719557344469,"memory_reduction_pct":10.04719557344469},"prefill_plus_1":{"total_sec":165.16011812399665,"peak_memory_bytes":26021806692,"delta_total_sec_vs_baseline":59.129163539997535,"delta_total_sec_pct_vs_baseline":55.76594473942478,"delta_prefill_tok_s_vs_baseline":-182.29244795778453,"delta_prefill_tok_s_pct_vs_baseline":-47.63390058560334,"delta_peak_memory_pct_vs_baseline":-10.434997961130621,"memory_reduction_pct":10.434997961130621},"prefill_plus_64":{"total_sec":165.71345687399298,"peak_memory_bytes":26021806692}},"chunk8192":{"prefill_only":{"sec":231.86367450000398,"tok_s":141.3244229423244,"peak_memory_bytes":30798216294,"delta_peak_memory_pct_vs_baseline":6.464011502807887},"prefill_plus_1":{"total_sec":244.49775583300652,"peak_memory_bytes":30798216294,"delta_peak_memory_pct_vs_baseline":6.005026392486834}},"chunk16384":{"prefill_only":{"sec":212.84438229200168,"tok_s":153.95285347510608,"peak_memory_bytes":41954965882,"delta_peak_memory_pct_vs_baseline":45.03093061046351},"prefill_plus_1":{"total_sec":256.89430933399854,"peak_memory_bytes":41954965882,"delta_peak_memory_pct_vs_baseline":44.4056767171847}}}},"decision":"keep","next_action":"use chunk=4096 for long-context length sweep"}
{"id":"EXP-20260208-001331-GLM-LENGTH-SWEEP-CHUNK4096-RESULT","date":"2026-02-08","question":"With chunk size fixed at 4096, does chunked prefill preserve memory gains at longer contexts (65536, 131072) versus monolithic baseline?","hypothesis":"Chunk size 4096 will keep peak memory materially below baseline at T=65536 and complete at least one high-context run at T=131072 without causality breakage.","change_set":["measurement only (reuse scripts/bench_glm_chunked_prefill_mlx.py)"],"command":"PYTHONPATH=. python3 scripts/bench_glm_chunked_prefill_mlx.py --model-path mlx-community/GLM-4.7-Flash-4bit --seq-lens 32768 65536 131072 --chunk-sizes 4096 --decode-lens 0 1 64 --cache-modes normal --path permute --window 64 --landmark-stride 0 --baseline-path benchmarks/mlx/glm_4_7_flash_4bit_wayfinder/20260207_201347_fullmodel_prefill_kv_checkpoint/results.json --out-dir benchmarks/mlx/glm_4_7_flash_4bit_wayfinder/20260208_001331_length_sweep_chunk4096","controls":{"model":"mlx-community/GLM-4.7-Flash-4bit","retro_backfill_enabled":false,"path":"permute","window":64,"landmark_stride":null,"batch":1,"seed":42,"full_swap":true,"baseline_path":"benchmarks/mlx/glm_4_7_flash_4bit_wayfinder/20260207_201347_fullmodel_prefill_kv_checkpoint/results.json"},"metrics":{"results_path":"benchmarks/mlx/glm_4_7_flash_4bit_wayfinder/20260208_001331_length_sweep_chunk4096/results.json","progress_path":"benchmarks/mlx/glm_4_7_flash_4bit_wayfinder/20260208_001331_length_sweep_chunk4096/progress.json","completed_cases":2,"total_cases":3,"t32768":{"prefill_only":{"sec":163.33155416700174,"tok_s":200.62259351610453,"peak_memory_bytes":26021806692,"delta_sec_pct_vs_baseline":166.5007952201415,"delta_tok_s_pct_vs_baseline":-62.47665980981574,"delta_peak_memory_pct_vs_baseline":-10.04719557344469,"memory_reduction_pct":10.04719557344469},"prefill_plus_1":{"total_sec":164.96773512500658,"peak_memory_bytes":26021806692,"delta_total_sec_pct_vs_baseline":55.58450432917396,"delta_prefill_tok_s_pct_vs_baseline":-47.57634349731745,"delta_peak_memory_pct_vs_baseline":-10.434997961130621,"memory_reduction_pct":10.434997961130621},"prefill_plus_64":{"total_sec":165.53001808300905,"peak_memory_bytes":26021806692}},"t65536":{"prefill_only":{"sec":876.3142480410024,"tok_s":74.78595737374522,"peak_memory_bytes":33164840500,"delta_sec_vs_baseline":749.6247982490022,"delta_sec_pct_vs_baseline":591.7026236042087,"delta_tok_s_vs_baseline":-442.51047186797575,"delta_tok_s_pct_vs_baseline":-85.5429202394901,"delta_peak_memory_bytes_vs_baseline":-11726051440,"delta_peak_memory_pct_vs_baseline":-26.121226229304455,"memory_reduction_pct":26.12122622930445},"prefill_plus_1":{"total_sec":903.3175961250017,"peak_memory_bytes":33164840500,"delta_total_sec_vs_baseline":676.0141059160087,"delta_total_sec_pct_vs_baseline":297.4059506497023,"delta_prefill_tok_s_pct_vs_baseline":-83.94826061467683,"delta_peak_memory_pct_vs_baseline":-26.121226229304455,"memory_reduction_pct":26.12122622930445},"prefill_plus_64":{"total_sec":904.3064721250048,"peak_memory_bytes":33164840500}},"t131072":{"status":"interrupted_before_completion"}},"decision":"follow_up","next_action":"run dedicated T=131072 checkpoint to complete high-context acceptance criterion"}
{"id":"EXP-20260207-DIAG01-CHUNKED-DENSE-BASELINE","date":"2026-02-08","question":"How much of the 6x chunked prefill latency regression is from chunking overhead itself vs HCSA-specific overhead?","hypothesis":"Stock GLM attention with same chunked loop will also be slower than monolithic, isolating chunking-inherent cost from HCSA graph construction cost.","change_set":["scripts/bench_glm_chunked_prefill_mlx.py: added --no-swap, true autoregressive decode, --kv-step"],"command":"PYTHONPATH=. python3 scripts/bench_glm_chunked_prefill_mlx.py --model-path mlx-community/GLM-4.7-Flash-4bit --seq-lens 65536 --chunk-sizes 4096 --decode-lens 0 1 64 --cache-modes normal --no-swap --path permute --window 64 --landmark-stride 0 --baseline-path benchmarks/mlx/glm_4_7_flash_4bit_wayfinder/20260207_201347_fullmodel_prefill_kv_checkpoint/results.json --out-dir benchmarks/mlx/glm_4_7_flash_4bit_wayfinder/20260208_diag01_chunked_dense_baseline","controls":{"model":"mlx-community/GLM-4.7-Flash-4bit","no_swap":true,"chunk_size":4096,"seq_len":65536,"retro_backfill_enabled":false,"batch":1,"seed":42},"metrics":{"status":"pending"},"decision":"pending","next_action":"compare per-chunk timing vs HCSA chunked run"}
{"id":"EXP-20260207-DIAG02-CHUNK-LATENCY-PROFILE","date":"2026-02-08","question":"Do later chunks get progressively slower (growing cache penalty) or is per-chunk overhead flat?","hypothesis":"Per-chunk latency should increase linearly with cache position. HCSA overhead should be additive on top of base cache-growth cost.","change_set":["analysis only on existing chunk_reports data"],"command":"analysis script (no benchmark run)","controls":{"data_sources":["HCSA chunked T=32768/65536 chunk_reports","stock GLM chunked chunk_reports from DIAG01"]},"metrics":{"status":"pending"},"decision":"pending","next_action":"identify whether HCSA graph construction or base cache-growth dominates"}
{"id":"EXP-20260207-DIAG03-HCSA-CHUNKED-FOCUSED","date":"2026-02-08","question":"After diagnosing root cause, does chunk=8192 offer a better latency/memory Pareto at T=65536?","hypothesis":"Halving chunk count (8 vs 16) should roughly halve fixed-overhead component with memory tradeoff dependent on per-chunk activation footprint.","change_set":["measurement only"],"command":"PYTHONPATH=. python3 scripts/bench_glm_chunked_prefill_mlx.py --model-path mlx-community/GLM-4.7-Flash-4bit --seq-lens 65536 --chunk-sizes 4096 8192 --decode-lens 0 1 64 --cache-modes normal --path permute --window 64 --landmark-stride 0 --baseline-path benchmarks/mlx/glm_4_7_flash_4bit_wayfinder/20260207_201347_fullmodel_prefill_kv_checkpoint/results.json --out-dir benchmarks/mlx/glm_4_7_flash_4bit_wayfinder/20260208_diag03_focused_chunk_sweep","controls":{"model":"mlx-community/GLM-4.7-Flash-4bit","retro_backfill_enabled":false,"path":"permute","window":64,"landmark_stride":null,"batch":1,"seed":42},"metrics":{"status":"pending"},"decision":"pending","next_action":"compare memory/latency vs DIAG01 and decide if optimization or architecture change needed"}
{"id":"EXP-20260207-DIAG02-CHUNK-LATENCY-PROFILE-RESULT","date":"2026-02-08","question":"Do later chunks get progressively slower (growing cache penalty) or is per-chunk overhead flat?","hypothesis":"Per-chunk latency increases linearly with cache position due to HCSA graph construction growing cost.","change_set":["analysis only"],"command":"code analysis of hcsa/integrations/glm_mlx.py:259","controls":{"data_sources":["HCSA chunked T=32768/65536 chunk_reports"]},"metrics":{"root_cause":"dense_fallback_bug","location":"hcsa/integrations/glm_mlx.py:259","description":"Q_len != K_len guard causes all chunks after first to fall back to O(T^2) dense MLA attention instead of O(T*W) HCSA sparse attention","chunk0_path":"hcsa_sparse","chunk1_15_path":"dense_mla_fallback","first_chunk_sec":4.29,"last_chunk_sec":103.19,"slowdown_ratio":24.07},"decision":"critical_fix_needed","next_action":"implement Q_len < K_len support in HCSA permute-window path for chunked prefill"}
