{"id":"EXP-20260210-GLM47-SAFE-SPARSE-T2048-PRERUN","date":"2026-02-10","question":"Under strict one-process-at-a-time constraints, what are GLM-4.7-Flash sparse landmarks/cycle/multicycle metrics at seq_len=2048 with dense comparison embedded?","hypothesis":"At T=2048, sparse variants may still underperform dense and may increase memory, but sequential isolated runs should complete safely with explicit swap/compressor stop gates.","change_set":["none (measurement-only)"],"command":"PYTHONPATH=/Volumes/VIXinSSD/wayfinder python3 scripts/bench_glm_wayfinder_mlx.py --model-path mlx-community/GLM-4.7-Flash-4bit --seq-lens 2048 --batch 1 --warmup 1 --iters 1 --dtype bfloat16 --path sparse --window 64 --landmark-stride 64 --num-cycles 0 --out-dir benchmarks/mlx/glm47_safe_20260210_t2048/landmarks && PYTHONPATH=/Volumes/VIXinSSD/wayfinder python3 scripts/bench_glm_wayfinder_mlx.py --model-path mlx-community/GLM-4.7-Flash-4bit --seq-lens 2048 --batch 1 --warmup 1 --iters 1 --dtype bfloat16 --path sparse --window 64 --landmark-stride 64 --num-cycles 1 --out-dir benchmarks/mlx/glm47_safe_20260210_t2048/cycle && PYTHONPATH=/Volumes/VIXinSSD/wayfinder python3 scripts/bench_glm_wayfinder_mlx.py --model-path mlx-community/GLM-4.7-Flash-4bit --seq-lens 2048 --batch 1 --warmup 1 --iters 1 --dtype bfloat16 --path sparse --window 64 --landmark-stride 0 --num-cycles 4 --no-edge-disjoint --out-dir benchmarks/mlx/glm47_safe_20260210_t2048/multicycle","controls":{"one_process_at_a_time":true,"graph_metrics_disabled":true,"retro_backfill_default_inference_off":true,"run_block_bench":false},"metrics":{"status":"pending"},"decision":"pending","next_action":"Capture pre-run swap/compressor baseline, run landmarks first, then enforce stop gates before proceeding."}
{"id":"EXP-20260210-GLM-CLI-NONHAMILTONIAN-PRERUN","date":"2026-02-10","question":"Can we safely run GLM sparse landmarks (num_cycles=0) by exposing non-Hamiltonian and edge-disjoint toggles in the GLM benchmark CLI?","hypothesis":"Adding --allow-non-hamiltonian and --no-edge-disjoint to bench_glm_wayfinder_mlx.py (wired to existing config fields) will unblock sparse landmarks/multicycle runs without changing inference defaults.","change_set":["scripts/bench_glm_wayfinder_mlx.py"],"command":"python3 scripts/bench_glm_wayfinder_mlx.py --help && PYTHONPATH=/Volumes/VIXinSSD/wayfinder python3 scripts/bench_glm_wayfinder_mlx.py --model-path mlx-community/GLM-4.7-Flash-4bit --seq-lens 2048 --batch 1 --warmup 1 --iters 1 --dtype bfloat16 --path sparse --window 64 --landmark-stride 64 --num-cycles 0 --allow-non-hamiltonian --out-dir benchmarks/mlx/glm47_safe_20260210_t2048/landmarks","controls":{"one_process_at_a_time":true,"retro_backfill_default_inference_off":true,"run_block_bench":false},"metrics":{"status":"pending"},"decision":"pending","next_action":"Apply minimal CLI patch, validate help, and retry landmarks run."}
{"id":"EXP-20260210-GLM-CLI-NONHAMILTONIAN-RESULT","date":"2026-02-10","question":"Can we safely run GLM sparse landmarks (num_cycles=0) by exposing non-Hamiltonian and edge-disjoint toggles in the GLM benchmark CLI?","hypothesis":"Adding --allow-non-hamiltonian and --no-edge-disjoint to bench_glm_wayfinder_mlx.py (wired to existing config fields) will unblock sparse landmarks/multicycle runs without changing inference defaults.","change_set":["scripts/bench_glm_wayfinder_mlx.py"],"command":"python3 scripts/bench_glm_wayfinder_mlx.py --help && PYTHONPATH=/Volumes/VIXinSSD/wayfinder python3 scripts/bench_glm_wayfinder_mlx.py --model-path mlx-community/GLM-4.7-Flash-4bit --seq-lens 2048 --batch 1 --warmup 1 --iters 1 --dtype bfloat16 --path sparse --window 64 --landmark-stride 64 --num-cycles 0 --allow-non-hamiltonian --out-dir benchmarks/mlx/glm47_safe_20260210_t2048/landmarks","controls":{"one_process_at_a_time":true,"retro_backfill_default_inference_off":true,"run_block_bench":false},"metrics":{"cli_flags_added":["--allow-non-hamiltonian","--edge-disjoint","--no-edge-disjoint"],"landmarks_command_status":"success"},"decision":"keep","next_action":"Continue sparse subset only when memory stop gates are green."}
{"id":"EXP-20260210-GLM47-SAFE-SPARSE-T2048-RESULT","date":"2026-02-10","question":"Under strict one-process-at-a-time constraints, what are GLM-4.7-Flash sparse landmarks/cycle/multicycle metrics at seq_len=2048 with dense comparison embedded?","hypothesis":"At T=2048, sparse variants may still underperform dense and may increase memory, but sequential isolated runs should complete safely with explicit swap/compressor stop gates.","change_set":["none (measurement-only)"],"command":"PYTHONPATH=/Volumes/VIXinSSD/wayfinder python3 scripts/bench_glm_wayfinder_mlx.py --model-path mlx-community/GLM-4.7-Flash-4bit --seq-lens 2048 --batch 1 --warmup 1 --iters 1 --dtype bfloat16 --path sparse --window 64 --landmark-stride 64 --num-cycles 0 --allow-non-hamiltonian --out-dir benchmarks/mlx/glm47_safe_20260210_t2048/landmarks","controls":{"one_process_at_a_time":true,"graph_metrics_disabled":true,"retro_backfill_default_inference_off":true,"run_block_bench":false},"metrics":{"artifact":"benchmarks/mlx/glm47_safe_20260210_t2048/landmarks/results.json","pre_run":{"swap_used_mb":3952.38,"swap_free_mb":1167.62,"pages_occupied_by_compressor":323581},"post_run":{"swap_used_mb":3944.38,"swap_free_mb":1175.62,"pages_occupied_by_compressor":725738},"safety_deltas":{"swap_used_mb":-8.0,"swap_free_mb":8.0,"pages_occupied_by_compressor":402157},"level_a_real_qkv":{"tokens_per_sec":{"dense_absolute":62128.853664327056,"wayfinder_absolute":3620.023875720178,"delta_vs_baseline":-58508.829788606876,"delta_pct_vs_baseline":-94.17336122878007},"peak_memory_bytes":{"dense_absolute":426232364.0,"wayfinder_absolute":11731143488.0,"delta_vs_baseline":11304911124.0,"delta_pct_vs_baseline":2652.288300660341},"memory_reduction_pct":-2652.288300660341}},"decision":"stop","next_action":"Do not run cycle/multicycle in this host state; resume only after explicit user confirmation with stricter safeguards or reduced pressure."}
{"id":"EXP-20260210T023637Z-BENCH-PROTOCOL-SETUP-PRERUN","date":"2026-02-10","question":"Can we establish a safety-critical benchmark preflight setup (script/CLI checks + memory baselines) without running any inference?","hypothesis":"A setup-only preflight command that runs file/help checks and captures swap/compressor baselines will validate readiness for the next GLM safe run while keeping inference completely off.","change_set":["scripts/bench_protocol_preflight_setup.sh","notes/LAB_NOTEBOOK.md","notes/experiments.ndjson"],"command":"bash /Volumes/VIXinSSD/wayfinder/scripts/bench_protocol_preflight_setup.sh --run-id EXP-20260210T023637Z-BENCH-PROTOCOL-SETUP --out-dir /Volumes/VIXinSSD/wayfinder/notes/preflight","controls":{"one_process_at_a_time":true,"benchmark_or_inference_execution":false,"retro_backfill_default_inference_off":true,"graph_metrics_enabled":false,"run_block_bench":false,"full_swap":false},"metrics":{"status":"pending","artifact_expected":"/Volumes/VIXinSSD/wayfinder/notes/preflight/EXP-20260210T023637Z-BENCH-PROTOCOL-SETUP_summary.json"},"decision":"pending","next_action":"Run setup command and append result entry with measured pre/post safety baselines and deltas."}
{"id":"EXP-20260210T023637Z-BENCH-PROTOCOL-SETUP-RESULT","date":"2026-02-10","question":"Can we establish a safety-critical benchmark preflight setup (script/CLI checks + memory baselines) without running any inference?","hypothesis":"A setup-only preflight command that runs file/help checks and captures swap/compressor baselines will validate readiness for the next GLM safe run while keeping inference completely off.","change_set":["scripts/bench_protocol_preflight_setup.sh","notes/LAB_NOTEBOOK.md","notes/experiments.ndjson"],"command":"bash /Volumes/VIXinSSD/wayfinder/scripts/bench_protocol_preflight_setup.sh --run-id EXP-20260210T023637Z-BENCH-PROTOCOL-SETUP --out-dir /Volumes/VIXinSSD/wayfinder/notes/preflight","controls":{"one_process_at_a_time":true,"benchmark_or_inference_execution":false,"retro_backfill_default_inference_off":true,"graph_metrics_enabled":false,"run_block_bench":false,"full_swap":false},"metrics":{"artifact_summary":"/Volumes/VIXinSSD/wayfinder/notes/preflight/EXP-20260210T023637Z-BENCH-PROTOCOL-SETUP_summary.json","artifact_raw":"/Volumes/VIXinSSD/wayfinder/notes/preflight/EXP-20260210T023637Z-BENCH-PROTOCOL-SETUP_raw.txt","checks":{"files_ok":5,"files_total":5,"help_ok":6,"help_total":6,"inference_executed":false},"pre_run":{"swap_used_mb":20227.75,"swap_free_mb":1276.25,"pages_occupied_by_compressor":79517,"compressor_occupied_bytes":1302806528},"post_run":{"swap_used_mb":20227.75,"swap_free_mb":1276.25,"pages_occupied_by_compressor":79163,"compressor_occupied_bytes":1297006592},"safety_deltas":{"swap_used_mb":{"absolute":20227.75,"delta_vs_baseline":0.0,"delta_pct_vs_baseline":0.0},"swap_free_mb":{"absolute":1276.25,"delta_vs_baseline":0.0,"delta_pct_vs_baseline":0.0},"pages_occupied_by_compressor":{"absolute":79163,"delta_vs_baseline":-354,"delta_pct_vs_baseline":-0.4452},"compressor_occupied_bytes":{"absolute":1297006592,"delta_vs_baseline":-5799936,"delta_pct_vs_baseline":-0.4452}},"memory_reduction_pct_formula":"100 * (1 - wayfinder/dense)","memory_reduction_pct":"not_applicable_setup_only"},"decision":"keep","next_action":"Await explicit go-ahead for the first single-seq GLM safe benchmark command, then record fresh pre/post baselines for that run."}
{"id":"EXP-20260210T025409Z-GLM-POST-REBOOT-PROTOCOL-PRERUN","date":"2026-02-10","question":"Can we produce a complete post-reboot GLM benchmark protocol (dense vs Wayfinder permute + fidelity parity) that is executable end-to-end with explicit stop gates and logging requirements?","hypothesis":"A single runbook with copy/paste shell blocks for preflight, per-run memory gates, long-context benchmark runs, and quality parity checks will reduce operator error and make the next benchmark day reproducible.","change_set":["notes/GLM_POST_REBOOT_FULL_BENCH_PROTOCOL.md","notes/LAB_NOTEBOOK.md","notes/experiments.ndjson"],"command":"python3 inline validation: assert protocol file exists and required sections are present","controls":{"inference_executed":false,"retro_backfill_default_inference_off":true,"one_path_documentation_only":true},"metrics":{"status":"pending","artifact_expected":"/Volumes/VIXinSSD/wayfinder/notes/GLM_POST_REBOOT_FULL_BENCH_PROTOCOL.md"},"decision":"pending","next_action":"Run protocol-file validation and append result entry with line count and section coverage."}
{"id":"EXP-20260210T025409Z-GLM-POST-REBOOT-PROTOCOL-RESULT","date":"2026-02-10","question":"Can we produce a complete post-reboot GLM benchmark protocol (dense vs Wayfinder permute + fidelity parity) that is executable end-to-end with explicit stop gates and logging requirements?","hypothesis":"A single runbook with copy/paste shell blocks for preflight, per-run memory gates, long-context benchmark runs, and quality parity checks will reduce operator error and make the next benchmark day reproducible.","change_set":["notes/GLM_POST_REBOOT_FULL_BENCH_PROTOCOL.md","notes/LAB_NOTEBOOK.md","notes/experiments.ndjson"],"command":"python3 inline validation: assert protocol file exists and required sections are present","controls":{"inference_executed":false,"retro_backfill_default_inference_off":true,"one_path_documentation_only":true},"metrics":{"artifact":"/Volumes/VIXinSSD/wayfinder/notes/GLM_POST_REBOOT_FULL_BENCH_PROTOCOL.md","validation":"pass","line_count":352,"required_sections":{"step_1_preflight":true,"step_3_throughput_memory":true,"step_4_fidelity_parity":true,"step_6_logging_requirements":true}},"decision":"keep","next_action":"After reboot, execute the runbook top-to-bottom and log each real benchmark run in LAB_NOTEBOOK and experiments.ndjson."}
{"id":"EXP-20260210T085850Z-GLM-POST-REBOOT-PREFLIGHT-PRERUN","date":"2026-02-10","question":"Is the host/session safe to start the post-reboot GLM benchmark sequence without running inference yet?","hypothesis":"The setup preflight script will pass file/help checks and produce baseline safety artifacts for swap/compressor tracking.","change_set":["none (planning-only queue entry)"],"command":"bash /Volumes/VIXinSSD/wayfinder/scripts/bench_protocol_preflight_setup.sh --run-id EXP-20260210T085850Z-GLM-POST-REBOOT-PREFLIGHT --out-dir /Volumes/VIXinSSD/wayfinder/notes/preflight","controls":{"inference_executed":false,"one_process_at_a_time":true,"retro_backfill_default_inference_off":true},"metrics":{"status":"pending","artifact_expected":"/Volumes/VIXinSSD/wayfinder/notes/preflight/EXP-20260210T085850Z-GLM-POST-REBOOT-PREFLIGHT_summary.json"},"decision":"pending","next_action":"Run setup preflight and append RESULT entry with safety deltas."}
{"id":"EXP-20260210T085850Z-GLM-PERM-T8192-PRERUN","date":"2026-02-10","question":"At seq_len=8192, does Wayfinder permute improve throughput and reduce peak memory versus embedded dense baseline?","hypothesis":"At 8k, Wayfinder should show positive memory reduction and competitive-to-positive throughput delta under strict memory gates.","change_set":["none (measurement-only)"],"command":"run_with_mem_gate \"glm_perm_t8192\" python3 /Volumes/VIXinSSD/wayfinder/scripts/bench_glm_wayfinder_mlx.py --model-path mlx-community/GLM-4.7-Flash-4bit --seq-lens 8192 --batch 1 --warmup 1 --iters 1 --dtype bfloat16 --path permute --window 64 --landmark-stride 0 --num-cycles 1 --seed 42 --permute-head-chunk-size 2 --permute-query-chunk-size 192 --permute-prepermute-mode auto --permute-memory-budget-multiplier 1.0 --out-dir \"$RUN_ROOT/glm_perm_t8192\"","controls":{"one_process_at_a_time":true,"one_seq_len_per_process":true,"retro_backfill_default_inference_off":true,"memory_gates_enabled":true},"metrics":{"status":"pending","artifact_expected":"$RUN_ROOT/glm_perm_t8192/results.json","required_comparison":"dense_vs_wayfinder embedded in level_a_real_qkv"},"decision":"pending","next_action":"Run command and extract absolute/delta/% summaries from results.json."}
{"id":"EXP-20260210T085850Z-GLM-PERM-T32768-PRERUN","date":"2026-02-10","question":"At seq_len=32768, does Wayfinder permute outperform dense on throughput/memory tradeoff under host safety gates?","hypothesis":"At 32k, Wayfinder should produce stronger memory reduction and likely positive throughput delta versus dense baseline.","change_set":["none (measurement-only)"],"command":"run_with_mem_gate \"glm_perm_t32768\" python3 /Volumes/VIXinSSD/wayfinder/scripts/bench_glm_wayfinder_mlx.py --model-path mlx-community/GLM-4.7-Flash-4bit --seq-lens 32768 --batch 1 --warmup 1 --iters 1 --dtype bfloat16 --path permute --window 64 --landmark-stride 0 --num-cycles 1 --seed 42 --permute-head-chunk-size 2 --permute-query-chunk-size 192 --permute-prepermute-mode auto --permute-memory-budget-multiplier 1.0 --out-dir \"$RUN_ROOT/glm_perm_t32768\"","controls":{"one_process_at_a_time":true,"one_seq_len_per_process":true,"retro_backfill_default_inference_off":true,"memory_gates_enabled":true},"metrics":{"status":"pending","artifact_expected":"$RUN_ROOT/glm_perm_t32768/results.json","required_comparison":"dense_vs_wayfinder embedded in level_a_real_qkv"},"decision":"pending","next_action":"Run command and extract absolute/delta/% summaries from results.json."}
{"id":"EXP-20260210T085850Z-CONSUMER-DENSE-QUALITY-PRERUN","date":"2026-02-10","question":"What is the dense quality baseline on the fixed consumer dataset at seq_len=8192?","hypothesis":"Dense run provides the reference correct/num_tasks/accuracy for parity judgment.","change_set":["none (measurement-only)"],"command":"run_with_mem_gate \"consumer_dense_quality\" python3 /Volumes/VIXinSSD/wayfinder/scripts/bench_glm_consumer_mlx.py --model-path mlx-community/GLM-4.7-Flash-4bit --seq-lens 8192 --decode-len 64 --repeats 1 --chunk-size 4096 --kv-step 4096 --cooldown-sec 0 --path permute --window 64 --landmark-stride 0 --head-chunk-size 2 --query-chunk-size 192 --active-dense-threshold 0 --seed 42 --quality-dataset /Volumes/VIXinSSD/wayfinder/benchmarks/mlx/glm_4_7_flash_4bit_wayfinder/quality_eval_glm47_consumer_v1.json --skip-single-turn --skip-multi-turn --no-swap --out-dir \"$RUN_ROOT/consumer_dense_quality\"","controls":{"same_dataset_and_seed_as_wayfinder_quality":true,"quality_only_mode":true,"memory_gates_enabled":true},"metrics":{"status":"pending","artifact_expected":"$RUN_ROOT/consumer_dense_quality/results.json","required_fields":["quality.correct","quality.num_tasks","quality.accuracy","quality.rows.id"]},"decision":"pending","next_action":"Run dense quality baseline and persist results.json."}
{"id":"EXP-20260210T085850Z-CONSUMER-WAYFINDER-QUALITY-PRERUN","date":"2026-02-10","question":"Does Wayfinder preserve quality parity versus dense on the same consumer dataset and prompt set?","hypothesis":"Wayfinder quality should remain near dense with matching task IDs and small accuracy delta.","change_set":["none (measurement-only)"],"command":"run_with_mem_gate \"consumer_wayfinder_quality\" python3 /Volumes/VIXinSSD/wayfinder/scripts/bench_glm_consumer_mlx.py --model-path mlx-community/GLM-4.7-Flash-4bit --seq-lens 8192 --decode-len 64 --repeats 1 --chunk-size 4096 --kv-step 4096 --cooldown-sec 0 --path permute --window 64 --landmark-stride 0 --head-chunk-size 2 --query-chunk-size 192 --active-dense-threshold 0 --seed 42 --quality-dataset /Volumes/VIXinSSD/wayfinder/benchmarks/mlx/glm_4_7_flash_4bit_wayfinder/quality_eval_glm47_consumer_v1.json --skip-single-turn --skip-multi-turn --out-dir \"$RUN_ROOT/consumer_wayfinder_quality\"","controls":{"same_dataset_and_seed_as_dense_quality":true,"quality_only_mode":true,"memory_gates_enabled":true},"metrics":{"status":"pending","artifact_expected":"$RUN_ROOT/consumer_wayfinder_quality/results.json","required_fields":["quality.correct","quality.num_tasks","quality.accuracy","quality.rows.id"]},"decision":"pending","next_action":"Run Wayfinder quality command, then run comparator summary."}
{"id":"EXP-20260210T085850Z-CONSUMER-QUALITY-COMPARE-PRERUN","date":"2026-02-10","question":"Do dense and Wayfinder quality outputs match task IDs and remain within acceptable accuracy drift?","hypothesis":"Comparator script will confirm task-ID parity and report a small accuracy delta.","change_set":["none (measurement-only comparator)"],"command":"python3 Step 4C comparator block from notes/GLM_POST_REBOOT_FULL_BENCH_PROTOCOL.md using $RUN_ROOT/consumer_dense_quality/results.json and $RUN_ROOT/consumer_wayfinder_quality/results.json to write $RUN_ROOT/consumer_quality_parity_summary.json","controls":{"no_model_execution":true,"input_artifacts_fixed_from_step_4A_4B":true},"metrics":{"status":"pending","artifact_expected":"$RUN_ROOT/consumer_quality_parity_summary.json","required_fields":["dense.correct","dense.num_tasks","dense.accuracy","wayfinder.correct","wayfinder.num_tasks","wayfinder.accuracy","accuracy_delta"]},"decision":"pending","next_action":"Run comparator block and append RESULT entry with parity verdict."}
