{"id":"EXP-20260208-GLM-ACTIVE-PERMUTE-FIX","date":"2026-02-08","question":"Does active-query Hamiltonian permute attention (Q_len < K_len) remove dense fallback and recover chunked-prefill latency while preserving memory reduction?","hypothesis":"Computing attention only for active query rows in cycle-window space should replace O(chunk*cache) dense fallback with O(chunk*W), improving chunked latency and keeping peak memory at or below prior chunked runs.","change_set":["hcsa/mlx/attention.py add wayfinder_permute_window_attention_active_batched","hcsa/integrations/glm_mlx.py route permute path to active-query kernel for Q_len < K_len"],"command":"PYTHONPATH=. python3 scripts/bench_glm_chunked_prefill_mlx.py --model-path mlx-community/GLM-4.7-Flash-4bit --seq-lens 32768 --chunk-sizes 4096 --decode-lens 0 1 --cache-modes normal --path permute --window 64 --landmark-stride 0 --kv-step 4096 --baseline-path benchmarks/mlx/glm_4_7_flash_4bit_wayfinder/20260207_201347_fullmodel_prefill_kv_checkpoint/results.json --out-dir benchmarks/mlx/glm_4_7_flash_4bit_wayfinder/20260208_glm_active_permute_fix","controls":{"model":"mlx-community/GLM-4.7-Flash-4bit","path":"permute","window":64,"landmark_stride":null,"chunk_size":4096,"seq_len":32768,"batch":1,"seed":42,"retro_backfill_enabled":false,"baseline_path":"benchmarks/mlx/glm_4_7_flash_4bit_wayfinder/20260208_001331_length_sweep_chunk4096/results.json"},"metrics":{"status":"pending"},"decision":"pending","next_action":"run benchmark, verify no dense fallback on chunks>0, and record absolute/delta/% vs baseline"}
{"id":"EXP-20260208-GLM-HYBRID-THRESHOLD-SWEEP","date":"2026-02-08","question":"With active-row matmul + adaptive graph reuse, which active_dense_threshold gives best 32k chunked-prefill latency/memory tradeoff?","hypothesis":"Hybrid dense-early/permute-late gating will reduce 32k chunked latency versus always-permute while keeping meaningful memory reduction; best threshold likely in 8k..24k.","change_set":["hcsa/mlx/attention.py active-row score/value ops switched to matmul","hcsa/integrations/glm_mlx.py active_dense_threshold gate for active mode","scripts/bench_glm_chunked_prefill_mlx.py chunk profile sample includes seq/q/graph length + dense trigger fields"],"command":"for t in 0 4096 8192 16384 24576 32768; do PYTHONPATH=. python3 scripts/bench_glm_chunked_prefill_mlx.py --model-path mlx-community/GLM-4.7-Flash-4bit --seq-lens 32768 --chunk-sizes 4096 --decode-lens 0 --cache-modes normal --path permute --window 64 --landmark-stride 0 --active-dense-threshold $t --kv-step 4096 --baseline-path benchmarks/mlx/glm_4_7_flash_4bit_wayfinder/20260207_201347_fullmodel_prefill_kv_checkpoint/results.json --out-dir benchmarks/mlx/glm_4_7_flash_4bit_wayfinder/20260208_glm_hybrid_thresh${t}_matmul_32k; done","controls":{"model":"mlx-community/GLM-4.7-Flash-4bit","seq_len":32768,"chunk_size":4096,"batch":1,"retro_backfill_enabled":false,"baseline_always_permute":"benchmarks/mlx/glm_4_7_flash_4bit_wayfinder/20260208_glm_active_permute_adaptive_graph_matmul_32k/results.json","baseline_chunked_dense":"benchmarks/mlx/glm_4_7_flash_4bit_wayfinder/20260208_glm_chunked_dense_control_32k_adaptive_cmp/results.json"},"metrics":{"status":"pending"},"decision":"pending","next_action":"run threshold sweep and choose continuation path based on latency/memory crossover and chunk path diagnostics"}
{"id":"EXP-20260208-GLM-HYBRID-THRESHOLD-SWEEP-RESULT","date":"2026-02-08","question":"With active-row matmul + adaptive graph reuse, which active_dense_threshold gives best 32k chunked-prefill latency/memory tradeoff?","hypothesis":"Hybrid dense-early/permute-late gating will reduce 32k chunked latency versus always-permute while keeping meaningful memory reduction.","change_set":["hcsa/mlx/attention.py active-row score/value ops switched to matmul","hcsa/integrations/glm_mlx.py active_dense_threshold gate + adaptive graph reuse","scripts/bench_glm_chunked_prefill_mlx.py chunk profile includes k_len/seq_len/graph_seq_len/active dense trigger"],"command":"for t in 0 4096 8192 16384 32768; do PYTHONPATH=. python3 scripts/bench_glm_chunked_prefill_mlx.py --model-path mlx-community/GLM-4.7-Flash-4bit --seq-lens 32768 --chunk-sizes 4096 --decode-lens 0 --cache-modes normal --path permute --window 64 --landmark-stride 0 --active-dense-threshold $t --kv-step 4096 --baseline-path benchmarks/mlx/glm_4_7_flash_4bit_wayfinder/20260207_201347_fullmodel_prefill_kv_checkpoint/results.json --out-dir benchmarks/mlx/glm_4_7_flash_4bit_wayfinder/20260208_glm_hybrid_thresh${t}_matmul_32k_v3; done","controls":{"model":"mlx-community/GLM-4.7-Flash-4bit","seq_len":32768,"chunk_size":4096,"batch":1,"retro_backfill_enabled":false,"window":64,"baseline_monolithic":"benchmarks/mlx/glm_4_7_flash_4bit_wayfinder/20260207_201347_fullmodel_prefill_kv_checkpoint/results.json","baseline_always_permute":"benchmarks/mlx/glm_4_7_flash_4bit_wayfinder/20260208_glm_active_permute_adaptive_graph_matmul_32k/results.json","baseline_chunked_dense":"benchmarks/mlx/glm_4_7_flash_4bit_wayfinder/20260208_glm_chunked_dense_control_32k_adaptive_cmp/results.json"},"metrics":{"results":{"0":{"path":"benchmarks/mlx/glm_4_7_flash_4bit_wayfinder/20260208_glm_hybrid_thresh0_matmul_32k_v3/results.json","prefill_sec":267.8685736250045,"prefill_tok_s":122.3286463079939,"peak_memory_bytes":22314797052,"memory_reduction_pct_vs_monolithic":22.86167525585625,"dense_chunks":0,"permute_chunks":8},"4096":{"path":"benchmarks/mlx/glm_4_7_flash_4bit_wayfinder/20260208_glm_hybrid_thresh4096_matmul_32k_v3/results.json","prefill_sec":245.80413395799405,"prefill_tok_s":133.30939342785743,"peak_memory_bytes":22310307836,"memory_reduction_pct_vs_monolithic":22.87719368521268,"dense_chunks":1,"permute_chunks":7},"8192":{"path":"benchmarks/mlx/glm_4_7_flash_4bit_wayfinder/20260208_glm_hybrid_thresh8192_matmul_32k_v3/results.json","prefill_sec":228.54557745798957,"prefill_tok_s":143.37621565231686,"peak_memory_bytes":22310307836,"memory_reduction_pct_vs_monolithic":22.87719368521268,"dense_chunks":2,"permute_chunks":6},"16384":{"path":"benchmarks/mlx/glm_4_7_flash_4bit_wayfinder/20260208_glm_hybrid_thresh16384_matmul_32k_v3/results.json","prefill_sec":197.31811170799483,"prefill_tok_s":166.06686388978008,"peak_memory_bytes":22446619216,"memory_reduction_pct_vs_monolithic":22.405989243054425,"dense_chunks":4,"permute_chunks":4},"32768":{"path":"benchmarks/mlx/glm_4_7_flash_4bit_wayfinder/20260208_glm_hybrid_thresh32768_matmul_32k_v3/results.json","prefill_sec":164.15062029100955,"prefill_tok_s":199.62154234877838,"peak_memory_bytes":26018070576,"memory_reduction_pct_vs_monolithic":10.060110668689248,"dense_chunks":8,"permute_chunks":0}},"attention_seqlen_correlation_chunk1_7":0.976441085778658},"decision":"keep","next_action":"set active_dense_threshold=16384 as working default and re-run 65536 threshold comparison (16384 vs 32768) to locate crossover where Hamiltonian active path becomes net-latency favorable while preserving memory advantage"}
{"id":"EXP-20260208-GLM-HYBRID-THRESHOLD-TRIANGULATION-65536","date":"2026-02-08","question":"At T=65536, where is the practical dense\u2194Hamiltonian crossover and does threshold=49152 improve triangulation of the transition?","hypothesis":"A 3-point threshold set (16384, 32768, 49152) will expose the chunk-index region where Hamiltonian becomes competitive while preserving stronger memory reduction than always-dense chunked control.","change_set":["measurement only: reuse active-row matmul + adaptive graph reuse + active_dense_threshold gate"],"command":"for t in 16384 32768 49152; do PYTHONPATH=. python3 scripts/bench_glm_chunked_prefill_mlx.py --model-path mlx-community/GLM-4.7-Flash-4bit --seq-lens 65536 --chunk-sizes 4096 --decode-lens 0 --cache-modes normal --path permute --window 64 --landmark-stride 0 --active-dense-threshold $t --kv-step 4096 --baseline-path benchmarks/mlx/glm_4_7_flash_4bit_wayfinder/20260207_201347_fullmodel_prefill_kv_checkpoint/results.json --out-dir benchmarks/mlx/glm_4_7_flash_4bit_wayfinder/20260208_glm_hybrid_thresh${t}_matmul_65k; done","controls":{"model":"mlx-community/GLM-4.7-Flash-4bit","seq_len":65536,"chunk_size":4096,"batch":1,"retro_backfill_enabled":false,"window":64,"baseline_monolithic":"benchmarks/mlx/glm_4_7_flash_4bit_wayfinder/20260207_201347_fullmodel_prefill_kv_checkpoint/results.json","baseline_chunked_dense":"benchmarks/mlx/glm_4_7_flash_4bit_wayfinder/20260208_glm_hybrid_thresh32768_matmul_32k_v4/results.json"},"metrics":{"status":"pending"},"decision":"pending","next_action":"run three-threshold 65k sweep and determine crossover-informed default"}
{"id":"EXP-20260208-GLM-CHUNK-CROSSOVER-EXTRACTION-32K-RESULT","date":"2026-02-08","question":"From existing 32k sweep data, at what k_len does Hamiltonian chunk time approach dense chunk time, and does attention_ms correlate with k_len or graph_seq_len?","hypothesis":"attention_ms in active-permute tracks live k_len (cache growth), while graph reuse keeps graph_build near zero; dense-vs-permute chunk gap should narrow toward final chunks.","change_set":["analysis only (no code changes)"],"command":"python3 analysis over results.json chunk_reports from 20260208_glm_hybrid_thresh0_matmul_32k_v3 and 20260208_glm_hybrid_thresh32768_matmul_32k_v3","controls":{"model":"mlx-community/GLM-4.7-Flash-4bit","seq_len":32768,"chunk_size":4096,"window":64,"retro_backfill_enabled":false,"graph_seq_len_fixed":32768},"metrics":{"chunk_delta_perm_minus_dense_sec":[{"chunk":0,"k_len":4096,"delta_sec":33.368},{"chunk":1,"k_len":8192,"delta_sec":18.867},{"chunk":2,"k_len":12288,"delta_sec":15.745},{"chunk":3,"k_len":16384,"delta_sec":13.813},{"chunk":4,"k_len":20480,"delta_sec":10.434},{"chunk":5,"k_len":24576,"delta_sec":7.613},{"chunk":6,"k_len":28672,"delta_sec":3.714},{"chunk":7,"k_len":32768,"delta_sec":0.181}],"corr_klen_perm_attention_ms":0.9671,"corr_klen_dense_chunk_sec":0.7469,"permute_graph_seq_len_unique":[32768],"permute_cache_hit_pattern":[false,true,true,true,true,true,true,true]},"decision":"keep","next_action":"complete 65k threshold triangulation and extract first chunk index where permute chunk time is <= dense chunk time"}
{"id":"EXP-20260208-GLM-HYBRID-THRESHOLD-TRIANGULATION-65536-STATUS","date":"2026-02-08","question":"At T=65536, where is the practical dense\u2194Hamiltonian crossover with thresholds 16384/32768/49152?","hypothesis":"A three-threshold sweep will bracket the crossover and identify a production default threshold balancing latency and memory.","change_set":["measurement only"],"command":"for t in 16384 32768 49152; do PYTHONPATH=. python3 scripts/bench_glm_chunked_prefill_mlx.py --model-path mlx-community/GLM-4.7-Flash-4bit --seq-lens 65536 --chunk-sizes 4096 --decode-lens 0 --cache-modes normal --path permute --window 64 --landmark-stride 0 --active-dense-threshold $t --kv-step 4096 --baseline-path benchmarks/mlx/glm_4_7_flash_4bit_wayfinder/20260207_201347_fullmodel_prefill_kv_checkpoint/results.json --out-dir benchmarks/mlx/glm_4_7_flash_4bit_wayfinder/20260208_glm_hybrid_thresh${t}_matmul_65k; done","controls":{"model":"mlx-community/GLM-4.7-Flash-4bit","seq_len":65536,"chunk_size":4096,"batch":1,"retro_backfill_enabled":false,"window":64},"metrics":{"status":"completed","started_utc":"2026-02-08T04:56:08Z","completed_utc":"2026-02-08T05:42:38Z"},"decision":"superseded_by_result","next_action":"refer to EXP-20260208-GLM-HYBRID-THRESHOLD-TRIANGULATION-65536-RESULT"}
{"id":"EXP-20260208-GLM-HYBRID-THRESHOLD-TRIANGULATION-65536-RESULT","date":"2026-02-08","question":"At T=65536, where is the practical dense\u2194Hamiltonian crossover and what threshold gives the best measured latency/memory tradeoff?","hypothesis":"A 3-point threshold sweep (16384/32768/49152) will bracket the crossover and expose a practical default region.","change_set":["measurement only"],"command":"for t in 16384 32768 49152; do PYTHONPATH=. python3 scripts/bench_glm_chunked_prefill_mlx.py --model-path mlx-community/GLM-4.7-Flash-4bit --seq-lens 65536 --chunk-sizes 4096 --decode-lens 0 --cache-modes normal --path permute --window 64 --landmark-stride 0 --active-dense-threshold $t --kv-step 4096 --baseline-path benchmarks/mlx/glm_4_7_flash_4bit_wayfinder/20260207_201347_fullmodel_prefill_kv_checkpoint/results.json --out-dir benchmarks/mlx/glm_4_7_flash_4bit_wayfinder/20260208_glm_hybrid_thresh${t}_matmul_65k; done","controls":{"model":"mlx-community/GLM-4.7-Flash-4bit","seq_len":65536,"chunk_size":4096,"batch":1,"retro_backfill_enabled":false,"window":64,"baseline_path":"benchmarks/mlx/glm_4_7_flash_4bit_wayfinder/20260207_201347_fullmodel_prefill_kv_checkpoint/results.json"},"metrics":{"baseline":{"prefill_sec":126.68944979200023,"prefill_tok_s":517.296429241721,"peak_memory_bytes":44890891940},"threshold_16384":{"path":"benchmarks/mlx/glm_4_7_flash_4bit_wayfinder/20260208_glm_hybrid_thresh16384_matmul_65k/results.json","prefill_sec":959.9001942080067,"prefill_tok_s":68.27376470537374,"peak_memory_bytes":24143352764,"delta_sec_vs_baseline":833.2107444160065,"delta_sec_pct_vs_baseline":657.6796613956242,"delta_tok_s_vs_baseline":-449.0226645363472,"delta_tok_s_pct_vs_baseline":-86.80181017188677,"delta_peak_memory_bytes_vs_baseline":-20747539176,"delta_peak_memory_pct_vs_baseline":-46.21770314506253,"memory_reduction_pct":46.21770314506253,"permute_chunks":12,"dense_chunks":4},"threshold_32768":{"path":"benchmarks/mlx/glm_4_7_flash_4bit_wayfinder/20260208_glm_hybrid_thresh32768_matmul_65k/results.json","prefill_sec":923.2899481670029,"prefill_tok_s":70.98095254920503,"peak_memory_bytes":26018201648,"delta_sec_vs_baseline":796.6004983750026,"delta_sec_pct_vs_baseline":628.7820332970645,"delta_tok_s_vs_baseline":-446.3154766925159,"delta_tok_s_pct_vs_baseline":-86.27847622044241,"delta_peak_memory_bytes_vs_baseline":-18872690292,"delta_peak_memory_pct_vs_baseline":-42.041245955247994,"memory_reduction_pct":42.041245955247994,"permute_chunks":8,"dense_chunks":8},"threshold_49152":{"path":"benchmarks/mlx/glm_4_7_flash_4bit_wayfinder/20260208_glm_hybrid_thresh49152_matmul_65k/results.json","prefill_sec":890.6999129580072,"prefill_tok_s":73.578091842802,"peak_memory_bytes":29589653008,"delta_sec_vs_baseline":764.010463166007,"delta_sec_pct_vs_baseline":603.0576850877209,"delta_tok_s_vs_baseline":-443.71833739891895,"delta_tok_s_pct_vs_baseline":-85.77641605787683,"delta_peak_memory_bytes_vs_baseline":-15301238932,"delta_peak_memory_pct_vs_baseline":-34.08539743975513,"memory_reduction_pct":34.08539743975513,"permute_chunks":4,"dense_chunks":12},"cross_run_crossover_probe":{"k_len_36864_perm_minus_dense_sec":24.254,"k_len_40960_perm_minus_dense_sec":-27.385,"k_len_45056_perm_minus_dense_sec":-15.133,"k_len_49152_perm_minus_dense_sec":-7.655,"note":"estimated from threshold32768 vs threshold49152 run pairing; subject to run-to-run variance"}},"decision":"keep_direction_optimize_kernel","next_action":"run matched --no-swap chunked dense control at T=65536 and prioritize active-kernel vectorization before further threshold tuning"}
{"id":"EXP-20260208-GLM-ACTIVE-HEAD-CHUNK-VECTORIZATION","date":"2026-02-08","question":"Does vectorizing active-query attention across head chunks reduce the constant-factor latency gap without breaking chunked prefill correctness?","hypothesis":"Removing per-head Python loops in wayfinder_permute_window_attention_active_batched will reduce latency while preserving memory/correctness characteristics.","change_set":["hcsa/mlx/attention.py: vectorized active-query kernel across head chunks"],"command":"PYTHONPATH=. python3 scripts/bench_glm_chunked_prefill_mlx.py --model-path mlx-community/GLM-4.7-Flash-4bit --seq-lens 8192 --chunk-sizes 4096 --decode-lens 0 --cache-modes normal --path permute --window 64 --landmark-stride 0 --active-dense-threshold 0 --kv-step 4096 --baseline-path benchmarks/mlx/glm_4_7_flash_4bit_wayfinder/20260207_201347_fullmodel_prefill_kv_checkpoint/results.json --out-dir benchmarks/mlx/glm_4_7_flash_4bit_wayfinder/20260208_glm_active_vec_heads_smoke_8k","controls":{"model":"mlx-community/GLM-4.7-Flash-4bit","seq_len":8192,"chunk_size":4096,"retro_backfill_enabled":false,"window":64,"landmark_stride":0,"active_dense_threshold":0},"metrics":{"status":"pending"},"decision":"pending","next_action":"run smoke benchmark; if successful, run 32k threshold rerun"}
{"id":"EXP-20260208-GLM-ACTIVE-HEAD-CHUNK-VECTORIZATION-SMOKE-RESULT","date":"2026-02-08","question":"Does the vectorized active-query head-chunk kernel execute correctly in chunked prefill?","hypothesis":"Vectorizing across heads preserves semantics while reducing Python-loop overhead.","change_set":["hcsa/mlx/attention.py active-row path vectorized across head chunks","hcsa/mlx/attention.py fix row-wise permutation gather shape"],"command":"PYTHONPATH=. python3 scripts/bench_glm_chunked_prefill_mlx.py --model-path mlx-community/GLM-4.7-Flash-4bit --seq-lens 8192 --chunk-sizes 4096 --decode-lens 0 --cache-modes normal --path permute --window 64 --landmark-stride 0 --active-dense-threshold 0 --kv-step 4096 --baseline-path benchmarks/mlx/glm_4_7_flash_4bit_wayfinder/20260207_201347_fullmodel_prefill_kv_checkpoint/results.json --out-dir benchmarks/mlx/glm_4_7_flash_4bit_wayfinder/20260208_glm_active_vec_heads_smoke_8k_fix1","controls":{"model":"mlx-community/GLM-4.7-Flash-4bit","seq_len":8192,"chunk_size":4096,"retro_backfill_enabled":false,"window":64,"active_dense_threshold":0},"metrics":{"path":"benchmarks/mlx/glm_4_7_flash_4bit_wayfinder/20260208_glm_active_vec_heads_smoke_8k_fix1/results.json","ok":true,"prefill_sec":111.18966120800178,"prefill_tok_s":73.67591474782245,"peak_memory_bytes":22175554348,"chunk0_sec":71.88061662499967,"chunk1_sec":39.28353362499911},"decision":"proceed","next_action":"run 32k threshold=16384 rerun and compare against pre-vectorization reference"}
{"id":"EXP-20260208-GLM-CHUNKED-DENSE-CONTROL-65K-MATCHED-RESULT","date":"2026-02-08","question":"How much of 65k latency comes from chunking/KV growth itself, independent of Wayfinder path?","hypothesis":"Chunked dense control will be materially slower than monolithic baseline, isolating chunking/KV-growth overhead.","change_set":["measurement only"],"command":"Run stock chunked control twice: --no-swap, seq_len=65536, chunk=4096, decode_lens=0, kv_step=4096","controls":{"model":"mlx-community/GLM-4.7-Flash-4bit","seq_len":65536,"chunk_size":4096,"no_swap":true,"retro_backfill_enabled":false,"baseline_path":"benchmarks/mlx/glm_4_7_flash_4bit_wayfinder/20260207_201347_fullmodel_prefill_kv_checkpoint/results.json"},"metrics":{"baseline":{"prefill_sec":126.68944979200023,"prefill_tok_s":517.296429241721,"peak_memory_bytes":44890891940},"run_a":{"path":"benchmarks/mlx/glm_4_7_flash_4bit_wayfinder/20260208_glm_chunked_dense_control_65k_matched/results.json","prefill_sec":785.1028986250021,"prefill_tok_s":83.47440840528947,"peak_memory_bytes":33161104180,"delta_sec_vs_baseline":658.4134488330019,"delta_sec_pct_vs_baseline":519.7066132294287,"delta_tok_s_vs_baseline":-433.82202083643153,"delta_tok_s_pct_vs_baseline":-83.86333179843317,"delta_peak_memory_bytes_vs_baseline":-11729787760,"delta_peak_memory_pct_vs_baseline":-26.129549343055448,"memory_reduction_pct":26.129549343055448},"run_b":{"path":"benchmarks/mlx/glm_4_7_flash_4bit_wayfinder/20260208_glm_chunked_dense_control_65k_matched_repeat/results.json","prefill_sec":626.7985392080009,"prefill_tok_s":104.55672102045553,"peak_memory_bytes":33161104180,"delta_sec_vs_baseline":500.109089415,"delta_sec_pct_vs_baseline":394.7487533395073,"delta_tok_s_vs_baseline":-412.7397082212655,"delta_tok_s_pct_vs_baseline":-79.78832445038367,"delta_peak_memory_bytes_vs_baseline":-11729787760,"delta_peak_memory_pct_vs_baseline":-26.129549343055448,"memory_reduction_pct":26.129549343055448},"median_prefill_sec":705.9507189165015,"std_prefill_sec":79.15217970850063,"median_prefill_tok_s":94.0155647128725,"std_prefill_tok_s":10.54115630758303},"decision":"keep_control_baseline","next_action":"use median/replicated reporting for all 65k comparisons"}
