{"id":"EXP-20260319T045153Z-QWEN35CUDA-SPARSE-STREAMED-DEGREE-RESULT","date":"2026-03-19","question":"Can a streamed-neighbor Wayfinder/HCSA fast path lower long-context attn_kernel_ms and reopen the 16k ladder by eliminating the current full-neighborhood K/V and weight materialization hot spots?","hypothesis":"A no-weights streamed degree-block path with online softmax accumulation should lower temporary materialization, permit less pathological long-context chunking, and improve kappa versus the repaired-loader tie-break anchor.","change_set":["hcsa/torch/attention_wayfinder_sparse.py","hcsa/integrations/qwen_torch.py","scripts/bench_qwen35_cuda_wayfinder.py","tests/pytorch/test_torch_qwen_sparse_gqa.py","tests/test_qwen_cuda_wayfinder_cli.py","notes/LAB_NOTEBOOK.md","notes/experiments.ndjson"],"command":".venv/bin/python -m py_compile hcsa/integrations/qwen_torch.py hcsa/torch/attention_wayfinder_sparse.py scripts/bench_qwen35_cuda_wayfinder.py tests/pytorch/test_torch_qwen_sparse_gqa.py tests/test_qwen_cuda_wayfinder_cli.py && .venv/bin/python -m pytest tests/pytorch/test_torch_qwen_sparse_gqa.py tests/pytorch/test_torch_causality.py tests/pytorch/test_torch_dense_limit_equivalence.py tests/pytorch/test_torch_matches_mlx_reference_small.py tests/test_qwen_cuda_wayfinder_cli.py -q && .venv/bin/python scripts/bench_qwen35_cuda_wayfinder.py --model-path /home/hmbown/HF_Models/Qwen3.5-9B --seq-lens 4096 8192 --path sparse --strategy random --engine auto --warmup 1 --repeats 1 --forward-target backbone --phases dense wayfinder --skip-divergence --output benchmarks/cuda/qwen35_wayfinder/EXP-20260319T045153Z-QWEN35CUDA-SPARSE-STREAMED-DEGREE-4096-8192.ndjson && journalctl -b -k --since '2026-03-19 00:07:10 CDT' | rg -n 'NVRM|Xid|Out of memory|hung task|BUG:|Call Trace'","controls":{"baseline_run_path":"benchmarks/cuda/qwen35_wayfinder/EXP-20260319T043357Z-QWEN35CUDA-BACKBONE-RESIDENCY-TIEBREAK-4096-8192.ndjson","one_process_at_a_time":true,"lock_file":"benchmarks/cuda/qwen35_wayfinder/.bench_qwen35_cuda_wayfinder.lock","retro_backfill_inference":"off","model_path":"/home/hmbown/HF_Models/Qwen3.5-9B","device":"cuda","gpu":"NVIDIA GB10","device_capability":[12,1],"torch":"2.10.0+cu130","transformers":"5.3.0","path":"sparse","strategy":"random","compute_graph_metrics":false,"forward_target":"backbone","window":64,"landmark_stride":64,"num_cycles":1,"engine_request":"auto","warmup":1,"repeats":1,"seq_lens_gate":[4096,8192],"kernel_log_since":"2026-03-19 00:07:10 CDT","current_anchor_4096":{"D_estimate":97.0,"kappa":64.25912658830366,"crossover_tokens_estimate":8387.646804924101},"current_anchor_8192":{"D_estimate":129.0,"kappa":116.42635492705567,"crossover_tokens_estimate":83695.9546355498}},"metrics":{"status":"completed","validation":{"py_compile":"pass","pytest":{"result":"pass","skipped":1}},"warnings":["existing torch.jit.script_method deprecation warnings","existing GB10 capability 12.1 vs PyTorch max advertised 12.0 warning"],"artifact":"benchmarks/cuda/qwen35_wayfinder/EXP-20260319T045153Z-QWEN35CUDA-SPARSE-STREAMED-DEGREE-4096-8192.ndjson","kernel_fault_lines_after_start":0,"benchmark_residency":{"dense_benchmark_module_device_counts":{"cuda:0":428},"wayfinder_benchmark_module_device_counts":{"cuda:0":428},"result":"single_gpu_comparable"},"4096":{"dense":{"median_ms":2741.2,"prefill_tok_per_sec":1494.2,"peak_mem_gb":17.54},"wayfinder":{"median_ms":9448.68,"prefill_tok_per_sec":433.5,"peak_mem_gb":18.07,"wayfinder_active_layers":8,"attn_kernel_ms_mean":412.7395172508841,"effective_chunking":{"query_chunk_size":4096,"kv_head_chunk_size":2,"degree_chunk_size":24,"num_query_chunks":1,"num_head_blocks":2,"num_degree_blocks":6,"streamed_degree":true}},"delta_vs_anchor_wayfinder_abs":{"median_ms":5345.25,"prefill_tok_per_sec":-564.7,"peak_mem_gb":0.5,"attn_kernel_ms_mean":178.28310250115464},"delta_vs_anchor_wayfinder_pct":{"median_ms":130.26297512081356,"prefill_tok_per_sec":-56.5718292927269,"peak_mem_gb":2.8457598178713717,"attn_kernel_ms_mean":76.04104272065364},"delta_vs_anchor_dense_abs":{"median_ms":44.69999999999982,"prefill_tok_per_sec":-24.799999999999955,"peak_mem_gb":0.0},"delta_vs_anchor_dense_pct":{"median_ms":1.6577044316706775,"prefill_tok_per_sec":-1.6326530612244867,"peak_mem_gb":0.0},"memory_reduction_pct":-3.0216647662485885,"degree_estimate":97.0,"kappa":145.55215219160547,"crossover_tokens":null},"8192":{"dense":{"median_ms":5498.08,"prefill_tok_per_sec":1490.0,"peak_mem_gb":18.38},"wayfinder":{"median_ms":13812.81,"prefill_tok_per_sec":593.1,"peak_mem_gb":18.49,"wayfinder_active_layers":8,"attn_kernel_ms_mean":824.0767038751073,"effective_chunking":{"query_chunk_size":8192,"kv_head_chunk_size":1,"degree_chunk_size":24,"num_query_chunks":1,"num_head_blocks":4,"num_degree_blocks":9,"streamed_degree":true}},"delta_vs_anchor_wayfinder_abs":{"median_ms":3893.8899999999994,"prefill_tok_per_sec":-232.79999999999995,"peak_mem_gb":0.0,"attn_kernel_ms_mean":141.45039499999257},"delta_vs_anchor_wayfinder_pct":{"median_ms":39.25719735616377,"prefill_tok_per_sec":-28.187431892480923,"peak_mem_gb":0.0,"attn_kernel_ms_mean":20.721497715651427},"delta_vs_anchor_dense_abs":{"median_ms":87.88000000000011,"prefill_tok_per_sec":-24.200000000000045,"peak_mem_gb":0.0},"delta_vs_anchor_dense_pct":{"median_ms":1.6243392111197388,"prefill_tok_per_sec":-1.5982036719059598,"peak_mem_gb":0.0},"memory_reduction_pct":-0.5984766050054269,"degree_estimate":129.0,"kappa":159.54059835856438,"crossover_tokens":null},"stop_gate_tripped":"kappa_regressed"},"decision":"stop","next_action":"Do not run 16384 from this branch. The stop-gate tripped because 8192 kappa worsened from ~116.43 to ~159.54, which also makes crossover mathematically impossible for this graph family (kappa >= 128). Isolate the streamed no-weights math from the aggressive auto tiling before another long-context rung."}
{"id":"EXP-20260319T051254Z-QWEN35CUDA-KERNEL-PEAK-BUDGET-FULLDEGREE-PRERUN","date":"2026-03-19","question":"If auto mode keeps the peak-live-byte chunk budget and query-first sorting but stops streaming degree blocks by default, does the Wayfinder/HCSA kernel recover enough realized efficiency to lower 8192 kappa and reopen a credible 16384 rung?","hypothesis":"The streamed-degree experiment proved the live-set math can open one query chunk at long prefill, but it also showed that serial degree-block gather plus online-softmax loops in Python/Torch raised the realized constant factor enough to make kappa worse than the repaired-loader anchor and even push it above 128. Preserving the improved peak-live-byte budget and query-first chunk selection while reverting default execution to the old full-degree score/softmax/V contraction whenever auto mode is used should keep larger query chunks than the original tie-break anchor, remove the extra serial degree-block loop, lower attn_kernel_ms, and improve 8192 kappa versus both the tie-break anchor (~116.43) and the failed streamed-degree run (~159.54).","change_set":["planned edits to hcsa/torch/attention_wayfinder_sparse.py","planned regression updates in tests/pytorch/test_torch_qwen_sparse_gqa.py","notes/LAB_NOTEBOOK.md","notes/experiments.ndjson"],"command":".venv/bin/python -m py_compile hcsa/integrations/qwen_torch.py hcsa/torch/attention_wayfinder_sparse.py scripts/bench_qwen35_cuda_wayfinder.py tests/pytorch/test_torch_qwen_sparse_gqa.py tests/test_qwen_cuda_wayfinder_cli.py && .venv/bin/python -m pytest tests/pytorch/test_torch_qwen_sparse_gqa.py tests/pytorch/test_torch_causality.py tests/pytorch/test_torch_dense_limit_equivalence.py tests/pytorch/test_torch_matches_mlx_reference_small.py tests/test_qwen_cuda_wayfinder_cli.py -q && .venv/bin/python scripts/bench_qwen35_cuda_wayfinder.py --model-path /home/hmbown/HF_Models/Qwen3.5-9B --seq-lens 4096 8192 --path sparse --strategy random --engine auto --warmup 1 --repeats 1 --forward-target backbone --phases dense wayfinder --skip-divergence --output benchmarks/cuda/qwen35_wayfinder/EXP-20260319T051254Z-QWEN35CUDA-KERNEL-PEAK-BUDGET-FULLDEGREE-4096-8192.ndjson && journalctl -b -k --since '2026-03-19 00:12:54 CDT' | rg -n 'NVRM|Xid|Out of memory|hung task|BUG:|Call Trace'","controls":{"baseline_run_path":"benchmarks/cuda/qwen35_wayfinder/EXP-20260319T043357Z-QWEN35CUDA-BACKBONE-RESIDENCY-TIEBREAK-4096-8192.ndjson","failed_streamed_degree_run":"benchmarks/cuda/qwen35_wayfinder/EXP-20260319T045153Z-QWEN35CUDA-SPARSE-STREAMED-DEGREE-4096-8192.ndjson","one_process_at_a_time":true,"lock_file":"benchmarks/cuda/qwen35_wayfinder/.bench_qwen35_cuda_wayfinder.lock","retro_backfill_inference":"off","model_path":"/home/hmbown/HF_Models/Qwen3.5-9B","device":"cuda","gpu":"NVIDIA GB10","device_capability":[12,1],"torch":"2.10.0+cu130","transformers":"5.3.0","path":"sparse","strategy":"random","compute_graph_metrics":false,"forward_target":"backbone","window":64,"landmark_stride":64,"num_cycles":1,"engine_request":"auto","warmup":1,"repeats":1,"seq_lens_gate":[4096,8192],"seq_len_contingent":[16384],"kernel_log_since":"2026-03-19 00:12:54 CDT","current_anchor_4096":{"D_estimate":97.0,"kappa":64.25912658830366,"crossover_tokens_estimate":8387.646804924101},"current_anchor_8192":{"D_estimate":129.0,"kappa":116.42635492705567,"crossover_tokens_estimate":83695.9546355498},"failed_streamed_degree_4096":{"D_estimate":97.0,"kappa":145.55215219160547},"failed_streamed_degree_8192":{"D_estimate":129.0,"kappa":159.54059835856438}},"metrics":{"status":"pending","artifacts_expected":["benchmarks/cuda/qwen35_wayfinder/EXP-20260319T051254Z-QWEN35CUDA-KERNEL-PEAK-BUDGET-FULLDEGREE-4096-8192.ndjson","benchmarks/cuda/qwen35_wayfinder/EXP-20260319T051254Z-QWEN35CUDA-KERNEL-PEAK-BUDGET-FULLDEGREE-16384.ndjson"],"required":["py_compile success","pytest selected suite passes","bench[label=dense][seq_len=4096].median_ms","bench[label=wayfinder][seq_len=4096].median_ms","bench[label=dense][seq_len=8192].median_ms","bench[label=wayfinder][seq_len=8192].median_ms","dense and wayfinder residency metadata for backbone module","no cpu or meta residency in backbone benchmark module","matching real-device placement for dense and wayfinder","bench[label=wayfinder].wayfinder_profiles","bench[label=wayfinder].wayfinder_active_layers==8","wayfinder D_estimate","wayfinder empirical kappa","wayfinder crossover_estimate","zero new kernel fault lines after kernel_log_since"]},"decision":"pending","next_action":"Patch auto mode so default sparse execution uses the peak-live-byte budget without streamed degree blocks, rerun the guarded 4096/8192 checkpoint, and only if 8192 kappa improves while stability holds continue automatically to 16384."}
{"id":"EXP-20260319T051254Z-QWEN35CUDA-KERNEL-PEAK-BUDGET-FULLDEGREE-RESULT","date":"2026-03-19","question":"If auto mode keeps the peak-live-byte chunk budget and query-first sorting but stops streaming degree blocks by default, does the Wayfinder/HCSA kernel recover enough realized efficiency to lower 8192 kappa and reopen a credible 16384 rung?","hypothesis":"Preserving the improved peak-live-byte budget and query-first chunk selection while reverting default execution to the old full-degree score/softmax/V contraction whenever auto mode is used should keep larger query chunks than the original tie-break anchor, remove the extra serial degree-block loop, lower attn_kernel_ms, and improve 8192 kappa.","change_set":["hcsa/torch/attention_wayfinder_sparse.py","hcsa/integrations/qwen_torch.py","scripts/bench_qwen35_cuda_wayfinder.py","tests/pytorch/test_torch_qwen_sparse_gqa.py","tests/test_qwen_cuda_wayfinder_cli.py","notes/LAB_NOTEBOOK.md","notes/experiments.ndjson"],"command":".venv/bin/python -m py_compile hcsa/integrations/qwen_torch.py hcsa/torch/attention_wayfinder_sparse.py scripts/bench_qwen35_cuda_wayfinder.py tests/pytorch/test_torch_qwen_sparse_gqa.py tests/test_qwen_cuda_wayfinder_cli.py && .venv/bin/python -m pytest tests/pytorch/test_torch_qwen_sparse_gqa.py tests/pytorch/test_torch_causality.py tests/pytorch/test_torch_dense_limit_equivalence.py tests/pytorch/test_torch_matches_mlx_reference_small.py tests/test_qwen_cuda_wayfinder_cli.py -q && .venv/bin/python scripts/bench_qwen35_cuda_wayfinder.py --model-path /home/hmbown/HF_Models/Qwen3.5-9B --seq-lens 4096 8192 --path sparse --strategy random --engine auto --warmup 1 --repeats 1 --forward-target backbone --phases dense wayfinder --skip-divergence --output benchmarks/cuda/qwen35_wayfinder/EXP-20260319T051254Z-QWEN35CUDA-KERNEL-PEAK-BUDGET-FULLDEGREE-4096-8192.ndjson && journalctl -b -k --since '2026-03-19 00:12:54 CDT' | rg -n 'NVRM|Xid|Out of memory|hung task|BUG:|Call Trace'","controls":{"baseline_run_path":"benchmarks/cuda/qwen35_wayfinder/EXP-20260319T043357Z-QWEN35CUDA-BACKBONE-RESIDENCY-TIEBREAK-4096-8192.ndjson","failed_streamed_degree_run":"benchmarks/cuda/qwen35_wayfinder/EXP-20260319T045153Z-QWEN35CUDA-SPARSE-STREAMED-DEGREE-4096-8192.ndjson","one_process_at_a_time":true,"lock_file":"benchmarks/cuda/qwen35_wayfinder/.bench_qwen35_cuda_wayfinder.lock","retro_backfill_inference":"off","model_path":"/home/hmbown/HF_Models/Qwen3.5-9B","device":"cuda","gpu":"NVIDIA GB10","device_capability":[12,1],"torch":"2.10.0+cu130","transformers":"5.3.0","path":"sparse","strategy":"random","compute_graph_metrics":false,"forward_target":"backbone","window":64,"landmark_stride":64,"num_cycles":1,"engine_request":"auto","warmup":1,"repeats":1,"kernel_log_since":"2026-03-19 00:12:54 CDT","current_anchor_4096":{"D_estimate":97.0,"kappa":64.25912658830366,"crossover_tokens_estimate":8387.646804924101},"current_anchor_8192":{"D_estimate":129.0,"kappa":116.42635492705567,"crossover_tokens_estimate":83695.9546355498},"failed_streamed_degree_4096":{"D_estimate":97.0,"kappa":145.55215219160547},"failed_streamed_degree_8192":{"D_estimate":129.0,"kappa":159.54059835856438}},"metrics":{"status":"completed","validation":{"py_compile":"pass","pytest":{"passed":35,"skipped":1,"failed":0}},"warnings":["existing torch.jit.script_method deprecation warnings","existing GB10 capability 12.1 vs PyTorch max advertised 12.0 warning"],"artifact":"benchmarks/cuda/qwen35_wayfinder/EXP-20260319T051254Z-QWEN35CUDA-KERNEL-PEAK-BUDGET-FULLDEGREE-4096-8192.ndjson","kernel_fault_lines_after_start":0,"benchmark_residency":{"dense_benchmark_module_device_counts":{"cuda:0":428},"wayfinder_benchmark_module_device_counts":{"cuda:0":428},"result":"single_gpu_comparable"},"4096":{"dense":{"median_ms":2499.12,"prefill_tok_per_sec":1639.0,"peak_mem_gb":17.54},"wayfinder":{"median_ms":3896.88,"prefill_tok_per_sec":1051.1,"peak_mem_gb":17.57,"wayfinder_active_layers":8,"attn_kernel_ms_mean":217.12598187332333,"effective_chunking":{"query_chunk_size":2048,"kv_head_chunk_size":1,"degree_chunk_size":130,"num_query_chunks":2,"num_head_blocks":4,"num_degree_blocks":1,"streamed_degree":false}},"delta_vs_anchor_wayfinder_abs":{"median_ms":-206.55000000000018,"prefill_tok_per_sec":52.899999999999864,"peak_mem_gb":0.0,"attn_kernel_ms_mean":-17.33043287640612},"delta_vs_anchor_wayfinder_pct":{"median_ms":-5.033593847098651,"prefill_tok_per_sec":5.299539170506899,"peak_mem_gb":0.0,"attn_kernel_ms_mean":-7.391750357910018},"delta_vs_anchor_dense_abs":{"median_ms":-197.3800000000001,"prefill_tok_per_sec":123.79999999999995,"peak_mem_gb":0.0},"delta_vs_anchor_dense_pct":{"median_ms":-7.319859076580756,"prefill_tok_per_sec":8.170538542766629,"peak_mem_gb":0.0},"memory_reduction_pct":-0.17103762827823665,"degree_estimate":97.0,"kappa":65.8442925724288,"crossover_tokens":8813.74433459673},"8192":{"dense":{"median_ms":5009.31,"prefill_tok_per_sec":1635.4,"peak_mem_gb":18.38},"wayfinder":{"median_ms":9370.64,"prefill_tok_per_sec":874.2,"peak_mem_gb":18.49,"wayfinder_active_layers":8,"attn_kernel_ms_mean":640.8747735003999,"effective_chunking":{"query_chunk_size":1536,"kv_head_chunk_size":1,"degree_chunk_size":194,"num_query_chunks":6,"num_head_blocks":4,"num_degree_blocks":1,"streamed_degree":false}},"delta_vs_anchor_wayfinder_abs":{"median_ms":-548.2800000000007,"prefill_tok_per_sec":48.30000000000007,"peak_mem_gb":0.0,"attn_kernel_ms_mean":-41.75153537471488},"delta_vs_anchor_wayfinder_pct":{"median_ms":-5.527617926145192,"prefill_tok_per_sec":5.848165637486387,"peak_mem_gb":0.0,"attn_kernel_ms_mean":-6.116309147755577},"delta_vs_anchor_dense_abs":{"median_ms":-400.8899999999994,"prefill_tok_per_sec":98.20000000000005,"peak_mem_gb":0.0},"delta_vs_anchor_dense_pct":{"median_ms":-7.409892425418644,"prefill_tok_per_sec":6.388238355451473,"peak_mem_gb":0.0},"memory_reduction_pct":-0.5984766050054269,"degree_estimate":129.0,"kappa":118.79319912524429,"crossover_tokens":107351.01477344125},"stop_gate_tripped":"kappa_regressed"},"decision":"stop","next_action":"Do not run 16384 from this branch. The full-degree revert improved absolute Wayfinder latency and attn_kernel_ms, but 8192 kappa still worsened from ~116.43 to ~118.79 because dense improved more in the same paired run. Attack the remaining gather/materialization transport hot spot next."}
{"id":"EXP-20260319T054523Z-QWEN35CUDA-KERNEL-FLAT3D-GATHER-PRERUN","date":"2026-03-19","question":"If the remaining hot spot is the current 5D query-axis-expanded gather in _gather_kv_head_block_chunk, can a flatter 3D gather over [B*H, T, dh] lower per-chunk transport overhead enough to improve 8192 kappa without reintroducing streamed degree blocks?","hypothesis":"The full-degree branch proved the larger query chunks are directionally right and recovered absolute Wayfinder/HCSA latency, but kappa still missed because the kernel still pays two expensive full-degree gathers whose current implementation expands the source across the query-chunk axis for every K and V block. Replacing that helper with a flatter 3D torch.gather path that keeps the peak-live-byte budget and full-degree auto mode intact should reduce per-chunk gather overhead, lower attn_kernel_ms, and improve 8192 kappa versus both the repaired-loader anchor (~116.43) and the just-completed full-degree branch (~118.79).","change_set":["planned edits to hcsa/torch/attention_wayfinder_sparse.py","possible regression updates in tests/pytorch/test_torch_qwen_sparse_gqa.py","notes/LAB_NOTEBOOK.md","notes/experiments.ndjson"],"command":".venv/bin/python -m py_compile hcsa/integrations/qwen_torch.py hcsa/torch/attention_wayfinder_sparse.py scripts/bench_qwen35_cuda_wayfinder.py tests/pytorch/test_torch_qwen_sparse_gqa.py tests/test_qwen_cuda_wayfinder_cli.py && .venv/bin/python -m pytest tests/pytorch/test_torch_qwen_sparse_gqa.py tests/pytorch/test_torch_causality.py tests/pytorch/test_torch_dense_limit_equivalence.py tests/pytorch/test_torch_matches_mlx_reference_small.py tests/test_qwen_cuda_wayfinder_cli.py -q && .venv/bin/python scripts/bench_qwen35_cuda_wayfinder.py --model-path /home/hmbown/HF_Models/Qwen3.5-9B --seq-lens 4096 8192 --path sparse --strategy random --engine auto --warmup 1 --repeats 1 --forward-target backbone --phases dense wayfinder --skip-divergence --output benchmarks/cuda/qwen35_wayfinder/EXP-20260319T054523Z-QWEN35CUDA-KERNEL-FLAT3D-GATHER-4096-8192.ndjson && journalctl -b -k --since '2026-03-19 00:46:13 CDT' | rg -n 'NVRM|Xid|Out of memory|hung task|BUG:|Call Trace'","controls":{"baseline_run_path":"benchmarks/cuda/qwen35_wayfinder/EXP-20260319T043357Z-QWEN35CUDA-BACKBONE-RESIDENCY-TIEBREAK-4096-8192.ndjson","latest_full_degree_run":"benchmarks/cuda/qwen35_wayfinder/EXP-20260319T051254Z-QWEN35CUDA-KERNEL-PEAK-BUDGET-FULLDEGREE-4096-8192.ndjson","one_process_at_a_time":true,"lock_file":"benchmarks/cuda/qwen35_wayfinder/.bench_qwen35_cuda_wayfinder.lock","retro_backfill_inference":"off","model_path":"/home/hmbown/HF_Models/Qwen3.5-9B","device":"cuda","gpu":"NVIDIA GB10","device_capability":[12,1],"torch":"2.10.0+cu130","transformers":"5.3.0","path":"sparse","strategy":"random","compute_graph_metrics":false,"forward_target":"backbone","window":64,"landmark_stride":64,"num_cycles":1,"engine_request":"auto","warmup":1,"repeats":1,"seq_lens_gate":[4096,8192],"seq_len_contingent":[16384],"kernel_log_since":"2026-03-19 00:46:13 CDT","current_anchor_4096":{"D_estimate":97.0,"kappa":64.25912658830366,"crossover_tokens_estimate":8387.646804924101},"current_anchor_8192":{"D_estimate":129.0,"kappa":116.42635492705567,"crossover_tokens_estimate":83695.9546355498},"latest_full_degree_4096":{"D_estimate":97.0,"kappa":65.8442925724288},"latest_full_degree_8192":{"D_estimate":129.0,"kappa":118.79319912524429}},"metrics":{"status":"pending","artifacts_expected":["benchmarks/cuda/qwen35_wayfinder/EXP-20260319T054523Z-QWEN35CUDA-KERNEL-FLAT3D-GATHER-4096-8192.ndjson","benchmarks/cuda/qwen35_wayfinder/EXP-20260319T054523Z-QWEN35CUDA-KERNEL-FLAT3D-GATHER-16384.ndjson"],"required":["py_compile success","pytest selected suite passes","bench[label=dense][seq_len=4096].median_ms","bench[label=wayfinder][seq_len=4096].median_ms","bench[label=dense][seq_len=8192].median_ms","bench[label=wayfinder][seq_len=8192].median_ms","dense and wayfinder residency metadata for backbone module","no cpu or meta residency in backbone benchmark module","matching real-device placement for dense and wayfinder","bench[label=wayfinder].wayfinder_profiles","bench[label=wayfinder].wayfinder_active_layers==8","wayfinder D_estimate","wayfinder empirical kappa","wayfinder crossover_estimate","zero new kernel fault lines after kernel_log_since"]},"decision":"pending","next_action":"Replace the query-axis-expanded gather helper with a flatter 3D gather path, rerun the guarded 4096/8192 checkpoint, and only if 8192 kappa improves while stability holds continue automatically to 16384."}
