{"id":"EXP-20260319T040003Z-QWEN35CUDA-SPARSE-QCHUNK-FIRST-RESULT","date":"2026-03-19","question":"Can a query-chunk-first Wayfinder/HCSA auto chunk objective lower long-context kappa enough to reopen the ladder toward 16k, without regressing the current 4096 gain or violating bounded-memory behavior?","hypothesis":"The current auto chunk resolver is minimizing num_query_chunks * num_head_blocks using the padded neighborhood width d = neigh.shape[-1], which overweights head-block consolidation and underweights the serial query-chunk loop that actually pays the repeated gather / score / softmax / value-materialization overhead. That is why the current 8192 checkpoint resolves to query_chunk_size=192, kv_head_chunk_size=4, 43 query chunks, 1 head block even though a query-first objective under the same 160 MiB budget would prefer shapes like 768 x 1 at 8192. If the auto sort is changed to minimize query chunks first, then head blocks, then secondary tile-shape tie-breaks, Wayfinder/HCSA should keep the 4096 win, materially reduce 8192 attn_kernel_ms and kappa, and make a guarded 16384 rung mathematically credible.","change_set":["hcsa/torch/attention_wayfinder_sparse.py","tests/pytorch/test_torch_qwen_sparse_gqa.py","notes/LAB_NOTEBOOK.md","notes/experiments.ndjson"],"command":".venv/bin/python -m py_compile hcsa/integrations/qwen_torch.py hcsa/torch/attention_wayfinder_sparse.py scripts/bench_qwen35_cuda_wayfinder.py tests/pytorch/test_torch_qwen_sparse_gqa.py && .venv/bin/python -m pytest tests/pytorch/test_torch_qwen_sparse_gqa.py tests/pytorch/test_torch_causality.py tests/pytorch/test_torch_dense_limit_equivalence.py tests/pytorch/test_torch_matches_mlx_reference_small.py tests/test_qwen_cuda_wayfinder_cli.py -q && .venv/bin/python scripts/bench_qwen35_cuda_wayfinder.py --model-path /home/hmbown/HF_Models/Qwen3.5-9B --seq-lens 4096 8192 --path sparse --strategy random --engine auto --warmup 1 --repeats 1 --forward-target backbone --phases dense wayfinder --skip-divergence --output benchmarks/cuda/qwen35_wayfinder/EXP-20260319T040003Z-QWEN35CUDA-SPARSE-QCHUNK-FIRST.ndjson && journalctl -b -k --since '2026-03-18 22:00:03 CDT' | rg -n 'NVRM|Xid|Out of memory|hung task|BUG:|Call Trace'","controls":{"baseline_run_path":"benchmarks/cuda/qwen35_wayfinder/EXP-20260318T231105Z-QWEN35CUDA-SPARSE-ADAPTIVE-CHUNK.ndjson","one_process_at_a_time":true,"lock_file":"benchmarks/cuda/qwen35_wayfinder/.bench_qwen35_cuda_wayfinder.lock","retro_backfill_inference":"off","model_path":"/home/hmbown/HF_Models/Qwen3.5-9B","device":"cuda","gpu":"NVIDIA GB10","device_capability":[12,1],"torch":"2.10.0+cu130","transformers":"5.3.0","path":"sparse","strategy":"random","compute_graph_metrics":false,"forward_target":"backbone","window":64,"landmark_stride":64,"num_cycles":1,"engine_request":"auto","warmup":1,"repeats":1,"seq_lens":[4096,8192],"temp_budget_mib":160.0,"kernel_log_since":"2026-03-18 22:00:03 CDT"},"metrics":{"status":"completed","validation":{"py_compile":"pass","pytest":{"passed":29,"skipped":1,"failed":0}},"warnings":["existing torch.jit.script_method deprecation warnings","existing GB10 capability 12.1 vs PyTorch max advertised 12.0 warning"],"artifact":"benchmarks/cuda/qwen35_wayfinder/EXP-20260319T040003Z-QWEN35CUDA-SPARSE-QCHUNK-FIRST.ndjson","kernel_fault_lines_after_start":0,"wayfinder_4096":{"median_ms":3327.89,"prefill_tok_per_sec":1230.8,"peak_mem_gb":17.57,"wayfinder_active_layers":8,"effective_chunking":{"query_chunk_size":1024,"kv_head_chunk_size":1,"num_query_chunks":4,"num_head_blocks":4},"per_layer_attn_kernel_ms_mean":188.68},"wayfinder_4096_delta_vs_named_baseline_abs":{"median_ms":-15.5,"prefill_tok_per_sec":5.7,"peak_mem_gb":0.0},"wayfinder_4096_delta_vs_named_baseline_pct":{"median_ms":-0.4635846455396764,"prefill_tok_per_sec":0.465003673168723,"peak_mem_gb":0.0},"wayfinder_8192":{"median_ms":7933.65,"prefill_tok_per_sec":1032.6,"peak_mem_gb":18.49,"wayfinder_active_layers":8,"effective_chunking":{"query_chunk_size":768,"kv_head_chunk_size":1,"num_query_chunks":11,"num_head_blocks":4},"per_layer_attn_kernel_ms_mean":537.76},"wayfinder_8192_delta_vs_named_baseline_abs":{"median_ms":-24.72,"prefill_tok_per_sec":3.2,"peak_mem_gb":0.0},"wayfinder_8192_delta_vs_named_baseline_pct":{"median_ms":-0.31062082245184356,"prefill_tok_per_sec":0.31079953328213136,"peak_mem_gb":0.0},"dense_confounder":{"dense_4096":{"median_ms":4813.33,"prefill_tok_per_sec":851.0,"peak_mem_gb":3.16},"dense_8192":{"median_ms":10055.57,"prefill_tok_per_sec":814.7,"peak_mem_gb":4.01},"dense_4096_delta_vs_named_baseline_abs":{"median_ms":2671.92,"prefill_tok_per_sec":-1061.8,"peak_mem_gb":-14.38},"dense_4096_delta_vs_named_baseline_pct":{"median_ms":124.77714869638935,"prefill_tok_per_sec":-55.512337410602254,"peak_mem_gb":-81.98403762827823},"dense_8192_delta_vs_named_baseline_abs":{"median_ms":5705.85,"prefill_tok_per_sec":-1068.6,"peak_mem_gb":-14.37},"dense_8192_delta_vs_named_baseline_pct":{"median_ms":131.17768719331967,"prefill_tok_per_sec":-56.74188923750863,"peak_mem_gb":-78.18280739934712},"backbone_parameter_device_counts":{"cuda:0":1,"meta":425},"hf_device_map_head":[["model.embed_tokens",0],["model.norm","cpu"],["model.rotary_emb","cpu"],["lm_head","cpu"],["model.layers","cpu"]],"conclusion":"dense rows are CPU/meta-offload confounded under device_map=auto and invalidate kappa / crossover comparisons for this artifact"},"stop_gate_tripped":"benchmark_device_comparability_invalid"},"decision":"follow-up","next_action":"Do not open 16384 from this artifact. Fix dense and Wayfinder benchmark device comparability under forward_target=backbone first, then rerun the guarded 4096/8192 gate before any 16k continuation."}
{"id":"EXP-20260319T035802Z-QWEN35CUDA-SPARSE-QK-DOWNCAST-16K-PRERUN","date":"2026-03-19","question":"Can downcasting Wayfinder/HCSA sparse Q/K compute states back to the model compute dtype before the sparse kernel lower the long-context constant factor enough to recover the 8192 stop-gate and make the 16384 rung mathematically credible?","hypothesis":"The current 8192 stop is being driven by per-tile byte cost, not by the existence of variable chunking itself. In hcsa/integrations/qwen_torch.py, Q/K are normalized and then passed through apply_rotary_pos_emb before entering the sparse kernel. That path can promote Q/K into a wider dtype than the model compute path, which in turn makes the current chunk-budget model choose query_chunk_size=192, kv_head_chunk_size=4, and 43 query chunks at T=8192 in benchmarks/cuda/qwen35_wayfinder/EXP-20260318T231105Z-QWEN35CUDA-SPARSE-ADAPTIVE-CHUNK.ndjson. If the sparse path explicitly casts Wayfinder/HCSA Q/K/V back to the model compute dtype before the grouped-query sparse kernel, the temporary K/V gather bytes should drop, larger chunk shapes should fit under the same budget, tile count should fall at 8192+, and empirical kappa should improve enough to reopen the path to 16384.","change_set":["planned edits to hcsa/integrations/qwen_torch.py","planned edits to hcsa/torch/attention_wayfinder_sparse.py","possible benchmark/profile wiring updates in scripts/bench_qwen35_cuda_wayfinder.py","possible regression updates in tests/pytorch/test_torch_qwen_sparse_gqa.py","notes/LAB_NOTEBOOK.md","notes/experiments.ndjson"],"command":".venv/bin/python -m py_compile hcsa/integrations/qwen_torch.py hcsa/torch/attention_wayfinder_sparse.py scripts/bench_qwen35_cuda_wayfinder.py tests/pytorch/test_torch_qwen_sparse_gqa.py && .venv/bin/python -m pytest tests/pytorch/test_torch_qwen_sparse_gqa.py tests/pytorch/test_torch_causality.py tests/pytorch/test_torch_dense_limit_equivalence.py tests/pytorch/test_torch_matches_mlx_reference_small.py tests/test_qwen_cuda_wayfinder_cli.py -q && .venv/bin/python scripts/bench_qwen35_cuda_wayfinder.py --model-path /home/hmbown/HF_Models/Qwen3.5-9B --seq-lens 4096 8192 --path sparse --strategy random --engine auto --warmup 1 --repeats 1 --forward-target backbone --phases dense wayfinder --skip-divergence --output benchmarks/cuda/qwen35_wayfinder/EXP-20260319T035802Z-QWEN35CUDA-SPARSE-QK-DOWNCAST-4096-8192.ndjson && journalctl -b -k --since '2026-03-18 22:58:02' | rg -n 'NVRM|Xid|Out of memory|hung task|BUG:|Call Trace'","controls":{"adaptive_chunk_baseline_path":"benchmarks/cuda/qwen35_wayfinder/EXP-20260318T231105Z-QWEN35CUDA-SPARSE-ADAPTIVE-CHUNK.ndjson","one_process_at_a_time":true,"lock_file":"benchmarks/cuda/qwen35_wayfinder/.bench_qwen35_cuda_wayfinder.lock","retro_backfill_inference":"off","model_path":"/home/hmbown/HF_Models/Qwen3.5-9B","device":"cuda","gpu":"NVIDIA GB10","device_capability":[12,1],"torch":"2.10.0+cu130","transformers":"5.3.0","path":"sparse","strategy":"random","compute_graph_metrics":false,"forward_target":"backbone","window":64,"landmark_stride":64,"num_cycles":1,"engine_request":"auto","warmup":1,"repeats":1,"seq_lens_gate":[4096,8192],"seq_len_contingent":[16384],"kernel_log_since":"2026-03-18 22:58:02","current_anchor_4096":{"D_estimate":97.0,"kappa":65.93455832495403,"crossover_tokens_estimate":8837.104194462412},"current_anchor_8192":{"D_estimate":129.0,"kappa":116.18541483203657,"crossover_tokens_estimate":81842.80503970875}},"metrics":{"status":"pending","artifacts_expected":["benchmarks/cuda/qwen35_wayfinder/EXP-20260319T035802Z-QWEN35CUDA-SPARSE-QK-DOWNCAST-4096-8192.ndjson","benchmarks/cuda/qwen35_wayfinder/EXP-20260319T035802Z-QWEN35CUDA-SPARSE-QK-DOWNCAST-16384.ndjson"],"required":["py_compile success","pytest selected suite passes","bench[label=dense][seq_len=4096].median_ms","bench[label=wayfinder][seq_len=4096].median_ms","bench[label=dense][seq_len=8192].median_ms","bench[label=wayfinder][seq_len=8192].median_ms","bench[label=wayfinder].wayfinder_profiles","bench[label=wayfinder].wayfinder_active_layers==8","wayfinder profile shows larger effective chunking or lower tile count at 8192","wayfinder D_estimate","wayfinder empirical kappa","wayfinder crossover_estimate","zero new kernel fault lines after kernel_log_since"]},"decision":"pending","next_action":"Implement the sparse compute-dtype fix, run the guarded 4096/8192 gate, and only if 8192 kappa improves without materially regressing 4096 continue automatically to 16384."}
{"id":"EXP-20260319T041705Z-QWEN35CUDA-BACKBONE-RESIDENCY-GUARD-16K-PRERUN","date":"2026-03-19","question":"Can we restore a credible 16k Wayfinder/HCSA checkpoint by making dense and Wayfinder backbone benchmarks load with the same single-GPU residency instead of letting device_map=\"auto\" offload most backbone parameters to CPU/meta?","hypothesis":"The current long-context stop is confounded before it reaches the kernel math. In scripts/bench_qwen35_cuda_wayfinder.py, dense and Wayfinder backbone runs still load via AutoModelForCausalLM.from_pretrained(..., device_map=\"auto\", low_cpu_mem_usage=True) and then infer the input device from next(bench_dense.parameters()).device. That allows a benchmark to look CUDA-resident even when almost the whole backbone is actually on cpu or meta, which is exactly what benchmarks/cuda/qwen35_wayfinder/EXP-20260319T040003Z-QWEN35CUDA-SPARSE-QCHUNK-FIRST.ndjson recorded ({'cuda:0': 1, 'meta': 425} plus model.layers -> cpu). If the benchmark forces single-GPU loading for forward_target=backbone and validates that the selected benchmark module has no non-CUDA parameter residency before timing, then dense and Wayfinder rows will become comparable again, kappa will become meaningful again at 4096/8192, and only then will a contingent 16384 rung be worth opening.","change_set":["planned edits to scripts/bench_qwen35_cuda_wayfinder.py","possible regression updates in tests/test_qwen_cuda_wayfinder_cli.py","possible small regression updates in tests/pytorch/test_torch_qwen_sparse_gqa.py","notes/LAB_NOTEBOOK.md","notes/experiments.ndjson"],"command":".venv/bin/python -m py_compile hcsa/integrations/qwen_torch.py hcsa/torch/attention_wayfinder_sparse.py scripts/bench_qwen35_cuda_wayfinder.py tests/pytorch/test_torch_qwen_sparse_gqa.py tests/test_qwen_cuda_wayfinder_cli.py && .venv/bin/python -m pytest tests/pytorch/test_torch_qwen_sparse_gqa.py tests/pytorch/test_torch_causality.py tests/pytorch/test_torch_dense_limit_equivalence.py tests/pytorch/test_torch_matches_mlx_reference_small.py tests/test_qwen_cuda_wayfinder_cli.py -q && .venv/bin/python scripts/bench_qwen35_cuda_wayfinder.py --model-path /home/hmbown/HF_Models/Qwen3.5-9B --seq-lens 4096 8192 --path sparse --strategy random --engine auto --warmup 1 --repeats 1 --forward-target backbone --phases dense wayfinder --skip-divergence --output benchmarks/cuda/qwen35_wayfinder/EXP-20260319T041705Z-QWEN35CUDA-BACKBONE-RESIDENCY-GUARD-4096-8192.ndjson && journalctl -b -k --since '2026-03-18 23:17:05 CDT' | rg -n 'NVRM|Xid|Out of memory|hung task|BUG:|Call Trace'","controls":{"baseline_run_path":"benchmarks/cuda/qwen35_wayfinder/EXP-20260318T231105Z-QWEN35CUDA-SPARSE-ADAPTIVE-CHUNK.ndjson","confounded_artifact_to_avoid":"benchmarks/cuda/qwen35_wayfinder/EXP-20260319T040003Z-QWEN35CUDA-SPARSE-QCHUNK-FIRST.ndjson","one_process_at_a_time":true,"lock_file":"benchmarks/cuda/qwen35_wayfinder/.bench_qwen35_cuda_wayfinder.lock","retro_backfill_inference":"off","model_path":"/home/hmbown/HF_Models/Qwen3.5-9B","device":"cuda","gpu":"NVIDIA GB10","device_capability":[12,1],"torch":"2.10.0+cu130","transformers":"5.3.0","path":"sparse","strategy":"random","compute_graph_metrics":false,"forward_target":"backbone","window":64,"landmark_stride":64,"num_cycles":1,"engine_request":"auto","warmup":1,"repeats":1,"seq_lens_gate":[4096,8192],"seq_len_contingent":[16384],"kernel_log_since":"2026-03-18 23:17:05 CDT","current_anchor_4096":{"D_estimate":97.0,"kappa":65.93455832495403,"crossover_tokens_estimate":8837.104194462412},"current_anchor_8192":{"D_estimate":129.0,"kappa":116.18541483203657,"crossover_tokens_estimate":81842.80503970875}},"metrics":{"status":"pending","artifacts_expected":["benchmarks/cuda/qwen35_wayfinder/EXP-20260319T041705Z-QWEN35CUDA-BACKBONE-RESIDENCY-GUARD-4096-8192.ndjson","benchmarks/cuda/qwen35_wayfinder/EXP-20260319T041705Z-QWEN35CUDA-BACKBONE-RESIDENCY-GUARD-16384.ndjson"],"required":["py_compile success","pytest selected suite passes","dense and wayfinder backbone modules show CUDA-only parameter residency","bench[label=dense][seq_len=4096].median_ms","bench[label=wayfinder][seq_len=4096].median_ms","bench[label=dense][seq_len=8192].median_ms","bench[label=wayfinder][seq_len=8192].median_ms","bench[label=wayfinder].wayfinder_profiles","bench[label=wayfinder].wayfinder_active_layers==8","wayfinder D_estimate","wayfinder empirical kappa","wayfinder crossover_estimate","zero new kernel fault lines after kernel_log_since"]},"decision":"pending","next_action":"Patch the benchmark loader to force or validate single-GPU backbone residency, rerun the guarded 4096/8192 gate, and only if 8192 kappa improves under residency-valid measurements continue automatically to 16384."}
{"id":"EXP-20260319T041705Z-QWEN35CUDA-BACKBONE-RESIDENCY-GUARD-16K-RESULT","date":"2026-03-19","question":"Can we restore a credible 16k Wayfinder/HCSA checkpoint by making dense and Wayfinder backbone benchmarks load with the same single-GPU residency instead of letting device_map=\"auto\" offload most backbone parameters to CPU/meta?","hypothesis":"The current long-context stop is confounded before it reaches the kernel math. In scripts/bench_qwen35_cuda_wayfinder.py, dense and Wayfinder backbone runs still load via AutoModelForCausalLM.from_pretrained(..., device_map=\"auto\", low_cpu_mem_usage=True) and then infer the input device from next(bench_dense.parameters()).device. That allows a benchmark to look CUDA-resident even when almost the whole backbone is actually on cpu or meta, which is exactly what benchmarks/cuda/qwen35_wayfinder/EXP-20260319T040003Z-QWEN35CUDA-SPARSE-QCHUNK-FIRST.ndjson recorded ({'cuda:0': 1, 'meta': 425} plus model.layers -> cpu). If the benchmark forces single-GPU loading for forward_target=backbone and validates that the selected benchmark module has no non-CUDA parameter residency before timing, then dense and Wayfinder rows will become comparable again, kappa will become meaningful again at 4096/8192, and only then will a contingent 16384 rung be worth opening.","change_set":["scripts/bench_qwen35_cuda_wayfinder.py","tests/test_qwen_cuda_wayfinder_cli.py","notes/LAB_NOTEBOOK.md","notes/experiments.ndjson"],"command":".venv/bin/python -m py_compile hcsa/integrations/qwen_torch.py hcsa/torch/attention_wayfinder_sparse.py scripts/bench_qwen35_cuda_wayfinder.py tests/pytorch/test_torch_qwen_sparse_gqa.py tests/test_qwen_cuda_wayfinder_cli.py && .venv/bin/python -m pytest tests/pytorch/test_torch_qwen_sparse_gqa.py tests/pytorch/test_torch_causality.py tests/pytorch/test_torch_dense_limit_equivalence.py tests/pytorch/test_torch_matches_mlx_reference_small.py tests/test_qwen_cuda_wayfinder_cli.py -q && .venv/bin/python scripts/bench_qwen35_cuda_wayfinder.py --model-path /home/hmbown/HF_Models/Qwen3.5-9B --seq-lens 4096 8192 --path sparse --strategy random --engine auto --warmup 1 --repeats 1 --forward-target backbone --phases dense wayfinder --skip-divergence --output benchmarks/cuda/qwen35_wayfinder/EXP-20260319T041705Z-QWEN35CUDA-BACKBONE-RESIDENCY-GUARD-4096-8192.ndjson && journalctl -b -k --since '2026-03-18 23:21:53 CDT' | rg -n 'NVRM|Xid|Out of memory|hung task|BUG:|Call Trace'","controls":{"baseline_run_path":"benchmarks/cuda/qwen35_wayfinder/EXP-20260318T231105Z-QWEN35CUDA-SPARSE-ADAPTIVE-CHUNK.ndjson","confounded_artifact_to_avoid":"benchmarks/cuda/qwen35_wayfinder/EXP-20260319T040003Z-QWEN35CUDA-SPARSE-QCHUNK-FIRST.ndjson","one_process_at_a_time":true,"lock_file":"benchmarks/cuda/qwen35_wayfinder/.bench_qwen35_cuda_wayfinder.lock","retro_backfill_inference":"off","model_path":"/home/hmbown/HF_Models/Qwen3.5-9B","device":"cuda","gpu":"NVIDIA GB10","device_capability":[12,1],"torch":"2.10.0+cu130","transformers":"5.3.0","path":"sparse","strategy":"random","compute_graph_metrics":false,"forward_target":"backbone","window":64,"landmark_stride":64,"num_cycles":1,"engine_request":"auto","warmup":1,"repeats":1,"seq_lens_gate":[4096,8192],"seq_len_contingent":[16384],"kernel_log_since":"2026-03-18 23:21:53 CDT","current_anchor_4096":{"D_estimate":97.0,"kappa":65.93455832495403,"crossover_tokens_estimate":8837.104194462412},"current_anchor_8192":{"D_estimate":129.0,"kappa":116.18541483203657,"crossover_tokens_estimate":81842.80503970875}},"metrics":{"status":"completed","artifact":"benchmarks/cuda/qwen35_wayfinder/EXP-20260319T041705Z-QWEN35CUDA-BACKBONE-RESIDENCY-GUARD-4096-8192.ndjson","validation":{"py_compile":"pass","pytest":{"passed":31,"skipped":1,"failed":0}},"warnings":["existing torch.jit.script_method deprecation warnings","existing GB10 capability 12.1 vs PyTorch max advertised 12.0 warning"],"kernel_fault_lines_after_start":0,"benchmark_residency":{"dense_benchmark_module_device_counts":{"cuda:0":428},"wayfinder_benchmark_module_device_counts":{"cuda:0":428},"result":"single_gpu_comparable"},"dense_4096":{"median_ms":2155.08,"prefill_tok_per_sec":1900.6,"peak_mem_gb":17.54},"wayfinder_4096":{"median_ms":7101.81,"prefill_tok_per_sec":576.8,"peak_mem_gb":17.57,"wayfinder_active_layers":8,"attn_kernel_ms_mean":407.30241962542606,"effective_chunking":{"query_chunk_size":1024,"kv_head_chunk_size":1,"num_query_chunks":4,"num_head_blocks":4},"sparse_compute_dtype":"bfloat16"},"dense_8192":{"median_ms":4368.09,"prefill_tok_per_sec":1875.4,"peak_mem_gb":18.38},"wayfinder_8192":{"median_ms":9286.68,"prefill_tok_per_sec":882.1,"peak_mem_gb":18.49,"wayfinder_active_layers":8,"attn_kernel_ms_mean":639.5585522497655,"effective_chunking":{"query_chunk_size":768,"kv_head_chunk_size":1,"num_query_chunks":11,"num_head_blocks":4},"sparse_compute_dtype":"bfloat16"},"delta_vs_named_baseline_abs":{"dense_4096_median_ms":13.669999999999618,"dense_4096_prefill_tok_per_sec":-12.199999999999818,"dense_4096_peak_mem_gb":0.0,"wayfinder_4096_median_ms":3758.42,"wayfinder_4096_prefill_tok_per_sec":-648.3,"wayfinder_4096_peak_mem_gb":0.0,"dense_8192_median_ms":18.36999999999989,"dense_8192_prefill_tok_per_sec":-7.899999999999864,"dense_8192_peak_mem_gb":0.0,"wayfinder_8192_median_ms":1328.3099999999995,"wayfinder_8192_prefill_tok_per_sec":-147.30000000000007,"wayfinder_8192_peak_mem_gb":0.0},"delta_vs_named_baseline_pct":{"dense_4096_median_ms":0.6383714961164765,"dense_4096_prefill_tok_per_sec":-0.6377154582763366,"dense_4096_peak_mem_gb":0.0,"wayfinder_4096_median_ms":112.40804530847927,"wayfinder_4096_prefill_tok_per_sec":-52.91935573394677,"wayfinder_4096_peak_mem_gb":0.0,"dense_8192_median_ms":0.4223246742836969,"dense_8192_prefill_tok_per_sec":-0.4195173449438932,"dense_8192_peak_mem_gb":0.0,"wayfinder_8192_median_ms":16.694714101459447,"wayfinder_8192_prefill_tok_per_sec":-14.312657369746586,"wayfinder_8192_peak_mem_gb":0.0},"memory_reduction_pct_convention":"100*(1-wayfinder/dense)","memory_reduction_pct":{"4096":-0.17103762827823665,"8192":-0.598476605005448},"degree_estimate":{"4096":97.0,"8192":129.0},"kappa":{"4096":139.15341414220197,"8192":135.01095236114576},"crossover_tokens":{"4096":null,"8192":null},"stop_gate_tripped":"kappa_regressed_above_128"},"decision":"follow-up","next_action":"Do not open 16384. Start a new kernel-regression experiment to explain why current Wayfinder/HCSA attn_kernel_ms nearly doubled at 4096 versus the named adaptive-chunk baseline while dense remained unchanged, then target that regression before retrying the long-context ladder."}
