{"id":"EXP-20260321T212000Z-QWEN27B-DECODE-KERNEL-MATRIX-RESULT","date":"2026-03-21","question":"Can we add an explicit cached-decode sparse backend control, route Qwen block_sparse cached decode onto fused sparse-GQA when requested, and build a repeatable CUDA decode benchmark matrix for dense vs Wayfinder vs Wayfinder+reCUDA?","hypothesis":"Yes. An explicit precomputed sparse backend switch should preserve the current default decode path while enabling an opt-in triton_fused decode branch. Extending the existing decode benchmark harness should then let us compare TTFT, TPOT, decode tok/s, peak memory, and per-layer backend markers across dense, Wayfinder-default, and Wayfinder+reCUDA runs without relying on the prefill-only benchmark.","change_set":["hcsa/torch/triton_fused_sparse_attn.py","hcsa/torch/attention_wayfinder_sparse.py","hcsa/integrations/qwen_torch.py","scripts/bench_decode_wayfinder.py","tests/pytorch/test_torch_qwen_sparse_gqa.py","notes/LAB_NOTEBOOK.md","notes/experiments.ndjson"],"command":"python -m py_compile hcsa/torch/attention_wayfinder_sparse.py hcsa/torch/triton_fused_sparse_attn.py hcsa/integrations/qwen_torch.py scripts/bench_decode_wayfinder.py tests/pytorch/test_torch_qwen_sparse_gqa.py ; .venv/bin/pytest -q tests/pytorch/test_torch_qwen_sparse_gqa.py -k 'precomputed or triton_fused or cached_kv' ; .venv/bin/python scripts/bench_decode_wayfinder.py --model-path /home/hmbown/HF_Models/Qwen3.5-27B-FP8 --prompt-lens 2048 --max-new-tokens 8 --repeats 1 --mode-matrix dense wayfinder wayfinder_triton wayfinder_recuda --output benchmarks/cuda/qwen35_wayfinder/EXP-20260321T212000Z-QWEN27B-DECODE-SMOKE.ndjson","controls":{"model":"~/HF_Models/Qwen3.5-27B-FP8","trust_remote_code":true,"dtype":"torch.bfloat16","decode_path":"generate()","prompt_len":2048,"max_new_tokens":8,"repeats":1,"path":"block_sparse","engine":"triton","default_decode_backend_is_control":true,"prefill_baseline":"benchmarks/cuda/qwen35_wayfinder/EXP-20260321T172541Z-QWEN27B-FP8-SCALE.ndjson"},"metrics":{"status":"success","py_compile":"pass","pytest":{"passed":2,"skipped":4},"artifact":"benchmarks/cuda/qwen35_wayfinder/EXP-20260321T212000Z-QWEN27B-DECODE-SMOKE.ndjson","dense":{"ttft_ms":5058.19,"tpot_ms":131.547,"decode_tok_per_sec":7.6,"peak_mem_gb":29.21},"wayfinder_default":{"backend":"sparse_gqa_precomputed","contraction_backend":"sdpa","ttft_ms":4804.23,"tpot_ms":187.337,"decode_tok_per_sec":5.34,"peak_mem_gb":29.21,"vs_dense":{"ttft_delta_ms":-253.96,"ttft_delta_pct":-5.0207,"tpot_delta_ms":55.79,"tpot_delta_pct":42.4088,"decode_tok_per_sec_delta":-2.26,"decode_tok_per_sec_delta_pct":-29.7368}},"wayfinder_triton":{"backend":"sparse_gqa_precomputed","contraction_backend":"triton_fused","ttft_ms":4791.19,"tpot_ms":179.445,"decode_tok_per_sec":5.57,"peak_mem_gb":29.21,"vs_dense":{"ttft_delta_ms":-267.0,"ttft_delta_pct":-5.2785,"tpot_delta_ms":47.898,"tpot_delta_pct":36.4103,"decode_tok_per_sec_delta":-2.03,"decode_tok_per_sec_delta_pct":-26.7105},"vs_wayfinder_default":{"ttft_delta_ms":-13.04,"ttft_delta_pct":-0.2714,"tpot_delta_ms":-7.892,"tpot_delta_pct":-4.2124,"decode_tok_per_sec_delta":0.23,"decode_tok_per_sec_delta_pct":4.3071}},"wayfinder_recuda":{"backend":"sparse_gqa_precomputed","contraction_backend":"triton_fused","use_recuda_kernel":true,"ttft_ms":4805.4,"tpot_ms":183.492,"decode_tok_per_sec":5.45,"peak_mem_gb":29.21,"vs_dense":{"ttft_delta_ms":-252.79,"ttft_delta_pct":-4.9976,"tpot_delta_ms":51.945,"tpot_delta_pct":39.4883,"decode_tok_per_sec_delta":-2.15,"decode_tok_per_sec_delta_pct":-28.2895},"vs_wayfinder_triton":{"ttft_delta_ms":14.21,"ttft_delta_pct":0.2966,"tpot_delta_ms":4.047,"tpot_delta_pct":2.2556,"decode_tok_per_sec_delta":-0.12,"decode_tok_per_sec_delta_pct":-2.1544}},"memory_reduction_pct_convention":"100*(1-wayfinder/dense)","memory_reduction_pct":{"wayfinder_default":0.0,"wayfinder_triton":0.0,"wayfinder_recuda":0.0}},"decision":"keep","next_action":"Run the same decode matrix at longer prompts and/or longer decode lengths to see whether cached sparse decode amortizes better; keep decode conclusions separate from the positive prefill results."}
{"id":"EXP-20260321T220000Z-QWEN27B-FP8-PREFILL-PAIR-PRERUN","date":"2026-03-21","question":"Does the 27B FP8 paired prefill speedup reproduce cleanly at 8192/32768/65536 using the stable block_sparse+triton path?","hypothesis":"Wayfinder should reproduce ~1.07x at 8192, ~1.07x at 32768, and ~1.01x at 65536 vs dense, consistent with the prior run.","command":"python scripts/bench_qwen35_cuda_wayfinder.py --model-path /home/hmbown/HF_Models/Qwen3.5-27B-FP8 --seq-lens 8192 32768 65536 --warmup 2 --repeats 3 --quantize none --path block_sparse --engine triton --block-size 128 --phases wayfinder dense --skip-divergence --forward-target backbone --output benchmarks/cuda/qwen35_wayfinder/EXP-20260321T220000Z-QWEN27B-FP8-PREFILL-PAIR.ndjson","controls":{"model":"Qwen3.5-27B-FP8","path":"block_sparse","engine":"triton","block_size":128,"forward_target":"backbone","baselines":["EXP-20260321T172541Z-QWEN27B-FP8-SCALE","EXP-20260321T003052Z-QWEN35CUDA-TRITON-SCALE-9B","EXP-20260321T061023Z-QWEN35A3B-FP8-SCALE"],"scope":"prefill_only","custom_kernels":false},"metrics":{"status":"pending"},"decision":"pending"}
{"id":"EXP-20260321T220000Z-QWEN27B-FP8-PREFILL-65536-STABILITY-PRERUN","date":"2026-03-21","question":"Is the 27B FP8 prefill speedup at 65536 stable under deeper repeats (5)?","hypothesis":"The prior 1.01x at 65536 may be noise; deeper repeats should clarify.","command":"python scripts/bench_qwen35_cuda_wayfinder.py --model-path /home/hmbown/HF_Models/Qwen3.5-27B-FP8 --seq-lens 65536 --warmup 2 --repeats 5 --quantize none --path block_sparse --engine triton --block-size 128 --phases wayfinder dense --skip-divergence --forward-target backbone --output benchmarks/cuda/qwen35_wayfinder/EXP-20260321T220000Z-QWEN27B-FP8-PREFILL-65536-STABILITY.ndjson","controls":{"model":"Qwen3.5-27B-FP8","scope":"prefill_only","custom_kernels":false},"metrics":{"status":"pending"},"decision":"pending"}
{"id":"EXP-20260321T220000Z-QWEN27B-FP8-PREFILL-BOUNDARY-PRERUN","date":"2026-03-21","question":"What is the highest stable prefill length below the known 131072 failure boundary?","hypothesis":"The failure at 131072 may be a sharp VRAM cliff. Probing at 81920-131072 should identify the exact boundary.","command":"fresh-process single-rung probes at 81920, 98304, 114688, 122880, 126976, 131072; dense first then wayfinder","controls":{"model":"Qwen3.5-27B-FP8","scope":"prefill_only","custom_kernels":false,"method":"fresh-process per rung, dense first, stop on failure"},"metrics":{"status":"pending"},"decision":"pending"}
{"id":"EXP-20260321T220000Z-QWEN27B-FP8-PREFILL-PAIR-RESULT","date":"2026-03-21","question":"Does the 27B FP8 paired prefill speedup reproduce cleanly at 8192/32768/65536 using the stable block_sparse+triton path?","hypothesis":"Wayfinder should reproduce ~1.07x at 8192, ~1.07x at 32768, and ~1.01x at 65536 vs dense.","command":"python scripts/bench_qwen35_cuda_wayfinder.py --model-path /home/hmbown/HF_Models/Qwen3.5-27B-FP8 --seq-lens 8192 32768 65536 --warmup 2 --repeats 3 --quantize none --path block_sparse --engine triton --block-size 128 --phases wayfinder dense --skip-divergence --forward-target backbone --output benchmarks/cuda/qwen35_wayfinder/EXP-20260321T220000Z-QWEN27B-FP8-PREFILL-PAIR.ndjson","controls":{"model":"Qwen3.5-27B-FP8","path":"block_sparse","engine":"triton","block_size":128,"forward_target":"backbone","scope":"prefill_only","custom_kernels":false},"metrics":{"status":"success","artifact":"benchmarks/cuda/qwen35_wayfinder/EXP-20260321T220000Z-QWEN27B-FP8-PREFILL-PAIR.ndjson","results":{"8192":{"dense_tok_per_sec":416.4,"wf_tok_per_sec":391.5,"speedup":0.94,"dense_peak_gb":30.78,"wf_peak_gb":30.78},"32768":{"dense_tok_per_sec":413.6,"wf_tok_per_sec":428.5,"speedup":1.04,"dense_peak_gb":38.16,"wf_peak_gb":38.16},"65536":{"dense_tok_per_sec":396.8,"wf_tok_per_sec":421.7,"speedup":1.06,"dense_peak_gb":48.0,"wf_peak_gb":48.01}}},"decision":"keep"}
{"id":"EXP-20260321T220000Z-QWEN27B-FP8-PREFILL-65536-STABILITY-RESULT","date":"2026-03-21","question":"Is the 27B FP8 prefill speedup at 65536 stable under deeper repeats (5)?","hypothesis":"The prior 1.01x at 65536 may be noise; deeper repeats should clarify.","command":"python scripts/bench_qwen35_cuda_wayfinder.py --model-path /home/hmbown/HF_Models/Qwen3.5-27B-FP8 --seq-lens 65536 --warmup 2 --repeats 5 --quantize none --path block_sparse --engine triton --block-size 128 --phases wayfinder dense --skip-divergence --forward-target backbone --output benchmarks/cuda/qwen35_wayfinder/EXP-20260321T220000Z-QWEN27B-FP8-PREFILL-65536-STABILITY.ndjson","controls":{"model":"Qwen3.5-27B-FP8","scope":"prefill_only","custom_kernels":false},"metrics":{"status":"success","artifact":"benchmarks/cuda/qwen35_wayfinder/EXP-20260321T220000Z-QWEN27B-FP8-PREFILL-65536-STABILITY.ndjson","dense_tok_per_sec":404.9,"wf_tok_per_sec":434.5,"speedup":1.07,"dense_median_ms":161863.5,"wf_median_ms":150820.9,"peak_gb":48.0},"decision":"keep"}
{"id":"EXP-20260321T220000Z-QWEN27B-FP8-PREFILL-BOUNDARY-RESULT","date":"2026-03-21","question":"What is the highest stable prefill length below the known 131072 failure boundary?","hypothesis":"The failure at 131072 may be a sharp VRAM cliff.","command":"fresh-process single-rung probes","controls":{"model":"Qwen3.5-27B-FP8","scope":"prefill_only","custom_kernels":false},"metrics":{"status":"success","highest_stable_T":122880,"failure_boundary":"122880→124928 (2048 tokens)","failure_type":"CUDA illegal memory access (base-path, not Wayfinder-specific)","scaling_table":[{"T":8192,"dense":416.4,"wf":391.5,"speedup":0.94},{"T":32768,"dense":413.6,"wf":428.5,"speedup":1.04},{"T":65536,"dense":396.8,"wf":421.7,"speedup":1.06},{"T":81920,"dense":390.2,"wf":426.4,"speedup":1.09},{"T":98304,"dense":377.1,"wf":413.0,"speedup":1.10},{"T":114688,"dense":364.6,"wf":401.7,"speedup":1.10},{"T":122880,"dense":363.7,"wf":408.0,"speedup":1.12}],"peak_speedup":"1.12x at T=122880","speedup_trend":"monotonically increasing with T"},"decision":"keep","next_action":"Investigate 122880→124928 CUDA cliff (likely PyTorch/sm_121 internal limit, not memory)"}
