{"id":"EXP-20260212T150726Z-GLM-THREE-MODE-CLEANUP-PRERUN","date":"2026-02-12","question":"After mode-surface cleanup, do dense|wayfinder|sparse runs produce a direct, truthful comparison under fixed controls with explicit fallback reporting?","hypothesis":"Dense remains no-swap baseline, sparse uses explicit sparse path, and wayfinder defaults to true HSA decode path (local-tail shortcut OFF unless debug-enabled), enabling clean 3-mode comparison.","change_set":["scripts/bench_glm_consumer_mlx.py:649 canonical --mode dense|wayfinder|sparse + debug namespace","hcsa/integrations/glm_mlx.py:51 config path normalization for wayfinder alias","hcsa/integrations/glm_mlx.py:379 profile labels report wayfinder_*|sparse_* fallback paths"],"command":"Run scripts/bench_glm_consumer_mlx.py for modes {dense,wayfinder,sparse} and seeds {42,7,99} with fixed controls (model=mlx-community/GLM-4.7-Flash-4bit, seq_len=8192, decode_len=64, chunk_size=4096, kv_step=4096, window=64, head_chunk_size=2, query_chunk_size=192), then aggregate 6-task + held-out drifts vs dense.","controls":{"run_root":"benchmarks/mlx/post_reboot_20260211_20260211T202821Z/mode3_cleanup_20260212T150726Z","fixed":{"model":"mlx-community/GLM-4.7-Flash-4bit","seq_len":8192,"decode_len":64,"chunk_size":4096,"kv_step":4096,"window":64,"head_chunk_size":2,"query_chunk_size":192,"seeds":[42,7,99],"retro_backfill_default_inference_off":true},"modes":["dense","wayfinder","sparse"],"datasets":{"six_task":"benchmarks/mlx/glm_4_7_flash_4bit_wayfinder/quality_eval_glm47_consumer_v1.json","heldout":"benchmarks/mlx/glm_4_7_flash_4bit_wayfinder/quality_eval_glm47_consumer_extract_holdout_v1.json"}},"metrics":{"status":"pending","required":["decode_tok_s_abs","decode_delta_vs_dense_abs","decode_delta_vs_dense_pct","peak_memory_bytes_abs","peak_memory_delta_vs_dense_abs","peak_memory_delta_vs_dense_pct","six_task_drift_vs_dense_abs","heldout_drift_vs_dense_abs"]},"decision":"pending","next_action":"Execute matrix, write summary artifacts, and append RESULT entry with acceptance verdict."}
{"id":"EXP-20260212T150726Z-GLM-THREE-MODE-CLEANUP-RESULT","date":"2026-02-12","question":"After mode-surface cleanup, do dense|wayfinder|sparse runs produce a direct, truthful comparison under fixed controls with explicit fallback reporting?","hypothesis":"Dense remains no-swap baseline, sparse remains explicit sparse path, and wayfinder defaults to true HSA decode path (no local-tail shortcut unless debug-enabled).","change_set":["scripts/bench_glm_consumer_mlx.py:649 mode resolver enforces dense|wayfinder|sparse primary contract","scripts/bench_glm_consumer_mlx.py:681 adds --mode {dense,wayfinder,sparse} primary selector","scripts/bench_glm_consumer_mlx.py:702 moves experimental routing knobs under --debug-*","scripts/bench_glm_consumer_mlx.py:875 writes canonical mode to results payload","hcsa/integrations/glm_mlx.py:53 path alias normalization (wayfinder->permute)","hcsa/integrations/glm_mlx.py:177 separates internal path from reported mode labels","hcsa/integrations/glm_mlx.py:384 reports fallback paths with wayfinder_* labels"],"command":"Executed full matrix with scripts/bench_glm_consumer_mlx.py across modes {dense,wayfinder,sparse} and seeds {42,7,99} for six-task + held-out under fixed controls (model=mlx-community/GLM-4.7-Flash-4bit, seq_len=8192, decode_len=64, chunk_size=4096, kv_step=4096, window=64, head_chunk_size=2, query_chunk_size=192); aggregated to mode3_summary.json and mode3_summary_table.md.","controls":{"run_root":"benchmarks/mlx/post_reboot_20260211_20260211T202821Z/mode3_cleanup_20260212T150726Z","fixed":{"model":"mlx-community/GLM-4.7-Flash-4bit","seq_len":8192,"decode_len":64,"chunk_size":4096,"kv_step":4096,"window":64,"head_chunk_size":2,"query_chunk_size":192,"seeds":[42,7,99],"retro_backfill_default_inference_off":true},"modes":["dense","wayfinder","sparse"],"datasets":{"six_task":"benchmarks/mlx/glm_4_7_flash_4bit_wayfinder/quality_eval_glm47_consumer_v1.json","heldout":"benchmarks/mlx/glm_4_7_flash_4bit_wayfinder/quality_eval_glm47_consumer_extract_holdout_v1.json"}},"metrics":{"artifacts":["benchmarks/mlx/post_reboot_20260211_20260211T202821Z/mode3_cleanup_20260212T150726Z/mode3_summary.json","benchmarks/mlx/post_reboot_20260211_20260211T202821Z/mode3_cleanup_20260212T150726Z/mode3_summary_table.md","benchmarks/mlx/post_reboot_20260211_20260211T202821Z/mode3_cleanup_20260212T150726Z/mode3_gate_verdict.json","benchmarks/mlx/post_reboot_20260211_20260211T202821Z/mode3_cleanup_20260212T150726Z/diagnostics/wayfinder_trace_s42/results.json"],"dense":{"decode_tok_s_abs":46.36765008575196,"peak_memory_bytes_abs":20660500140.0,"six_task_accuracy_abs":0.5,"heldout_accuracy_abs":0.125},"wayfinder":{"decode_tok_s_abs":26.807927690618367,"decode_delta_vs_dense_abs":-19.559722395133594,"decode_delta_vs_dense_pct":-42.18398465085033,"peak_memory_bytes_abs":20668045724.0,"peak_memory_delta_vs_dense_abs":7545584.0,"peak_memory_delta_vs_dense_pct":0.036521787705377395,"memory_reduction_pct":-0.03652178770536807,"six_task_accuracy_abs":0.05555555555555555,"six_task_drift_vs_dense_abs":-0.4444444444444444,"six_task_drift_vs_dense_pct":-88.88888888888889,"heldout_accuracy_abs":0.0,"heldout_drift_vs_dense_abs":-0.125,"heldout_drift_vs_dense_pct":-100.0},"sparse":{"decode_tok_s_abs":46.45525253351408,"decode_delta_vs_dense_abs":0.08760244776211579,"decode_delta_vs_dense_pct":0.18893010018861106,"peak_memory_bytes_abs":33502935292.0,"peak_memory_delta_vs_dense_abs":12842435152.0,"peak_memory_delta_vs_dense_pct":62.15936238221192,"memory_reduction_pct":-62.15936238221191,"six_task_accuracy_abs":0.5,"six_task_drift_vs_dense_abs":0.0,"six_task_drift_vs_dense_pct":0.0,"heldout_accuracy_abs":0.05555555555555555,"heldout_drift_vs_dense_abs":-0.06944444444444445,"heldout_drift_vs_dense_pct":-55.55555555555556},"wayfinder_path_trace":{"path_counts":{"wayfinder":17,"wayfinder_dense_fallback":1},"dense_fallback_reason_counts":{"active_large_q":1},"local_tail_path_observed":false}},"decision":"follow-up","next_action":"Keep 3-mode contract and debug namespace cleanup; investigate wayfinder quality/throughput regression under fixed controls now that decode path semantics are explicitly traceable."}
{"id":"EXP-20260212T170900Z-WAYFINDER-DECODE-DENSE-PRERUN","date":"2026-02-12","question":"Can routing wayfinder active decode to dense SDPA restore quality to sparse/dense levels while preserving fast permute prefill?","hypothesis":"Permute-active decode path produces incorrect attention for q_len=1 causing 0.056 six-task accuracy. Dense SDPA decode should restore quality (>=0.40 six-task, >=0.04 held-out) and improve decode throughput (>=40 tok/s) while keeping permute prefill.","change_set":["hcsa/integrations/glm_mlx.py: add wayfinder_decode_backend config (default dense)","hcsa/integrations/glm_mlx.py: add force_dense_wayfinder_decode condition in __call__","hcsa/integrations/glm_mlx.py: update profile notes with wayfinder_decode_dense_triggered","scripts/bench_glm_consumer_mlx.py: add --debug-wayfinder-decode-backend toggle"],"command":"Full 3-seed x 3-mode x 2-dataset matrix with fixed controls","controls":{"model":"mlx-community/GLM-4.7-Flash-4bit","seq_len":8192,"decode_len":64,"chunk_size":4096,"kv_step":4096,"window":64,"head_chunk_size":2,"query_chunk_size":192,"seeds":[42,7,99],"modes":["dense","wayfinder","sparse"],"datasets":{"six_task":"benchmarks/mlx/glm_4_7_flash_4bit_wayfinder/quality_eval_glm47_consumer_v1.json","heldout":"benchmarks/mlx/glm_4_7_flash_4bit_wayfinder/quality_eval_glm47_consumer_extract_holdout_v1.json"},"baseline":"benchmarks/mlx/post_reboot_20260211_20260211T202821Z/mode3_cleanup_20260212T150726Z"},"metrics":{"status":"pending","gates":{"G1":"wayfinder 6-task acc mean >= 0.40","G2":"wayfinder held-out acc mean >= 0.04","G3":"wayfinder decode tok/s median >= 40","G4":"wayfinder peak mem delta vs dense <= 5%","G5":"dense and sparse unchanged within 5% of baseline"}},"decision":"pending","next_action":"implement code change, run matrix, aggregate"}
{"id":"EXP-20260212T170900Z-WAYFINDER-DECODE-DENSE-RESULT","date":"2026-02-12","question":"Can routing wayfinder active decode to dense SDPA restore quality to sparse/dense levels while preserving fast permute prefill?","hypothesis":"Dense SDPA decode should restore quality and improve decode throughput.","change_set":["hcsa/integrations/glm_mlx.py:84 wayfinder_decode_backend config field","hcsa/integrations/glm_mlx.py:374-383 force_dense_wayfinder_decode dispatch","scripts/bench_glm_consumer_mlx.py:730 --debug-wayfinder-decode-backend toggle"],"command":"Full 3-seed x 3-mode x 2-dataset matrix via scripts/_run_decode_dense_matrix.sh","controls":{"model":"mlx-community/GLM-4.7-Flash-4bit","seq_len":8192,"decode_len":64,"chunk_size":4096,"kv_step":4096,"window":64,"head_chunk_size":2,"query_chunk_size":192,"seeds":[42,7,99],"baseline":"benchmarks/mlx/post_reboot_20260211_20260211T202821Z/mode3_cleanup_20260212T150726Z"},"metrics":{"run_root":"benchmarks/mlx/post_reboot_20260211_20260211T202821Z/decode_dense_backend_20260212T171140Z","dense":{"decode_tok_s":46.3356,"peak_memory_bytes":20660500140,"six_task_accuracy":0.5,"heldout_accuracy":0.125},"wayfinder":{"decode_tok_s":44.394,"decode_delta_vs_dense_pct":-4.19,"peak_memory_bytes":20663941532,"peak_memory_delta_vs_dense_pct":0.02,"six_task_accuracy":0.5,"six_task_drift_vs_dense_pct":0.0,"heldout_accuracy":0.125,"heldout_drift_vs_dense_pct":0.0},"sparse":{"decode_tok_s":45.4164,"decode_delta_vs_dense_pct":-1.98,"peak_memory_bytes":33502935304,"peak_memory_delta_vs_dense_pct":62.16,"six_task_accuracy":0.5,"six_task_drift_vs_dense_pct":0.0,"heldout_accuracy":0.0556,"heldout_drift_vs_dense_pct":-55.56},"wayfinder_vs_baseline":{"decode_tok_s_before":26.8079,"decode_tok_s_after":44.394,"decode_delta_pct":65.6,"six_task_before":0.0556,"six_task_after":0.5,"heldout_before":0.0,"heldout_after":0.125},"gates_all_pass":true},"decision":"keep","next_action":"This becomes new default wayfinder decode behavior. Next: investigate permute-active decode bug."}
{"id":"EXP-20260212T182820Z-SPARSE-FIDELITY-QWEN-PORT-PRERUN","date":"2026-02-12","question":"Does sparse mode stay truly sparse for q_len<k_len in GLM/Qwen, and do Qwen wayfinder/sparse prefill smoke benchmarks run cleanly for direct comparison?","hypothesis":"An active sparse gather path keyed by query positions will eliminate dense fallback for sparse active calls in both integrations while preserving existing dense/wayfinder semantics.","change_set":["hcsa/mlx/attention.py add sparse_gather_attention_active()","hcsa/integrations/glm_mlx.py route sparse q_len<k_len through active sparse path","hcsa/integrations/qwen_mlx.py route sparse q_len<k_len through active sparse path","tests/mlx/test_glm_hamiltonian_e2e.py add sparse no-dense-fallback coverage","tests/mlx/test_qwen_sparse_decode.py add qwen sparse decode coverage"],"command":"python3 -m pytest tests/mlx/test_glm_hamiltonian_e2e.py -q && python3 -m pytest tests/mlx/test_qwen_sparse_decode.py -q && python3 -m pytest tests/mlx/test_k4_active_row.py -q && python3 scripts/bench_qwen_wayfinder_mlx.py --model-path mlx-community/Qwen3-1.7B-4bit --seq-lens 1024 --batch 1 --warmup 1 --iters 1 --dtype bfloat16 --path permute --window 64 --landmark-stride 64 --num-cycles 1 --seed 42 --out-dir benchmarks/mlx/qwen3_1_7b_sparse_fidelity_20260212T182820Z/permute_prefill_smoke && python3 scripts/bench_qwen_wayfinder_mlx.py --model-path mlx-community/Qwen3-1.7B-4bit --seq-lens 1024 --batch 1 --warmup 1 --iters 1 --dtype bfloat16 --path sparse --window 64 --landmark-stride 64 --num-cycles 1 --seed 42 --out-dir benchmarks/mlx/qwen3_1_7b_sparse_fidelity_20260212T182820Z/sparse_prefill_smoke","controls":{"model":"mlx-community/Qwen3-1.7B-4bit","seq_len":1024,"batch":1,"warmup":1,"iters":1,"dtype":"bfloat16","window":64,"landmark_stride":64,"num_cycles":1,"seed":42,"retro_backfill_default_inference_off":true,"baseline_source":"dense baseline_attention from each qwen benchmark artifact"},"metrics":{"status":"pending","required":["pytest_pass_status","qwen_permute_baseline_latency_ms","qwen_permute_wayfinder_latency_ms","qwen_sparse_baseline_latency_ms","qwen_sparse_wayfinder_latency_ms","qwen_sparse_path_profile_flags","delta_vs_baseline_abs","delta_vs_baseline_pct"]},"decision":"pending","next_action":"Execute validation/benchmark commands, extract deltas, and append RESULT entry with keep/revert/follow-up."}
{"id":"EXP-20260212T182820Z-SPARSE-FIDELITY-QWEN-PORT-RESULT","date":"2026-02-12","question":"Does sparse mode stay truly sparse for q_len<k_len in GLM/Qwen, and do Qwen wayfinder/sparse prefill smoke benchmarks run cleanly for direct comparison?","hypothesis":"An active sparse gather path keyed by query positions will eliminate dense fallback for sparse active calls in both integrations while preserving existing dense/wayfinder semantics.","change_set":["hcsa/mlx/attention.py:408 add sparse_gather_attention_active()","hcsa/integrations/glm_mlx.py:356-390,547-723 route sparse q_len<k_len through active sparse path","hcsa/integrations/qwen_mlx.py:794-798,871-987 route sparse q_len<k_len through active sparse path","tests/mlx/test_glm_hamiltonian_e2e.py:262-295 add sparse integration coverage","tests/mlx/test_qwen_sparse_decode.py:77-104 add qwen sparse integration coverage"],"command":"Executed the PRERUN command bundle plus a Qwen sparse profile probe (`python3 - <<'PY' ...`)","controls":{"model":"mlx-community/Qwen3-1.7B-4bit","seq_len":1024,"batch":1,"warmup":1,"iters":1,"dtype":"bfloat16","window":64,"landmark_stride":64,"num_cycles":1,"seed":42,"baseline_run_path":"benchmarks/mlx/qwen3_1_7b_sparse_fidelity_20260212T182820Z/permute_prefill_smoke/results.json","retro_backfill_default_inference_off":true},"metrics":{"artifacts":["benchmarks/mlx/qwen3_1_7b_sparse_fidelity_20260212T182820Z/permute_prefill_smoke/results.json","benchmarks/mlx/qwen3_1_7b_sparse_fidelity_20260212T182820Z/sparse_prefill_smoke/results.json","benchmarks/mlx/qwen3_1_7b_sparse_fidelity_20260212T182820Z/prefill_smoke_summary.json","benchmarks/mlx/qwen3_1_7b_sparse_fidelity_20260212T182820Z/prefill_smoke_summary.md"],"tests":{"test_glm_hamiltonian_e2e":"pass","test_qwen_sparse_decode":"pass","test_k4_active_row":"pass"},"baseline":{"latency_ms_abs":4.5483330031856894,"tokens_per_sec_abs":225137.42931372483,"peak_memory_bytes_abs":34341416},"wayfinder":{"latency_ms_abs":4.4060000000172295,"latency_ms_delta_vs_baseline_abs":-0.14233300316845998,"latency_ms_delta_vs_baseline_pct":-3.1293443788915365,"tokens_per_sec_abs":232410.34952246837,"tokens_per_sec_delta_vs_baseline_abs":7272.920208743541,"tokens_per_sec_delta_vs_baseline_pct":3.2304358413051175,"peak_memory_bytes_abs":76097620,"peak_memory_bytes_delta_vs_baseline_abs":41756204,"peak_memory_bytes_delta_vs_baseline_pct":121.59138691310807,"memory_reduction_pct_convention":-121.59138691310804},"sparse":{"latency_ms_abs":39.483291999204084,"latency_ms_delta_vs_baseline_abs":34.934958996018395,"latency_ms_delta_vs_baseline_pct":768.0827013226531,"tokens_per_sec_abs":25935.02081894899,"tokens_per_sec_delta_vs_baseline_abs":-199202.40849477585,"tokens_per_sec_delta_vs_baseline_pct":-88.48036024129554,"peak_memory_bytes_abs":1778156724,"peak_memory_bytes_delta_vs_baseline_abs":1743815308,"peak_memory_bytes_delta_vs_baseline_pct":5077.878291331959,"memory_reduction_pct_convention":-5077.878291331959},"sparse_decode_probe":{"path":"sparse","sparse_active_mode":true,"active_query_mode":true,"q_len":1}},"decision":"keep","next_action":"Build a Qwen consumer-style dense/wayfinder/sparse decode+quality harness with trace summaries to complete full Task-4 parity with GLM benchmarking."}
{"id":"EXP-20260212T183630Z-QWEN-CONSUMER-HARNESS-PRERUN","date":"2026-02-12","question":"Does scripts/bench_qwen_consumer_mlx.py provide end-to-end dense/wayfinder/sparse consumer parity (decode + quality + HSA trace) with stable artifacts?","hypothesis":"All three modes will run successfully at smoke settings and emit single_turn/quality metrics; swapped modes will emit HSA trace summaries and sparse mode will avoid dense fallback in active decode.","change_set":["scripts/bench_qwen_consumer_mlx.py (new)","benchmarks/mlx/qwen3_1_7b_wayfinder/quality_eval_qwen3_consumer_v1.json (new)"],"command":"python3 scripts/bench_qwen_consumer_mlx.py --mode dense ... && python3 scripts/bench_qwen_consumer_mlx.py --mode wayfinder ... --hsa-trace ... && python3 scripts/bench_qwen_consumer_mlx.py --mode sparse ... --hsa-trace ...","controls":{"model":"mlx-community/Qwen3-1.7B-4bit","seq_len":512,"decode_len":16,"repeats":1,"chunk_size":256,"kv_step":256,"quality_task_id_filter":"extract-01","baseline":"benchmarks/mlx/qwen3_1_7b_wayfinder/consumer_smoke_20260212T183630Z/dense/results.json","retro_backfill_default_inference_off":true},"metrics":{"status":"pending","required":["single_turn.prefill_sec","single_turn.decode_sec","single_turn.decode_tok_s","single_turn.ttft_sec","single_turn.itl_p95_sec","single_turn.peak_memory_bytes","quality.correct","quality.num_tasks","quality.accuracy","hsa_trace_summary.path_counts","delta_vs_dense_abs","delta_vs_dense_pct"]},"decision":"pending","next_action":"Execute smoke matrix and append RESULT entry with deltas vs dense baseline."}
{"id":"EXP-20260212T183630Z-QWEN-CONSUMER-HARNESS-RESULT","date":"2026-02-12","question":"Does scripts/bench_qwen_consumer_mlx.py provide end-to-end dense/wayfinder/sparse consumer parity (decode + quality + HSA trace) with stable artifacts?","hypothesis":"All three modes will run successfully at smoke settings and emit single_turn/quality metrics; swapped modes will emit HSA trace summaries and sparse mode will avoid dense fallback in active decode.","change_set":["scripts/bench_qwen_consumer_mlx.py (new)","benchmarks/mlx/qwen3_1_7b_wayfinder/quality_eval_qwen3_consumer_v1.json (new)"],"command":"Executed 3-mode smoke matrix commands under benchmarks/mlx/qwen3_1_7b_wayfinder/consumer_smoke_20260212T183630Z plus summary aggregation to summary.json/summary.md.","controls":{"model":"mlx-community/Qwen3-1.7B-4bit","seq_len":512,"decode_len":16,"repeats":1,"chunk_size":256,"kv_step":256,"quality_task_id_filter":"extract-01","baseline":"benchmarks/mlx/qwen3_1_7b_wayfinder/consumer_smoke_20260212T183630Z/dense/results.json","retro_backfill_default_inference_off":true},"metrics":{"artifacts":["benchmarks/mlx/qwen3_1_7b_wayfinder/consumer_smoke_20260212T183630Z/dense/results.json","benchmarks/mlx/qwen3_1_7b_wayfinder/consumer_smoke_20260212T183630Z/wayfinder/results.json","benchmarks/mlx/qwen3_1_7b_wayfinder/consumer_smoke_20260212T183630Z/sparse/results.json","benchmarks/mlx/qwen3_1_7b_wayfinder/consumer_smoke_20260212T183630Z/summary.json"],"dense":{"prefill_sec_abs":0.18587224999646423,"decode_sec_abs":0.07933325000340119,"decode_tok_s_abs":201.68088410992925,"ttft_sec_abs":0.006123958999523893,"itl_p95_sec_abs":0.004913666001812089,"peak_memory_bytes_abs":1480446224,"quality_accuracy_abs":0.0},"wayfinder":{"prefill_sec_abs":0.19514333299594,"prefill_sec_delta_vs_dense_abs":0.009271082999475766,"prefill_sec_delta_vs_dense_pct":4.987879040390443,"decode_sec_abs":0.08110441700409865,"decode_sec_delta_vs_dense_abs":0.00177116700069746,"decode_sec_delta_vs_dense_pct":2.2325657912937213,"decode_tok_s_abs":197.2765552237609,"decode_tok_s_delta_vs_dense_abs":-4.404328886168344,"decode_tok_s_delta_vs_dense_pct":-2.1838107788974668,"ttft_sec_abs":0.006218874994374346,"ttft_sec_delta_vs_dense_abs":0.00009491599485045299,"ttft_sec_delta_vs_dense_pct":1.54991231747032,"peak_memory_bytes_abs":1480512208,"peak_memory_bytes_delta_vs_dense_abs":65984,"peak_memory_bytes_delta_vs_dense_pct":0.004457034570409361,"memory_reduction_pct_convention":-0.0044570345704153524,"quality_accuracy_abs":0.0,"quality_accuracy_delta_vs_dense_abs":0.0,"hsa_trace_path_counts":{"permute":4,"permute_dense_fallback":36}},"sparse":{"prefill_sec_abs":0.561546917000669,"prefill_sec_delta_vs_dense_abs":0.3756746670042048,"prefill_sec_delta_vs_dense_pct":202.1144452769852,"decode_sec_abs":0.6929625420016237,"decode_sec_delta_vs_dense_abs":0.6136292919982225,"decode_sec_delta_vs_dense_pct":773.4831132871965,"decode_tok_s_abs":23.08927110805148,"decode_tok_s_delta_vs_dense_abs":-178.59161300187776,"decode_tok_s_delta_vs_dense_pct":-88.55158176742903,"ttft_sec_abs":0.04650570800004061,"ttft_sec_delta_vs_dense_abs":0.04038174900051672,"ttft_sec_delta_vs_dense_pct":659.4059333783292,"peak_memory_bytes_abs":1835012772,"peak_memory_bytes_delta_vs_dense_abs":354566548,"peak_memory_bytes_delta_vs_dense_pct":23.9499782060304,"memory_reduction_pct_convention":-23.949978206030398,"quality_accuracy_abs":0.0,"quality_accuracy_delta_vs_dense_abs":0.0,"hsa_trace_path_counts":{"sparse":40}}},"decision":"keep","next_action":"Run full 8192-context dense/wayfinder/sparse matrix with six-task quality and summarize deltas vs dense using scripts/bench_qwen_consumer_mlx.py."}
