{"id":"EXP-20260220T020000Z-QWEN30B-T8192-PREFILL-TUNING-PRERUN","date":"2026-02-20","question":"Can landmark and chunk-size tuning recover T=8192 prefill enough to beat dense e2e for Qwen3-30B Wayfinder with dense decode backend?","hypothesis":"landmark_stride=0 and smaller query_chunk_size should reduce prefill overhead and improve e2e vs prior wayfinder run.","change_set":["measurement-only"],"command":"HF_HOME=/Volumes/VIXinSSD/hf_cache HF_HUB_CACHE=/Volumes/VIXinSSD/hf_cache/hub HF_HUB_OFFLINE=1 python3 scripts/bench_qwen_consumer_mlx.py --model-path mlx-community/Qwen3-30B-A3B-4bit --mode wayfinder --debug-wayfinder-decode-backend dense --seq-lens 8192 --decode-len 32 --repeats 1 --chunk-size 4096 --kv-step 4096 --cooldown-sec 0 --window 64 --landmark-stride 0 --num-cycles 1 --head-chunk-size 2 --query-chunk-size 384 --seed 42 --skip-multi-turn --skip-quality --hf-home /Volumes/VIXinSSD/hf_cache --hf-hub-cache /Volumes/VIXinSSD/hf_cache/hub --hf-offline --out-dir benchmarks/mlx/qwen3_moe_wayfinder/EXP-20260220T020000Z-QWEN30B-T8192-PREFILL-TUNING/ls0_q384 && HF_HOME=/Volumes/VIXinSSD/hf_cache HF_HUB_CACHE=/Volumes/VIXinSSD/hf_cache/hub HF_HUB_OFFLINE=1 python3 scripts/bench_qwen_consumer_mlx.py --model-path mlx-community/Qwen3-30B-A3B-4bit --mode wayfinder --debug-wayfinder-decode-backend dense --seq-lens 8192 --decode-len 32 --repeats 1 --chunk-size 4096 --kv-step 4096 --cooldown-sec 0 --window 64 --landmark-stride 0 --num-cycles 1 --head-chunk-size 2 --query-chunk-size 192 --seed 42 --skip-multi-turn --skip-quality --hf-home /Volumes/VIXinSSD/hf_cache --hf-hub-cache /Volumes/VIXinSSD/hf_cache/hub --hf-offline --out-dir benchmarks/mlx/qwen3_moe_wayfinder/EXP-20260220T020000Z-QWEN30B-T8192-PREFILL-TUNING/ls0_q192","controls":{"baseline_run_path":"benchmarks/mlx/qwen3_moe_wayfinder/EXP-20260220T010000Z-QWEN30B-GLM-PARITY-T8192/dense_t8192_s42/results.json","one_process_at_a_time":true,"retro_backfill_inference":"off","seed":42,"seq_len":8192,"decode_len":32,"repeats":1,"chunk_size":4096,"kv_step":4096,"window":64,"num_cycles":1,"hf_home":"/Volumes/VIXinSSD/hf_cache","hf_hub_cache":"/Volumes/VIXinSSD/hf_cache/hub","hf_hub_offline":1,"stop_gates":["nonzero exit","missing results.json","missing single_turn[0]","hf_cache mismatch"]},"metrics":{"status":"pending","artifacts_expected":["benchmarks/mlx/qwen3_moe_wayfinder/EXP-20260220T020000Z-QWEN30B-T8192-PREFILL-TUNING/ls0_q384/results.json","benchmarks/mlx/qwen3_moe_wayfinder/EXP-20260220T020000Z-QWEN30B-T8192-PREFILL-TUNING/ls0_q192/results.json"],"required":["single_turn[0].prefill_sec","single_turn[0].decode_sec","single_turn[0].e2e_sec","single_turn[0].decode_tok_s","single_turn[0].peak_memory_bytes","single_turn[0].dense_fallback_share_run","single_turn[0].observability_fallback_share_known","hf_cache.hf_home"]},"decision":"pending","next_action":"Run both variants, compute deltas vs dense baseline and prior wayfinder run, keep best config."}
{"id":"EXP-20260225T170859Z-QWEN35A3B-SETUP-PRERUN","date":"2026-02-25","question":"What exact Wayfinder setup should we use for Qwen3.5-35B-A3B later, given the model is already local and this session must stay no-inference?","hypothesis":"We can fully prepare queue commands, controls, and stop-gates now; queue execution is blocked until mlx-lm supports qwen3_5_moe model loading in this environment.","change_set":["scripts/queue_qwen35_a3b_wayfinder.sh","configs/experiments/qwen3_5_35b_a3b_wayfinder_setup.yaml","docs/QWEN3_5_35B_A3B_SETUP.md"],"command":"python3 -c \"import importlib.metadata; print(importlib.metadata.version('mlx-lm'))\" && python3 scripts/bench_qwen_consumer_mlx.py --help >/dev/null && python3 scripts/bench_qwen_wayfinder_mlx.py --help >/dev/null && bash -n scripts/queue_qwen35_a3b_wayfinder.sh && bash scripts/queue_qwen35_a3b_wayfinder.sh","controls":{"baseline_run_path":null,"one_process_at_a_time":true,"no_inference_mode":true,"retro_backfill_inference":"off","model":"/Volumes/VIXinSSD/models/Qwen3.5-35B-A3B-MLX-4bit","stop_gates":["mlx-lm must be >= 0.30.7 before queue execution","nonzero exit on preflight checks","any benchmark/inference execution in this planning session"]},"metrics":{"status":"pending","artifacts_expected":["configs/experiments/qwen3_5_35b_a3b_wayfinder_setup.yaml","docs/QWEN3_5_35B_A3B_SETUP.md","scripts/queue_qwen35_a3b_wayfinder.sh"],"required":["local model path discovery","loader compatibility verdict","queued commands for dense/wayfinder at T=2048 and T=8192"]},"decision":"pending","next_action":"Run setup checks, record blocker status, and append RESULT entry without launching model benchmarks."}
{"id":"EXP-20260225T170859Z-QWEN35A3B-SETUP-RESULT","date":"2026-02-25","question":"What exact Wayfinder setup should we use for Qwen3.5-35B-A3B later, given the model is already local and this session must stay no-inference?","hypothesis":"We can fully prepare queue commands, controls, and stop-gates now; queue execution is blocked until mlx-lm supports qwen3_5_moe model loading in this environment.","change_set":["scripts/queue_qwen35_a3b_wayfinder.sh","configs/experiments/qwen3_5_35b_a3b_wayfinder_setup.yaml","docs/QWEN3_5_35B_A3B_SETUP.md","notes/LAB_NOTEBOOK.md","notes/experiments.ndjson"],"command":"python3 -c \"import importlib.metadata; print(importlib.metadata.version('mlx-lm'))\" && python3 scripts/bench_qwen_consumer_mlx.py --help >/dev/null && python3 scripts/bench_qwen_wayfinder_mlx.py --help >/dev/null && bash -n scripts/queue_qwen35_a3b_wayfinder.sh && bash scripts/queue_qwen35_a3b_wayfinder.sh","controls":{"no_inference_mode":true,"one_process_at_a_time":true,"retro_backfill_inference":"off","selected_model_path":"/Volumes/VIXinSSD/models/Qwen3.5-35B-A3B-MLX-4bit","required_mlx_lm_min":"0.30.7"},"metrics":{"local_model_candidates":["/Volumes/VIXinSSD/models/Qwen3.5-35B-A3B-MLX-4bit","/Volumes/VIXinSSD/hf_cache/hub/models--Qwen--Qwen3.5-35B-A3B/snapshots/b1fc3d59ae0ab1e4279e04a8dd0fc4dc361fc2b6","/Volumes/VIXinSSD/hf_cache/hub/models--mlx-community--Qwen3.5-35B-A3B-4bit/snapshots/1e20fd8d42056f870933bf98ca6211024744f7ec"],"selected_model_path":"/Volumes/VIXinSSD/models/Qwen3.5-35B-A3B-MLX-4bit","local_mlx_lm_version":"0.30.5","queue_commands_prepared":4,"compatibility_status":"blocked_until_upgrade","no_inference_commands_run":true},"decision":"follow-up","next_action":"Upgrade mlx-lm to >=0.30.7, then execute scripts/queue_qwen35_a3b_wayfinder.sh --execute in a separate benchmark session and record benchmark RESULT entries."}
{"id":"EXP-20260225T182700Z-QWEN35A3B-COMPAT-RERUN-PRERUN","date":"2026-02-25","question":"After upgrading mlx-lm, does Wayfinder run on Qwen3.5-35B-A3B with the patched Qwen attention integration under single-process inference controls?","hypothesis":"Qwen3.5-compatible head/scale attribute resolution and gated-query handling will remove the prior n_heads failure and allow sequential dense+wayfinder queue stages to execute.","change_set":["hcsa/integrations/qwen_mlx.py","scripts/bench_qwen_wayfinder_mlx.py"],"command":"python3 -m py_compile hcsa/integrations/qwen_mlx.py scripts/bench_qwen_wayfinder_mlx.py && python3 -m pytest -q tests/mlx/test_qwen_wayfinder_active_decode.py && bash scripts/queue_qwen35_a3b_wayfinder.sh --execute --run-id EXP-20260225T182700Z-QWEN35A3B-COMPAT-RERUN","controls":{"model_path":"/Volumes/VIXinSSD/models/Qwen3.5-35B-A3B-MLX-4bit","one_process_at_a_time":true,"retro_backfill_inference":"off","baseline_failed_stage":"benchmarks/mlx/qwen3_5_35b_a3b_wayfinder/EXP-20260225T171900Z-QWEN35A3B-CONSUMER-QUEUE/t2048/wayfinder","stop_gates":["nonzero exit","missing results.json","concurrent inference process detected"]},"metrics":{"status":"pending","artifacts_expected":["benchmarks/mlx/qwen3_5_35b_a3b_wayfinder/EXP-20260225T182700Z-QWEN35A3B-COMPAT-RERUN/t2048/dense/results.json","benchmarks/mlx/qwen3_5_35b_a3b_wayfinder/EXP-20260225T182700Z-QWEN35A3B-COMPAT-RERUN/t2048/wayfinder/results.json","benchmarks/mlx/qwen3_5_35b_a3b_wayfinder/EXP-20260225T182700Z-QWEN35A3B-COMPAT-RERUN/t8192/dense/results.json","benchmarks/mlx/qwen3_5_35b_a3b_wayfinder/EXP-20260225T182700Z-QWEN35A3B-COMPAT-RERUN/t8192/wayfinder/results.json"]},"decision":"pending","next_action":"Run sequential queue, verify each stage artifact, and append RESULT entry with keep/revert/follow-up decision."}
{"id":"EXP-20260225T182700Z-QWEN35A3B-COMPAT-RERUN-RESULT","date":"2026-02-25","question":"After upgrading mlx-lm, does Wayfinder run on Qwen3.5-35B-A3B with the patched Qwen attention integration under single-process inference controls?","hypothesis":"Qwen3.5-compatible head/scale attribute resolution and gated-query handling will remove the prior n_heads failure and allow sequential dense+wayfinder queue stages to execute.","change_set":["hcsa/integrations/qwen_mlx.py","scripts/bench_qwen_wayfinder_mlx.py","notes/LAB_NOTEBOOK.md","notes/experiments.ndjson"],"command":"bash scripts/queue_qwen35_a3b_wayfinder.sh --execute --run-id EXP-20260225T182700Z-QWEN35A3B-COMPAT-RERUN","controls":{"model_path":"/Volumes/VIXinSSD/models/Qwen3.5-35B-A3B-MLX-4bit","one_process_at_a_time":true,"retro_backfill_inference":"off","hf_home":"/Volumes/VIXinSSD/hf_cache","hf_hub_cache":"/Volumes/VIXinSSD/hf_cache/hub","hf_hub_offline":1},"metrics":{"status":"completed","artifacts":["benchmarks/mlx/qwen3_5_35b_a3b_wayfinder/EXP-20260225T182700Z-QWEN35A3B-COMPAT-RERUN/t2048/dense/results.json","benchmarks/mlx/qwen3_5_35b_a3b_wayfinder/EXP-20260225T182700Z-QWEN35A3B-COMPAT-RERUN/t2048/wayfinder/results.json","benchmarks/mlx/qwen3_5_35b_a3b_wayfinder/EXP-20260225T182700Z-QWEN35A3B-COMPAT-RERUN/t8192/dense/results.json","benchmarks/mlx/qwen3_5_35b_a3b_wayfinder/EXP-20260225T182700Z-QWEN35A3B-COMPAT-RERUN/t8192/wayfinder/results.json"],"per_t":{"2048":{"dense":{"prefill_sec":1.9178559160063742,"decode_sec":1.0877034169971012,"e2e_sec":3.0055593330034753,"decode_tok_s":29.419784382349956,"peak_memory_bytes":24935466998},"wayfinder":{"prefill_sec":2.671489832995576,"decode_sec":2.310994166007731,"e2e_sec":4.982483999003307,"decode_tok_s":13.846854514254515,"peak_memory_bytes":24976397290},"delta_wayfinder_minus_dense":{"prefill_sec_abs":0.7536339169892017,"prefill_sec_pct":39.29564836958779,"decode_sec_abs":1.22329074901063,"decode_sec_pct":112.46546897755034,"e2e_sec_abs":1.9769246659998316,"e2e_sec_pct":65.77559937984248,"decode_tok_s_abs":-15.572929868095441,"decode_tok_s_pct":-52.93352821932383,"peak_memory_bytes_abs":40930292,"peak_memory_bytes_pct":0.1641448784708259,"memory_reduction_pct_convention":-0.16414487847082881},"wayfinder_observability":{"path_counts":{"permute":8,"permute_dense_fallback":256},"dense_fallback_reason_counts":{"wayfinder_decode_dense":256},"dense_fallback_share_run":0.9696969696969697,"dense_fallback_share_decode_steps":1.0,"observability_fallback_share_known":true}},"8192":{"dense":{"prefill_sec":12.281659375003073,"decode_sec":2.14880858300603,"e2e_sec":14.430467958009103,"decode_tok_s":14.891973279087653,"peak_memory_bytes":29371883558},"wayfinder":{"prefill_sec":15.320644124993123,"decode_sec":1.845168375002686,"e2e_sec":17.16581249999581,"decode_tok_s":17.34259075405702,"peak_memory_bytes":29373458886},"delta_wayfinder_minus_dense":{"prefill_sec_abs":3.0389847499900497,"prefill_sec_pct":24.74408919185067,"decode_sec_abs":-0.303640208003344,"decode_sec_pct":-14.13063082513255,"e2e_sec_abs":2.7353445419867057,"e2e_sec_pct":18.955341919237988,"decode_tok_s_abs":2.450617474969368,"decode_tok_s_pct":16.455962074621073,"peak_memory_bytes_abs":1575328,"peak_memory_bytes_pct":0.005363387734018607,"memory_reduction_pct_convention":-0.005363387734025338},"wayfinder_observability":{"path_counts":{"permute":8,"permute_dense_fallback":264},"dense_fallback_reason_counts":{"active_large_q":8,"wayfinder_decode_dense":256},"dense_fallback_share_run":0.9705882352941176,"dense_fallback_share_decode_steps":1.0,"observability_fallback_share_known":true}}}},"decision":"follow-up","next_action":"Keep compatibility patch because Qwen3.5 queue now executes end-to-end; tune prefill path and fallback policy before claiming performance wins."}
{"id":"EXP-20260225T183600Z-QWEN35A3B-PREFILL-WFDENSEDECODE-PRERUN","date":"2026-02-25","question":"With decode minimized (decode_len=1), is Wayfinder prefill faster than dense on Qwen3.5-35B-A3B when decode backend is forced to dense?","hypothesis":"Prefill-focused pairing will isolate whether the regression is prefill-specific; if healthy, Wayfinder prefill_sec should be <= dense under identical controls.","change_set":["measurement-only"],"command":"python3 scripts/bench_qwen_consumer_mlx.py --model-path /Volumes/VIXinSSD/models/Qwen3.5-35B-A3B-MLX-4bit --mode dense --seq-lens 8192 --decode-len 1 --repeats 1 --chunk-size 4096 --kv-step 4096 --cooldown-sec 10 --seed 42 --skip-multi-turn --skip-quality --hf-home /Volumes/VIXinSSD/hf_cache --hf-hub-cache /Volumes/VIXinSSD/hf_cache/hub --hf-offline --out-dir benchmarks/mlx/qwen3_5_35b_a3b_wayfinder/EXP-20260225T183600Z-QWEN35A3B-PREFILL-WFDENSEDECODE/dense_t8192_d1_s42 && python3 scripts/bench_qwen_consumer_mlx.py --model-path /Volumes/VIXinSSD/models/Qwen3.5-35B-A3B-MLX-4bit --mode wayfinder --debug-wayfinder-decode-backend dense --seq-lens 8192 --decode-len 1 --repeats 1 --chunk-size 4096 --kv-step 4096 --cooldown-sec 10 --window 64 --landmark-stride 64 --num-cycles 1 --head-chunk-size 2 --query-chunk-size 384 --seed 42 --skip-multi-turn --skip-quality --hf-home /Volumes/VIXinSSD/hf_cache --hf-hub-cache /Volumes/VIXinSSD/hf_cache/hub --hf-offline --out-dir benchmarks/mlx/qwen3_5_35b_a3b_wayfinder/EXP-20260225T183600Z-QWEN35A3B-PREFILL-WFDENSEDECODE/wayfinder_dense_decode_t8192_d1_s42","controls":{"one_process_at_a_time":true,"model_path":"/Volumes/VIXinSSD/models/Qwen3.5-35B-A3B-MLX-4bit","seq_len":8192,"decode_len":1,"repeats":1,"seed":42,"hf_home":"/Volumes/VIXinSSD/hf_cache","hf_hub_cache":"/Volumes/VIXinSSD/hf_cache/hub","hf_hub_offline":1,"retro_backfill_inference":"off","baseline_path":"benchmarks/mlx/qwen3_5_35b_a3b_wayfinder/EXP-20260225T182700Z-QWEN35A3B-COMPAT-RERUN/t8192/dense/results.json","stop_gates":["nonzero exit","missing results.json","concurrent inference process detected"]},"metrics":{"status":"pending","artifacts_expected":["benchmarks/mlx/qwen3_5_35b_a3b_wayfinder/EXP-20260225T183600Z-QWEN35A3B-PREFILL-WFDENSEDECODE/dense_t8192_d1_s42/results.json","benchmarks/mlx/qwen3_5_35b_a3b_wayfinder/EXP-20260225T183600Z-QWEN35A3B-PREFILL-WFDENSEDECODE/wayfinder_dense_decode_t8192_d1_s42/results.json"],"required":["single_turn[0].prefill_sec","single_turn[0].decode_sec","single_turn[0].e2e_sec","single_turn[0].decode_tok_s","single_turn[0].peak_memory_bytes","single_turn[0].path_counts","single_turn[0].dense_fallback_reason_counts","single_turn[0].observability_fallback_share_known"]},"decision":"pending","next_action":"Execute paired run sequentially and append RESULT with dense-vs-wayfinder prefill deltas."}
{"id":"EXP-20260225T183600Z-QWEN35A3B-PREFILL-WFDENSEDECODE-RESULT","date":"2026-02-25","question":"With decode minimized (decode_len=1), is Wayfinder prefill faster than dense on Qwen3.5-35B-A3B when decode backend is forced to dense?","hypothesis":"Prefill-focused pairing will isolate whether the regression is prefill-specific; if healthy, Wayfinder prefill_sec should be <= dense under identical controls.","change_set":["measurement-only","notes/LAB_NOTEBOOK.md","notes/experiments.ndjson"],"command":"python3 scripts/bench_qwen_consumer_mlx.py --model-path /Volumes/VIXinSSD/models/Qwen3.5-35B-A3B-MLX-4bit --mode dense --seq-lens 8192 --decode-len 1 --repeats 1 --chunk-size 4096 --kv-step 4096 --cooldown-sec 10 --seed 42 --skip-multi-turn --skip-quality --hf-home /Volumes/VIXinSSD/hf_cache --hf-hub-cache /Volumes/VIXinSSD/hf_cache/hub --hf-offline --out-dir benchmarks/mlx/qwen3_5_35b_a3b_wayfinder/EXP-20260225T183600Z-QWEN35A3B-PREFILL-WFDENSEDECODE/dense_t8192_d1_s42 && python3 scripts/bench_qwen_consumer_mlx.py --model-path /Volumes/VIXinSSD/models/Qwen3.5-35B-A3B-MLX-4bit --mode wayfinder --debug-wayfinder-decode-backend dense --seq-lens 8192 --decode-len 1 --repeats 1 --chunk-size 4096 --kv-step 4096 --cooldown-sec 10 --window 64 --landmark-stride 64 --num-cycles 1 --head-chunk-size 2 --query-chunk-size 384 --seed 42 --skip-multi-turn --skip-quality --hf-home /Volumes/VIXinSSD/hf_cache --hf-hub-cache /Volumes/VIXinSSD/hf_cache/hub --hf-offline --out-dir benchmarks/mlx/qwen3_5_35b_a3b_wayfinder/EXP-20260225T183600Z-QWEN35A3B-PREFILL-WFDENSEDECODE/wayfinder_dense_decode_t8192_d1_s42","controls":{"one_process_at_a_time":true,"model_path":"/Volumes/VIXinSSD/models/Qwen3.5-35B-A3B-MLX-4bit","seq_len":8192,"decode_len":1,"repeats":1,"seed":42,"hf_home":"/Volumes/VIXinSSD/hf_cache","hf_hub_cache":"/Volumes/VIXinSSD/hf_cache/hub","hf_hub_offline":1,"retro_backfill_inference":"off"},"metrics":{"status":"completed","artifacts":["benchmarks/mlx/qwen3_5_35b_a3b_wayfinder/EXP-20260225T183600Z-QWEN35A3B-PREFILL-WFDENSEDECODE/dense_t8192_d1_s42/results.json","benchmarks/mlx/qwen3_5_35b_a3b_wayfinder/EXP-20260225T183600Z-QWEN35A3B-PREFILL-WFDENSEDECODE/wayfinder_dense_decode_t8192_d1_s42/results.json"],"dense":{"prefill_sec":73.34400708299654,"decode_sec":66.07708966700011,"e2e_sec":139.42109674999665,"decode_tok_s":0.015133838445966167,"peak_memory_bytes":29371883558},"wayfinder":{"prefill_sec":23.919740041004843,"decode_sec":22.359555957998964,"e2e_sec":46.27929599900381,"decode_tok_s":0.04472360729696233,"peak_memory_bytes":29373458886,"path_counts":{"permute":8,"permute_dense_fallback":16},"dense_fallback_reason_counts":{"active_large_q":8,"wayfinder_decode_dense":8},"observability_fallback_share_known":true},"delta_wayfinder_minus_dense":{"prefill_sec_abs":-49.4242670419917,"prefill_sec_pct":-67.38691954212821,"decode_sec_abs":-43.717533709001145,"decode_sec_pct":-66.16140924081034,"e2e_sec_abs":-93.14180075099284,"e2e_sec_pct":-66.80610246382606,"decode_tok_s_abs":0.02958976885099616,"decode_tok_s_pct":195.52058095930803,"peak_memory_bytes_abs":1575328,"peak_memory_bytes_pct":0.005363387734018607,"memory_reduction_pct_convention":-0.005363387734025338}},"decision":"follow-up","next_action":"Rerun with repeats>=3 for stability and compare against decode_len=32 paired runs before selecting default claims."}
{"id":"EXP-20260225T184500Z-QWEN35A3B-VISIBLE-OUTPUT-CHECK-PRERUN","date":"2026-02-25","question":"For a concrete prompt, do dense and Wayfinder+dense-decode produce the same visible output on Qwen3.5-35B-A3B under the current setup?","hypothesis":"Outputs should be the same or very close on a deterministic short extraction task when decode backend is dense.","change_set":["measurement-only"],"command":"python3 scripts/bench_qwen_consumer_mlx.py --model-path /Volumes/VIXinSSD/models/Qwen3.5-35B-A3B-MLX-4bit --mode dense --seq-lens 8192 --decode-len 24 --repeats 1 --chunk-size 4096 --kv-step 4096 --cooldown-sec 5 --seed 42 --hf-home /Volumes/VIXinSSD/hf_cache --hf-hub-cache /Volumes/VIXinSSD/hf_cache/hub --hf-offline --quality-dataset benchmarks/mlx/qwen3_1_7b_wayfinder/quality_eval_qwen3_consumer_v1.json --quality-task-id-filter extract-01 --skip-single-turn --skip-multi-turn --out-dir benchmarks/mlx/qwen3_5_35b_a3b_wayfinder/EXP-20260225T184500Z-QWEN35A3B-VISIBLE-OUTPUT-CHECK/dense && python3 scripts/bench_qwen_consumer_mlx.py --model-path /Volumes/VIXinSSD/models/Qwen3.5-35B-A3B-MLX-4bit --mode wayfinder --debug-wayfinder-decode-backend dense --seq-lens 8192 --decode-len 24 --repeats 1 --chunk-size 4096 --kv-step 4096 --cooldown-sec 5 --window 64 --landmark-stride 64 --num-cycles 1 --head-chunk-size 2 --query-chunk-size 384 --seed 42 --hf-home /Volumes/VIXinSSD/hf_cache --hf-hub-cache /Volumes/VIXinSSD/hf_cache/hub --hf-offline --quality-dataset benchmarks/mlx/qwen3_1_7b_wayfinder/quality_eval_qwen3_consumer_v1.json --quality-task-id-filter extract-01 --skip-single-turn --skip-multi-turn --out-dir benchmarks/mlx/qwen3_5_35b_a3b_wayfinder/EXP-20260225T184500Z-QWEN35A3B-VISIBLE-OUTPUT-CHECK/wayfinder_dense_decode","controls":{"one_process_at_a_time":true,"task_id":"extract-01","decode_backend_wayfinder":"dense","hf_home":"/Volumes/VIXinSSD/hf_cache","hf_hub_cache":"/Volumes/VIXinSSD/hf_cache/hub","hf_hub_offline":1},"metrics":{"status":"pending","artifacts_expected":["benchmarks/mlx/qwen3_5_35b_a3b_wayfinder/EXP-20260225T184500Z-QWEN35A3B-VISIBLE-OUTPUT-CHECK/dense/results.json","benchmarks/mlx/qwen3_5_35b_a3b_wayfinder/EXP-20260225T184500Z-QWEN35A3B-VISIBLE-OUTPUT-CHECK/wayfinder_dense_decode/results.json"],"required":["quality.rows[0].output","quality.rows[0].correct","quality.rows[0].expected"]},"decision":"pending","next_action":"Run paired quality-only commands sequentially and compare visible output text."}
