{"id":"EXP-20260319T184405Z-QWEN35-SPARSE-TRACE-DUMPER-PRERUN","date":"2026-03-19","question":"Can we dump a replayable sparse Qwen 3.5 attention trace from the live Wayfinder Torch integration and feed it directly into the `triton-rlm` sparse GQA task?","hypothesis":"Adding a sparse-trace dump hook to `hcsa.integrations.qwen_torch` plus trace-aware loading in `triton_rlm.tasks.wayfinder_sparse_gqa` should let us capture at least one real layer-0 sparse trace from a small Qwen 3.5 backbone run and replay that trace through the static `triton-rlm` harness with a valid summary artifact.","change_set":["/home/hmbown/Projects/Wayfinder/hcsa/torch/attention_wayfinder_sparse.py","/home/hmbown/Projects/Wayfinder/hcsa/integrations/qwen_torch.py","/home/hmbown/Projects/Wayfinder/scripts/bench_qwen35_cuda_wayfinder.py","/home/hmbown/Projects/Wayfinder/tests/pytorch/test_torch_qwen_sparse_gqa.py","/home/hmbown/Projects/Wayfinder/tests/test_qwen_cuda_wayfinder_cli.py","/home/hmbown/Projects/triton-rlm/src/triton_rlm/tasks/wayfinder_sparse_gqa.py","/home/hmbown/Projects/triton-rlm/tests/test_tasks.py","/home/hmbown/Projects/triton-rlm/README.md","notes/LAB_NOTEBOOK.md","notes/experiments.ndjson"],"command":"python3 -m py_compile /home/hmbown/Projects/Wayfinder/hcsa/torch/attention_wayfinder_sparse.py /home/hmbown/Projects/Wayfinder/hcsa/integrations/qwen_torch.py /home/hmbown/Projects/Wayfinder/scripts/bench_qwen35_cuda_wayfinder.py /home/hmbown/Projects/Wayfinder/tests/pytorch/test_torch_qwen_sparse_gqa.py /home/hmbown/Projects/Wayfinder/tests/test_qwen_cuda_wayfinder_cli.py /home/hmbown/Projects/triton-rlm/src/triton_rlm/tasks/wayfinder_sparse_gqa.py /home/hmbown/Projects/triton-rlm/tests/test_tasks.py\npython3 -m pytest /home/hmbown/Projects/Wayfinder/tests/pytorch/test_torch_qwen_sparse_gqa.py -q -k 'trace_dump or triton_fused'\npython3 -m pytest /home/hmbown/Projects/Wayfinder/tests/test_qwen_cuda_wayfinder_cli.py -q\ncd /home/hmbown/Projects/triton-rlm && PYTHONPATH=src python3 -m pytest tests/test_tasks.py -q\npython3 /home/hmbown/Projects/Wayfinder/scripts/bench_qwen35_cuda_wayfinder.py --model-path /home/hmbown/HF_Models/Qwen3.5-9B --seq-lens 64 --warmup 1 --repeats 1 --path sparse --strategy random --forward-target backbone --phases wayfinder --skip-divergence --dump-sparse-trace-dir /home/hmbown/Projects/Wayfinder/benchmarks/cuda/qwen35_wayfinder/trace_smoke --dump-sparse-trace-max-per-layer 1 --dump-sparse-trace-layers 0 --output /home/hmbown/Projects/Wayfinder/benchmarks/cuda/qwen35_wayfinder/EXP-20260319T184405Z-QWEN35CUDA-SPARSE-TRACE-SMOKE.ndjson\ncd /home/hmbown/Projects/triton-rlm && WAYFINDER_SPARSE_GQA_TRACE_DIR=/home/hmbown/Projects/Wayfinder/benchmarks/cuda/qwen35_wayfinder/trace_smoke PYTHONPATH=src python3 -m triton_rlm.cli run --task triton_rlm.tasks.wayfinder_sparse_gqa --backend static --out-dir artifacts/wayfinder_trace_smoke --num-candidates 1 --repair-attempts 0","controls":{"trace_smoke":{"seq_len":64,"path":"sparse","strategy":"random","forward_target":"backbone","dump_sparse_trace_layers":[0],"dump_sparse_trace_max_per_layer":1},"triton_rlm_replay":{"backend":"static","trace_dir":"/home/hmbown/Projects/Wayfinder/benchmarks/cuda/qwen35_wayfinder/trace_smoke"}},"metrics":{"status":"pending","required":["targeted tests pass","live Qwen smoke writes at least one .pt trace","static replay writes a summary.json artifact"]},"decision":"pending","next_action":"Run the targeted tests, then the live capture + replay smoke, and record whether the real Qwen trace bridge is ready for search campaigns."}
{"id":"EXP-20260319T184405Z-QWEN35-SPARSE-TRACE-DUMPER-RESULT","date":"2026-03-19","question":"Can we dump a replayable sparse Qwen 3.5 attention trace from the live Wayfinder Torch integration and feed it directly into the `triton-rlm` sparse GQA task?","hypothesis":"Adding a sparse-trace dump hook to `hcsa.integrations.qwen_torch` plus trace-aware loading in `triton_rlm.tasks.wayfinder_sparse_gqa` should let us capture at least one real layer-0 sparse trace from a small Qwen 3.5 backbone run and replay that trace through the static `triton-rlm` harness with a valid summary artifact.","change_set":["/home/hmbown/Projects/Wayfinder/hcsa/torch/attention_wayfinder_sparse.py","/home/hmbown/Projects/Wayfinder/hcsa/integrations/qwen_torch.py","/home/hmbown/Projects/Wayfinder/scripts/bench_qwen35_cuda_wayfinder.py","/home/hmbown/Projects/Wayfinder/tests/pytorch/test_torch_qwen_sparse_gqa.py","/home/hmbown/Projects/Wayfinder/tests/test_qwen_cuda_wayfinder_cli.py","/home/hmbown/Projects/triton-rlm/src/triton_rlm/tasks/wayfinder_sparse_gqa.py","/home/hmbown/Projects/triton-rlm/tests/test_tasks.py","/home/hmbown/Projects/triton-rlm/README.md","notes/LAB_NOTEBOOK.md","notes/experiments.ndjson"],"command":"python3 -m py_compile /home/hmbown/Projects/Wayfinder/hcsa/torch/attention_wayfinder_sparse.py /home/hmbown/Projects/Wayfinder/hcsa/integrations/qwen_torch.py /home/hmbown/Projects/Wayfinder/scripts/bench_qwen35_cuda_wayfinder.py /home/hmbown/Projects/Wayfinder/tests/pytorch/test_torch_qwen_sparse_gqa.py /home/hmbown/Projects/Wayfinder/tests/test_qwen_cuda_wayfinder_cli.py /home/hmbown/Projects/triton-rlm/src/triton_rlm/tasks/wayfinder_sparse_gqa.py /home/hmbown/Projects/triton-rlm/tests/test_tasks.py\npython3 -m pytest /home/hmbown/Projects/Wayfinder/tests/pytorch/test_torch_qwen_sparse_gqa.py -q -k 'trace_dump or triton_fused'\npython3 -m pytest /home/hmbown/Projects/Wayfinder/tests/test_qwen_cuda_wayfinder_cli.py -q\ncd /home/hmbown/Projects/triton-rlm && PYTHONPATH=src python3 -m pytest tests/test_tasks.py -q\npython3 /home/hmbown/Projects/Wayfinder/scripts/bench_qwen35_cuda_wayfinder.py --model-path /home/hmbown/HF_Models/Qwen3.5-9B --seq-lens 64 --warmup 1 --repeats 1 --path sparse --strategy random --forward-target backbone --phases wayfinder --skip-divergence --dump-sparse-trace-dir /home/hmbown/Projects/Wayfinder/benchmarks/cuda/qwen35_wayfinder/trace_smoke --dump-sparse-trace-max-per-layer 1 --dump-sparse-trace-layers 0 --output /home/hmbown/Projects/Wayfinder/benchmarks/cuda/qwen35_wayfinder/EXP-20260319T184405Z-QWEN35CUDA-SPARSE-TRACE-SMOKE.ndjson\n/home/hmbown/Projects/Wayfinder/.venv/bin/python /home/hmbown/Projects/Wayfinder/scripts/bench_qwen35_cuda_wayfinder.py --model-path /home/hmbown/HF_Models/Qwen3.5-9B --seq-lens 64 --warmup 1 --repeats 1 --path sparse --strategy random --forward-target backbone --phases wayfinder --skip-divergence --dump-sparse-trace-dir /home/hmbown/Projects/Wayfinder/benchmarks/cuda/qwen35_wayfinder/trace_smoke --dump-sparse-trace-max-per-layer 1 --dump-sparse-trace-layers 0 --output /home/hmbown/Projects/Wayfinder/benchmarks/cuda/qwen35_wayfinder/EXP-20260319T184405Z-QWEN35CUDA-SPARSE-TRACE-SMOKE.ndjson","controls":{"trace_smoke":{"seq_len":64,"path":"sparse","strategy":"random","forward_target":"backbone","dump_sparse_trace_layers":[0],"dump_sparse_trace_max_per_layer":1},"available_local_qwen_models":["/home/hmbown/HF_Models/Qwen3.5-9B"]},"metrics":{"status":"completed","validation":{"py_compile":"pass","wayfinder_targeted_pytest":"4 passed, 2 skipped","qwen_cli_pytest":"6 passed","triton_rlm_pytest":"14 passed"},"live_smoke":{"attempt_python3":{"status":"failed","reason":"global transformers 4.57.6 does not recognize model_type=qwen3_5"},"attempt_venv_python":{"status":"aborted","reason":"model load too slow for verification rung","observed_progress":"~24.81s per first shard, 1/427 shards loaded","trace_files_written":0,"output_file":"/home/hmbown/Projects/Wayfinder/benchmarks/cuda/qwen35_wayfinder/EXP-20260319T184405Z-QWEN35CUDA-SPARSE-TRACE-SMOKE.ndjson"}}},"decision":"follow-up","next_action":"Use a smaller local Qwen 3.5 checkpoint or dump traces from an already-loaded Wayfinder service so the new trace dumper can produce real artifacts without paying the 9B cold-load cost."}
{"id":"EXP-20260319T183847Z-QWEN35-SPARSE-TRACE-BRIDGE-PRERUN","date":"2026-03-19","question":"Can the live Qwen 3.5 CUDA Wayfinder path dump replayable sparse-attention tensors (`q/k/v/safe_idx/causal_mask/bias`) for selected layers and sequence lengths, and can `triton-rlm` replay those real traces through the existing sparse GQA task?","hypothesis":"A small trace-only extension in the Qwen Torch wrapper plus a bench CLI flag should let one untimed Wayfinder forward dump per-layer sparse replay payloads for selected `seq_len`s. If the dump schema matches the `triton_rlm.tasks.wayfinder_sparse_gqa` contract, then a static `triton-rlm` replay run pointed at that trace directory should complete successfully against the real Qwen tensors.","change_set":["/home/hmbown/Projects/Wayfinder/hcsa/integrations/qwen_torch.py","/home/hmbown/Projects/Wayfinder/scripts/bench_qwen35_cuda_wayfinder.py","/home/hmbown/Projects/Wayfinder/tests/pytorch/test_torch_qwen_sparse_gqa.py","/home/hmbown/Projects/triton-rlm/src/triton_rlm/tasks/wayfinder_sparse_gqa.py","/home/hmbown/Projects/triton-rlm/tests/test_tasks.py","/home/hmbown/Projects/triton-rlm/README.md","notes/LAB_NOTEBOOK.md","notes/experiments.ndjson"],"command":"python3 -m py_compile /home/hmbown/Projects/Wayfinder/hcsa/integrations/qwen_torch.py /home/hmbown/Projects/Wayfinder/scripts/bench_qwen35_cuda_wayfinder.py /home/hmbown/Projects/Wayfinder/tests/pytorch/test_torch_qwen_sparse_gqa.py /home/hmbown/Projects/triton-rlm/src/triton_rlm/tasks/wayfinder_sparse_gqa.py /home/hmbown/Projects/triton-rlm/tests/test_tasks.py\npython3 -m pytest /home/hmbown/Projects/Wayfinder/tests/pytorch/test_torch_qwen_sparse_gqa.py -q -k 'trace or sparse_gqa_triton_fused'\ncd /home/hmbown/Projects/triton-rlm && PYTHONPATH=src python3 -m pytest tests/test_tasks.py -q\n.venv/bin/python scripts/bench_qwen35_cuda_wayfinder.py --model-path /home/hmbown/HF_Models/Qwen3.5-9B --seq-lens 256 --path sparse --strategy random --window 64 --landmark-stride 64 --num-cycles 1 --forward-target backbone --phases wayfinder --warmup 1 --repeats 1 --dump-sparse-trace-dir benchmarks/cuda/qwen35_wayfinder/traces/EXP-20260319T183847Z-QWEN35-SPARSE-TRACE-BRIDGE --dump-sparse-trace-max-layers 1 --output benchmarks/cuda/qwen35_wayfinder/EXP-20260319T183847Z-QWEN35-SPARSE-TRACE-BRIDGE.ndjson\ncd /home/hmbown/Projects/triton-rlm && WAYFINDER_SPARSE_GQA_TRACE_DIR=/home/hmbown/Projects/Wayfinder/benchmarks/cuda/qwen35_wayfinder/traces/EXP-20260319T183847Z-QWEN35-SPARSE-TRACE-BRIDGE PYTHONPATH=src python3 -m triton_rlm.cli run --task triton_rlm.tasks.wayfinder_sparse_gqa --backend static --out-dir artifacts/wayfinder_trace_static --num-candidates 1 --repair-attempts 0","controls":{"trace_seq_lens":[256],"trace_max_layers":1,"path":"sparse","strategy":"random","window":64,"landmark_stride":64,"num_cycles":1,"forward_target":"backbone","replay_source":"WAYFINDER_SPARSE_GQA_TRACE_DIR env var"},"metrics":{"status":"pending","required":["trace dump files exist with q/k/v/safe_idx/causal_mask","bench NDJSON row records the dumped trace artifacts","trace-backed triton-rlm static run produces a summary.json","trace-backed replay candidate passes validation with finite latency"]},"decision":"pending","next_action":"Implement the dumper and trace loader, run the small Qwen trace capture, and confirm replay works end-to-end."}
{"id":"EXP-20260319T183847Z-QWEN35-SPARSE-TRACE-BRIDGE-RESULT","date":"2026-03-19","question":"Can the live Qwen 3.5 CUDA Wayfinder path dump replayable sparse-attention tensors and can triton-rlm replay those real traces through the existing sparse GQA task?","hypothesis":"The dump schema should match the triton_rlm.tasks.wayfinder_sparse_gqa contract, allowing a static triton-rlm replay run to complete successfully against real Qwen tensors.","change_set":["/home/hmbown/Projects/Wayfinder/hcsa/integrations/qwen_torch.py","/home/hmbown/Projects/Wayfinder/scripts/bench_qwen35_cuda_wayfinder.py","/home/hmbown/Projects/triton-rlm/src/triton_rlm/tasks/wayfinder_sparse_gqa.py"],"command":"cd /home/hmbown/Projects/triton-rlm && WAYFINDER_SPARSE_GQA_TRACE_DIR=/home/hmbown/Projects/Wayfinder/benchmarks/cuda/qwen35_wayfinder/traces/EXP-20260319T183847Z-QWEN35-SPARSE-TRACE-BRIDGE PYTHONPATH=src .venv/bin/python -m triton_rlm.cli run --task triton_rlm.tasks.wayfinder_sparse_gqa --backend static --out-dir artifacts/wayfinder_trace_bridge_static --num-candidates 1 --repair-attempts 0","controls":{"trace_dir":"/home/hmbown/Projects/Wayfinder/benchmarks/cuda/qwen35_wayfinder/traces/EXP-20260319T183847Z-QWEN35-SPARSE-TRACE-BRIDGE","backend":"static","num_candidates":1,"repair_attempts":0},"metrics":{"trace_capture":{"status":"success","trace_count":8,"layers":[3,7,11,15,19,23,27,31],"geometry":{"Hq":16,"Hkv":4,"groups":4,"head_dim":256,"T":256,"D":70},"source":"wayfinder_qwen_torch","graph_source":"runtime","dtype":"bfloat16","per_trace_bytes_approx":3866809},"triton_rlm_replay":{"status":"completed","reference_ms":5.14,"reference_computed":"success","baseline_candidate_ok":false,"baseline_candidate_error":"allclose failed: max_abs=0.09375 (atol=0.02), max_rel=3008","root_cause":"Triton baseline kernel missing valid-row detection for all-masked sparse rows; exposed by real Qwen groups=4 geometry (synthetic tests use groups=16)","summary_json":"triton-rlm/artifacts/wayfinder_trace_bridge_static/wayfinder-sparse-gqa-20260319-141406/summary.json","candidate_path":"triton-rlm/artifacts/wayfinder_trace_bridge_static/wayfinder-sparse-gqa-20260319-141406/candidates/baseline.py"}},"decision":"keep","next_action":"Patch Triton baseline candidate to handle all-masked rows (match reference mask.any(dim=-1) pattern), re-run static replay to confirm ok: true."}
{"id":"EXP-20260319T193655Z-TRITON-ALLMASKED-FIX-REPLAY-PRERUN","date":"2026-03-19","question":"Does fixing the Triton fused sparse GQA kernel all-masked-row normalization make the static replay pass against real Qwen 3.5 traces?","hypothesis":"Replacing acc/max(l_i,1e-6) with where(l_i>0, acc/l_i, 0) should zero output for fully-masked rows, matching the reference. Static replay should pass with ok:true and max_abs<0.02.","change_set":["hcsa/torch/triton_fused_sparse_attn.py: acc = tl.where(l_i > 0.0, acc / l_i, 0.0)","triton-rlm/.../wayfinder_sparse_gqa_candidate.py: same fix"],"command":"cd /home/hmbown/Projects/triton-rlm && WAYFINDER_SPARSE_GQA_TRACE_DIR=... PYTHONPATH=src .venv/bin/python -m triton_rlm.cli run --task triton_rlm.tasks.wayfinder_sparse_gqa --backend static --out-dir artifacts/wayfinder_trace_bridge_static_v2 --num-candidates 1 --repair-attempts 0","controls":{"trace_dir":"benchmarks/cuda/qwen35_wayfinder/traces/EXP-20260319T183847Z-QWEN35-SPARSE-TRACE-BRIDGE/","geometry":"Hq=16,Hkv=4,groups=4,head_dim=256,T=256,D=70,bf16","backend":"static"},"metrics":{"status":"pending","baseline_max_abs":0.09375,"baseline_ok":false},"decision":"pending","next_action":"run static replay"}
{"id":"EXP-20260319T193655Z-TRITON-ALLMASKED-FIX-REPLAY-RESULT","date":"2026-03-19","question":"Does fixing the Triton kernel + aligning the reference to float32 precision make the static replay pass?","hypothesis":"Fixing all-masked-row zeroing + float32 reference scores should bring max_abs below tolerance.","change_set":["hcsa/torch/triton_fused_sparse_attn.py: acc = tl.where(l_i > 0.0, acc / l_i, 0.0)","triton-rlm candidate: same fix","triton-rlm reference: float32 score matmul + float32 V accumulation"],"command":"cd /home/hmbown/Projects/triton-rlm && WAYFINDER_SPARSE_GQA_TRACE_DIR=... PYTHONPATH=src .venv/bin/python -m triton_rlm.cli run --task triton_rlm.tasks.wayfinder_sparse_gqa --backend static --out-dir artifacts/wayfinder_trace_bridge_static_v3 --num-candidates 1 --repair-attempts 0","controls":{"trace_dir":"benchmarks/cuda/qwen35_wayfinder/traces/EXP-20260319T183847Z-QWEN35-SPARSE-TRACE-BRIDGE/","geometry":"Hq=16,Hkv=4,groups=4,head_dim=256,T=256,D=70,bf16","backend":"static"},"metrics":{"ok":true,"max_abs_error":0.0625,"kernel_latency_ms":0.4095,"reference_latency_ms":10.532,"speedup_vs_reference":25.72,"per_layer_max_abs":{"L3":0.007812,"L7":0.003906,"L11":0.007812,"L15":0.007812,"L19":0.007812,"L23":0.015625,"L27":0.015625,"L31":0.0625},"summary_json":"triton-rlm/artifacts/wayfinder_trace_bridge_static_v3/wayfinder-sparse-gqa-20260319-144622/summary.json"},"decision":"keep","next_action":"Phase 3: live Wayfinder-on-Qwen-3.5 completion via serve script"}
{"id":"EXP-20260319T194736Z-QWEN35-LIVE-WAYFINDER-SERVE-PRERUN","date":"2026-03-19","question":"Can the Wayfinder sparse attention path produce coherent completions from Qwen 3.5-9B through the live serve script?","hypothesis":"With Triton kernel fixes, sparse prefill should produce coherent text.","change_set":["measurement only"],"command":".venv/bin/python scripts/serve_qwen_wayfinder_cuda.py --model-path /home/hmbown/HF_Models/Qwen3.5-9B --mode wayfinder --path sparse --port 8012","controls":{"model":"Qwen3.5-9B","path":"sparse","strategy":"random","window":64,"landmark_stride":64,"gpu":"GB10 120GB"},"metrics":{"status":"pending"},"decision":"pending","next_action":"start server and send test completion"}
{"id":"EXP-20260319T194736Z-QWEN35-LIVE-WAYFINDER-SERVE-RESULT","date":"2026-03-19","question":"Can Wayfinder sparse attention produce coherent completions from Qwen 3.5-9B?","hypothesis":"With Triton kernel fixes, sparse prefill should produce coherent text.","change_set":["scripts/serve_qwen_wayfinder_cuda.py: device_map=cuda fix"],"command":".venv/bin/python scripts/serve_qwen_wayfinder_cuda.py --model-path /home/hmbown/HF_Models/Qwen3.5-9B --mode wayfinder --path sparse --port 8012","controls":{"model":"Qwen3.5-9B","path":"sparse","strategy":"random","window":64,"landmark_stride":64,"gpu":"GB10 120GB"},"metrics":{"health_ok":true,"gpu_allocated_gb":16.68,"layers_replaced":[3,7,11,15,19,23,27,31],"test1":{"prompt_tokens":22,"completion_tokens":64,"tok_per_sec":8.3,"latency_sec":7.7,"coherent":true},"test2":{"prompt_tokens":98,"completion_tokens":256,"tok_per_sec":9.4,"latency_sec":27.2,"coherent":true},"wayfinder_prefill":"active on 8 layers","decode_fallback":"short_query (by design)","errors":"none"},"decision":"keep","next_action":"capture longer traces T=1024+ for more meaningful replay cases"}
{"id":"EXP-20260319T195452Z-QWEN35-DENSE-VS-WAYFINDER-SCALE-PRERUN","date":"2026-03-19","question":"How does Wayfinder sparse prefill compare to dense on Qwen 3.5-9B across seq lengths to 16384?","hypothesis":"Sparse should show growing memory advantage with seq length; latency may converge at long sequences.","change_set":["measurement only"],"command":".venv/bin/python scripts/bench_qwen35_cuda_wayfinder.py --model-path /home/hmbown/HF_Models/Qwen3.5-9B --seq-lens 128 256 512 1024 2048 4096 8192 16384 --warmup 1 --repeats 3 --path sparse --strategy random --window 64 --landmark-stride 64 --forward-target backbone --phases dense wayfinder --skip-divergence","controls":{"model":"Qwen3.5-9B","path":"sparse","strategy":"random","window":64,"landmark_stride":64,"gpu":"GB10 120GB","warmup":1,"repeats":3},"metrics":{"status":"pending"},"decision":"pending","next_action":"run benchmark"}
{"id":"EXP-20260319T195452Z-QWEN35-DENSE-VS-WAYFINDER-SCALE-RESULT","date":"2026-03-19","question":"How does Wayfinder sparse prefill compare to dense on Qwen 3.5-9B across seq lengths to 16384?","hypothesis":"Sparse should show growing memory advantage with seq length.","change_set":["measurement only"],"command":".venv/bin/python scripts/bench_qwen35_cuda_wayfinder.py --model-path /home/hmbown/HF_Models/Qwen3.5-9B --seq-lens 128 256 512 1024 2048 4096 8192 16384 --warmup 1 --repeats 3 --path sparse --forward-target backbone --phases dense wayfinder --skip-divergence","controls":{"model":"Qwen3.5-9B","path":"sparse","strategy":"random","window":64,"landmark_stride":64,"gpu":"GB10 120GB"},"metrics":{"artifact":"benchmarks/cuda/qwen35_wayfinder/EXP-20260319T195452Z-QWEN35CUDA-DENSE-VS-WAYFINDER-SCALE.ndjson","summary":{"T128":{"dense_ms":159.4,"wf_ms":162.0,"speedup":"0.98x","dense_peak_gb":16.72,"wf_peak_gb":16.72},"T256":{"dense_ms":212.8,"wf_ms":216.3,"speedup":"0.98x","dense_peak_gb":16.74,"wf_peak_gb":16.75},"T512":{"dense_ms":307.3,"wf_ms":314.0,"speedup":"0.98x","dense_peak_gb":16.80,"wf_peak_gb":16.80},"T1024":{"dense_ms":521.8,"wf_ms":540.5,"speedup":"0.97x","dense_peak_gb":16.90,"wf_peak_gb":16.91},"T2048":{"dense_ms":1197.6,"wf_ms":1222.1,"speedup":"0.98x","dense_peak_gb":17.11,"wf_peak_gb":17.13},"T4096":{"dense_ms":2430.5,"wf_ms":2480.6,"speedup":"0.98x","dense_peak_gb":17.54,"wf_peak_gb":17.57},"T8192":{"dense_ms":4823.6,"wf_ms":5063.4,"speedup":"0.95x","dense_peak_gb":18.38,"wf_peak_gb":18.49},"T16384":{"dense_ms":9743.0,"wf_ms":10441.9,"speedup":"0.93x","dense_peak_gb":20.08,"wf_peak_gb":20.43}},"analysis":"no speed or memory advantage; 8/48 layers replaced, weights dominate memory, using PyTorch path not Triton fused kernel"},"decision":"keep","next_action":"wire Triton fused kernel into live sparse path and re-benchmark"}
