{"id":"EXP-20260207-185738-GLM-INTEGRATION-SMOKE-RESULT","date":"2026-02-07","question":"Does GLM-4.7-Flash MLA integration run correctly with Wayfinder swap while keeping retro off by default?","hypothesis":"MLA extraction + value-dim padding inside Wayfinder kernels will preserve shape correctness and enable benchmark smoke without MoE routing changes.","change_set":["add hcsa/integrations/glm_mlx.py","update hcsa/integrations/__init__.py exports","add scripts/bench_glm_wayfinder_mlx.py","hcsa/mlx/attention.py planner bfloat16 itemsize fix"],"command":"PYTHONPATH=. python3 -m pytest tests/mlx/ -x -q && PYTHONPATH=. python3 scripts/bench_glm_wayfinder_mlx.py --model-path mlx-community/GLM-4.7-Flash-4bit --seq-lens 2048 --batch 1 --warmup 1 --iters 1 --path permute --window 64 --landmark-stride 64 --seed 42 --permute-prepermute-mode auto --permute-memory-budget-multiplier 1.0 --out-dir benchmarks/mlx/glm_4_7_flash_4bit_wayfinder/20260207_glm_integration_smoke","controls":{"retro_backfill_enabled":false,"batch":1,"window":64,"landmark_stride":64,"path":"permute","baseline_path":"benchmarks/mlx/glm_4_7_flash_4bit_wayfinder/20260207_glm_integration_smoke/results.json","validation":"PYTHONPATH=. python3 -m pytest tests/mlx/ -x -q"},"metrics":{"validation":{"tests_mlx_passed":38},"results_path":"benchmarks/mlx/glm_4_7_flash_4bit_wayfinder/20260207_glm_integration_smoke/results.json","t2048":{"sanity_mae":0.0037978594191372395,"attention":{"dense_tokens_per_sec":61309.640990025495,"wayfinder_tokens_per_sec":75061.04482428232,"absolute_tokens_per_sec":75061.04482428232,"delta_tokens_per_sec_vs_dense":13751.403834256824,"delta_tokens_per_sec_pct_vs_dense":22.42943134586948,"dense_peak_memory_bytes":426232364,"wayfinder_peak_memory_bytes":209706682,"absolute_peak_memory_bytes":209706682,"delta_peak_memory_bytes_vs_dense":-216525682,"delta_peak_memory_pct_vs_dense":-50.799915794287266,"memory_reduction_pct":50.799915794287266},"block":{"dense_tokens_per_sec":32956.710124189995,"wayfinder_tokens_per_sec":37291.45328321193,"absolute_tokens_per_sec":37291.45328321193,"delta_tokens_per_sec_vs_dense":4334.743159021935,"delta_tokens_per_sec_pct_vs_dense":13.152839414757796,"dense_peak_memory_bytes":604891708,"wayfinder_peak_memory_bytes":377596464,"absolute_peak_memory_bytes":377596464,"delta_peak_memory_bytes_vs_dense":-227295244,"delta_peak_memory_pct_vs_dense":-37.57618776946435,"memory_reduction_pct":37.576187769464354}}},"decision":"keep","next_action":"benchmark 4096 and 8192 to validate long-context acceptance criteria"}
{"id":"EXP-20260207-190227-GLM-LONG-SMOKE-RESULT","date":"2026-02-07","question":"At T=8192 on GLM-4.7-Flash MLA, does Wayfinder permute exceed dense throughput with reduced memory (retro off)?","hypothesis":"Wayfinder should cross >1.0x throughput at T=8192 and reduce peak memory vs dense due O(T\u00b7W) local attention.","change_set":["hcsa/integrations/glm_mlx.py","scripts/bench_glm_wayfinder_mlx.py","hcsa/mlx/attention.py bfloat16 itemsize planner fix"],"command":"PYTHONPATH=. python3 scripts/bench_glm_wayfinder_mlx.py --model-path mlx-community/GLM-4.7-Flash-4bit --seq-lens 4096 8192 --batch 1 --warmup 1 --iters 1 --path permute --window 64 --landmark-stride 64 --seed 42 --permute-prepermute-mode auto --permute-memory-budget-multiplier 1.0 --out-dir benchmarks/mlx/glm_4_7_flash_4bit_wayfinder/20260207_glm_long_smoke","controls":{"retro_backfill_enabled":false,"batch":1,"window":64,"landmark_stride":64,"path":"permute","baseline_path":"benchmarks/mlx/glm_4_7_flash_4bit_wayfinder/20260207_glm_long_smoke/results.json"},"metrics":{"results_path":"benchmarks/mlx/glm_4_7_flash_4bit_wayfinder/20260207_glm_long_smoke/results.json","t4096":{"sanity_mae":0.004028857685625553,"attention":{"dense_tokens_per_sec":23877.49385974934,"wayfinder_tokens_per_sec":83344.28379225139,"absolute_tokens_per_sec":83344.28379225139,"delta_tokens_per_sec_vs_dense":59466.78993250205,"delta_tokens_per_sec_pct_vs_dense":249.04954549164867,"dense_peak_memory_bytes":1184107052,"wayfinder_peak_memory_bytes":407434558,"absolute_peak_memory_bytes":407434558,"delta_peak_memory_bytes_vs_dense":-776672494,"delta_peak_memory_pct_vs_dense":-65.59140853761252,"memory_reduction_pct":65.59140853761252},"block":{"dense_tokens_per_sec":23589.00639157068,"wayfinder_tokens_per_sec":38374.72652583662,"absolute_tokens_per_sec":38374.72652583662,"delta_tokens_per_sec_vs_dense":14785.720134265935,"delta_tokens_per_sec_pct_vs_dense":62.680555038339726,"dense_peak_memory_bytes":1456745012,"wayfinder_peak_memory_bytes":707504688,"absolute_peak_memory_bytes":707504688,"delta_peak_memory_bytes_vs_dense":-749240324,"delta_peak_memory_pct_vs_dense":-51.43249627272449,"memory_reduction_pct":51.43249627272449}},"t8192":{"sanity_mae":0.003983604721724987,"attention":{"dense_tokens_per_sec":19355.25024651089,"wayfinder_tokens_per_sec":87598.2658802036,"absolute_tokens_per_sec":87598.2658802036,"delta_tokens_per_sec_vs_dense":68243.01563369272,"delta_tokens_per_sec_pct_vs_dense":352.58141726167906,"dense_peak_memory_bytes":3755780652,"wayfinder_peak_memory_bytes":831760944,"absolute_peak_memory_bytes":831760944,"delta_peak_memory_bytes_vs_dense":-2924019708,"delta_peak_memory_pct_vs_dense":-77.85384661489545,"memory_reduction_pct":77.85384661489545},"block":{"dense_tokens_per_sec":15578.259960828951,"wayfinder_tokens_per_sec":38596.260415499724,"absolute_tokens_per_sec":38596.260415499724,"delta_tokens_per_sec_vs_dense":23018.00045467077,"delta_tokens_per_sec_pct_vs_dense":147.75719825287814,"dense_peak_memory_bytes":3940788790,"wayfinder_peak_memory_bytes":1368631860,"absolute_peak_memory_bytes":1368631860,"delta_peak_memory_bytes_vs_dense":-2572156930,"delta_peak_memory_pct_vs_dense":-65.27010370428911,"memory_reduction_pct":65.27010370428911}}},"decision":"keep","next_action":"run full-length 2048/4096/8192/16384/32768 sweep with higher iters and add measured GLM section to README"}
{"id":"EXP-20260207-190427-GLM-FULL-SWAP-SMOKE","date":"2026-02-07","question":"Can all GLM transformer self_attn layers be swapped to Wayfinder without forward breakage?","hypothesis":"swap_glm_attention_with_wayfinder will replace all attention layers and full-model forward smoke will succeed.","change_set":["hcsa/integrations/glm_mlx.py","scripts/bench_glm_wayfinder_mlx.py"],"command":"PYTHONPATH=. python3 scripts/bench_glm_wayfinder_mlx.py --model-path mlx-community/GLM-4.7-Flash-4bit --seq-lens 1024 --batch 1 --warmup 1 --iters 1 --path permute --window 64 --landmark-stride 64 --seed 42 --permute-prepermute-mode auto --permute-memory-budget-multiplier 1.0 --full-swap --out-dir benchmarks/mlx/glm_4_7_flash_4bit_wayfinder/20260207_glm_full_swap_smoke","controls":{"retro_backfill_enabled":false,"batch":1,"full_swap":true,"baseline_path":"benchmarks/mlx/glm_4_7_flash_4bit_wayfinder/20260207_glm_integration_smoke/results.json"},"metrics":{"status":"pending"},"decision":"pending","next_action":"run command and capture replaced layer count + smoke throughput"}
{"id":"EXP-20260207-190617-GLM-STABLE-MEDIAN","date":"2026-02-07","question":"Do GLM Wayfinder gains persist under stricter median benchmarking?","hypothesis":"Wayfinder remains >1.0x at 4096 and 8192 with substantial memory reduction vs dense.","change_set":["measurement only"],"command":"PYTHONPATH=. python3 scripts/bench_glm_wayfinder_mlx.py --model-path mlx-community/GLM-4.7-Flash-4bit --seq-lens 2048 4096 8192 --batch 1 --warmup 2 --iters 4 --path permute --window 64 --landmark-stride 64 --seed 42 --permute-prepermute-mode auto --permute-memory-budget-multiplier 1.0 --out-dir benchmarks/mlx/glm_4_7_flash_4bit_wayfinder/20260207_glm_stable_median","controls":{"retro_backfill_enabled":false,"batch":1,"window":64,"landmark_stride":64,"path":"permute","baseline_path":"benchmarks/mlx/glm_4_7_flash_4bit_wayfinder/20260207_glm_long_smoke/results.json"},"metrics":{"status":"pending"},"decision":"pending","next_action":"run stable benchmark and compare absolute/delta/% vs dense and prior smoke"}
{"id":"EXP-20260207-190427-GLM-FULL-SWAP-SMOKE-RESULT","date":"2026-02-07","question":"Can all GLM transformer self_attn layers be swapped to Wayfinder without forward breakage?","hypothesis":"swap_glm_attention_with_wayfinder will replace all attention layers and full-model forward smoke will succeed.","change_set":["hcsa/integrations/glm_mlx.py","scripts/bench_glm_wayfinder_mlx.py"],"command":"PYTHONPATH=. python3 scripts/bench_glm_wayfinder_mlx.py --model-path mlx-community/GLM-4.7-Flash-4bit --seq-lens 1024 --batch 1 --warmup 1 --iters 1 --path permute --window 64 --landmark-stride 64 --seed 42 --permute-prepermute-mode auto --permute-memory-budget-multiplier 1.0 --full-swap --out-dir benchmarks/mlx/glm_4_7_flash_4bit_wayfinder/20260207_glm_full_swap_smoke","controls":{"retro_backfill_enabled":false,"batch":1,"full_swap":true,"baseline_path":"benchmarks/mlx/glm_4_7_flash_4bit_wayfinder/20260207_glm_integration_smoke/results.json"},"metrics":{"results_path":"benchmarks/mlx/glm_4_7_flash_4bit_wayfinder/20260207_glm_full_swap_smoke/results.json","t1024":{"attention_ratio":0.7755797894119807,"block_ratio":0.8719737015670235,"block_memory_reduction_pct":24.94049418513409},"full_swap":{"replaced_layers":47,"smoke_seq_len":256,"tokens_per_sec":11.799322062116367,"peak_memory_bytes":17016685356}},"decision":"keep","next_action":"run extended full-model throughput benchmark separately from layer-level kernel benchmark"}
{"id":"EXP-20260207-190617-GLM-STABLE-MEDIAN-RESULT","date":"2026-02-07","question":"Do GLM Wayfinder gains persist under stricter median benchmarking?","hypothesis":"Wayfinder remains >1.0x at 4096 and 8192 with substantial memory reduction vs dense.","change_set":["measurement only"],"command":"PYTHONPATH=. python3 scripts/bench_glm_wayfinder_mlx.py --model-path mlx-community/GLM-4.7-Flash-4bit --seq-lens 2048 4096 8192 --batch 1 --warmup 2 --iters 4 --path permute --window 64 --landmark-stride 64 --seed 42 --permute-prepermute-mode auto --permute-memory-budget-multiplier 1.0 --out-dir benchmarks/mlx/glm_4_7_flash_4bit_wayfinder/20260207_glm_stable_median","controls":{"retro_backfill_enabled":false,"batch":1,"window":64,"landmark_stride":64,"path":"permute","baseline_path":"benchmarks/mlx/glm_4_7_flash_4bit_wayfinder/20260207_glm_long_smoke/results.json"},"metrics":{"results_path":"benchmarks/mlx/glm_4_7_flash_4bit_wayfinder/20260207_glm_stable_median/results.json","t2048":{"attention":{"dense_tokens_per_sec":71451.68315367037,"wayfinder_tokens_per_sec":85843.99968652728,"absolute_tokens_per_sec":85843.99968652728,"delta_tokens_per_sec_vs_dense":14392.316532856916,"delta_tokens_per_sec_pct_vs_dense":20.142592862014244,"dense_peak_memory_bytes":426232364,"wayfinder_peak_memory_bytes":209706682,"delta_peak_memory_bytes_vs_dense":-216525682,"delta_peak_memory_pct_vs_dense":-50.799915794287266,"memory_reduction_pct":50.799915794287266},"block":{"dense_tokens_per_sec":36382.80151478575,"wayfinder_tokens_per_sec":39499.69723333428,"absolute_tokens_per_sec":39499.69723333428,"delta_tokens_per_sec_vs_dense":3116.89571854853,"delta_tokens_per_sec_pct_vs_dense":8.565613834110888,"dense_peak_memory_bytes":604891708,"wayfinder_peak_memory_bytes":377596464,"delta_peak_memory_bytes_vs_dense":-227295244,"delta_peak_memory_pct_vs_dense":-37.57618776946435,"memory_reduction_pct":37.576187769464354},"sanity_mae":0.0036354234907776117},"t4096":{"attention":{"dense_tokens_per_sec":44051.98611123814,"wayfinder_tokens_per_sec":87843.26686440197,"absolute_tokens_per_sec":87843.26686440197,"delta_tokens_per_sec_vs_dense":43791.28075316383,"delta_tokens_per_sec_pct_vs_dense":99.40744741243243,"dense_peak_memory_bytes":1220160044,"wayfinder_peak_memory_bytes":443487550,"delta_peak_memory_bytes_vs_dense":-776672494,"delta_peak_memory_pct_vs_dense":-63.65470622597713,"memory_reduction_pct":63.65470622597713},"block":{"dense_tokens_per_sec":26401.44113211477,"wayfinder_tokens_per_sec":40480.412913203865,"absolute_tokens_per_sec":40480.412913203865,"delta_tokens_per_sec_vs_dense":14078.971781089094,"delta_tokens_per_sec_pct_vs_dense":53.32696981833128,"dense_peak_memory_bytes":1457400372,"wayfinder_peak_memory_bytes":708160048,"delta_peak_memory_bytes_vs_dense":-749240324,"delta_peak_memory_pct_vs_dense":-51.41094652371881,"memory_reduction_pct":51.41094652371881},"sanity_mae":0.004085819236934185},"t8192":{"attention":{"dense_tokens_per_sec":24506.41489237214,"wayfinder_tokens_per_sec":94958.58806103375,"absolute_tokens_per_sec":94958.58806103375,"delta_tokens_per_sec_vs_dense":70452.17316866161,"delta_tokens_per_sec_pct_vs_dense":287.4812450165928,"dense_peak_memory_bytes":3756436012,"wayfinder_peak_memory_bytes":832416304,"delta_peak_memory_bytes_vs_dense":-2924019708,"delta_peak_memory_pct_vs_dense":-77.84122136339359,"memory_reduction_pct":77.84122136339359},"block":{"dense_tokens_per_sec":17567.94336575785,"wayfinder_tokens_per_sec":40887.708000280174,"absolute_tokens_per_sec":40887.708000280174,"delta_tokens_per_sec_vs_dense":23319.764634522326,"delta_tokens_per_sec_pct_vs_dense":132.7408530752927,"dense_peak_memory_bytes":3941444150,"wayfinder_peak_memory_bytes":1369287220,"delta_peak_memory_bytes_vs_dense":-2572156930,"delta_peak_memory_pct_vs_dense":-65.25779938451723,"memory_reduction_pct":65.25779938451723},"sanity_mae":0.004063078202307224}},"decision":"keep","next_action":"run 16384/32768 stable median sweep and publish measured GLM benchmark section"}
{"id":"EXP-20260207-190908-GLM-MAXCTX-PROBE","date":"2026-02-07","question":"Can GLM Wayfinder run up to max context 202752 on this machine, and what are latency/memory trends as T scales?","hypothesis":"Wayfinder layer-level prefill should extend far beyond 8192 and may reach 202752 with substantial runtime while avoiding dense O(T^2) infeasibility.","change_set":["measurement only"],"command":"PYTHONPATH=. python3 - <<'PY' (progressive GLMWayfinderAttention layer probe for T in [16384,32768,65536,98304,131072,163840,202752]) PY","controls":{"retro_backfill_enabled":false,"batch":1,"path":"permute","window":64,"landmark_stride":64,"layer":"model.layers[0].self_attn","baseline_path":"benchmarks/mlx/glm_4_7_flash_4bit_wayfinder/20260207_glm_stable_median/results.json"},"metrics":{"status":"pending"},"decision":"pending","next_action":"run progressive max-context probe and capture success/failure + time + peak memory per T"}
{"id":"EXP-20260207-190908-GLM-MAXCTX-PROBE-RESULT","date":"2026-02-07","question":"Can GLM Wayfinder run up to max context 202752 on this machine, and what are latency/memory trends as T scales?","hypothesis":"Wayfinder layer-level prefill should extend far beyond 8192 and may reach 202752 with substantial runtime while avoiding dense O(T^2) infeasibility.","change_set":["measurement only"],"command":"progressive maxctx layer probe with rungs [16384,32768,65536,98304,131072,163840,202752] and per-rung timeout guards","controls":{"retro_backfill_enabled":false,"batch":1,"path":"permute","window":64,"landmark_stride":64,"layer":"model.layers[0].self_attn","baseline_path":"benchmarks/mlx/glm_4_7_flash_4bit_wayfinder/20260207_glm_stable_median/results.json"},"metrics":{"results_path":"benchmarks/mlx/glm_4_7_flash_4bit_wayfinder/20260207_191444_maxctx_wayfinder_layer_probe/summary.json","max_success_seq_len":131072,"failure_seq_len":163840,"failure_error":"RuntimeError: [metal::malloc] Attempting to allocate 34419507200 bytes which is greater than the maximum allowed buffer size of 22613000192 bytes.","rungs":{"16384":{"ok":true,"sec":19.03778487499949,"tok_s":860.6043249031325,"peak_memory_bytes":1577896492},"32768":{"ok":true,"sec":62.71172145899618,"tok_s":522.5179478038285,"peak_memory_bytes":3143371308},"65536":{"ok":true,"sec":229.3751637919995,"tok_s":285.7153273116741,"peak_memory_bytes":7180126190},"98304":{"ok":true,"sec":529.1717826669992,"tok_s":185.76954255677197,"peak_memory_bytes":15804927090},"131072":{"ok":true,"sec":885.4793157080057,"tok_s":148.02378516905085,"peak_memory_bytes":27773636722},"163840":{"ok":false}}},"decision":"follow_up","next_action":"rerun high-context probe with landmark_stride=None to reduce graph memory and continue toward 202752"}
{"id":"EXP-20260207-200906-GLM-MAXCTX-NOLANDMARK","date":"2026-02-07","question":"Can we reach 202752 context when landmark edges are disabled?","hypothesis":"Setting landmark_stride=None should reduce graph memory and allow higher max context than the default stride=64 probe.","change_set":["measurement only: landmark_stride=None"],"command":"PYTHONPATH=. python3 - <<'PY' (no-landmark layer probe for T in [163840,202752] with long timeouts) PY","controls":{"retro_backfill_enabled":false,"batch":1,"path":"permute","window":64,"landmark_stride":null,"layer":"model.layers[0].self_attn","baseline_path":"benchmarks/mlx/glm_4_7_flash_4bit_wayfinder/20260207_191444_maxctx_wayfinder_layer_probe/summary.json"},"metrics":{"status":"pending"},"decision":"pending","next_action":"run no-landmark max-context probe and compare max successful T"}
{"id":"EXP-20260207-201256-GLM-FULLMODEL-PREFILL-KV-CHECKPOINT","date":"2026-02-07","question":"At full-model scale, does prefill+1 token reveal KV-cache-dominated memory growth versus prefill-only?","hypothesis":"Wayfinder should keep attention workspace manageable, but full-model prefill+1 should increase peak memory beyond prefill-only due to retained KV cache.","change_set":["measurement only"],"command":"PYTHONPATH=. python3 - <<'PY' (full-model Wayfinder full-swap prefill-only vs prefill+1 at T=[32768,65536]) PY","controls":{"retro_backfill_enabled":false,"full_swap":true,"landmark_stride":null,"path":"permute","window":64,"batch":1,"baseline_path":"benchmarks/mlx/glm_4_7_flash_4bit_wayfinder/20260207_200939_maxctx_nolandmark_probe/summary.json"},"metrics":{"status":"pending"},"decision":"pending","next_action":"collect full-model prefill-only and prefill+1 peaks/times and compare delta"}
{"id":"EXP-20260207-202313-GLM-NOLANDMARK-DELTA131072","date":"2026-02-07","question":"At fixed T=131072, how much does landmark_stride=None change runtime and memory vs landmark_stride=64?","hypothesis":"landmark_stride=None should reduce graph build and peak memory significantly at the same T.","change_set":["measurement only"],"command":"PYTHONPATH=. python3 - <<'PY' (single-layer GLM Wayfinder probe at T=131072 with landmark_stride=None) PY","controls":{"retro_backfill_enabled":false,"batch":1,"path":"permute","window":64,"landmark_stride":null,"baseline_path":"benchmarks/mlx/glm_4_7_flash_4bit_wayfinder/20260207_191444_maxctx_wayfinder_layer_probe/summary.json"},"metrics":{"status":"pending"},"decision":"pending","next_action":"compute absolute and delta/% vs baseline T=131072"}
{"id":"EXP-20260207-200906-GLM-MAXCTX-NOLANDMARK-RESULT","date":"2026-02-07","question":"Can we reach 202752 context when landmark edges are disabled?","hypothesis":"Setting landmark_stride=None should reduce graph memory and allow higher max context than the default stride=64 probe.","change_set":["measurement only: landmark_stride=None"],"command":"no-landmark layer probe for T=[163840,202752] with long timeout guards","controls":{"retro_backfill_enabled":false,"batch":1,"path":"permute","window":64,"landmark_stride":null,"layer":"model.layers[0].self_attn","baseline_path":"benchmarks/mlx/glm_4_7_flash_4bit_wayfinder/20260207_191444_maxctx_wayfinder_layer_probe/summary.json"},"metrics":{"results_path":"benchmarks/mlx/glm_4_7_flash_4bit_wayfinder/20260207_200939_maxctx_nolandmark_probe/summary.json","t163840":{"ok":true,"sec":70.4445475829998,"tok_s":2325.8010111706512,"peak_memory_bytes":15667546668},"t202752":{"ok":true,"sec":88.05871583300177,"tok_s":2302.463737769097,"peak_memory_bytes":19386010156},"baseline_comparison":{"t163840":"baseline failed; delta/% undefined","t202752":"no baseline success; delta/% undefined"}},"decision":"keep","next_action":"add fixed-T apples-to-apples comparison at T=131072 vs baseline stride=64"}
{"id":"EXP-20260207-202313-GLM-NOLANDMARK-DELTA131072-RESULT","date":"2026-02-07","question":"At fixed T=131072, how much does landmark_stride=None change runtime and memory vs landmark_stride=64?","hypothesis":"landmark_stride=None should reduce graph build and peak memory significantly at the same T.","change_set":["measurement only"],"command":"single-layer GLM Wayfinder probe at T=131072 with landmark_stride=None","controls":{"retro_backfill_enabled":false,"batch":1,"path":"permute","window":64,"landmark_stride":null,"baseline_path":"benchmarks/mlx/glm_4_7_flash_4bit_wayfinder/20260207_191444_maxctx_wayfinder_layer_probe/summary.json"},"metrics":{"absolute":{"seq_len":131072,"sec":55.046618874999695,"tok_s":2381.1090068517988,"peak_memory_bytes":12536515116},"baseline":{"seq_len":131072,"sec":885.4793157080057,"tok_s":148.02378516905085,"peak_memory_bytes":27773636722},"delta_vs_baseline":{"sec":-830.432696833006,"sec_pct":-93.78340996808198,"tok_s":2233.085221682748,"tok_s_pct":1508.5989181620025,"peak_memory_bytes":-15237121606,"peak_memory_pct":-54.86181647191489,"memory_reduction_pct":54.86181647191489}},"decision":"keep","next_action":"use no-landmark mode for max-context stress tests and evaluate quality implications"}
