{"id":"EXP-20260225T184500Z-QWEN35A3B-VISIBLE-OUTPUT-CHECK-RESULT","date":"2026-02-25","question":"For a concrete prompt, do dense and Wayfinder+dense-decode produce the same visible output on Qwen3.5-35B-A3B under the current setup?","hypothesis":"Outputs should be the same or very close on a deterministic short extraction task when decode backend is dense.","change_set":["measurement-only","notes/LAB_NOTEBOOK.md","notes/experiments.ndjson"],"command":"python3 scripts/bench_qwen_consumer_mlx.py --model-path /Volumes/VIXinSSD/models/Qwen3.5-35B-A3B-MLX-4bit --mode dense --seq-lens 8192 --decode-len 24 --repeats 1 --chunk-size 4096 --kv-step 4096 --cooldown-sec 5 --seed 42 --hf-home /Volumes/VIXinSSD/hf_cache --hf-hub-cache /Volumes/VIXinSSD/hf_cache/hub --hf-offline --quality-dataset benchmarks/mlx/qwen3_1_7b_wayfinder/quality_eval_qwen3_consumer_v1.json --quality-task-id-filter extract-01 --skip-single-turn --skip-multi-turn --out-dir benchmarks/mlx/qwen3_5_35b_a3b_wayfinder/EXP-20260225T184500Z-QWEN35A3B-VISIBLE-OUTPUT-CHECK/dense && python3 scripts/bench_qwen_consumer_mlx.py --model-path /Volumes/VIXinSSD/models/Qwen3.5-35B-A3B-MLX-4bit --mode wayfinder --debug-wayfinder-decode-backend dense --seq-lens 8192 --decode-len 24 --repeats 1 --chunk-size 4096 --kv-step 4096 --cooldown-sec 5 --window 64 --landmark-stride 64 --num-cycles 1 --head-chunk-size 2 --query-chunk-size 384 --seed 42 --hf-home /Volumes/VIXinSSD/hf_cache --hf-hub-cache /Volumes/VIXinSSD/hf_cache/hub --hf-offline --quality-dataset benchmarks/mlx/qwen3_1_7b_wayfinder/quality_eval_qwen3_consumer_v1.json --quality-task-id-filter extract-01 --skip-single-turn --skip-multi-turn --out-dir benchmarks/mlx/qwen3_5_35b_a3b_wayfinder/EXP-20260225T184500Z-QWEN35A3B-VISIBLE-OUTPUT-CHECK/wayfinder_dense_decode","controls":{"one_process_at_a_time":true,"task_id":"extract-01","decode_backend_wayfinder":"dense","hf_home":"/Volumes/VIXinSSD/hf_cache","hf_hub_cache":"/Volumes/VIXinSSD/hf_cache/hub","hf_hub_offline":1},"metrics":{"status":"completed","artifacts":["benchmarks/mlx/qwen3_5_35b_a3b_wayfinder/EXP-20260225T184500Z-QWEN35A3B-VISIBLE-OUTPUT-CHECK/dense/results.json","benchmarks/mlx/qwen3_5_35b_a3b_wayfinder/EXP-20260225T184500Z-QWEN35A3B-VISIBLE-OUTPUT-CHECK/wayfinder_dense_decode/results.json"],"dense":{"expected":"Q9X4","correct":true,"output":"<think>\n\n</think>\n\nQ9X4<|endoftext|><|im_start|><|im_start|>assistant\n<think>\n\n</think>\n\nQ9X4<|endoftext|><|im_start|>"},"wayfinder_dense_decode":{"expected":"Q9X4","correct":true,"output":"<think>\n\n</think>\n\nQ9X4<|endoftext|><|im_start|><|im_start|>assistant<think>\n\n</think>\n\nQ9X4<|endoftext|><|im_start|><|im_start|>"},"verdict":"semantic_match_single_task"},"decision":"keep","next_action":"Scale visible parity check to all tasks in quality_eval_qwen3_consumer_v1.json if strict parity confidence is needed."}
{"id":"EXP-20260225T185200Z-LMSTUDIO-WAYFINDER-BRIDGE-PRERUN","date":"2026-02-25","question":"Can we expose local Qwen3.5 Wayfinder through an OpenAI-compatible endpoint that LM Studio can target?","hypothesis":"A small FastAPI bridge that loads Qwen3.5, swaps Wayfinder attention, and serves /v1/chat/completions should enable LM Studio plugin routing.","change_set":["scripts/serve_qwen_wayfinder_openai.py","docs/LM_STUDIO_WAYFINDER_SETUP.md"],"command":"python3 -m py_compile scripts/serve_qwen_wayfinder_openai.py && python3 scripts/serve_qwen_wayfinder_openai.py --help && python3 scripts/serve_qwen_wayfinder_openai.py --model-path /Volumes/VIXinSSD/models/Qwen3.5-35B-A3B-MLX-4bit --mode wayfinder --host 127.0.0.1 --port 8012 --hf-home /Volumes/VIXinSSD/hf_cache --hf-hub-cache /Volumes/VIXinSSD/hf_cache/hub --hf-offline --window 64 --landmark-stride 64 --num-cycles 1 --head-chunk-size 2 --query-chunk-size 384","controls":{"one_inference_at_a_time":true,"wayfinder_decode_backend":"dense","hf_home":"/Volumes/VIXinSSD/hf_cache","hf_hub_cache":"/Volumes/VIXinSSD/hf_cache/hub","hf_hub_offline":1,"stop_gates":["server startup failure","missing /health","missing /v1/models","/v1/chat/completions failure"]},"metrics":{"status":"pending","artifacts_expected":["scripts/serve_qwen_wayfinder_openai.py","docs/LM_STUDIO_WAYFINDER_SETUP.md"]},"decision":"pending","next_action":"Run startup + endpoint smoke checks and record RESULT."}
{"id":"EXP-20260225T185200Z-LMSTUDIO-WAYFINDER-BRIDGE-RESULT","date":"2026-02-25","question":"Can we expose local Qwen3.5 Wayfinder through an OpenAI-compatible endpoint that LM Studio can target?","hypothesis":"A small FastAPI bridge that loads Qwen3.5, swaps Wayfinder attention, and serves /v1/chat/completions should enable LM Studio plugin routing.","change_set":["scripts/serve_qwen_wayfinder_openai.py","docs/LM_STUDIO_WAYFINDER_SETUP.md","notes/LAB_NOTEBOOK.md","notes/experiments.ndjson"],"command":"python3 scripts/serve_qwen_wayfinder_openai.py --model-path /Volumes/VIXinSSD/models/Qwen3.5-35B-A3B-MLX-4bit --mode wayfinder --host 127.0.0.1 --port 8012 --hf-home /Volumes/VIXinSSD/hf_cache --hf-hub-cache /Volumes/VIXinSSD/hf_cache/hub --hf-offline --window 64 --landmark-stride 64 --num-cycles 1 --head-chunk-size 2 --query-chunk-size 384","controls":{"one_inference_at_a_time":true,"wayfinder_decode_backend":"dense","hf_home":"/Volumes/VIXinSSD/hf_cache","hf_hub_cache":"/Volumes/VIXinSSD/hf_cache/hub","hf_hub_offline":1},"metrics":{"status":"completed","server_startup":{"wayfinder_layers_replaced":10,"health_ok":true},"endpoints":{"health":{"ok":true,"model":"Qwen3.5-35B-A3B-MLX-4bit-wayfinder","mode":"wayfinder","busy":false},"models":{"ids":["Qwen3.5-35B-A3B-MLX-4bit-wayfinder"]},"chat_completions_http_status":200}},"decision":"keep","next_action":"Configure LM Studio openai-compat-endpoint generator with base URL http://127.0.0.1:8012/v1 and model Qwen3.5-35B-A3B-MLX-4bit-wayfinder."}
{"id":"EXP-20260225T190500Z-QWEN35A3B-STABLE-FULLRERUN-PRERUN","date":"2026-02-25","question":"Under stronger warmup and repeated measurements, is Wayfinder actually better or worse than dense for Qwen3.5-35B-A3B at T={2048,8192} with dense decode backend?","hypothesis":"Additional warmup plus repeats=3 will reduce run-to-run noise and provide a stable dense-vs-wayfinder comparison.","change_set":["measurement-only"],"command":"python3 scripts/bench_qwen_consumer_mlx.py --model-path /Volumes/VIXinSSD/models/Qwen3.5-35B-A3B-MLX-4bit --mode dense --seq-lens 2048 --decode-len 16 --repeats 1 --chunk-size 4096 --kv-step 4096 --cooldown-sec 5 --seed 42 --skip-multi-turn --skip-quality --hf-home /Volumes/VIXinSSD/hf_cache --hf-hub-cache /Volumes/VIXinSSD/hf_cache/hub --hf-offline --out-dir benchmarks/mlx/qwen3_5_35b_a3b_wayfinder/EXP-20260225T190500Z-QWEN35A3B-STABLE-FULLRERUN/prewarm_dense && python3 scripts/bench_qwen_consumer_mlx.py --model-path /Volumes/VIXinSSD/models/Qwen3.5-35B-A3B-MLX-4bit --mode wayfinder --debug-wayfinder-decode-backend dense --seq-lens 2048 --decode-len 16 --repeats 1 --chunk-size 4096 --kv-step 4096 --cooldown-sec 5 --window 64 --landmark-stride 64 --num-cycles 1 --head-chunk-size 2 --query-chunk-size 384 --seed 42 --skip-multi-turn --skip-quality --hf-home /Volumes/VIXinSSD/hf_cache --hf-hub-cache /Volumes/VIXinSSD/hf_cache/hub --hf-offline --out-dir benchmarks/mlx/qwen3_5_35b_a3b_wayfinder/EXP-20260225T190500Z-QWEN35A3B-STABLE-FULLRERUN/prewarm_wayfinder && python3 scripts/bench_qwen_consumer_mlx.py --model-path /Volumes/VIXinSSD/models/Qwen3.5-35B-A3B-MLX-4bit --mode dense --seq-lens 2048 8192 --decode-len 32 --repeats 3 --chunk-size 4096 --kv-step 4096 --cooldown-sec 10 --seed 42 --heartbeat-sec 30 --stage-timeout-sec 2400 --skip-multi-turn --skip-quality --hf-home /Volumes/VIXinSSD/hf_cache --hf-hub-cache /Volumes/VIXinSSD/hf_cache/hub --hf-offline --out-dir benchmarks/mlx/qwen3_5_35b_a3b_wayfinder/EXP-20260225T190500Z-QWEN35A3B-STABLE-FULLRERUN/dense && python3 scripts/bench_qwen_consumer_mlx.py --model-path /Volumes/VIXinSSD/models/Qwen3.5-35B-A3B-MLX-4bit --mode wayfinder --debug-wayfinder-decode-backend dense --seq-lens 2048 8192 --decode-len 32 --repeats 3 --chunk-size 4096 --kv-step 4096 --cooldown-sec 10 --window 64 --landmark-stride 64 --num-cycles 1 --head-chunk-size 2 --query-chunk-size 384 --seed 42 --heartbeat-sec 30 --stage-timeout-sec 2400 --skip-multi-turn --skip-quality --hf-home /Volumes/VIXinSSD/hf_cache --hf-hub-cache /Volumes/VIXinSSD/hf_cache/hub --hf-offline --out-dir benchmarks/mlx/qwen3_5_35b_a3b_wayfinder/EXP-20260225T190500Z-QWEN35A3B-STABLE-FULLRERUN/wayfinder","controls":{"model_path":"/Volumes/VIXinSSD/models/Qwen3.5-35B-A3B-MLX-4bit","one_process_at_a_time":true,"wayfinder_decode_backend":"dense","seq_lens":[2048,8192],"decode_len":32,"repeats":3,"seed":42,"hf_home":"/Volumes/VIXinSSD/hf_cache","hf_hub_cache":"/Volumes/VIXinSSD/hf_cache/hub","hf_hub_offline":1,"retro_backfill_inference":"off","baseline":"benchmarks/mlx/qwen3_5_35b_a3b_wayfinder/EXP-20260225T182700Z-QWEN35A3B-COMPAT-RERUN"},"metrics":{"status":"pending","artifacts_expected":["benchmarks/mlx/qwen3_5_35b_a3b_wayfinder/EXP-20260225T190500Z-QWEN35A3B-STABLE-FULLRERUN/dense/results.json","benchmarks/mlx/qwen3_5_35b_a3b_wayfinder/EXP-20260225T190500Z-QWEN35A3B-STABLE-FULLRERUN/wayfinder/results.json"],"required":["single_turn[].seq_len","single_turn[].prefill_sec","single_turn[].decode_sec","single_turn[].e2e_sec","single_turn[].decode_tok_s","single_turn[].peak_memory_bytes"]},"decision":"pending","next_action":"Execute sequential run and summarize dense-vs-wayfinder deltas at each seq length."}
{"id":"EXP-20260225T190500Z-QWEN35A3B-STABLE-FULLRERUN-RESULT","date":"2026-02-25","question":"Under stronger warmup and repeated measurements, is Wayfinder actually better or worse than dense for Qwen3.5-35B-A3B at T={2048,8192} with dense decode backend?","hypothesis":"Additional warmup plus repeats=3 will reduce run-to-run noise and provide a stable dense-vs-wayfinder comparison.","change_set":["measurement-only","notes/LAB_NOTEBOOK.md","notes/experiments.ndjson"],"command":"sequential execution of 4 commands from PRERUN (prewarm dense, prewarm wayfinder, measured dense repeats=3, measured wayfinder repeats=3)","controls":{"model_path":"/Volumes/VIXinSSD/models/Qwen3.5-35B-A3B-MLX-4bit","one_process_at_a_time":true,"wayfinder_decode_backend":"dense","seq_lens":[2048,8192],"decode_len":32,"repeats":3,"seed":42,"hf_home":"/Volumes/VIXinSSD/hf_cache","hf_hub_cache":"/Volumes/VIXinSSD/hf_cache/hub","hf_hub_offline":1,"retro_backfill_inference":"off"},"metrics":{"status":"completed","artifacts":{"dense":"benchmarks/mlx/qwen3_5_35b_a3b_wayfinder/EXP-20260225T190500Z-QWEN35A3B-STABLE-FULLRERUN/dense/results.json","wayfinder":"benchmarks/mlx/qwen3_5_35b_a3b_wayfinder/EXP-20260225T190500Z-QWEN35A3B-STABLE-FULLRERUN/wayfinder/results.json"},"summary_all_repeats_median":{"2048":{"dense":{"prefill_sec":1.8973267080000369,"decode_sec":1.0816216660023201,"e2e_sec":2.9617086670041317,"decode_tok_s":29.585206182372605,"peak_memory_bytes":24935466998},"wayfinder":{"prefill_sec":1.8564709999918705,"decode_sec":1.1214337919955142,"e2e_sec":2.9779047919873847,"decode_tok_s":28.53489900911422,"peak_memory_bytes":24976397290},"delta_wayfinder_minus_dense":{"prefill_sec_abs":-0.0408557080081664,"prefill_sec_pct":-2.1533301479338904,"decode_sec_abs":0.03981212599319406,"decode_sec_pct":3.680781112710131,"e2e_sec_abs":0.016196124983252957,"e2e_sec_pct":0.5468507137008815,"decode_tok_s_abs":-1.0503071732583855,"decode_tok_s_pct":-3.550109357981008,"peak_memory_bytes_abs":40930292,"peak_memory_bytes_pct":0.1641448784708259,"memory_reduction_pct_convention":-0.16414487847082881}},"8192":{"dense":{"prefill_sec":13.562044916994637,"decode_sec":15.037383499991847,"e2e_sec":25.557442416989943,"decode_tok_s":2.1280297865660835,"peak_memory_bytes":29371883558},"wayfinder":{"prefill_sec":14.320852542005014,"decode_sec":5.833926874998724,"e2e_sec":23.93463287501072,"decode_tok_s":5.4851561710750785,"peak_memory_bytes":29373458886},"delta_wayfinder_minus_dense":{"prefill_sec_abs":0.7588076250103768,"prefill_sec_pct":5.595082671194466,"decode_sec_abs":-9.203456624993123,"decode_sec_pct":-61.20384324173227,"e2e_sec_abs":-1.6228095419792226,"e2e_sec_pct":-6.3496554760910655,"decode_tok_s_abs":3.357126384508995,"decode_tok_s_pct":157.7574903181339,"peak_memory_bytes_abs":1575328,"peak_memory_bytes_pct":0.005363387734018607,"memory_reduction_pct_convention":-0.005363387734025338}}},"summary_repeats_2_3_mean":{"2048":{"dense":{"prefill_sec":1.882255875003466,"decode_sec":1.0730018125032075,"e2e_sec":2.9552576875066734,"decode_tok_s":29.82480075730481},"wayfinder":{"prefill_sec":1.853731291492295,"decode_sec":1.0884000004953123,"e2e_sec":2.9421312919876073,"decode_tok_s":29.428063766818497}},"8192":{"dense":{"prefill_sec":12.956330646491551,"decode_sec":15.39542585399613,"e2e_sec":28.35175650048768,"decode_tok_s":2.0796642594254373},"wayfinder":{"prefill_sec":11.793585917002929,"decode_sec":8.4038667920031,"e2e_sec":20.19745270900603,"decode_tok_s":5.3353992006543125}}},"wayfinder_dense_fallback_reason_counts_total":{"wayfinder_decode_dense":1536,"active_large_q":24}},"decision":"follow-up","next_action":"Use repeats>=5 and report median-of-last-3 as official metric; current run indicates near-parity at 2048 and wayfinder win at 8192 under dense decode backend."}
{"id":"EXP-20260225T192700Z-QWEN35A3B-16KPLUS-PRERUN","date":"2026-02-25","question":"At 16k and above (16384, 32768), is Wayfinder better or worse than dense on Qwen3.5-35B-A3B under dense-decode policy?","hypothesis":"Wayfinder may pull ahead at longer contexts where routing overhead amortizes.","change_set":["measurement-only"],"command":"python3 scripts/bench_qwen_consumer_mlx.py --model-path /Volumes/VIXinSSD/models/Qwen3.5-35B-A3B-MLX-4bit --mode dense --seq-lens 2048 --decode-len 16 --repeats 1 --chunk-size 4096 --kv-step 4096 --cooldown-sec 5 --seed 42 --skip-multi-turn --skip-quality --hf-home /Volumes/VIXinSSD/hf_cache --hf-hub-cache /Volumes/VIXinSSD/hf_cache/hub --hf-offline --out-dir benchmarks/mlx/qwen3_5_35b_a3b_wayfinder/EXP-20260225T192700Z-QWEN35A3B-16KPLUS/prewarm_dense && python3 scripts/bench_qwen_consumer_mlx.py --model-path /Volumes/VIXinSSD/models/Qwen3.5-35B-A3B-MLX-4bit --mode wayfinder --debug-wayfinder-decode-backend dense --seq-lens 2048 --decode-len 16 --repeats 1 --chunk-size 4096 --kv-step 4096 --cooldown-sec 5 --window 64 --landmark-stride 64 --num-cycles 1 --head-chunk-size 2 --query-chunk-size 384 --seed 42 --skip-multi-turn --skip-quality --hf-home /Volumes/VIXinSSD/hf_cache --hf-hub-cache /Volumes/VIXinSSD/hf_cache/hub --hf-offline --out-dir benchmarks/mlx/qwen3_5_35b_a3b_wayfinder/EXP-20260225T192700Z-QWEN35A3B-16KPLUS/prewarm_wayfinder && python3 scripts/bench_qwen_consumer_mlx.py --model-path /Volumes/VIXinSSD/models/Qwen3.5-35B-A3B-MLX-4bit --mode dense --seq-lens 16384 32768 --decode-len 32 --repeats 1 --chunk-size 4096 --kv-step 4096 --cooldown-sec 15 --seed 42 --heartbeat-sec 30 --stage-timeout-sec 3600 --skip-multi-turn --skip-quality --hf-home /Volumes/VIXinSSD/hf_cache --hf-hub-cache /Volumes/VIXinSSD/hf_cache/hub --hf-offline --out-dir benchmarks/mlx/qwen3_5_35b_a3b_wayfinder/EXP-20260225T192700Z-QWEN35A3B-16KPLUS/dense && python3 scripts/bench_qwen_consumer_mlx.py --model-path /Volumes/VIXinSSD/models/Qwen3.5-35B-A3B-MLX-4bit --mode wayfinder --debug-wayfinder-decode-backend dense --seq-lens 16384 32768 --decode-len 32 --repeats 1 --chunk-size 4096 --kv-step 4096 --cooldown-sec 15 --window 64 --landmark-stride 64 --num-cycles 1 --head-chunk-size 2 --query-chunk-size 384 --seed 42 --heartbeat-sec 30 --stage-timeout-sec 3600 --skip-multi-turn --skip-quality --hf-home /Volumes/VIXinSSD/hf_cache --hf-hub-cache /Volumes/VIXinSSD/hf_cache/hub --hf-offline --out-dir benchmarks/mlx/qwen3_5_35b_a3b_wayfinder/EXP-20260225T192700Z-QWEN35A3B-16KPLUS/wayfinder","controls":{"model_path":"/Volumes/VIXinSSD/models/Qwen3.5-35B-A3B-MLX-4bit","one_process_at_a_time":true,"wayfinder_decode_backend":"dense","seq_lens":[16384,32768],"decode_len":32,"repeats":1,"seed":42,"hf_home":"/Volumes/VIXinSSD/hf_cache","hf_hub_cache":"/Volumes/VIXinSSD/hf_cache/hub","hf_hub_offline":1},"metrics":{"status":"pending","artifacts_expected":["benchmarks/mlx/qwen3_5_35b_a3b_wayfinder/EXP-20260225T192700Z-QWEN35A3B-16KPLUS/dense/results.json","benchmarks/mlx/qwen3_5_35b_a3b_wayfinder/EXP-20260225T192700Z-QWEN35A3B-16KPLUS/wayfinder/results.json"],"required":["single_turn[].seq_len","single_turn[].prefill_sec","single_turn[].decode_sec","single_turn[].e2e_sec","single_turn[].decode_tok_s","single_turn[].peak_memory_bytes"]},"decision":"pending","next_action":"Execute sequential 16k+ run and summarize dense-vs-wayfinder deltas."}
{"id":"EXP-20260225T192700Z-QWEN35A3B-16KPLUS-RESULT","date":"2026-02-25","question":"At 16k and above (16384, 32768), is Wayfinder better or worse than dense on Qwen3.5-35B-A3B under dense-decode policy?","hypothesis":"Wayfinder may pull ahead at longer contexts where routing overhead amortizes.","change_set":["measurement-only","notes/LAB_NOTEBOOK.md","notes/experiments.ndjson"],"command":"sequential execution of 4 commands from PRERUN (prewarm dense, prewarm wayfinder, measured dense @16384/32768, measured wayfinder @16384/32768)","controls":{"model_path":"/Volumes/VIXinSSD/models/Qwen3.5-35B-A3B-MLX-4bit","one_process_at_a_time":true,"wayfinder_decode_backend":"dense","seq_lens":[16384,32768],"decode_len":32,"repeats":1,"seed":42,"hf_home":"/Volumes/VIXinSSD/hf_cache","hf_hub_cache":"/Volumes/VIXinSSD/hf_cache/hub","hf_hub_offline":1},"metrics":{"status":"completed","artifacts":{"dense":"benchmarks/mlx/qwen3_5_35b_a3b_wayfinder/EXP-20260225T192700Z-QWEN35A3B-16KPLUS/dense/results.json","wayfinder":"benchmarks/mlx/qwen3_5_35b_a3b_wayfinder/EXP-20260225T192700Z-QWEN35A3B-16KPLUS/wayfinder/results.json"},"per_t":{"16384":{"dense":{"prefill_sec":38.97068683299585,"decode_sec":11.869488124997588,"e2e_sec":50.84017495799344,"decode_tok_s":2.6959882063158895,"peak_memory_bytes":30224801930},"wayfinder":{"prefill_sec":46.74731458298629,"decode_sec":14.812119166002958,"e2e_sec":61.55943374898925,"decode_tok_s":2.1603930971232645,"peak_memory_bytes":30226377258,"path_counts":{"permute":8,"permute_dense_fallback":280},"dense_fallback_reason_counts":{"active_large_q":24,"wayfinder_decode_dense":256}},"delta_wayfinder_minus_dense":{"prefill_sec_abs":7.776627749990439,"prefill_sec_pct":19.955069776717647,"decode_sec_abs":2.94263104100537,"decode_sec_pct":24.791558069029772,"e2e_sec_abs":10.71925879099581,"e2e_sec_pct":21.08422876170778,"decode_tok_s_abs":-0.535595109192625,"decode_tok_s_pct":-19.86637433865203,"peak_memory_bytes_abs":1575328,"peak_memory_bytes_pct":0.005212037463962299,"memory_reduction_pct_convention":-0.005212037463953045}},"32768":{"dense":{"prefill_sec":593.9268122499925,"decode_sec":18.487702458005515,"e2e_sec":612.414514707998,"decode_tok_s":1.7308803012536267,"peak_memory_bytes":35264923642},"wayfinder":{"prefill_sec":451.90922691699234,"decode_sec":18.246556124999188,"e2e_sec":470.1557830419915,"decode_tok_s":1.7537556008258202,"peak_memory_bytes":35266498970,"path_counts":{"permute":8,"permute_dense_fallback":312},"dense_fallback_reason_counts":{"active_large_q":56,"wayfinder_decode_dense":256}},"delta_wayfinder_minus_dense":{"prefill_sec_abs":-142.01758533300017,"prefill_sec_pct":-23.91163059215836,"decode_sec_abs":-0.24114633300632704,"decode_sec_pct":-1.304360742250621,"e2e_sec_abs":-142.2587316660065,"e2e_sec_pct":-23.22915741698841,"decode_tok_s_abs":0.022875299572193475,"decode_tok_s_pct":1.321599162901418,"peak_memory_bytes_abs":1575328,"peak_memory_bytes_pct":0.0044671243754624435,"memory_reduction_pct_convention":-0.004467124375473475}}}},"decision":"follow-up","next_action":"Repeat T=16384 with repeats>=3 to determine if the 16k regression is stable or a one-run outlier; retain 32768 win as current evidence."}
{"id":"EXP-20260318T170629Z-QWEN35-9B-CUDA-SHORT-FLEX-PRERUN","date":"2026-03-18","question":"On Qwen3.5-9B CUDA with flex_attention, does Wayfinder prefill stay near dense at short contexts (64 through 8192) while preserving graph-cache hits and producing a divergence row?","hypothesis":"With --engine flex, the full short sweep should complete, including T=64, and Wayfinder should be roughly parity to dense at short T with small overhead at most, because graph construction is amortized by warmup and the sparse kernel replaces the slower non-flex path seen in earlier artifacts.","change_set":["measurement-only"],"command":"source .venv/bin/activate && python scripts/bench_qwen35_cuda_wayfinder.py --model-path /home/hmbown/HF_Models/Qwen3.5-9B --seq-lens 64 128 256 512 1024 2048 4096 8192 --engine flex --warmup 2 --repeats 5 --output benchmarks/cuda/qwen35_wayfinder/EXP-20260318T170629Z-Qwen3.5-9B-short-flex.ndjson","controls":{"baseline_run_path":"benchmarks/cuda/qwen35_wayfinder/EXP-flex-engine-Qwen3.5-9B.ndjson","one_process_at_a_time":true,"retro_backfill_inference":"off","model_path":"/home/hmbown/HF_Models/Qwen3.5-9B","seq_lens":[64,128,256,512,1024,2048,4096,8192],"warmup":2,"repeats":5,"dtype":"bfloat16","engine":"flex","window":64,"landmark_stride":64,"num_cycles":1},"metrics":{"status":"pending","artifacts_expected":["benchmarks/cuda/qwen35_wayfinder/EXP-20260318T170629Z-Qwen3.5-9B-short-flex.ndjson"],"required":["experiment_meta","bench[dense].seq_len","bench[dense].median_ms","bench[dense].prefill_tok_per_sec","bench[dense].peak_mem_gb","bench[wayfinder].seq_len","bench[wayfinder].median_ms","bench[wayfinder].prefill_tok_per_sec","bench[wayfinder].peak_mem_gb","bench[wayfinder].wayfinder_profiles","divergence.cosine_similarity","divergence.top1_agreement","divergence.l2_relative"]},"decision":"pending","next_action":"Run the short Qwen CUDA flex benchmark, inspect the ndjson for missing rows or errors, then append a RESULT entry with absolute metrics and deltas vs the existing flex baseline."}
