{"id":"EXP-20260216T041913Z-GLM-PREFILL-STABILITY-MATRIX256-RESULT","date":"2026-02-16","question":"With the same patch set, is dense-vs-wayfinder performance stable across T={2048,8192,32768,65536} at decode_len=256?","hypothesis":"Wayfinder should preserve or improve e2e/prefill at medium+long contexts and reduce peak memory at long context.","change_set":["measurement only"],"command":"dense+wayfinder decode256 matrix pair","controls":{"dense_path":"benchmarks/mlx/glm_4_7_flash_4bit_wayfinder/20260216_glm_prefill_matrix256_dense/results.json","wayfinder_path":"benchmarks/mlx/glm_4_7_flash_4bit_wayfinder/20260216_glm_prefill_matrix256_wayfinder/results.json","seq_lens":[2048,8192,32768,65536],"decode_len":256},"metrics":{"per_context_delta_vs_dense":{"2048":{"e2e_sec":{"dense":6.435442624962889,"wayfinder":6.128294958965853,"delta_wayfinder_vs_dense":-0.3071476659970358,"delta_pct_wayfinder_vs_dense":-4.772751213811141},"prefill_sec":{"dense":2.435301207995508,"wayfinder":2.0132755839731544,"delta_wayfinder_vs_dense":-0.42202562402235344,"delta_pct_wayfinder_vs_dense":-17.329504154836027},"decode_sec":{"dense":4.000141416967381,"wayfinder":4.115019374992698,"delta_wayfinder_vs_dense":0.11487795802531764,"delta_pct_wayfinder_vs_dense":2.8718474186447596},"ttft_sec":{"dense":0.0730605410062708,"wayfinder":0.0670174999977462,"delta_wayfinder_vs_dense":-0.006043041008524597,"delta_pct_wayfinder_vs_dense":-8.271278757716729},"itl_p95_sec":{"dense":0.015691582986619323,"wayfinder":0.016125999973155558,"delta_wayfinder_vs_dense":0.0004344169865362346,"delta_pct_wayfinder_vs_dense":2.7684713958220457},"decode_tok_s":{"dense":63.99773740851411,"wayfinder":62.211128714419296,"delta_wayfinder_vs_dense":-1.7866086940948165,"delta_pct_wayfinder_vs_dense":-2.7916747785791722},"peak_memory_bytes":{"dense":18284344600.0,"wayfinder":18318769672.0,"delta_wayfinder_vs_dense":34425072.0,"delta_pct_wayfinder_vs_dense":0.18827621527106855},"memory_reduction_pct_convention":-0.18827621527106597},"8192":{"e2e_sec":{"dense":20.987287541967817,"wayfinder":24.262274624954443,"delta_wayfinder_vs_dense":3.2749870829866268,"delta_pct_wayfinder_vs_dense":15.604622924414159},"prefill_sec":{"dense":16.00080945796799,"wayfinder":19.150529707956593,"delta_wayfinder_vs_dense":3.1497202499886043,"delta_pct_wayfinder_vs_dense":19.684755688532526},"decode_sec":{"dense":4.9864780839998275,"wayfinder":5.11174491699785,"delta_wayfinder_vs_dense":0.12526683299802244,"delta_pct_wayfinder_vs_dense":2.512130423273445},"ttft_sec":{"dense":0.13405175000661984,"wayfinder":0.13132129103178158,"delta_wayfinder_vs_dense":-0.002730458974838257,"delta_pct_wayfinder_vs_dense":-2.036869324498501},"itl_p95_sec":{"dense":0.01942191697889939,"wayfinder":0.01985799998510629,"delta_wayfinder_vs_dense":0.0004360830062068999,"delta_pct_wayfinder_vs_dense":2.2453139238555844},"decode_tok_s":{"dense":51.33883989612434,"wayfinder":50.0807462337831,"delta_wayfinder_vs_dense":-1.2580936623412384,"delta_pct_wayfinder_vs_dense":-2.4505689355014315},"peak_memory_bytes":{"dense":20660500140.0,"wayfinder":20610120350.0,"delta_wayfinder_vs_dense":-50379790.0,"delta_pct_wayfinder_vs_dense":-0.24384593624847262},"memory_reduction_pct_convention":0.24384593624847684},"32768":{"e2e_sec":{"dense":156.84632558299927,"wayfinder":129.76856095902622,"delta_wayfinder_vs_dense":-27.077764623973053,"delta_pct_wayfinder_vs_dense":-17.263882034421112},"prefill_sec":{"dense":145.37877608300187,"wayfinder":120.98202075000154,"delta_wayfinder_vs_dense":-24.39675533300033,"delta_pct_wayfinder_vs_dense":-16.78151102267594},"decode_sec":{"dense":11.467549499997403,"wayfinder":8.786540209024679,"delta_wayfinder_vs_dense":-2.6810092909727246,"delta_pct_wayfinder_vs_dense":-23.379094992991586},"ttft_sec":{"dense":2.9117500000284053,"wayfinder":0.18889762501930818,"delta_wayfinder_vs_dense":-2.722852375009097,"delta_pct_wayfinder_vs_dense":-93.51257405280448},"itl_p95_sec":{"dense":0.033674332953523844,"wayfinder":0.034042749961372465,"delta_wayfinder_vs_dense":0.0003684170078486204,"delta_pct_wayfinder_vs_dense":1.0940588143411687},"decode_tok_s":{"dense":22.32386265261449,"wayfinder":29.13547242827862,"delta_wayfinder_vs_dense":6.811609775664131,"delta_pct_wayfinder_vs_dense":30.512684483240086},"peak_memory_bytes":{"dense":26017775484.0,"wayfinder":21978678158.0,"delta_wayfinder_vs_dense":-4039097326.0,"delta_pct_wayfinder_vs_dense":-15.524376126944059},"memory_reduction_pct_convention":15.524376126944063},"65536":{"e2e_sec":{"dense":820.8656070840079,"wayfinder":289.1857847920037,"delta_wayfinder_vs_dense":-531.6798222920042,"delta_pct_wayfinder_vs_dense":-64.77062965041387},"prefill_sec":{"dense":783.318168042053,"wayfinder":273.53528883401304,"delta_wayfinder_vs_dense":-509.78287920803996,"delta_pct_wayfinder_vs_dense":-65.07992537467507},"decode_sec":{"dense":37.54743904195493,"wayfinder":15.650495957990643,"delta_wayfinder_vs_dense":-21.89694308396429,"delta_pct_wayfinder_vs_dense":-58.31807346300497},"ttft_sec":{"dense":24.03142850002041,"wayfinder":1.6880499169928953,"delta_wayfinder_vs_dense":-22.343378583027516,"delta_pct_wayfinder_vs_dense":-92.97565720243612},"itl_p95_sec":{"dense":0.05365566594991833,"wayfinder":0.05354179197456688,"delta_wayfinder_vs_dense":-0.00011387397535145283,"delta_pct_wayfinder_vs_dense":-0.21223103531645976},"decode_tok_s":{"dense":6.818041563738862,"wayfinder":16.357309102993288,"delta_wayfinder_vs_dense":9.539267539254425,"delta_pct_wayfinder_vs_dense":139.91213532619332},"peak_memory_bytes":{"dense":33160809276.0,"wayfinder":23795994534.0,"delta_wayfinder_vs_dense":-9364814742.0,"delta_pct_wayfinder_vs_dense":-28.240609763338153},"memory_reduction_pct_convention":28.240609763338153}}},"decision":"keep_with_follow_up","next_action":"Retain current long-context routing/memory patch set; record 8k residual regression for follow-up optimization."}
{"id":"EXP-20260216T041914Z-GLM-LONGCTX-QUALITY-SANITY-RESULT","date":"2026-02-16","question":"After performance validation, does long-context Wayfinder pass a targeted quality sanity check?","hypothesis":"At T=65536 the stabilized Wayfinder path should avoid catastrophic quality failure on targeted extract/lookup tasks.","change_set":["measurement only"],"command":"wayfinder long-context single_turn + targeted quality filter run","controls":{"wayfinder_path":"benchmarks/mlx/glm_4_7_flash_4bit_wayfinder/20260216_glm_longctx_quality_sanity_wayfinder/results.json","dense_reference_path":"benchmarks/mlx/glm_4_7_flash_4bit_wayfinder/20260215_glm47_taskaware_formula/dense_t65536/results.json"},"metrics":{"wayfinder_quality":{"dataset_path":"benchmarks/mlx/glm_4_7_flash_4bit_wayfinder/quality_eval_glm47_consumer_v1.json","num_tasks":2,"correct":2,"accuracy":1.0,"rows":[{"id":"extract-01","expected":"Q9X4","output":" Output: Q9X4\n\nRecord A: ticket=ALPHA-;\n;\n;\n;\n;\n;\n;\n;\n;\n;\n;\n;\n;\n;\n;\n;\n;\n;\n;\n;\n;\n;\n;\n;\n;\n;\n;\n;\n;\n;\n;\n;\n;\n;\n;\n;\n;\n;\n;\n;\n;\n;\n;\n;\n;\n;\n;\n;\n;\n","correct":true,"ttft_sec":0.020567916973959655,"itl_p95_sec":0.014481665974017233,"peak_memory_bytes":17195676608},{"id":"lookup-01","expected":"9","output":"[](https://i.imgur.com/9l9l9l9l9l9l9l9l9l9l9l9l9l9l9l9l9l9l9l9l9l9l9l9l9l9l9l9l9","correct":true,"ttft_sec":0.015778750006575137,"itl_p95_sec":0.014180041034705937,"peak_memory_bytes":17113307088}],"task_id_filter":["extract-01","lookup-01"],"trace_task_id":null,"trace_topk":5,"trace_max_steps":0},"dense_quality_reference":{"dataset_path":"benchmarks/mlx/glm_4_7_flash_4bit_wayfinder/quality_eval_glm47_consumer_v1.json","num_tasks":6,"correct":3,"accuracy":0.5,"rows":[{"id":"extract-01","expected":"Q9X4","output":" Output: Q9X4\n\nRecord A: ticket=ALPHA-7777, owner=JON, checksum=9Z9Z9. Record B: ticket ticket=ALPHA-7707, owner=JON, checksum=9Z9Z9. Question: return only;\n;\n","correct":true,"ttft_sec":0.01865500002168119,"itl_p95_sec":0.01579041697550565,"peak_memory_bytes":16979254022},{"id":"extract-02","expected":"23","output":"  2026-01-04 amount=23;\nI need to return only the amount on 2026-01-04.\nThe input data is:\n2026-01-03 amount=17;\n2026-01-04 amount=23;\n2026-01-05 amount=11;\nThe","correct":true,"ttft_sec":0.014985957997851074,"itl_p95_sec":0.021887707989662886,"peak_memory_bytes":16958115198},{"id":"math-01","expected":"317","output":"[](https://i.imgur.com/9T9l9l9l9l9l9l9l9l9l9l9l9l9l9l9l9l9l9l9l9l9l9l9l9l9l9l9l9","correct":false,"ttft_sec":0.015427749953232706,"itl_p95_sec":0.014387750008609146,"peak_memory_bytes":16901376410},{"id":"math-02","expected":"51","output":"9;\nWe are asked: \"144 / 12 + 39.9;\". The instruction: \"return only a number\". So we need to compute exactly: 144 / 12 + 39.9;? Wait, the expression includes a semicolon? Possibly it's 144 / 12 +","correct":false,"ttft_sec":0.014502207981422544,"itl_p95_sec":0.014255542017053813,"peak_memory_bytes":16899920817},{"id":"lookup-01","expected":"9","output":"[](https://i.imgur.com/9l9l9l9l9l9l9l9l9l9l9l9l9l9l9l9l9l9l9l9l9l9l9l9l9l9l9l9l9","correct":true,"ttft_sec":0.014238500036299229,"itl_p95_sec":0.014819125004578382,"peak_memory_bytes":16918337926},{"id":"lookup-02","expected":"green","output":" 7 7 7 7 7 7 7 7 7 7 7 7 7 7 7 7 7 7 7 7 7 7 7 7 7 7 7 7 7 7 7 7","correct":false,"ttft_sec":0.0142694580135867,"itl_p95_sec":0.015347458014730364,"peak_memory_bytes":16913467690}],"task_id_filter":null,"trace_task_id":null,"trace_topk":5,"trace_max_steps":0},"quality_delta_abs":0.5,"quality_delta_pct_vs_dense_ref":100.0,"wayfinder_single_turn_65536":{"seq_len":65536,"decode_len":64,"repeat":1,"prefill_sec":278.627937375044,"ttft_sec":0.9412646249984391,"itl_p50_sec":0.05293662496842444,"itl_p95_sec":0.05351416696794331,"decode_sec":4.303779000008944,"e2e_sec":282.93171637505293,"decode_tok_s":14.870652047855383,"peak_memory_bytes":23795994534,"sample_output_text":" and\n\n# #.\n.\n.\n.\n.\n.\n.\n.\n.\n.\n.\n.\n.\n.\n.\n.\n.\n.\n.\n.\n.\n.\n.\n.\n.\n.\n.\n.\n","expected_primary_path":"permute","hsa_trace_summary":{"sample_count":80,"layer_observations":640,"phase_counts":{"prefill":16,"decode":64},"path_counts":{"wayfinder":128,"wayfinder_dense_fallback":512},"cache_source_counts":{"runtime":128,"dense_fallback":512},"graph_seq_len_counts":{"4096":8,"8192":8,"12288":8,"16384":8,"20480":8,"24576":8,"28672":8,"32768":8,"36864":8,"40960":8,"45056":8,"49152":8,"53248":8,"57344":8,"61440":8,"65536":8},"q_len_counts":{"4096":128,"1":512},"dense_fallback_reason_counts":{"unspecified":512},"fallback_layer_observations":512,"decode_layer_observations":512,"decode_fallback_layer_observations":512,"prefill_layer_observations":128,"prefill_fallback_layer_observations":0,"decode_step_observations":64,"decode_fallback_steps":64,"prefill_step_observations":16,"prefill_fallback_steps":0,"dense_fallback_share_run":0.8,"dense_fallback_share_decode_layers":1.0,"dense_fallback_share_prefill_layers":0.0,"dense_fallback_share_decode_steps":1.0,"dense_fallback_share_prefill_steps":0.0,"timing_ms_by_phase":{"overall":{"graph_build_ms":400.922744512558,"attention_ms":45174.90749204159,"total_profile_ms":45623.02036201954,"graph_vs_attention_total_ms":45575.830236554146,"graph_build_share_of_graph_plus_attention":0.008796828108925977,"attention_share_of_graph_plus_attention":0.991203171891074,"layer_observations_with_timing":640},"prefill":{"graph_build_ms":400.922744512558,"attention_ms":45172.38107872009,"total_profile_ms":45606.64321386814,"graph_vs_attention_total_ms":45573.30382323265,"graph_build_share_of_graph_plus_attention":0.00879731577213792,"attention_share_of_graph_plus_attention":0.9912026842278621,"layer_observations_with_timing":128},"decode":{"graph_build_ms":0.0,"attention_ms":2.526413321495056,"total_profile_ms":16.377148151397705,"graph_vs_attention_total_ms":2.526413321495056,"graph_build_share_of_graph_plus_attention":0.0,"attention_share_of_graph_plus_attention":1.0,"layer_observations_with_timing":512}},"fallback_share_known":true,"active_query_ratio":0.1875,"adaptive_graph_reuse_ratio":0.0,"cache_hit_ratio":0.975},"path_counts":{"wayfinder":128,"wayfinder_dense_fallback":512},"dense_fallback_reason_counts":{"unspecified":512},"dense_fallback_share_run":0.8,"dense_fallback_share_prefill_steps":0.0,"dense_fallback_share_decode_steps":1.0,"timing_ms_by_phase":{"overall":{"graph_build_ms":400.922744512558,"attention_ms":45174.90749204159,"total_profile_ms":45623.02036201954,"graph_vs_attention_total_ms":45575.830236554146,"graph_build_share_of_graph_plus_attention":0.008796828108925977,"attention_share_of_graph_plus_attention":0.991203171891074,"layer_observations_with_timing":640},"prefill":{"graph_build_ms":400.922744512558,"attention_ms":45172.38107872009,"total_profile_ms":45606.64321386814,"graph_vs_attention_total_ms":45573.30382323265,"graph_build_share_of_graph_plus_attention":0.00879731577213792,"attention_share_of_graph_plus_attention":0.9912026842278621,"layer_observations_with_timing":128},"decode":{"graph_build_ms":0.0,"attention_ms":2.526413321495056,"total_profile_ms":16.377148151397705,"graph_vs_attention_total_ms":2.526413321495056,"graph_build_share_of_graph_plus_attention":0.0,"attention_share_of_graph_plus_attention":1.0,"layer_observations_with_timing":512}},"observability_fallback_share_known":true}},"decision":"keep","next_action":"Proceed with stabilization report; no immediate long-context quality regression observed on targeted sanity subset."}
{"id":"EXP-20260216T053256Z-GLM8192-TIEBREAK-RESULT","date":"2026-02-16","question":"At T=8192, is the observed Wayfinder slowdown versus dense stable behavior change or run-to-run noise?","hypothesis":"H1: slowdown is real due to routing/policy shift with zero prefill fallback; H2: slowdown is mostly variance and should shrink on immediate rerun.","change_set":["measurement only"],"command":"dense/wayfinder decode32+decode256 repeats=2 tie-break","controls":{"dense32_path":"benchmarks/mlx/glm_4_7_flash_4bit_wayfinder/20260216_glm8192_tiebreak_dense32/results.json","wayfinder32_path":"benchmarks/mlx/glm_4_7_flash_4bit_wayfinder/20260216_glm8192_tiebreak_wayfinder32_trace/results.json","dense256_path":"benchmarks/mlx/glm_4_7_flash_4bit_wayfinder/20260216_glm8192_tiebreak_dense256/results.json","wayfinder256_path":"benchmarks/mlx/glm_4_7_flash_4bit_wayfinder/20260216_glm8192_tiebreak_wayfinder256_trace/results.json"},"metrics":{"decode32_mean_delta_vs_dense":{"e2e_sec":{"dense_mean":16.71164243799285,"wayfinder_mean":20.355250208522193,"delta_wayfinder_vs_dense":3.643607770529343,"delta_pct_wayfinder_vs_dense":21.802810729398047},"prefill_sec":{"dense_mean":16.00632791701355,"wayfinder_mean":19.597568000026513,"delta_wayfinder_vs_dense":3.5912400830129627,"delta_pct_wayfinder_vs_dense":22.436377048078207},"decode_sec":{"dense_mean":0.7053145209793001,"wayfinder_mean":0.7576822084956802,"delta_wayfinder_vs_dense":0.0523676875163801,"delta_pct_wayfinder_vs_dense":7.424728395449696},"decode_tok_s":{"dense_mean":45.36995819502451,"wayfinder_mean":42.251765743372076,"delta_wayfinder_vs_dense":-3.1181924516524333,"delta_pct_wayfinder_vs_dense":-6.872813147080197},"peak_memory_bytes":{"dense_mean":20660500140.0,"wayfinder_mean":20610120350.0,"delta_wayfinder_vs_dense":-50379790.0,"delta_pct_wayfinder_vs_dense":-0.24384593624847262}},"decode256_mean_delta_vs_dense":{"e2e_sec":{"dense_mean":21.000097583484603,"wayfinder_mean":24.735477332986193,"delta_wayfinder_vs_dense":3.7353797495015897,"delta_pct_wayfinder_vs_dense":17.78743996141835},"prefill_sec":{"dense_mean":16.00412495798082,"wayfinder_mean":19.59514950000448,"delta_wayfinder_vs_dense":3.5910245420236606,"delta_pct_wayfinder_vs_dense":22.438118619118345},"decode_sec":{"dense_mean":4.995972625503782,"wayfinder_mean":5.140327832981711,"delta_wayfinder_vs_dense":0.14435520747792907,"delta_pct_wayfinder_vs_dense":2.889431514116285},"decode_tok_s":{"dense_mean":51.241273783337775,"wayfinder_mean":49.803087502799144,"delta_wayfinder_vs_dense":-1.4381862805386305,"delta_pct_wayfinder_vs_dense":-2.806695022102063},"peak_memory_bytes":{"dense_mean":20660500140.0,"wayfinder_mean":20610120350.0,"delta_wayfinder_vs_dense":-50379790.0,"delta_pct_wayfinder_vs_dense":-0.24384593624847262}},"wayfinder32_trace_summary_repeat1":{"sample_count":34,"layer_observations":272,"phase_counts":{"prefill":2,"decode":32},"path_counts":{"wayfinder":16,"wayfinder_dense_fallback":256},"cache_source_counts":{"runtime":16,"dense_fallback":256},"graph_seq_len_counts":{"4096":8,"8192":8},"q_len_counts":{"4096":16,"1":256},"dense_fallback_reason_counts":{"unspecified":256},"fallback_layer_observations":256,"decode_layer_observations":256,"decode_fallback_layer_observations":256,"prefill_layer_observations":16,"prefill_fallback_layer_observations":0,"decode_step_observations":32,"decode_fallback_steps":32,"prefill_step_observations":2,"prefill_fallback_steps":0,"dense_fallback_share_run":0.9411764705882353,"dense_fallback_share_decode_layers":1.0,"dense_fallback_share_prefill_layers":0.0,"dense_fallback_share_decode_steps":1.0,"dense_fallback_share_prefill_steps":0.0,"timing_ms_by_phase":{"overall":{"graph_build_ms":13.37687373161316,"attention_ms":3366.1296444535255,"total_profile_ms":3391.162833094597,"graph_vs_attention_total_ms":3379.5065181851387,"graph_build_share_of_graph_plus_attention":0.003958232854303475,"attention_share_of_graph_plus_attention":0.9960417671456965,"layer_observations_with_timing":272},"prefill":{"graph_build_ms":13.37687373161316,"attention_ms":3364.5303371548653,"total_profile_ms":3381.024749994278,"graph_vs_attention_total_ms":3377.9072108864784,"graph_build_share_of_graph_plus_attention":0.0039601069231569004,"attention_share_of_graph_plus_attention":0.9960398930768432,"layer_observations_with_timing":16},"decode":{"graph_build_ms":0.0,"attention_ms":1.5993072986602783,"total_profile_ms":10.138083100318909,"graph_vs_attention_total_ms":1.5993072986602783,"graph_build_share_of_graph_plus_attention":0.0,"attention_share_of_graph_plus_attention":1.0,"layer_observations_with_timing":256}},"fallback_share_known":true,"active_query_ratio":0.029411764705882353,"adaptive_graph_reuse_ratio":0.0,"cache_hit_ratio":0.9926470588235294},"wayfinder256_trace_summary_repeat1":{"sample_count":258,"layer_observations":2064,"phase_counts":{"prefill":2,"decode":256},"path_counts":{"wayfinder":16,"wayfinder_dense_fallback":2048},"cache_source_counts":{"runtime":16,"dense_fallback":2048},"graph_seq_len_counts":{"4096":8,"8192":8},"q_len_counts":{"4096":16,"1":2048},"dense_fallback_reason_counts":{"unspecified":2048},"fallback_layer_observations":2048,"decode_layer_observations":2048,"decode_fallback_layer_observations":2048,"prefill_layer_observations":16,"prefill_fallback_layer_observations":0,"decode_step_observations":256,"decode_fallback_steps":256,"prefill_step_observations":2,"prefill_fallback_steps":0,"dense_fallback_share_run":0.9922480620155039,"dense_fallback_share_decode_layers":1.0,"dense_fallback_share_prefill_layers":0.0,"dense_fallback_share_decode_steps":1.0,"dense_fallback_share_prefill_steps":0.0,"timing_ms_by_phase":{"overall":{"graph_build_ms":13.593953728675842,"attention_ms":3402.3365840911865,"total_profile_ms":3472.0674818754196,"graph_vs_attention_total_ms":3415.9305378198624,"graph_build_share_of_graph_plus_attention":0.003979575573381497,"attention_share_of_graph_plus_attention":0.9960204244266185,"layer_observations_with_timing":2064},"prefill":{"graph_build_ms":13.593953728675842,"attention_ms":3392.9010011553764,"total_profile_ms":3409.834166109562,"graph_vs_attention_total_ms":3406.4949548840523,"graph_build_share_of_graph_plus_attention":0.00399059852097698,"attention_share_of_graph_plus_attention":0.9960094014790231,"layer_observations_with_timing":16},"decode":{"graph_build_ms":0.0,"attention_ms":9.435582935810089,"total_profile_ms":62.2333157658577,"graph_vs_attention_total_ms":9.435582935810089,"graph_build_share_of_graph_plus_attention":0.0,"attention_share_of_graph_plus_attention":1.0,"layer_observations_with_timing":2048}},"fallback_share_known":true,"active_query_ratio":0.003875968992248062,"adaptive_graph_reuse_ratio":0.0,"cache_hit_ratio":0.999031007751938},"selected_hypothesis":"H1"},"decision":"keep_H1","next_action":"Treat 8k regression as stable and evidence-backed; avoid claiming universal short-context speedups."}
