{"id":"EXP-20260212T184953Z-QWEN-NONSMOKE-MATRIX-PRERUN","date":"2026-02-12","question":"Under fixed non-smoke controls, how do dense, wayfinder, and sparse compare on Qwen3 for prefill/decode/memory/quality across seeds and primary+heldout datasets?","hypothesis":"Wayfinder will stay close to dense on quality/latency with small memory delta; sparse trace will stay truly sparse on decode/prefill-active observations.","change_set":["benchmarks/mlx/qwen3_1_7b_wayfinder/quality_eval_qwen3_consumer_holdout_v1.json (new)","measurement-only benchmark execution via scripts/bench_qwen_consumer_mlx.py"],"command":"RUN_ROOT=benchmarks/mlx/qwen3_1_7b_wayfinder/consumer_matrix_20260212T184953Z; for dataset_tag in main heldout; do if [ \"$dataset_tag\" = \"main\" ]; then DATASET=benchmarks/mlx/qwen3_1_7b_wayfinder/quality_eval_qwen3_consumer_v1.json; else DATASET=benchmarks/mlx/qwen3_1_7b_wayfinder/quality_eval_qwen3_consumer_holdout_v1.json; fi; for seed in 42 7 99; do python3 scripts/bench_qwen_consumer_mlx.py --model-path mlx-community/Qwen3-1.7B-4bit --mode dense --seq-lens 8192 --decode-len 64 --repeats 3 --chunk-size 4096 --kv-step 4096 --cooldown-sec 0 --seed \"$seed\" --quality-dataset \"$DATASET\" --skip-multi-turn --out-dir \"$RUN_ROOT/dense/s${seed}/${dataset_tag}\"; python3 scripts/bench_qwen_consumer_mlx.py --model-path mlx-community/Qwen3-1.7B-4bit --mode wayfinder --seq-lens 8192 --decode-len 64 --repeats 3 --chunk-size 4096 --kv-step 4096 --cooldown-sec 0 --window 64 --landmark-stride 64 --num-cycles 1 --seed \"$seed\" --quality-dataset \"$DATASET\" --hsa-trace --skip-multi-turn --out-dir \"$RUN_ROOT/wayfinder/s${seed}/${dataset_tag}\"; python3 scripts/bench_qwen_consumer_mlx.py --model-path mlx-community/Qwen3-1.7B-4bit --mode sparse --seq-lens 8192 --decode-len 64 --repeats 3 --chunk-size 4096 --kv-step 4096 --cooldown-sec 0 --window 64 --landmark-stride 64 --num-cycles 1 --seed \"$seed\" --quality-dataset \"$DATASET\" --hsa-trace --skip-multi-turn --out-dir \"$RUN_ROOT/sparse/s${seed}/${dataset_tag}\"; done; done","controls":{"run_root":"benchmarks/mlx/qwen3_1_7b_wayfinder/consumer_matrix_20260212T184953Z","model":"mlx-community/Qwen3-1.7B-4bit","modes":["dense","wayfinder","sparse"],"seeds":[42,7,99],"fixed":{"seq_len":8192,"decode_len":64,"repeats":3,"chunk_size":4096,"kv_step":4096,"window":64,"landmark_stride":64,"num_cycles":1,"cooldown_sec":0,"retro_backfill_default_inference_off":true},"datasets":{"main":"benchmarks/mlx/qwen3_1_7b_wayfinder/quality_eval_qwen3_consumer_v1.json","heldout":"benchmarks/mlx/qwen3_1_7b_wayfinder/quality_eval_qwen3_consumer_holdout_v1.json"},"hsa_trace_modes":["wayfinder","sparse"],"baseline":"dense results under same run_root and seed/dataset"},"metrics":{"status":"pending","required":["prefill_sec_abs","decode_sec_abs","decode_tok_s_abs","ttft_sec_abs","itl_p95_sec_abs","peak_memory_bytes_abs","quality_accuracy_abs","delta_vs_dense_abs","delta_vs_dense_pct","memory_reduction_pct_convention","sparse_trace_path_counts_decode_prefill_active","wayfinder_dense_fallback_reason_counts"]},"decision":"pending","next_action":"Execute the full 18-run matrix, then write summary.json + summary.md and append RESULT entry with gate verdicts."}
{"id":"EXP-20260212T184953Z-QWEN-NONSMOKE-MATRIX-RESULT","date":"2026-02-12","question":"Under fixed non-smoke controls, how do dense, wayfinder, and sparse compare on Qwen3 for prefill/decode/memory/quality across seeds and primary+heldout datasets?","hypothesis":"Wayfinder will stay close to dense on quality/latency with small memory delta; sparse trace will stay truly sparse on decode/prefill-active observations.","change_set":["benchmarks/mlx/qwen3_1_7b_wayfinder/quality_eval_qwen3_consumer_holdout_v1.json (new)","ran 18 benchmark jobs using scripts/bench_qwen_consumer_mlx.py","wrote benchmarks/mlx/qwen3_1_7b_wayfinder/consumer_matrix_20260212T184953Z/summary.json and summary.md"],"command":"Executed the PRERUN 18-run matrix command exactly, then executed python aggregation to write summary.json/summary.md under run_root.","controls":{"run_root":"benchmarks/mlx/qwen3_1_7b_wayfinder/consumer_matrix_20260212T184953Z","model":"mlx-community/Qwen3-1.7B-4bit","modes":["dense","wayfinder","sparse"],"seeds":[42,7,99],"fixed":{"seq_len":8192,"decode_len":64,"repeats":3,"chunk_size":4096,"kv_step":4096,"window":64,"landmark_stride":64,"num_cycles":1,"cooldown_sec":0,"retro_backfill_default_inference_off":true},"datasets":{"main":"benchmarks/mlx/qwen3_1_7b_wayfinder/quality_eval_qwen3_consumer_v1.json","heldout":"benchmarks/mlx/qwen3_1_7b_wayfinder/quality_eval_qwen3_consumer_holdout_v1.json"},"baseline":"dense results path convention benchmarks/mlx/qwen3_1_7b_wayfinder/consumer_matrix_20260212T184953Z/dense/s{seed}/{dataset}/results.json"},"metrics":{"artifacts":["benchmarks/mlx/qwen3_1_7b_wayfinder/consumer_matrix_20260212T184953Z/matrix_run.log","benchmarks/mlx/qwen3_1_7b_wayfinder/consumer_matrix_20260212T184953Z/summary.json","benchmarks/mlx/qwen3_1_7b_wayfinder/consumer_matrix_20260212T184953Z/summary.md"],"overall":{"dense":{"prefill_sec_abs":3.5213823842221044,"decode_sec_abs":0.4904828333900595,"decode_tok_s_abs":130.5491938724288,"ttft_sec_abs":0.026422381944737734,"itl_p95_sec_abs":0.007501974499771475,"peak_memory_bytes_abs":3840100396.0,"quality_accuracy_abs":0.5208333333333333},"wayfinder":{"prefill_sec_abs":3.4343345093333886,"prefill_sec_delta_vs_dense_abs":-0.08704787488871579,"prefill_sec_delta_vs_dense_pct":-2.4719801881994483,"decode_sec_abs":0.49507394222301726,"decode_sec_delta_vs_dense_abs":0.004591108832957769,"decode_sec_delta_vs_dense_pct":0.9360386379326473,"decode_tok_s_abs":129.3406604806246,"decode_tok_s_delta_vs_dense_abs":-1.2085333918041954,"decode_tok_s_delta_vs_dense_pct":-0.9257302599548495,"ttft_sec_abs":0.026777439833191845,"ttft_sec_delta_vs_dense_abs":0.00035505788845411126,"ttft_sec_delta_vs_dense_pct":1.3437769887541287,"itl_p95_sec_abs":0.007585109000501689,"itl_p95_sec_delta_vs_dense_abs":0.0000831345007302137,"itl_p95_sec_delta_vs_dense_pct":1.1081682660044518,"peak_memory_bytes_abs":3841673708.0,"peak_memory_bytes_delta_vs_dense_abs":1573312.0,"peak_memory_bytes_delta_vs_dense_pct":0.04097059549898289,"memory_reduction_pct_convention":-0.04097059549899029,"quality_accuracy_abs":0.5625,"quality_accuracy_delta_vs_dense_abs":0.04166666666666674,"quality_accuracy_delta_vs_dense_pct":8.000000000000016},"sparse":{"prefill_sec_abs":17.978817719833994,"prefill_sec_delta_vs_dense_abs":14.45743533561189,"prefill_sec_delta_vs_dense_pct":410.5613579595852,"decode_sec_abs":109.91744680322235,"decode_sec_delta_vs_dense_abs":109.42696396983229,"decode_sec_delta_vs_dense_pct":22310.049714382116,"decode_tok_s_abs":9.669051922602758,"decode_tok_s_delta_vs_dense_abs":-120.88014194982603,"decode_tok_s_delta_vs_dense_pct":-92.59355677672644,"ttft_sec_abs":1.734650280221912,"ttft_sec_delta_vs_dense_abs":1.7082278982771741,"ttft_sec_delta_vs_dense_pct":6465.07912061041,"itl_p95_sec_abs":1.7785822892777408,"itl_p95_sec_delta_vs_dense_abs":1.7710803147779692,"itl_p95_sec_delta_vs_dense_pct":23608.18894854841,"peak_memory_bytes_abs":24916253253.333332,"peak_memory_bytes_delta_vs_dense_abs":21076152857.333332,"peak_memory_bytes_delta_vs_dense_pct":548.8437979196348,"memory_reduction_pct_convention":-548.8437979196348,"quality_accuracy_abs":0.4930555555555555,"quality_accuracy_delta_vs_dense_abs":-0.027777777777777735,"quality_accuracy_delta_vs_dense_pct":-5.333333333333326}},"dataset_main":{"dense_quality_accuracy_abs":0.6666666666666666,"wayfinder_quality_accuracy_abs":0.7777777777777778,"wayfinder_quality_accuracy_delta_vs_dense_abs":0.11111111111111116,"wayfinder_quality_accuracy_delta_vs_dense_pct":16.666666666666675,"sparse_quality_accuracy_abs":0.611111111111111,"sparse_quality_accuracy_delta_vs_dense_abs":-0.05555555555555558,"sparse_quality_accuracy_delta_vs_dense_pct":-8.333333333333337},"dataset_heldout":{"dense_quality_accuracy_abs":0.375,"wayfinder_quality_accuracy_abs":0.3472222222222222,"wayfinder_quality_accuracy_delta_vs_dense_abs":-0.02777777777777779,"wayfinder_quality_accuracy_delta_vs_dense_pct":-7.407407407407411,"sparse_quality_accuracy_abs":0.375,"sparse_quality_accuracy_delta_vs_dense_abs":0.0,"sparse_quality_accuracy_delta_vs_dense_pct":0.0},"trace":{"sparse_path_counts_overall":{"sparse":9504},"sparse_phase_counts_overall":{"prefill":36,"decode":1152},"sparse_q_len_counts_overall":{"4096":288,"1":9216},"sparse_decode_observed":true,"sparse_prefill_active_observed":true,"sparse_only_sparse_paths_observed":true,"wayfinder_path_counts_overall":{"permute":144,"permute_dense_fallback":9360},"wayfinder_dense_fallback_reason_counts_overall":{}},"gates":{"G1_matrix_completeness_18_runs":"PASS","G2_retro_disabled_for_inference":"PASS","G3_sparse_truly_sparse_decode_prefill_active":"PASS","G4_wayfinder_fallback_reason_counts_reported":"PASS"}},"decision":"follow-up","next_action":"Keep this run as non-smoke baseline artifact set; investigate sparse runtime/memory regressions and high wayfinder permute_dense_fallback share."}
{"id":"EXP-20260213T000725Z-QWEN-HAMILTONIAN-RESCUE-PRERUN","date":"2026-02-13","question":"Can Qwen Wayfinder permute decode be rescued by removing unconditional dense fallback for q_len<k_len and adding fallback-reason observability/adaptive graph horizon/cache preallocation while preserving correctness and quality gates?","hypothesis":"Routing active permute decode through wayfinder_permute_window_attention_active_batched plus adaptive graph reuse should cut fallback to <=10% and hold decode throughput >=0.9x dense at seed-42 gate settings with non-inferior quality.","change_set":["hcsa/integrations/qwen_mlx.py","scripts/bench_qwen_consumer_mlx.py","tests/mlx/test_qwen_sparse_decode.py","tests/mlx/test_qwen_wayfinder_active_decode.py"],"command":"Execute commands[] sequentially with stop-gate enforcement.","commands":["python3 -m pytest tests/mlx/test_qwen_sparse_decode.py tests/mlx/test_qwen_wayfinder_active_decode.py tests/mlx/test_k4_active_row.py -q","RUN_ROOT='benchmarks/mlx/qwen3_1_7b_wayfinder/rescue_EXP-20260213T000725Z-QWEN-HAMILTONIAN-RESCUE'","DATA_MAIN='benchmarks/mlx/qwen3_1_7b_wayfinder/quality_eval_qwen3_consumer_v1.json'","DATA_HELDOUT='benchmarks/mlx/qwen3_1_7b_wayfinder/quality_eval_qwen3_consumer_holdout_v1.json'","python3 scripts/bench_qwen_consumer_mlx.py --model-path mlx-community/Qwen3-1.7B-4bit --mode dense --seq-lens 8192 --decode-len 16 --repeats 1 --chunk-size 4096 --kv-step 4096 --cooldown-sec 0 --seed 42 --quality-dataset \"$DATA_MAIN\" --skip-quality --skip-multi-turn --out-dir \"$RUN_ROOT/dense_s42_d16\"","python3 scripts/bench_qwen_consumer_mlx.py --model-path mlx-community/Qwen3-1.7B-4bit --mode wayfinder --seq-lens 8192 --decode-len 16 --repeats 1 --chunk-size 4096 --kv-step 4096 --cooldown-sec 0 --window 64 --landmark-stride 64 --num-cycles 1 --seed 42 --quality-dataset \"$DATA_MAIN\" --hsa-trace --skip-quality --skip-multi-turn --out-dir \"$RUN_ROOT/wayfinder_s42_d16\"","python3 scripts/bench_qwen_consumer_mlx.py --model-path mlx-community/Qwen3-1.7B-4bit --mode dense --seq-lens 8192 --decode-len 64 --repeats 3 --chunk-size 4096 --kv-step 4096 --cooldown-sec 0 --seed 42 --quality-dataset \"$DATA_MAIN\" --skip-multi-turn --out-dir \"$RUN_ROOT/dense/s42/main\"","python3 scripts/bench_qwen_consumer_mlx.py --model-path mlx-community/Qwen3-1.7B-4bit --mode wayfinder --seq-lens 8192 --decode-len 64 --repeats 3 --chunk-size 4096 --kv-step 4096 --cooldown-sec 0 --window 64 --landmark-stride 64 --num-cycles 1 --seed 42 --quality-dataset \"$DATA_MAIN\" --hsa-trace --skip-multi-turn --out-dir \"$RUN_ROOT/wayfinder/s42/main\"","python3 scripts/bench_qwen_consumer_mlx.py --model-path mlx-community/Qwen3-1.7B-4bit --mode dense --seq-lens 8192 --decode-len 64 --repeats 3 --chunk-size 4096 --kv-step 4096 --cooldown-sec 0 --seed 42 --quality-dataset \"$DATA_HELDOUT\" --skip-multi-turn --out-dir \"$RUN_ROOT/dense/s42/heldout\"","python3 scripts/bench_qwen_consumer_mlx.py --model-path mlx-community/Qwen3-1.7B-4bit --mode wayfinder --seq-lens 8192 --decode-len 64 --repeats 3 --chunk-size 4096 --kv-step 4096 --cooldown-sec 0 --window 64 --landmark-stride 64 --num-cycles 1 --seed 42 --quality-dataset \"$DATA_HELDOUT\" --hsa-trace --skip-multi-turn --out-dir \"$RUN_ROOT/wayfinder/s42/heldout\"","python3 scripts/bench_qwen_consumer_mlx.py --model-path mlx-community/Qwen3-1.7B-4bit --mode sparse --seq-lens 8192 --decode-len 64 --repeats 1 --chunk-size 4096 --kv-step 4096 --cooldown-sec 0 --window 64 --landmark-stride 64 --num-cycles 1 --seed 42 --quality-dataset \"$DATA_MAIN\" --hsa-trace --skip-quality --skip-multi-turn --out-dir \"$RUN_ROOT/sparse_s42_smoke\"","for dataset_tag in main heldout; do if [ \"$dataset_tag\" = \"main\" ]; then DATASET=\"$DATA_MAIN\"; else DATASET=\"$DATA_HELDOUT\"; fi; for seed in 42 7 99; do python3 scripts/bench_qwen_consumer_mlx.py --model-path mlx-community/Qwen3-1.7B-4bit --mode dense --seq-lens 8192 --decode-len 64 --repeats 3 --chunk-size 4096 --kv-step 4096 --cooldown-sec 0 --seed \"$seed\" --quality-dataset \"$DATASET\" --skip-multi-turn --out-dir \"$RUN_ROOT/dense/s${seed}/${dataset_tag}\"; python3 scripts/bench_qwen_consumer_mlx.py --model-path mlx-community/Qwen3-1.7B-4bit --mode wayfinder --seq-lens 8192 --decode-len 64 --repeats 3 --chunk-size 4096 --kv-step 4096 --cooldown-sec 0 --window 64 --landmark-stride 64 --num-cycles 1 --seed \"$seed\" --quality-dataset \"$DATASET\" --hsa-trace --skip-multi-turn --out-dir \"$RUN_ROOT/wayfinder/s${seed}/${dataset_tag}\"; done; done"],"controls":{"run_root":"benchmarks/mlx/qwen3_1_7b_wayfinder/rescue_EXP-20260213T000725Z-QWEN-HAMILTONIAN-RESCUE","baseline_run_root":"benchmarks/mlx/qwen3_1_7b_wayfinder/consumer_matrix_20260212T184953Z","baseline_dense_path_template":"benchmarks/mlx/qwen3_1_7b_wayfinder/consumer_matrix_20260212T184953Z/dense/s{seed}/{dataset}/results.json","fixed":{"model":"mlx-community/Qwen3-1.7B-4bit","seq_len":8192,"chunk_size":4096,"kv_step":4096,"window":64,"landmark_stride":64,"num_cycles":1,"retro_backfill_default_inference_off":true}},"metrics":{"status":"pending","required":["hsa_trace_summary.path_counts","hsa_trace_summary.dense_fallback_reason_counts","single_turn.decode_tok_s","single_turn.peak_memory_bytes","quality.accuracy.main","quality.accuracy.heldout","delta_vs_dense_abs","delta_vs_dense_pct","memory_reduction_pct_convention"]},"stop_gates":["diagnostic fallback share must be <=0.10","if fallback exists then dense_fallback_reason_counts must be non-empty","diagnostic wayfinder decode tok/s must be >=0.85x dense","seed-42 acceptance requires fallback<=10%, decode tok/s>=0.90x dense, peak_memory<=dense (or justified exception), and non-inferior main+heldout quality"],"decision":"pending","next_action":"Apply rescue patches, run diagnostics and acceptance gates, then append RESULT entry with keep/revert/follow-up."}
{"id":"EXP-20260213T000725Z-QWEN-HAMILTONIAN-RESCUE-RESULT","date":"2026-02-13","question":"Can Qwen Wayfinder permute decode be rescued by removing unconditional dense fallback for q_len<k_len and adding fallback observability/adaptive graph horizon/cache preallocation while preserving seed-42 performance+quality gates?","hypothesis":"Routing active permute decode through wayfinder_permute_window_attention_active_batched plus adaptive graph reuse should keep fallback <=10% and preserve decode>=0.9x dense with non-inferior quality.","change_set":["hcsa/integrations/qwen_mlx.py","scripts/bench_qwen_consumer_mlx.py","tests/mlx/test_qwen_sparse_decode.py","tests/mlx/test_qwen_wayfinder_active_decode.py"],"command":"Executed fast pytest, diagnostic dense+wayfinder runs, seed-42 main/heldout dense+wayfinder runs, and sparse smoke regression under run_root rescue_EXP-20260213T000725Z-QWEN-HAMILTONIAN-RESCUE.","controls":{"run_root":"benchmarks/mlx/qwen3_1_7b_wayfinder/rescue_EXP-20260213T000725Z-QWEN-HAMILTONIAN-RESCUE","baseline_dense_path_template":"benchmarks/mlx/qwen3_1_7b_wayfinder/rescue_EXP-20260213T000725Z-QWEN-HAMILTONIAN-RESCUE/dense/s{seed}/{dataset}/results.json","fixed":{"model":"mlx-community/Qwen3-1.7B-4bit","seq_len":8192,"decode_len_diag":16,"decode_len_gate":64,"repeats_gate":3,"chunk_size":4096,"kv_step":4096,"window":64,"landmark_stride":64,"num_cycles":1,"seed":42,"retro_backfill_default_inference_off":true}},"metrics":{"artifacts":["benchmarks/mlx/qwen3_1_7b_wayfinder/rescue_EXP-20260213T000725Z-QWEN-HAMILTONIAN-RESCUE/rescue_summary.json","benchmarks/mlx/qwen3_1_7b_wayfinder/rescue_EXP-20260213T000725Z-QWEN-HAMILTONIAN-RESCUE/rescue_summary.md"],"tests":{"pytest_fast_suite":"pass"},"diagnostic":{"dense_decode_tok_s_abs":13.948338329190394,"wayfinder_decode_tok_s_abs":37.96866079644536,"decode_ratio_vs_dense_abs":2.7220920442535026,"wayfinder_path_counts":{"permute":136,"permute_dense_fallback":8},"wayfinder_dense_fallback_reason_counts":{"active_large_q":8},"fallback_rate_abs":0.05555555555555555},"seed42":{"overall":{"dense_decode_tok_s_abs":124.79831351345427,"wayfinder_decode_tok_s_abs":44.06212534191641,"decode_delta_vs_dense_abs":-80.73618817153786,"decode_delta_vs_dense_pct":-64.69347515138018,"decode_ratio_vs_dense_abs":0.35306667294960004,"dense_peak_memory_bytes_abs":3840100388,"wayfinder_peak_memory_bytes_abs":3844819428,"peak_memory_delta_vs_dense_abs":4719040,"peak_memory_delta_vs_dense_pct":0.12288845402965544,"memory_reduction_pct_convention":-0.12288845402965709,"fallback_rate_abs":0.015151515151515152,"wayfinder_path_counts":{"permute":3120,"permute_dense_fallback":48},"wayfinder_dense_fallback_reason_counts":{"active_large_q":48},"quality_main_delta_vs_dense_abs":-0.5,"quality_heldout_delta_vs_dense_abs":-0.375},"main":{"dense_decode_tok_s_abs":124.40005047548736,"wayfinder_decode_tok_s_abs":43.96145208085262,"decode_delta_vs_dense_abs":-80.43859839463474,"decode_delta_vs_dense_pct":-64.66122649241602,"dense_peak_memory_bytes_abs":3840100388,"wayfinder_peak_memory_bytes_abs":3844819428,"peak_memory_delta_vs_dense_abs":4719040,"peak_memory_delta_vs_dense_pct":0.12288845402965544,"memory_reduction_pct_convention":-0.12288845402965709,"dense_quality_accuracy_abs":0.6666666666666666,"wayfinder_quality_accuracy_abs":0.16666666666666666,"quality_delta_vs_dense_abs":-0.5},"heldout":{"dense_decode_tok_s_abs":125.19657655142117,"wayfinder_decode_tok_s_abs":44.16279860298021,"decode_delta_vs_dense_abs":-81.03377794844096,"decode_delta_vs_dense_pct":-64.72523465141116,"dense_peak_memory_bytes_abs":3840100388,"wayfinder_peak_memory_bytes_abs":3844819428,"peak_memory_delta_vs_dense_abs":4719040,"peak_memory_delta_vs_dense_pct":0.12288845402965544,"memory_reduction_pct_convention":-0.12288845402965709,"dense_quality_accuracy_abs":0.375,"wayfinder_quality_accuracy_abs":0.0,"quality_delta_vs_dense_abs":-0.375}},"sparse_smoke":{"decode_tok_s_abs":0.1972430983121079,"decode_delta_vs_dense_main_abs":-124.20280737717525,"decode_delta_vs_dense_main_pct":-99.84144451906715,"path_counts":{"sparse":528}},"gates":{"diagnostic_fallback_le_10pct":"PASS","diagnostic_reason_counts_present_when_fallback":"PASS","diagnostic_decode_ratio_ge_0_85":"PASS","seed42_fallback_le_10pct":"PASS","seed42_decode_ratio_ge_0_90":"FAIL","seed42_peak_memory_le_dense":"FAIL","seed42_quality_main_noninferior":"FAIL","seed42_quality_heldout_noninferior":"FAIL"},"root_cause_status":"d"},"decision":"follow-up","next_action":"Stop before full 3-seed x 2-dataset matrix; iterate on active permute decode quality/perf first, then rerun seed-42 acceptance gates."}
{"id":"EXP-20260213T230717Z-PHASE0-BASELINE-TRUTH-LOCK-PRERUN","date":"2026-02-13","question":"Can we complete the Phase 0 stop-gate (facts vs assumptions memo, behavior map, risk register, SQL todo orchestration) without running inference or benchmarks?","hypothesis":"A strict no-inference analysis cycle can close Phase 0 by consolidating existing evidence, creating SQL todo orchestration, and freezing an executable run queue with stop gates.","change_set":["notes/PHASE0_BASELINE_TRUTH_LOCK_20260213.md","notes/todos.sqlite3","notes/HANDOFF_20260213_PHASE0.md","notes/LAB_NOTEBOOK.md","notes/experiments.ndjson"],"command":"sqlite3 notes/todos.sqlite3 bootstrap/ready queries + repository evidence extraction via rg/nl + documentation updates only","controls":{"no_inference":true,"no_benchmark":true,"no_finetune":true,"evidence_format":"file:line","retro_backfill_inference_default_off":true},"metrics":{"planned_outputs":["notes/PHASE0_BASELINE_TRUTH_LOCK_20260213.md","notes/HANDOFF_20260213_PHASE0.md"],"planned_sql_checks":["bootstrap_query","ready_queue_query"],"status":"pending"},"decision":"pending","next_action":"Execute SQL todo bootstrap and write Phase 0 memo with citations, then append RESULT."}
