{"id":"EXP-20260219T152803Z-QWEN3-30B-A3B-4BIT-PARITY-V1-PRERUN","date":"2026-02-19","question":"Can Wayfinder reproduce GLM-stable-profile-like validated gains on Qwen3-30B-A3B (MoE) at T=8192 under the consumer harness, while keeping retro/backfill inference off?","hypothesis":"At T=8192 (seed=42), Wayfinder will achieve prefill gain >=30% and e2e gain >=20% vs dense, with memory regression <=+5% and quality drift <=1 task lost on the 6-task main consumer set.","change_set":["docs/QWEN3_MOE_RESEARCH_AND_COMPAT.md (new)","scripts/summarize_qwen_moe_parity.py (new)","measurement artifacts under benchmarks/mlx/qwen3_moe_wayfinder/"],"command":"python3 -m py_compile scripts/summarize_qwen_moe_parity.py && python3 scripts/bench_qwen_consumer_mlx.py --help >/dev/null && ./scripts/verify_install_and_preflight.sh --run-id EXP-20260219T152803Z-VERIFY-INSTALL --out-dir benchmarks/mlx/preflight && python3 scripts/bench_qwen_consumer_mlx.py --model-path mlx-community/Qwen3-30B-A3B-4bit --mode dense --seq-lens 2048 --decode-len 32 --repeats 1 --chunk-size 4096 --kv-step 4096 --cooldown-sec 0 --seed 42 --skip-multi-turn --skip-quality --out-dir benchmarks/mlx/qwen3_moe_wayfinder/EXP-20260219T152803Z-QWEN3-30B-A3B-4BIT-PARITY-V1/dense_t2048_s42 && python3 scripts/bench_qwen_consumer_mlx.py --model-path mlx-community/Qwen3-30B-A3B-4bit --mode wayfinder --seq-lens 2048 --decode-len 32 --repeats 1 --chunk-size 4096 --kv-step 4096 --cooldown-sec 0 --window 64 --landmark-stride 64 --num-cycles 1 --head-chunk-size 2 --query-chunk-size 384 --seed 42 --skip-multi-turn --skip-quality --out-dir benchmarks/mlx/qwen3_moe_wayfinder/EXP-20260219T152803Z-QWEN3-30B-A3B-4BIT-PARITY-V1/wayfinder_t2048_s42 && python3 scripts/bench_qwen_consumer_mlx.py --model-path mlx-community/Qwen3-30B-A3B-4bit --mode dense --seq-lens 8192 --decode-len 32 --repeats 1 --chunk-size 4096 --kv-step 4096 --cooldown-sec 0 --seed 42 --skip-multi-turn --skip-quality --out-dir benchmarks/mlx/qwen3_moe_wayfinder/EXP-20260219T152803Z-QWEN3-30B-A3B-4BIT-PARITY-V1/dense_t8192_s42 && python3 scripts/bench_qwen_consumer_mlx.py --model-path mlx-community/Qwen3-30B-A3B-4bit --mode wayfinder --seq-lens 8192 --decode-len 32 --repeats 1 --chunk-size 4096 --kv-step 4096 --cooldown-sec 0 --window 64 --landmark-stride 64 --num-cycles 1 --head-chunk-size 2 --query-chunk-size 384 --seed 42 --skip-multi-turn --skip-quality --out-dir benchmarks/mlx/qwen3_moe_wayfinder/EXP-20260219T152803Z-QWEN3-30B-A3B-4BIT-PARITY-V1/wayfinder_t8192_s42 && python3 scripts/bench_qwen_consumer_mlx.py --model-path mlx-community/Qwen3-30B-A3B-4bit --mode dense --seq-lens 8192 --decode-len 32 --repeats 1 --chunk-size 4096 --kv-step 4096 --cooldown-sec 0 --seed 7 --skip-multi-turn --skip-quality --out-dir benchmarks/mlx/qwen3_moe_wayfinder/EXP-20260219T152803Z-QWEN3-30B-A3B-4BIT-PARITY-V1/dense_t8192_s7 && python3 scripts/bench_qwen_consumer_mlx.py --model-path mlx-community/Qwen3-30B-A3B-4bit --mode wayfinder --seq-lens 8192 --decode-len 32 --repeats 1 --chunk-size 4096 --kv-step 4096 --cooldown-sec 0 --window 64 --landmark-stride 64 --num-cycles 1 --head-chunk-size 2 --query-chunk-size 384 --seed 7 --skip-multi-turn --skip-quality --out-dir benchmarks/mlx/qwen3_moe_wayfinder/EXP-20260219T152803Z-QWEN3-30B-A3B-4BIT-PARITY-V1/wayfinder_t8192_s7 && python3 scripts/bench_qwen_consumer_mlx.py --model-path mlx-community/Qwen3-30B-A3B-4bit --mode dense --seq-lens 8192 --decode-len 32 --repeats 1 --chunk-size 4096 --kv-step 4096 --cooldown-sec 0 --seed 99 --skip-multi-turn --skip-quality --out-dir benchmarks/mlx/qwen3_moe_wayfinder/EXP-20260219T152803Z-QWEN3-30B-A3B-4BIT-PARITY-V1/dense_t8192_s99 && python3 scripts/bench_qwen_consumer_mlx.py --model-path mlx-community/Qwen3-30B-A3B-4bit --mode wayfinder --seq-lens 8192 --decode-len 32 --repeats 1 --chunk-size 4096 --kv-step 4096 --cooldown-sec 0 --window 64 --landmark-stride 64 --num-cycles 1 --head-chunk-size 2 --query-chunk-size 384 --seed 99 --skip-multi-turn --skip-quality --out-dir benchmarks/mlx/qwen3_moe_wayfinder/EXP-20260219T152803Z-QWEN3-30B-A3B-4BIT-PARITY-V1/wayfinder_t8192_s99 && python3 scripts/bench_qwen_consumer_mlx.py --model-path mlx-community/Qwen3-30B-A3B-4bit --mode dense --seq-lens 8192 --decode-len 64 --repeats 1 --seed 42 --quality-dataset benchmarks/mlx/qwen3_1_7b_wayfinder/quality_eval_qwen3_consumer_v1.json --skip-multi-turn --skip-single-turn --out-dir benchmarks/mlx/qwen3_moe_wayfinder/EXP-20260219T152803Z-QWEN3-30B-A3B-4BIT-PARITY-V1/quality_dense_main && python3 scripts/bench_qwen_consumer_mlx.py --model-path mlx-community/Qwen3-30B-A3B-4bit --mode wayfinder --seq-lens 8192 --decode-len 64 --repeats 1 --window 64 --landmark-stride 64 --num-cycles 1 --head-chunk-size 2 --query-chunk-size 384 --seed 42 --quality-dataset benchmarks/mlx/qwen3_1_7b_wayfinder/quality_eval_qwen3_consumer_v1.json --skip-multi-turn --skip-single-turn --out-dir benchmarks/mlx/qwen3_moe_wayfinder/EXP-20260219T152803Z-QWEN3-30B-A3B-4BIT-PARITY-V1/quality_wayfinder_main && python3 scripts/bench_qwen_consumer_mlx.py --model-path mlx-community/Qwen3-30B-A3B-4bit --mode dense --seq-lens 8192 --decode-len 64 --repeats 1 --seed 42 --quality-dataset benchmarks/mlx/qwen3_1_7b_wayfinder/quality_eval_qwen3_consumer_holdout_v1.json --skip-multi-turn --skip-single-turn --out-dir benchmarks/mlx/qwen3_moe_wayfinder/EXP-20260219T152803Z-QWEN3-30B-A3B-4BIT-PARITY-V1/quality_dense_holdout && python3 scripts/bench_qwen_consumer_mlx.py --model-path mlx-community/Qwen3-30B-A3B-4bit --mode wayfinder --seq-lens 8192 --decode-len 64 --repeats 1 --window 64 --landmark-stride 64 --num-cycles 1 --head-chunk-size 2 --query-chunk-size 384 --seed 42 --quality-dataset benchmarks/mlx/qwen3_1_7b_wayfinder/quality_eval_qwen3_consumer_holdout_v1.json --skip-multi-turn --skip-single-turn --out-dir benchmarks/mlx/qwen3_moe_wayfinder/EXP-20260219T152803Z-QWEN3-30B-A3B-4BIT-PARITY-V1/quality_wayfinder_holdout && python3 scripts/summarize_qwen_moe_parity.py --run-root benchmarks/mlx/qwen3_moe_wayfinder/EXP-20260219T152803Z-QWEN3-30B-A3B-4BIT-PARITY-V1 --strict","controls":{"model":"mlx-community/Qwen3-30B-A3B-4bit","entrypoint":"scripts/bench_qwen_consumer_mlx.py","perf":{"seq_lens":[2048,8192],"decode_len":32,"repeats":1,"chunk_size":4096,"kv_step":4096,"cooldown_sec":0,"seeds":[42,7,99],"skip_multi_turn":true,"skip_quality":true},"wayfinder":{"window":64,"landmark_stride":64,"num_cycles":1,"head_chunk_size":2,"query_chunk_size":384},"quality":{"seq_len":8192,"decode_len":64,"seed":42,"datasets":["benchmarks/mlx/qwen3_1_7b_wayfinder/quality_eval_qwen3_consumer_v1.json","benchmarks/mlx/qwen3_1_7b_wayfinder/quality_eval_qwen3_consumer_holdout_v1.json"],"skip_multi_turn":true,"skip_single_turn":true},"one_process_at_a_time":true,"retro_backfill_inference":"off","memory_cap_bytes":30000000000,"stop_gates":["nonzero exit","missing results.json","missing single_turn rows","observability_fallback_share_known must be true","fallback present but reasons missing/unspecified","peak_memory_bytes > 30_000_000_000"]},"metrics":{"status":"pending","artifacts_expected":["benchmarks/mlx/qwen3_moe_wayfinder/EXP-20260219T152803Z-QWEN3-30B-A3B-4BIT-PARITY-V1/dense_t2048_s42/results.json","benchmarks/mlx/qwen3_moe_wayfinder/EXP-20260219T152803Z-QWEN3-30B-A3B-4BIT-PARITY-V1/wayfinder_t2048_s42/results.json","benchmarks/mlx/qwen3_moe_wayfinder/EXP-20260219T152803Z-QWEN3-30B-A3B-4BIT-PARITY-V1/dense_t8192_s42/results.json","benchmarks/mlx/qwen3_moe_wayfinder/EXP-20260219T152803Z-QWEN3-30B-A3B-4BIT-PARITY-V1/wayfinder_t8192_s42/results.json","benchmarks/mlx/qwen3_moe_wayfinder/EXP-20260219T152803Z-QWEN3-30B-A3B-4BIT-PARITY-V1/dense_t8192_s7/results.json","benchmarks/mlx/qwen3_moe_wayfinder/EXP-20260219T152803Z-QWEN3-30B-A3B-4BIT-PARITY-V1/wayfinder_t8192_s7/results.json","benchmarks/mlx/qwen3_moe_wayfinder/EXP-20260219T152803Z-QWEN3-30B-A3B-4BIT-PARITY-V1/dense_t8192_s99/results.json","benchmarks/mlx/qwen3_moe_wayfinder/EXP-20260219T152803Z-QWEN3-30B-A3B-4BIT-PARITY-V1/wayfinder_t8192_s99/results.json","benchmarks/mlx/qwen3_moe_wayfinder/EXP-20260219T152803Z-QWEN3-30B-A3B-4BIT-PARITY-V1/quality_dense_main/results.json","benchmarks/mlx/qwen3_moe_wayfinder/EXP-20260219T152803Z-QWEN3-30B-A3B-4BIT-PARITY-V1/quality_wayfinder_main/results.json","benchmarks/mlx/qwen3_moe_wayfinder/EXP-20260219T152803Z-QWEN3-30B-A3B-4BIT-PARITY-V1/quality_dense_holdout/results.json","benchmarks/mlx/qwen3_moe_wayfinder/EXP-20260219T152803Z-QWEN3-30B-A3B-4BIT-PARITY-V1/quality_wayfinder_holdout/results.json","benchmarks/mlx/qwen3_moe_wayfinder/EXP-20260219T152803Z-QWEN3-30B-A3B-4BIT-PARITY-V1/parity_summary.json","benchmarks/mlx/qwen3_moe_wayfinder/EXP-20260219T152803Z-QWEN3-30B-A3B-4BIT-PARITY-V1/parity_summary.md"],"required":["single_turn[].prefill_sec","single_turn[].decode_sec","single_turn[].e2e_sec","single_turn[].decode_tok_s","single_turn[].peak_memory_bytes","single_turn[].path_counts","single_turn[].dense_fallback_reason_counts","single_turn[].dense_fallback_share_run","single_turn[].dense_fallback_share_decode_steps","single_turn[].observability_fallback_share_known","quality.accuracy","quality.rows[].correct"],"gate_T8192_seed42":{"prefill_gain_pct_ge":30,"e2e_gain_pct_ge":20,"memory_regression_pct_le":5,"quality_lost_tasks_main_le":1}},"decision":"pending","next_action":"Execute queue sequentially; run summarizer; append RESULT entry and parity report."}
{"id":"EXP-20260219T152803Z-QWEN3-30B-A3B-4BIT-TUNE1-PRERUN","date":"2026-02-19","question":"If the parity gate fails at T=8192, can a bounded tuning of query_chunk_size (256 or 512 vs baseline 384) improve Wayfinder performance without violating memory/observability/quality gates?","hypothesis":"At T=8192 (seed=42), at least one of query_chunk_size=256 or 512 will improve prefill/e2e vs the baseline Wayfinder config while keeping peak memory <= dense*1.05 and without increasing fallback share.","change_set":["measurement only"],"command":"python3 scripts/bench_qwen_consumer_mlx.py --model-path mlx-community/Qwen3-30B-A3B-4bit --mode wayfinder --seq-lens 8192 --decode-len 32 --repeats 1 --chunk-size 4096 --kv-step 4096 --cooldown-sec 0 --window 64 --landmark-stride 64 --num-cycles 1 --head-chunk-size 2 --query-chunk-size 256 --seed 42 --skip-multi-turn --skip-quality --out-dir benchmarks/mlx/qwen3_moe_wayfinder/EXP-20260219T152803Z-QWEN3-30B-A3B-4BIT-TUNE1/wayfinder_q256_t8192_s42 && python3 scripts/bench_qwen_consumer_mlx.py --model-path mlx-community/Qwen3-30B-A3B-4bit --mode wayfinder --seq-lens 8192 --decode-len 32 --repeats 1 --chunk-size 4096 --kv-step 4096 --cooldown-sec 0 --window 64 --landmark-stride 64 --num-cycles 1 --head-chunk-size 2 --query-chunk-size 512 --seed 42 --skip-multi-turn --skip-quality --out-dir benchmarks/mlx/qwen3_moe_wayfinder/EXP-20260219T152803Z-QWEN3-30B-A3B-4BIT-TUNE1/wayfinder_q512_t8192_s42","controls":{"model":"mlx-community/Qwen3-30B-A3B-4bit","entrypoint":"scripts/bench_qwen_consumer_mlx.py","seq_len":8192,"decode_len":32,"repeats":1,"chunk_size":4096,"kv_step":4096,"cooldown_sec":0,"seed":42,"skip_multi_turn":true,"skip_quality":true,"retro_backfill_inference":"off","baseline_dense":"benchmarks/mlx/qwen3_moe_wayfinder/EXP-20260219T152803Z-QWEN3-30B-A3B-4BIT-PARITY-V1/dense_t8192_s42/results.json","baseline_wayfinder":"benchmarks/mlx/qwen3_moe_wayfinder/EXP-20260219T152803Z-QWEN3-30B-A3B-4BIT-PARITY-V1/wayfinder_t8192_s42/results.json","variants":[{"query_chunk_size":256},{"query_chunk_size":512}],"stop_gates":["nonzero exit","missing results.json","missing single_turn rows","observability_fallback_share_known must be true","fallback present but reasons missing/unspecified","peak_memory_bytes > dense*1.05"]},"metrics":{"status":"pending","artifacts_expected":["benchmarks/mlx/qwen3_moe_wayfinder/EXP-20260219T152803Z-QWEN3-30B-A3B-4BIT-TUNE1/wayfinder_q256_t8192_s42/results.json","benchmarks/mlx/qwen3_moe_wayfinder/EXP-20260219T152803Z-QWEN3-30B-A3B-4BIT-TUNE1/wayfinder_q512_t8192_s42/results.json"],"required":["single_turn[].prefill_sec","single_turn[].decode_sec","single_turn[].e2e_sec","single_turn[].decode_tok_s","single_turn[].peak_memory_bytes","single_turn[].path_counts","single_turn[].dense_fallback_reason_counts","single_turn[].dense_fallback_share_run","single_turn[].dense_fallback_share_decode_steps","single_turn[].observability_fallback_share_known"]},"decision":"pending","next_action":"Run the two variant commands sequentially; compare to dense and baseline Wayfinder; if improved, rerun quality main+holdout for best variant and append RESULT entry."}
{"id":"EXP-20260220T000000Z-QWEN30B-GLM-PARITY-PRERUN","date":"2026-02-20","question":"Can Qwen3-30B-A3B Wayfinder close the gap to GLM-style behavior using dense decode backend while loading strictly from VIXinSSD HF cache?","hypothesis":"Switching Wayfinder decode backend from active_permute to dense will improve decode/e2e materially while preserving prefill and memory near dense baseline.","change_set":["hcsa/integrations/qwen_mlx.py add wayfinder_decode_backend","scripts/bench_qwen_consumer_mlx.py add HF cache controls + decode backend CLI","scripts/bench_qwen_wayfinder_mlx.py add HF cache controls + decode backend passthrough","tests/mlx/test_qwen_wayfinder_active_decode.py add dense-backend fallback coverage"],"command":"python3 -m pytest tests/mlx/test_qwen_wayfinder_active_decode.py tests/mlx/test_qwen_sparse_decode.py -q && HF_HOME=/Volumes/VIXinSSD/hf_cache HF_HUB_CACHE=/Volumes/VIXinSSD/hf_cache/hub HF_HUB_OFFLINE=1 python3 scripts/bench_qwen_consumer_mlx.py --model-path mlx-community/Qwen3-30B-A3B-4bit --mode dense --seq-lens 2048 --decode-len 32 --repeats 1 --chunk-size 4096 --kv-step 4096 --cooldown-sec 0 --seed 42 --skip-multi-turn --skip-quality --hf-home /Volumes/VIXinSSD/hf_cache --hf-hub-cache /Volumes/VIXinSSD/hf_cache/hub --hf-offline --out-dir benchmarks/mlx/qwen3_moe_wayfinder/EXP-20260220T000000Z-QWEN30B-GLM-PARITY/dense_t2048_s42 && HF_HOME=/Volumes/VIXinSSD/hf_cache HF_HUB_CACHE=/Volumes/VIXinSSD/hf_cache/hub HF_HUB_OFFLINE=1 python3 scripts/bench_qwen_consumer_mlx.py --model-path mlx-community/Qwen3-30B-A3B-4bit --mode wayfinder --debug-wayfinder-decode-backend active_permute --seq-lens 2048 --decode-len 32 --repeats 1 --chunk-size 4096 --kv-step 4096 --cooldown-sec 0 --window 64 --landmark-stride 64 --num-cycles 1 --head-chunk-size 2 --query-chunk-size 384 --seed 42 --skip-multi-turn --skip-quality --hf-home /Volumes/VIXinSSD/hf_cache --hf-hub-cache /Volumes/VIXinSSD/hf_cache/hub --hf-offline --out-dir benchmarks/mlx/qwen3_moe_wayfinder/EXP-20260220T000000Z-QWEN30B-GLM-PARITY/wayfinder_active_t2048_s42 && HF_HOME=/Volumes/VIXinSSD/hf_cache HF_HUB_CACHE=/Volumes/VIXinSSD/hf_cache/hub HF_HUB_OFFLINE=1 python3 scripts/bench_qwen_consumer_mlx.py --model-path mlx-community/Qwen3-30B-A3B-4bit --mode wayfinder --debug-wayfinder-decode-backend dense --seq-lens 2048 --decode-len 32 --repeats 1 --chunk-size 4096 --kv-step 4096 --cooldown-sec 0 --window 64 --landmark-stride 64 --num-cycles 1 --head-chunk-size 2 --query-chunk-size 384 --seed 42 --skip-multi-turn --skip-quality --hf-home /Volumes/VIXinSSD/hf_cache --hf-hub-cache /Volumes/VIXinSSD/hf_cache/hub --hf-offline --out-dir benchmarks/mlx/qwen3_moe_wayfinder/EXP-20260220T000000Z-QWEN30B-GLM-PARITY/wayfinder_dense_decode_t2048_s42","controls":{"baseline_run_path":"benchmarks/mlx/qwen3_moe_wayfinder/EXP-20260220T000000Z-QWEN30B-GLM-PARITY/dense_t2048_s42/results.json","one_process_at_a_time":true,"retro_backfill_inference":"off","seed":42,"seq_len":2048,"decode_len":32,"repeats":1,"window":64,"landmark_stride":64,"num_cycles":1,"chunk_size":4096,"kv_step":4096,"hf_home":"/Volumes/VIXinSSD/hf_cache","hf_hub_cache":"/Volumes/VIXinSSD/hf_cache/hub","hf_hub_offline":1,"stop_gates":["nonzero exit","missing results.json","missing single_turn[0]","hf_cache mismatch"]},"metrics":{"status":"pending","artifacts_expected":["benchmarks/mlx/qwen3_moe_wayfinder/EXP-20260220T000000Z-QWEN30B-GLM-PARITY/dense_t2048_s42/results.json","benchmarks/mlx/qwen3_moe_wayfinder/EXP-20260220T000000Z-QWEN30B-GLM-PARITY/wayfinder_active_t2048_s42/results.json","benchmarks/mlx/qwen3_moe_wayfinder/EXP-20260220T000000Z-QWEN30B-GLM-PARITY/wayfinder_dense_decode_t2048_s42/results.json"],"required":["single_turn[0].prefill_sec","single_turn[0].decode_sec","single_turn[0].e2e_sec","single_turn[0].decode_tok_s","single_turn[0].peak_memory_bytes","single_turn[0].dense_fallback_share_run","single_turn[0].observability_fallback_share_known","hf_cache.hf_home"]},"decision":"pending","next_action":"Run test+benchmark queue and append RESULT entry with dense-vs-wayfinder deltas and decode-backend tie-break decision."}
{"id":"EXP-20260220T010000Z-QWEN30B-GLM-PARITY-T8192-PRERUN","date":"2026-02-20","question":"At seq_len=8192, does Qwen3-30B Wayfinder with dense decode backend improve e2e vs dense while staying cache/offline constrained?","hypothesis":"Dense decode backend should remove decode regression and produce net e2e gain with small memory reduction at T=8192.","change_set":["measurement-only using patched qwen integration + benchmark CLI"],"command":"HF_HOME=/Volumes/VIXinSSD/hf_cache HF_HUB_CACHE=/Volumes/VIXinSSD/hf_cache/hub HF_HUB_OFFLINE=1 python3 scripts/bench_qwen_consumer_mlx.py --model-path mlx-community/Qwen3-30B-A3B-4bit --mode dense --seq-lens 8192 --decode-len 32 --repeats 1 --chunk-size 4096 --kv-step 4096 --cooldown-sec 0 --seed 42 --skip-multi-turn --skip-quality --hf-home /Volumes/VIXinSSD/hf_cache --hf-hub-cache /Volumes/VIXinSSD/hf_cache/hub --hf-offline --out-dir benchmarks/mlx/qwen3_moe_wayfinder/EXP-20260220T010000Z-QWEN30B-GLM-PARITY-T8192/dense_t8192_s42 && HF_HOME=/Volumes/VIXinSSD/hf_cache HF_HUB_CACHE=/Volumes/VIXinSSD/hf_cache/hub HF_HUB_OFFLINE=1 python3 scripts/bench_qwen_consumer_mlx.py --model-path mlx-community/Qwen3-30B-A3B-4bit --mode wayfinder --debug-wayfinder-decode-backend dense --seq-lens 8192 --decode-len 32 --repeats 1 --chunk-size 4096 --kv-step 4096 --cooldown-sec 0 --window 64 --landmark-stride 64 --num-cycles 1 --head-chunk-size 2 --query-chunk-size 384 --seed 42 --skip-multi-turn --skip-quality --hf-home /Volumes/VIXinSSD/hf_cache --hf-hub-cache /Volumes/VIXinSSD/hf_cache/hub --hf-offline --out-dir benchmarks/mlx/qwen3_moe_wayfinder/EXP-20260220T010000Z-QWEN30B-GLM-PARITY-T8192/wayfinder_dense_decode_t8192_s42","controls":{"baseline_run_path":"benchmarks/mlx/qwen3_moe_wayfinder/EXP-20260220T010000Z-QWEN30B-GLM-PARITY-T8192/dense_t8192_s42/results.json","one_process_at_a_time":true,"retro_backfill_inference":"off","seed":42,"seq_len":8192,"decode_len":32,"repeats":1,"chunk_size":4096,"kv_step":4096,"hf_home":"/Volumes/VIXinSSD/hf_cache","hf_hub_cache":"/Volumes/VIXinSSD/hf_cache/hub","hf_hub_offline":1,"stop_gates":["nonzero exit","missing results.json","missing single_turn[0]","hf_cache mismatch"]},"metrics":{"status":"pending","artifacts_expected":["benchmarks/mlx/qwen3_moe_wayfinder/EXP-20260220T010000Z-QWEN30B-GLM-PARITY-T8192/dense_t8192_s42/results.json","benchmarks/mlx/qwen3_moe_wayfinder/EXP-20260220T010000Z-QWEN30B-GLM-PARITY-T8192/wayfinder_dense_decode_t8192_s42/results.json"],"required":["single_turn[0].prefill_sec","single_turn[0].decode_sec","single_turn[0].e2e_sec","single_turn[0].decode_tok_s","single_turn[0].peak_memory_bytes","single_turn[0].dense_fallback_share_run","single_turn[0].observability_fallback_share_known","hf_cache.hf_home"]},"decision":"pending","next_action":"Run paired T8192 dense vs wayfinder(dense decode) and append RESULT deltas."}
