{"id":"EXP-20260208-GLM-ACTIVE-HEAD-CHUNK-VECTORIZATION-32K-RESULT","date":"2026-02-08","question":"Does active-path head-chunk vectorization improve 32k mixed-threshold latency?","hypothesis":"Vectorizing across heads should reduce Python overhead and improve 32k threshold=16384 runtime.","change_set":["hcsa/mlx/attention.py: vectorized active-path head chunk loop","hcsa/mlx/attention.py: reverted vectorized loop after regression"],"command":"PYTHONPATH=. python3 scripts/bench_glm_chunked_prefill_mlx.py --model-path mlx-community/GLM-4.7-Flash-4bit --seq-lens 32768 --chunk-sizes 4096 --decode-lens 0 --cache-modes normal --path permute --window 64 --landmark-stride 0 --active-dense-threshold 16384 --kv-step 4096 --baseline-path benchmarks/mlx/glm_4_7_flash_4bit_wayfinder/20260207_201347_fullmodel_prefill_kv_checkpoint/results.json --out-dir benchmarks/mlx/glm_4_7_flash_4bit_wayfinder/20260208_glm_hybrid_thresh16384_vec_heads_32k","controls":{"model":"mlx-community/GLM-4.7-Flash-4bit","seq_len":32768,"chunk_size":4096,"active_dense_threshold":16384,"reference":"benchmarks/mlx/glm_4_7_flash_4bit_wayfinder/20260208_glm_hybrid_thresh16384_matmul_32k_v3/results.json"},"metrics":{"new":{"path":"benchmarks/mlx/glm_4_7_flash_4bit_wayfinder/20260208_glm_hybrid_thresh16384_vec_heads_32k/results.json","prefill_sec":943.0460784999887,"prefill_tok_s":34.74697657628868,"peak_memory_bytes":23531751416},"reference":{"path":"benchmarks/mlx/glm_4_7_flash_4bit_wayfinder/20260208_glm_hybrid_thresh16384_matmul_32k_v3/results.json","prefill_sec":197.31811170799483,"prefill_tok_s":166.06686388978008,"peak_memory_bytes":22446619216},"delta":{"prefill_sec":745.7279667919938,"prefill_tok_s":-131.3198873134914,"peak_memory_bytes":1085132200}},"decision":"revert","next_action":"pursue lower-risk optimizations (query-chunk tuning and selective fused path experiments) before next 65k run"}
{"id":"EXP-20260208-GLM-QUERY-CHUNK-SWEEP-32K","date":"2026-02-08","question":"Can tuning query_chunk_size improve 32k mixed-threshold runtime without semantic kernel changes?","hypothesis":"Larger query chunk sizes (256/384) can reduce dispatch overhead and improve prefill latency at similar memory usage.","change_set":["scripts/bench_glm_chunked_prefill_mlx.py: add --query-chunk-size and wire to GLMWayfinderConfig"],"command":"for q in 256 384; do PYTHONPATH=. python3 scripts/bench_glm_chunked_prefill_mlx.py --model-path mlx-community/GLM-4.7-Flash-4bit --seq-lens 32768 --chunk-sizes 4096 --decode-lens 0 --cache-modes normal --path permute --window 64 --landmark-stride 0 --active-dense-threshold 16384 --query-chunk-size $q --kv-step 4096 --baseline-path benchmarks/mlx/glm_4_7_flash_4bit_wayfinder/20260207_201347_fullmodel_prefill_kv_checkpoint/results.json --out-dir benchmarks/mlx/glm_4_7_flash_4bit_wayfinder/20260208_glm_hybrid_thresh16384_qchunk${q}_32k; done","controls":{"model":"mlx-community/GLM-4.7-Flash-4bit","seq_len":32768,"chunk_size":4096,"active_dense_threshold":16384,"retro_backfill_enabled":false,"window":64,"reference":"benchmarks/mlx/glm_4_7_flash_4bit_wayfinder/20260208_glm_hybrid_thresh16384_matmul_32k_v3/results.json"},"metrics":{"status":"pending"},"decision":"pending","next_action":"run sweep and compare absolute/delta/% against 32k threshold=16384 reference"}
{"id":"EXP-20260208-GLM-QUERY-CHUNK-SWEEP-32K-Q512","date":"2026-02-08","question":"Does query_chunk_size=512 improve 32k threshold=16384 runtime beyond q=384?","hypothesis":"q=512 may reduce dispatch overhead further but risks extra memory/compute pressure.","change_set":["measurement only (using --query-chunk-size)"],"command":"PYTHONPATH=. python3 scripts/bench_glm_chunked_prefill_mlx.py --model-path mlx-community/GLM-4.7-Flash-4bit --seq-lens 32768 --chunk-sizes 4096 --decode-lens 0 --cache-modes normal --path permute --window 64 --landmark-stride 0 --active-dense-threshold 16384 --query-chunk-size 512 --kv-step 4096 --baseline-path benchmarks/mlx/glm_4_7_flash_4bit_wayfinder/20260207_201347_fullmodel_prefill_kv_checkpoint/results.json --out-dir benchmarks/mlx/glm_4_7_flash_4bit_wayfinder/20260208_glm_hybrid_thresh16384_qchunk512_32k","controls":{"model":"mlx-community/GLM-4.7-Flash-4bit","seq_len":32768,"chunk_size":4096,"active_dense_threshold":16384,"window":64,"retro_backfill_enabled":false},"metrics":{"status":"pending"},"decision":"pending","next_action":"compare vs q=384 and reference 32k run"}
{"id":"EXP-20260208-GLM-HEAD-CHUNK-TUNING-32K","date":"2026-02-08","question":"Can increasing permute_head_chunk_size from 2 to 4 reduce active-path overhead at 32k threshold=16384?","hypothesis":"Larger head chunks reduce sync/dispatch overhead and improve runtime at similar memory.","change_set":["scripts/bench_glm_chunked_prefill_mlx.py: add --head-chunk-size and wire to GLMWayfinderConfig"],"command":"PYTHONPATH=. python3 scripts/bench_glm_chunked_prefill_mlx.py --model-path mlx-community/GLM-4.7-Flash-4bit --seq-lens 32768 --chunk-sizes 4096 --decode-lens 0 --cache-modes normal --path permute --window 64 --landmark-stride 0 --active-dense-threshold 16384 --query-chunk-size 384 --head-chunk-size 4 --kv-step 4096 --baseline-path benchmarks/mlx/glm_4_7_flash_4bit_wayfinder/20260207_201347_fullmodel_prefill_kv_checkpoint/results.json --out-dir benchmarks/mlx/glm_4_7_flash_4bit_wayfinder/20260208_glm_hybrid_thresh16384_q384_h4_32k","controls":{"model":"mlx-community/GLM-4.7-Flash-4bit","seq_len":32768,"chunk_size":4096,"active_dense_threshold":16384,"query_chunk_size":384,"head_chunk_reference":2},"metrics":{"status":"pending"},"decision":"pending","next_action":"compare against q=384,h=2 baseline"}
{"id":"EXP-20260208-GLM-QUERY-CHUNK-SWEEP-32K-RESULT","date":"2026-02-08","question":"Can query_chunk_size tuning improve 32k threshold=16384 runtime without memory regression?","hypothesis":"Increasing query chunk size from 192 toward 384/512 reduces overhead and improves runtime.","change_set":["scripts/bench_glm_chunked_prefill_mlx.py: add --query-chunk-size"],"command":"Run q in {256,384,512} at seq_len=32768 chunk=4096 threshold=16384","controls":{"model":"mlx-community/GLM-4.7-Flash-4bit","seq_len":32768,"chunk_size":4096,"active_dense_threshold":16384,"head_chunk_size":2,"reference":"benchmarks/mlx/glm_4_7_flash_4bit_wayfinder/20260208_glm_hybrid_thresh16384_matmul_32k_v3/results.json"},"metrics":{"reference":{"prefill_sec":197.31811170799483,"prefill_tok_s":166.06686388978008,"peak_memory_bytes":22446619216},"q256":{"path":"benchmarks/mlx/glm_4_7_flash_4bit_wayfinder/20260208_glm_hybrid_thresh16384_qchunk256_32k/results.json","prefill_sec":195.3446438749961,"prefill_tok_s":167.74455316506513,"peak_memory_bytes":22446619216,"delta_sec_vs_ref":-1.9734678329987219,"delta_tok_s_vs_ref":1.6776892752850472},"q384":{"path":"benchmarks/mlx/glm_4_7_flash_4bit_wayfinder/20260208_glm_hybrid_thresh16384_qchunk384_32k/results.json","prefill_sec":193.8482291669934,"prefill_tok_s":169.0394601013947,"peak_memory_bytes":22446619216,"delta_sec_vs_ref":-3.469882541001425,"delta_tok_s_vs_ref":2.972596211614615},"q512":{"path":"benchmarks/mlx/glm_4_7_flash_4bit_wayfinder/20260208_glm_hybrid_thresh16384_qchunk512_32k/results.json","prefill_sec":193.90624954100326,"prefill_tok_s":168.98891240615772,"peak_memory_bytes":22446619216,"delta_sec_vs_ref":-3.4118621669915685,"delta_tok_s_vs_ref":2.9220485163776377}},"decision":"keep_q384","next_action":"run 65k validation with q=384 and best-latency threshold"}
{"id":"EXP-20260208-GLM-HEAD-CHUNK-TUNING-32K-RESULT","date":"2026-02-08","question":"Does head_chunk_size=4 improve 32k runtime over head_chunk_size=2 when q=384?","hypothesis":"Higher head chunk might reduce synchronization overhead and improve runtime.","change_set":["scripts/bench_glm_chunked_prefill_mlx.py: add --head-chunk-size"],"command":"PYTHONPATH=. python3 scripts/bench_glm_chunked_prefill_mlx.py --model-path mlx-community/GLM-4.7-Flash-4bit --seq-lens 32768 --chunk-sizes 4096 --decode-lens 0 --cache-modes normal --path permute --window 64 --landmark-stride 0 --active-dense-threshold 16384 --query-chunk-size 384 --head-chunk-size 4 --kv-step 4096 --baseline-path benchmarks/mlx/glm_4_7_flash_4bit_wayfinder/20260207_201347_fullmodel_prefill_kv_checkpoint/results.json --out-dir benchmarks/mlx/glm_4_7_flash_4bit_wayfinder/20260208_glm_hybrid_thresh16384_q384_h4_32k","controls":{"model":"mlx-community/GLM-4.7-Flash-4bit","seq_len":32768,"chunk_size":4096,"active_dense_threshold":16384,"query_chunk_size":384,"reference_h2":"benchmarks/mlx/glm_4_7_flash_4bit_wayfinder/20260208_glm_hybrid_thresh16384_qchunk384_32k/results.json"},"metrics":{"h4":{"path":"benchmarks/mlx/glm_4_7_flash_4bit_wayfinder/20260208_glm_hybrid_thresh16384_q384_h4_32k/results.json","prefill_sec":193.97713020799053,"prefill_tok_s":168.92775056901666,"peak_memory_bytes":22446619216},"h2":{"prefill_sec":193.8482291669934,"prefill_tok_s":169.0394601013947,"peak_memory_bytes":22446619216},"delta_h4_minus_h2":{"prefill_sec":0.12890104099712987,"prefill_tok_s":-0.11170953237803589,"peak_memory_bytes":0}},"decision":"keep_h2","next_action":"carry forward q=384,h=2 for 65k validation"}
{"id":"EXP-20260208-GLM-65K-TUNED-Q384-TH49152","date":"2026-02-08","question":"Does q=384,h=2 tuning improve 65k runtime at threshold=49152?","hypothesis":"The 32k query-chunk gain will carry over partially and reduce total 65k prefill runtime.","change_set":["measurement only with tuned benchmark knobs"],"command":"PYTHONPATH=. python3 scripts/bench_glm_chunked_prefill_mlx.py --model-path mlx-community/GLM-4.7-Flash-4bit --seq-lens 65536 --chunk-sizes 4096 --decode-lens 0 --cache-modes normal --path permute --window 64 --landmark-stride 0 --active-dense-threshold 49152 --query-chunk-size 384 --head-chunk-size 2 --kv-step 4096 --baseline-path benchmarks/mlx/glm_4_7_flash_4bit_wayfinder/20260207_201347_fullmodel_prefill_kv_checkpoint/results.json --out-dir benchmarks/mlx/glm_4_7_flash_4bit_wayfinder/20260208_glm_hybrid_thresh49152_q384_h2_65k","controls":{"model":"mlx-community/GLM-4.7-Flash-4bit","seq_len":65536,"chunk_size":4096,"active_dense_threshold":49152,"query_chunk_size":384,"head_chunk_size":2,"reference":"benchmarks/mlx/glm_4_7_flash_4bit_wayfinder/20260208_glm_hybrid_thresh49152_matmul_65k/results.json"},"metrics":{"status":"pending"},"decision":"pending","next_action":"compare against prior threshold=49152 result and 65k chunked-dense control median"}
{"id":"EXP-20260208-GLM-65K-TUNED-Q384-TH49152-REPEAT","date":"2026-02-08","question":"Is the 65k tuned gain reproducible?","hypothesis":"Repeat should remain in the same performance regime and beat chunked dense controls.","change_set":["measurement only"],"command":"PYTHONPATH=. python3 scripts/bench_glm_chunked_prefill_mlx.py --model-path mlx-community/GLM-4.7-Flash-4bit --seq-lens 65536 --chunk-sizes 4096 --decode-lens 0 --cache-modes normal --path permute --window 64 --landmark-stride 0 --active-dense-threshold 49152 --query-chunk-size 384 --head-chunk-size 2 --kv-step 4096 --baseline-path benchmarks/mlx/glm_4_7_flash_4bit_wayfinder/20260207_201347_fullmodel_prefill_kv_checkpoint/results.json --out-dir benchmarks/mlx/glm_4_7_flash_4bit_wayfinder/20260208_glm_hybrid_thresh49152_q384_h2_65k_repeat","controls":{"same_as":"EXP-20260208-GLM-65K-TUNED-Q384-TH49152"},"metrics":{"status":"pending"},"decision":"pending","next_action":"compare run pair against chunked dense controls and prior th49152 result"}
{"id":"EXP-20260208-GLM-65K-TUNED-Q384-TH49152-RESULT","date":"2026-02-08","question":"Does q=384,h=2 tuning improve 65k runtime at threshold=49152?","hypothesis":"The 32k query-chunk gain carries over and materially improves 65k runtime.","change_set":["measurement only with tuned runtime knobs"],"command":"PYTHONPATH=. python3 scripts/bench_glm_chunked_prefill_mlx.py --model-path mlx-community/GLM-4.7-Flash-4bit --seq-lens 65536 --chunk-sizes 4096 --decode-lens 0 --cache-modes normal --path permute --window 64 --landmark-stride 0 --active-dense-threshold 49152 --query-chunk-size 384 --head-chunk-size 2 --kv-step 4096 --baseline-path benchmarks/mlx/glm_4_7_flash_4bit_wayfinder/20260207_201347_fullmodel_prefill_kv_checkpoint/results.json --out-dir benchmarks/mlx/glm_4_7_flash_4bit_wayfinder/20260208_glm_hybrid_thresh49152_q384_h2_65k","controls":{"model":"mlx-community/GLM-4.7-Flash-4bit","seq_len":65536,"chunk_size":4096,"active_dense_threshold":49152,"query_chunk_size":384,"head_chunk_size":2,"reference_th49152":"benchmarks/mlx/glm_4_7_flash_4bit_wayfinder/20260208_glm_hybrid_thresh49152_matmul_65k/results.json","dense_controls":["benchmarks/mlx/glm_4_7_flash_4bit_wayfinder/20260208_glm_chunked_dense_control_65k_matched/results.json","benchmarks/mlx/glm_4_7_flash_4bit_wayfinder/20260208_glm_chunked_dense_control_65k_matched_repeat/results.json"]},"metrics":{"path":"benchmarks/mlx/glm_4_7_flash_4bit_wayfinder/20260208_glm_hybrid_thresh49152_q384_h2_65k/results.json","prefill_sec":483.5005433750048,"prefill_tok_s":135.5448321578618,"peak_memory_bytes":29589653008,"delta_sec_vs_prev_th49152":-407.1993695830024,"delta_tok_s_vs_prev_th49152":61.96674031505981,"delta_sec_vs_dense_control_a":-301.60235524999734,"delta_tok_s_vs_dense_control_a":52.07042375257234,"delta_sec_vs_dense_control_b":-143.2979958329961,"delta_tok_s_vs_dense_control_b":30.98811113740628},"decision":"keep","next_action":"run repeat for variance confirmation"}
{"id":"EXP-20260208-GLM-65K-TUNED-Q384-TH49152-REPEAT-RESULT","date":"2026-02-08","question":"Is the tuned 65k gain reproducible?","hypothesis":"Repeat remains in the same performance regime and beats chunked dense controls.","change_set":["measurement only"],"command":"PYTHONPATH=. python3 scripts/bench_glm_chunked_prefill_mlx.py --model-path mlx-community/GLM-4.7-Flash-4bit --seq-lens 65536 --chunk-sizes 4096 --decode-lens 0 --cache-modes normal --path permute --window 64 --landmark-stride 0 --active-dense-threshold 49152 --query-chunk-size 384 --head-chunk-size 2 --kv-step 4096 --baseline-path benchmarks/mlx/glm_4_7_flash_4bit_wayfinder/20260207_201347_fullmodel_prefill_kv_checkpoint/results.json --out-dir benchmarks/mlx/glm_4_7_flash_4bit_wayfinder/20260208_glm_hybrid_thresh49152_q384_h2_65k_repeat","controls":{"same_as":"EXP-20260208-GLM-65K-TUNED-Q384-TH49152","dense_control_pair":[705.9507189165015,94.0155647128725]},"metrics":{"run_a":{"prefill_sec":483.5005433750048,"prefill_tok_s":135.5448321578618,"peak_memory_bytes":29589653008},"run_b":{"prefill_sec":485.4538682910061,"prefill_tok_s":134.99943924787996,"peak_memory_bytes":29589653008},"median_prefill_sec":484.4772058330054,"median_prefill_tok_s":135.27213570287088,"median_peak_memory_bytes":29589653008,"std_prefill_sec":0.9766624580006464,"std_prefill_tok_s":0.2726964549909212,"delta_sec_vs_prev_th49152":-406.22270712500176,"delta_tok_s_vs_prev_th49152":61.69404386006889,"delta_sec_vs_dense_control_median":-221.47351308349607,"delta_tok_s_vs_dense_control_median":41.25657098999838,"peak_memory_reduction_pct_vs_dense_control_median":10.77000075936555},"decision":"promote_tuned_config","next_action":"use q=384,h=2,th=49152 as current long-context default and re-check threshold around this tuned baseline"}
{"id":"EXP-20260208-GLM-65K-THRESHOLD-RETUNE-Q384H2","date":"2026-02-08","question":"Do thresholds 45056 or 53248 outperform 49152 under tuned q=384,h=2 settings at 65k?","hypothesis":"A nearby threshold can further improve latency while preserving memory advantage over chunked dense controls.","change_set":["measurement only"],"command":"for t in 45056 53248; do PYTHONPATH=. python3 scripts/bench_glm_chunked_prefill_mlx.py --model-path mlx-community/GLM-4.7-Flash-4bit --seq-lens 65536 --chunk-sizes 4096 --decode-lens 0 --cache-modes normal --path permute --window 64 --landmark-stride 0 --active-dense-threshold $t --query-chunk-size 384 --head-chunk-size 2 --kv-step 4096 --baseline-path benchmarks/mlx/glm_4_7_flash_4bit_wayfinder/20260207_201347_fullmodel_prefill_kv_checkpoint/results.json --out-dir benchmarks/mlx/glm_4_7_flash_4bit_wayfinder/20260208_glm_hybrid_thresh${t}_q384_h2_65k; done","controls":{"model":"mlx-community/GLM-4.7-Flash-4bit","seq_len":65536,"chunk_size":4096,"query_chunk_size":384,"head_chunk_size":2,"reference":"benchmarks/mlx/glm_4_7_flash_4bit_wayfinder/20260208_glm_hybrid_thresh49152_q384_h2_65k/results.json"},"metrics":{"status":"pending"},"decision":"pending","next_action":"select best threshold around tuned baseline and promote"}
{"id":"EXP-20260208-GLM-65K-BEST-TH45056-REPEAT","date":"2026-02-08","question":"Is the best tuned threshold=45056 result reproducible?","hypothesis":"Repeat remains close to 464.7s and preserves lead over 49152 tuned median.","change_set":["measurement only"],"command":"PYTHONPATH=. python3 scripts/bench_glm_chunked_prefill_mlx.py --model-path mlx-community/GLM-4.7-Flash-4bit --seq-lens 65536 --chunk-sizes 4096 --decode-lens 0 --cache-modes normal --path permute --window 64 --landmark-stride 0 --active-dense-threshold 45056 --query-chunk-size 384 --head-chunk-size 2 --kv-step 4096 --baseline-path benchmarks/mlx/glm_4_7_flash_4bit_wayfinder/20260207_201347_fullmodel_prefill_kv_checkpoint/results.json --out-dir benchmarks/mlx/glm_4_7_flash_4bit_wayfinder/20260208_glm_hybrid_thresh45056_q384_h2_65k_repeat","controls":{"same_as":"EXP-20260208-GLM-65K-THRESHOLD-RETUNE-Q384H2 threshold=45056"},"metrics":{"status":"pending"},"decision":"pending","next_action":"promote threshold default if confirmed"}
{"id":"EXP-20260208-GLM-65K-THRESHOLD-RETUNE-Q384H2-RESULT","date":"2026-02-08","question":"Around tuned q=384,h=2, do thresholds 45056 or 53248 outperform 49152?","hypothesis":"One nearby threshold may outperform 49152 while preserving memory edge.","change_set":["measurement only"],"command":"Run thresholds {45056,53248} at seq_len=65536 chunk=4096 with q=384 h=2","controls":{"model":"mlx-community/GLM-4.7-Flash-4bit","seq_len":65536,"chunk_size":4096,"query_chunk_size":384,"head_chunk_size":2,"reference":"benchmarks/mlx/glm_4_7_flash_4bit_wayfinder/20260208_glm_hybrid_thresh49152_q384_h2_65k/results.json"},"metrics":{"threshold_45056":{"path":"benchmarks/mlx/glm_4_7_flash_4bit_wayfinder/20260208_glm_hybrid_thresh45056_q384_h2_65k/results.json","prefill_sec":464.7230203749932,"prefill_tok_s":141.02163466556453,"peak_memory_bytes":28696790168,"delta_sec_vs_ref49152":-18.77752300001157,"delta_tok_s_vs_ref49152":5.476802507702729,"delta_peak_bytes_vs_ref49152":-892862840,"permute_chunks":5,"dense_chunks":11},"threshold_53248":{"path":"benchmarks/mlx/glm_4_7_flash_4bit_wayfinder/20260208_glm_hybrid_thresh53248_q384_h2_65k/results.json","prefill_sec":638.0962187910045,"prefill_tok_s":102.70551379252882,"peak_memory_bytes":30482515848,"delta_sec_vs_ref49152":154.595675416,"delta_tok_s_vs_ref49152":-32.83931836533299,"delta_peak_bytes_vs_ref49152":892862840,"permute_chunks":3,"dense_chunks":13}},"decision":"needs_repeat_for_45056","next_action":"run 45056 repeat before promoting default"}
{"id":"EXP-20260208-GLM-65K-BEST-TH45056-REPEAT-RESULT","date":"2026-02-08","question":"Is threshold=45056 reproducible enough to replace 49152 as tuned default?","hypothesis":"Repeat should remain near the first 45056 run if truly better.","change_set":["measurement only"],"command":"PYTHONPATH=. python3 scripts/bench_glm_chunked_prefill_mlx.py --model-path mlx-community/GLM-4.7-Flash-4bit --seq-lens 65536 --chunk-sizes 4096 --decode-lens 0 --cache-modes normal --path permute --window 64 --landmark-stride 0 --active-dense-threshold 45056 --query-chunk-size 384 --head-chunk-size 2 --kv-step 4096 --baseline-path benchmarks/mlx/glm_4_7_flash_4bit_wayfinder/20260207_201347_fullmodel_prefill_kv_checkpoint/results.json --out-dir benchmarks/mlx/glm_4_7_flash_4bit_wayfinder/20260208_glm_hybrid_thresh45056_q384_h2_65k_repeat","controls":{"pair_with":"benchmarks/mlx/glm_4_7_flash_4bit_wayfinder/20260208_glm_hybrid_thresh45056_q384_h2_65k/results.json","compare_stable_ref":"threshold=49152 tuned pair"},"metrics":{"run_a":{"prefill_sec":464.7230203749932,"prefill_tok_s":141.02163466556453,"peak_memory_bytes":28696790168},"run_b":{"prefill_sec":658.550191250004,"prefill_tok_s":99.51557355955687,"peak_memory_bytes":28696790168},"median_prefill_sec":561.6366058124986,"median_prefill_tok_s":120.2686041125607,"median_peak_memory_bytes":28696790168,"std_prefill_sec":96.91358543750539,"std_prefill_tok_s":20.753030553003846,"stable_ref_49152_median_sec":484.4772058330054,"stable_ref_49152_median_tok_s":135.27213570287088},"decision":"keep_49152_as_default","next_action":"promote reproducible tuned default (th=49152,q=384,h=2) in README and roadmap"}
